,userid,corp_creators,lastmod,pagerange,datestamp,documents,publisher,ispublished,number,refereed,full_text_status,uri,type,divisions,issn,creators,publication,dir,date,eprint_status,status_changed,abstract,subjects,title,metadata_visibility,volume,rev_number,eprintid,date_type
0,803,['fakultas ekonomi dan bisnis unila'],2016-09-28 05:14:32,32-48,2016-09-28 05:14:32,"[{'placement': 1, 'security': 'public', 'eprintid': 675, 'mime_type': 'application/pdf', 'language': 'en', 'files': [{'objectid': 571, 'uri': 'http://repository.lppm.unila.ac.id/id/file/3750', 'datasetid': 'document', 'filesize': 23111089, 'mime_type': 'application/pdf', 'fileid': 3750, 'filename': 'Jurnal EKONOMI PEMBANGUNAN.pdf', 'hash': 'a967a67c7367125f5b98328330ca4552', 'mtime': '2016-09-28 04:14:04', 'hash_type': 'MD5'}], 'docid': 571, 'main': 'Jurnal EKONOMI PEMBANGUNAN.pdf', 'uri': 'http://repository.lppm.unila.ac.id/id/document/571', 'rev_number': 1, 'pos': 1, 'format': 'text'}]",Balai Penelitian Dan Pengembangan Ekonomi Fakultas Ekonomi Universitas Muhammadiyah Surakarta,pub,1,TRUE,public,http://repository.lppm.unila.ac.id/id/eprint/675,article,"['FEB5', 'FEB2']",1411-6081,"[{'id': 'wayansuparta61@gmail.com', 'name': {'honourific': None, 'family': 'suparta', 'lineage': None, 'given': 'i wayan'}}]",jurnal ekonomi pembangunan,disk0/00/00/06/75,2009,archive,2016-09-28 05:14:32,"This study was based on 23-year period time series datafrom l.983 to 2005. An OLS
method was applied to test the lrypothesis that economic yqriables such qs private
irwestments, local government spending, prices of domestic goods, prices of goods
and income of the adjacent regions (Jakana and South Sumqterq Province) hove
effects on the economic growth of Lampung Province. The results of this study show
that the jndependent economic variables have sigiificant efects on the economic
growth of Lompung Province. It is found thot the interregional linkage is important.
A comparison of the two neighbor provinces shows that the linkoge of Lampung's
economy with Jaksrta's economy is relatively itronger thon that with Sofih
Sumatera Province. The implication of this study is that the provincial and local governments
of Lampung as well as the people of Lampung shouldmake better use of tlrc
spatial spillover efect of DKI Jakorta and South Sumatera Proyince.
Kqtwords: spatial spillover efect, pertumbuhan elconomi, reduceform, OLS",['AC'],"SPILOVER EFFECT PEREKONOMIAN PROVINSI DKI JAKARTA
DAI\ SUMATERA SELATAN TERHADAP PERTUMBUHAN
EKONOMI PROVINSI LAMPUNG",show,10,6,675,published
