,date_type,eprintid,metadata_visibility,rev_number,volume,title,abstract,subjects,eprint_status,status_changed,dir,date,issn,creators,publication,divisions,type,refereed,full_text_status,uri,documents,publisher,number,ispublished,pagerange,datestamp,corp_creators,userid,lastmod
0,published,10711,show,6,V,The Effects of Customer’s Psychological Factors on the Decision for Joining Syariah Folk Credit Banking,"The development of banking has stimulated the growth of various types of financial institutions. One of them is folk credit banking or Bank Perkreditan Rakyat (BPR). Its main concept is the sharing of profits between customers and bank. This system does not involve interest value or is known as a non-interest banking (BTB). Syariah folk credit banking (BPRS) is one type of BTB. The objective of this research is to explain the influence of some psychological factors which affect customer’s decision on joining the Syariah Folk Credit Banking. The research type is explanatory research in which relation among variables are explained to verify the hypothesis. The research was conducted at Sakai Sambayan’s Syariah Folk Credit Banking in Natar, South Lampung. The results show that significant and positive relation between motivation variable and making of decision to become a member is 9,3%, while between perception and making of decision to be a member is 23,5%. Both variables (motivation and perceptive) have an influence of 37,8%. Rest of percentage (62,2%) is influenced by other factors which are unknown in this research.

Keywords: Non-Interest Banking, credit, syariah, psychological factor, consumer, motivation and perception.",['HB'],archive,2019-02-08 02:05:13,disk0/00/01/07/11,2004-07-01 00:00:00.000000000,1345-8981,"[{'name': {'given': 'Ahmad', 'honourific': None, 'family': ""Rifa'i"", 'lineage': None}, 'id': 'rifaiunila@gmail.com'}, {'name': {'honourific': None, 'family': 'Khristianto', 'lineage': None, 'given': 'Wheny'}, 'id': 'wheny.khristianto@gmail.com'}]",ISTECS JOURNAL,['FISIP1'],article,TRUE,public,http://repository.lppm.unila.ac.id/id/eprint/10711,"[{'security': 'public', 'placement': 1, 'eprintid': 10711, 'mime_type': 'application/pdf', 'language': 'en', 'files': [{'filename': 'The Effects of Customer’s Psychological Factors on the Decision for Joining Syariah Folk Credit Banking.pdf', 'hash': '59bdb72d931f7665a66935a95d721352', 'mtime': '2019-02-07 04:27:59', 'hash_type': 'MD5', 'mime_type': 'application/pdf', 'fileid': 98883, 'filesize': 191472, 'datasetid': 'document', 'uri': 'http://repository.lppm.unila.ac.id/id/file/98883', 'objectid': 23717}], 'docid': 23717, 'main': 'The Effects of Customer’s Psychological Factors on the Decision for Joining Syariah Folk Credit Banking.pdf', 'uri': 'http://repository.lppm.unila.ac.id/id/document/23717', 'rev_number': 1, 'format': 'text', 'pos': 1}]",Institute for Science and Technology Studies,1,pub,73-86,2019-02-08 02:05:13,"['Jurusan Ilmu Adm. Bisnis FISIP Universitas Lampung', 'Jurusan Ilmu Adm. Bisnis FISIP Universitas Lampung']",348,2019-02-08 02:05:13
1,published,14764,show,6,IV,Analisis Target Marketing Pada UPT Universitas Lampung Dalam Menyongsong Otonomi Kampus,"Purpose of this research is knowing the discription of market segmentation and target marketing in UPT Fasora Lampung University. The research methode was done by descriptive verivikative. Data was analized by domain analized and taksonoml analized. Reliability dan validity test with content validity and construct validity.

The result of this research show that market segmentation based on geographic segmentation, demographic segmentation and behavioral segmentation. The result target marketing is children (basic school) segmen, student segmen, and society segmen. Target ~arketing strategic is differentiated marketing

Kata kunci: Segmentasi & Target Pasar",['HB'],archive,2019-11-04 02:04:33,disk0/00/01/47/64,2004-02-01 00:00:00.000000000,1410-587X,"[{'id': 'rifaiunila@gmail.com', 'name': {'family': ""Rifa'i"", 'honourific': None, 'lineage': None, 'given': 'Ahmad'}}, {'name': {'given': 'Arif', 'lineage': None, 'honourific': None, 'family': 'Sugiono'}, 'id': 'arifsugiono01@gmail.com'}]",TATANIAGA,['FISIP1'],article,TRUE,public,http://repository.lppm.unila.ac.id/id/eprint/14764,"[{'language': 'en', 'mime_type': 'application/pdf', 'placement': 1, 'security': 'public', 'eprintid': 14764, 'rev_number': 1, 'uri': 'http://repository.lppm.unila.ac.id/id/document/27883', 'pos': 1, 'format': 'text', 'files': [{'uri': 'http://repository.lppm.unila.ac.id/id/file/127717', 'objectid': 27883, 'filesize': 3677574, 'datasetid': 'document', 'mtime': '2019-10-30 06:57:34', 'hash_type': 'MD5', 'filename': 'Analisis Target Marketing Pada UPT Universitas Lampung Dalam Menyongsong Otonomi Kampus.pdf', 'hash': '0dc0818f86e38d69bf895f4361b062c2', 'fileid': 127717, 'mime_type': 'application/pdf'}], 'main': 'Analisis Target Marketing Pada UPT Universitas Lampung Dalam Menyongsong Otonomi Kampus.pdf', 'docid': 27883}]",Politeknik Negeri Bandung,1,pub,109-120,2019-11-04 02:04:33,"['Administrasi Bisnis', 'Administrasi Bisnis']",348,2019-11-04 02:04:33
2,published,14073,show,6,1,Langkah Bidak Pemilih dalam Pemilihan Presiden RI 2004,"Skeptisme yang berkaitan dengan issue Political Marketing sudah terjawab dalam pelaksanaan Pilpres RI 2004, terutama yang berkaitan dengan perilaku pemilih.Realita menunjukkan bekerjanya konsep political marketing dalam mempengaruhi keputusan memilih. Tulisan ini membahas, kajian perilaku pemilih yang bisa diatasi dengan Political Marketing",['H1'],archive,2019-09-09 04:09:02,disk0/00/01/40/73,2004-09-01 00:00:00.000000000,1693-9034,"[{'name': {'given': 'Arif', 'family': 'Sugiono', 'honourific': None, 'lineage': None}, 'id': 'arifsugiono01@gmail.com'}]",Jurnal Inovasi,['FISIP1'],article,TRUE,public,http://repository.lppm.unila.ac.id/id/eprint/14073,"[{'mime_type': 'application/pdf', 'language': 'en', 'eprintid': 14073, 'placement': 1, 'security': 'public', 'pos': 1, 'format': 'text', 'rev_number': 1, 'uri': 'http://repository.lppm.unila.ac.id/id/document/27106', 'main': 'Langkah Bidak Pemilih_Sugiono, Arif.pdf', 'docid': 27106, 'files': [{'uri': 'http://repository.lppm.unila.ac.id/id/file/122428', 'objectid': 27106, 'filesize': 22954051, 'datasetid': 'document', 'filename': 'Langkah Bidak Pemilih_Sugiono, Arif.pdf', 'hash': '9bde2172a611cad8c2240e67fab19b9a', 'hash_type': 'MD5', 'mtime': '2019-09-06 01:46:39', 'mime_type': 'application/pdf', 'fileid': 122428}]}]",IMPAG BANDUNG,3,pub,79-82,2019-09-09 04:09:02,,539,2019-09-09 04:09:02
3,published,14074,show,6,1,POlitical Marketing dalam Pilpres RI 2004,"Dunia Politik tidak hanya penuh dengan trik dan intrik, tapi juga seni.Hal itu disebabkan sistem Pemilu yang berbeda dengan sistem-sistem sebelumnya. Salah satu konsekwensi logis diantaranya suasana kompetisi yang berlangsung relatif sportif dan terbuka. Salah satu yang menarik dari praktek politik yang dijalankan adalah adanya fenomena Political Marketing.",['H1'],archive,2019-09-09 04:09:06,disk0/00/01/40/74,2004-06-01 00:00:00.000000000,1693-9034,"[{'name': {'lineage': None, 'family': 'Sugiono', 'honourific': None, 'given': 'Arif'}, 'id': 'arifsugiono01@gmail.com'}]",Jurnal Inovasi,['FISIP1'],article,TRUE,public,http://repository.lppm.unila.ac.id/id/eprint/14074,"[{'mime_type': 'application/pdf', 'language': 'en', 'security': 'public', 'placement': 1, 'eprintid': 14074, 'rev_number': 1, 'uri': 'http://repository.lppm.unila.ac.id/id/document/27107', 'format': 'text', 'pos': 1, 'files': [{'datasetid': 'document', 'filesize': 14912265, 'mime_type': 'application/pdf', 'fileid': 122434, 'hash': '52cf01b8f7d3a192992cc546a8f72c27', 'filename': 'PolMark dalam Pilpres RI 2004_Sugiono,Arif.pdf', 'mtime': '2019-09-06 01:53:12', 'hash_type': 'MD5', 'objectid': 27107, 'uri': 'http://repository.lppm.unila.ac.id/id/file/122434'}], 'docid': 27107, 'main': 'PolMark dalam Pilpres RI 2004_Sugiono,Arif.pdf'}]",IMPAG BANDUNG,2,pub,61-68,2019-09-09 04:09:06,['Ilmu Adm. Bisnis FISIP Unila'],539,2019-09-09 04:09:06
4,,14063,show,6,6,Mengelola Konflik dalam Organisasi,"Tulisan ini membahas konflik dari dua perspektif, yakni tradisional dan modern. Hadirnya perspektif modern dalam mengelola konflik, mengharuskan kita untuk tidak menghindari, tapi harus mampu mengelola konflik, nahkan jika perlu harus menstimuli konflik",['H1'],archive,2019-09-09 04:08:52,disk0/00/01/40/63,2004-08-01 00:00:00.000000000,1410-9263,"[{'id': 'arifsugiono01@gmail.com', 'name': {'given': 'Arif', 'lineage': None, 'family': 'Sugiono', 'honourific': None}}, {'id': None, 'name': {'given': 'Deny', 'family': 'Budiyana', 'honourific': None, 'lineage': None}}]",SOSIOHUMANITAS,['FISIP1'],article,TRUE,public,http://repository.lppm.unila.ac.id/id/eprint/14063,"[{'rev_number': 1, 'uri': 'http://repository.lppm.unila.ac.id/id/document/27097', 'format': 'text', 'pos': 1, 'files': [{'objectid': 27097, 'uri': 'http://repository.lppm.unila.ac.id/id/file/122356', 'datasetid': 'document', 'filesize': 21154471, 'fileid': 122356, 'mime_type': 'application/pdf', 'mtime': '2019-09-05 09:24:42', 'hash_type': 'MD5', 'hash': 'a0b1808bcbcb1f48eba627512c9646b2', 'filename': 'Mengelola Konflik Organisasi- Sugiono, Arif.pdf'}], 'docid': 27097, 'main': 'Mengelola Konflik Organisasi- Sugiono, Arif.pdf', 'mime_type': 'application/pdf', 'language': 'en', 'security': 'public', 'placement': 1, 'eprintid': 14063}]",Universitas Langlabuana Bandung,2,pub,86-96,2019-09-09 04:08:52,"['Ilmu Adm. Bisnis FISIP Unila', 'FE Universitas Langlangbuana Bandung']",539,2019-09-09 04:08:52
5,published,14058,show,6,5,Analisis Brand Equity Siaran Berita Stasiun TV Swasta Indonesia,"Penelitian ini ingin mengetahui keadaan merek siaran berita TV Swasta berdasarkan dimensi ekuitas merek (loyalitas, kesadaran, persepsi kualitas dan asosiasi)",['HE'],archive,2019-09-09 04:08:41,disk0/00/01/40/58,1970-01-01 00:00:00.000002004,14115883,"[{'name': {'family': 'Sugiono', 'honourific': None, 'lineage': None, 'given': 'Arif'}, 'id': 'arifsugiono01@gmail.com'}, {'id': None, 'name': {'lineage': None, 'family': 'Mulya Sari', 'honourific': None, 'given': 'Prima'}}]",Mediator,['FISIP1'],article,TRUE,public,http://repository.lppm.unila.ac.id/id/eprint/14058,"[{'format': 'text', 'pos': 1, 'rev_number': 1, 'uri': 'http://repository.lppm.unila.ac.id/id/document/27092', 'docid': 27092, 'main': 'Brand Equity Siaran BeritaTV Swasta.pdf', 'files': [{'datasetid': 'document', 'filesize': 8348057, 'mime_type': 'application/pdf', 'fileid': 122332, 'hash': 'c2c83aaa33ffceb6422e259f7cc0215b', 'filename': 'Brand Equity Siaran BeritaTV Swasta.pdf', 'mtime': '2019-09-05 08:52:43', 'hash_type': 'MD5', 'objectid': 27092, 'uri': 'http://repository.lppm.unila.ac.id/id/file/122332'}], 'language': 'en', 'mime_type': 'application/pdf', 'eprintid': 14058, 'security': 'public', 'placement': 1}]",FIKOM UNISBA BANDUNG,2,pub,281-295,2019-09-09 04:08:41,"['Ilmu Adm. Bisnis FISIP Unila', 'Ilmu Komunikaksi Univ. Bakrie']",539,2019-09-09 04:08:41
