,subjects,abstract,status_changed,eprint_status,volume,rev_number,metadata_visibility,title,official_url,eprintid,datestamp,lastmod,userid,full_text_status,uri,refereed,ispublished,number,documents,publisher,divisions,type,dir,date,id_number,publication,creators,issn,contact_email,pagerange,referencetext,corp_creators,date_type,event_dates,event_type,event_location,event_title,pres_type,related_url,pages,place_of_pub,isbn,contributors,succeeds,funders,projects
0,['QC'],"Studi ini mendeskripsikan analisis transisi fasa dan sifat dielektrik pada bahan litium kobalt silikat (Li2CoSiO4) yang dipreparasi dari silika sekam padi dan produk daur ulang katoda baterai ion litium bekas dengan perbandingan massa 1:1. Transisi fasa pada sampel Li2CoSiO4 dipelajari menggunakan teknik termogravimetry/differential thermal analysis (TG/DTA). Sedangkan, nilai konstanta dielektrik pada sampel yang telah disinter pada suhu 600 – 900 oC dikarakterisasi menggunakan inductance, capacitance, dan resistance (LCR) meter. Hasilnya, pada rentang suhu 410 – 850 oC terjadi transisi polimorfik fasa  menjadi fasa . Suhu 850 oC juga merupakan titik transisi dimana fasa  berubah menjadi fasa . Transisi fasa yang terjadi pada sampel  Li2CoSiO4 diikuti dengan peningkatan nilai konstanta dielektrik dalam rentang frekuensi 450 – 100.000 Hz.",2022-06-21 02:57:41,archive,15.0,7,show,Analisis Transisi Fasa dan Sifat Dielektrik Pada Li2CoSiO4 yang Dipreparasi dari Silika Sekam Padi dan Produk Daur Ulang Katoda Baterai Ion Litium Bekas,https://jurnal.uns.ac.id/alchemy/article/view/24622,42687,2022-06-21 02:57:41,2022-06-21 02:57:41,181,public,http://repository.lppm.unila.ac.id/id/eprint/42687,TRUE,pub,1.0,"[{'language': 'en', 'mime_type': 'application/pdf', 'security': 'public', 'placement': 1, 'eprintid': 42687, 'rev_number': 1, 'uri': 'http://repository.lppm.unila.ac.id/id/document/164408', 'format': 'text', 'pos': 1, 'files': [{'datasetid': 'document', 'filesize': 1251182, 'mime_type': 'application/pdf', 'fileid': 468228, 'filename': '2019_Agus Riyanto dkk.pdf', 'hash': '6a14a2ca1ef34a4c2260fa57d1cbff11', 'mtime': '2022-06-21 02:01:35', 'hash_type': 'MD5', 'objectid': 164408, 'uri': 'http://repository.lppm.unila.ac.id/id/file/468228'}], 'main': '2019_Agus Riyanto dkk.pdf', 'docid': 164408}]",Jurusan Fisika Universitas Negeri Semarang,['FMIPA1'],article,disk0/00/04/26/87,1970-01-01 00:00:00.000002019,https://doi.org/10.20961/alchemy.15.1.24622.89-103,Jurnal Fisika,"[{'name': {'given': 'Riyanto', 'lineage': None, 'honourific': None, 'family': 'Agus'}, 'id': 'agus.riyanto@fmipa.unila.ac.id'}, {'id': 'simonsembiring2@gmail.com', 'name': {'given': 'Sembiring', 'lineage': None, 'family': 'Simon', 'honourific': None}}, {'id': 'junaidi.1982@fmipa.unila.ac.id', 'name': {'given': 'Junaidi', 'honourific': None, 'family': 'Junaidi', 'lineage': None}}, {'name': {'family': 'Ediman Ginting Suka', 'honourific': None, 'lineage': None, 'given': 'EGS'}, 'id': 'gintingediman@gmail.com'}]",2088-1509,,,,,,,,,,,,,,,,,,
1,['QC'],"Infant warmer is one of the tools used to provide comfort and warmth to newborns, where the baby needs a temperature that is in accordance with the temperature in the mother's womb, which is between 34ºC - 37ºC. This tool is made so that a newborn baby can feel the temperature outside the mother's womb will be the same as the temperature that is in the mother's womb. Until now, infant warmer still has to be connected to the PLN nets to activate it. This study aims to create and design infant warmers with DC pemanass equipped with batteries so that when the electricity dies by the PLN this tool can still be used. Data analysis results for power supply output, 12V pemanas input measurement is 11.9V with 0.8% error and 11.8V with 1.6% error, still within the tolerance limit of 5%. The measurement results of temperature comparison between DS18B20 sensor and thermometer, have an average difference of 0.3ºC or 1% error, so that it is still within reasonable limits. This tool has a maximum electric power of 36 Watt which saves power usage around 80%. Compared to a real device where the power needed is around 200 Watts to 300 Watt.",2020-03-19 00:47:36,archive,7.0,9,show,"Rancang Bangun Mobile Infant Warmer dengan Menggunakan
Pemanas DC",https://jurnal.fmipa.unila.ac.id/jtaf/issue/current,17494,2020-03-19 00:47:36,2020-03-19 00:47:36,2743,public,http://repository.lppm.unila.ac.id/id/eprint/17494,TRUE,pub,2.0,"[{'rev_number': 1, 'uri': 'http://repository.lppm.unila.ac.id/id/document/30622', 'pos': 1, 'format': 'text', 'files': [{'uri': 'http://repository.lppm.unila.ac.id/id/file/147915', 'objectid': 30622, 'filename': 'Rancang Bangun Mobile Infant Warmer dengan Menggunakan (2).pdf', 'hash': 'b3542885f9887d562ecddea17b2f1deb', 'mtime': '2020-01-06 04:31:17', 'hash_type': 'MD5', 'mime_type': 'application/pdf', 'fileid': 147915, 'filesize': 350211, 'datasetid': 'document'}], 'docid': 30622, 'main': 'Rancang Bangun Mobile Infant Warmer dengan Menggunakan (2).pdf', 'language': 'en', 'mime_type': 'application/pdf', 'placement': 1, 'security': 'public', 'eprintid': 17494}, {'format': 'text', 'pos': 2, 'uri': 'http://repository.lppm.unila.ac.id/id/document/30623', 'rev_number': 3, 'docid': 30623, 'main': 2143, 'files': [{'hash': '5efb8bd9268b022a64832144aba77dbd', 'filename': 2143, 'hash_type': 'MD5', 'mtime': '2020-01-06 04:31:58', 'mime_type': 'text/html', 'fileid': 147918, 'filesize': 33974, 'datasetid': 'document', 'uri': 'http://repository.lppm.unila.ac.id/id/file/147918', 'objectid': 30623}], 'mime_type': 'text/html', 'language': 'id', 'content': 'published', 'eprintid': 17494, 'security': 'public', 'placement': 2}]",Publikasi FMIPA UNILA,['FMIPA1'],article,disk0/00/01/74/94,2019-07-01 00:00:00.000000000,http://dx.doi.org/10.23960%2Fjtaf.v7i2.2143,Jurnal Teori dan Aplikasi Fisika,"[{'name': {'lineage': None, 'family': 'Bayu Wahyudi', 'honourific': None, 'given': 'B.W'}, 'id': 'bayuwahyudi@atemsemarang.ac.id'}, {'name': {'given': 'M.M', 'lineage': None, 'honourific': None, 'family': 'Mohamad Miftahudin'}, 'id': 'mhuddin1@gmail.com'}, {'name': {'given': 'I.F', 'lineage': None, 'family': 'Iqbal Firdaus', 'honourific': None}, 'id': 'iqbal.firdaus@fmipa.unila.ac.id'}]",2303-016X,iqbal.firdaus@fmipa.unila.ac.id,145-152,"H. S. Hutagaol, E. Darwin, and E. Yantri, “Pengaruh Inisiasi Menyusu Dini (IMD) terhadap Suhu dan Kehilangan Panas pada Bayi Baru Lahir,” J. Kesehat. Andalas, vol. 4, no. 4, pp. 32–38, 2014.

A. Proverati, BBLR- Berat Badan Lahir Rendah : Plus Asuhan pada BBLR dan Materi Pijat Bayi. Yogyakarta: Nuhu Medika, 2010.

S. Heri and Suryono, “Rancang Bangun Sistem Pengaturan Suhu Ruang Inkubator Bayi Berbasis Microcontroller AT89S51,” J. Berk. Fis., vol. 12, no. 2, pp. 55–63, 2009.

M. AFDALI, M. DAUD, and R. PUTRI, “Perancangan Alat Ukur Digital untuk Tinggi dan Berat Badan dengan Output Suara berbasis Arduino UNO,” J. Elkomika, vol. 5, no. 1, 2017.

A. . Yoga and L. Rachmawati, “Alat Ukur Panjang Dan Berat Badan Balita Untuk Menentukan Kategori Status Gizi Berbasis Arduino Uno,” in Jurusan Teknik Elektro Unesa, 2018, vol. 07, no. 01, pp. 1–8.

A. Susanto, A. A. Muslim, and S. Mubarok, “Pemecahan Bitmap Pada Led Dot Matrix F3.75 Menggunakan Arduino Uno Sebagai Pembentuk Karakter,” J. Elektro dan Inform., vol. 3, no. 1, pp. 1–4, 2018.

Y. M. Dinata, Arduino Itu Mudah. Jakarta: PT Elex Media Komputindo, 2015.

E. P. Agfianto, Belajar Mikrokontroller AT89CS1/25/55 : Teori dan Aplikasi. Yogyakarta: Gava Media, 2003.

A. Kadir, Pemrograman Arduino dan Processing. Jakarta: Gramedia, 2017.

A. Kadir, Simualasi Arduino. Jakarta: PT Elex Media Komputindo, 2016.

E. Nurazizah, M. Ramdhani, and A. Rizal, “Rancang Bangun Termometer Digital Berbasis Sensor DS18B20 Untuk Penyandang Tunanetra,” Proceeding Eng., vol. 4, no. 3, pp. 3294–3301, 2017.

I. Abdul Rozaq, “Uji Karakterisasi Sensor Suhu Ds18B20 Waterproof Berbasis Arduino Uno Sebagai Salah Satu Parameter Kualitas Air,” Pros. SNATIF Ke-4 Tahun 2017, vol. 4, pp. 303–309, 2017.

T. Surdia and S. Saito, Pengetahuan Bahan Teknik. 1999.

M. R. Rahmat, “Perancangan Dan Pembuatan Tungku Heat Treatment,” J. Ilm. Tek. Mesin, vol. 3, no. 2, pp. 133–148, 2015.

S. I. Inc, Liquid Crystal Display Module M2004. 2011.","['AKADEMI TEKNIK ELEKTRO MEDIK SEMARANG', 'AKADEMI TEKNIK ELEKTRO MEDIK SEMARANG', 'UNIVERSITAS LAMPUNG']",published,,,,,,,,,,,,,
2,['QC'],"Penelitian ini dilakukan untuk mengetahui pengaruh suhu sintering terhadap pembentukan fase superkonduktor BSCCO-2223 dengan kadar Ca = 2,10 menggunakan metode pencampuran basah. Bahan yang digunakan yaitu Bi2O3, SrCO3, CaCO3, CuO, HNO3 dan aquades. Sintesis dilakukan dengan melarutkan bahan menggunakan HNO3 dan aquades secara perlahan kemudian larutan dikeringkan selama 40 jam dengan suhu 300, 400 dan 600 °C secara bertahap. Sampel dikalsinasi pada suhu 800 °C selama 10 jam dan disintering dengan variasi suhu 850, 855, 860 dan 865 °C selama 20 jam. Hasil XRD menunjukkan bahwa suhu sintering berpengaruh terhadap pembentukan fase superkonduktor BSCCO-2223, dengan nilai fraksi volume yang cenderung meningkat seiring meningkatnya suhu sintering. Fraksi volume tertinggi diperoleh pada sampel BSCCO-2223 dengan suhu sintering 865 °C yaitu 79,49 %. Hasil SEM menunjukkan bahwa semua sampel telah memiliki lapisan-lapisan yang tersusun (terorientasi) dengan ruang kosong antara lempengan (void) relatif kecil. Derajat orientasi yang tertinggi yaitu pada sampel BSCCO-2223 dengan suhu sintering 860 °C yaitu 23,77 %.",2019-11-14 10:18:45,archive,7.0,6,show,"Pengaruh Suhu Sintering Terhadap Pembentukan Fase Superkonduktor BSCCO-2223 dengan Kadar Ca = 2,10 Menggunakan Metode Pencampuran Basah",,16290,2019-11-14 10:18:45,2019-11-14 10:18:45,490,public,http://repository.lppm.unila.ac.id/id/eprint/16290,TRUE,pub,2.0,"[{'files': [{'objectid': 29394, 'uri': 'http://repository.lppm.unila.ac.id/id/file/139187', 'fileid': 139187, 'mime_type': 'application/pdf', 'mtime': '2019-11-13 10:17:20', 'hash_type': 'MD5', 'hash': 'eb0a1ff3b40c5316a41c679213e1bd61', 'filename': 'Jurnal Komala (1955-5187-1-PB).pdf', 'datasetid': 'document', 'filesize': 310044}], 'main': 'Jurnal Komala (1955-5187-1-PB).pdf', 'docid': 29394, 'rev_number': 1, 'uri': 'http://repository.lppm.unila.ac.id/id/document/29394', 'pos': 1, 'format': 'text', 'placement': 1, 'security': 'public', 'eprintid': 16290, 'mime_type': 'application/pdf', 'language': 'en'}]",Jurusan Fisika FMIPA Universitas Lampung,['FMIPA1'],article,disk0/00/01/62/90,1970-01-01 00:00:00.000002019,,Jurnal Teori dan Aplikasi Fisika,"[{'name': {'honourific': None, 'family': 'Dewi', 'lineage': None, 'given': 'Komala'}, 'id': 'akomaladewikomala@gmail.com'}, {'name': {'family': 'Suprihatin', 'honourific': None, 'lineage': None, 'given': 'Suprihatin'}, 'id': 'suprihatin_itb@yahoo.com'}, {'id': 'ssyafriadi155@gmail.com', 'name': {'honourific': None, 'family': 'Syafriadi', 'lineage': None, 'given': 'Syafriadi'}}]",2303-016X,,133-138,,,published,,,,,,,,,,,,,
3,['QC'],"Physical properties of polyethylene (PE)/ nanotitania composite as a function of thickness have
been studied. The material used is PE and nanotitania. The blending of PE with nanotitania was carried out
by melting polyethylene at 95 °C for 5 minutes then added nanotitania 5 wt% and 10 wt% and heated at 124
° C for 30 minutes. Then printed using barcoater with size 6, 12 and 25 μm with four repetitions. Variations
were performed to determine the effect of composite thickness of polyethylene/nanotitania on electrical
properties and functional groups. FTIR results show that as the thickness of the absorption sample increases,
new functional groups appear, namely hydroxyl and carbonyl. The LCR results show the smallest
conductivity value, sample 5 wt% PE / nanotitania with 6 μm size and the largest 10% PE/nanotitania
sample with a size of 25 μm each at 2,302 x 10-5 S/m and 3,121 x 10-5 S/m at a frequency of 105 Hz. While the
largest dielectric constant value is a sample of PE/nanotitania 5 wt% with a size of 6 μm and the smallest
sample PE/nanotitania 10 wt% with a size of 6 μm at a frequency of 105 Hz. Based on these characteristics,
the 5 wt% PE/nanotitania sample with a size of 6 μm is the material with the best dielectric properties so that
the sample has the potential to be used as a cable insulator.",2019-11-04 03:39:08,archive,7.0,6,show,"The Physical Properties of Polyethylene/Nanotitania
Composites as Thickness Function",,14785,2019-11-04 03:39:08,2019-11-04 03:39:08,1168,public,http://repository.lppm.unila.ac.id/id/eprint/14785,TRUE,pub,1.0,"[{'security': 'public', 'placement': 1, 'eprintid': 14785, 'language': 'en', 'mime_type': 'application/pdf', 'files': [{'mime_type': 'application/pdf', 'fileid': 127849, 'filename': '1930-4313-1-PB_compressed.pdf', 'hash': '1c45d5d792d62d3032377815d5f038d5', 'mtime': '2019-10-30 14:01:51', 'hash_type': 'MD5', 'datasetid': 'document', 'filesize': 206499, 'objectid': 27909, 'uri': 'http://repository.lppm.unila.ac.id/id/file/127849'}], 'docid': 27909, 'main': '1930-4313-1-PB_compressed.pdf', 'uri': 'http://repository.lppm.unila.ac.id/id/document/27909', 'rev_number': 1, 'format': 'text', 'pos': 1}]",Jurusan Fisika FMIPA Universitas Lampung,['FMIPA1'],article,disk0/00/01/47/85,1970-01-01 00:00:00.000002019,,Jurnal Teori dan Aplikasi Fisika,"[{'name': {'lineage': None, 'honourific': None, 'family': 'Fricilia', 'given': 'Nola'}, 'id': 'fricilianola@gmail.com'}, {'name': {'given': 'Posman', 'family': 'Manurung', 'honourific': None, 'lineage': None}, 'id': 'reip65@yahoo.com'}, {'name': {'lineage': None, 'honourific': None, 'family': 'Riyanto', 'given': 'Agus'}, 'id': 'agus.riyanto@fmipa.unila.ac.id'}]",2303-016X,,83-89,,,published,,,,,,,,,,,,,
4,['QC'],"Pada penelitian ini telah dilakukan rancang bangun sistem pengaturan suhu dan volume pelarut pada ultrasound assisted extraction. Sistem ini terdiri dari pompa, mikrokontroler, termocouple, termocontroller dan sensor suhu LM35 yang bertujuan untuk menghindari pengenceran ekstrak dan meningkatkan transfer massa sehingga mendapatkan hasil ekstraksi yang lebih baik. Pompa menyala sesuai dengan perintah yang diberikan ke mikrokontroler selanjutnya dilakukan pembacaan nilai ADC oleh sensor suhu LM35 yang kemudian dikonversi ke dalam nilai temperatur. Berdasarkan hasil penelitian yang telah dilakukan, sistem mampu mengontrol volume pelarut dengan nilai error sebesar 2,38%, memantau suhu dalam wadah ekstraksi menggunakan sensor suhu LM35 dengan nilai error sebesar 0,70% dan mengontrol suhu menggunakan termokontroler dengan kestabilan sistem sebesar 96,16%.",2019-11-15 02:39:21,archive,,8,show,RANCANG BANGUN SISTEM ULTRASOUND ASSISTED EXTRACTION (UAE) DENGAN OTOMASI PENGATURAN SUHU DAN VOLUME PELARUT,http://snsmiap.fmipa.unila.ac.id/2019/,16515,2019-11-15 02:39:21,2019-11-15 02:39:21,2752,public,http://repository.lppm.unila.ac.id/id/eprint/16515,TRUE,submitted,,"[{'uri': 'http://repository.lppm.unila.ac.id/id/document/29597', 'rev_number': 1, 'format': 'text', 'pos': 1, 'files': [{'mime_type': 'application/vnd.openxmlformats-officedocument.wordprocessingml.document', 'fileid': 140954, 'hash': '697f6a086d06b9ea7c9e80ace7da98ca', 'filename': 'RANCANG BANGUN SISTEM ULTRASOUND ASSISTED EXTRACTION (UAE) DENGAN.docx', 'hash_type': 'MD5', 'mtime': '2019-11-15 02:16:09', 'datasetid': 'document', 'filesize': 540763, 'objectid': 29597, 'uri': 'http://repository.lppm.unila.ac.id/id/file/140954'}], 'docid': 29597, 'main': 'RANCANG BANGUN SISTEM ULTRASOUND ASSISTED EXTRACTION (UAE) DENGAN.docx', 'language': 'en', 'mime_type': 'application/vnd.openxmlformats-officedocument.wordprocessingml.document', 'security': 'public', 'placement': 1, 'eprintid': 16515}]",,['FMIPA1'],conference_item,disk0/00/01/65/15,2019-10-24 00:00:00.000000000,,,"[{'name': {'family': 'Humairoh Ratu Ayu', 'honourific': None, 'lineage': None, 'given': 'HRA'}, 'id': 'humairoh.ratu@fmipa.unila.ac.id'}, {'name': {'lineage': None, 'family': 'Suryono Suryono', 'honourific': None, 'given': 'SR'}, 'id': 'suryono@fisika.undip.ac.id'}, {'id': 'jatmikoendrosuseno@undip.ac.id', 'name': {'given': 'JES', 'honourific': None, 'family': 'Jatmiko Endro Suseno', 'lineage': None}}]",,,1-9,"[1]	M. Bonfigli, E. Godoy, M. A. Reinheimer, and N. J. Scenna, “Comparison between conventional and ultrasound-assisted techniques for extraction of anthocyanins from grape pomace. Experimental results and mathematical modeling,” J. Food Eng., vol. 207, pp. 56–72, 2017.
[2]	K. P. Šavikin et al., “Optimization of the extraction process of polyphenols from Thymus serpyllum L. herb using maceration, heat- and ultrasound-assisted techniques,” Sep. Purif. Technol., vol. 179, pp. 369–380, 2017.
[3]	F. Chemat, M. A. Vian, and G. Cravotto, “Green extraction of natural products: Concept and principles,” Int. J. Mol. Sci., vol. 13, no. 7, pp. 8615–8627, 2012.
[4]	Y. Tao, Z. Zhang, and D. Sun, “Ultrasonics Sonochemistry Kinetic modeling of ultrasound-assisted extraction of phenolic compounds from grape marc : Influence of acoustic energy density and temperature,” Ultrason. - Sonochemistry, vol. 21, no. 4, pp. 1461–1469, 2014.
[5]	B. He et al., “Optimization of Ultrasound-Assisted Extraction of phenolic compounds and anthocyanins from blueberry (Vaccinium ashei) wine pomace,” Food Chem., vol. 204, pp. 70-76, 2016.
[6]	D. T. Veličković, D. M. Milenović, M. S. Ristić, and V. B. Veljković, “Kinetics of ultrasonic extraction of extractive substances from garden (Salvia officinalis L.) and glutinous (Salvia glutinosa L.) sage,” Ultrason. Sonochem., vol. 13, pp. 150-156, 2006.
[7]	H. Ratu Ayu, S. Suryono, J. Endro Suseno, and R. Kurniawati, “Determination of the ultrasound power effects on flavonoid compounds from Psidium guajava L. using ANFIS,” J. Phys. Conf. Ser., vol. 1025, no. 1, 2018.
[8]	J. L. Tadeo, C. Sánchez-Brunete, B. Albero, and A. I. García-Valcárcel, “Application of ultrasound-assisted extraction to the determination of contaminants in food and soil samples,” Journal of Chromatography A., vol. 1217, no. 16, pp. 2415-2440, 2010.
[9]	T. Azis, S. Febrizky, and A. D. Mario, “Pengaruh Jenis Pelarut Terhadap Persen Yieldalkaloiddari Daun Salam India (Murraya Koenigii),” Tek. Kim., vol. 20, no. 2, pp. 1-6, 2014.
[10]	A. A. Jovanović et al., “Optimization of the extraction process of polyphenols from Thymus serpyllum L. herb using maceration, heat- and ultrasound-assisted techniques,” Sep. Purif. Technol., vol. 179, pp. 369-380, 2017.
[11]	K. Gorovoy, J. Tung, and P. Poupart, “Automatic speech feature extraction for cognitive load classification,” Proc. Conf. Can. Med. Biol. Eng. Soc., vol 33. no. 1, 2010.
[12]	E. V. Euramet, “Guidelines on The Calibration of Temperature Indivators and Simulators by Electrical Simulation and Measurement,” German, 2011.","['Universitas Lampung', 'Universitas Diponegoro', 'Universitas Diponegoro']",submitted,24 Oktober 2019,conference,Bandar Lampung,"Seminar Nasional Sains, Matematika, Informatika dan Aplikasinya (SNSMIAP 2019)",paper,,,,,,,,
5,['QC'],"Synthesis and characterization of the electrochemical properties of manganese ferrite nanoparticles (\ce {MnFe2O4}) from iron ore have been done. The aim of this research was to determine the potential of iron ore as a source for the manufacture of \ce {MnFe2O4} and to know electrochemical characterization. The precipitation method was used in this research. Iron ore samples were taken from Tanah Laut Regency, South Kalimantan, Indonesia. The sample of iron ore was purified first to synthesis MnFe2O4 nanoparticle. Manganese salt \ce {MnCl2} is used as a source of manganese. Characterization of samples use TEM and potentiostat. Glucose oxidase (GOD) is used as a sample to be given electrochemical properties of the sample. The GOD concentration used is 0.2; 0.4; 0.6; and 0.8 ppm. The range of \ce {MnFe2O4} nanoparticles was successfully made with sample diameters ranging from 1.5 to 12.5 nm. The current values ​​obtained on \ce {MnFe2O4} nanoparticles range from $0.226 - 0.322$ mA. The sensitivity of \ce {MnFe2O4} nanoparticles is around 0.16 mA/ppm. The higher the concentration used, the greater the current produced.",2019-11-05 10:51:59,archive,5.0,8,show,Synthesis and Characterization of Electrochemical Properties of Manganese Ferrite Nanoparticles MnFe2O4 from Iron,http://omega.uhamka.ac.id/index.php/omega/article/view/98,15439,2019-11-05 10:51:59,2019-11-05 10:51:59,1168,public,http://repository.lppm.unila.ac.id/id/eprint/15439,TRUE,pub,1.0,"[{'uri': 'http://repository.lppm.unila.ac.id/id/document/28563', 'rev_number': 1, 'pos': 2, 'format': 'text', 'files': [{'datasetid': 'document', 'filesize': 1573538, 'mime_type': 'application/pdf', 'fileid': 133095, 'hash': 'd2e7e1b71e5037a5474c5172946170db', 'filename': '98-Article Text-273-2-10-20190706.pdf', 'hash_type': 'MD5', 'mtime': '2019-11-04 14:03:02', 'objectid': 28563, 'uri': 'http://repository.lppm.unila.ac.id/id/file/133095'}], 'docid': 28563, 'main': '98-Article Text-273-2-10-20190706.pdf', 'mime_type': 'application/pdf', 'language': 'en', 'placement': 2, 'security': 'public', 'eprintid': 15439}]",Pendidikan Fisika UHAMKA,['FMIPA1'],article,disk0/00/01/54/39,2019-07-01 00:00:00.000000000,,Omega: Jurnal Fisika dan Pendidikan Fisika,"[{'id': None, 'name': {'honourific': None, 'family': 'Husain', 'lineage': None, 'given': 'Sadang'}}, {'id': None, 'name': {'family': 'Irfansyah', 'honourific': None, 'lineage': None, 'given': 'Muhammdad'}}, {'id': 'agus.riyanto@fmipa.unila.ac.id', 'name': {'given': 'Agus', 'honourific': None, 'family': 'Riyanto', 'lineage': None}}, {'id': None, 'name': {'given': 'Sugianto', 'family': 'Arjo', 'honourific': None, 'lineage': None}}]","p-ISSN 2443-2911, e-ISSN 2502-2318",,15-19,,,published,,,,,,[{'url': 'http://omega.uhamka.ac.id/index.php/omega/article/view/98'}],,,,,,,
6,"['QC', 'QD']","Sintesis nanokomposit Fe3O4@C dari bijih besi Tanah Laut dan sumber karbon dari gula pasir telah dilakukan dengan menggunakan metode kopresipitasi dan metode hidrotermal. Penelitian dilakukan untuk mengetahui karakteristik Fe3O4@C berbahan bijih besi. Sebanyak 6 g bijih besi digunakan sebagai bahan baku pembuatan Fe3O4. FeSO4.7H2O digunakan sebagai sumber ion Fe2+. Sampel diaduk dengan menggunakan temperatur 70oC dengan kecepatan adukan 450 rpm. Karbon (C) disintesis menggunakan metode hidrotermal pada temperatur 300oC dengan menambahkan etilon glikol sebagai surfaktan. Sampel Fe3O4 dan C digabung pada suhu 250oC selama 30 menit dengan kecepatan 500 rpm. Sampel Nanokomposit Fe3O4@C dikarakterisasi menggunakan Vibrating Sample Magnetometer, Fourier Transform Infrared, Transmission Electron Microscopy, serta elektrokimia. Dari penelitian, diperoleh nilai magnetisasi saturasi sebesar 24,82 emu/g, jenis ikatan yang terdapat dalam nanokomposit Fe3O4@C adalah ikatan Fe-O, C=O, C=N dan O-H, distribusi ukuran partikel dalam rentang 5 nm – 20 nm, dengan rata-rata ukuran partikel 12 nm, serta nilai sensitivitas 0,285 mA/ppm.",2020-03-17 01:29:53,archive,9.0,8,show,Potensi Nanokomposit Fe3O4@C dari Bijih Besi Sebagai Pendeteksi Kadar Glukosa,http://jurnal.untan.ac.id/index.php/jpositron/article/view/32771,18700,2020-03-17 01:29:53,2020-03-17 01:29:53,1168,public,http://repository.lppm.unila.ac.id/id/eprint/18700,TRUE,pub,2.0,"[{'eprintid': 18700, 'placement': 1, 'security': 'public', 'mime_type': 'application/pdf', 'language': 'en', 'docid': 31876, 'main': '32771-75676618154-1-PB(Positron).pdf', 'files': [{'objectid': 31876, 'uri': 'http://repository.lppm.unila.ac.id/id/file/157033', 'datasetid': 'document', 'filesize': 1058126, 'fileid': 157033, 'mime_type': 'application/pdf', 'hash_type': 'MD5', 'mtime': '2020-03-15 02:42:47', 'filename': '32771-75676618154-1-PB(Positron).pdf', 'hash': 'ae492f6d7323991fab2a1881c46d0582'}], 'pos': 1, 'format': 'text', 'rev_number': 1, 'uri': 'http://repository.lppm.unila.ac.id/id/document/31876'}]",Jurusan Fisika Fakultas Matematika dan Ilmu Pengetahuan Alam Universitas Tanjungpura,['FMIPA1'],article,disk0/00/01/87/00,2019-11-30 00:00:00.000000000,,Positron,"[{'name': {'honourific': None, 'family': 'Husain', 'lineage': None, 'given': 'Sadang'}, 'id': None}, {'name': {'given': 'Suryajaya', 'honourific': None, 'family': 'Suryajaya', 'lineage': None}, 'id': None}, {'name': {'given': 'Ninis Hadi', 'lineage': None, 'honourific': None, 'family': 'Haryanti'}, 'id': None}, {'name': {'lineage': None, 'honourific': None, 'family': 'Manik', 'given': 'Tetti Novalina'}, 'id': None}, {'name': {'family': 'Sudarningsih', 'honourific': None, 'lineage': None, 'given': 'Sudarningsih'}, 'id': None}, {'name': {'given': 'Rodiansono', 'lineage': None, 'family': 'Rodiansono', 'honourific': None}, 'id': None}, {'name': {'given': 'Sepfina Monica', 'family': 'Hutasoit', 'honourific': None, 'lineage': None}, 'id': None}, {'id': 'agus.riyanto@fmipa.unila.ac.id', 'name': {'family': 'Riyanto', 'honourific': None, 'lineage': None, 'given': 'Agus'}}]","ISSN (print): 2301-4970, ISSN (Online):2549-936X",,44-52,,,published,,,,,,[{'url': 'http://jurnal.untan.ac.id/index.php/jpositron/article/view/32771'}],,,,,,,
