,subjects,abstract,status_changed,eprint_status,volume,rev_number,metadata_visibility,title,official_url,eprintid,datestamp,lastmod,userid,full_text_status,uri,refereed,ispublished,number,documents,publisher,divisions,type,dir,date,id_number,publication,creators,issn,contact_email,pagerange,referencetext,corp_creators,date_type,event_dates,event_type,event_location,event_title,pres_type,related_url,pages,place_of_pub,isbn,contributors,succeeds,funders,projects
16,['QC'],"Telah dilakukan penelitian tentang variasi konsentrasi inhibitor ekstrak buah harendong (Melastoma
Affine D. Don) pada baja per daun dengan perlakuan panas 300 dan 700 °C terhadap laju korosi dalam larutan
nacl 3%. Tujuan dari penelitian ini adalah mengetahui efisiensi ekstrak buah harendong terhadap laju koros
pada baja per daun dengan perlakuan panas 300 dan 700 °C. Untuk mengetahui laju korosi digunakan metode
kehilangan berat. Hasil penelitian menunjukkan bahwa effisiensi ekstrak buah harendong pada kosentrasi
inhibitor 5% pada suhu 300 °C yaitu sebesar 90,345%. Berdasarkan hasil XRD pada sampel didapatkan fasa
Fe dengan struktur kristal Orthorombic. Berdasarkan hasil analisis SEM dan EDS luas permukaan sampel yang
terkorosi berkurang serta pengurangan kadar FeO dalam sampel lebih sedikit. Dari hasil laju korosi dan analisis
SEM dan EDS yang didapatkan bahwa inhibitor ekstrak buah harendong efektif dalam menginhibisi laju korosi
pada baja per daun.",2019-11-14 10:19:07,archive,7.0,6,show,"Variasi Konsentrasi Inhibitor Ekstrak Buah Harendong
(Melastoma Affine D. Don) Pada Baja Per Daun Dengan
Perlakuan Panas 300 Dan 700 °C Terhadap Laju
Korosi Dalam Larutan Nacl 3%",,16316,2019-11-14 10:19:07,2019-11-14 10:19:07,490,public,http://repository.lppm.unila.ac.id/id/eprint/16316,TRUE,pub,2.0,"[{'mime_type': 'application/pdf', 'language': 'en', 'eprintid': 16316, 'placement': 1, 'security': 'public', 'pos': 1, 'format': 'text', 'uri': 'http://repository.lppm.unila.ac.id/id/document/29420', 'rev_number': 1, 'main': 'Jurnal Dwi Kurniawan (2052-5206-1-PB).pdf', 'docid': 29420, 'files': [{'mtime': '2019-11-13 13:51:34', 'hash_type': 'MD5', 'hash': '134fbc1bb0d31633558eec7bcd9142c5', 'filename': 'Jurnal Dwi Kurniawan (2052-5206-1-PB).pdf', 'fileid': 139356, 'mime_type': 'application/pdf', 'filesize': 1446731, 'datasetid': 'document', 'uri': 'http://repository.lppm.unila.ac.id/id/file/139356', 'objectid': 29420}]}]",Jurusan Fisika FMIPA Universitas Lampung,['FMIPA1'],article,disk0/00/01/63/16,1970-01-01 00:00:00.000002019,,Jurnal Teori dan Aplikasi Fisika,"[{'id': 'dwikurniawandwi23@gmail.com,', 'name': {'family': 'Kurniawan', 'honourific': None, 'lineage': None, 'given': 'Dwi'}}, {'name': {'given': 'Ediman', 'lineage': None, 'honourific': None, 'family': 'Gunting Suka'}, 'id': 'ediman.gintingsuka@fmipa.ac.id'}, {'name': {'honourific': None, 'family': 'Suprihatin', 'lineage': None, 'given': 'Suprihatin'}, 'id': 'suprihatin_itb@yahoo.com'}]",2303-016X,,187-196,,,published,,,,,,,,,,,,,
17,['QC'],"The research's aims are to calculate the absorbance and the thickness value of the
silver (Ag) thin layer formed on the glass substrate (SiO2) at various visible wavelengths. The
silver (Ag) thin layer was formed using Direct Current Sputtering method. The research
showed that the highest absorbance value on the glass (SiO2) substrate was 4.000 with
wavelengths 287.50 nm. While, the lowest absorbance value on the glass (SiO2) substrate was -
4.000 with wavelengths 262.50 nm and 243 nm. The lowest absorbance value is estimated
because of the part of the substrate that has not been completely coated so that the part is not
absorbed at all. Using Swanepoel equation we obtained the thickness value of the thin layer
equal to 4.692663316 nm with sputtering time of 15 minutes.",2019-11-04 08:09:56,archive,1338.0,8,show,The Deposition of Silver (Ag) on a Glass Substrate (Sio2) using Direct Current Sputtering Method,https://iopscience.iop.org/issue/1742-6596/1338/1,15204,2019-11-04 08:09:56,2019-11-04 08:09:56,1167,public,http://repository.lppm.unila.ac.id/id/eprint/15204,TRUE,pub,,"[{'uri': 'http://repository.lppm.unila.ac.id/id/document/28345', 'rev_number': 1, 'format': 'text', 'pos': 1, 'files': [{'fileid': 130886, 'mime_type': 'application/pdf', 'hash_type': 'MD5', 'mtime': '2019-11-04 03:31:06', 'filename': 'Rumiyanti_2019_J._Phys.__Conf._Ser._1338_012016.pdf', 'hash': '1d36cb3b721543683807f78319e81269', 'datasetid': 'document', 'filesize': 721598, 'objectid': 28345, 'uri': 'http://repository.lppm.unila.ac.id/id/file/130886'}], 'docid': 28345, 'main': 'Rumiyanti_2019_J._Phys.__Conf._Ser._1338_012016.pdf', 'language': 'en', 'mime_type': 'application/pdf', 'security': 'public', 'placement': 1, 'eprintid': 15204}]",IOP Publishing,['FMIPA1'],article,disk0/00/01/52/04,2019-10-23 00:00:00.000000000,10.1088/1742-6596/1338/1/012016,Journal of Physics: Conference Series,"[{'id': 'lenirumiyanti@fmipa.unila.ac.id', 'name': {'family': 'Leni', 'honourific': None, 'lineage': None, 'given': 'Rumiyanti'}}, {'id': None, 'name': {'lineage': None, 'honourific': None, 'family': 'Listiani', 'given': 'Listiani'}}, {'name': {'honourific': None, 'family': 'Tika', 'lineage': None, 'given': 'Damayanti'}, 'id': None}, {'name': {'given': 'Sembiring', 'family': 'Simon', 'honourific': None, 'lineage': None}, 'id': None}, {'id': 'warsito@fmipa.unila.ac.id', 'name': {'lineage': None, 'family': 'Warsito', 'honourific': None, 'given': 'Warsito'}}]",Print : 1742-6588 Online : 1742-6596,,1-6,,"['Universitas Lampung', 'Universitas Lampung', 'PT Semen Baturaja', 'Universitas Lampung', 'Universitas Lampung']",published,,,,,,[{'url': 'https://iopscience.iop.org/article/10.1088/1742-6596/1338/1/012016'}],,,,,,,
18,['QC'],"The research's aims are to calculate the absorbance and the thickness value of the
silver (Ag) thin layer formed on the glass substrate (SiO2) at various visible wavelengths. The
silver (Ag) thin layer was formed using Direct Current Sputtering method. The research
showed that the highest absorbance value on the glass (SiO2) substrate was 4.000 with
wavelengths 287.50 nm. While, the lowest absorbance value on the glass (SiO2) substrate was -
4.000 with wavelengths 262.50 nm and 243 nm. The lowest absorbance value is estimated
because of the part of the substrate that has not been completely coated so that the part is not
absorbed at all. Using Swanepoel equation we obtained the thickness value of the thin layer
equal to 4.692663316 nm with sputtering time of 15 minutes",2019-11-04 08:21:19,archive,,9,show,"The Deposition of Silver (Ag) on a Glass Substrate (Sio2) using Direct
Current Sputtering Method",https://iopscience.iop.org/article/10.1088/1742-6596/1338/1/012016,15228,2019-11-04 08:21:19,2019-11-04 08:21:19,1167,public,http://repository.lppm.unila.ac.id/id/eprint/15228,TRUE,pub,,"[{'rev_number': 1, 'uri': 'http://repository.lppm.unila.ac.id/id/document/28361', 'pos': 1, 'format': 'text', 'files': [{'uri': 'http://repository.lppm.unila.ac.id/id/file/131069', 'objectid': 28361, 'hash_type': 'MD5', 'mtime': '2019-11-04 03:59:51', 'filename': 'Rumiyanti_2019_J._Phys.__Conf._Ser._1338_012016.pdf', 'hash': '1d36cb3b721543683807f78319e81269', 'fileid': 131069, 'mime_type': 'application/pdf', 'filesize': 721598, 'datasetid': 'document'}], 'docid': 28361, 'main': 'Rumiyanti_2019_J._Phys.__Conf._Ser._1338_012016.pdf', 'mime_type': 'application/pdf', 'language': 'en', 'placement': 1, 'security': 'public', 'eprintid': 15228}]",,['FMIPA1'],conference_item,disk0/00/01/52/28,2019-10-23 00:00:00.000000000,,,"[{'name': {'lineage': None, 'honourific': None, 'family': 'Leni', 'given': 'Rumiyanti'}, 'id': 'lenirumiyanti@fmipa.unila.ac.id'}, {'id': None, 'name': {'given': 'Wulandari', 'family': 'Siska', 'honourific': None, 'lineage': None}}, {'name': {'given': 'Damayanti', 'honourific': None, 'family': 'Tika', 'lineage': None}, 'id': None}, {'name': {'lineage': None, 'family': 'Simon', 'honourific': None, 'given': 'Sembiring'}, 'id': None}, {'id': 'warsito@fmipa.unila.ac.id', 'name': {'honourific': None, 'family': 'Warsito', 'lineage': None, 'given': 'Warsito'}}]",,,1-6,,"['Universitas Lampung', 'Universitas Lampung', 'PT Semen Baturaja', 'Universitas Lampung', 'Universitas Lampung']",published,9-11 Agustus 2018,conference,"Hotel Emersia, Bandar Lampung",ICASMI 2018 (International Conference on Applied Sciences Mathematics and Informatics),paper,,,,,,,,
19,['QC'],"This study was conducted to determine the effect of temperature on the chemical content and crystal structure on clinker of cement with 20% substitution of basalt stone on the mass of limestone and 20% of coal against total mass. The raw material used is basalt stone from East Lampung and anthracite coal. The percentage of limestone used is 80%. All raw materials are milled, sifted, then formed pellets with a diameter of 0.8 - 1.4 cm. Pellets are dried at room temperature, then heated and burned with temperature variations of 1000 ° C, 1100 ° C and 1200 ° C for 1 hour. XRF results showed that basalt rock had a content of SiO2 + Al2O3 + Fe2O3 of 79.293% so that basalt could be said to have pozzolanic properties. The CaO content for cement clinker decreased, the results of XRF with combustion temperatures of 1000 ° C, 1100 ° C and 1200 ° C respectively were 62,329%, 55,606%, and 54,148%. Materials A, B and C respectively were burning at 1000°C, 1100°C, and 1200oC for 1 hour. The crystalline phase formed in material A is calcium iron oxide with the highest peak belonging to Ca at position 2θ which is 26.6627° and another crystal phase, gehlenite, syn. The crystalline phase formed in material B is akermanite-gehlenite syn with the highest peak belonging to Ca at position 2θ which is 31.2747° and other crystalline phases namely and wollastonite, ferroan 1A. While the crystalline phase formed in material C is akermanite-gehlenite with the highest peak belonging to Ca at position 2θ which is 31.3051° and syn and other crystalline phases namely wollastonite, ferroan 1A.",2019-08-19 03:22:18,archive,7.0,6,show,Pengaruh Temperatur terhadap Karakterisasi Klinker Semen dengan Substitusi 20% Batu Basalt terhadap Massa Batu Kapur dan 20% Batubara terhadap Massa Total sebagai Reduktor,http://jurnal.fmipa.unila.ac.id/jtaf,13857,2019-08-19 03:22:18,2019-08-19 03:22:18,1167,public,http://repository.lppm.unila.ac.id/id/eprint/13857,TRUE,pub,1.0,"[{'security': 'public', 'placement': 1, 'eprintid': 13857, 'mime_type': 'application/pdf', 'language': 'en', 'files': [{'objectid': 26886, 'uri': 'http://repository.lppm.unila.ac.id/id/file/120904', 'datasetid': 'document', 'filesize': 743041, 'mime_type': 'application/pdf', 'fileid': 120904, 'hash': '3dcac44fb7295619d91b89a5227557ea', 'filename': 'JTAF 7 No 1 p 29-34.pdf', 'hash_type': 'MD5', 'mtime': '2019-08-19 02:57:31'}], 'docid': 26886, 'main': 'JTAF 7 No 1 p 29-34.pdf', 'uri': 'http://repository.lppm.unila.ac.id/id/document/26886', 'rev_number': 1, 'format': 'text', 'pos': 1}]",Jurusan Fisika FMIPA Universitas Lampung,['FMIPA1'],article,disk0/00/01/38/57,2019-01-31 00:00:00.000000000,,Jurnal Teori dan Aplikasi Fisika,"[{'name': {'family': 'Leni', 'honourific': None, 'lineage': None, 'given': 'Rumiyanti'}, 'id': 'lenirumiyanti@fmipa.unila.ac.id'}, {'name': {'family': 'Yuliana', 'honourific': None, 'lineage': None, 'given': 'Sari'}, 'id': None}, {'name': {'given': 'Amin', 'honourific': None, 'family': 'Muhamad', 'lineage': None}, 'id': None}]",2303-016X,,29-34,,"['Universitas Lampung', 'Universitas Lampung', 'Balai Penelitian Teknologi Material LIPI Lampung Selatan']",published,,,,,,,,,,,,,
20,['QC'],"Abstract. Research has been conducted on a phytochemical screening of soursop leaf extract (Annona muricata) and its effect on the corrosion rate of ST 37 carbon steel. Extraction of soursop leaves was carried out by the maceration method, while corrosion rate testing was carried out by weight loss method. ST 37 carbon immersion was carried out for 10 days with 7 variations of concentration, namely 0%, 5%, 10%, 15%, 20%, 25%, 30%, and 35%. The results of phytochemical screening showed that the soursop leaf extract contained saponins, triterpenoids, tannins, alkaloids, and flavonoids. The greatest corrosion rate was obtained at a concentration of 0%, which was 1.3 x 104 mm / y, while the lowest corrosion rate was at a concentration of 30%, which was 0.032 x 104 mm / y. The greatest corrosion inhibition efficiency occurred at a concentration of 35% at 97.53%. Based on the results of the reaserch, it can be concluded that the higher the concentration of soursop leaf extract used, the lower the corrosion rate and the higher the inhibition efficiency of the corrosion
Keywords: ST 37 carbon steel, soursop leaf extract, corrosion rate, phytochemical screening",2019-11-04 08:09:47,archive,7.0,9,show,Skrinning Fitokimia Ekstrak Daun Sirsak (Annona muricata) Dan Pengaruhnya Terhadap Laju Korosi Baja Karbon ST 37,http://jurnal.fmipa.unila.ac.id/jtaf/article/view/1917,15190,2019-11-04 08:09:47,2019-11-04 08:09:47,633,public,http://repository.lppm.unila.ac.id/id/eprint/15190,TRUE,pub,1.0,"[{'rev_number': 1, 'uri': 'http://repository.lppm.unila.ac.id/id/document/28332', 'format': 'text', 'pos': 1, 'files': [{'datasetid': 'document', 'filesize': 702724, 'fileid': 130720, 'mime_type': 'application/pdf', 'mtime': '2019-11-04 02:47:10', 'hash_type': 'MD5', 'filename': '1917-4301-2-PB Jurnal 1.pdf', 'hash': '29ec770daab1f1d506da7eed5da5a0c3', 'objectid': 28332, 'uri': 'http://repository.lppm.unila.ac.id/id/file/130720'}], 'docid': 28332, 'main': '1917-4301-2-PB Jurnal 1.pdf', 'language': 'en', 'mime_type': 'application/pdf', 'security': 'public', 'placement': 1, 'eprintid': 15190}]",Lampung University,['FMIPA1'],article,disk0/00/01/51/90,2019-01-02 00:00:00.000000000,,Jurnal Teori dan Aplikasi Fisika,"[{'id': None, 'name': {'lineage': None, 'honourific': None, 'family': 'Leni Rumiyanti', 'given': 'LR'}}, {'name': {'given': 'AR', 'lineage': None, 'family': 'Amilia Rasitiani', 'honourific': None}, 'id': None}, {'name': {'family': 'Ediman Ginting Suka', 'honourific': None, 'lineage': None, 'given': 'EGS'}, 'id': 'gintingediman@gmail.com'}]",ISSN 2303-016X,,1-6,,,published,,,,,,,,,,,,,
21,['QC'],"Corrosion inhibition of low carbon API 5L by cocoa peel extract (Theobroma cacao) in corrosive medium of natrium chloride and hydrochloride acid of 3% has been investigated. The test was carried out by weight loss method. Corrosion rate was tested on low carbon steel with and without the tea leaves extract for 4 days with concentration of 0, 500, 1000, and 1500 ppm. The research result show that the more percentage of cocoa peels inhibitor extract, the lower corrosion rate so that capability of inhibition will increase. The biggest inhibition efficiency corrosion occurred at concentrations of 1500 ppm in NaCl and HCl with efficiency of 93,39% and 73,6% respectively. The X-Ray Diffraction (XRD) result shows that the phase was Fe. Scanning Electron Microscopy (SEM) shows that the grain size and cluster is bigger, hole and crack also shows is lower of with inhibitor than without inhibitor. Energy Dispersive Spectroscopy (EDS) shows that there is Cl element on sample without inhibitor.",2019-11-04 08:10:15,archive,7.0,7,show,"Pengaruh Penambahan Inhibitor Ekstrak Kulit Kakao (Theobroma Cacao) terhadap Laju Korosi Baja Api
5 L pada Medium NaCl 3% dan HCl 3%",http://jurnal.fmipa.unila.ac.id/jtaf,15236,2019-11-04 08:10:15,2019-11-04 08:10:15,633,public,http://repository.lppm.unila.ac.id/id/eprint/15236,TRUE,pub,1.0,"[{'rev_number': 1, 'uri': 'http://repository.lppm.unila.ac.id/id/document/28371', 'format': 'text', 'pos': 1, 'files': [{'datasetid': 'document', 'filesize': 891026, 'fileid': 131120, 'mime_type': 'application/pdf', 'mtime': '2019-11-04 04:16:54', 'hash_type': 'MD5', 'hash': '4feea85da0fffd571a7d9f900977ad5b', 'filename': '1924-4308-1-PB.pdf', 'objectid': 28371, 'uri': 'http://repository.lppm.unila.ac.id/id/file/131120'}], 'main': '1924-4308-1-PB.pdf', 'docid': 28371, 'language': 'en', 'mime_type': 'application/pdf', 'security': 'public', 'placement': 1, 'eprintid': 15236}]",Jurusan Fisika FMIPA Universitas Lampung,['FMIPA1'],article,disk0/00/01/52/36,2019-01-31 00:00:00.000000000,http://dx.doi.org/10.23960%2Fjtaf.v7i1.1924,Jurnal Teori dan Aplikasi Fisika,"[{'name': {'lineage': None, 'honourific': None, 'family': 'Liyana', 'given': 'Mardova'}}, {'name': {'honourific': None, 'family': 'Ediman', 'lineage': None, 'given': 'Ginting Suka'}}, {'name': {'given': 'Sembiring', 'family': 'Simon', 'honourific': None, 'lineage': None}}]",2303-016X,,45-54,,"['Universitas Lampung', 'Universitas Lampung', 'Universitas Lampung']",published,,,,,,,,,,,,,
22,['QC'],,2019-11-04 07:51:39,archive,1.0,8,show,Analisis Data Difraksi Sinar-X,http://www.aura-publishing.com,15261,2019-11-04 07:51:39,2019-11-04 07:51:39,781,public,http://repository.lppm.unila.ac.id/id/eprint/15261,TRUE,pub,1.0,"[{'pos': 1, 'format': 'text', 'rev_number': 1, 'uri': 'http://repository.lppm.unila.ac.id/id/document/28395', 'main': 'Kover buku XRD 2019_3.pdf', 'docid': 28395, 'files': [{'datasetid': 'document', 'filesize': 154128, 'fileid': 131283, 'mime_type': 'application/pdf', 'hash_type': 'MD5', 'mtime': '2019-11-04 05:18:50', 'hash': '3b66a0217a432815a9c539ff8870f68f', 'filename': 'Kover buku XRD 2019_3.pdf', 'objectid': 28395, 'uri': 'http://repository.lppm.unila.ac.id/id/file/131283'}], 'language': 'en', 'mime_type': 'application/pdf', 'eprintid': 15261, 'placement': 1, 'security': 'public'}]",AURA Publishing,['FMIPA1'],book,disk0/00/01/52/61,2019-03-01 00:00:00.000000000,,,"[{'name': {'lineage': None, 'family': 'Manurung', 'honourific': None, 'given': 'Posman'}, 'id': 'reip65@yahoo.com'}]",,,,,,published,,,,,,"[{'url': 'http://www.aura-publishing.com', 'type': 'pub'}]",157.0,Bandarlampung,9786232110434.0,,,,
23,['QC'],"Abstract. Physical properties of polyethylene (PE)/ nanotitania composite as a function of thickness have
been studied. The material used is PE and nanotitania. The blending of PE with nanotitania was carried out
by melting polyethylene at 95 °C for 5 minutes then added nanotitania 5 wt% and 10 wt% and heated at 124
° C for 30 minutes. Then printed using barcoater with size 6, 12 and 25 μm with four repetitions. Variations
were performed to determine the effect of composite thickness of polyethylene/nanotitania on electrical
properties and functional groups. FTIR results show that as the thickness of the absorption sample increases,
new functional groups appear, namely hydroxyl and carbonyl. The LCR results show the smallest
conductivity value, sample 5 wt% PE / nanotitania with 6 μm size and the largest 10% PE/nanotitania
sample with a size of 25 μm each at 2,302 x 10-5 S/m and 3,121 x 10-5 S/m at a frequency of 105 Hz. While the
largest dielectric constant value is a sample of PE/nanotitania 5 wt% with a size of 6 μm and the smallest
sample PE/nanotitania 10 wt% with a size of 6 μm at a frequency of 105 Hz. Based on these characteristics,
the 5 wt% PE/nanotitania sample with a size of 6 μm is the material with the best dielectric properties so that
the sample has the potential to be used as a cable insulator.
Key words. composite, PE, TiO2, conductivity and dielectric constant.",2019-11-04 08:13:49,archive,7.0,6,show,"The Physical Properties of Polyethylene/Nanotitania
Composites as Thickness Function",https://jurnal.fmipa.unila.ac.id/jtaf/,15245,2019-11-04 08:13:49,2019-11-04 08:13:49,781,public,http://repository.lppm.unila.ac.id/id/eprint/15245,TRUE,pub,1.0,"[{'mime_type': 'application/pdf', 'language': 'en', 'security': 'public', 'placement': 1, 'eprintid': 15245, 'rev_number': 1, 'uri': 'http://repository.lppm.unila.ac.id/id/document/28382', 'format': 'text', 'pos': 1, 'files': [{'filesize': 207676, 'datasetid': 'document', 'hash': '703aa826ada36be8db83f5647458c366', 'filename': 'Nola.pdf', 'mtime': '2019-11-04 04:38:18', 'hash_type': 'MD5', 'mime_type': 'application/pdf', 'fileid': 131195, 'uri': 'http://repository.lppm.unila.ac.id/id/file/131195', 'objectid': 28382}], 'docid': 28382, 'main': 'Nola.pdf'}]",Jurusan Fisika FMIPA Universitas Lampung,['FMIPA1'],article,disk0/00/01/52/45,2019-01-01 00:00:00.000000000,http://dx.doi.org/10.23960%2Fjtaf.v7i1.1930,Jurnal Teori dan Aplikasi Fisika,"[{'name': {'given': 'Posman', 'family': 'Manurung', 'honourific': None, 'lineage': None}, 'id': 'reip65@yahoo.com'}, {'id': 'fricilianola@gmail.com', 'name': {'lineage': None, 'family': 'Fricilia', 'honourific': None, 'given': 'Nola'}}, {'name': {'family': 'Riyanto', 'honourific': None, 'lineage': None, 'given': 'Agus'}, 'id': 'agus.riyanto@fmipa.unila.ac.id'}]",2303-016X,,83-90,,,published,,,,,,[{'url': 'https://jurnal.fmipa.unila.ac.id/jtaf/article/view/1930'}],,,,,,,
24,['QC'],"Abstract. Synthesis of sulfur doped titania (S-TiO2) was carried out through sol-gel method. Titanium isopropoxide (TTIP), tween-80, isopropanol and sulfuric acid (H2SO4) as a source of sulfur doping were used as raw material. The aimed of this research is to study the effect of the rate of sulfur doping injection by using an injection pump toward S-TiO2 photocatalyst activity. Titania was calcined at temperatur of 450 oC for 5 hours. The sintered samples were tested for photodegradation of remazol yellow under UV irradiation. Physical characteristics were analyzed using transmission electron microscopy (TEM) and UV-Vis Spectrophotometer. The result of the UV-Vis spectrophotometer showed that the rate of sulfur doping injection has an effect on increasing photocatalysts activity of TiO2. Maximum photocatalysts activity was obtained in sample with an injection rate of 4 ml/30 minutes with the particle size is (7,1 nm ± 1,9 nm).
Keywords: photodegradation, remazol yellow, sulfur doped, titania.",2019-11-04 08:14:29,archive,7.0,6,show,Pengaruh Laju Injeksi Doping Sulfur terhadap Aktivitas Fotokatalis Nanotitania Menggunakan Metode Sol Gel,http://jurnal.fmipa.unila.ac.id/jtaf/issue/view/96,15289,2019-11-04 08:14:29,2019-11-04 08:14:29,949,public,http://repository.lppm.unila.ac.id/id/eprint/15289,TRUE,pub,2.0,"[{'uri': 'http://repository.lppm.unila.ac.id/id/document/28424', 'rev_number': 1, 'pos': 1, 'format': 'text', 'files': [{'uri': 'http://repository.lppm.unila.ac.id/id/file/131694', 'objectid': 28424, 'hash': 'ae2a44b7caa4aeaad5e81c21699eb0a1', 'filename': 'jurnal 1.pdf', 'hash_type': 'MD5', 'mtime': '2019-11-04 06:25:47', 'mime_type': 'application/pdf', 'fileid': 131694, 'filesize': 334687, 'datasetid': 'document'}], 'docid': 28424, 'main': 'jurnal 1.pdf', 'language': 'en', 'mime_type': 'application/pdf', 'placement': 1, 'security': 'public', 'eprintid': 15289}]",Jurusan Fisika FMIPA Universitas Lampung,['FMIPA1'],article,disk0/00/01/52/89,2019-07-01 00:00:00.000000000,http://dx.doi.org/10.23960%2Fjtaf.v7i2,Jurnal Teori dan Aplikasi Fisika,"[{'id': 'reip65@yahoo.com', 'name': {'given': 'Posman', 'lineage': None, 'honourific': None, 'family': 'Manurung'}}, {'id': None, 'name': {'given': 'Pulung', 'lineage': None, 'family': 'Karo Karo', 'honourific': None}}]",2303-016X,,223-230,,,published,,,,,,,,,,,,,
25,['QC'],"Abstract. Synthesis of sulfur doped titania (S-TiO2) was carried out through sol-gel method. Titanium isopropoxide (TTIP), tween-80, isopropanol and sulfuric acid (H2SO4) as a source of sulfur doping were used as raw material. The aimed of this research is to study the effect of the rate of sulfur doping injection by using an injection pump toward S-TiO2 photocatalyst activity. Titania was calcined at temperatur of 450 oC for 5 hours. The sintered samples were tested for photodegradation of remazol yellow under UV irradiation. Physical characteristics were analyzed using transmission electron microscopy (TEM) and UV-Vis Spectrophotometer. The result of the UV-Vis spectrophotometer showed that the rate of sulfur doping injection has an effect on increasing photocatalysts activity of TiO2. Maximum photocatalysts activity was obtained in sample with an injection rate of 4 ml/30 minutes with the particle size is (7,1 nm ± 1,9 nm).
Keywords: photodegradation, remazol yellow, sulfur doped, titania.",2019-11-04 08:14:37,archive,7.0,6,show,Pengaruh Laju Injeksi Doping Sulfur terhadap Aktivitas Fotokatalis Nanotitania Menggunakan Metode Sol Gel,http://jurnal.fmipa.unila.ac.id/jtaf/issue/view/96,15304,2019-11-04 08:14:37,2019-11-04 08:14:37,949,public,http://repository.lppm.unila.ac.id/id/eprint/15304,TRUE,pub,2.0,"[{'mime_type': 'application/pdf', 'language': 'en', 'eprintid': 15304, 'security': 'public', 'placement': 1, 'format': 'text', 'pos': 1, 'uri': 'http://repository.lppm.unila.ac.id/id/document/28441', 'rev_number': 1, 'main': 'Jurnal 3.pdf', 'docid': 28441, 'files': [{'mime_type': 'application/pdf', 'fileid': 131799, 'filename': 'Jurnal 3.pdf', 'hash': '8e476ccb07d54997095531aa8c609e69', 'mtime': '2019-11-04 06:54:15', 'hash_type': 'MD5', 'datasetid': 'document', 'filesize': 334687, 'objectid': 28441, 'uri': 'http://repository.lppm.unila.ac.id/id/file/131799'}]}]",Jurusan Fisika FMIPA Universitas Lampung,['FMIPA1'],article,disk0/00/01/53/04,2019-07-01 00:00:00.000000000,http://dx.doi.org/10.23960%2Fjtaf.v7i2,Jurnal Teori dan Aplikasi Fisika,"[{'name': {'given': 'Posman', 'lineage': None, 'family': 'Manurung', 'honourific': None}, 'id': 'reip65@yahoo.com'}, {'name': {'given': 'Pulung', 'family': 'Karo Karo', 'honourific': None, 'lineage': None}, 'id': None}]",2303-016X,,223-230,,,published,,,,,,,,,,,,,
