,subjects,abstract,status_changed,eprint_status,volume,rev_number,metadata_visibility,title,official_url,eprintid,datestamp,lastmod,userid,full_text_status,uri,refereed,ispublished,number,documents,publisher,divisions,type,dir,date,id_number,publication,creators,issn,contact_email,pagerange,referencetext,corp_creators,date_type,event_dates,event_type,event_location,event_title,pres_type,related_url,pages,place_of_pub,isbn,contributors,succeeds,funders,projects
43,['QC'],"This study aims to investigate the effect of sintering temperatures on both the phase formation and physical characteristics of forsterite prepared from rice husk silica and magnesium nitrate hydrate. The samples were subjected to sintering temperatures of 1000–1300 °C, and the development of structures was characterized using Fourier transform infrared (FTIR) spectroscopy, X-ray diffraction (XRD), and scanning electron microscopy (SEM). Some physical properties include density, porosity, hardness, bending strength, and thermal expansion coefficient of the samples were measured. It is concluded that forsterite formation started at 1000 °C, and its abundance increased slowly from an increased temperature up to 1300 °C, resulting in increased phase contents from 87.7 to 90.0 wt%. Thermal expansion coefficient of the samples with increasing temperature of sintering from 1100 to 1300 °C reaches the relatively constant value of 9.1 × 10−6/°C, with the main crystalline phase being forsterite.",2021-03-18 09:53:22,archive,5.0,4,show,Effect of sintering temperature on the structural and physical properties of forsterite using amorphous rice husk silica as refractory precursors,https://link.springer.com/article/10.1007%2Fs41779-019-00346-2,28458,2021-03-18 09:53:22,2021-03-18 09:53:22,1042,public,http://repository.lppm.unila.ac.id/id/eprint/28458,TRUE,pub,2.0,"[{'files': [{'uri': 'http://repository.lppm.unila.ac.id/id/file/252812', 'objectid': 42506, 'filesize': 2215762, 'datasetid': 'document', 'mtime': '2021-03-17 08:19:11', 'hash_type': 'MD5', 'hash': '89d918288b7157b748ce9988b9526a29', 'filename': 'Australian Ceramic 2020.pdf', 'fileid': 252812, 'mime_type': 'application/pdf'}], 'docid': 42506, 'main': 'Australian Ceramic 2020.pdf', 'uri': 'http://repository.lppm.unila.ac.id/id/document/42506', 'rev_number': 2, 'format': 'text', 'pos': 1, 'security': 'public', 'placement': 1, 'eprintid': 28458, 'mime_type': 'application/pdf', 'language': 'en'}]",Springer,['FMIPA1'],article,disk0/00/02/84/58,2019-04-17 00:00:00.000000000,https://doi.org/10.1007/s41779-019-00346-2,Journal of the Australian Ceramic Society,"[{'name': {'lineage': None, 'family': 'Sembiring', 'honourific': None, 'given': 'Simon'}, 'id': 'simon.sembiring@fmipa.'}, {'id': 'agus.riyanto@fmipa.unila.ac.id', 'name': {'given': 'Agus', 'honourific': None, 'family': 'Riyanto', 'lineage': None}}, {'id': 'lenirumiyanti@unila.ac.id', 'name': {'given': 'Leni', 'lineage': None, 'honourific': None, 'family': 'Rumiyanti'}}, {'name': {'given': 'Zipora', 'lineage': None, 'family': 'Sembiring', 'honourific': None}, 'id': 'zipora_sembiring@yahoo.com'}, {'name': {'given': 'Rudy T.M', 'family': 'Situmeang', 'honourific': None, 'lineage': None}, 'id': 'rudy.tahan@fmipa.unila.ac.id'}]",2510-1560,,433-440,"1. Deer, W.A., Howie, R.A., Zussman, J.: An Introduction to the
Rock-Forming Minerals, 2nd edn. Pearson, London (1992)
2. Ye, Y., Schwering, R.A., Smyth, J.R.: Effects of hydration on ther�mal expansion of forsterite, wadsleyite, and ringwoodite at ambient
pressure. Am. Mineral. 94(7), 899–904 (2009)
3. Saberi, A., Alinejad, B., Negahdari, Z., Kazemi, F., Almasi, A.: A
novel method to low temperature synthesis of nanocrystalline
forsterite. Mater. Res. Bull. 42(4), 666–673 (2007)
4. Diesperova, M., Bron, V.A., Perepelitsyn, V.A., Boriskova, T.L.,
Alekseeva, V.A., and Kelareva, E.I.: Forsterite refractories from
the dunites of the kytlym deposits. Refrac. Indus. Ceram.18, 278–
282 (1997)
5. Mitchell, M.B.D., Jackson, D., James, P.F.: Preparation and charac�terization of forsterite (Mg2SiO4) xerogels. Sol Gel Sci Technol. 13,
359–364 (1998)
6. Ghomi, H., Jaberzadeh, M., Fathi, M.H.: Novel fabrication of
forsterite scaffold with improved mechanical properties. Alloys
Compd. 509(5), L63–L68 (2011)
7. Tavangarian, F., Emadi, R.: Mechanical activation assisted synthe�sis of pure nanocrystalline forsterite powder. Alloys Compd. 485,
648–652 (2009)
8. Martin, M.H.E., Ober, C.K., Hubbard, C.R., Porter, W.D., Cavin,
O.B.: Poly(methacrylate) precursors to forsterite. Am Ceram Soc.
75, 1831–1838 (1992)
9. Ni, S., Chou, L., Chiang, J.: Preparation and characterization of
forsterite (Mg2SiO4) bioceramics. Ceram. Int. 33, 83–88 (2007)
10. Fathi, M.H., Kharaziha, M.: Two-step sintering of dense,
nanostructural forsterite. Mater. Lett. 63(17), 1455–1458 (2009)
11. Mustafa, E., Khalil, N., Gamal, A.: Sintering and microstructure of
spinel-forsterite bodies. Ceram. Int. 28, 663–667 (2002)
12. Sasikala, T.S., Suma, M.N., Mohanan, P., Pavithran, C., Sebastian,
M.T.: Forsterite-based ceramic-glass composites for substrate appli�cations in microwave and millimeter wave communications. Alloys
Compd. 461, 555–559 (2008)
13. Amista, P., Cesari, M., Montenero, A., Gnappi, G., Lan, L.:
Crystallization behaviour in the system MgO-Al2O3-SiO2. Non�Crystal Solids 192&193, 529–533 (1992)
14. Hu, Y., Tsai, H.T.: Compositional effect on the crystallization of the
cordierite-type glasses. Mater. Sci. 36, 123–129 (2001)
15. Lacerda, S.R., Oliveira, J.M., Correia, R.N., Fernandes, M.H.V.:
TiO-induced phase separation and crystallization in SiO2-
3Ca·P2O5-MgO glass. Non-Crystal Solids. 221, 55–60 (1997)
16. Khater, G.: Crystallizing phases from multi-component silicate
glasses in the system K2O-CaO-MgO-Al2O3–SiO2. Ceram. Int.
27, 661–668 (2011)
17. Demirci, Y., Günay, E.: Crystallization behavior and properties of
cordierite glass-ceramics with added boron oxide. Ceram Proc Res.
12, 352–356 (2001)
18. Lee, K.Y.S., Chin, K.M.C., Ramesh, S., Tan, C.Y., Teng, W.D.,
Sopyan, I.: Characterization of forsterite bioceramics. Adv. Mater.
Res. 576, 195–198 (2012)
19. Lee, Y.S.K., Chin, K.M.C., Ramesha, S., Purbolaksonoa, J.,
Hassana, M.A., Hamdia, M., Teng, T.D.: Characterization of
forsterite ceramics. Ceram. Proc.Res. 14(1), 131–133 (2013)
20. Haslinawati, M.M., Matori, K.A., Wahab, Z.A., Sidek, H.A.A.,
Zainal, A.T.: Effect of temperature on ceramic from rice husk ash.
Int Basic Appl Sci. 09(09), 22–25 (2009)
21. Rafiee, E., Shahebrahimi, S., Feyzi, M., Shaterzadeh, M.:
Optimization of synthesis and characterization of nanosilica pro�duced from rice husk (a common waste material). Int Nano Lett.
2(29), 1–8 (2012)
22. Ugheoke, B.I., Mamat, O.: A novel method for high volume pro�duction of nano silica from rice husk: process development and
product characteristics. Mater Engg Innov. 3(2), 139–155 (2012)
23. Amutha, K., Ravibaskar, R., Sivakumar, G.: Extraction, synthesis
and characterization of nanosilica from rice husk ash. Nano Technol
Appl. 4(1), 61–66 (2011)
24. Liou, T.H., Yang, C.C.: Synthesis and surface characteristics of
nanosilica produced from alkali-extracted rice husk ash. Mater.
Sci. Eng. B. 176, 521–529 (2011)
25. Kordatos, K., Gavela, S., Ntziouni, A., Pistiolas, K.N., Kyritsi, A.,
Kasselouri-Rigopoulou, V.: Synthesis of highly siliceous ZSM-5
zeolite using silica from rice husk ash. Microporous Mesoporous
Mater. 115(1–2), 189–196 (2008)
26. Nayak, J.P., Bera, J.: Preparation of silica aerogel by ambient pres�sure drying process using rice husk ash as raw material. Trans Indus
Ceram Soc. 68(1–4), (2009)
27. Nayak, J.P., Kumar, S., Bera, J.: Sol-gel synthesis of bioglass�ceramics using rice husk ash as a source for silica and its charac�terization. Non-Crystal Solids. 356, 1447–1451 (2010)
28. Watari, T., Nakata, A., Kiba, Y., Torikai, T., Yada, M.: Fabrication
of porous SiO2/C composite from rice husks. Eur CeramSoc. 26,
797–801 (2006)
29. Martín, M.I., Andreola, F., Barbieri, L., Bondioli, F., Lancellotti, I.,
Rincón, J.M., Romero, M.: Crystallisation and microstructure of
nepheline-forsterite glass-ceramics. Ceram. Int. 39, 2955–2966
(2013)
30. Ngun, B.K., Mohamad, H., Sakai, E., Ahmad, Z.A.: Effect of rice
husk ash and silica fume in ternary system on the properties of
blended cement paste and concrete. Ceram. Proc. Res. 11, 311–
315 (2010)
31. Naskar, M.K., Chatterjee, M.: A novel process for the synthesis of
cordierite (Mg2Al4Si5O18) powders from rice husk ash and other
sources of silica and their comparative study. Eur Ceram Soc 2004;
24, 3499–3508 (2004)
32. Hossain, S.K.S., Mathur, L., Singh, P., Majhi, M.R.: Preparation of
forsterite refractory using highly abundant amorphous rice husk
silica for thermal insulation. JasCerS. 5, 82–87 (2017)
33. Sembiring, S., Riyanto, A., Simanjuntak, W., and Situmeang, R.:
Effect of MgO-SiO2 ratio on the forsterite (Mg2SiO4) precursors
characteristics derived from amorphous rice husk silica. Orient
Chem 33 [4], 186–192 (2017)
34. Australian Standard. Refractories and refractory material physical
test methods: the determination of density, porosity and water ad�sorption. 1–4, 1774 (1989)
35. Adam, F., Chua, J.H.: The adsorption of palmitic acid on rice husk
ash chemically modified with Al(III) ion using the sol–gel tech�nique. Coll Interf Sci. 280(1), 55–61 (2004)
36. Kharaziha, M., Fathi, M.M.: Synthesis and charaterisation of bio�active forsterite nanopowder. Ceram. Int. 35, 2449–2454 (2009)
37. Powder Diffraction File (Type PDF-2): Diffraction Data for XRD
Identification. International Centre for Diffraction Data, PA, USA
(1997)
38. Tavangarian, F., Emadi, R., Shafyei, A.: Influence of mechanical
activation and thermal treatment time on nanoparticle forsterite for�mation mechanism. Powder Technol. 198(3), 412–416 (2010)
39. Rani, A.B., Annamalai, A.R., Majhi, M.R., Kumar, A.H.: Synthesis
and characterization of forsterite refractory by doping with kaolin.
Inter. ChemTech Res. CODEN( USA). 6(2), 1390–1397 (2014)
40. Kisi, E.H.: Rietveld analysis of powder diffraction patterns.
Mater.Forum. 18, 135–153 (1994)
41. Ono, T., Matsumaru, K., Juarez-Ramirez, J., Leticia, M., Torres�Martinez, Ishizaki, K.: Development of porous material with high
Young’s modulus and low thermal expansion coefficient in SiC�vitrified bonding material-LiAlSiO4 system. Mater Sci Forum.
620-622, 715–718 (2009)
42. Charles, A.H.: Handbook of Ceramic Glasses and Diamonds.
McGraw Hills, Company Inc, USA (2001)
43. Hamzawy, E.M.A., Abd El Rahim, S.H., Melegy, A.A.:
Composite-like material from magnesite, fumed silica and glass
cullet Middle East. Appl. Sci. 4(3), 455–459 (2014)
44. Buchanan, R.C.: Ceramic Materials for Electronics, 3d edn.
University of Cincinnati, Cincinnati (2004)",,published,,,,,,,,,,,28446.0,,
44,['QC'],"The composites were prepared with a ratio of bitumen to silica of 1:0, 1:1.5, 1:1.6, 1: 1.7, 1:1.8, 1:1.9 and 1:2 by weight,
and calcined at the temperature of 150 °C for 6 hours. The structural and microstructural characteristics of the bituminous
composites were examined by X-ray diffraction (XRD), Fourier Transform Infrared (FTIR), Differential Thermal Analysis
(DTA/TGA), and Scanning Electron Microscopy/Energy-Dispersive X-ray (SEM/EDX). Further evaluation was made by
comparing the characteristics of the modified bituminous composites including the density, porosity, compressive strength,
swelling thickness, and water absorption. The XRD  study revealed that the major phases were silica and carbon amorphous,
which were associated with the Si–OH, Si–O-Si and C–H functional groups according to the FTIR analysis. The DTA/TGA
analysis resulted in an increase in the temperature decomposition by adding silica which was 230 to 315 °C. In addition,
an increased silica addition was followed by an increase in the density, compressive strength, swelling thickness, and water
absorption, while the opposite was true for the porosity. Based on these characteristics, rice husk silica has a positive effect
on improving the mixture of high and low temperature performance, water stability, for use as a substitute in lightweight
steel roof devices
Keywords: Rice husk, Silica, Asphalt, Microstructure, Structure",2019-07-16 03:14:11,archive,3.0,6,show,"BITUMINOUS COMPOSITE COMPRISING AMORPHOUS SILICA
FROM RICE HUSKS",,13544,2019-07-16 03:14:11,2019-07-16 03:14:11,1042,public,http://repository.lppm.unila.ac.id/id/eprint/13544,TRUE,pub,,"[{'format': 'text', 'pos': 1, 'rev_number': 1, 'uri': 'http://repository.lppm.unila.ac.id/id/document/26554', 'docid': 26554, 'main': 'ceramic silikaty 2019.pdf', 'files': [{'mime_type': 'application/pdf', 'fileid': 118354, 'filename': 'ceramic silikaty 2019.pdf', 'hash': '547ca4a46a5f36983e73e48b3907653a', 'mtime': '2019-07-16 03:03:14', 'hash_type': 'MD5', 'datasetid': 'document', 'filesize': 3144482, 'objectid': 26554, 'uri': 'http://repository.lppm.unila.ac.id/id/file/118354'}], 'mime_type': 'application/pdf', 'language': 'en', 'eprintid': 13544, 'security': 'public', 'placement': 1}]",,['FMIPA1'],article,disk0/00/01/35/44,1970-01-01 00:00:00.000002019,,Ceramics – Silikáty  63,"[{'id': 'simon.sembiring@fmipa.', 'name': {'given': 'Simon', 'lineage': None, 'honourific': None, 'family': 'Sembiring'}}, {'name': {'given': 'Agus', 'family': 'Riyanto', 'honourific': None, 'lineage': None}, 'id': 'arfi2208@gmail.com'}, {'name': {'given': 'Rudy T.M', 'family': 'Situmeang', 'honourific': None, 'lineage': None}, 'id': 'rudy.tahan@fmipa.unila.ac.id'}, {'id': 'zipora_sembiring@yahoo.com', 'name': {'lineage': None, 'family': 'Sembiring', 'honourific': None, 'given': 'Zipora'}}]",,,,,['Universitas Lampung'],published,,,,,,,,,,,,,
45,['QC'],"Abstract. This study was conducted to determine the functional characteristics and physical properties of asphalt due to the addition of silica rice husk. Asphalt penetration 60/70 was combined with silica sourced from extracted rice husks using the sol gel method with 1.5% NaOH solvent and 10% HNO3 solvent. Comparison of asphalt and silica masses is 1: 1.8; 1: 1,9; and 1: 2, then asphalt and silica alloys are heated at 110oC for 4 hours. The results of Fourier Transform Infra-Red (FTIR) analysis showed that the O-H group was formed after the addition of silica. The functional groups seen are functional groups associated with asphalt and silica that is C-H, Si-OH, Si-O-Si, and Si-O. The results of swelling thickness and degradation physical tests (diameter, thickness, and volume) indicate that this material is quite stable. In each addition of silica the increase in increment occurs only slightly. This proves that the interaction between asphalt and silica that occurs physically and does not occur in a chemical reaction.
Keywords: Asphalt, silica rice husk, functional groups, physical properties",2019-11-04 08:14:21,archive,7.0,6,show,Karakteristik Fungsional Dan Sifat Fisis Aspal Akibat Penambahan Silika Sekam Padi,http://jurnal.fmipa.unila.ac.id/jtaf/article/view/1928/1398,15266,2019-11-04 08:14:21,2019-11-04 08:14:21,1042,public,http://repository.lppm.unila.ac.id/id/eprint/15266,TRUE,pub,1.0,"[{'uri': 'http://repository.lppm.unila.ac.id/id/document/28402', 'rev_number': 1, 'format': 'text', 'pos': 1, 'files': [{'uri': 'http://repository.lppm.unila.ac.id/id/file/131305', 'objectid': 28402, 'hash': '8c18f1961e51ecb3786106e0f3c53529', 'filename': 'Jurnal dgn Pak Wasinton.pdf', 'hash_type': 'MD5', 'mtime': '2019-11-04 05:26:00', 'mime_type': 'application/pdf', 'fileid': 131305, 'filesize': 449420, 'datasetid': 'document'}], 'main': 'Jurnal dgn Pak Wasinton.pdf', 'docid': 28402, 'language': 'en', 'mime_type': 'application/pdf', 'security': 'public', 'placement': 1, 'eprintid': 15266}]",Jurusan Fisika FMIPA Universitas Lampung,['FMIPA1'],article,disk0/00/01/52/66,2019-01-01 00:00:00.000000000,http://dx.doi.org/10.23960%2Fjtaf.v7i1.1928,Jurnal Teori dan Aplikasi Fisika,"[{'name': {'lineage': None, 'family': 'Sembiring', 'honourific': None, 'given': 'Simon'}, 'id': 'simon.sembiring@fmipa.unila.ac.ic'}, {'name': {'given': 'Wasinton', 'honourific': None, 'family': 'Simanjuntak', 'lineage': None}, 'id': 'wasinton.simanjuntak@fmipa.unila.ac.id'}]",2303-016X,,77-82,,,published,,,,,,,,,,,,,
46,['QC'],"Abstract. In this research, asphalt composite was produced by combining asphalt and rice 
husk silica. The ratio of asphalt and silica were 1:1.5; 1:1.7; and 1:1.9 respectively and
calcined at temperature of 150°C.  Functional group characteristics of asphalt composites
were examined by FTIR and XRD. The FTIR and XRD studies revealed that the main
Functional groups are Si-O-Si, C-H, and structure amorph of silica. 
Keyword: Rice Husk, Silica, Asphalt, Functional Group, FTIR",2019-04-22 03:37:28,archive,1.0,6,show,"Preliminary Study on Functional Groups
Characteristics of Asphalt Containing Rice Husk Silica",,11216,2019-04-22 03:37:28,2019-04-22 03:37:28,1042,public,http://repository.lppm.unila.ac.id/id/eprint/11216,TRUE,pub,1.0,"[{'docid': 24216, 'main': 'aspalt silica 2019.pdf', 'files': [{'fileid': 102347, 'mime_type': 'application/pdf', 'mtime': '2019-04-22 03:29:24', 'hash_type': 'MD5', 'hash': 'fc955ff90f78ebd3d604248b22290a7d', 'filename': 'aspalt silica 2019.pdf', 'datasetid': 'document', 'filesize': 781096, 'objectid': 24216, 'uri': 'http://repository.lppm.unila.ac.id/id/file/102347'}], 'format': 'text', 'pos': 1, 'rev_number': 1, 'uri': 'http://repository.lppm.unila.ac.id/id/document/24216', 'eprintid': 11216, 'security': 'public', 'placement': 1, 'mime_type': 'application/pdf', 'language': 'en'}]","Dept. of Physics, FMIPA, University of Sumatera Utara",['FMIPA1'],article,disk0/00/01/12/16,1970-01-01 00:00:00.000002019,,Journal of Technomaterials Physics,"[{'id': 'simon.sembiring@fmipa.', 'name': {'given': 'Simon', 'lineage': None, 'honourific': None, 'family': 'Sembiring'}}, {'id': 'wasinton.simanjuntak@fmipa.unila.ac.id', 'name': {'lineage': None, 'family': 'Simanjuntak', 'honourific': None, 'given': 'Wasinton'}}, {'id': 'rudy.tahan@fmipa.unila.ac.id', 'name': {'given': 'Rudy T.M', 'lineage': None, 'honourific': None, 'family': 'Situmeang'}}]",2656-0755,,61-66,,['Universitas Lampung'],published,,,,,,,,,,,,,
47,['QC'],"А refractory cordierite ceramic prepared from amorphous rice husk silica is modified by the addition of 5 wt. %
to 20 wt. % of periclase followed by a sintering treatment at a temperature of 1230 
C. The phases, the structural
changes and the microstructure characteristics of the samples are investigated by x-ray diffraction (XRD) and scanning

electron microscopy (SEM). The results obtained indicate the significant effect of the periclace addition on
the phase decomposition of cordierite into spinel and forsterite. The addition of periclace is found to increase the
presence of forsterite and decrease that of spinel. The formation of spinel and forsterite is connected with electrical
resistivity and porosity decrease  but density increase.
Keywords: cordierite, periclace, silica, rice husk, structure",2019-07-16 03:14:15,archive,54.0,6,show,"STRUCTURE AND MICROSTRUCTURE PROPERTIES
OF А REFRACTORY CORDIERITE PREPARED FROM AMORPHOUS RICE HUSK SILICA RESULTING FROM PERICLACE INTRODUCTION",,13547,2019-07-16 03:14:15,2019-07-16 03:14:15,1042,public,http://repository.lppm.unila.ac.id/id/eprint/13547,TRUE,pub,4.0,"[{'docid': 26557, 'main': 'JCTM 2019.pdf', 'files': [{'objectid': 26557, 'uri': 'http://repository.lppm.unila.ac.id/id/file/118373', 'mime_type': 'application/pdf', 'fileid': 118373, 'filename': 'JCTM 2019.pdf', 'hash': '45ebf7e79c9238d88cec4f85a2c1ca74', 'mtime': '2019-07-16 03:11:17', 'hash_type': 'MD5', 'datasetid': 'document', 'filesize': 2060012}], 'pos': 1, 'format': 'text', 'uri': 'http://repository.lppm.unila.ac.id/id/document/26557', 'rev_number': 1, 'eprintid': 13547, 'placement': 1, 'security': 'public', 'mime_type': 'application/pdf', 'language': 'en'}]",,['FMIPA1'],article,disk0/00/01/35/47,1970-01-01 00:00:00.000002019,,"Simon Sembiring, Wasinton Simanjuntak, Rudy Situmeang Journal of Chemical Technology and Metallurgy","[{'id': 'simon.sembiring@fmipa.', 'name': {'lineage': None, 'honourific': None, 'family': 'Sembiring', 'given': 'Simon'}}, {'id': 'wasinton.simanjuntak@fmipa.unila.ac.id', 'name': {'family': 'Simanjuntak', 'honourific': None, 'lineage': None, 'given': 'Wasinton'}}, {'name': {'lineage': None, 'honourific': None, 'family': 'Situmeang', 'given': 'Rudy T.M'}, 'id': 'rudy.tahan@fmipa.unila.ac.id'}]",,,721-726,,['Universitas Lampung'],published,,,,,,,,,,,,,
48,['QC'],"Abstarct. Synthesis and characterization of silica rice husk blend asphalt was carried out with a mass ratio of 1;0; 1:1,5; 1:1,6 and 1:1,7 respectively. Rice husk was prepared by sol-gel method as a raw material of silica. Asphalt and silica is mixed by using the solid-sate method, which is heated with a temperature of 110 oC for 4 hours. This study was revealed to investigate the effect of the addition of silica from rice husk on microstructure and asphalt structure. SEM results show the morphology of the asphalt surface without addition of silica which transforms elongated folds and after addition of silica shows uncertain granules more likely seems clusters with grain size (1:1,5 = 4,298 m, 1:1,6 = 3,103 m and 1:1,7 = 5,328 m) respectively. The XRD results show asphaltene amorphous phase in the asphalt sample with two peaks at 2= 18,90 and 2= 42. Furthermore, the addition of silica with asphalt able to modify two asphaltene peaks into carbon and silica amorphous peaks.
Keywords: Asphalt, silica, rice husk, asphaltene, sol gel.",2019-11-04 08:13:55,archive,7.0,6,show,"Pengaruh Penambahan Silika (Sio2) Sekam Padi Terhadap Karakteristik Mikrostruktur dan Struktur Aspal dengan Perbandingan Massa 1:0 ; 1:1,5 ; 1:1,6 dan 1:1,7",http://jurnal.fmipa.unila.ac.id/jtaf/article/view/1923/1393,15260,2019-11-04 08:13:55,2019-11-04 08:13:55,1042,public,http://repository.lppm.unila.ac.id/id/eprint/15260,TRUE,pub,1.0,"[{'placement': 1, 'security': 'public', 'eprintid': 15260, 'language': 'en', 'mime_type': 'application/pdf', 'files': [{'filename': 'Jurnal sama PAk Rudi.pdf', 'hash': '017b11120a651d4e960e2ce167ec68ac', 'hash_type': 'MD5', 'mtime': '2019-11-04 05:18:00', 'mime_type': 'application/pdf', 'fileid': 131278, 'filesize': 480356, 'datasetid': 'document', 'uri': 'http://repository.lppm.unila.ac.id/id/file/131278', 'objectid': 28394}], 'main': 'Jurnal sama PAk Rudi.pdf', 'docid': 28394, 'uri': 'http://repository.lppm.unila.ac.id/id/document/28394', 'rev_number': 1, 'pos': 1, 'format': 'text'}]",Jurusan Fisika FMIPA Universitas Lampung,['FMIPA1'],article,disk0/00/01/52/60,2019-01-01 00:00:00.000000000,http://dx.doi.org/10.23960%2Fjtaf.v7i1.1923,Jurnal Teori dan Aplikasi Fisika,"[{'id': 'simon.sembiring@fmipa.unila.ac.ic', 'name': {'family': 'Sembiring', 'honourific': None, 'lineage': None, 'given': 'Simon'}}, {'name': {'honourific': None, 'family': 'Situmeang', 'lineage': None, 'given': 'Rudy T.M'}, 'id': 'rudy.tahan@fmipa.unila.ac.id'}]",2303-016X,,39-44,,,published,,,,,,[{'url': 'http://jurnal.fmipa.unila.ac.id/jtaf/article/view/1923/1393'}],,,,,,,
49,['QC'],"In this research, asphalt composites were produced by mixing asphalt with silica extracted from rice husk, with a ratio of asphalt
to silica of 1:0, 1:1.7 and 1:2, and calcined at 150 °C. Development of structures was characterized using Fourier transform
infrared (FTIR) spectroscopy, X-ray diffraction (XRD), scanning electron microscopy (SEM), followed by differential thermal
analysis (DTA/TGA). The FTIR results showed the presence of Si-OH, C=O, and C-H functional groups, which were associated
with asphaltene, carbon, and silica, according to the XRD analysis. The results obtained also indicated the significant effect of
rice husk silica addition on phase transformation of asphaltene into silica and carbon, while asphaltene molecules were practically
undetected. The presence of silica and carbon resulted in increased decomposition temperature of the sample. Based on these
characteristics, the samples were considered as a roof material, suggesting their potential use as a substitute for lightweight steel
roof devices.
Keywords: rice husk, silica, asphalt, structure, thermal behavior.",2019-07-16 03:14:13,archive,65.0,6,show,"Synthesis and characterization of asphalt composite
precursors using amorphous rice husk silica",,13546,2019-07-16 03:14:13,2019-07-16 03:14:13,1042,public,http://repository.lppm.unila.ac.id/id/eprint/13546,TRUE,pub,,"[{'files': [{'objectid': 26556, 'uri': 'http://repository.lppm.unila.ac.id/id/file/118363', 'datasetid': 'document', 'filesize': 2765767, 'fileid': 118363, 'mime_type': 'application/pdf', 'hash_type': 'MD5', 'mtime': '2019-07-16 03:07:16', 'filename': 'ceramica 2019.pdf', 'hash': '4e067622fb4341d2d1f6f8ea27c1a618'}], 'main': 'ceramica 2019.pdf', 'docid': 26556, 'uri': 'http://repository.lppm.unila.ac.id/id/document/26556', 'rev_number': 1, 'pos': 1, 'format': 'text', 'placement': 1, 'security': 'public', 'eprintid': 13546, 'mime_type': 'application/pdf', 'language': 'en'}]",ÓRGÃO OFICIAL DA ASSOCIAÇÃO BRASILEIRA DE CERÂMICA,['FMIPA1'],article,disk0/00/01/35/46,1970-01-01 00:00:00.000002019,,Cerâmica,"[{'name': {'family': 'Sembiring', 'honourific': None, 'lineage': None, 'given': 'Simon'}, 'id': 'simon.sembiring@fmipa.'}, {'name': {'family': 'Situmeang', 'honourific': None, 'lineage': None, 'given': 'Rudy T.M'}, 'id': 'rudy.tahan@fmipa.unila.ac.id'}, {'name': {'given': 'Zipora', 'lineage': None, 'honourific': None, 'family': 'Sembiring'}, 'id': 'zipora_sembiring@yahoo.com'}]",0366-6913,,,,['Universitas Lampung'],published,,,,,,,,,,,,,
