,subjects,abstract,status_changed,eprint_status,volume,rev_number,metadata_visibility,title,official_url,eprintid,datestamp,lastmod,userid,full_text_status,uri,refereed,ispublished,number,documents,publisher,divisions,type,dir,date,id_number,publication,creators,issn,contact_email,pagerange,referencetext,corp_creators,date_type,event_dates,event_type,event_location,event_title,pres_type,related_url,pages,place_of_pub,isbn,contributors,succeeds,funders,projects
34,['QC'],"Telah dilakukan penelitian tentang pengaruh waktu sintering terhadap tingkat kemurnian fase superkonduktor BPSCCO-2223 pada kadar Ca 2,10 menggunakan metode pencampuran basah. Sintesis dilakukan dengan pelarutan HNO3 dan aquades secara perlahan kemudian dilakukan pengeringan dengan suhu 300, 400, dan 600 ℃ secara bertahap. Sampel dikalsinasi selama 10 jam pada suhu 800 ℃ dan disintering dengan variasi waktu 10, 20, 30, dan 40 jam pada suhu 865℃. Variasi dilakukan untuk mengetahui pengaruh waktu sintering terhadap kemurnian fase superkonduktor. Hasil XRD menunjukkan penurunan kemurnian fase seiring bertambahnya waktu sintering. Fraksi volume yang relatif tinggi pada sampel BPSCCO-2223/ts10 sebesar 88,88%. Sedangkan fraksi volume terendah adalah BPSCCO-2223/ts40 sebesar 71,51%. Derajat orientasi yang relatif tinggi pada sampel BPSCCO-2223/ts30 sebesar 33,76%. Sementara, derajat orientasi terendah BPSCCO-2223/ts20 sebesar 22,21%. Hasil SEM menunjukkan bahwa semua sampel telah memiliki lapisan-lapisan yang tersusun (terorientasi) dengan ruang kosong antara lempengan (void) relatif kecil.",2019-05-14 08:22:16,archive,7.0,6,show,"Pengaruh waktu sintering  Terhadap tingkat kemurnian fase Superkonduktor BPSCCO-2223 dengan Kadar Ca 2,10 Menggunakan Metode Pencampuran Basah",http://jurnal.fmipa.unila.ac.id/jtaf/issue/view/89,12806,2019-05-14 08:22:16,2019-05-14 08:22:16,490,public,http://repository.lppm.unila.ac.id/id/eprint/12806,TRUE,pub,1.0,"[{'mime_type': 'application/pdf', 'language': 'en', 'security': 'public', 'placement': 1, 'eprintid': 12806, 'rev_number': 1, 'uri': 'http://repository.lppm.unila.ac.id/id/document/25779', 'format': 'text', 'pos': 1, 'files': [{'mime_type': 'application/pdf', 'fileid': 112970, 'filename': '1931-4314-1-PB.pdf', 'hash': 'c296a2ce065f875d7be8a4949eb786f7', 'mtime': '2019-05-13 07:12:42', 'hash_type': 'MD5', 'datasetid': 'document', 'filesize': 688600, 'objectid': 25779, 'uri': 'http://repository.lppm.unila.ac.id/id/file/112970'}], 'main': '1931-4314-1-PB.pdf', 'docid': 25779}]",Universitas Lampung,['FMIPA1'],article,disk0/00/01/28/06,2019-01-01 00:00:00.000000000,1931-4314-1-PB,Jurnal Teori dan Aplikasi Fisika,"[{'id': 'isnainirahayu2965.ir@gmail.com', 'name': {'lineage': None, 'honourific': None, 'family': 'Rahayu', 'given': 'Isnaini'}}, {'name': {'honourific': None, 'family': 'Suprihatin', 'lineage': None, 'given': 'Suprihatin'}, 'id': 'suprihatin.1973@fmipa.unila.ac.id'}, {'name': {'given': 'Agus', 'family': 'Riyanto', 'honourific': None, 'lineage': None}, 'id': 'agus.riyanto@fmipa.unila.ac.id'}]",2303-016X,,91-97,,,published,,,,,,,,,,,,,
35,['QC'],"Research about the effect of sintering time on the phase purity level of superconductor BPSCCO-
2223 at the level of Ca 2,10 has been synthesized using the wet-mixing method. Synthesis carried out by
slowly dissolving HNO3 and aquades then gradually for 40 hours dried out at a temperature of 300, 400, 600
°C. The sample was calcined for 10 hours at 800 °C and sintered using variations of time 10, 20, 30, and 40
hours at 865°C. Variations were carried out to determine the effect of sintering time on the purification of the
superconductor. XRD result shows a decrease in phase purity with increasing the sintering time. Volume
fraction that is relatively high at BPSCCO-2223/ts10 is 88,88%. While the lowest volume fraction of
BPSCCO-2223/ts40 is 71,51%. The relative high orientation degree of BPSCCO-2223/ts30 is 33,76% and
the lowest orientation degree of BPSCCO-2223/ts20 is 22,21%. The SEM result shows that all samples have
layers arranged (oriented) by empty spaces between the plate (void) is relatively small.",2019-11-04 03:39:24,archive,7.0,6,show,"Pengaruh waktu sintering Terhadap tingkat kemurnian fase
Superkonduktor BPSCCO-2223 dengan Kadar Ca 2,10
Menggunakan Metode Pencampuran Basah",,14788,2019-11-04 03:39:24,2019-11-04 03:39:24,1168,public,http://repository.lppm.unila.ac.id/id/eprint/14788,TRUE,pub,1.0,"[{'main': '1931-4314-1-PB_compressed.pdf', 'docid': 27913, 'files': [{'mime_type': 'application/pdf', 'fileid': 127868, 'filename': '1931-4314-1-PB_compressed.pdf', 'hash': 'b96d19655634835e3104a8a5afda238c', 'hash_type': 'MD5', 'mtime': '2019-10-30 14:17:24', 'datasetid': 'document', 'filesize': 243624, 'objectid': 27913, 'uri': 'http://repository.lppm.unila.ac.id/id/file/127868'}], 'format': 'text', 'pos': 1, 'rev_number': 1, 'uri': 'http://repository.lppm.unila.ac.id/id/document/27913', 'eprintid': 14788, 'security': 'public', 'placement': 1, 'mime_type': 'application/pdf', 'language': 'en'}]",Jurusan Fisika FMIPA Universitas Lampung,['FMIPA1'],article,disk0/00/01/47/88,1970-01-01 00:00:00.000002019,,Jurnal Teori dan Aplikasi Fisika,"[{'name': {'honourific': None, 'family': 'Rahayu', 'lineage': None, 'given': 'Isnaini'}, 'id': 'isnainirahayu2965.ir@gmail.com'}, {'id': 'suprihatin.1973@fmipa.unila.ac.id', 'name': {'family': 'Suprihatin', 'honourific': None, 'lineage': None, 'given': 'Suprihatin'}}, {'id': 'agus.riyanto@fmipa.unila.ac.id', 'name': {'family': 'Riyanto', 'honourific': None, 'lineage': None, 'given': 'Agus'}}]",2303-016X,,91-97,,,published,,,,,,,,,,,,,
36,['QC'],"Papaya leaf extract used as an inhibitor in carbon steel sample AISI 1020, was immersed in a 3% carboxy NaCl medium. By varying the immersion time of 4 days and 8 days, and also the concentration of inhibitor 0%, 3%, 5% and 7%. After the treatment of the sample obtained the slowest corrosion rate calculation results in AISI 1020 4.5 samples and the fastest in the AISI 1020 8.7 sample. The inhibitor used has the most efficient efficiency value in the AISI 1020 4.5 sample and the inefficient value in the AISI 1020 4.7 sample. The XRD characterization results show that the crystalline structure formed is BBC with pure Fe phase. The SEM characterization shows the surface morphology of the steel sample, visible in the sample without the addition of more inhibitors than the sample with the added inhibitor. In addition, cracks do not appear on the AISI 1020 4.5 sample. Characterization of EDS in the sample seen elements of Oxygen (O) and Clorin (Cl) which indicates that the sample has been corroded.",2019-11-04 08:13:50,archive,7.0,6,show,"Efektivitas Ekstrak Daun Pepaya (Carica Papaya L) sebagai Inhibitor pada Baja Karbon AISI 1020 dalam Medium
Korosif NaCl 3%",http://jurnal.fmipa.unila.ac.id/jtaf,15249,2019-11-04 08:13:50,2019-11-04 08:13:50,633,public,http://repository.lppm.unila.ac.id/id/eprint/15249,TRUE,pub,1.0,"[{'uri': 'http://repository.lppm.unila.ac.id/id/document/28385', 'rev_number': 1, 'pos': 1, 'format': 'text', 'files': [{'objectid': 28385, 'uri': 'http://repository.lppm.unila.ac.id/id/file/131207', 'datasetid': 'document', 'filesize': 1007347, 'fileid': 131207, 'mime_type': 'application/pdf', 'mtime': '2019-11-04 04:41:16', 'hash_type': 'MD5', 'hash': '38be09b2590e76e690a521015c9ed6fb', 'filename': '1927-4311-1-PB.pdf'}], 'main': '1927-4311-1-PB.pdf', 'docid': 28385, 'mime_type': 'application/pdf', 'language': 'en', 'placement': 1, 'security': 'public', 'eprintid': 15249}]",Jurusan Fisika FMIPA Universitas Lampung,['FMIPA1'],article,disk0/00/01/52/49,2019-01-31 00:00:00.000000000,http://dx.doi.org/10.23960%2Fjtaf.v7i1.1927,Jurnal Teori dan Aplikasi Fisika,"[{'name': {'honourific': None, 'family': 'Repangga', 'lineage': None, 'given': 'Yugi Aditama'}}, {'name': {'family': 'Ediman', 'honourific': None, 'lineage': None, 'given': 'Ginting Suka'}}, {'name': {'given': 'Syafriadi', 'lineage': None, 'family': 'Syafriadi', 'honourific': None}}]",2303-016X,,69-76,,"['Universitas Lampung', 'Universitas Lampung', 'Universitas Lampung']",published,,,,,,,,,,,,,
37,['QC'],"−This study aims to identify the effect of preparation temperature on microstructure and magnetic properties of magnetite nanoparticles prepared from FeSO4.7H2O and FeCl3.6H2O by using the coprecipitation method without organic solvent and surfactant. Precursors were prepared at 30 oC, 60 oC, and 90 oC under atmospheric pressure. Microstructure and diameter distribution of magnetite nanoparticles were analyzed by using XRD, FTIR, TEM, and ImageJ software, while the magnetic properties were analyzed using VSM. The identification result shows that the magnetite phase was formed on all samples with a polycrystalline structure. The increasing of preparation temperature was followed by an increase in the diameter of grains and the oxidation rate of magnetite phase into maghemite (γ-Fe2O3). The superparamagnetic properties almost can be observed mainly in the sample prepared at 30 oC, where the magnitude of remanent and coercivity is 3.39 emu/g and 23.93 Oe, respectively. The magnitude of remanent and coercivity increases as preparation temperature increases and superparamagnetic effect decrease.",2019-05-09 01:28:52,archive,16.0,7,show,Preparasi dan Karakteristik Fisis Nanopartikel Magnetit (Fe3O4),https://ppjp.ulm.ac.id/journal/index.php/f/article/view/5524/5142,11613,2019-05-09 01:28:52,2019-05-09 01:28:52,1168,public,http://repository.lppm.unila.ac.id/id/eprint/11613,TRUE,pub,1.0,"[{'security': 'public', 'placement': 1, 'eprintid': 11613, 'mime_type': 'application/pdf', 'language': 'en', 'files': [{'objectid': 25054, 'uri': 'http://repository.lppm.unila.ac.id/id/file/108079', 'datasetid': 'document', 'filesize': 1462243, 'mime_type': 'application/pdf', 'fileid': 108079, 'filename': 'Jurnal Fisika Flux.pdf', 'hash': '1620b40bea880a2c0c449d9fcd20a128', 'mtime': '2019-05-08 09:17:16', 'hash_type': 'MD5'}], 'docid': 25054, 'main': 'Jurnal Fisika Flux.pdf', 'rev_number': 1, 'uri': 'http://repository.lppm.unila.ac.id/id/document/25054', 'format': 'text', 'pos': 1}]",Jurusan Fisika Universitas Lambung Mangkurat,['FMIPA1'],article,disk0/00/01/16/13,2019-02-01 00:00:00.000000000,,Jurnal Fisika Flux,"[{'name': {'given': 'Agus', 'honourific': None, 'family': 'Riyanto', 'lineage': None}, 'id': 'agus.riyanto@fmipa.unila.ac.id'}]",2514-1713,,35-41,,['Universitas Lampung'],published,,,,,,[{'url': 'https://ppjp.ulm.ac.id/journal/index.php/f/article/view/5524/5142'}],,,,"[{'name': {'given': 'Agus', 'honourific': None, 'family': 'Riyanto', 'lineage': None}, 'id': 'agus.riyanto@fmipa.unila.ac.id', 'type': 'http://www.loc.gov/loc.terms/relators/AUT'}]",,,
38,['QC'],"Korosi pada elektroda Zn dalam sistem akumulator air laut dapat dikendalikan oleh proteksi katodik sistem anoda korban. Mekanismenya melalui pengorbanan anoda seperti Al yang memiliki potensial negatif terhubung ke struktur Zn untuk menyediakan elektron ekstra. Desain elektroda Zn diproteksi dengan anoda korban Al sehingga membentuk pasangan electroda Cu-ZnAl yang disusun seri untuk membentuk akumulator air laut.  Pengujian elektroda dengan proteksi katodik sistem anoda korban (Cu-ZnAl) dibandingkan dengan elektroda tanpa proteksi (Cu-Zn) selama 48 jam menunjukkan tegangan tanpa beban sebesar 9,52 V (Cu-Zn) dan 11,09 V (Cu-ZnAl).  Daya rata-rata setelah pembebanan LED 3 watt diperoleh 12,03 mW (hari ke-1) dan 12,56 mW (hari ke-2) untuk elektroda Cu-ZnAl, sedangkan untuk elektroda Cu-Zn diperoleh daya rata-rata 6,68 mW (hari ke-1) dan 10,09 mW (hari ke-2). Laju korosi setelah dua hari pemakaian masing-masing pasangan elektrode Cu-Zn dan Cu-ZnAl  diperoleh  0,008136 mm/tahun (Zn) dan 0,0749626 mm/tahun (ZnAl).",2019-11-04 08:23:18,archive,,8,show,"Proteksi Katodik pada Elektrode Zn Metode Sacrificial Anode 
untuk Peningkatan Kinerja Sistem Akumulator Air Laut",,15192,2019-11-04 08:23:18,2019-11-04 08:23:18,672,public,http://repository.lppm.unila.ac.id/id/eprint/15192,FALSE,inpress,,"[{'eprintid': 15192, 'security': 'public', 'placement': 1, 'mime_type': 'application/vnd.openxmlformats-officedocument.wordprocessingml.document', 'language': 'en', 'docid': 28334, 'main': 'Makalah-SFN-Sri Wahyu Suciyati-Universitas Lampung.docx', 'files': [{'objectid': 28334, 'uri': 'http://repository.lppm.unila.ac.id/id/file/130733', 'fileid': 130733, 'mime_type': 'application/vnd.openxmlformats-officedocument.wordprocessingml.document', 'hash_type': 'MD5', 'mtime': '2019-11-04 02:49:37', 'hash': 'b9f67bd6e20aaf0a0d9165fdb68811bd', 'filename': 'Makalah-SFN-Sri Wahyu Suciyati-Universitas Lampung.docx', 'datasetid': 'document', 'filesize': 255851}], 'format': 'text', 'pos': 1, 'uri': 'http://repository.lppm.unila.ac.id/id/document/28334', 'rev_number': 1}]",,['FMIPA1'],conference_item,disk0/00/01/51/92,2019-09-27 00:00:00.000000000,,,"[{'id': 'sri.wahyu@fmipa.unila.ac.id', 'name': {'lineage': None, 'honourific': None, 'family': 'SW Suciyati', 'given': 'SW suciyati'}}, {'id': None, 'name': {'given': 'GURUM A. PAUZI', 'family': 'GURUM A. PAUZI', 'honourific': None, 'lineage': None}}, {'name': {'given': 'L', 'honourific': None, 'family': 'Kamalia', 'lineage': None}, 'id': None}, {'id': None, 'name': {'honourific': None, 'family': 'Junaidi', 'lineage': None, 'given': 'J'}}]",,sri.wahyu@fmipa.unila.ac.id,1-7,,['universitas lampung'],,26-28 september,conference,Gedung FEB Universitas Lampung,Simposium Fisika Nasional,paper,,,,,"[{'type': 'http://www.loc.gov/loc.terms/relators/AUT'}, {'type': 'http://www.loc.gov/loc.terms/relators/AUT'}, {'type': 'http://www.loc.gov/loc.terms/relators/AUT'}, {'type': 'http://www.loc.gov/loc.terms/relators/AUT'}]",,,
39,['QC'],"The Research of design reactor HTGR cell core with thorium fuel and hydrogen gas cooled using
SRAC program has been done. The reactor was designed to generate maximum thermal power and critical
conditions. The parameters on this study are fuel enrichment, atomic density, size and configuration of
reactor core, criticality and the distribution of power density. Reactor core calculation was done in two
dimensional core (x,y) at 1/6 part of the reactor core with a triangular mesh. The fuel was Th232 and U233,
and hydrogen as coolant. In this study, the ideal reactor core design was length (x) was 428 cm and width
(y) was 214 cm, the first fuel enrichment was 6,037% and second fuel enrichment was 8%. Reactor core
design in this study generated 60 MWth thermal power with maximum power density was 179,6747 Watt/cm3
which is located at x=1, y=18 point and effective multiplication (keff) is 1,000005.",2019-11-04 03:39:27,archive,7.0,6,show,"Studi Desain High Temperature Gas-Cooled Reactor (HTGR)
Berpendingin Gas Hidrogen Menggunakan Bahan Bakar
Thorium",,14789,2019-11-04 03:39:27,2019-11-04 03:39:27,1168,public,http://repository.lppm.unila.ac.id/id/eprint/14789,TRUE,pub,1.0,"[{'rev_number': 1, 'uri': 'http://repository.lppm.unila.ac.id/id/document/27914', 'format': 'text', 'pos': 1, 'files': [{'objectid': 27914, 'uri': 'http://repository.lppm.unila.ac.id/id/file/127877', 'mime_type': 'application/pdf', 'fileid': 127877, 'hash': '61e8c2256d814b64033a8cff3bc59c6c', 'filename': '1932-4315-1-PB_compressed.pdf', 'mtime': '2019-10-30 14:22:32', 'hash_type': 'MD5', 'datasetid': 'document', 'filesize': 196040}], 'docid': 27914, 'main': '1932-4315-1-PB_compressed.pdf', 'language': 'en', 'mime_type': 'application/pdf', 'security': 'public', 'placement': 1, 'eprintid': 14789}]",Jurusan Fisika FMIPA Universitas Lampung,['FMIPA1'],article,disk0/00/01/47/89,1970-01-01 00:00:00.000002019,,Jurnal Teori dan Aplikasi Fisika,"[{'name': {'lineage': None, 'family': 'Saputra', 'honourific': None, 'given': 'Dika'}, 'id': None}, {'name': {'honourific': None, 'family': 'yulianti', 'lineage': None, 'given': 'yanti'}, 'id': None}, {'name': {'given': 'Agus', 'lineage': None, 'honourific': None, 'family': 'Riyanto'}, 'id': 'agus.riyanto@fmipa.unila.ac.id'}]",2303-016X,,88-105,,,published,,,,,,,,,,,,,
40,['QC'],"Polyethylene (PE) has been widely used as the insulation material of high voltage cables because
of its outstanding physical, chemical, and electrical properties. In this research the amorph nanosilica
powders were extracted from pumice using NaOH, H2SO4 and HCl. PE and nanosilica was mixed by mixer
at temperature 95 OC and then made the film by using barcoater. The weight percentage of nanosilica was 5
and 10% with thickness of 6, 12 and 25μm respectively. The PE/nanosilica were characterized via Fourier
Transform InfraRed (FTIR) spectroscopy and LCR measurement to abtain conductivity and permitivity
respons as a function of frequency. The effect thickness on the electrical properties of PE/nanosilica of 5 and
10 % for conductivity values in samples 25 μm thick has a greater conductivity value. Whereas for the
electrica constant of two filer variation shows that the thicker the sample, the greater the electric constant
value. Where as for the dielectric constant of two filler variations shows that the ticker the sample, the
greater the electric constant value.",2019-11-04 03:40:29,archive,7.0,6,show,Sifat Fisis Komposit Pe/Nanosilika sebagai Fungsi Ketebalan,,14794,2019-11-04 03:40:29,2019-11-04 03:40:29,1168,public,http://repository.lppm.unila.ac.id/id/eprint/14794,TRUE,pub,1.0,"[{'language': 'en', 'mime_type': 'application/pdf', 'eprintid': 14794, 'placement': 1, 'security': 'public', 'pos': 1, 'format': 'text', 'uri': 'http://repository.lppm.unila.ac.id/id/document/27919', 'rev_number': 1, 'main': '1934-4317-1-PB_compressed.pdf', 'docid': 27919, 'files': [{'uri': 'http://repository.lppm.unila.ac.id/id/file/127905', 'objectid': 27919, 'hash': '2e2ff1e439c81475c80cf5c7e3870961', 'filename': '1934-4317-1-PB_compressed.pdf', 'mtime': '2019-10-30 14:47:37', 'hash_type': 'MD5', 'mime_type': 'application/pdf', 'fileid': 127905, 'filesize': 271504, 'datasetid': 'document'}]}]",Jurusan Fisika FMIPA Universitas Lampung,['FMIPA1'],article,disk0/00/01/47/94,1970-01-01 00:00:00.000002019,,Jurnal Teori dan Aplikasi Fisika,"[{'id': None, 'name': {'given': 'Tria', 'lineage': None, 'family': 'Sari', 'honourific': None}}, {'name': {'given': 'Posman', 'honourific': None, 'family': 'Manurung', 'lineage': None}, 'id': 'reip65@yahoo.com'}, {'id': 'agus.riyanto@fmipa.unila.ac.id', 'name': {'given': 'Agus', 'family': 'Riyanto', 'honourific': None, 'lineage': None}}]",2303-016X,,117-124,,,published,,,,,,,,,,,,,
41,['QC'],"Abstract
This study aims to investigate the effect of sintering temperatures on both the phase formation and physical characteristics of
forsterite prepared from rice husk silica and magnesium nitrate hydrate. The samples were subjected to sintering temperatures of
1000–1300 °C, and the development of structures was characterized using Fourier transforminfrared (FTIR) spectroscopy, X-ray
diffraction (XRD), and scanning electron microscopy (SEM). Some physical properties include density, porosity, hardness,
bending strength, and thermal expansion coefficient of the samples were measured. It is concluded that forsterite formation
started at 1000 °C, and its abundance increased slowly from an increased temperature up to 1300 °C, resulting in increased phase
contents from 87.7 to 90.0 wt%. Thermal expansion coefficient of the samples with increasing temperature of sintering from 1100
to 1300 °C reaches the relatively constant value of 9.1 × 10
Keywords Refractory Rice husk Sintering Forsterite
−6 /°C, with the main crystalline phase being forsterite.Structure",2019-04-22 03:37:40,archive,,7,show,"Effect of sintering temperature on the structural
and physical properties of forsterite using amorphous rice husk silica as refractory precursors",,11215,2019-04-22 03:37:40,2019-04-22 03:37:40,1042,public,http://repository.lppm.unila.ac.id/id/eprint/11215,TRUE,pub,,"[{'files': [{'datasetid': 'document', 'filesize': 2604968, 'fileid': 102340, 'mime_type': 'application/pdf', 'mtime': '2019-04-22 03:24:51', 'hash_type': 'MD5', 'hash': 'e6be83a72fef05875fffbadb5947f0c4', 'filename': 'australian ceramics 2019.pdf', 'objectid': 24215, 'uri': 'http://repository.lppm.unila.ac.id/id/file/102340'}], 'main': 'australian ceramics 2019.pdf', 'docid': 24215, 'uri': 'http://repository.lppm.unila.ac.id/id/document/24215', 'rev_number': 1, 'format': 'text', 'pos': 1, 'security': 'public', 'placement': 1, 'eprintid': 11215, 'mime_type': 'application/pdf', 'language': 'en'}]",Springer,['FMIPA1'],article,disk0/00/01/12/15,1970-01-01 00:00:00.000002019,,Journal of the Australian Ceramic Society,"[{'id': 'simon.sembiring@fmipa.', 'name': {'given': 'Simon', 'lineage': None, 'family': 'Sembiring', 'honourific': None}}, {'id': 'arfi2208@gmail.com', 'name': {'lineage': None, 'family': 'Riyanto', 'honourific': None, 'given': 'Agus'}}, {'id': 'leni.rumiyanti@gmail.com', 'name': {'honourific': None, 'family': 'Rumiyanti', 'lineage': None, 'given': 'Leni'}}, {'id': 'zipora_sembiring@yahoo.com', 'name': {'given': 'Zipora', 'lineage': None, 'family': 'Sembiring', 'honourific': None}}, {'name': {'given': 'Rudy T.M', 'lineage': None, 'honourific': None, 'family': 'Situmeang'}, 'id': 'rudy.tahan@fmipa.unila.ac.id'}]",2510-1560,,,,['Universitas Lampung'],published,,,,,,,,,,,,,
42,['QC'],"This study aims to investigate the effect of sintering temperatures on both the phase formation and physical characteristics of
forsterite prepared from rice husk silica and magnesium nitrate hydrate. The samples were subjected to sintering temperatures of
1000–1300 °C, and the development of structures was characterized using Fourier transforminfrared (FTIR) spectroscopy, X-ray
diffraction (XRD), and scanning electron microscopy (SEM). Some physical properties include density, porosity, hardness,
bending strength, and thermal expansion coefficient of the samples were measured. It is concluded that forsterite formation started at 1000 °C, and its abundance increased slowly from an increased temperature up to 1300 °C, resulting in increased phase
contents from 87.7 to 90.0 wt%. Thermal expansion coefficient of the samples with increasing temperature of sintering from 1100 to 1300 °C reaches the relatively constant value of 9.1 × 10−6/°C, with the main crystalline phase being forsterite.",2019-11-04 03:42:10,archive,,7,show,"Effect of sintering temperature on the structural
and physical properties of forsterite using amorphous rice husk silica as refractory precursors",,14800,2019-11-04 03:42:10,2019-11-04 03:42:10,1168,public,http://repository.lppm.unila.ac.id/id/eprint/14800,TRUE,pub,,"[{'files': [{'datasetid': 'document', 'filesize': 2290705, 'mime_type': 'application/pdf', 'fileid': 127937, 'hash': 'ff41679782cbc25c8341ce020f7af09d', 'filename': 'Journal of the Australian Ceramic Society.pdf', 'mtime': '2019-10-30 15:06:54', 'hash_type': 'MD5', 'objectid': 27926, 'uri': 'http://repository.lppm.unila.ac.id/id/file/127937'}], 'docid': 27926, 'main': 'Journal of the Australian Ceramic Society.pdf', 'rev_number': 1, 'uri': 'http://repository.lppm.unila.ac.id/id/document/27926', 'format': 'text', 'pos': 1, 'security': 'public', 'placement': 1, 'eprintid': 14800, 'language': 'en', 'mime_type': 'application/pdf'}]",Springer,['FMIPA1'],article,disk0/00/01/48/00,1970-01-01 00:00:00.000002019,,Journal of the Australian Ceramic Society,"[{'id': 'simon.sembiring@fmipa.', 'name': {'honourific': None, 'family': 'Sembiring', 'lineage': None, 'given': 'Simon'}}, {'id': 'agus.riyanto@fmipa.unila.ac.id', 'name': {'given': 'Agus', 'lineage': None, 'family': 'Riyanto', 'honourific': None}}, {'name': {'lineage': None, 'family': 'Rumiyanti', 'honourific': None, 'given': 'Leni'}, 'id': 'leni.rumiyanti@gmail.com'}, {'name': {'given': 'Zipora', 'lineage': None, 'honourific': None, 'family': 'Sembiring'}, 'id': 'zipora_sembiring@yahoo.com'}, {'id': 'rudy.tahan@fmipa.unila.ac.id', 'name': {'given': 'Rudy T.M', 'family': 'Situmeang', 'honourific': None, 'lineage': None}}]",2510-1560,,,,,,,,,,,,,,,,,,
