,corp_creators,lastmod,userid,datestamp,pagerange,ispublished,number,documents,publisher,uri,full_text_status,refereed,type,divisions,publication,issn,creators,date,dir,eprint_status,status_changed,subjects,abstract,official_url,title,rev_number,volume,metadata_visibility,eprintid,date_type,contact_email,related_url,pages,place_of_pub,isbn
0,"['Jurusan Administrasi Negara FISIP Unila', 'Jurusan Administrasi Negara FISIP Unila']",2016-09-19 06:12:10,659,2016-09-19 06:12:10,17-46,pub,2.0,"[{'security': 'public', 'placement': 1, 'eprintid': 592, 'mime_type': 'application/pdf', 'language': 'en', 'files': [{'hash_type': 'MD5', 'mtime': '2016-09-15 07:56:26', 'hash': 'af7acfe4b23e697abd1c9ee418323608', 'filename': 'BRT.pdf', 'fileid': 3241, 'mime_type': 'application/pdf', 'filesize': 306536, 'datasetid': 'document', 'uri': 'http://repository.lppm.unila.ac.id/id/file/3241', 'objectid': 505}], 'docid': 505, 'main': 'BRT.pdf', 'rev_number': 1, 'uri': 'http://repository.lppm.unila.ac.id/id/document/505', 'format': 'text', 'pos': 1}]",Jurusan Administrasi Negara FISIP UNS Surakarta,http://repository.lppm.unila.ac.id/id/eprint/592,public,TRUE,article,['FISIP2'],Spirit Publik,1907-0489,"[{'name': {'given': 'Dedy', 'lineage': None, 'honourific': None, 'family': 'Hermawan'}, 'id': 'hermawan.dedy@yahoo.com'}, {'id': 'simon.sumanjoyo@fisip.unila.ac.id', 'name': {'given': 'Simon', 'lineage': None, 'honourific': None, 'family': 'Hutagalung'}}]",1970-01-01 00:00:00.000002015,disk0/00/00/05/92,archive,2016-09-19 06:12:10,['JS'],"The aim of the research is to describe and discess the policy cycle of Bus Rapid 
Transit, the polemic in the policy of bus rapid transit, and the involvement of the 
stakeholder and their role in bus rapid transpit policy in Bandar  Lampung. This 
research  uses  post  positivistic  paradigm  with  the  approach  of  qualitative 
descriptive research method. This research resulted as: firstly, the bus rapid transit 
is  an  derivative  regulation  of  Act  No.  22  2009  regarding  Traffic  and  Road 
Transport,  aimed  to  reduce  traffic  jam  in  Bandar  Lampung  city.  Secondly,  the 
policy of bus rapid transit was arranged stage-by-stage with  a full iniative from 
the  Municipal  goverement  of  Bandar  Lampung,  collaborated  with  the  leading 
sector  from  Transportation  Bureau  of  Bandar  Lampung,  involving  PT  Trans 
Bandar Lampung as the management in charge. Thirdly, there was a polemic of 
bus rapid transit policy regarding the monopoly of route of people transportation 
by the bus rapid transit, special treatment to bus rapid transit which don’t pay bus 
station  retribution  which  is  unfair,  and  there  was  some  illegal  fees  on  the 
employee  in  PT  Trans  .Bandar  Lampung.  Fourthly,  the  of  bus  rapid  transit 
involves many stakeholders, such as Ministry of Transportatio of The Republic of 
Indonesia,  |Transportation  Bureau  of  Bandar  Lampung  City,  The  Regional 
Representatives Council of Bandar Lampung, Road Transportation Organization 
of  Bandar  Lampung,  PT.  Trans  Bandar  Lampung,  Perum  DAMRI  Bandar 
Lampung, Lampung Region of Indonesia Transportation Society, Communication 
Forum of Public Car Transportation Bandar Lampung, CV. Devis Jaya, and also 
Indonesian Police and Civil Servant Security Forces.",https://jurnal.uns.ac.id/index.php?journal=spirit-publik&page=article&op=view&path%5B%5D=1262&path%5B%5D=1206,"KEBIJAKAN BUS RAPID TRANSIT DI BANDAR LAMPUNG
(BUS RAPID TRANSIT POLICY IN MUNICIPAL CITY OF BANDAR 
LAMPUNG)",8,10,show,592,published,,,,,
1,,2018-01-10 06:15:00,205,2018-01-10 06:15:00,65-80,pub,,"[{'main': 'AA12162559-29-65-80.pdf', 'docid': 19076, 'files': [{'uri': 'http://repository.lppm.unila.ac.id/id/file/56561', 'objectid': 19076, 'hash': 'cbab2024fb27fbe2e1e61c97b0396ec9', 'filename': 'AA12162559-29-65-80.pdf', 'hash_type': 'MD5', 'mtime': '2017-11-30 02:49:22', 'mime_type': 'application/pdf', 'fileid': 56561, 'filesize': 1321627, 'datasetid': 'document'}], 'format': 'text', 'pos': 1, 'rev_number': 1, 'uri': 'http://repository.lppm.unila.ac.id/id/document/19076', 'eprintid': 6155, 'security': 'public', 'placement': 1, 'language': 'en', 'mime_type': 'application/pdf'}]","Graduate School of Human, Socio and Environmental Studies Kanazawa University",http://repository.lppm.unila.ac.id/id/eprint/6155,public,TRUE,article,['FISIP2'],Departmental Bulletin Paper,1881-5545,"[{'id': 'intan.fitri@fisip.unila.ac.id', 'name': {'given': 'Intan Fitri', 'honourific': None, 'family': 'Meutia', 'lineage': None}}]",2015-03-01 00:00:00.000000000,disk0/00/00/61/55,archive,2018-01-10 06:15:00,['H1'],"The Lampungnese and Balinese people living in the province of Lampung, Indonesia, concur 10 points in the peace resolution document, a citizen contract agreement, that was the result of the mediation process. To resolve ethnic conflict, traditional cultural norms and laws should be followed in areas with discord. In this case, both the Lampungnese and Balinese have their own local customs. Community policing rest on the belief that contemporary community problems require a decentralized and personalized police approach, one that draws citizens into the process of policing themselves. Therefore, the procedure in which society tries to establish harmony within their communities becomes important. Additionally, the role of citizens to build peace and order within their communities becomes a strategic way for citizens to become empowered. The concept of community policing means that government trusts society to guard their own environment and create peace independently via the police institution. However, in this case the process of community policing should stil be under the supervision of Police Institutions.

Keywords: Community Policing, Ethnic Conflict, Lampungnese, Balinese, Indonesia",https://kanazawa-u.repo.nii.ac.jp/?action=pages_view_main&active_action=repository_view_main_item_detail&item_id=5611&item_no=1&page_id=13&block_id=21,Community Policing to Resolve Ethnic Conflict in Indonesia : A Case Study of Lampungnese Vs. Balinese,7,29,show,6155,published,,,,,
2,['universitas lampung'],2017-06-12 02:02:31,345,2017-06-12 02:02:31,170-177,pub,2.0,"[{'placement': 1, 'security': 'public', 'eprintid': 3344, 'language': 'en', 'mime_type': 'application/pdf', 'files': [{'uri': 'http://repository.lppm.unila.ac.id/id/file/24156', 'objectid': 3357, 'hash_type': 'MD5', 'mtime': '2017-06-06 15:50:16', 'filename': 'ND_jurnal_sosio_humaniora.pdf', 'hash': '03de1444394a277d1e2ab3f8e09fbc9b', 'fileid': 24156, 'mime_type': 'application/pdf', 'filesize': 234774, 'datasetid': 'document'}], 'main': 'ND_jurnal_sosio_humaniora.pdf', 'docid': 3357, 'rev_number': 1, 'uri': 'http://repository.lppm.unila.ac.id/id/document/3357', 'pos': 1, 'format': 'text'}]",Direktorat Riset dan Pengabdian Kepada Masyarakat Universitas Padjajaran,http://repository.lppm.unila.ac.id/id/eprint/3344,public,TRUE,article,['FISIP2'],"Sosiohumaniora, Jurnal Ilmu-Ilmu Sosial dan Humaniora",14110-0911,"[{'id': 'noverman.duadji@fisip.unila.ac.id', 'name': {'given': 'Noverman', 'lineage': None, 'honourific': None, 'family': 'Noverman Duadji'}}]",2015-07-01 00:00:00.000000000,disk0/00/00/33/44,archive,2017-06-12 02:02:31,['H1'],"Rumusan masalah penelitian ini adalah ‘Bagaimana pelembagaan (forum) musyawarah sebagai media
partisipasi masyarakat dalam permusan dan implementasi program operasional PNPM Mandiri Perkotaan di Kota
Bandar Lampung?’. Penelitian bertujuan untuk mendapatkan gambaran tentang bentuk pelembagaan (forum)
musyawarah dalam perumusan dan implementasi program operasional PNPM Mandiri Perkotaan di Kota Bandar
Lampung, sedangkan metode yang digunakan adalah metode kualitatif. Berkaitan dengan hasil penelitian
diperoleh kesimpulan bahwa LKM dan KSM merupakan bentuk pelembagaan (forum) musyawarah dalam
permusan dan implementasi program operasional PNPM Mandiri Perkotaan di Kota Bandar Lampung. Forum
ini masih bersifat simbolik. Artinya forum musyawarah masih dikondisikan oleh pemerintah dengan mekanisme
pembentukan bersifat top down, keanggotaannya cerminan representasi elit (elitis) bukan representasi masyarakat
miskin dan demikian pula dengan keikutsertaan warga masih terkesan sebagai partisipasi semu. Kondisi inilah
yang menyebabkan substansi program aksi PNPM MP di Kota Bandar Lampung belum menyentuh akar persoalan
kemiskinan warga kota. Program aksi baru mampu mengatasi fenomena (gejalah) yang muncul atau ‘symptomatic
program’ dan belum mengarah kepada ‘strategic program’. Program operasional belum beorientasi atau berpihak
pada rakyat miskin sebagai sasaran (pro poor policy), tetapi masih menunjukkan kehendak dan keinginan
pemerintah. PNPM Mandiri Perkotaan Kota Bandar Lampung belum menunjukan program aksi (kebijakan) hasil
dari pelembagaan (forum) musyawarah atau sebagai hasil proses deliberasi, tetapi lebih merupakan ‘in policy’,
yaitu kebijakan inkremental, tambal-sulam atas kebijakan sebelumnya dan lebih mencerminkan kepentingan
pemerintah. Ada dua saran yang menjadi masukan untuk ditindak-lanjuti oleh pemerintah kota guna meningkatkan
kualitas kebijakan (program), yaitu: (1) perlu merumuskan rancangan kelembagaan (forum) musyawarah yang
benar-benar mencerminkan hakekat musyawarah yang sesungguhnya dengan dilandasi kerangka legal formal yang
mengatur partisipasi publik kedalam bentuk perencanaan partisipatif; dan (2) perlu menumbuh-kembangkan nilainilai
demokrasi perencanaan melalui kerjasama nyata, pembinaan manajerial, dukungan finansial dan penguatan
jejaring (networking) kemitraan dengan organisasi akar rumput sebagai wadah masyarakat.
Kata Kunci: Musyawarah; Partisipasi Masyarakat",http://jurnal.unpad.ac.id/sosiohumaniora/article/viewFile/7307/3361,"PROGRAM OPERASIONAL PNPM MANDIRI PERKOTAAN DI KOTA BANDAR LAMPUNG:
KAJIAN TENTANG PELEMBAGAAN (FORUM) MUSYAWARAH",6,17,show,3344,published,noverman.duadji@fisip.unila.ac.id,,,,
3,"['universitas Lampung', 'universitas Lampung']",2022-02-03 01:04:24,127,2022-02-03 01:04:24,185-192,pub,2.0,"[{'security': 'public', 'placement': 1, 'eprintid': 7941, 'language': 'en', 'mime_type': 'application/pdf', 'files': [{'uri': 'http://repository.lppm.unila.ac.id/id/file/438956', 'objectid': 160018, 'filesize': 542303, 'datasetid': 'document', 'mtime': '2022-02-02 14:25:46', 'hash_type': 'MD5', 'filename': 'Administratio Edisi 6 Vol. 2_halaman 185.pdf', 'hash': 'cde9e915f91d6aabd9045e3b5f7dce7a', 'fileid': 438956, 'mime_type': 'application/pdf'}], 'main': 'Administratio Edisi 6 Vol. 2_halaman 185.pdf', 'docid': 160018, 'uri': 'http://repository.lppm.unila.ac.id/id/document/160018', 'rev_number': 1, 'format': 'text', 'pos': 1}]",Jurusan Administrasi Negara,http://repository.lppm.unila.ac.id/id/eprint/7941,public,TRUE,article,['FISIP2'],Administratio : Jurnal Ilmiah Administrasi Publik dan Pembangunan,2087-0825,"[{'name': {'given': 'Renita', 'honourific': None, 'family': 'Renita', 'lineage': None}, 'id': 'willy_nm@yahoo.com'}, {'id': 'dewie.brima@fisip.unila.ac.id', 'name': {'lineage': None, 'family': 'Dewie Brima Atika', 'honourific': None, 'given': 'DW Atika'}}]",2015-07-01 00:00:00.000000000,disk0/00/00/79/41,archive,2022-02-03 01:04:24,['H1'],"Kelancaran penyelenggaraan pemerintahan dan pelaksanaan pembangunan
nasional tergantung dari kesempurnaan aparatur publik. Salah satu bagian dari aparatur
publik yakni penyuluh yang berperan sebagai alat untuk melaksakan pembangunan yang
memiliki keterampilan dan kecakapan yang tinggi dalam pekerjaannya akan mampu
membawa organisasinya ke arah kemajuan dan dapat menciptakan keunggulan-keunggulan
untuk memenuhi misi dan visi organisasi. Ada banyak faktor yang dapat mempengaruhi
peningkatan  kinerja para pegawai dalam suatu organisasi yang salah satunya adalah
dengan mengikuti pemberdayaan sumberdaya aparatur. Hasil penelitian menunjukkan
hubungan antara pemberdayaaan sumberdaya aparatur terhadap kinerja pegawai di Badan
Pelaksana Penyuluhan Pertanian, Perikanan dan Kehutan (BP4K) Kabupaten Tanggamus
dikategorikan sangat baik dengan presentase sebesar 54,2%.Sisanya sebesar 47,8 %
merupakan pengaruh kinerja pegawai dari faktor lain yang tidak terindentifikasi dalam
penelitian ini. 

Kata kunci:Penyuluh Petani, Pemberdayaan Sumberdaya Aparatur, Kinerja Pegawai",,"PENGARUH PEMBERDAYAAN SUMBER DAYA APARATUR TERHADAP KINERJA PEGAWAI DI
BADAN PELAKSANA PENYULUHAN PERTANIAN PERIKANAN DAN KEHUTANAN (BP4K) 
KABUPATEN TANGGAMUS",13,6,show,7941,published,,,,,
4,,2019-11-04 07:40:10,659,2019-11-04 07:40:10,93-114,pub,1.0,"[{'eprintid': 14929, 'placement': 1, 'security': 'public', 'mime_type': 'application/pdf', 'language': 'en', 'docid': 28046, 'main': 'Jurnal_Spirit_Publik_2015.pdf', 'files': [{'datasetid': 'document', 'filesize': 6214963, 'fileid': 128758, 'mime_type': 'application/pdf', 'mtime': '2019-11-01 06:30:04', 'hash_type': 'MD5', 'filename': 'Jurnal_Spirit_Publik_2015.pdf', 'hash': 'e01c6b9d80b75e51669868cae6bbc3ac', 'objectid': 28046, 'uri': 'http://repository.lppm.unila.ac.id/id/file/128758'}], 'pos': 1, 'format': 'text', 'rev_number': 1, 'uri': 'http://repository.lppm.unila.ac.id/id/document/28046'}]",Jurusan Administrasi Negara FISIP UNS Surakarta,http://repository.lppm.unila.ac.id/id/eprint/14929,public,TRUE,article,['FISIP2'],Spirit Publik,1907-0489,"[{'id': 'devi.yulianti@fisip.unila.ac.id', 'name': {'given': 'Devi', 'honourific': None, 'family': 'Yulianti', 'lineage': None}}, {'name': {'given': 'Dedy', 'honourific': None, 'family': 'Hermawan', 'lineage': None}, 'id': 'hermawan.dedy@yahoo.com'}]",2015-04-01 00:00:00.000000000,disk0/00/01/49/29,archive,2019-11-04 07:40:10,['JS'],"This research is about the design of organization structure to create the effective public organization which is located in PT. Perkebunan Nusantara VII (Persero) Lampung.  This research is aimed to describe and analyze the relation between the design of organization structure of PTPN VII (Persero) with the company goals in creating the effective corporation. This study used qualitative approach with descriptive method.  The data was collected using documentation tehcnique and the data analysis was using reduction and conclusion technique. The results of this research were three main points. First, PTPN VII (Persero) has used the divisional structure.  Second, there were some alterations in divisional structure each year from 2008 until 2012. Third, the divisional structure of PTPN VII (Persero) hasn’t been able to support the achievement of company goals so that this corporation is no yet effective. The conclusion of this research is that the design of organization structure of PTPN VII (Persero) is not effective to reach the company goals.",https://jurnal.uns.ac.id/spirit-publik/article/view/900,Hasil Scan Similarity Artikel: DESIGNING AN EFFECTIVE ORGANIZATIONAL STRUCTURE TO ACHIEVE PUBLIC ORGANIZATION OBJECTIVE (CASE STUDY IN PT. PTPN VII LAMPUNG),6,10,show,14929,published,,,,,
5,"['Universitas Lampung,Fisip']",2017-10-16 06:30:36,544,2017-06-05 02:56:35,152-177,pub,2.0,"[{'docid': 3138, 'main': 'Jurnal Borneo Administrator (Terakreditasi LIPI)_Dr. Novita Tresiana (lengkap).pdf', 'files': [{'fileid': 22596, 'mime_type': 'application/pdf', 'mtime': '2017-06-03 04:45:29', 'hash_type': 'MD5', 'filename': 'Jurnal Borneo Administrator (Terakreditasi LIPI)_Dr. Novita Tresiana (lengkap).pdf', 'hash': 'af4743e7918deea05ec1ae8f03f5776d', 'datasetid': 'document', 'filesize': 12533948, 'objectid': 3138, 'uri': 'http://repository.lppm.unila.ac.id/id/file/22596'}], 'pos': 1, 'format': 'text', 'uri': 'http://repository.lppm.unila.ac.id/id/document/3138', 'rev_number': 1, 'eprintid': 3244, 'placement': 1, 'security': 'public', 'language': 'en', 'mime_type': 'application/pdf'}]",PKP2A II LAN,http://repository.lppm.unila.ac.id/id/eprint/3244,public,TRUE,article,['FISIP2'],Jurnal BorneoAdministration,1858-0300,"[{'name': {'lineage': None, 'family': 'novita tresiana', 'honourific': None, 'given': 'novita'}, 'id': 'novita.tresiana@fisip.unila.ac.id'}]",2015-08-01 00:00:00.000000000,disk0/00/00/32/44,archive,2017-06-05 02:56:35,['H1'],"It talks about the urgency of a gender perspective ineducation policies by integrating a gender perspective into all policies or programs designed Lampung Provincial Education Office. The method used is the evaluation (qualitative). Focus studied is the policy formulation process, understanding actors, gender management authority lies in the education department, while using descriptive qualitative analysis techniques with interactive analysis. This paper reveals that in the process of formulating education department shows failed to integrate a gender perspective in policy formulation or educational programs. Model formulation dominated incremental models, promoting the consideration of administrative/political. A contributing factor, the lack of understanding of actors, where the authorities are not in a functional structure, so that gender is an exclusive program, not integrated in all programs.",http://www.samarinda.lan.go.id/jba/index.php/jba/article/view/192,PERUMUSAN KEBIJAKAN PENDIDIKAN YANG BERPERSPEKTIF 1 GENDER DI PROVINSI LAMPUNG EDUCATION POLICY FORMULATION OF GENDER PERSPECTIVE  IN LAMPUNG PROVINCE,8,11,show,3244,published,,[{'url': 'http://www.samarinda.lan.go.id/jba/index.php/jba/article/view/192'}],,,
6,['universitas lampung'],2017-07-18 05:54:19,544,2017-07-18 05:54:19,,pub,,"[{'security': 'public', 'placement': 1, 'eprintid': 3698, 'mime_type': 'application/pdf', 'language': 'en', 'files': [{'uri': 'http://repository.lppm.unila.ac.id/id/file/25776', 'objectid': 3557, 'hash_type': 'MD5', 'mtime': '2017-07-18 05:04:37', 'filename': 'Buku Referensi Rasionalitas Graha Ilmu_Dr. Novita Tresiana (lengkap).pdf', 'hash': '7ffd41948eddd261427839285a669ba5', 'fileid': 25776, 'mime_type': 'application/pdf', 'filesize': 3460656, 'datasetid': 'document'}], 'docid': 3557, 'main': 'Buku Referensi Rasionalitas Graha Ilmu_Dr. Novita Tresiana (lengkap).pdf', 'uri': 'http://repository.lppm.unila.ac.id/id/document/3557', 'rev_number': 1, 'format': 'text', 'pos': 1}]",graha ilmu,http://repository.lppm.unila.ac.id/id/eprint/3698,public,TRUE,book,['FISIP2'],,,"[{'name': {'lineage': None, 'honourific': None, 'family': 'novita tresiana', 'given': 'novita'}, 'id': 'novita.tresiana@fisip.unila.ac.id'}]",1970-01-01 00:00:00.000002015,disk0/00/00/36/98,archive,2017-07-18 05:54:19,['H1'],"Perspektif rasionalitas dalam pembuatan keputusan kebijakan bertujuan agar  lahir sebuah keputusan lebih baik (heuristic).  Hasil atau output yang pembuatan keputusan kebijakan adalah sebuah keputusan kebijakan yang berdimensi rasional substantive, dan diharapkan dapat menyelesaikan persoalan kepublikan secara cerdas, bijaksana dan memberikan harapan.  Rasionalitas atau irasionalitas sebuah kebijakan kapasitasnya ditentukan oleh sejauhmana model dan tehnik yang tepat digunakan dalam analisis keputusan serta  mengedepankan dimensi-dimensi yang cukup potensial untuk menghasilkan sebuah keputusan yang mampu memecahkan persoalan kepublikan. Perspektif rasionalitas akan menjadikan sebuah keputusan dapat dipertanggungjawabkan dan dapat diterima oleh semua pihak, dikarenakan telah terpenuhinya  instrumen-instrumen penunjang dan disusun secara sistematis melalui tahapan serta memiliki kriteria melibatkan publik dalam setiap tahapan penyusunannya, transparan, jelas tolak ukur keberhasilannya, jelas target dan juga jelas sasaran.",http://grahailmu.co.id/index/buku/detil/0/1/3/10/buku1540.html,RASIONALITAS DAN PEMBUATAN KEPUTUSAN KEBIJAKAN,7,1,show,3698,published,,,113.0,yogyakarta,978-602-262-513-1
7,"['Universitas Lampung,Fisip']",2017-06-05 02:56:17,544,2017-06-05 02:56:17,161-171,pub,2.0,"[{'mime_type': 'application/pdf', 'language': 'en', 'security': 'public', 'placement': 2, 'eprintid': 3237, 'uri': 'http://repository.lppm.unila.ac.id/id/document/3129', 'rev_number': 1, 'format': 'text', 'pos': 2, 'files': [{'datasetid': 'document', 'filesize': 9577987, 'fileid': 22536, 'mime_type': 'application/pdf', 'hash_type': 'MD5', 'mtime': '2017-06-03 04:06:19', 'hash': '7572030436dd5411aa991aa2c4ac6953', 'filename': 'Jurnal  Bina Praja (Terakreditasi LIPI)_Dr.Novita Tresiana.pdf', 'objectid': 3129, 'uri': 'http://repository.lppm.unila.ac.id/id/file/22536'}], 'docid': 3129, 'main': 'Jurnal  Bina Praja (Terakreditasi LIPI)_Dr.Novita Tresiana.pdf'}]",Badan Penelitian dan Pengembangan Kementerian Dalam Negeri Jakarta,http://repository.lppm.unila.ac.id/id/eprint/3237,public,TRUE,article,['FISIP2'],Jurnal Bina Praja,2085-4323,"[{'id': 'novita.tresiana@fisip.unila.ac.id', 'name': {'honourific': None, 'family': 'novita tresiana', 'lineage': None, 'given': 'novita'}}]",2015-06-01 00:00:00.000000000,disk0/00/00/32/37,archive,2017-06-05 02:56:17,['H1'],"Penelitian ini didasari pemikiran bahwa pemekaran wilayah merupakan sebuah produk kebijakan publik, sebagai upaya pemerintah untuk memecahkan masalah publik. Dalam kerangka rasionalitas, maka  kebijakan pemekaran seharusnya adalah  hasil  pilihan yang rasional, mencakup pemilihan alternative  bagi tercapainya tujuan, mengandung  nilai yang fundamental dan tepat guna untuk mencapai  hasil akhir (outcome) yang diinginkan. Tujuan dari penulisan ini adalah : mendeskripsikan proses pembuatan kebijakan pemekaran dan  mendeskripsikan rasionalitas yang digunakan aktor dalam kebijakan pemekaran. Metode yang digunakan adalah kualitatif. Tulisan ini mengangkat temuan hasil penelitian bahwasanya proses penetapan  kebijakan pemekaran, bukanlah upaya solutif bagi persoalaan substantive masyarakat dan rasionalitas yang digunakan dalam penetapan kebijakan,  didominasi model rasionalitas tong sampah, sebagai respon struktur terhadap kepentingannya elit (politik),  bersifat transaksional, bukanlah respon sistem (legislatif dan eksekutif) untuk mengatasi masalah faktual yang berkaitan dengan kesejahteraan masyarakat.",http://binaprajajournal.com/ojs/index.php/jbp/article/view/47,Rasionalitas Kebijakan Pemekaran Kecamatan dan Kelurahan di Kota Bandar Lampung,7,7,show,3237,published,,"[{'type': 'pub', 'url': 'http://binaprajajournal.com/ojs/index.php/jbp/article/view/47'}]",,,
8,"['Universitas lampung, fisip']",2017-10-16 06:33:18,544,2017-06-05 07:41:17,,pub,,"[{'mime_type': 'application/pdf', 'language': 'en', 'eprintid': 3246, 'placement': 1, 'security': 'public', 'pos': 1, 'format': 'text', 'uri': 'http://repository.lppm.unila.ac.id/id/document/3142', 'rev_number': 1, 'main': 'Buku Referensi Rasionalitas Graha Ilmu_Dr. Novita Tresiana (lengkap).pdf', 'docid': 3142, 'files': [{'uri': 'http://repository.lppm.unila.ac.id/id/file/22623', 'objectid': 3142, 'filesize': 3460656, 'datasetid': 'document', 'mtime': '2017-06-03 04:54:33', 'hash_type': 'MD5', 'filename': 'Buku Referensi Rasionalitas Graha Ilmu_Dr. Novita Tresiana (lengkap).pdf', 'hash': '7ffd41948eddd261427839285a669ba5', 'fileid': 22623, 'mime_type': 'application/pdf'}]}]",Graha ilmu press,http://repository.lppm.unila.ac.id/id/eprint/3246,public,TRUE,book,['FISIP2'],,,"[{'id': 'novita.tresiana@fisip.unila.ac.id', 'name': {'given': 'novita', 'lineage': None, 'honourific': None, 'family': 'novita tresiana'}}]",2015-01-01 00:00:00.000000000,disk0/00/00/32/46,archive,2017-06-05 07:41:17,['H1'],"Kegagalan keputusan kebijakan dalam menyelesaikan persoalan publik secara substantif sangat berkorelasi dengan hasil proses tindakan yang dilakukan oleh seorang atau sejumlah aktor yang dapat terlihat dalam putusan di setiap tahapan dan proses kebijakan publik. Hal ini penting mengingat kebijakan  seharusnya dapat menyelesaikan persoalan publik secara cerdas, bijaksana dan memberikan harapan bagi semua pihak. Perspektif rasionalitas dalam pembuatan keputusan kebijakan merupakan gagasan untuk mengatasi terjadinya kegagalan dalam pembuatan keputusan kebijakan. Rasionalitas dalam pembuatan keputusan kebijakan memerlukan metode dan teknik, dimensi-dimensi potensial untuk mendapatkan informasi, selain tentunya  penggunaan  informasi untuk menghasilkan keputusan kebijakan yang paling mendekati rasionalitas yang substantif. Oleh karena itu diperlukan sebuah model dan teknik yang paling aplikatif dalam memandang hubungan antara pengetahuan dan kekuasaan serta sifat rasionalitas. Dengan demikian, diharapkan akan menghasilkan keputusan lebih baik (heuristic).  
Buku ini berisi uraian tentang bagaimana upaya pembuat keputusan menghasilkan keputusan yang bijak melalui model dan teknik analisis keputusan yang rasional sehingga dapat memecahkan persoalan publik secara cerdas, bijaksana dan memberikan harapan bagi meningkatkan harkat dan martabat kehidupan publik. Pembahasan juga dilengkapi dengan model dan teknik deliberative (musyawarah) dalam pembuatan keputusan kebijakan dan urgensi dimensi kognitif serta networking dalam pembuatan keputusan yang rasional. Pembahasan didasarkan pada hasil-hasil penelitian yang diperkuat dengan landasan teoritik yang relevan.",http://grahailmu.co.id/index/buku/detail/0/1/3/10/buku1540.html,Rasionalitas dan pembuatan keputusan kebijakan,14,1,show,3246,published,,"[{'type': 'pub', 'url': 'http://index/buku/detil/0/1/3/10/buku1540.html'}]",,Yogyakarta,978-602-262-513-1
