,divisions,type,dir,publication,creators,issn,datestamp,lastmod,userid,full_text_status,uri,refereed,ispublished,publisher,documents,eprintid,subjects,abstract,eprint_status,status_changed,rev_number,metadata_visibility,title,date_type,number,official_url,volume
0,['FMIPA10'],article,disk0/00/03/49/46,IOP Conf. Series: Journal of Physics: Conf. Series 1338 (2019) 012033,"[{'name': {'honourific': None, 'family': 'Irawan', 'lineage': None, 'given': 'Agus'}, 'id': None}, {'id': 'asmiati,1976@fmipa.unila.ac.id', 'name': {'given': 'Asmiati', 'family': 'Asmiati', 'honourific': None, 'lineage': None}}, {'name': {'lineage': None, 'family': 'Suharsono', 'honourific': None, 'given': 'Suharsono'}, 'id': 'suharsono.1962@fmipa.unila.ac.id'}, {'id': 'kurnia.muludi@fmipa.unila.ac.id', 'name': {'lineage': None, 'family': 'Muludi', 'honourific': None, 'given': 'Kurnia'}}]",Online ISSN: 1742-6596,2021-11-04 01:10:50,2021-11-04 01:10:50,883,public,http://repository.lppm.unila.ac.id/id/eprint/34946,TRUE,pub,IOP Science,"[{'mime_type': 'application/pdf', 'language': 'en', 'eprintid': 34946, 'security': 'public', 'placement': 1, 'format': 'text', 'pos': 1, 'uri': 'http://repository.lppm.unila.ac.id/id/document/155632', 'rev_number': 1, 'main': 'The Locating-Chromatic Number for Certain Operation of Generalized Petersen Graphs sP(4,2) - IOP - Irawan.pdf', 'docid': 155632, 'files': [{'objectid': 155632, 'uri': 'http://repository.lppm.unila.ac.id/id/file/409261', 'datasetid': 'document', 'filesize': 754215, 'fileid': 409261, 'mime_type': 'application/pdf', 'hash_type': 'MD5', 'mtime': '2021-11-03 14:06:09', 'filename': 'The Locating-Chromatic Number for Certain Operation of Generalized Petersen Graphs sP(4,2) - IOP - Irawan.pdf', 'hash': 'e481cc623e0e0deb37b41e314a0ab817'}]}]",34946,['QA75'],"The locating-chromatic number of a graph combined two graph concept, coloring
vertices and partition dimension of a graph. The locating-chromatic number, denoted by",archive,2021-11-04 01:10:50,6,show,"The Locating-Chromatic Number for Certain Operation of Generalized Petersen Graphs sP(4,2)",,,,
1,['FMIPA10'],article,disk0/00/03/49/51,Jurnal Pendidikan Teknologi dan Kejuruan,"[{'id': 'henisulistiani@teknokrat.ac.id', 'name': {'given': 'Heni', 'honourific': None, 'family': 'Sulistiani', 'lineage': None}}, {'id': 'kurnia.muludi@fmipa.unila.ac.id', 'name': {'given': 'Kurnia', 'lineage': None, 'honourific': None, 'family': 'Muludi'}}]",2541-0652,2021-11-04 01:13:19,2021-11-04 01:13:19,883,public,http://repository.lppm.unila.ac.id/id/eprint/34951,TRUE,pub,,"[{'language': 'en', 'mime_type': 'application/pdf', 'eprintid': 34951, 'placement': 1, 'security': 'public', 'pos': 1, 'format': 'text', 'uri': 'http://repository.lppm.unila.ac.id/id/document/155636', 'rev_number': 1, 'docid': 155636, 'main': 'jurnal heni.pdf', 'files': [{'mime_type': 'application/pdf', 'fileid': 409285, 'hash': '4cdb02eb60c274f0945002835c04ad40', 'filename': 'jurnal heni.pdf', 'mtime': '2021-11-03 14:22:31', 'hash_type': 'MD5', 'datasetid': 'document', 'filesize': 545328, 'objectid': 155636, 'uri': 'http://repository.lppm.unila.ac.id/id/file/409285'}]}]",34951,['QA75'],"Karet (Hevea brasiliensis) termasuk dalam genus Hevea dari familia Euphorbiaceae, merupakan pohon kayu tropis yang berasal dari hutan Amazon. Banyak artikel dan penelitian yang menyebutkan bahwa hingga saat ini Indonesia telah memiliki luas areal perkebunan karet terluas namun tidak didukung dengan produktivitas yang tinggi. Hal tersebut tentu saja akan menimbulkan kerugian ekonomi. Kerugian ekonomi dari budidaya karet disebabkan adanya serangan penyakit. Pengetahuan para petani tentang penanganan penyakit pada tanaman karet juga masih rendah. Namun, seiring dengan kemajuan teknologi dalam berbagai aspek kehidupan saat ini menjadikan para pengembang teknologi untuk membuat aplikasi baru yang lebih memudahkan masyarakat dalam memperoleh informasi. Metode certainty factor sering digunakan dalam sistem pakar agar terlihat lebih natural. Penelitian ini menekankan pada dua aspek utama yaitu gejala-gejala dan jenis penyakit pada pohon karet. Hasil penelitian menunjukkan bahwa penerapan metode certainty factor pada penelitian ini, memiliki akurasi sebesar 100% dari hasil diagnosa sistem pakar.",archive,2021-11-04 01:13:19,6,show,PENERAPAN METODE CERTAINTY FACTOR DALAM MENDETEKSI PENYAKIT TANAMAN KARET,published,,,
2,['FMIPA10'],article,disk0/00/03/49/48,IOP Conf. Series: Journal of Physics: Conf. Series 1338 (2019) 012033,"[{'name': {'given': 'Heni', 'family': 'Sulistiani', 'honourific': None, 'lineage': None}, 'id': 'henisulistiani@teknokrat.ac.id'}, {'id': 'kurnia.muludi@fmipa.unila.ac.id', 'name': {'lineage': None, 'family': 'Muludi', 'honourific': None, 'given': 'Kurnia'}}, {'id': 'admi_syarif@yahoo.com', 'name': {'given': 'Admi', 'family': 'Syarif', 'honourific': None, 'lineage': None}}]",Online ISSN: 1742-6596,2021-11-04 01:10:59,2021-11-04 01:10:59,883,public,http://repository.lppm.unila.ac.id/id/eprint/34948,TRUE,pub,IOP Science,"[{'security': 'public', 'placement': 1, 'eprintid': 34948, 'language': 'en', 'mime_type': 'application/pdf', 'files': [{'datasetid': 'document', 'filesize': 446074, 'mime_type': 'application/pdf', 'fileid': 409270, 'filename': 'Sulistiani_2019_J._Phys.__Conf._Ser._1338_012050.pdf', 'hash': 'a7057199379410879f9e535f80c7e699', 'hash_type': 'MD5', 'mtime': '2021-11-03 14:12:43', 'objectid': 155634, 'uri': 'http://repository.lppm.unila.ac.id/id/file/409270'}], 'docid': 155634, 'main': 'Sulistiani_2019_J._Phys.__Conf._Ser._1338_012050.pdf', 'rev_number': 1, 'uri': 'http://repository.lppm.unila.ac.id/id/document/155634', 'format': 'text', 'pos': 1}]",34948,['QA75'],"Fast Moving Consumer Goods (FMCG) is known one of the important industrial sectors
worldwide. It includes household and personal care products as well as processed foods and
beverages. Because of the tight competition company must develop good marketing strategies. So, it
is important for the company to know customer loyalty and also to predict the income as reference
in company development planning. Data mining now is becoming popular technique for predicting
customer loyalty. One of the well known data mining strategies is retaining customer’s strategy. In
this paper, we would present a new model for predicting customer loyalty. The model is based on
Dynamic Mutual Information and Support Vector Machine (DMI-SVM) to identify the relevant
factors that affect the performance of the classification of customer loyalty. The comparison of two
classification methods and several selected features is given to show the effectiveness of the methods.
We validated the model by 10-fold cross validation method. Classification accuracy, precision, recall
and f-measure are used to evaluate classifier performance on a test/hold-out sample. A result in this
paper is shown that SVM method gives better performance accuracy than Naïve Bayes.",archive,2021-11-04 01:10:59,6,show,Implementation of Dynamic Mutual Information and Support Vector Machine for Customer Loyalty Classification,published,,,
3,['FMIPA10'],article,disk0/00/03/49/49,Jurnal Teknika,"[{'id': None, 'name': {'given': 'Andri', 'family': 'Winata', 'honourific': None, 'lineage': None}}, {'name': {'family': 'Zuriana', 'honourific': None, 'lineage': None, 'given': 'Zuriana'}, 'id': None}, {'id': None, 'name': {'family': 'Herlina', 'honourific': None, 'lineage': None, 'given': 'Herlina'}}, {'name': {'given': 'ketut', 'honourific': None, 'family': 'artaye', 'lineage': None}, 'id': None}, {'id': None, 'name': {'family': 'Mardiana', 'honourific': None, 'lineage': None, 'given': 'Mardiana'}}, {'name': {'honourific': None, 'family': 'Muludi', 'lineage': None, 'given': 'Kurnia'}, 'id': 'kurnia.muludi@fmipa.unila.ac.id'}]",2622-3481,2021-11-04 01:11:03,2021-11-04 01:11:03,883,public,http://repository.lppm.unila.ac.id/id/eprint/34949,TRUE,pub,PPPM Politeknik Negeri Sriwijaya Palembang,"[{'main': 'Rancang Bangun Perpustakaan Digital.pdf', 'docid': 155635, 'files': [{'mtime': '2021-11-03 14:15:54', 'hash_type': 'MD5', 'filename': 'Rancang Bangun Perpustakaan Digital.pdf', 'hash': '9e563e0570738bad82681f20db479016', 'fileid': 409276, 'mime_type': 'application/pdf', 'filesize': 802163, 'datasetid': 'document', 'uri': 'http://repository.lppm.unila.ac.id/id/file/409276', 'objectid': 155635}], 'pos': 1, 'format': 'text', 'uri': 'http://repository.lppm.unila.ac.id/id/document/155635', 'rev_number': 1, 'eprintid': 34949, 'placement': 1, 'security': 'public', 'mime_type': 'application/pdf', 'language': 'en'}]",34949,['QA75'],"Berdasarkan surat edaran Dirjen Dikti No. 152/E/T/2012 tanggal 27 Januari 2012 yang dituju kepada :Rektor/Ketua/Direktur PTN/PTS di seluruh Indonesia menyatakan bahwa publikasi hasil penelitian menjadi persyaratan wajib bagi mahasiswa pasca untuk lulus, karena itu kualitas penelitian mahasiswa harus semakin baik dan dapat diterima di jurnal nasional terakreditasi atau jurnal international bereputasi. Hal ini menjadi tugas besar para pengelola program pascasarjana dan dosen-dosen pembimbing untuk mendorong dan melibatkan mahasiswa pasca untuk dapat mempublikasikan hasil penelitiannya. Salah satunya dengan memfasilitasi dengan literature-literature baik buku, maupun jurnal-jurnal yang berkualitas yang dapat diakses di perpustakaan lingkungan mahasiswa berada. Penelitian ini bertujuan untuk mendesain manajemen perpustakaan berbasis digital. Hasil penelitiannya bahwa program perpustakaan digital telah dibuat dari tampilan awal masuk perpustakaan digital sampai proses peminjaman buku, namun tampilan perpustakan digital masih sederhana.",archive,2021-11-04 01:11:03,8,show,Rancang Bangun Perpustakaan Digital,published,1.0,http://jurnal.polsri.ac.id/index.php/teknika,13.0
4,['FMIPA10'],article,disk0/00/03/49/52,Jour of Adv Research in Dynamical & Control Systems,"[{'id': None, 'name': {'given': 'Andri', 'honourific': None, 'family': 'Winata', 'lineage': None}}, {'name': {'given': 'Zuriana', 'lineage': None, 'honourific': None, 'family': 'Zuriana'}, 'id': None}, {'name': {'given': 'Mardiana', 'lineage': None, 'honourific': None, 'family': 'Mardiana'}, 'id': None}, {'name': {'given': 'Kurnia', 'honourific': None, 'family': 'Muludi', 'lineage': None}, 'id': 'kurnia.muludi@fmipa.unila.ac.id'}]",1943-023X,2021-11-04 01:13:22,2021-11-04 01:13:22,883,public,http://repository.lppm.unila.ac.id/id/eprint/34952,TRUE,pub,JARDCS,"[{'pos': 1, 'format': 'text', 'rev_number': 1, 'uri': 'http://repository.lppm.unila.ac.id/id/document/155637', 'docid': 155637, 'main': 'darmajaya join research-How to Build Digital Library in University - Jour of Adv Research in Dynamical & Control Systems, Vol. 11.pdf', 'files': [{'fileid': 409291, 'mime_type': 'application/pdf', 'hash_type': 'MD5', 'mtime': '2021-11-03 14:28:11', 'hash': '3342d38a7458b071bfc9877f3d2a2897', 'filename': 'darmajaya join research-How to Build Digital Library in University - Jour of Adv Research in Dynamical & Control Systems, Vol. 11.pdf', 'datasetid': 'document', 'filesize': 333676, 'objectid': 155637, 'uri': 'http://repository.lppm.unila.ac.id/id/file/409291'}], 'mime_type': 'application/pdf', 'language': 'en', 'eprintid': 34952, 'placement': 1, 'security': 'public'}]",34952,['QA75'],"Currently there is euphoria among college librarians. The trigger for the situation is related to the
widespread development of digital-based library concepts. According to Oppenheim and Smithson a digital library
is an information service where all information sources are available / processed in computers and the functions of
acquisition / retrieval, storage, retrieval, access and display using digital technology. The problem in this study is how to build digital library management. This study aims to design digital-based library management. The result of
this research that digital library programs have been made from the initial display into digital libraries to the process of borrowing books, but the appearance of digital libraries is still simple",archive,2021-11-04 01:13:22,6,show,How to Build Digital Library in University,published,5.0,,11.0
