,subjects,abstract,eprint_status,status_changed,rev_number,volume,metadata_visibility,official_url,title,date_type,eprintid,datestamp,pagerange,userid,lastmod,uri,full_text_status,refereed,ispublished,number,documents,divisions,type,dir,date,publication,creators,issn,publisher,contributors,corp_creators,contact_email,referencetext,id_number,succeeds,pres_type,event_type,event_dates,related_url,event_location,event_title
0,"['H1', 'L1']","This study aimed at making inventory and mapping the folklore in West Lampung of Lampung Province and finding out the cultural values contained in folklore. This type of research was qualitative descriptive where the population in this study was the people who live in West Lampung. The samples respondents were selected through purposive sampling with snawball method. The key informant who acted as the respondents were determined by specific criteria; such as 
community leaders, traditional leaders, people who know directly or indirectly on folklore, or a formal government leaders. There were two types of data used in this study, namely primary and secondary data. Primary data were obtained directly from interviews to the respondents while secondary data were obtained indirectly through books and historical records related to the research theme. Data analysis was conducted to determine the cultural values contained in folklore. The results showed that there were seven folklores in West Lampung, namely: 1) Si Pahit 
Lidah and Si Mata Empat (The Story of the Bitter Tongue and the Four Eyes), 2) Naga Danau Ranau (The Dragon of Ranau Lake), 3) Asal Mula Nama Desa Sri Menanti (The origin of Sri Menant Village), 4) Kisah Batu Katai dan Larangan Menikah Antara Warga Desa Gandasuli dan Desa Kunyanyan (Story of the Katai Stone and Prohibition Marriage between Residents of Gandasuli and Kunyanyan Village), 5) Batu Kepampang(Kepampang Stone), 6) Kisah Si Beguk Sakti (The Story of the Magic Mumps), and 7) Asal-usul Nama Way Mengaku (The Origins of Way Mengaku). The values contained in the folklore were social values, religious values, customs,vanity, greed, faithfulness, and the envy.",archive,2021-05-24 06:08:27,7,2.0,show,https://www.folkloredebiyat.org/DergiTamDetay.aspx?ID=1633,Values Folklore in West Lampung Indonesia,published,30601,2021-05-24 06:08:27,597-608,1087,2021-05-24 06:08:27,http://repository.lppm.unila.ac.id/id/eprint/30601,public,TRUE,pub,27,"[{'files': [{'filesize': 446358, 'datasetid': 'document', 'mtime': '2021-05-24 05:55:00', 'hash_type': 'MD5', 'hash': '715fd389c56186dc79ce074cb8e0a79e', 'filename': '756404841_fe 106-14 (2).pdf', 'fileid': 362835, 'mime_type': 'application/pdf', 'uri': 'http://repository.lppm.unila.ac.id/id/file/362835', 'objectid': 137855}], 'main': '756404841_fe 106-14 (2).pdf', 'docid': 137855, 'uri': 'http://repository.lppm.unila.ac.id/id/document/137855', 'rev_number': 1, 'format': 'text', 'pos': 1, 'security': 'public', 'placement': 1, 'eprintid': 30601, 'language': 'en', 'mime_type': 'application/pdf'}]",['FKIP10'],article,disk0/00/03/06/01,2021-02-01 00:00:00.000000000,Folklor,"[{'name': {'honourific': None, 'family': 'Albet Maydiantoro', 'lineage': None, 'given': 'Albet'}, 'id': 'albet.maydiantoro@fkip.unila.ac.id'}, {'name': {'honourific': None, 'family': 'Listumbinang Halengkara', 'lineage': None, 'given': 'Mr'}, 'id': 'listumbinang.halengkara@fkip.unila.ac.id'}]",1300-7491,,,,,,,,,,,,,
1,['L1'],"This study aims to produce problem-based worksheets and to see the feasibility of economic 
worksheets. The type of research used is Research and Development (R&D) Borg and Gall. Limited trials in this 
study were students of class XI IPS 4 at SMA Negeri 1 Seputih Surabaya consisting of individual tests totaling 3 
students with high, medium, and low abilities. Small group trials totaling 9 students with low, medium, and high 
abilities. Data collection techniques using interviews, observation, and questionnaires. Based on the results of 
the limited trial, the overall average score was 3.4 with a percentage of 86. The results of the study obtained, 1) 
problem-based economic LKPD. 2) The results of the feasibility test of problem-based economic LKPD in 
improving critical thinking skills. 75 categories of media experts are feasible, 77 material experts are eligible 
categories, 76 linguists are in the proper category. LKPD based on problems in improving critical thinking 
skills obtained n-gain 0.88 with high criteria. That the critical thinking skills of students who use problem-based 
LKPD are included in the improvement with high criteria. This shows that the use of problem-based LKPD can 
improve students critical thinking skills.
Key Words: Student Worksheets, Problem Based Learning, Critical Thinking Ability",archive,2021-05-28 01:01:20,6,11.0,show,https://www.iosrjournals.org/iosr-jrme/papers/Vol-11%20Issue-2/Series-6/A1102060104.pdf,"Development of Problem Based Student Worksheets to Improve
the Critical Thinking Ability Students of Class XI IPS",published,31085,2021-05-28 01:01:20,01-04,85,2021-05-28 01:01:20,http://repository.lppm.unila.ac.id/id/eprint/31085,public,TRUE,pub,2,"[{'mime_type': 'application/pdf', 'language': 'en', 'security': 'public', 'placement': 1, 'eprintid': 31085, 'uri': 'http://repository.lppm.unila.ac.id/id/document/140402', 'rev_number': 1, 'format': 'text', 'pos': 1, 'files': [{'uri': 'http://repository.lppm.unila.ac.id/id/file/368566', 'objectid': 140402, 'mtime': '2021-05-27 21:50:41', 'hash_type': 'MD5', 'filename': 'Jurnal Erma Wati-pargito-pujiati.pdf', 'hash': '32f95008b3f6ceb46be6ec519f79899a', 'fileid': 368566, 'mime_type': 'application/pdf', 'filesize': 263809, 'datasetid': 'document'}], 'main': 'Jurnal Erma Wati-pargito-pujiati.pdf', 'docid': 140402}]",['FKIP10'],article,disk0/00/03/10/85,1970-01-01 00:00:00.000002021,IOSR Journal of Research & Method in Education (IOSR-JRME),"[{'id': None, 'name': {'honourific': None, 'family': 'Ermawati', 'lineage': None, 'given': 'Ermawati'}}, {'id': 'pargito.1959@fkip.unila.ac.id', 'name': {'family': 'Pargito', 'honourific': None, 'lineage': None, 'given': 'Pargito'}}, {'id': 'pujiatifkipunila@gmail.com', 'name': {'given': 'P', 'family': 'Pujiati', 'honourific': None, 'lineage': None}}]","e-ISSN: 2320–7388, p- ISSN: 2320-737x Volume 11, Issue 2 Ser. VI (Mar. – Apr. 2021), PP 01-04",iosrjournals,,,,,,,,,,,,
2,['L1'],"Social studies learning in the revolutionary era 4.0 should use digital maps to visualize the conditions of the earth's surface so that students interpret social studies subject matter more clearly. This study aims to develop a map media product based on the android application ""ethnic and cultural diversity"". This type of research is research and development using the Borg and Gall model. The stages are (1) research and information gathering, (2) planning, (3) initial product development, and (4) preliminary testing. Collecting data in this study using a validation questionnaire of the feasibility of map media products based on android applications. Data analysis in this research is the feasibility analysis of map media products based on android applications. The result of this research is the development of map media based on android application material on ethnic and cultural diversity that is suitable for use in social studies subjects has been validated by experts and declared ""feasible"" to be used. The author suggests teachers use android-based map media development products for ethnic and cultural diversity in social studies subject for class VII SMP / MTs in order to answer the challenges of technology-based 21st century learning in the current era of industrial revolution 4.0",archive,2021-03-12 02:16:26,6,8.0,show,https://ijmmu.com/index.php/ijmmu/article/view/2380,The Development of Android-Based Map Media on Indonesian Ethnic andCultural Diversity,published,28347,2021-03-12 02:16:26,97-110,85,2021-03-12 02:16:26,http://repository.lppm.unila.ac.id/id/eprint/28347,public,TRUE,pub,3,"[{'pos': 1, 'format': 'text', 'uri': 'http://repository.lppm.unila.ac.id/id/document/42386', 'rev_number': 1, 'main': 'JURNAL ANA, TRISNANINGSIH, PUJIATI.pdf', 'docid': 42386, 'files': [{'objectid': 42386, 'uri': 'http://repository.lppm.unila.ac.id/id/file/251998', 'datasetid': 'document', 'filesize': 1509560, 'fileid': 251998, 'mime_type': 'application/pdf', 'mtime': '2021-03-11 10:27:57', 'hash_type': 'MD5', 'filename': 'JURNAL ANA, TRISNANINGSIH, PUJIATI.pdf', 'hash': '4caf30413396154224f1f39bd2ecb4d2'}], 'language': 'en', 'mime_type': 'application/pdf', 'eprintid': 28347, 'placement': 1, 'security': 'public'}]",['FKIP10'],article,disk0/00/02/83/47,1970-01-01 00:00:00.000002021,International Journal of Multicultural and Multireligious Understanding,"[{'id': None, 'name': {'given': 'Ana Pratiwi', 'honourific': None, 'family': 'Mardatila', 'lineage': None}}, {'name': {'honourific': None, 'family': 'Trisnaningsih', 'lineage': None, 'given': 'Trisna'}, 'id': 'trisna_unila@yahoo.co.id'}, {'name': {'lineage': None, 'honourific': None, 'family': 'Pujiati', 'given': 'P'}, 'id': 'pujiatifkipunila@gmail.com'}]",2364-5369,,,,,,,,,,,,,
3,['L1'],"The purpose of this research is to explain the effectiveness of online learning in growing collaborative learning of the
students during Covid-19 pandemic. This research used qulitative research method. Data collection was through
google form distributed to 57 subject teachers and the interview on the students who conduct online learning. The
research results show that even though the teacher can utilize online learning application well, they still encounter
difficulty in building collaborative learning among the students whereas collaborative learning is a pivotal thing in
building active learning activity on the students. This occurs because there are various obstacles such as the presence
of the students is in different places until it is difficult to do coordination, difficulty in accessing the internet network
especially the students living in the region, the teacher finds difficulty in monitoring the students’ activity during the
online learning until the learning model is more on using lecture method. Therefore, the coordination and support
from the government, parents, the school, even the teacher are necessary in creating online collaborative learning
effectively. On the other hand, that online learning encourages the emergence of social distancing behavior and can
minimize direct contact between the teacher and students.",archive,2021-06-06 14:33:24,6,513.0,show,,"The Effectiveness of Online Collaborative Learning
During Covid-19 Pandemic",published,32113,2021-06-06 14:33:24,256-262,531,2021-06-06 14:33:24,http://repository.lppm.unila.ac.id/id/eprint/32113,public,TRUE,pub,,"[{'pos': 1, 'format': 'text', 'rev_number': 1, 'uri': 'http://repository.lppm.unila.ac.id/id/document/145559', 'docid': 145559, 'main': '125950303.pdf', 'files': [{'mime_type': 'application/pdf', 'fileid': 380045, 'hash': '895323648998e2d672faa0f76bad7d99', 'filename': '125950303.pdf', 'mtime': '2021-06-06 04:19:31', 'hash_type': 'MD5', 'datasetid': 'document', 'filesize': 367617, 'objectid': 145559, 'uri': 'http://repository.lppm.unila.ac.id/id/file/380045'}], 'mime_type': 'application/pdf', 'language': 'en', 'eprintid': 32113, 'placement': 1, 'security': 'public'}]",['FKIP10'],article,disk0/00/03/21/13,1970-01-01 00:00:00.000002021,"Advances in Social Science, Education and Humanities Research, volume 513 4th Sriwijaya University Learning and Education International Conference (SULE-IC 2020)","[{'name': {'honourific': None, 'family': 'Mustakim', 'lineage': None, 'given': 'Mustakim'}, 'id': 'mustakim.101119@students.unila.ac.id'}, {'id': 'trisna_unila@yahoo.co.id', 'name': {'lineage': None, 'family': 'Trisnaningsih', 'honourific': None, 'given': 'Trisna'}}, {'id': 'mohammad.monaadha@fkip.unila.ac.id', 'name': {'given': 'Muhammad Mona', 'lineage': None, 'honourific': None, 'family': 'Adha'}}]",,Atlantis Press SARL,"[{'id': 'mohammad.monaadha@fkip.unila.ac.id', 'name': {'honourific': None, 'family': 'Adha', 'lineage': None, 'given': 'Muhammad'}}]","['Universitas Lampung', 'Universitas Lampung', 'Universitas Lampung']",mohammad.monaadha@fkip.unila.ac.id,"[1] Budiningsih Budi, Belajar dan pembelajaran, PT
Rineka Cipta, 2005
[2] Mulyono, Strategi pembelajaran, UIN-Maliki, 2012.
[3] M. M. Adha, E. P. Ulpa, J. M. Johnstone, B. L.
Cook, Pendidikan moral pada aktivitas
kesukarelaan warga negara muda (koherensi sikap
kepedulian dan kerjasama individu). Journal of
Moral and Civic Education, vol. 3, 28-37.
[4] S. Sadiman, Arief Raharjo, R Haryono, Rahardjito
Anung, Media pendidikan, Rajawali, 1990.
[5] Sharon E Smaldino, Lowther, L. Deborah, James
Russel D, Instructional technology & media for
learning teknologi pembelajaran dan media untuk
belajar (9thed), 2011, Kencana.
[6] LKPP Univ. Hasanuddin. Model Pembelajaran
Kolaboratif Bagi Pendidikan, 2011, Universitas
Hasanuddin.
[7] E, Ikhtiarti, Rohman, M. M. Adha, Yanzi, H,
Membangun generasi muda smart and good
citizenship melalui pembelajaran ppkn menghadapi
tantangan revolusi industri. prosiding seminar
nasional pendidikan fakultas keguruan universitas
lampung, 2019, pp. 348-360.
[8] A. K. Arora, R. Srinivasan, Impact of pandemic
COVID-19 on the teaching – learning process: A
study of higher education teachers. Prabadhan:
Indian Journal of Management, 2020, vol 13. DOI:
https://doi.org/10.17010/pijom/2020/v13i4/15182
[9] J Anderson, Should schools close when coronavirus
cases are still rare? Quartz. Retrieved from
https://qz.com/1810224/does-closing-schoolsprotect-kids-and-us-from-coronavirus/, 2020.
[10] M.B. Miles, M. Huberman, Qualitative data
analysis second edition, 1994, SAGE Publications.
[11] M. K. Naserly, implementasi zoom, google
classroom, dan whatsapp group dalam mendukung
pembelajaran daring (online) pada mata kuliah
bahasa inggris lanjut (studi kasus pada 2 kelas
semester 2, jurusan administrasi bisnis, fakultas
ekonomi dan bisnis, universitas bina sa. Aksara
Public, vol. 4, pp. 155-165.
[12] P. Astuti, P. Febrian, Blended learning syarah:
bagaimana penerapan dan persepsi mahasiswa,
Jurnal Gantang, vol 4, 2019, pp. 111- 119.
[13] A. Anggrawan, Analisis deskriptif hasil belajar
pembelajaran tatap muka dan pembelajaran online
menurut gaya belajar mahasiswa. MATRIK: Jurnal Manajemen, Teknik Informatika Dan Rekayasa
Komputer, vol 18, 2019, pp. 339-346.
[14] R.A.Pangondian, P.I. Santosa, E. Nugroho, faktorfaktor yang mempengaruhi kesuksesan
pembelajaran daring dalam revolusi industri 4.0. In
Seminar Nasional Teknologi Komputer & Sains
(SAINTEKS), vol. 1, 2019.
[15] E. Barkley, Elizabert, K. Patricia Cross, Clarie
Howell Major, Collaborative learning techniques,
Nusa Media, 2014.
[16] N. Suryani, Implementasi model pembelajaran
kolaboratif untuk meningkatkan ketrampilan sosial
siswa. Majalah Ilmiah Pembelajaran, vol 8, 2010.
[17] P. Wahyono, H. Husamah, A. S Budi, Guru
profesional di masa pandemi covid-19: review
implementasi, tantangan, dan solusi pembelajaran
daring, Jurnal Pendidikan Profesi Guru, vol 1,
2020, pp. 51-65
[18] A. Purwanto, R. Pramono, M. Asbari, P. Budi
Santoso, L. Mayesti Wijayanti, C Chi Hyun,
Putri R Setyowati, Studi eksploratif dampak
pandemic COVID-19 terhadap proses pembelajaran
online di sekolah dasar. Journal of Education,
Psychology and Counseling, vol 2, 2020, pp. 1–12.
[19] A. Khoiriyah, Pembelajaran kolaboratif pada
matematika untuk membentuk karakter
generasi. JMPM: Jurnal Matematika dan
Pendidikan Matematika, vol 1, 2016, pp. 13-22.
[20] N. Oknisih, S. Suyoto, Penggunaan Aplen
(Aplikasi Online) Sebagai Upaya Kemandirian
Belajar Siswa. In Seminar Nasional Pendidikan
Dasar, vol. 1.
[21] A. Sadikin, N. Hakim, pengembangan media elearning interaktif dalam menyongsong revolusi
industri 4.0 pada materi ekosistem untuk siswa sma.
biodik, vol 5, 2019, pp. 131-138.
[22] M. Arzayeva, K. Rakhimzhanov, Abdrahmanova,
A. K, U Umitkaliev, Special aspects of distance
learning in educational system, Anthropologist, vol
22, 2015, pp. 449-454.",,,,,,,,
4,"['LB', 'LB1603']","This study aims to determine and analyze the effect of parenting democratic parenting on character based learning achievement in class students XI IPS MA Al-Fatah Natar. This research is included in quantitative research using a correlative pattern. The population in this study amounted to 40 students who were divided into 2 classes in MA Al-Fatah. The sample used in this study were all students, totaling 40 students. Data was collected by means of a questionnaire. The analysis used is simple regression analysis. The results of this study indicate that the relationship between democratic parenting of parents with learning achievement in students MA Al-Fatah Natar Lampung, The hypothesis can be accepted from the results of the t-test table showing that the value of tcount (28,392) greater than ttable (2.023), with significant level 0, 00 (p-value< 0, 05). This shows that the better the democratic parenting of parents, the better the learning achievement of students.",archive,2023-02-14 04:16:49,7,8.0,show,https://ijmmu.com/index.php/ijmmu/article/view/3150/2741,The Influence of Parents Democratic Parenting on Character Based Learning Achievement,published,48370,2023-02-14 04:16:49,402-408,3493,2023-02-14 04:16:49,http://repository.lppm.unila.ac.id/id/eprint/48370,public,TRUE,pub,11,"[{'security': 'public', 'placement': 1, 'eprintid': 48370, 'language': 'en', 'mime_type': 'application/pdf', 'files': [{'objectid': 187659, 'uri': 'http://repository.lppm.unila.ac.id/id/file/528159', 'mime_type': 'application/pdf', 'fileid': 528159, 'hash': '9edf826578b8e45379f82ed0d7685dfc', 'filename': '3150-9737-1-PB.pdf', 'mtime': '2023-02-14 04:00:16', 'hash_type': 'MD5', 'datasetid': 'document', 'filesize': 540153}], 'main': '3150-9737-1-PB.pdf', 'docid': 187659, 'rev_number': 1, 'uri': 'http://repository.lppm.unila.ac.id/id/document/187659', 'format': 'text', 'pos': 1}]",['FKIP10'],article,disk0_bak/00/04/83/70,2021-11-17 00:00:00.000000000,International Journal of Multicultural and Multireligious Understanding,"[{'name': {'lineage': None, 'honourific': None, 'family': 'Nurhayati', 'given': 'Novia'}, 'id': None}, {'id': 'profdrsudjarwo@gmail.com', 'name': {'given': 'SUDJARWO', 'lineage': None, 'family': 'SUDJARWO', 'honourific': None}}, {'name': {'lineage': None, 'family': 'Novia Fitri Istiawati', 'honourific': None, 'given': 'Novia Fitri Istiawati'}, 'id': 'novia.istiawati@fkip.unila.ac.id'}]",2364-5369,International Journal of Multicultural and Multireligious Understanding (IJMMU),"[{'type': 'http://www.loc.gov/loc.terms/relators/AUT'}, {'type': 'http://www.loc.gov/loc.terms/relators/AUD'}, {'type': 'http://www.loc.gov/loc.terms/relators/AUS'}]","['Universitas Lampung', 'Universitas Lampung']",,,tp://dx.doi.org/10.18415/ijmmu.v8i11.3150,,,,,,,
5,['L1'],"This study aims to analyze the effect of emotional intelligence on students characters, to analyze
the influence of spiritual intelligence with student characteristics, analyzing the influence of emotional
intelligence and spiritual intelligence on the character of students. This research method is a quantitative
study using correlational analysis. The population in this study were students of class VII SMP Negeri 2
Wonosobo Tanggamus. The research sample of 69 students, the sampling technique used was simple
random sampling. This research uses data collection techniques using observation, interviews,
questionnaires, documentation, literature study. The results of this study indicate that: 1) there is an effect
of emotional intelligence on the character of class students with tcount> ttable or 3.268> 1.996; 2) there is
an influence of spiritual intelligence on the character of students with tcount> ttable or 3,112> 1,996; and
3) there is an influence of emotional intelligence and spiritual intelligence on the character of students
with Fcount> Ftable or 10.139> 3.14. This indicates that the higher the emotional intelligence and
spiritual intelligence, the better the character of the students.",archive,2021-11-08 05:20:53,7,8.0,show,https://ijmmu.com/index.php/ijmmu/article/view/2677,The Effect of Emotional Intelligence and Intelligence Spiritual with Student Characters,published,35451,2021-11-08 05:20:53,108-114,1087,2021-11-08 05:20:53,http://repository.lppm.unila.ac.id/id/eprint/35451,public,TRUE,pub,6,"[{'eprintid': 35451, 'placement': 1, 'security': 'public', 'mime_type': 'application/pdf', 'language': 'en', 'main': '1. JOURNAL PRASETYO WULANDARI 1723031020.pdf', 'docid': 156323, 'files': [{'filesize': 1026273, 'datasetid': 'document', 'hash_type': 'MD5', 'mtime': '2021-11-08 02:22:43', 'hash': '452e07c54eab8140b0dea4bddb37ce89', 'filename': '1. JOURNAL PRASETYO WULANDARI 1723031020.pdf', 'fileid': 413337, 'mime_type': 'application/pdf', 'uri': 'http://repository.lppm.unila.ac.id/id/file/413337', 'objectid': 156323}], 'pos': 1, 'format': 'text', 'rev_number': 1, 'uri': 'http://repository.lppm.unila.ac.id/id/document/156323'}]",['FKIP10'],article,disk0/00/03/54/51,1970-01-01 00:00:00.000002021,International Journal of Multicultural and Multireligious Understanding,"[{'id': None, 'name': {'given': 'PW', 'family': 'Prasetyo Wulandari', 'honourific': None, 'lineage': None}}, {'id': 'profdrsudjarwo@gmail.com', 'name': {'given': 'SUDJARWO', 'lineage': None, 'honourific': None, 'family': 'SUDJARWO'}}, {'name': {'lineage': None, 'honourific': None, 'family': 'Erlina Rufaidah', 'given': 'ER'}, 'id': 'erlinarufaidah1958@gmail.com'}]",2364-5369,International Journal of Multicultural and Multireligious Understanding,,,,,,,,,,,,
6,['L1'],"Education and culture have a very strong relationship, culture will not grow and develop without an educational process. The purpose of this study was to determine the implementation of academic culture in the History Subject at MAN 2 Bandar Lampung. The method used in this research is the descriptive qualitative research method. Data collection techniques used in this study were in-depth interviews, observation, and documentation. The reason the researcher uses this research technique is that in qualitative research to collect information involves direct participation, in the form of in-depth interviews, field observations, and reviewing documents that support the research. Data analysis consists of three activities that occur simultaneously, namely: data reduction, data presentation, drawing conclusions/verification. The implementation of academic culture in History Subjects at MAN 2 Bandar Lampung is as follows: 1) Respect for opinions, 2) Rational thinking with responsibility, 3) Reading habits, 4) Addition of knowledge and insight, 5) Habit of researching and serving the community, 6) Writing articles, papers, books, 7) Scientific discussion.",archive,2021-05-25 03:12:27,6,4.0,show,https://ijessr.com/,"IMPLEMENTATION OF ACADEMIC CULTURE IN HISTORICAL LESSONS IN 
MADRASAH ALIYAH NEGERI 2 BANDAR LAMPUNG",published,30715,2021-05-25 03:12:27,28-35,1087,2021-05-25 03:12:27,http://repository.lppm.unila.ac.id/id/eprint/30715,public,TRUE,pub,1,"[{'pos': 1, 'format': 'text', 'uri': 'http://repository.lppm.unila.ac.id/id/document/138427', 'rev_number': 1, 'main': 'jurnal bu yuta (1).pdf', 'docid': 138427, 'files': [{'fileid': 364233, 'mime_type': 'application/pdf', 'mtime': '2021-05-25 03:03:17', 'hash_type': 'MD5', 'filename': 'jurnal bu yuta (1).pdf', 'hash': 'ac93c1580002ef3a73330cf5c7de3f06', 'datasetid': 'document', 'filesize': 1130770, 'objectid': 138427, 'uri': 'http://repository.lppm.unila.ac.id/id/file/364233'}], 'mime_type': 'application/pdf', 'language': 'en', 'eprintid': 30715, 'placement': 1, 'security': 'public'}]",['FKIP10'],article,disk0/00/03/07/15,2021-01-01 00:00:00.000000000,International Journal of Education and Social Science Research,"[{'id': 'risma_msinaga@gmail.com', 'name': {'given': 'RMS', 'lineage': None, 'honourific': None, 'family': 'Risma M Sinaga'}}]",2581-5148,,,,,,,,,,,,,
