,subjects,abstract,eprint_status,status_changed,rev_number,volume,metadata_visibility,official_url,title,date_type,eprintid,datestamp,pagerange,userid,lastmod,uri,full_text_status,refereed,ispublished,number,documents,divisions,type,dir,date,publication,creators,issn,publisher,contributors,corp_creators,contact_email,referencetext,id_number,succeeds,pres_type,event_type,event_dates,related_url,event_location,event_title
7,"['GN', 'H1']","One of the common problems in a society that originates from multiculturalism is the emergence of a dichotomy in the community resulting in differences between ethnic groups. This distinction is often measured by domination, marginalization, majority or minority, and even stereotypes attached to each group or ethnicity. Not infrequently also formed a pattern that labels a local community and migrants. The complexity of inter-ethnic relations in multicultural societies requires controlling models for the relations with conflict potential. Actually, the concept of ethnic identity still leaves debate that is not over, especially among experts in the social sciences. However, at least we need to get an overview of this construct. One of the strongest elements in the cultural structure of a society that can support multicultural relationships that are equilibrium and harmony is kinship because there is a mechanism in maintaining wholeness. This study aims to reveal the meaning of kinship commodification in local ethnic groups in Lampung and reveal the implicit meaning of the commodification of kinship. As a qualitative study, interviews were the main instrument for obtaining a native perspective (the giver and recipient of a title) and observing the custom ritual of awarding the title holistically and supported by several relevant documents. Collected data by rolling out information on some (original) informants to get their perspective on the culture of lifting titles for migrants who used a kinship perspective. This study also used participatory observation to get a complete picture of the commodification of kinship in multicultural relationships. The research location included the Lampung society dominated by Papadun and Saibatin communities. The results showed that the positioning of Lampung ethnicity at the minority level in a multicultural society increased their ability to cultivate a title culture in their community structure as a tool of resistance by adopting kinship. Cultural actions with kinship patterns and symbols make other people like relatives or family. Even the title becomes an instrument of cultural harmony in multicultural relations. The title of Lampung’s local ethnic kinship becomes the identity at stake because the title found a compromise of identity that is always modified.",archive,2022-03-28 01:29:06,7,27.0,show,https://folkloredebiyat.org/SonSayi.Aspx,The Kinship Commodification of Local Ethnic in Lampung in Multicultural Relations,published,40538,2022-03-28 01:29:06,1163-1173,820,2022-03-28 01:29:06,http://repository.lppm.unila.ac.id/id/eprint/40538,public,TRUE,pub,4(108),"[{'eprintid': 40538, 'placement': 1, 'security': 'public', 'mime_type': 'application/pdf', 'language': 'en', 'main': '770644176_108.12.makale Risma M.Sinaga (The Kinship Commodification).pdf', 'docid': 161862, 'files': [{'filesize': 286059, 'datasetid': 'document', 'mtime': '2021-11-10 04:10:42', 'hash_type': 'MD5', 'hash': '27bc86c2b54154b7f6440f19a158a3ec', 'filename': '770644176_108.12.makale Risma M.Sinaga (The Kinship Commodification).pdf', 'fileid': 451721, 'mime_type': 'application/pdf', 'uri': 'http://repository.lppm.unila.ac.id/id/file/451721', 'objectid': 161862}], 'pos': 1, 'format': 'text', 'rev_number': 2, 'uri': 'http://repository.lppm.unila.ac.id/id/document/161862'}, {'format': 'text', 'pos': 2, 'rev_number': 1, 'uri': 'http://repository.lppm.unila.ac.id/id/document/161863', 'main': 'The Kinship Commodification of Local Ethnic in Lampung in Multicultural Relations,.pdf', 'docid': 161863, 'files': [{'hash': '59221e695f0f8fee0b657702baa50bc4', 'filename': 'The Kinship Commodification of Local Ethnic in Lampung in Multicultural Relations,.pdf', 'hash_type': 'MD5', 'mtime': '2022-03-25 07:57:19', 'mime_type': 'application/pdf', 'fileid': 451723, 'filesize': 2120115, 'datasetid': 'document', 'uri': 'http://repository.lppm.unila.ac.id/id/file/451723', 'objectid': 161863}], 'mime_type': 'application/pdf', 'language': 'en', 'eprintid': 40538, 'security': 'public', 'placement': 2}, {'pos': 3, 'format': 'text', 'rev_number': 2, 'uri': 'http://repository.lppm.unila.ac.id/id/document/161864', 'formatdesc': 'Similaritas', 'main': 'The Kinship Commodification of Local Ethnic in Lampung in Multicultural Relations,.pdf', 'docid': 161864, 'files': [{'uri': 'http://repository.lppm.unila.ac.id/id/file/451725', 'objectid': 161864, 'filesize': 2120115, 'datasetid': 'document', 'hash_type': 'MD5', 'mtime': '2022-03-25 07:57:58', 'filename': 'The Kinship Commodification of Local Ethnic in Lampung in Multicultural Relations,.pdf', 'hash': '59221e695f0f8fee0b657702baa50bc4', 'fileid': 451725, 'mime_type': 'application/pdf'}], 'language': 'en', 'mime_type': 'application/pdf', 'eprintid': 40538, 'placement': 3, 'security': 'public'}]",['FKIP10'],article,disk0/00/04/05/38,2021-11-01 00:00:00.000000000,"folklor/edebiyat,","[{'id': 'sinaga_rmargaretha@yahoo.com', 'name': {'lineage': None, 'honourific': None, 'family': 'Sinaga', 'given': 'Risma Margaretha'}}]",1300-7491,Uluslararasi Kibris Universitesi Fen-Edebiyat Fakultesi,,,,,,35756.0,,,,,,
8,['L1'],"Kehadiran Covid-19 mau tidak mau merubah aktivitas manusia kedalam 
aktivitas-aktivitas yang tidak biasa tak terkecuali dalam dunia Pendidikan. Kebijakan 
Pembelajaran Jarak Jauh menuntut seorang pendidik untuk terus mencari strategi dan 
berinovasi agar kegiatan pembelajaran dapat berjalan sebagaimana mestinya sehingga 
hak-hak dari peserta didik tetap dapat mereka dapatkan. Rumusan masalah dalam 
penelitian ini adalah bagaimana efektivitas media pembelajaran Ilmu Pengetahuan Sosial 
pada masa pandemi covid-19 di SMP Negeri 3 Banjar Agung. Adapun Tujuan penelitian 
ini adalah untuk menganalisis kesiapan media pembelajaran guna memperoleh informasi 
efektivitas media pembelajaran yang dapat digunakan dalam pembelajaran Ilmu 
Pengetahuan Sosial pada masa pandemi covid-19 di SMP Negeri 3 Banjar Agung. Hasil 
Penelitian menunjukkan bahwa media yang digunakan dalam pembelajaran berupa 
aplikasi whatsapp, aplikasi lark, google classroom, google form, Khoot, blog/website 
serta video pembelajaran youtube. Dari beberapa media pembelajaran tersebut tidak 
semuanya dapat efektif digunakan dalam pembelajaran Ilmu Pengetahuan Sosial karena 
kendala keterbatasan sarana prasarana peserta didik. Adapun media yang paling efektif 
digunakan dalam pembelajaran Ilmu Pengetahuan Sosial di SMP Negeri 3 Banjar Agung 
pada masa pandemi covid-19 adalah integrasi web blog, aplikasi youtube dengan media 
sosial whatsapp.
Kata kunci: IPS, media pembelajaran, covid-19",archive,2021-05-24 01:43:42,8,,show,https://drive.google.com/file/d/1j1ICl1JQUeMme7YOytR2CwvUofD0IyD9/view,"Efektivitas Media Pembelajaran Ilmu Pengetahuan Sosial (IPS)
Pada Masa Pandemi Covid-19 di SMP Negeri 3 Banjar 
Agung Kab. Tulang Bawang",published,30556,2021-05-24 01:43:42,629-640,85,2021-05-24 01:43:42,http://repository.lppm.unila.ac.id/id/eprint/30556,public,TRUE,pub,,"[{'mime_type': 'application/pdf', 'language': 'en', 'eprintid': 30556, 'placement': 1, 'security': 'public', 'pos': 1, 'format': 'text', 'rev_number': 1, 'uri': 'http://repository.lppm.unila.ac.id/id/document/137535', 'main': 'FINAL-PROSIDING SEMNAS 2021 FULL.pdf', 'docid': 137535, 'files': [{'filename': 'FINAL-PROSIDING SEMNAS 2021 FULL.pdf', 'hash': '1a53dc758896f48c95c21c7eba8fd87c', 'hash_type': 'MD5', 'mtime': '2021-05-24 01:35:19', 'mime_type': 'application/pdf', 'fileid': 362104, 'filesize': 31126215, 'datasetid': 'document', 'uri': 'http://repository.lppm.unila.ac.id/id/file/362104', 'objectid': 137535}]}]",['FKIP10'],conference_item,disk0/00/03/05/56,1970-01-01 00:00:00.000002021,,"[{'name': {'given': 'Siswati', 'lineage': None, 'family': 'Siswati', 'honourific': None}, 'id': None}, {'name': {'honourific': None, 'family': 'SUDJARWO', 'lineage': None, 'given': 'SUDJARWO'}, 'id': 'profdrsudjarwo@gmail.com'}, {'id': 'pujiatifkipunila@gmail.com', 'name': {'given': 'P', 'lineage': None, 'honourific': None, 'family': 'Pujiati'}}]",,,,,,,,,paper,conference,16 Februari 2021,"[{'url': 'http://semnaspend.fkip.unila.ac.id/2019/08/14/prosiding/', 'type': 'org'}]",Bandar Lampung,Seminar Nasional Pendidikan Fakultas Keguruan dan Ilmu Pendidikan Universitas Lampung 2021
9,['L1'],"The purpose of this research is to find out the evaluation study of environmental development programs in relation to the character building of students at SMP N 6 Bandar Lampung. This research is a descriptive study using a qualitative approach. This study uses interview techniques using question instruments as the main tool in data collection. Determination of informants was done by purposive sample. The results of evaluation studies have found that the implementation of the Biling program has
been carried out by public schools in Bandar Lampung. However, in its implementation, several problems have been found regarding the misuse of society in utilizing this billing program. Based on the results of the study, it can be concluded that the billing program launched by the City Government is not running properly because it is aimed at the wrong community so that it affects students' motivation and enthusiasm for learning at school",archive,2021-05-24 06:38:26,6,4.0,show,http://ijessr.com,EVALUATION STUDY OF BILING PROGRAMS IN THE FORMATION OF STUDENTS'CHARACTERS OF SMP NEGERI 6 BANDAR LAMPUNG,published,30605,2021-05-24 06:38:26,22-27,1087,2021-05-24 06:38:26,http://repository.lppm.unila.ac.id/id/eprint/30605,public,TRUE,pub,1,"[{'language': 'en', 'mime_type': 'application/pdf', 'security': 'public', 'placement': 1, 'eprintid': 30605, 'rev_number': 1, 'uri': 'http://repository.lppm.unila.ac.id/id/document/137876', 'format': 'text', 'pos': 1, 'files': [{'objectid': 137876, 'uri': 'http://repository.lppm.unila.ac.id/id/file/362883', 'fileid': 362883, 'mime_type': 'application/pdf', 'mtime': '2021-05-24 06:20:17', 'hash_type': 'MD5', 'filename': 'JURNAL RINA MARYANI (NPM.1723031002).pdf', 'hash': '1cb7a916a990971eb7fc6a83e3c12b46', 'datasetid': 'document', 'filesize': 1157449}], 'main': 'JURNAL RINA MARYANI (NPM.1723031002).pdf', 'docid': 137876}]",['FKIP10'],article,disk0/00/03/06/05,2021-01-01 00:00:00.000000000,International Journal of Education and Social Science Research,"[{'name': {'family': 'Sugeng', 'honourific': None, 'lineage': None, 'given': 'Widodo'}, 'id': 'sugeng.widodo@fkip.unila.ac.id'}]",2581-5148,,,,,,,,,,,,,
10,"['L1', 'LB', 'LB1603']","This study aims to analyze online based integrated social studies learning. This research method
uses qualitative methods, namely research conducted by taking data sources using descriptive analysis. The
location of this research is at SMP Negeri 35 Bandar Lampung. Data collection techniques using
observation, interviews, documentation. This study uses data analysis with the Miles and Huberman model,
namely through data reduction, data presentation, and drawing conclusions. The triangulation technique
used is data source triangulation, technical triangulation, and time triangulation. The results of this study
indicate that the implementation of online learning at SMP Negeri 35 Bandar Lampung. Online learning of
teachers and students using the Whatsapp and Google Classroom applications has been carried out well.
Keywords: Social Studies Learning; Online Learning; Covid 19 Pandemic",archive,2021-11-12 07:42:40,8,8.0,show,https://ijmmu.com/index.php/ijmmu/article/view/2845,Analysis of Online Based IPS Learning on Covid-19 Pandemic Time,published,36446,2021-11-12 07:42:40,504-508,3493,2021-11-12 07:42:40,http://repository.lppm.unila.ac.id/id/eprint/36446,public,TRUE,pub,8,"[{'language': 'en', 'mime_type': 'application/pdf', 'security': 'public', 'placement': 1, 'eprintid': 36446, 'rev_number': 1, 'uri': 'http://repository.lppm.unila.ac.id/id/document/157375', 'format': 'text', 'pos': 1, 'files': [{'uri': 'http://repository.lppm.unila.ac.id/id/file/420744', 'objectid': 157375, 'hash_type': 'MD5', 'mtime': '2021-11-12 04:58:58', 'hash': '492d57cea1b408887c4bb2dae086c5fb', 'filename': '2845-9062-1-PB.pdf', 'fileid': 420744, 'mime_type': 'application/pdf', 'filesize': 503419, 'datasetid': 'document'}], 'main': '2845-9062-1-PB.pdf', 'docid': 157375}]",['FKIP10'],article,disk0/00/03/64/46,2021-08-03 00:00:00.000000000,International Journal of Multicultural and Multireligious Understanding,"[{'id': None, 'name': {'given': 'Suwartini', 'lineage': None, 'family': 'Suwartini', 'honourific': None}}, {'id': 'profdrsudjarwo@gmail.com', 'name': {'family': 'SUDJARWO', 'honourific': None, 'lineage': None, 'given': 'SUDJARWO'}}, {'id': 'novia.istiawati@fkip.unila.ac.id', 'name': {'lineage': None, 'honourific': None, 'family': 'Istiawati', 'given': 'Novia Fitri'}}]",2364-5369,International Journal of Multicultural and Multireligious Understanding (IJMMU),,['Universitas Lampung'],,,,,,,,,,
11,['H1'],"This study aims to analyze and describe the values of local wisdom in the Tabot culture in the 
community, as well as efforts to preserve the values contained in the Tabot culture. This study uses a 
qualitative approach. Data collection techniques using interviews, observation, and documentation. The 
data analysis technique uses an interactive pattern of Miles and Huberman data. The results of this study 
indicate that the form of local wisdom of the Tabot culture consists of local wisdom in the form of musical 
instruments used in the Tabot ceremony, traditional clothing, and the local language used as well as food 
and drinks. While local wisdom is intangible in the form of values contained in the Tabot ceremony, 
including the prayer of salvation which contains the meaning to always remember Allah SWT, asking for 
the safety of the hereafter, and safety during the implementation of the Tabot ritual. Efforts to preserve 
Tabot culture are influenced by several inhibiting berdoas, including the lack of support from the local 
government, negative perceptions of non-Tabot communities towards Tabot culture, conflicts among Tabot
family members, and the values contained in each Tabot ritual are less socialized. As for the supporting 
berdoas in general, there is sosial support from several parties, namely support from the descendants of the 
Tabot family, support from the community, and support from art studios in Bengkulu.",archive,2022-01-31 01:18:12,6,8.0,show,https://ijmmu.com/index.php/ijmmu/index,Tabot Culture: Local Wisdom of the Bengkulu Community and Effort to Preserve it,published,38678,2022-01-31 01:18:12,272-279,531,2022-01-31 01:18:12,http://repository.lppm.unila.ac.id/id/eprint/38678,public,TRUE,pub,9,"[{'uri': 'http://repository.lppm.unila.ac.id/id/document/159783', 'rev_number': 1, 'format': 'text', 'pos': 1, 'files': [{'filesize': 1290914, 'datasetid': 'document', 'filename': 'Artikel IJMMU.pdf', 'hash': 'c6c9ae9563eac97d361e4fb2bbcc7985', 'mtime': '2022-01-28 11:07:15', 'hash_type': 'MD5', 'mime_type': 'application/pdf', 'fileid': 437386, 'uri': 'http://repository.lppm.unila.ac.id/id/file/437386', 'objectid': 159783}], 'docid': 159783, 'main': 'Artikel IJMMU.pdf', 'language': 'en', 'mime_type': 'application/pdf', 'security': 'public', 'placement': 1, 'eprintid': 38678}]",['FKIP10'],article,disk0/00/03/86/78,2021-09-01 00:00:00.000000000,International Journal of Multicultural and Multireligious Understanding (IJMMU),"[{'name': {'lineage': None, 'family': 'Widanita', 'honourific': None, 'given': 'Widanita'}, 'id': 'widanita159@gmail.com'}, {'name': {'given': 'Risma Margaretha', 'lineage': None, 'family': 'Sinaga', 'honourific': None}, 'id': 'sinaga_rmargaretha@yahoo.com'}, {'id': 'mohammad.monaadha@fkip.unila.ac.id', 'name': {'given': 'Muhammad Mona', 'lineage': None, 'honourific': None, 'family': 'Adha'}}]",ISSN 2364-5369,"Centre for Policy Research and International Studies-Principal at Global Institute for Multidisciplinary Knowledge and Responsible Future, Germany","[{'name': {'given': 'Muhammad', 'family': 'Adha', 'honourific': None, 'lineage': None}, 'id': 'mohammad.monaadha@fkip.unila.ac.id'}]","['Universitas Lampung', 'Universitas Lampung', 'Universitas Lampung']",mohammad.monaadha@fkip.unila.ac.id,"Boas, F. (1938). The Mind of Primitive Man. New York: Columbia University
Damayanti, W. (2009). STRUKTUR DAN NILAI BUDAYA DALAM UKURAN CERITA PENDEK 
ROBOHNYA SURAU KAMI KARYA AA NAUIS (Doctoral dissertation, Universitas Pendidikan 
Indonesia).
Geertz, C. (1992). Kebudayaan dan Agama, terj. Francisco Budiman Hardiman. Yogyakarta: Kanisius.
Gumay, S. (2011). Tradisi Tabot Sebagai Medium Pemersatu Masyarakat Kelurahan Berkas Kecamatan 
Kota Bengkulu. Akses, 8(1), 82-90.
Moleong, L. J., & Edisi, P. R. R. B. (2004). Metodelogi penelitian. Bandung: Penerbit Remaja Rosdakarya.
Peursen, C. V. (1988). Strategi Kebudayaan Edisi Kedua. V. Peursen, Strategi Kebudayaan Edisi Kedua. 
Yogyakarta: Gunung Mulia.
Tarakanita, I., & Cahyono, M. Y. M. (2015). Komitmen identitas etnik dalam kaitannya dengan eksistensi 
budaya lokal. Zenit, 2(2).",,,,,,,,
