,metadata_visibility,rev_number,volume,referencetext,title,related_url,status_changed,dir,creators,issn,publication,keywords,contact_email,refereed,uri,full_text_status,documents,pagerange,userid,date_type,eprintid,abstract,subjects,eprint_status,id_number,date,divisions,type,publisher,number,ispublished,datestamp,lastmod,official_url,place_of_pub
0,show,8,1.0,"Abidah, A., Hidaayatullaah, H. N., Simamora, R. M., Fehabutar, D., & Mutakinati, L. (2020). The Impact of Covid-19 to Indonesian Education and Its Relation to the Philosophy of “Merdeka Belajar.” Studies in Philosophy of Science and Education, 1(1), 38–49.https://doi.org/10.46627/sipose.v1i1.9Anjani,  A.  (2021).  Berkenalan  dengan  Jakarta  Book  Hive,  Perpustakaan  Jalanan  di  Taman  Lembang. Detik.com.      https://www.detik.com/edu/edutainment/d-5548204/berkenalan-dengan-jakarta-book-hive-perpustakaan-jalanan-di-taman-lembangFritsch,  E.  (2011).  Take  one,  leave  one.  dw.com.  https://www.dw.com/en/germanys-public-bookshelves-reincarnate-well-read-treasures/a-15324732Gewati,    M.    (2019).    Tingkatan    Minat    Baca,    Pemprov    DKI    Galakan    Program    Baca    Jakarta. kilasdaerah.kompas.com. https://kilasdaerah.kompas.com/dki-jakarta/read/2019/11/07/22081711/tingkatan-minat-baca-pemprov-dki-galakan-program-baca-jakartaIndonesia,  DW.  (2022)  Marak  Pojok  Buku  di  Jakarta,  Efektif  Tingkatkan  Minat  Baca?  tempo.co.  https://www.tempo.co/dw/8092/marak-pojok-buku-di-jakarta-efektif-tingkatkan-minat-bacaKhumaini,    A.    (2019).    Minat    Membaca    di    Jakarta    Meningkat    Gara-gara    Ini.    merdeka.com. https://www.merdeka.com/peristiwa/minat-membaca-di-jakarta-meningkat-gara-gara-ini.htmlLestari,  D.,  &  Subekti,  S.  (2019).  Peran  Perpustakaan  Jalanan  Semarang  Terhadap  Pemberdayaan Masyarakat. Jurnal Ilmu Perpustakaan, 6(3), 431–440. https://ejournal3.undip.ac.id/index.php/jip/article/view/23175Liu, W., & Li, X. (2022). Children’s Reading Promotion Communication and Research in Public Libraries. OALib, 09(06), 1–10. https://doi.org/10.4236/oalib.1108932Miles,  M.  B.,  &  Huberman,  A.  M.  (1994).  Qualitative  Data  Analysis:  An  Expanded  Sourcebook.  Sage Publications.Oliveira, A. S. de, Simon, V. L. B., & Simon, A. (2018). Childhood and Scientific Literacy: Contributions of    History    and    Epistemology.    Open    Journal of    Social    Sciences,    06(08),    216–225. https://doi.org/10.4236/jss.2018.68017Onwuegbuzie, A. J., & Weinbaum, R. K. (2016). Mapping Miles and Huberman’s Within-Case and Cross-Case Analysis Methods onto the Literature Review Process. Journal of Educational Issues, 2(1), 265. https://doi.org/10.5296/jei.v2i1.9217Pirinen, R. (2015). Studies of Externally Funded Research and Development Projects in Higher Education: Knowledge Sources and Transfers. Creative Education Journal, 6(3). https://www.scirp.org/journal/paperinformation.aspx?paperid=54558Rakib, R., Londa, N. S., & Warouw. D. M. D. (2017). Kajian Pemanfaatan Layanan Perpustakaan Keliling Sebagai  Upaya  Peningkatan  Minat  Baca  Masyarakat  Di  Kelurahan  Tinoor  1  Kecamatan  Tomohon Utara Kota Tomohon. E-journal “Acta Diurna,” 6(2), 1–17.Rekso,  S.  (2021).  5  Ruang  Baca  di  Jakarta,  Jadi  Bagian  Dari  Warga  Kota  Sastra  Dunia.  kabarbintang.id. https://www.kabarbintang.id/5-ruang-baca-di-jakarta-jadi-bagian-dari-warga-kota-sastra-dunia/S.    C.    A.    (2022).    Cuma    Perlu    Satu    Buku    untuk    Jatuh    Cinta    pada    Membaca.    dw.com. https://www.dw.com/id/cuma-perlu-satu-buku-untuk-jatuh-cinta-pada-membaca/a-63775617Sugiyono. (2009). Metode Penelitian Pendidikan Pendekatan Kuantitatif, Kualitatif, dan R&D. : . Alfabeta.Valentin.  (2011)  Öffentliche  Bücherregale  im  Rhein-Neckar-Kreis.chillr.de.  https://chillr.de/offentliche-bucherregale-im-rhein-neckar-kreisWilders,  C.  (2017).  Predicting  the  Role  of Library  Bookshelves  in  2025.  The  Journal  of  AcademicLibrarianship, 43(5), 384–391. https://doi.org/10.1016/j.acalib.2017.06.019","PeranPerpustakaan  Jalanan ""Jakarta  Book  Hive"" dalam MenumbuhkanMinat Baca dan Pendidikan Literasibagi Pembaca Anak",[{'url': 'https://publikasi.abidan.org/index.php/educative'}],2023-03-13 03:20:59,disk0_bak/00/04/89/18,"[{'id': 'purwanto.putra@fisip.unila.ac.id', 'name': {'given': 'Purwanto', 'lineage': None, 'family': 'Putra', 'honourific': None}}, {'name': {'given': 'Windah', 'family': 'Andi', 'honourific': None, 'lineage': None}, 'id': 'andi.windah@fisip.unila.ac.id'}, {'name': {'lineage': None, 'family': 'Arnila Purnamayanti', 'honourific': None, 'given': 'AP'}, 'id': 'arnila.purnamayanti@fisip.unila.ac.id'}, {'name': {'given': 'Eri Maryani', 'family': 'Eri Maryani', 'honourific': None, 'lineage': None}, 'id': None}]",2985-9182,Educative: Jurnal Ilmiah Pendidikan,"Jakarta Book Hive, Minat Baca, Pendidikan Literasi, Perpustakaan Jalanan",purwanto.putra@fisip.unila.ac.id,TRUE,http://repository.lppm.unila.ac.id/id/eprint/48918,public,"[{'docid': 188359, 'main': 'Educative Jurnal Pendidikan_Peran Perpustakaan Jalanan_2023.pdf', 'files': [{'uri': 'http://repository.lppm.unila.ac.id/id/file/532390', 'objectid': 188359, 'mtime': '2023-03-12 10:31:44', 'hash_type': 'MD5', 'filename': 'Educative Jurnal Pendidikan_Peran Perpustakaan Jalanan_2023.pdf', 'hash': '87774fa8a5080015e24c055e42012e7b', 'fileid': 532390, 'mime_type': 'application/pdf', 'filesize': 439683, 'datasetid': 'document'}], 'format': 'text', 'pos': 1, 'uri': 'http://repository.lppm.unila.ac.id/id/document/188359', 'rev_number': 2, 'eprintid': 48918, 'security': 'public', 'placement': 1, 'mime_type': 'application/pdf', 'language': 'en', 'content': 'published'}]",33-42,2792,published,48918,"Penelitian ini ditulis dalam kerangka untuk melihat dan mendeskripsikan suatu alternative baru dibidang literasi dan pendidikan, seperti inisiasi perpustakaan jalanan Jakarta Book Hivedalam rangkamenumbuhkanminat baca dan pendidikan literasi bagi anak-anak.Tujuan  penelitian ini  adalah  untuk  mengetahui  bagaimana proses pendirian dan peranan dariPerpustakaan Jalanan,Jakarta Book Hivedan melihat berbagai unsur yang terkandung di  dalamnyaaktivisme  sosialmedia,  kerelawanan,  pemanfaatan  dan kemungkinan  replikasi(pendirian  ulang)diberbagai daerahlaindalam rangka peningkatan minat baca dan pendidikan literasi bagi anak. Penelitian ini merupakan penelitian kualitatifyang berfokus pada kajian literatur dan observasi digital(media sosial). Teknik pengumpulan data memanfaatkan berbagai informasi yang terekam pada akun sosial media resmi Jakarta Book Hive,akun  Instagram:  @jakartabookhive.  Informasi  yang  tersajiberupa  data  yang  dibagikan  pendiri,  pengelola, dan penguna dan berbagai pertanyaan dan komentar nitizen dalam sosial media.Selanjutnya untukpengolahan dan analisis data menggunakan model analisis data Miles dan Huberman yang terdiri dari empat tahap, yaitu pengumpulan  data,  reduksi  data,  penyajian  data,  dan penarikan  kesimpulan. Hasilpenelitianmenunjukan bahwa  inisiatif  dan  program  ini  diterima  secara  positif,  bahkan  dukungan  juga  mengalir  dari  berbagai  pihak secara  sukarela  melalui  aktivisme  sosial.  Keberaradaan  Jakarta  Book  Hive  juga  terbukti  berhasil  dalam menumbuhkan minat baca masyarakat dan menyediakan informasi terutama bagi masyarakat sekitar",['Z719'],archive,DOI: 10.37985/educative.v1i1.8,2023-02-05,['FISIP4'],article,LPPI Yayasan Almahmudi bin Dahlan,2.0,pub,2023-03-13 03:20:59,2023-03-13 03:20:59,,
1,show,10,,,"Similarity paper ""Tourist Interests as a Basis for Post-Covid-19
Pandemic Tourism Visit Recovery Planning:
Studies in the Ecotourism Area of Way
Kambas National Park, Lampung Province""",,2023-03-13 03:21:17,disk0_bak/00/04/89/28,"[{'name': {'lineage': None, 'family': 'nurhaida', 'honourific': None, 'given': 'Ida'}, 'id': 'ida.nurhaida@fisip.unila.ac.id'}, {'id': None, 'name': {'lineage': None, 'family': 'sitorus', 'honourific': None, 'given': 'siti herawati'}}, {'id': 'samsul.bakri@fp.unila.ac.id', 'name': {'lineage': None, 'family': 'Bakri', 'honourific': None, 'given': 'Samsul'}}, {'name': {'given': 'Dikpride', 'honourific': None, 'family': 'Despa', 'lineage': None}, 'id': 'despa@eng.unila.ac.id'}]",,,,,,http://repository.lppm.unila.ac.id/id/eprint/48928,public,"[{'eprintid': 48928, 'security': 'public', 'placement': 1, 'mime_type': 'application/pdf', 'language': 'en', 'main': 'Similarity TNWK.pdf', 'docid': 188370, 'files': [{'uri': 'http://repository.lppm.unila.ac.id/id/file/532470', 'objectid': 188370, 'filename': 'Similarity TNWK.pdf', 'hash': '44cb44704a553c8dffa3076642261750', 'hash_type': 'MD5', 'mtime': '2023-03-13 01:08:48', 'mime_type': 'application/pdf', 'fileid': 532470, 'filesize': 840977, 'datasetid': 'document'}], 'format': 'text', 'pos': 1, 'rev_number': 1, 'uri': 'http://repository.lppm.unila.ac.id/id/document/188370'}]",,753,published,48928,"Ecotourism is expected to revive in the post COVID-19 pandemic, as currently the
lowland conservation area with the highest biodiversity in the world is Way Kambas
National Park, Lampung province, Indonesia. Attractiveness is the main variable as
the basis for planning the restoration of tourist visit performance. The purpose of this
study was to determine the role of the country of origin variable and demographics
of respondents in the attractiveness of ecotourism objects in WKNP. As a result, from
May 2022 to August 2022, a 15-minute video about the exoticism of WKNP had
been uploaded on the https://research-mil.unila.ac.id/ site. At the end of the video, a
questionnaire is presented in Indonesian, English, French, Korean, Japanese, Chinese,
and Arabic. The Ordinal Logistic Regression Postulate is used at the 95% confidence
level. There are three levels of response variables that score 0, 1, and 2 to express not
interested, interested, and very interested in visiting WKNP, respectively. The predictor
variable is the respondent’s characteristics, which include the respondent’s origin,
age, gender, number of dependents, income, and professional group. Optimization of
model parameters and hypothesis testing were carried out at a 95% significance level
using Minitab 19 software. The results showed that the attractiveness of visiting was
influenced by: (a) country of origin, 33.09 times more foreign respondents compared
to domestic ones with P = 0.037; (b) those who are 1 year older have a higher
attractiveness, namely 1.06 times; and (c) whose professions as teachers, civil servants,
and professional workers are lower, namely only 0.08 times, 0.09 times, and 0.14 times
compared to housewives or students. The policy implications for redeveloping plans
to improve tourist interest in visiting WKNP need to be focused on prospective tourists
from abroad, with the main target being professions other than civil service employees.","['GE', 'H1', 'SD']",archive,,2023-03-06,['FISIP4'],other,KNE Publising,,pub,2023-03-13 03:21:17,2023-03-13 03:21:17,https://knepublishing.com/index.php/index/about/aboutKnE,"Dubai, United Arab Emirate"
