,lastmod,userid,datestamp,publisher,documents,ispublished,uri,full_text_status,type,divisions,creators,dir,date,status_changed,eprint_status,abstract,subjects,title,metadata_visibility,rev_number,eprintid,date_type,refereed,issn,publication
0,2021-11-12 00:48:37,205,2021-11-12 00:48:37,Universitas Lampung,"[{'mime_type': 'application/pdf', 'language': 'en', 'eprintid': 36280, 'placement': 1, 'security': 'public', 'pos': 1, 'format': 'text', 'uri': 'http://repository.lppm.unila.ac.id/id/document/157217', 'rev_number': 1, 'docid': 157217, 'main': 'df83d3c349eb753435b62855f8e26c1e.pdf', 'files': [{'objectid': 157217, 'uri': 'http://repository.lppm.unila.ac.id/id/file/419501', 'datasetid': 'document', 'filesize': 954238, 'fileid': 419501, 'mime_type': 'application/pdf', 'mtime': '2021-11-11 22:49:20', 'hash_type': 'MD5', 'filename': 'df83d3c349eb753435b62855f8e26c1e.pdf', 'hash': '34d85a54e0f606cbebe0ce3a28d2c9d7'}]}]",submitted,http://repository.lppm.unila.ac.id/id/eprint/36280,public,other,['FISIP5'],"[{'id': 'intan.fitri@fisip.unila.ac.id', 'name': {'given': 'Intan Fitri', 'family': 'Meutia', 'honourific': None, 'lineage': None}}, {'name': {'lineage': None, 'honourific': None, 'family': 'Sujadmiko', 'given': 'Bayu'}, 'id': 'bayu.sujadmiko@fh.unila.ac.id'}]",disk0/00/03/62/80,1970-01-01 00:00:00.000002021,2021-11-12 00:48:37,archive,"Total umat Muslim di Indonesia diperkirakan sebanyak 13% dari jumlah umat muslim yang ada di
dunia. Indonesia merupakan negara kedua terbanyak yang mengirimkan jamaah haji dan umroh setiap
tahunnya setelah Pakistan. Adanya pandemi global COVID-19, mengakibatkan pemerintah Kerajaan
Arab Saudi memutuskan menghentikan sementara ibadah umroh dan penyelenggaraan ibadah haji
hanya untuk penduduk setempat dengan jumlah yang sangat terbatas dan serba ketat. Oleh karena itu
diperlukan formulasi model kebijakan penyelenggaraan Haji dan Umroh di masa pandemi COVID-19.
Penelitian ini merupakan penelitian deskriptif kualitatif, dimana pada penelitian ini akan
mendeskripsikan dan menganalisis agenda setting kebijakan haji dan umroh di masa pademi COVID19 di Indonesia. Tahapan agenda setting dan formulasi kebijakan untuk merumuskan model akan
diprioritaskan dengan pemetaan 4P, yaitu: Power (kekuatan/kekuasaan); Perception (persepsi); Potency
(Potensi); Proximity (kedekatan). Melalui pemetaan agenda setting tersebut nantinya diharapkan akan
muncul model kebijakan Pemerintah melalui Kementerian Agama selaku pihak yang bertanggung
jawab dalam penyelenggaraan ibadah haji dan umroh yang berkewajiban untuk selalu berupaya
memberikan pelayanan yang terbaik untuk masyarakat.
Keywords: Agenda Setting, Covid-19, Formulasi, Haji dan Umroh, Kebijakan.",['H1'],"MODEL KEBIJAKAN PENYELENGGARAAN HAJI DAN UMROH DI MASA PANDEMI
COVID-19",show,7,36280,submitted,,,
1,2021-06-16 03:31:54,639,2021-06-16 03:31:54,EconJournals,"[{'language': 'en', 'mime_type': 'application/pdf', 'security': 'public', 'placement': 1, 'eprintid': 32592, 'uri': 'http://repository.lppm.unila.ac.id/id/document/148071', 'rev_number': 1, 'format': 'text', 'pos': 1, 'files': [{'objectid': 148071, 'uri': 'http://repository.lppm.unila.ac.id/id/file/385738', 'datasetid': 'document', 'filesize': 534497, 'fileid': 385738, 'mime_type': 'application/pdf', 'mtime': '2021-06-16 02:20:28', 'hash_type': 'MD5', 'filename': 'IMPACT OF OIL PRICES AND STOCK RETURNS EVIDENCE OF OIL AND GAS MINING COMPANIES IN INDONESIA DURING THE COVID-19 PERIOD.pdf', 'hash': 'c67dd0c1f24b1e0fbfb2b495ffcfe63c'}], 'docid': 148071, 'main': 'IMPACT OF OIL PRICES AND STOCK RETURNS EVIDENCE OF OIL AND GAS MINING COMPANIES IN INDONESIA DURING THE COVID-19 PERIOD.pdf'}]",pub,http://repository.lppm.unila.ac.id/id/eprint/32592,public,article,['FISIP5'],"[{'id': 'suriptob.1969@fisip.unila.ac.id', 'name': {'given': 'Suripto', 'honourific': None, 'family': 'Suripto', 'lineage': None}}, {'name': {'given': 'Supriyanto', 'lineage': None, 'honourific': None, 'family': 'Supriyanto'}, 'id': 'supriyanto.1989@fisip.unila.ac.id'}, {'id': 'arif.sugiono@fisip.unila.ac.id', 'name': {'given': 'Arif', 'lineage': None, 'family': 'Sugiono', 'honourific': None}}, {'id': 'putri.irmalasari@gmail.com', 'name': {'given': 'Putri Irmala Sari', 'family': 'Putri Irmala Sari', 'honourific': None, 'lineage': None}}]",disk0/00/03/25/92,2021-04-29 00:00:00.000000000,2021-06-16 03:31:54,archive,"This study points to analyze the determinants of stock return revelation in oil and gas mining division companies recorded on the Indonesia Stock Trade-in 2019-2021 amid the Covid 19 emergency. The think about utilized the Eviews Program as information preparing and the irregular impact relapse show was chosen to look at the relationship between outside and inside markers as autonomous factors counting Current Ratio (CR), debt to equity ratio (DER), total asset turnover (TATO), return on assets (ROA), oil price (WTI), an exchange rate (FOREX), institutional ownership (IO). The comes about appeared that the current proportion, obligation to value ratio, and add up to resource turnover did not influence stock returns. Return on resources, exchange rates, and institutional ownership has a negative and significant impact on stock returns, while oil prices have a positive and widespread effect on stock returns.

Keywords: Oil Price, Stock Return, Probability, Institutional Ownership, Covid-19","['H1', 'HB', 'HC']",IMPACT OF OIL PRICES AND STOCK RETURNS EVIDENCE OF OIL AND GAS MINING COMPANIES IN INDONESIA DURING THE COVID-19 PERIOD,show,8,32592,,TRUE,2146-4553,International Journal of Energy Economics and Policy
