,eprintid,subjects,eprint_status,status_changed,metadata_visibility,rev_number,title,divisions,type,dir,creators,publication,datestamp,userid,lastmod,refereed,uri,full_text_status,documents,ispublished,abstract,issn,publisher,corp_creators,pres_type,event_title,event_location,event_dates,event_type,date_type,contact_email,volume,pagerange,number,succeeds,official_url
44,19003,['SH'],archive,2020-04-07 05:04:33,show,7,Aplikasi Bioremediasi pada Budidaya Lele dumbo (Clarias gariepinus) dengan Sistem tanpa ganti air.,['FP3'],other,disk0/00/01/90/03,"[{'id': 'supono_unila@yahoo.com', 'name': {'honourific': None, 'family': 'Supono', 'lineage': None, 'given': 'Supono'}}]",,2020-04-07 05:04:33,333,2020-04-07 05:04:33,,http://repository.lppm.unila.ac.id/id/eprint/19003,public,"[{'security': 'public', 'placement': 1, 'eprintid': 19003, 'language': 'en', 'mime_type': 'application/pdf', 'files': [{'filesize': 445359, 'datasetid': 'document', 'hash': 'ceeb395b1c25c013f27a5bbe9dbaf06c', 'filename': 'Aplikasi bioremediasi pada budidaya ikan lele dumbo.pdf', 'hash_type': 'MD5', 'mtime': '2020-04-06 09:47:38', 'mime_type': 'application/pdf', 'fileid': 159442, 'uri': 'http://repository.lppm.unila.ac.id/id/file/159442', 'objectid': 32242}], 'docid': 32242, 'main': 'Aplikasi bioremediasi pada budidaya ikan lele dumbo.pdf', 'rev_number': 1, 'uri': 'http://repository.lppm.unila.ac.id/id/document/32242', 'format': 'text', 'pos': 1}]",pub,Hasil review,,Politeknik Negeri Lampung,,,,,,,published,,,,,,
45,33788,['SH'],archive,2021-09-07 01:24:56,show,7,"CEK Similarity: Current status of technical and economic analysis of inland shrimp culture in Lampung Province,
Indonesia",['FP3'],other,disk0/00/03/37/88,"[{'name': {'given': 'Supono', 'family': 'Supono', 'honourific': None, 'lineage': None}, 'id': 'supono_unila@yahoo.com'}]",,2021-09-07 01:24:56,333,2021-09-07 01:24:56,,http://repository.lppm.unila.ac.id/id/eprint/33788,public,"[{'uri': 'http://repository.lppm.unila.ac.id/id/document/154022', 'rev_number': 1, 'pos': 1, 'format': 'text', 'files': [{'objectid': 154022, 'uri': 'http://repository.lppm.unila.ac.id/id/file/399970', 'datasetid': 'document', 'filesize': 3450366, 'mime_type': 'application/pdf', 'fileid': 399970, 'filename': 'Current_status_of_technical_and_economic_analysis_.pdf', 'hash': 'ddd567dd15491504e8147d4fb6f6fe37', 'mtime': '2021-09-06 12:06:22', 'hash_type': 'MD5'}], 'docid': 154022, 'main': 'Current_status_of_technical_and_economic_analysis_.pdf', 'language': 'en', 'mime_type': 'application/pdf', 'placement': 1, 'security': 'public', 'eprintid': 33788}]",pub,"The culture of Pacific white shrimp (Penaeus vannamei) in Indonesia has rapidly grown since
it was first introduced in 2000. One of the advantages of this shrimp type is its ability to live in low
salinity locations far from the coast. This study aims to analyze Pacific white shrimp cultivation at low
salinity in Lampung Province, Indonesia. This species, often called the inland shrimp culture, is an
alternative to overcome problems associated with water degradation and the spread of diseases. Since
2016, studies have been carried out on the Pacific white shrimp cultivation using low salinity in Lampung
Province, especially in East Lampung Regency. The cultivation was carried out in small ponds, ranging
between 1000 and 2000 m2 and managed semi-intensively, with the application of biosecurity. Seed
stocking density ranged from 50 to 70 post-larvae m-2 with the partial and final harvest types used for
cultivation. The result showed that the diseases that often attack Pacific white shrimp include white spot
virus syndrome, infectious myonecrosis, white feces syndrome, and vibriosis. Pond productivity reached
10-13 tons ha-1, and based on performance, the average shrimp weight was 21.5-24.5 g, feed
conversion ratio (FCR) 1.3-1.5, and survival rate (SR) 5-93%. Furthermore, the economic analysis
showed that Pacific white shrimp's cultivation with low salinity was very beneficial with a benefit cost
(B/C) ratio of 0.8.
Key Words: Penaeus vannamei, Pacific white shrimp, low salinity, white feces syndrome.",,Bioflux Publishing House,,,,,,,published,,,,,,
46,18984,['SH'],archive,2020-04-06 07:41:53,show,7,The Effect of Different C:N And C:P Ratio of Media on The Content of Polyhydroxybutyrate in Biofloc Inoculated With Bacterium Bacillus cereus,['FP3'],other,disk0/00/01/89/84,"[{'name': {'given': 'Supono', 'family': 'Supono', 'honourific': None, 'lineage': None}, 'id': 'supono_unila@yahoo.com'}]",,2020-04-06 07:41:53,333,2020-04-06 07:41:53,,http://repository.lppm.unila.ac.id/id/eprint/18984,public,"[{'eprintid': 18984, 'placement': 1, 'security': 'public', 'mime_type': 'application/pdf', 'language': 'en', 'main': 'The effect of different C N and C P ratio.pdf', 'docid': 32223, 'files': [{'filesize': 427087, 'datasetid': 'document', 'filename': 'The effect of different C N and C P ratio.pdf', 'hash': 'ea8c57fd9ce42f3eb1404606cfa3352b', 'mtime': '2020-04-06 04:23:09', 'hash_type': 'MD5', 'mime_type': 'application/pdf', 'fileid': 159287, 'uri': 'http://repository.lppm.unila.ac.id/id/file/159287', 'objectid': 32223}], 'pos': 1, 'format': 'text', 'rev_number': 1, 'uri': 'http://repository.lppm.unila.ac.id/id/document/32223'}]",pub,Hasil review,,Universitas Diponegoro,,,,,,,published,,,,,,
47,19030,['SH'],archive,2020-04-13 02:14:27,show,7,The Effect of Different C:N And C:P Ratio of Media on The Content of Polyhydroxybutyrate in Biofloc Inoculated With Bacterium Bacillus cereus,['FP3'],other,disk0/00/01/90/30,"[{'id': 'supono_unila@yahoo.com', 'name': {'given': 'Supono', 'lineage': None, 'honourific': None, 'family': 'Supono'}}]",,2020-04-13 02:14:27,333,2020-04-13 02:14:27,,http://repository.lppm.unila.ac.id/id/eprint/19030,public,"[{'mime_type': 'application/pdf', 'language': 'en', 'eprintid': 19030, 'placement': 1, 'security': 'public', 'pos': 1, 'format': 'text', 'rev_number': 1, 'uri': 'http://repository.lppm.unila.ac.id/id/document/32269', 'main': 'The_effect_of_Different_C_N_and_C_P_Ratio_of_Media (1).pdf', 'docid': 32269, 'files': [{'uri': 'http://repository.lppm.unila.ac.id/id/file/159643', 'objectid': 32269, 'filename': 'The_effect_of_Different_C_N_and_C_P_Ratio_of_Media (1).pdf', 'hash': 'e638c60fb15e35d0f232553943bd4d90', 'hash_type': 'MD5', 'mtime': '2020-04-09 05:00:16', 'mime_type': 'application/pdf', 'fileid': 159643, 'filesize': 1653079, 'datasetid': 'document'}]}]",pub,Cek Similarity,,Omics publishing,,,,,,,published,,,,,,
48,18988,['SH'],archive,2020-04-06 07:43:06,show,8,Evaluasi Kesesuaian Perairan untuk  Budidaya Ikan Nila (Oreochromis niloticus) di Kawasan Pesisir Desakandang Besi Kecamatan Kota Agung Barat Kabupaten Tanggamus,['FP3'],other,disk0/00/01/89/88,"[{'name': {'given': 'Supono', 'family': 'Supono', 'honourific': None, 'lineage': None}, 'id': 'supono_unila@yahoo.com'}]",,2020-04-06 07:43:06,333,2020-04-06 07:43:06,,http://repository.lppm.unila.ac.id/id/eprint/18988,public,"[{'mime_type': 'application/pdf', 'language': 'en', 'security': 'public', 'placement': 1, 'eprintid': 18988, 'uri': 'http://repository.lppm.unila.ac.id/id/document/32227', 'rev_number': 1, 'format': 'text', 'pos': 1, 'files': [{'fileid': 159315, 'mime_type': 'application/pdf', 'mtime': '2020-04-06 04:41:38', 'hash_type': 'MD5', 'hash': 'aabece0d4b71c9dfc8da1bb7799716bd', 'filename': 'Evaluasi kesesuaian perairan untuk budidaya ikan nila.pdf', 'datasetid': 'document', 'filesize': 435089, 'objectid': 32227, 'uri': 'http://repository.lppm.unila.ac.id/id/file/159315'}], 'main': 'Evaluasi kesesuaian perairan untuk budidaya ikan nila.pdf', 'docid': 32227}]",pub,Hasil review,,FP Unila,,,,,,,published,,,,,,
49,18996,['SH'],archive,2020-04-06 07:47:25,show,7,Evaluasi Kualitas Sedimen Sedimen Beberapa Tambak Udang di Kabupaten Tulang Bawang Provinsi Lampung,['FP3'],other,disk0/00/01/89/96,"[{'name': {'given': 'Supono', 'lineage': None, 'family': 'Supono', 'honourific': None}, 'id': 'supono_unila@yahoo.com'}]",,2020-04-06 07:47:25,333,2020-04-06 07:47:25,,http://repository.lppm.unila.ac.id/id/eprint/18996,public,"[{'security': 'public', 'placement': 1, 'eprintid': 18996, 'mime_type': 'application/pdf', 'language': 'en', 'files': [{'objectid': 32235, 'uri': 'http://repository.lppm.unila.ac.id/id/file/159375', 'datasetid': 'document', 'filesize': 407264, 'mime_type': 'application/pdf', 'fileid': 159375, 'hash': 'ab439feab5ae9d5948a667f1a7467370', 'filename': 'Evaluasi kualitas sedimen beberapa tambak udang di kabupaten tulang bawang.pdf', 'mtime': '2020-04-06 05:13:47', 'hash_type': 'MD5'}], 'docid': 32235, 'main': 'Evaluasi kualitas sedimen beberapa tambak udang di kabupaten tulang bawang.pdf', 'uri': 'http://repository.lppm.unila.ac.id/id/document/32235', 'rev_number': 1, 'format': 'text', 'pos': 1}]",pub,Hasil review,,FP Unila,,,,,,,published,,,,,,
50,18992,['SH'],archive,2020-04-06 07:44:29,show,7,The Growth Kinetics of Bacillus Sp. D2.2 at Different pH and Salinity,['FP3'],other,disk0/00/01/89/92,"[{'name': {'lineage': None, 'family': 'Supono', 'honourific': None, 'given': 'Supono'}, 'id': 'supono_unila@yahoo.com'}]",,2020-04-06 07:44:29,333,2020-04-06 07:44:29,,http://repository.lppm.unila.ac.id/id/eprint/18992,public,"[{'files': [{'datasetid': 'document', 'filesize': 434960, 'fileid': 159345, 'mime_type': 'application/pdf', 'hash_type': 'MD5', 'mtime': '2020-04-06 04:58:22', 'hash': '40cccb2d545f8c63481747aa24f48f17', 'filename': 'The growth kinetic of Bacilllus sp. D22 .pdf', 'objectid': 32231, 'uri': 'http://repository.lppm.unila.ac.id/id/file/159345'}], 'main': 'The growth kinetic of Bacilllus sp. D22 .pdf', 'docid': 32231, 'uri': 'http://repository.lppm.unila.ac.id/id/document/32231', 'rev_number': 1, 'format': 'text', 'pos': 1, 'security': 'public', 'placement': 1, 'eprintid': 18992, 'language': 'en', 'mime_type': 'application/pdf'}]",pub,Hasil review,,FP Unila,,,,,,,published,,,,,,
51,18986,['SH'],archive,2020-04-06 07:42:24,show,7,"Identification of Vibrio sp.  as a cause of white feces diseases in white shrimp Penaeus vannamei and handling with herbal ingredients in East Lampung Regency, Indonesia",['FP3'],other,disk0/00/01/89/86,"[{'id': 'supono_unila@yahoo.com', 'name': {'given': 'Supono', 'honourific': None, 'family': 'Supono', 'lineage': None}}]",,2020-04-06 07:42:24,333,2020-04-06 07:42:24,,http://repository.lppm.unila.ac.id/id/eprint/18986,public,"[{'uri': 'http://repository.lppm.unila.ac.id/id/document/32225', 'rev_number': 1, 'pos': 1, 'format': 'text', 'files': [{'uri': 'http://repository.lppm.unila.ac.id/id/file/159301', 'objectid': 32225, 'filename': 'Identicication of Vibrio sp as a cause of  white feces disease.pdf', 'hash': 'd6cb6e33e6d8579b16fb1f18e6404da9', 'mtime': '2020-04-06 04:32:51', 'hash_type': 'MD5', 'mime_type': 'application/pdf', 'fileid': 159301, 'filesize': 452237, 'datasetid': 'document'}], 'main': 'Identicication of Vibrio sp as a cause of  white feces disease.pdf', 'docid': 32225, 'language': 'en', 'mime_type': 'application/pdf', 'placement': 1, 'security': 'public', 'eprintid': 18986}]",pub,Hasil review,,Bioflux Publishing House,,,,,,,published,,,,,,
52,18994,['SH'],archive,2020-04-06 07:45:04,show,9,"Kajian Sintasan dan Pertumbuhan Benih Ikan Badut Amphiprion percula (Bloch,1801) yang Dipelihara Pada Media Salinitas yang Berbeda",['FP3'],other,disk0/00/01/89/94,"[{'name': {'given': 'Supono', 'family': 'Supono', 'honourific': None, 'lineage': None}, 'id': 'supono_unila@yahoo.com'}]",,2020-04-06 07:45:04,333,2020-04-06 07:45:04,,http://repository.lppm.unila.ac.id/id/eprint/18994,public,"[{'uri': 'http://repository.lppm.unila.ac.id/id/document/32233', 'rev_number': 1, 'format': 'text', 'pos': 1, 'files': [{'filename': 'Kajian sintasan dan pertumbuhan benih ikan badut.pdf', 'hash': '6b42be6d976c6a403082b9fed8f02418', 'mtime': '2020-04-06 05:06:48', 'hash_type': 'MD5', 'mime_type': 'application/pdf', 'fileid': 159359, 'filesize': 439963, 'datasetid': 'document', 'uri': 'http://repository.lppm.unila.ac.id/id/file/159359', 'objectid': 32233}], 'main': 'Kajian sintasan dan pertumbuhan benih ikan badut.pdf', 'docid': 32233, 'mime_type': 'application/pdf', 'language': 'en', 'security': 'public', 'placement': 1, 'eprintid': 18994}]",pub,Hasil review,,Departemen Ilmu Kelautan Universitas Trunojoyo,,,,,,,published,,,,,,
53,18995,['SH'],archive,2020-04-06 07:47:00,show,7,Pengaruh Feeding Rate  yang Berbeda terhadap Pertumbuhan dan Tingkat Kelulushidupan Benih Ikan Nila (Oreochromis Niloticus) yang Dipelihara  dengan Sistem Bioflok,['FP3'],other,disk0/00/01/89/95,"[{'id': 'supono_unila@yahoo.com', 'name': {'given': 'Supono', 'family': 'Supono', 'honourific': None, 'lineage': None}}]",,2020-04-06 07:47:00,333,2020-04-06 07:47:00,,http://repository.lppm.unila.ac.id/id/eprint/18995,public,"[{'uri': 'http://repository.lppm.unila.ac.id/id/document/32234', 'rev_number': 1, 'pos': 1, 'format': 'text', 'files': [{'datasetid': 'document', 'filesize': 712474, 'fileid': 159368, 'mime_type': 'application/pdf', 'hash_type': 'MD5', 'mtime': '2020-04-06 05:10:59', 'hash': 'daec2dcac8ddb1f637ed835cd1d3b7a5', 'filename': 'pengaruh feeding rate yang berbeda terhadap pertumbuhan .pdf', 'objectid': 32234, 'uri': 'http://repository.lppm.unila.ac.id/id/file/159368'}], 'docid': 32234, 'main': 'pengaruh feeding rate yang berbeda terhadap pertumbuhan .pdf', 'language': 'en', 'mime_type': 'application/pdf', 'placement': 1, 'security': 'public', 'eprintid': 18995}]",pub,Hasil review,,Universitas Sriwijaya,,,,,,,published,,,,,,
54,18990,['SH'],archive,2020-04-06 07:43:52,show,7,Performa Budidaya Udang Vaname (Litopenaeus vannamei) Semi Litopenaeus vannamei) Semi Intensif   di Desa Purworejo Kecamatan Pasir Sakti  Kabupaten  Lampung Timur,['FP3'],other,disk0/00/01/89/90,"[{'id': 'supono_unila@yahoo.com', 'name': {'given': 'Supono', 'honourific': None, 'family': 'Supono', 'lineage': None}}]",,2020-04-06 07:43:52,333,2020-04-06 07:43:52,,http://repository.lppm.unila.ac.id/id/eprint/18990,public,"[{'docid': 32229, 'main': 'Performa budidaya udang vaname semi intensif di desa purworejo.pdf', 'files': [{'uri': 'http://repository.lppm.unila.ac.id/id/file/159331', 'objectid': 32229, 'hash_type': 'MD5', 'mtime': '2020-04-06 04:49:23', 'filename': 'Performa budidaya udang vaname semi intensif di desa purworejo.pdf', 'hash': 'c1e0e950b4bf59e7e4b0e2d626efb8a2', 'fileid': 159331, 'mime_type': 'application/pdf', 'filesize': 417895, 'datasetid': 'document'}], 'pos': 1, 'format': 'text', 'rev_number': 1, 'uri': 'http://repository.lppm.unila.ac.id/id/document/32229', 'eprintid': 18990, 'placement': 1, 'security': 'public', 'mime_type': 'application/pdf', 'language': 'en'}]",pub,Hasil Review,,FP Unila,,,,,,,,,,,,,
55,19001,['SH'],archive,2020-04-07 05:03:52,show,7,Performance of Inland Shrimp  Culture in East Lampung Indonesia,['FP3'],other,disk0/00/01/90/01,"[{'name': {'family': 'Supono', 'honourific': None, 'lineage': None, 'given': 'Supono'}, 'id': 'supono_unila@yahoo.com'}]",,2020-04-07 05:03:52,333,2020-04-07 05:03:52,,http://repository.lppm.unila.ac.id/id/eprint/19001,public,"[{'rev_number': 1, 'uri': 'http://repository.lppm.unila.ac.id/id/document/32240', 'pos': 1, 'format': 'text', 'files': [{'objectid': 32240, 'uri': 'http://repository.lppm.unila.ac.id/id/file/159428', 'mime_type': 'application/pdf', 'fileid': 159428, 'filename': 'Performance of shrimp culture in east lampung.pdf', 'hash': 'fecaa4e28d3ae55dad22953a6b0632b3', 'mtime': '2020-04-06 09:29:45', 'hash_type': 'MD5', 'datasetid': 'document', 'filesize': 421056}], 'docid': 32240, 'main': 'Performance of shrimp culture in east lampung.pdf', 'language': 'en', 'mime_type': 'application/pdf', 'placement': 1, 'security': 'public', 'eprintid': 19001}]",pub,Hasil review,,Masyarakat Akuakultur Indonesia,,,,,,,published,,,,,,
56,19000,['SH'],archive,2020-04-07 05:03:33,show,7,Performance of White Shrimp (Litopenaeus vannamei) cultured in low   salinity combined with indigeneous bacteria,['FP3'],other,disk0/00/01/90/00,"[{'id': 'supono_unila@yahoo.com', 'name': {'given': 'Supono', 'lineage': None, 'family': 'Supono', 'honourific': None}}]",,2020-04-07 05:03:33,333,2020-04-07 05:03:33,,http://repository.lppm.unila.ac.id/id/eprint/19000,public,"[{'security': 'public', 'placement': 1, 'eprintid': 19000, 'language': 'en', 'mime_type': 'application/pdf', 'files': [{'uri': 'http://repository.lppm.unila.ac.id/id/file/159421', 'objectid': 32239, 'filename': 'Performance of shrimp culture in east lampung.pdf', 'hash': 'fecaa4e28d3ae55dad22953a6b0632b3', 'mtime': '2020-04-06 09:25:48', 'hash_type': 'MD5', 'mime_type': 'application/pdf', 'fileid': 159421, 'filesize': 421056, 'datasetid': 'document'}], 'docid': 32239, 'main': 'Performance of shrimp culture in east lampung.pdf', 'rev_number': 1, 'uri': 'http://repository.lppm.unila.ac.id/id/document/32239', 'format': 'text', 'pos': 1}]",pub,Hasil review,,Masyarakat Akuakultur Indonesia,,,,,,,published,,,,,,
57,18987,['SH'],archive,2020-04-06 07:42:44,show,7,Produksi dan Pengujian Aktivitas  Amilase Burkholderia Cepacia terhadap Substrat yang Berbeda,['FP3'],other,disk0/00/01/89/87,"[{'name': {'family': 'Supono', 'honourific': None, 'lineage': None, 'given': 'Supono'}, 'id': 'supono_unila@yahoo.com'}]",,2020-04-06 07:42:44,333,2020-04-06 07:42:44,,http://repository.lppm.unila.ac.id/id/eprint/18987,public,"[{'language': 'en', 'mime_type': 'application/pdf', 'eprintid': 18987, 'placement': 1, 'security': 'public', 'pos': 1, 'format': 'text', 'uri': 'http://repository.lppm.unila.ac.id/id/document/32226', 'rev_number': 1, 'docid': 32226, 'main': 'Produksi dan pengujian aktivitas amilase.pdf', 'files': [{'objectid': 32226, 'uri': 'http://repository.lppm.unila.ac.id/id/file/159308', 'datasetid': 'document', 'filesize': 478179, 'mime_type': 'application/pdf', 'fileid': 159308, 'filename': 'Produksi dan pengujian aktivitas amilase.pdf', 'hash': '9f00282c4a2f8506a7f142909a4cecbb', 'hash_type': 'MD5', 'mtime': '2020-04-06 04:37:24'}]}]",pub,Hasil Review,,FP Universitas Lampung,,,,,,,published,,,,,,
58,26786,['SH'],archive,2020-11-24 05:18:11,show,7,Review HaKI Teknologi Produksi Udang,['FP3'],other,disk0/00/02/67/86,"[{'name': {'lineage': None, 'family': 'Supono', 'honourific': None, 'given': 'Supono'}, 'id': 'supono_unila@yahoo.com'}]",,2020-11-24 05:18:11,333,2020-11-24 05:18:11,,http://repository.lppm.unila.ac.id/id/eprint/26786,public,"[{'files': [{'uri': 'http://repository.lppm.unila.ac.id/id/file/240611', 'objectid': 40774, 'filesize': 534733, 'datasetid': 'document', 'filename': '22. Review HaKI Manajemen Lingkungan untuk Akuakultur.pdf', 'hash': '59ac8c67af5020a91388e66494cda33f', 'hash_type': 'MD5', 'mtime': '2020-11-24 05:05:52', 'mime_type': 'application/pdf', 'fileid': 240611}], 'main': '22. Review HaKI Manajemen Lingkungan untuk Akuakultur.pdf', 'docid': 40774, 'uri': 'http://repository.lppm.unila.ac.id/id/document/40774', 'rev_number': 1, 'format': 'text', 'pos': 1, 'security': 'public', 'placement': 1, 'eprintid': 26786, 'mime_type': 'application/pdf', 'language': 'en'}]",pub,"Lingkungan kolam  yang meliputi  air dan tanah  berperan penting dalam menunjang keberhasilan budidaya ikan/udang.  Manajemen kualitas air selama ini dianggap merupakan faktor paling  penting dalam pengelolaan akuakultur, namun demikian akhir-akhir ini banyak penelitian yang menunjukkan bahwa  terdapat hubungan yang sangat erat antara  variabel kualitas  tanah dan  air.  Tanah dasar kolam berpegaruh terhadap  tingkat kesuburan kolam.  Tanah dasar kolam merupakan tempat akumulasi limbah akuakultur yang dapat menghasilkan senyawa beracun seperti amonia (NH3), nitrit   (NO2-) maupun hidrogen sulfida (H2S).  Pengelolaan yang komprehensif kualitas air dan tanah akan mendukung keberhasilan budidaya ikan/udang.
Buku Manajemen Lingkungan untuk  Akuakultur ini berisi tentang peranan lingkungan kolam dalam  akuakultur, manajemen kualitas air, manajemen kualitas tanah, benthic diatom, senyawa  beracun  dalam kolam,  dinamika ekosistem kolam, bahan kimia dalam akuakultur, Manajemen kualitas air dan tanah,  sistem heterotrof dalam  akuakultur serta  prosedur pengukuran sampel.  Disamping  berisi tentang teori-teori yang berkaitan dengan  akuakultur,  buku ini juga berisi tentang permasalahan-permasalahan yang muncul dalam budidaya ikan  dan udang yang  berkaitan  dengan lingkungan  akuakultur.   Buku ini dapat dijadikan rujukan  bagi akademisi  dan  praktisi budidaya ikan, udang  atau kultivan lainnya yang ingin mendalami  tentang lingkungan akuakultur, dinamika ekosistem kolam serta manajemen kualitas air dan tanah.",,Plantaxia,,,,,,,,,,,,,
59,18999,['SH'],archive,2020-04-07 05:03:17,show,7,Sex Reversal of Juvenile Freshwater Crayfish (Cherax quadricarinatus) Influenced by Steroid  Extract of Sea Cucumber and 17 alfa Metthyltestosteron Hormone at Different Temperature,['FP3'],other,disk0/00/01/89/99,"[{'name': {'honourific': None, 'family': 'Supono', 'lineage': None, 'given': 'Supono'}, 'id': 'supono_unila@yahoo.com'}]",,2020-04-07 05:03:17,333,2020-04-07 05:03:17,,http://repository.lppm.unila.ac.id/id/eprint/18999,public,"[{'rev_number': 1, 'uri': 'http://repository.lppm.unila.ac.id/id/document/32238', 'format': 'text', 'pos': 1, 'files': [{'filesize': 462460, 'datasetid': 'document', 'hash': '30adce48b3aece4e7f2d42a3af7b03e5', 'filename': 'sex reversal  of juvenile fresh water crayfish.pdf', 'hash_type': 'MD5', 'mtime': '2020-04-06 09:20:52', 'mime_type': 'application/pdf', 'fileid': 159414, 'uri': 'http://repository.lppm.unila.ac.id/id/file/159414', 'objectid': 32238}], 'docid': 32238, 'main': 'sex reversal  of juvenile fresh water crayfish.pdf', 'mime_type': 'application/pdf', 'language': 'en', 'security': 'public', 'placement': 1, 'eprintid': 18999}]",pub,Hasil review,,AIP Publishing,,,,,,,published,,,,,,
60,19028,['SH'],archive,2020-04-13 02:13:54,show,7,Sex Reversal of Juvenile Freshwater Crayfish (Cherax quadricarinatus) Influenced by Steroid  Extract of Sea Cucumber and 17 alfa Metthyltestosteron Hormone at Different Temperature,['FP3'],other,disk0/00/01/90/28,"[{'id': 'supono_unila@yahoo.com', 'name': {'lineage': None, 'honourific': None, 'family': 'Supono', 'given': 'Supono'}}]",,2020-04-13 02:13:54,333,2020-04-13 02:13:54,,http://repository.lppm.unila.ac.id/id/eprint/19028,public,"[{'main': 'Sex_reversal_of_Juvenile_Freshwater_Crayfish__Cher.pdf', 'docid': 32267, 'files': [{'fileid': 159629, 'mime_type': 'application/pdf', 'hash_type': 'MD5', 'mtime': '2020-04-09 04:49:42', 'filename': 'Sex_reversal_of_Juvenile_Freshwater_Crayfish__Cher.pdf', 'hash': 'a0633223ae11b453880941e0ae92fee9', 'datasetid': 'document', 'filesize': 2594042, 'objectid': 32267, 'uri': 'http://repository.lppm.unila.ac.id/id/file/159629'}], 'pos': 1, 'format': 'text', 'rev_number': 1, 'uri': 'http://repository.lppm.unila.ac.id/id/document/32267', 'eprintid': 19028, 'placement': 1, 'security': 'public', 'mime_type': 'application/pdf', 'language': 'en'}]",pub,Cek similarity,,AIP Publishing,,,,,,,published,,,,,,
61,18985,['SF'],archive,2020-04-06 07:42:09,show,7,"Short Communication : The Diversity of epipelic diatoms as an indicator of shrimp pond environmental quality in Lampung Province, Indonesia",['FP3'],other,disk0/00/01/89/85,"[{'id': 'supono_unila@yahoo.com', 'name': {'lineage': None, 'family': 'Supono', 'honourific': None, 'given': 'Supono'}}]",,2020-04-06 07:42:09,333,2020-04-06 07:42:09,,http://repository.lppm.unila.ac.id/id/eprint/18985,public,"[{'eprintid': 18985, 'placement': 1, 'security': 'public', 'language': 'en', 'mime_type': 'application/pdf', 'main': 'Short communication the diversity epipelic diatom as an indicator of shrimp pond.pdf', 'docid': 32224, 'files': [{'objectid': 32224, 'uri': 'http://repository.lppm.unila.ac.id/id/file/159294', 'mime_type': 'application/pdf', 'fileid': 159294, 'filename': 'Short communication the diversity epipelic diatom as an indicator of shrimp pond.pdf', 'hash': '824023e46d52baf385d2b9ad4338ef14', 'hash_type': 'MD5', 'mtime': '2020-04-06 04:29:27', 'datasetid': 'document', 'filesize': 415682}], 'pos': 1, 'format': 'text', 'rev_number': 1, 'uri': 'http://repository.lppm.unila.ac.id/id/document/32224'}]",pub,Hasil review,,Universitas Sebelas Maret,,,,,,,published,,,,,,
62,19029,['SH'],archive,2020-04-13 02:14:08,show,7,"Short Communication : The Diversity of epipelic diatoms as an indicator of shrimp pond environmental quality in Lampung Province, Indonesia",['FP3'],other,disk0/00/01/90/29,"[{'name': {'given': 'Supono', 'lineage': None, 'honourific': None, 'family': 'Supono'}, 'id': 'supono_unila@yahoo.com'}]",,2020-04-13 02:14:08,333,2020-04-13 02:14:08,,http://repository.lppm.unila.ac.id/id/eprint/19029,public,"[{'mime_type': 'application/pdf', 'language': 'en', 'eprintid': 19029, 'security': 'public', 'placement': 1, 'format': 'text', 'pos': 1, 'uri': 'http://repository.lppm.unila.ac.id/id/document/32268', 'rev_number': 1, 'main': 'Short_Communication___The_Diversity_of_epipelic_di.pdf', 'docid': 32268, 'files': [{'datasetid': 'document', 'filesize': 2086554, 'mime_type': 'application/pdf', 'fileid': 159636, 'hash': 'd69e3abcf8406125169fc0f828b62044', 'filename': 'Short_Communication___The_Diversity_of_epipelic_di.pdf', 'hash_type': 'MD5', 'mtime': '2020-04-09 04:55:08', 'objectid': 32268, 'uri': 'http://repository.lppm.unila.ac.id/id/file/159636'}]}]",pub,Cek Similarity,,Univ. Negeri Surakarta,,,,,,,published,,,,,,
