,eprintid,subjects,eprint_status,status_changed,metadata_visibility,rev_number,title,divisions,type,dir,creators,publication,datestamp,userid,lastmod,refereed,uri,full_text_status,documents,ispublished,abstract,issn,publisher,corp_creators,pres_type,event_title,event_location,event_dates,event_type,date_type,contact_email,volume,pagerange,number,succeeds,official_url
34,8186,['S1'],archive,2018-06-28 08:18:18,show,6,"PEMBINAAN USAHA BUDIDAYA KERANG HIJAU 
DAN IKANDI PULAU PASARAN, LAMPUNG",['FP3'],article,disk0/00/00/81/86,"[{'name': {'given': 'Berta', 'honourific': None, 'family': 'Putri', 'lineage': None}}, {'name': {'given': 'Nuning Mahmudah', 'lineage': None, 'family': 'Noor', 'honourific': None}}, {'name': {'given': 'Mahrus', 'family': 'Ali', 'honourific': None, 'lineage': None}}]",Sakai Sembayan,2018-06-28 08:18:18,142,2018-06-28 08:18:18,TRUE,http://repository.lppm.unila.ac.id/id/eprint/8186,public,"[{'mime_type': 'application/pdf', 'language': 'en', 'eprintid': 8186, 'placement': 1, 'security': 'public', 'pos': 1, 'format': 'text', 'rev_number': 1, 'uri': 'http://repository.lppm.unila.ac.id/id/document/21217', 'docid': 21217, 'main': 'Pembinaan Budidaya Kerang Hijau dan  Ikan di Pulau Pasaran.pdf', 'files': [{'objectid': 21217, 'uri': 'http://repository.lppm.unila.ac.id/id/file/81434', 'datasetid': 'document', 'filesize': 312516, 'mime_type': 'application/pdf', 'fileid': 81434, 'filename': 'Pembinaan Budidaya Kerang Hijau dan  Ikan di Pulau Pasaran.pdf', 'hash': 'aa4ab88bb2705011720ed9e6366422bc', 'mtime': '2018-06-28 07:59:56', 'hash_type': 'MD5'}]}]",pub,"Pulau Pasaran terletak di Teluk Lampung dan dikenal sebagai penghasil ikan teri, namun potensinya
tidak hanya sebatas pengolahan ikan melainkan juga usaha budidaya salah satunya adalah kerang hijau
(Perna viridis). Kondisi perairan Pulau Pasaran cukup mendukung untuk usaha budidaya terutama lokasi
geografisnya yang dekat dengan pusat kota Bandar Lampung sehingga memudahkan dalam proses
transportasi. Namun usaha kerang hijau masih belum optimal karena teknologi rakit yang sederhana
serta belum adanya upaya polikultur. Khalayak sasaran merupakan pembudidaya kerang hijau di Pulau
Pasaran, Bandar Lampung di mana proses pembinaan diawali dengan survei, focus group discussion,
penguatan teori, praktek dan pemberian denplot serta evaluasi. Program pembinaan dan introduksi
sistem polikuktur kerang dan ikan dapat diterima oleh masyarakat danlebih meningkatkan produktivitas
usahbudidaya serta menjadikan Pulau Pasaran tidak hanya sebagai penghasil teri melainkan juga
menjadi pusat produksi kerang hijau dan ikan di Lampung.  

Kata kunci: Pembinaan, Budidaya, Kerang Hijau, Ikan, Pulau Pasaran",2550-1089,LPPM Unila,['Universitas Lampung'],,,,,,,,2,,1.0,,
35,15239,['SH'],archive,2019-11-04 08:13:41,show,6,"PEMANFAATAN LIMBAH BUDIDAYA IKAN BAWAL BINTANG Trachinotus blochii (Lacepede, 1801) DAN BONGGOL PISANG Musa paradisiaca L. var. sapientum SEBAGAI PUPUK UNTUK MEDIA PEMELIHARAAN RUMPUT LAUT Kappaphycus alvarezii (Doty, 1985) SECARA IN VITRO",['FP3'],article,disk0/00/01/52/39,"[{'id': 'putriyulia21@gmail.com', 'name': {'lineage': None, 'family': 'Putri', 'honourific': None, 'given': 'Yulia'}}, {'name': {'given': 'Yudha', 'family': 'Indra Gumay', 'honourific': None, 'lineage': None}, 'id': 'indra_gumay@yahoo.com'}, {'id': None, 'name': {'given': 'Santoso', 'lineage': None, 'family': 'Limin', 'honourific': None}}]",E-JURNAL REKAYASA DAN TEKNOLOGI BUDIDAYA PERAIRAN,2019-11-04 08:13:41,509,2019-11-04 08:13:41,FALSE,http://repository.lppm.unila.ac.id/id/eprint/15239,public,"[{'uri': 'http://repository.lppm.unila.ac.id/id/document/28375', 'rev_number': 1, 'format': 'text', 'pos': 1, 'files': [{'fileid': 131138, 'mime_type': 'application/pdf', 'mtime': '2019-11-04 04:20:24', 'hash_type': 'MD5', 'filename': 'Putri Yulia.pdf', 'hash': '1ea23e8b0775435a4930cd9d0eb3bf7c', 'datasetid': 'document', 'filesize': 11240, 'objectid': 28375, 'uri': 'http://repository.lppm.unila.ac.id/id/file/131138'}], 'main': 'Putri Yulia.pdf', 'docid': 28375, 'language': 'en', 'mime_type': 'application/pdf', 'security': 'public', 'placement': 1, 'eprintid': 15239}]",submitted,"Pada umumnya pupuk untuk budidaya rumput laut (Kappaphycus alvarezii) adalah pupuk kimia, seperti PES (Provasoli Enriched Seawater), yang harganya relatif
mahal. Pupuk organik cair dari limbah budidaya ikan bawal bintang (Trachinotus blochii) dan bonggol pisang (Musa paradisiaca L. var. sapientum) dapat menjadi alternatif pengganti PES.Fermentasi dari limbah budidaya ikan bawal bintang  yang ditambahkan  bonggol pisang dapat digunakan sebagai pupuk cair organik untuk rumput laut karena memiliki nutrisi yang tinggi. Tujuan penelitian ini adalah untuk mempelajari pengaruh pupuk organik cair (POC) dari limbah ikan bawal bintang dan bonggol pisang terhadap pertumbuhan rumput laut dan membandingkannya dengan pertumbuhan rumput laut yang menggunakan pupuk PES secara in vitro. Percobaan yang dilakukan menggunakan rancangan acak lengkap yang memiliki 4 perlakuan (pupuk PES  dengan konsentrasi 20 ml/l, LOF dengan konsentrasi 1,75, 3,50, dan 7,00 ml/l), dan  masing-masing dileng-kapi dengan 3 ulangan.Parameter rumput laut
yang diukur meliputi pertumbuhan panjang dan berat, diameter talus, dan laju pertumbuhan, kemudian dianalisis menggunakan analisis varian. Hasil penelitian menunjukkan bahwa pengaruh pupuk PES dan POC dalam berbagai konsentrasi tidak berbeda nyata (P>0,05) terhadap pertumbuhan panjang dan berat, diameter talus, dan
laju pertumbuhan, sehingga pupuk organik cair tersebut dapat diaplikasikan untuk budidaya rumput laut secara in vitro dan menggantikan pupuk PES. 

Kata Kunci: Limbah budidaya ikan bawal bintang, bonggol pisang, pupuk organik cair, rumput laut Kappaphycus alvarezii",2302-3600,"Jurusan Budidaya Perairan, Fakultas Pertanian Universitas Lampung",,,,,,,submitted,,,,,,
36,30170,['SH'],archive,2021-05-18 03:57:37,show,3,"The effect of spirulina meals on Oithona sp. (Claus, 1866) production through growth analysis",['FP3'],article,disk0/00/03/01/70,"[{'name': {'family': 'Samara', 'honourific': None, 'lineage': None, 'given': 'Syifania'}, 'id': 'syifania_hani@yahoo.com'}, {'name': {'given': 'Browijoyo', 'lineage': None, 'family': 'Santanumurti', 'honourific': None}, 'id': 'm.browijoyo@gmail.com'}, {'name': {'family': 'Widyantoro', 'honourific': None, 'lineage': None, 'given': 'Adi G'}, 'id': None}, {'id': 'berta.putri@fp.unila.ac.id', 'name': {'given': 'Berta', 'family': 'Putri', 'honourific': None, 'lineage': None}}, {'id': 'siti.hudaidah@fp.unila.ac.id', 'name': {'given': 'Siti', 'family': 'Hudaidah', 'honourific': None, 'lineage': None}}]",IOP Conf. Series: Earth and Environmental Science,2021-05-18 03:57:37,614,2021-05-18 03:57:37,TRUE,http://repository.lppm.unila.ac.id/id/eprint/30170,public,"[{'files': [{'filesize': 194043, 'datasetid': 'document', 'filename': '586.pdf', 'hash': '9d98fef33d207b7d95edfbda6f55e579', 'hash_type': 'MD5', 'mtime': '2020-11-17 12:52:23', 'mime_type': 'application/pdf', 'fileid': 357696, 'uri': 'http://repository.lppm.unila.ac.id/id/file/357696', 'objectid': 135537}], 'docid': 135537, 'main': '586.pdf', 'rev_number': 2, 'uri': 'http://repository.lppm.unila.ac.id/id/document/135537', 'pos': 1, 'format': 'text', 'placement': 1, 'security': 'public', 'eprintid': 30170, 'mime_type': 'application/pdf', 'language': 'en'}]",inpress,"Abstract. Oithona sp. is widely used for natural feed of larval stage. Therefore it is necessary to develop its culture method. The appropriate nutrient will affect the development of Oithona sp production. One of the highly nutritious ingredients is Spirulina meals. This study was conducted to determine the effect of Spirulina meals application on the population density of Oithona sp. The treatments in this study were A (Oithona sp. fed with Chaetoceros sp. of 2x106 cell/ml), B (Oithona sp. fed with 83 mg/L of Spirulina meals), C (Oithona sp. fed with 167 mg/L of Spirulina meals), D (Oithona sp. fed with 249 mg/L of Spirulina meals). The results showed that Spirulina meals had an effect on the population density of Oithona spp. This study also showed that the use of 83 mg/L of Spirulina meals could produce the best results with the amount up to 1067 ind/ml and grow speed of 0,78 ± 0,08 ind/day
1.",,IOP Publishing,,,,,,,,,,,,25888.0,
37,6326,['SH'],archive,2018-04-26 03:49:13,show,8,Potensi Penggunaan Media Teknis sebagai Pengganti Media Sea Water Complete (SWC) untuk Mendukung Pertumbuhan Bakteri Bacillus sp. D2.2,['FP3'],article,disk0/00/00/63/26,"[{'name': {'given': 'Kurnia Dwi Permata', 'lineage': None, 'honourific': None, 'family': 'Sari'}, 'id': 'kurniadwi51295@gmail.com'}, {'name': {'given': 'Limin', 'lineage': None, 'honourific': None, 'family': 'Santoso'}, 'id': None}, {'id': 'eko.efendi@fp.unila.ac.id', 'name': {'given': 'Eko', 'family': 'Efendi', 'honourific': None, 'lineage': None}}, {'id': 'edypeni@yahoo.com', 'name': {'honourific': None, 'family': 'Harpeni', 'lineage': None, 'given': 'Esti'}}]",Jurnal Sains Teknologi akuakultur,2018-04-26 03:49:13,274,2018-04-26 03:49:13,FALSE,http://repository.lppm.unila.ac.id/id/eprint/6326,public,"[{'mime_type': 'application/pdf', 'language': 'en', 'security': 'public', 'placement': 4, 'eprintid': 6326, 'rev_number': 1, 'uri': 'http://repository.lppm.unila.ac.id/id/document/19247', 'format': 'text', 'pos': 4, 'files': [{'filesize': 495938, 'datasetid': 'document', 'filename': '13-106-1-PB.pdf', 'hash': '98b27444c8eedc94c566e6315ebf24d9', 'mtime': '2018-01-09 03:05:02', 'hash_type': 'MD5', 'mime_type': 'application/pdf', 'fileid': 58836, 'uri': 'http://repository.lppm.unila.ac.id/id/file/58836', 'objectid': 19247}], 'main': '13-106-1-PB.pdf', 'docid': 19247}]",pub,"Media merupakan substrat yang berguna untuk menumbuhkan dan mengembangbiakan bakteri. Media yang selama ini digunakan untuk menumbuhkan bakteri merupakan media komersil yang penggunaannya terbatas pada skala laboratorium karena harganya yang relatif mahal. Penggunaan media teknis berupa campuran tepung ikan tepung kedelai, dan NaHCO3 dinilai mampu untuk menggantikan media analis Sea Water Complete (SWC) karena harganya yang relatif murah. Tujuan dilakukannya penelitian ini adalah untuk mengetahui pengaruh kombinasi media teknis tersebut terhadap pertumbuhan bakteri Bacillus sp D2.2, kemudian hasilnya akan dibandingkan dengan media SWC. Penelitian ini menggunakan rancangan acak lengkap (RAL) pola faktorial yang terdiri dari tiga taraf untuk masing-masing faktor (33) dan tiga kali pengulangan. Hasil yang didapat dari penelitian ini adalah tidak ada interaksi dari penggunaan media teknis terhadap pertumbuhan bakteri Bacillus sp. D2.2, namun hanya faktor mandiri berupa tepung ikan dan tepung kedelai saja yang mampu menunjang pertumbuhan bakteri Bacillus sp. D2.2. Selain itu, jika dibandingkan dengan media SWC maka diketahui bahwa fase eksponensial pada media media teknis terjadi lebih cepat, yakni 18 jam sedangkan pada media SWC fase eksponensial terjadi selama 23 jam.",2599-1701,Masyarakat Akuakultur Indonesia,,,,,,,,,1,95-103,2.0,,http://jsta.aquasiana.org/index.php/jmai/index
38,26157,['SH'],archive,2020-11-19 11:31:26,show,8,White spot syndrome virus immunoprotection and growth improvement in Litopenaues vannamei by dietary Sargassum fucoidan,['FP3'],article,disk0/00/02/61/57,"[{'id': 'agus.setyawan@fp.unila.ac.id', 'name': {'given': 'Agus', 'lineage': None, 'honourific': None, 'family': 'Setyawan'}}, {'id': 'isnansetyo@ugm.ac.id', 'name': {'given': 'Alim', 'lineage': None, 'family': 'Isnansetyo', 'honourific': None}}, {'id': None, 'name': {'given': 'Soedarmanto', 'lineage': None, 'family': 'Indarjulianto', 'honourific': None}}, {'id': None, 'name': {'given': 'Murwantoko', 'family': 'Murwantoko', 'honourific': None, 'lineage': None}}, {'name': {'family': 'Handayani', 'honourific': None, 'lineage': None, 'given': 'Christina Retna'}, 'id': None}]",Veterinary World,2020-11-19 11:31:26,64,2020-11-19 11:31:26,FALSE,http://repository.lppm.unila.ac.id/id/eprint/26157,public,"[{'files': [{'uri': 'http://repository.lppm.unila.ac.id/id/file/235844', 'objectid': 40042, 'filesize': 318314, 'datasetid': 'document', 'mtime': '2020-11-19 02:08:08', 'hash_type': 'MD5', 'hash': 'bffaf31535bf9e0b8d089021fa0d980e', 'filename': 'draft Publikasi Agus Setyawan 2020.pdf', 'fileid': 235844, 'mime_type': 'application/pdf'}], 'docid': 40042, 'main': 'draft Publikasi Agus Setyawan 2020.pdf', 'uri': 'http://repository.lppm.unila.ac.id/id/document/40042', 'rev_number': 1, 'pos': 1, 'format': 'text', 'placement': 1, 'security': 'public', 'eprintid': 26157, 'language': 'en', 'mime_type': 'application/pdf'}]",unpub,"Innate immune response, immune gene expression, resistance to white spot syndrome virus as well as the growth performance were evaluated in Pacific white shrimp after feeding diet supplemented with fucoidan from tropical Sargassum crassifolium. Total hemocyte count, phagocytic activity, phagocytic index, superoxide dismutase activity, phenoloxidase activity, and total plasma protein significantly increased in shrimp treated by fucoidan, particularly at dose 750 mg kg-1 in days 4th of treatment.  Shrimp proPO and lipopolysaccharide-β-glucan binding protein (LGBP) genes upregulation were highest at 6 and 12 days which maximum change reached at 2.4x105 and 1.1x103 fold, respectively. Whereas Toll and lectin upregulated highest at14 days of treatment (post-WSSV infection). In the separate trial, dietary 1,000 mg kg-1 fucoidan from S. crassifolium from 28 days significantly improved specific growth of shrimp 0.7% higher than control group. Subsequent result showed that 1,500 mg kg-1 fucoidan increased shrimp survival rate 20% higher than control group at2 days after challanged test. The shrimp resistance against WSSV also showed by decrease in copy number virus in shrimp tissue that treated with fucoidan coated diet. This current study supported the previous study in fucoidan from tropical Sargassum to enhance immunoprotection against WSSV and the first report as a growth promoter in L. vannamei.",,,"['Program Studi Budidaya Perairan, Jurusan Perikanan dan Kelautan, Universitas Lampung', 'Jurusan Perikanan, Fakultas Pertanian, Universitas Gadjah Mada, Yogyakarta', 'Fakultas Kedokteran Hewan, Universitas Gadjah Mada, Yogyakarta', 'Jurusan Perikanan, Fakultas Pertanian, Universitas Gadjah Mada, Yogyakarta', 'Direktorat Kawasan dan Kesehatan Ikan, Direktorat Jenderal Perikanan Budidaya, Kementrian Kelautan dan Perikanan']",,,,,,,,,,,,
39,47733,['SH'],archive,2023-01-11 10:27:49,show,7,Effectiveness of using of brown algae alginate to immobilize the indigenous bioremediation bacteria for reducing waste water from shrimp culture,['FP3'],other,disk0_bak/00/04/77/33,"[{'id': 'agus.setyawan@fp.unila.ac.id', 'name': {'honourific': None, 'family': 'Setyawan', 'lineage': None, 'given': 'Agus'}}, {'id': 'supono_unila@yahoo.com', 'name': {'honourific': None, 'family': 'Supono', 'lineage': None, 'given': 'Supono'}}, {'name': {'lineage': None, 'honourific': None, 'family': 'Anti', 'given': 'Ussy Tri'}, 'id': None}, {'id': None, 'name': {'given': 'Arlin', 'lineage': None, 'family': 'Wijayanti', 'honourific': None}}]",,2023-01-11 10:27:49,333,2023-01-11 10:27:49,,http://repository.lppm.unila.ac.id/id/eprint/47733,public,"[{'main': 'Cek Similarity (Effectiveness Using).pdf', 'docid': 186826, 'files': [{'uri': 'http://repository.lppm.unila.ac.id/id/file/522693', 'objectid': 186826, 'hash': '3f937a3c246cf3403ee5487a13a0c997', 'filename': 'Cek Similarity (Effectiveness Using).pdf', 'hash_type': 'MD5', 'mtime': '2023-01-11 09:47:20', 'mime_type': 'application/pdf', 'fileid': 522693, 'filesize': 414543, 'datasetid': 'document'}], 'format': 'text', 'pos': 1, 'rev_number': 1, 'uri': 'http://repository.lppm.unila.ac.id/id/document/186826', 'eprintid': 47733, 'security': 'public', 'placement': 1, 'mime_type': 'application/pdf', 'language': 'en'}]",unpub,"Abstract. Bacillus coagulans T1.2, an indigenous bacterium from shrimp ponds in East Lampung, has been found to reduce total ammonia nitrogen (TAN). The purpose of this study was to know the effectivity of immobilization of bacterial by sodium alginate from marine brown algae to reduce wastewater pollution from shrimp culture. The brown algae, Sargassum sp. and Padina sp., were collected from Pesisir Barat and Ketapang beach, Lampung. Alginate was extracted from both Sargassum and Padina by alkali method. The bacterial immobilization beads were made by mixed Bacillus coagulans suspension with alginate (1:3 v/v) and formed beads by 1,5 ml syringe without needle. In the in vitro study, the immobilized bacteria were submerged in artificial wastewater (2 beads ml-1) and incubated for 20 days. The control group includes the same bacteria without immobilization. The TAN was measured and the viability of bacteria was evaluated after the incubation period. The results showed that using alginate from Sargassum sp. and Padina sp. as a matrix of immobilization indigenous bacterial Bacillus coagulans effectively and significantly reduce the content of Total Ammonia Nitrogen (TAN) in wastewater. The viability of bacteria immobilized with the alginate of Sargassum sp. and Padina sp. better than the bacterial treatment without immobilization",,IOP Publishing,,,,,,,,,,,,,
40,47732,['SH'],archive,2023-01-11 10:28:05,show,8,Non-specific immune response of Pacific white shrimp Litopenaeus vannamei by supplementation of sodium alginate of Sargassum collected from Lampung Indonesia,['FP3'],other,disk0_bak/00/04/77/32,"[{'id': 'agus.setyawan@fp.unila.ac.id', 'name': {'lineage': None, 'family': 'Setyawan', 'honourific': None, 'given': 'Agus'}}, {'id': 'supono_unila@yahoo.com', 'name': {'lineage': None, 'family': 'Supono', 'honourific': None, 'given': 'Supono'}}, {'id': 'siti.hudaidah@fp.unila.ac.id', 'name': {'family': 'Hudaidah', 'honourific': None, 'lineage': None, 'given': 'Siti'}}, {'id': 'hilma.putri@fp.unila.ac.id', 'name': {'lineage': None, 'honourific': None, 'family': 'Fidyandini', 'given': 'Hilma Putri'}}, {'id': None, 'name': {'lineage': None, 'honourific': None, 'family': 'Riana', 'given': 'Riana'}}]",,2023-01-11 10:28:05,333,2023-01-11 10:28:05,,http://repository.lppm.unila.ac.id/id/eprint/47732,public,"[{'mime_type': 'application/pdf', 'language': 'en', 'eprintid': 47732, 'placement': 1, 'security': 'public', 'pos': 1, 'format': 'text', 'uri': 'http://repository.lppm.unila.ac.id/id/document/186825', 'rev_number': 1, 'docid': 186825, 'main': 'Cek Similarity (Nonspecific immune).pdf', 'files': [{'mtime': '2023-01-11 09:39:09', 'hash_type': 'MD5', 'hash': 'b4f919a769ce9fd497086dde92267068', 'filename': 'Cek Similarity (Nonspecific immune).pdf', 'fileid': 522682, 'mime_type': 'application/pdf', 'filesize': 3248911, 'datasetid': 'document', 'uri': 'http://repository.lppm.unila.ac.id/id/file/522682', 'objectid': 186825}]}]",unpub,"Abstract. This study aims to determine the effectiveness of supplementation of sodium (Na) alginate Sargassum sp. from Lampung waters to enhance the non-specific immune response and the resistence of Pacific white shrimp (Litopenaeus vannamei) against white spot disease. This study used a completely randomized design with 3 treatments, namely feeding without alginate supplementation (A) or control, dietary Na alginate Sargassum supplementation at a dose of 2.0 (B), and 4.0 g kg-1 feed (C), each with four replications, for 14 days. Hemolymph sampling was performed on days 0, 7 and 14 to observe the parameter of shrimp hematology included total haemocyte count (THC), phagocytocyte activity (PA), phagocytic index (PI), and total plasma protein (TPP). The hepatopancreas histology  profile and water quality were observed at the end of treatment. Data were analyzed by Anova at 95% of confidence interval and continued with Duncan test. Result showedthat the supplementation of Na alginat from Sargassum sp. significantly enhance several shrimp immune response namely THC, PA, and TPP. Meanwhile, the histology of the hepatopancreas of both shrimp treatment and control showed not significantly effect on tissue damage. The water quality was still in normal condition during the treatment. The results of this study indicate that the application of Sargassum alginate supplementation at a dose of 2gr / kg of feed is the best treatment to enhance the immune response of Pacific white shrim",,IOP Publishing,,,,,,,,,,,,,
41,42072,['SH'],archive,2022-06-03 09:56:48,show,6,Effectiveness of using of brown algae alginate to immobilize the indigenous bioremediation bacteria for reducing waste water from shrimp culture,['FP3'],article,disk0/00/04/20/72,"[{'name': {'lineage': None, 'family': 'Setyawan', 'honourific': None, 'given': 'Agus'}, 'id': 'agus.setyawan@fp.unila.ac.id'}, {'name': {'given': 'Supono', 'family': 'Supono', 'honourific': None, 'lineage': None}, 'id': 'supono_unila@yahoo.com'}, {'id': None, 'name': {'lineage': None, 'family': 'Wijayanti', 'honourific': None, 'given': 'Arlin'}}, {'name': {'lineage': None, 'family': 'Anti', 'honourific': None, 'given': 'Ussy Tri'}, 'id': None}]",IOP Conf. Series: Earth and Environmental Science,2022-06-03 09:56:48,64,2022-06-03 09:56:48,TRUE,http://repository.lppm.unila.ac.id/id/eprint/42072,public,"[{'language': 'en', 'mime_type': 'application/pdf', 'security': 'public', 'placement': 1, 'eprintid': 42072, 'rev_number': 1, 'uri': 'http://repository.lppm.unila.ac.id/id/document/163769', 'format': 'text', 'pos': 1, 'files': [{'mtime': '2022-06-03 01:47:55', 'hash_type': 'MD5', 'hash': 'f7cbe4fd176b1f5517e1be8353d1d00f', 'filename': '25. IOP Trepsea 2022.pdf', 'fileid': 463905, 'mime_type': 'application/pdf', 'filesize': 1389658, 'datasetid': 'document', 'uri': 'http://repository.lppm.unila.ac.id/id/file/463905', 'objectid': 163769}], 'main': '25. IOP Trepsea 2022.pdf', 'docid': 163769}]",pub,"Bacillus coagulans T1.2, an indigenous bacterium from shrimp ponds in East Lampung, has been found to reduce total ammonia nitrogen (TAN). The purpose of this study was to know the effectivity of immobilization of bacterial by sodium alginate from marine brown algae to reduce wastewater pollution from shrimp culture. The brown algae, Sargassum sp. and Padina sp., were collected from Pesisir Barat and Ketapang beach, Lampung. Alginate was extracted from both Sargassum and Padina by alkali method. The bacterial immobilization beads were made by mixed Bacillus coagulans suspension with alginate (1:3 v/v) and formed beads by
1,5 ml syringe without needle. In the in vitro study, the immobilized bacteria were submerged in artificial wastewater (2 beads ml-1) and incubated for 20 days. The control group includes the same bacteria without immobilization. The TAN was measured and the viability of bacteria was evaluated after the incubation period. The results showed that using alginate from Sargassum sp. and Padina sp. as a matrix of immobilization indigenous bacterial Bacillus coagulans effectively and significantly reduce the content of Total Ammonia Nitrogen (TAN) in wastewater. The viability of bacteria immobilized with the alginate of Sargassum sp. and Padina sp. better than the bacterial treatment without immobilization.",1755-1315,IOP Publishing,,,,,,,,,1027,012010-012018,,,
42,18997,['SH'],archive,2020-04-06 07:47:47,show,8,Analisis Indeks True Diversities Diatom Epipelic Tambak Udang dengan Tekstur Tanah yang Berbeda,['FP3'],other,disk0/00/01/89/97,"[{'name': {'given': 'Supono', 'lineage': None, 'honourific': None, 'family': 'Supono'}, 'id': 'supono_unila@yahoo.com'}]",,2020-04-06 07:47:47,333,2020-04-06 07:47:47,,http://repository.lppm.unila.ac.id/id/eprint/18997,public,"[{'main': 'Analisis indeks true diversities  diatom epipelic tambak udang dengan tekstur tanah yang berbeda.pdf', 'docid': 32236, 'files': [{'fileid': 159382, 'mime_type': 'application/pdf', 'mtime': '2020-04-06 05:17:13', 'hash_type': 'MD5', 'filename': 'Analisis indeks true diversities  diatom epipelic tambak udang dengan tekstur tanah yang berbeda.pdf', 'hash': 'e1cefd128af7e1a9e6ff7e830a8c097c', 'datasetid': 'document', 'filesize': 430261, 'objectid': 32236, 'uri': 'http://repository.lppm.unila.ac.id/id/file/159382'}], 'format': 'text', 'pos': 1, 'rev_number': 1, 'uri': 'http://repository.lppm.unila.ac.id/id/document/32236', 'eprintid': 18997, 'security': 'public', 'placement': 1, 'language': 'en', 'mime_type': 'application/pdf'}]",pub,Hasil review,,PS. Kalautan Fakultas Matematika dan Ilmu Pengetahuan Alam,,,,,,,published,,,,,,
43,19002,['SH'],archive,2020-04-07 05:04:17,show,7,Analisis Keragaan Lele Dumbo (Clarias gariepinas) yang Dipelihara pada skala Intensif dengan Menggunakan Sistem Zero Water Exchange,['FP3'],other,disk0/00/01/90/02,"[{'id': 'supono_unila@yahoo.com', 'name': {'family': 'Supono', 'honourific': None, 'lineage': None, 'given': 'Supono'}}]",,2020-04-07 05:04:17,333,2020-04-07 05:04:17,,http://repository.lppm.unila.ac.id/id/eprint/19002,public,"[{'language': 'en', 'mime_type': 'application/pdf', 'eprintid': 19002, 'security': 'public', 'placement': 1, 'format': 'text', 'pos': 1, 'uri': 'http://repository.lppm.unila.ac.id/id/document/32241', 'rev_number': 1, 'docid': 32241, 'main': 'Analisis keragaan leel dumbo yang dipelihara pada skala intensif dengan zero exchange.pdf', 'files': [{'objectid': 32241, 'uri': 'http://repository.lppm.unila.ac.id/id/file/159435', 'mime_type': 'application/pdf', 'fileid': 159435, 'filename': 'Analisis keragaan leel dumbo yang dipelihara pada skala intensif dengan zero exchange.pdf', 'hash': 'b7652dcd82698d467c164a24e72e57b5', 'hash_type': 'MD5', 'mtime': '2020-04-06 09:36:29', 'datasetid': 'document', 'filesize': 475691}]}]",pub,Hasil review,,Politeknik negeri lampung,,,,,,,published,,,,,,
