,eprintid,subjects,eprint_status,status_changed,metadata_visibility,rev_number,title,divisions,type,dir,creators,publication,datestamp,userid,lastmod,refereed,uri,full_text_status,documents,ispublished,abstract,issn,publisher,corp_creators,pres_type,event_title,event_location,event_dates,event_type,date_type,contact_email,volume,pagerange,number,succeeds,official_url
26,25925,['SH'],archive,2020-11-18 01:36:26,show,9,Efek bakterisidal dan imunomoulator ekstrak daun handeleum terhadap serangan Vibrio parahaemolyticus pada ikan kakap putih (Lates calcarifer),['FP3'],conference_item,disk0/00/02/59/25,"[{'name': {'given': 'Muhammad', 'honourific': None, 'family': 'Darmawan', 'lineage': None}, 'id': None}, {'id': None, 'name': {'lineage': None, 'honourific': None, 'family': 'Windari', 'given': 'Hanesty Resta'}}, {'name': {'given': 'Ofriani', 'lineage': None, 'family': 'Fatrika', 'honourific': None}, 'id': None}, {'name': {'given': 'Agus', 'honourific': None, 'family': 'Setyawan', 'lineage': None}, 'id': 'agus.setyawan@fp.unila.ac.id'}]",,2020-11-18 01:36:26,64,2020-11-18 01:36:26,FALSE,http://repository.lppm.unila.ac.id/id/eprint/25925,public,"[{'uri': 'http://repository.lppm.unila.ac.id/id/document/39729', 'rev_number': 1, 'pos': 1, 'format': 'image', 'files': [{'datasetid': 'document', 'filesize': 13464638, 'fileid': 233038, 'mime_type': 'image/png', 'mtime': '2020-11-17 15:02:42', 'hash_type': 'MD5', 'filename': 'poster baru fix.png', 'hash': '0c0728a8873522e6140b7058bd355ca5', 'objectid': 39729, 'uri': 'http://repository.lppm.unila.ac.id/id/file/233038'}], 'main': 'poster baru fix.png', 'docid': 39729, 'mime_type': 'image/png', 'language': 'en', 'placement': 1, 'security': 'public', 'eprintid': 25925}]",unpub,"Vibrio parahaemolyticus merupakan salah satu patogen oportunistik dari golongan bakteri yang  bisa mengancam kapan saja dan menyebabkan mortilitas mencapai 90% pada budidaya ikan kakap putih. Hingga saat ini berbagai teknik pengendalian bakteri Vibrio sp. dinilai masih kurang efektif dan bahkan bakteri Vibrio berpotensi mengalami resisten terhadap penggunaan antibiotic yang tidak tepat.  Oleh karena itu, diperlukan antibakteri alternative khususnya anti-Vibrio yang efektif, aman serta ramah lingkungan. Salah satu tumbuhan herbal yang memiliki potensi sebagai antibakteri yaitu daun handeuleum (Graptophyllum pictum). Sejauh ini belum ada kajian aktivitas ekstrak daun handeuleum sebagai anti-Vibrio. Namun, daun handeuleum terbukti memiliki kandungan antibakteri seperti alkaloid non-toksik, flavonoid, steroid, saponin dan tannin. Tujuan penulisan narrative review ini yaitu untuk mengkaji potensi daun handeuleum (Graptophyllum pictum) sebagai anti-Vibrio parahaemolyticus pada budidaya ikan kakap putih (Lates calcarifer) berdasarkan referensi yang ada sebelumnya. Metode yang dilakukan yakni dengan melakukan penelusuran dan pengumpulan pustaka berupa artikel dan jurnal ilmiah baik nasional maupun internasional, selanjutnya dilakukan analisa dan komparasi literatur. Daun handeuleum memiliki beberapa senyawa  seperti hexadeconoic acid (palmitit acid), dodecanoic acid (lauric acid), hexadecanoic acid (methyl ester), 9,12,15-octadecatrienoic acid, tetradecanoic acid (myrist), dan octadeconoic acid yang berpotensi sebagai kandidat anti-Vibrio parahameulyticus untuk mencegah dan mengobati penyakit Virbiosis pada ikan kakap putih.",,,"['Program Studi Budidaya Perairan, Jurusan Perikanan dan Kelautan, Universitas Lampung', 'Program Studi Budidaya Perairan, Jurusan Perikanan dan Kelautan, Universitas Lampung', 'Program Studi Kimia, Fakultas MIPA, Universitas Lampung', 'Program Studi Budidaya Perairan, Jurusan Perikanan dan Kelautan, Universitas Lampung']",poster,PIMNAS 2020,"Universitas Gadjah Mada, Yigyakarta",26 November 2020,other,,,,,,,
27,26159,['SH'],archive,2020-11-19 11:31:44,show,8,PELATIHAN PENGGUNAAN PROBIOTIK DAN IMUNOSTIMULAN UNTUK PENCEGAHAN DAN PENGOBATAN PENYAKIT IKAN LELE PADA KELOMPOK PEMBUDIDAYA IKAN ULAM ADI JAYA KABUPATEN MESUJI,['FP3'],article,disk0/00/02/61/59,"[{'name': {'given': 'Hilma Putri', 'lineage': None, 'family': 'Fidyandini', 'honourific': None}, 'id': 'hilma.putri@fp.unila.ac.id'}, {'name': {'lineage': None, 'honourific': None, 'family': 'Elisdiana', 'given': 'Yeni'}, 'id': 'elisdiana.yeni@gmail.com'}, {'id': 'nidya.kartini@fp.unila.ac.id', 'name': {'given': 'Nidya', 'lineage': None, 'family': 'Kartini', 'honourific': None}}]",SAKAI SAMBAYAN,2020-11-19 11:31:44,3281,2020-11-19 11:31:44,FALSE,http://repository.lppm.unila.ac.id/id/eprint/26159,public,"[{'mime_type': 'application/pdf', 'language': 'en', 'security': 'public', 'placement': 1, 'eprintid': 26159, 'rev_number': 1, 'uri': 'http://repository.lppm.unila.ac.id/id/document/40045', 'format': 'text', 'pos': 1, 'files': [{'uri': 'http://repository.lppm.unila.ac.id/id/file/235852', 'objectid': 40045, 'filesize': 126319, 'datasetid': 'document', 'mtime': '2020-11-19 02:10:19', 'hash_type': 'MD5', 'hash': '0ad5e82cad74107636f25a8c5af9c27e', 'filename': 'Hilma Putri_JSS.pdf', 'fileid': 235852, 'mime_type': 'application/pdf'}], 'main': 'Hilma Putri_JSS.pdf', 'docid': 40045}]",submitted,"Usaha budidaya ikan menunjukkan perkembangan yang pesat dari tahun ketahun. Hal ini dikarenakan semakin bertambahnya kesadaran masyarakat untuk mengkonsumsi ikan. Salah satu usaha budidaya yang banyak dilakukan masayarakat indunesia adalah budidaya ikan konsumsi air tawar. Teknologi budidaya ikan konsumsi air tawar yang saat ini banyak digunakan di Indonesia adalah sistem budi daya intensif dengan padat tebar yang tinggi. Sama seperti usaha budidaya perikanan lainnya, masalah utama dalam budidaya ikan air tawar adalah serangan penyakit. Untuk menghindari keadaan ini, perlu dilakukan upaya pencegahan dan penanggulangan penyakit secara tepat. Pencegahan penyakit ikan dapat dilakukan dengan cara peningkatan daya tahan tubuh ikan dengan pemberian imunostimulan alami. Imunostimulan alami yang mudah didapat di lingkungan sekitar antara lain kunyit, bawang putih, meniran, dan masih banyak lagi. Pencegahan penyakit juga dapat dilakukan dengan cara mengontrol kualitas air, baik dari suhu, kandungan oksigen terlarut, derajat keasaman, dan mengontrol jumlah bakteri pathogen dalam perairan. Kontrol jumlah bakteri dalam perairan biasanya dilakukan dengan pemberian probiotik. Sedangkan untuk pengobatan penyakit ikan dapat dilakukan dengan cara karantina ikan atau memisahkan ikan yang sakit dengan yang sehat dan juga pemberian obat-obatan alami. Aplikasi pemberian probiotik dan imunostimulan pada media budidaya dan pakan ikan lele mampu mencegah dan mengobati penyakit pada ikan lele sehingga mampu meningkatkan produksi ikan lele. Kendala yang dihadapi dalam budidaya ikan lele di Pokdakan Ulam Adi Jaya adalah kurangnya sarana dan prasarana budidaya terutama aerator.   
Kata kunci: ikan lele, imunostimulan, probiotik.",e-ISSN 2550-1089,Lembaga Penelitian dan Pengabdian Kepada Masyarakat,"['Jurusan Perikanan dan Kelautan Universitas Lampung, Bandar Lampung']",,,,,,submitted,,,,,,
28,20944,['SH'],archive,2020-05-29 01:42:34,show,8,First report of Spirulina sp. performance in wastewater of Cromileptes altivelis aquaculture in Indonesia,['FP3'],article,disk0/00/02/09/44,"[{'id': 'siti.hudaidah@fp.unila.ac.id', 'name': {'honourific': None, 'family': 'Hudaidah', 'lineage': None, 'given': 'Siti'}}, {'id': 'berta.putri@fp.unila.ac.id', 'name': {'honourific': None, 'family': 'Berta', 'lineage': None, 'given': 'Putri'}}, {'id': 'supono_unila@yahoo.com', 'name': {'given': 'Supono', 'honourific': None, 'family': 'Supono', 'lineage': None}}, {'id': None, 'name': {'family': 'Ellen', 'honourific': None, 'lineage': None, 'given': 'Larasati'}}, {'id': None, 'name': {'given': 'Browijoyo', 'lineage': None, 'family': 'Santanumurti', 'honourific': None}}]","Aquaculture, Aquarium, Conservation & Legislation - International Journal of the Bioflux Society (AACL Bioflux)",2020-05-29 01:42:34,614,2020-05-29 01:42:34,TRUE,http://repository.lppm.unila.ac.id/id/eprint/20944,public,"[{'eprintid': 20944, 'security': 'public', 'placement': 1, 'language': 'en', 'mime_type': 'application/vnd.openxmlformats-officedocument.wordprocessingml.document', 'docid': 34314, 'main': 'siti hudaidah draft bioflux.docx', 'files': [{'objectid': 34314, 'uri': 'http://repository.lppm.unila.ac.id/id/file/195601', 'fileid': 195601, 'mime_type': 'application/vnd.openxmlformats-officedocument.wordprocessingml.document', 'mtime': '2020-05-29 00:45:59', 'hash_type': 'MD5', 'filename': 'siti hudaidah draft bioflux.docx', 'hash': 'f6e69595f916e9f1b89457c49b8893f3', 'datasetid': 'document', 'filesize': 81340}], 'format': 'text', 'pos': 1, 'uri': 'http://repository.lppm.unila.ac.id/id/document/34314', 'rev_number': 1}]",inpress,"Abstract. Indonesia is one of the countries with the most significant grouper production in the world. One of the groupers that are widely cultured in Indonesia is the humpback grouper (Cromileptes altivelis). Unfortunately, humpback grouper aquaculture activities cause waste. The waste can produce hydrogen sulfide, orthophosphate, and ammonia, which is toxic to aquatic animals. One way to treat the waste is by using Spirulina sp. Spirulina sp. is utilizing organic material from humpback grouper waste to support its growth. The purpose of this study was to identify its performance in reducing water quality parameters into tolerance level. It was also to examine the growth of Spirulina sp. on laboratory-scale culture in the humpback grouper nursery media with a varying degree of waste. The study design used was a Completely Randomized Design (CRD) with four treatments and three replications, A (100%), B (75%), C (50%), and D (25%) humpback grouper nursery waste as culture media. The parameters calculated include population density, nitrate, orthophosphate, pH, temperature, salinity, and light intensity. The results showed that Spirulina sp. could reduce nitrate and phosphorus in water up to 89.78% and 84.34% of the waste. Spirulina sp. could maintain all water quality to be following the standards for fish farming again. The utilization of humpback grouper nursery waste at a concentration of 25% has a significant effect on the population growth of Spirulina sp. on laboratory scale culture.

Key Words: Cromileptes altivelis, Spirulina, wastewater, aquaculture, Indonesia.",,"Bioflux, Romania",,,,,,,,siti.hudaidah@fp.unila.ac.id,,,,,
29,47734,['SH'],archive,2023-01-11 10:28:11,show,7,First report of Spirulina sp. performance in wastewater of Cromileptes altivelis aquaculture in Indonesia,['FP3'],other,disk0_bak/00/04/77/34,"[{'name': {'lineage': None, 'honourific': None, 'family': 'Hudaidah', 'given': 'Siti'}, 'id': 'siti.hudaidah@fp.unila.ac.id'}, {'name': {'given': 'Supono', 'lineage': None, 'family': 'Supono', 'honourific': None}, 'id': 'supono_unila@yahoo.com'}, {'id': None, 'name': {'lineage': None, 'honourific': None, 'family': 'Putri', 'given': 'Berta'}}, {'name': {'family': 'larasati', 'honourific': None, 'lineage': None, 'given': 'ellen'}, 'id': None}]",,2023-01-11 10:28:11,333,2023-01-11 10:28:11,,http://repository.lppm.unila.ac.id/id/eprint/47734,public,"[{'language': 'en', 'mime_type': 'application/pdf', 'placement': 1, 'security': 'public', 'eprintid': 47734, 'rev_number': 1, 'uri': 'http://repository.lppm.unila.ac.id/id/document/186827', 'pos': 1, 'format': 'text', 'files': [{'objectid': 186827, 'uri': 'http://repository.lppm.unila.ac.id/id/file/522700', 'fileid': 522700, 'mime_type': 'application/pdf', 'mtime': '2023-01-11 10:02:22', 'hash_type': 'MD5', 'hash': 'b2c65ceb677f4926576ecd7041686152', 'filename': 'Cek Similarity(First Report).pdf', 'datasetid': 'document', 'filesize': 477154}], 'main': 'Cek Similarity(First Report).pdf', 'docid': 186827}]",unpub,"One of the groupers that are widely cultured in Indonesia is the humpback grouper (Cromileptes altivelis). Unfortunately, humpback grouper aquaculture activities cause waste. The waste can produce hydrogen sulfide, orthophosphate, and ammonia, which is toxic to aquatic animals. One way to treat the waste is by using Spirulina sp., which is utilizing organic material from humpback grouper waste to support its growth. The purpose of this study was to identify its performance in reducing water quality parameters to tolerance level. It was also to examine the growth of Spirulina sp. on laboratory-scale culture in the humpback grouper nursery media with a varying degree of waste. The study design used was a Completely Randomized Design (CRD) with four treatments and three replications, A (100%), B (75%), C (50%), and D (25%) humpback grouper nursery waste as culture media. The parameters calculated include population density, nitrate, orthophosphate, pH, temperature, salinity, and light intensity. The results showed that Spirulina sp. could reduce nitrate and phosphorus in water up to 89.78% and 84.34% of the waste. Spirulina sp. could maintain all water quality to be following the standards for fish farming again. The utilization of humpback grouper nursery waste at a concentration of 25% has a significant effect on the population growth of Spirulina sp. on laboratory scale culture. Key Words: aquaculture, grouper, phytoplankton, waste",,Bioflux,,,,,,,,,,,,,
30,4511,['SH'],archive,2017-11-10 08:44:18,show,6,"Pengaruh Salinitas Berbeda Terhadap Pertumbuhan dan Kandungan Karotenoid Dunaliella sp. Dalam Media Ekstrak
Daun Lamtoro (Leucaena leucocephala)",['FP3'],article,disk0/00/00/45/11,"[{'name': {'given': 'Dharta', 'family': 'Mahardani', 'honourific': None, 'lineage': None}, 'id': None}, {'id': 'berta.putri@fp.unila.ac.id', 'name': {'given': 'Berta', 'lineage': None, 'honourific': None, 'family': 'Putri'}}, {'id': None, 'name': {'honourific': None, 'family': 'Hudaidah', 'lineage': None, 'given': 'Siti'}}]",Jurnal Perikanan dan Kelautan,2017-11-10 08:44:18,142,2017-11-10 08:44:18,TRUE,http://repository.lppm.unila.ac.id/id/eprint/4511,public,"[{'language': 'en', 'mime_type': 'application/pdf', 'eprintid': 4511, 'placement': 1, 'security': 'public', 'pos': 1, 'format': 'text', 'rev_number': 1, 'uri': 'http://repository.lppm.unila.ac.id/id/document/17416', 'docid': 17416, 'main': '1950-4204-1-SM_2.pdf', 'files': [{'uri': 'http://repository.lppm.unila.ac.id/id/file/44593', 'objectid': 17416, 'filename': '1950-4204-1-SM_2.pdf', 'hash': '25855dc40fef69a0e19f77db561720e8', 'hash_type': 'MD5', 'mtime': '2017-11-03 11:08:45', 'mime_type': 'application/pdf', 'fileid': 44593, 'filesize': 874446, 'datasetid': 'document'}]}]",pub,"Dunaliella merupakan mikroalga hijau yang menghasilkan karotenoid, salah satu jenis karotenoid yang dihasilkan adalah β-karoten yang mampu diakumulasi dalam jumlah sangat tinggi pada beberapa kondisi stress seperti keterbatasan nitrogen, salinitas yang tinggi dan terkena intensitas cahaya tinggi. Daun lamtoro (Leucaena leucocephala) salah satu bahan alami yang berpotensi sebagai sumber nutrisi untuk memenuhi kebutuhan nutrisi Dunaliella sp. serta meningkatkan pertumbuhan. Tujuan dari penelitian ini yaitu untuk mengetahui pengaruh salinitas yang berbeda dalam media ekstrak Daun Lamtoro terhadap pertumbuhan dan kandungan karotenoid Dunaliella sp. Penelitian dilakukan di Laboratorium Budidaya Perikanan, Fakultas Pertanian, Universitas Lampung selama 8 hari waktu kultur. Rancangan penelitian yang digunakan adalah Rancangan Acak Lengkap (RAL) dengan 4 perlakuan 3 kali ulangan. Perlakuan yang digunakan yaitu media ekstrak Daun Lamtoro dengan salinitas 30 ppt, 35 ppt, 40 ppt dan 45 ppt. Hasil penelitian menunjukkan bahwa penggunaan media ekstrak Daun Lamtoro dengan salinitas berbeda berpengaruh terhadap kepadatan sel dan kandungan karotenoid Dunaliella sp. (p<0,05). Kepadatan sel tertinggi terjadi pada perlakuan salinitas 30 ppt dengan kepadatan sel mencapai 5,09×106sel/ml, sedangkan kandungan karotenoid tertinggi dihasilkan pada perlakuan salinitas 35 ppt yaitu sebanyak 1,0668 g/ml.",e – ISSN 2540 – 9484,Jurusan Perikanan dan Kelautan Universitas Tirtayasa,,,,,,,,,7,50-58,1.0,,
31,25747,['SH'],archive,2020-11-17 04:36:19,show,7,"SUPLEMENTASI MULTIVITAMIN UNTUK MENINGKATKAN RESPON IMUN NONSPESIFIK DAN PERTUMBUHAN 
BENIH IKAN GABUS, Channa striata (Bloch, 1793)",['FP3'],article,disk0/00/02/57/47,"[{'id': 'nagung540@gmail.com', 'name': {'given': 'M. Agung', 'lineage': None, 'honourific': None, 'family': 'Nugraha'}}, {'id': 'agus.setyawan@fp.unila.ac.id', 'name': {'lineage': None, 'honourific': None, 'family': 'Setyawan', 'given': 'Agus'}}, {'id': 'deny.utomo@fp.unila.ac.id', 'name': {'given': 'Deny Sapto Chondro', 'lineage': None, 'family': 'Utomo', 'honourific': None}}, {'id': 'indra.yudha@fp.unila.ac.id', 'name': {'given': 'Indra Gumay', 'lineage': None, 'honourific': None, 'family': 'Yudha'}}]",Aquatropica Asia,2020-11-17 04:36:19,64,2020-11-17 04:36:19,TRUE,http://repository.lppm.unila.ac.id/id/eprint/25747,public,"[{'files': [{'uri': 'http://repository.lppm.unila.ac.id/id/file/231761', 'objectid': 39537, 'hash': 'df83ce8d52931f09b0625c158cc8f27b', 'filename': '4. JURNAL M. Agung Nugraha.docx', 'hash_type': 'MD5', 'mtime': '2020-11-17 04:27:57', 'mime_type': 'application/vnd.openxmlformats-officedocument.wordprocessingml.document', 'fileid': 231761, 'filesize': 135476, 'datasetid': 'document'}], 'docid': 39537, 'main': '4. JURNAL M. Agung Nugraha.docx', 'rev_number': 1, 'uri': 'http://repository.lppm.unila.ac.id/id/document/39537', 'format': 'text', 'pos': 1, 'security': 'public', 'placement': 1, 'eprintid': 25747, 'language': 'en', 'mime_type': 'application/vnd.openxmlformats-officedocument.wordprocessingml.document'}]",unpub,"Budidaya pada benih ikan gabus (Channa striata) masih mengalami kesulitan, hal ini dikarenakan mortalitas yang tinggi dan kanibalisme. Oleh karena itu perlu adanya penambahan suplemen dan vitamin pada pakan yang digunakan agar dapat mendukung pertumbuhan benih ikan gabus. Tujuan dari penelitian ini yaitu untuk mempelajari peningkatan respon imun nonspesifik dan pertumbuhan benih ikan gabus dengan pemberian pakan yang ditambahkan suplemen viterna dan vitamin C. Penelitian ini menggunakan metode Rancangan Acak Lengkap (RAL), yang terdiri atas 4 perlakuan dan 2 ulangan yaitu perlakuan tanpa suplementasi, pakan dengan suplementasi viterna 1,5 ml/kg pakan, pakan dengan suplementasi vitamin C 1,5 g/kg pakan, pakan dengan kombinasi viterna 0,75 ml + vitamin C 0,75 g/kg pakan. Hasil penelitian ini menunjukkan, perlakuan pakan dengan kombinasi viterna 0,75 ml + 0,75 g/kg pakan  nilai tertinggi, pada parameter total leukosit dan jumlah hematokrit nilai tertinggi pada kedua perlakuan pakan dengan suplementasi viterna 1,5 ml/pakan dan pakan dengan kombinasi 0,75 ml + 0,75 g/kg pakan, pada paramter aktivitas fagositosis nilai tertinggi pada tiga perlakuan dengan penambahan suplementasi viterna 1,5 ml/kg pakan, pakan dengan suplementasi vitamin C 1,5 g/kg pakan, pakan dengan kombinasi viterna 0,75 ml + vitamin C 0,75 g/kg pakan. Pada parameter pertumbuhan, nilai berat mutlak dan laju pertumbuhan tertinggi yaitu pada dua perlakuan dengan penambahan suplementasi viterna 1,5 ml/kg pakan, pakan dengan kombinasi viterna 0,75 ml + vitamin C 0,75 g/kg pakan, parameter rasio konversi pakan tertinggi pada perlakuan dengan penambahan suplementasi viterna 1,5 g/kg pakan, parameter kelangsungan hidup nilai tertinggi yaitu pada perlakuan dengan penambahan suplementasi viterna 1,5 g/kg pakan. Penambahan suplemen viterna dan vitamin C dapat mempengaruhi respon imun dan pertumbuhan benih ikan gabus selama penelitian.",,,"['Program Studi Budidaya Perairan, Jurusan Perikanan dan Kelautan, Universitas Lampung']",,,,,,,,,,,,
32,15229,['SH'],archive,2019-11-04 08:10:08,show,7,"PENGARUH PEMBERIAN RECOMBINANT GROWTH HORMONE
(rGH) TERHADAP BEBERAPA ASPEK PERTUMBUHAN IKAN 
JELAWAT, Leptobarbus hoevenii (Bleeker, 1851)",['FP3'],article,disk0/00/01/52/29,"[{'id': 'nurselawati1010@gmail.com', 'name': {'given': 'Selawati', 'family': 'Nur', 'honourific': None, 'lineage': None}}, {'id': 'indra_gumay@yahoo.com', 'name': {'lineage': None, 'family': 'Indra Gumay', 'honourific': None, 'given': 'Yudha'}}, {'id': None, 'name': {'given': 'Utomo', 'family': 'Deny Sapto Chondro', 'honourific': None, 'lineage': None}}]",E-JURNAL REKAYASA DAN TEKNOLOGI BUDIDAYA PERAIRAN,2019-11-04 08:10:08,509,2019-11-04 08:10:08,FALSE,http://repository.lppm.unila.ac.id/id/eprint/15229,restricted,"[{'language': 'en', 'mime_type': 'application/pdf', 'eprintid': 15229, 'date_embargo': '2020-11-30', 'security': 'staffonly', 'placement': 1, 'format': 'text', 'pos': 1, 'formatdesc': 'Abstrak makalah', 'uri': 'http://repository.lppm.unila.ac.id/id/document/28363', 'rev_number': 2, 'docid': 28363, 'main': 'Nur Selawati.PDF', 'files': [{'filesize': 100319, 'datasetid': 'document', 'hash_type': 'MD5', 'mtime': '2019-11-04 04:03:06', 'filename': 'Nur Selawati.PDF', 'hash': 'e9b586e34a172eba0b8752502e9e0a43', 'fileid': 131077, 'mime_type': 'application/pdf', 'uri': 'http://repository.lppm.unila.ac.id/id/file/131077', 'objectid': 28363}]}]",submitted,"Ikan jelawat telah dibudidayakan di Indonesia. Oleh karena ikan ini memiliki pertumbuhan yang lambat, maka menyebabkan budidayanya tidak berkembang dengan baik. Penelitian ini bertujuan untuk mempelajari pengaruh rGH terhadap pertumbuhan ikan jelawat dan menentukan dosis optimumnya. Ikan uji yang digunakan berukuran 70 - 90 mm dengan bobot antara 5 - 6 g yang dipelihara dalam 12 kolam berukuran 0,75 x 0,5 x 0,5 m3  yang masing-masing berisi 10 ikan. Rancangan percobaan menggunakan rancangan acak lengkap yang terdiri dari 4 perlakuan, yaitu A (tanpa penambahan rGH), B (dosis rGH 1 mg/kg), C
(dosis rGH 2 mg/kg), dan D (dosis rGH 3 mg/ kg), yang masing-masing perlakuan memiliki 3 ulangan. Parameter yang dianalisis meliputi pertumbuhan berat mutlak, pertumbuhan panjang mutlak, tingkat kelangsungan hidup, laju konversi pakan, dan retensi protein. Hasil peneliitian menunjukkan bahwa pengaruh penambahan rGH berbeda nyata terhadap pertumbuhan, FCR, dan retensi protein. Penambahan rGH dengan dosis 2 mg/kg menyebabkan pertumbuhan dan retensi protein lebih tinggi, serta FCR lebih rendah dibandingkan dengan perlakuan lainnya. Adapun dosis optimum rGH yang disarankan untuk meningkatkan pertumbuhan ikan jelawat adalah 1,98 mg/kg. 

Kata kunci: rGH, ikan jelawat, pertumbuhan, parameter.",2302-3600,"Jurusan Budidaya Perairan, Fakultas Pertanian Universitas Lampung",,,,,,,submitted,,,,,,
33,8176,['S1'],archive,2018-06-28 08:17:36,show,6,EMANFAATAN BUNGKIL INTI SAWIT SEBAGAI MEDIA                                                            PERTUMBUHAN CACING SUTRA (Tubifex sp.),['FP3'],article,disk0/00/00/81/76,"[{'name': {'honourific': None, 'family': 'Putri', 'lineage': None, 'given': 'Berta'}, 'id': None}, {'id': 'siti.hudaidah@fp.unila.ac.id', 'name': {'family': 'Hudaidah', 'honourific': None, 'lineage': None, 'given': 'Siti'}}, {'id': None, 'name': {'honourific': None, 'family': 'indra', 'lineage': None, 'given': 'widi'}}]",E-JURNAL REKAYASA DAN TEKNOLOGI BUDIDAYA PERAIRAN,2018-06-28 08:17:36,142,2018-06-28 08:17:36,TRUE,http://repository.lppm.unila.ac.id/id/eprint/8176,public,"[{'docid': 21208, 'main': 'Carnel Cake Tubifex.pdf', 'files': [{'filesize': 506968, 'datasetid': 'document', 'hash_type': 'MD5', 'mtime': '2018-06-28 07:32:19', 'filename': 'Carnel Cake Tubifex.pdf', 'hash': 'e84324d830da4698fb05c21ea1ba3ee2', 'fileid': 81371, 'mime_type': 'application/pdf', 'uri': 'http://repository.lppm.unila.ac.id/id/file/81371', 'objectid': 21208}], 'pos': 1, 'format': 'text', 'uri': 'http://repository.lppm.unila.ac.id/id/document/21208', 'rev_number': 1, 'eprintid': 8176, 'placement': 1, 'security': 'public', 'language': 'en', 'mime_type': 'application/pdf'}]",pub,"The purpose of this research was to observe the effect of fermented palm
kernel cake as a growth media for Tubifex sp. This research was conducted at the
Aquaculture Laboratory, University of Lampung for 50 days. Completely
Randomized Design (CDR) with 5 treatments and 3 replicates design is used for
this experiment. The treatments are 100% field mud, 25% palm kernel cake :75%
field mud, 50% palm kernel cake : 50% field mud, 75% palm kernel cake : 25%
field mud, and 100% palm kernel cake. The data were analyzed with analysis of
variance (ANOVA) continued with Least Significant Difference (LSD) test. The
main parameters measured were Tubifex sp population and biomass as well as
water quality parameters: pH, temperature, dissolved oxygen, and ammonia. The
results showed that fermented palm kernel cake significantly (p<0,05) increase silk
worm biomass and population. The best result of this research was found in 50%
fermented palm kernel cake and 50% field mud media producing 111.008 ind/m

and 750,72 gr/m
2
 of Tubifex sp. Water quality during Tubifex sp were measured at
0,26-0,91 mg/l ammonia, pH 6,14-7,11, temperature 25-28C, and dissolved 
oxygen 2,9-3,9 mg/l.

Keywords: Biomass, Fermentation, Palm kernel cake, Population, Tubifex sp.",2302-3600,"Jurusan Budidaya Perairan, Fakultas Pertanian Universitas Lampung",['Universitas Lampung'],,,,,,,,,,,,
