,title,rev_number,metadata_visibility,eprint_status,status_changed,subjects,abstract,eprintid,date_type,ispublished,publisher,documents,full_text_status,uri,refereed,userid,lastmod,datestamp,pagerange,creators,date,dir,pages,type,book_title,divisions,number,corp_creators,issn,publication,volume,official_url,contributors,id_number,related_url,place_of_pub,event_type,event_location,event_title,pres_type,contact_email,isbn
9,STRATEGIC HUMAN RESOURCE MANAGEMENT AND FIRM PERFORMANCE: THE MODERATION OF PSYCHOLOGICAL CONTRACT,7,show,archive,2022-03-31 02:39:08,['HD28'],"Practices and role of HRM is expected to improve business performance. HRM model as a business or a strategic partner developed by Ulrich (1997, 2007) is quite popular and preferable because it can improve the status of HRM into a strategic partner, which means that HRM involved in strategic decision making. But the influence of SHRM to organizational performance has not been conclusive, some studies found a direct influence while others doubted the direct influence. This paper describes the influence of SHRM to organizational performance mediated by OCB and moderated by psychological contracts in the relationship between organizations and employees.",40840,,pub,,"[{'main': '2015_Prosiding Nasional madic-Unes.pdf', 'docid': 162229, 'files': [{'objectid': 162229, 'uri': 'http://repository.lppm.unila.ac.id/id/file/454237', 'fileid': 454237, 'mime_type': 'application/pdf', 'hash_type': 'MD5', 'mtime': '2022-03-30 22:47:46', 'filename': '2015_Prosiding Nasional madic-Unes.pdf', 'hash': 'f77f42e1df0d05515b092938947d0a42', 'datasetid': 'document', 'filesize': 287702}], 'format': 'text', 'pos': 1, 'rev_number': 1, 'uri': 'http://repository.lppm.unila.ac.id/id/document/162229', 'eprintid': 40840, 'security': 'public', 'placement': 1, 'language': 'en', 'mime_type': 'application/pdf'}]",public,http://repository.lppm.unila.ac.id/id/eprint/40840,TRUE,108,2022-03-31 02:39:08,2022-03-31 02:39:08,,"[{'id': 'umi_asra@yahoo.co.id', 'name': {'lineage': None, 'honourific': None, 'family': 'Hayati', 'given': 'Keumala'}}, {'id': 'igoc4n@gmail.com', 'name': {'given': 'Indra', 'lineage': None, 'honourific': None, 'family': 'Caniago'}}]",2015-09-07 00:00:00.000000000,disk0/00/04/08/40,,conference_item,,['FEB6'],,,,,,http://journal.unnes.ac.id/nju/index.php/jdm/article/view/4753,,,,,conference,Semarang,Management Dynamic Conference,paper,,
10,"APAKAH KINERJA BANK DIPENGARUHI OLEH PEMILIHAN 
KEPALA DAERAH?.(STUDI KASUS PADA PT. BANK LAMPUNG)",7,show,archive,2017-06-02 12:20:14,['HG'],"Tujuan penelitian ini adalah untuk menguji pengaruh mekanisme pemilihan kepala daerah/gubernur terhadap prilaku pemberian pinjaman yang dilakukan oleh Bank BPD Lampung dan mengkonfirmasi secara empiris adanya ambiguitas pengaruh demokratisasi terhadap kinerja organisasi ekonomi yang dikuasai oleh pemerintah. Hasil penelitian menunjukan bahwa momentum pemilihan gubernur secara langsung tidak memberikan signifikansi terhadap pola pembiayaan yang dilakukan oleh Bank Lampung, baik secara parsial atau pun simultan. Setelah dilakukannya pemilihan gubernur secara langsung, variabel ini hanya memberikan penguatan pada konstanta model yang dipergunakan, yang menunjukan aktif atau pasifnya manajer dalam mengelola Bank Lampung. Dengan tidak signifikannya variabel pemilihan gubernur secara langsung menunjukan manajemen bank masih menjaga jarak dengan hal-hal yang tidak terkait dengan bisnis inti bank. Prinsip-prinsip manajemen ini perlu terus dipertahankan dimana bank tidak ikut terlibat dalam aktivitas-aktivitas politik yang terjadi di daerah, walaupun kepemilikan bank mayoritas dikuasai oleh pemerintah daerah yang ada.",2862,published,pub,Jurusan Manajemen FEB Unila,"[{'rev_number': 1, 'uri': 'http://repository.lppm.unila.ac.id/id/document/2735', 'pos': 1, 'format': 'text', 'files': [{'mime_type': 'application/pdf', 'fileid': 19669, 'filename': 'Muslimin+JBM_Vol_11_No_3.pdf', 'hash': '46ce80137aa96b16ffcfbd8f88355d00', 'hash_type': 'MD5', 'mtime': '2017-06-01 14:26:50', 'datasetid': 'document', 'filesize': 6301417, 'objectid': 2735, 'uri': 'http://repository.lppm.unila.ac.id/id/file/19669'}], 'docid': 2735, 'main': 'Muslimin+JBM_Vol_11_No_3.pdf', 'mime_type': 'application/pdf', 'language': 'en', 'placement': 1, 'security': 'public', 'eprintid': 2862}]",public,http://repository.lppm.unila.ac.id/id/eprint/2862,FALSE,111,2017-06-02 12:20:14,2017-06-02 12:20:14,220-228,"[{'id': 'muslimin.1975@feb.unila.ac.id', 'name': {'family': 'Muslimin', 'honourific': None, 'lineage': None, 'given': 'Muslimin'}}]",2015-09-01 00:00:00.000000000,disk0/00/00/28/62,,article,,['FEB6'],3.0,,ISSN 1412- 9366,JURNAL BISNIS DAN MANAJEMEN,11.0,,,,,,,,,,muslimin.1975@feb.unila.ac.id,
11,PEMASARAN INTERNASIONAL,7,show,archive,2019-05-09 03:12:49,['AC'],,12009,published,pub,Penerbit Aura,"[{'rev_number': 1, 'uri': 'http://repository.lppm.unila.ac.id/id/document/24995', 'pos': 1, 'format': 'text', 'files': [{'uri': 'http://repository.lppm.unila.ac.id/id/file/107572', 'objectid': 24995, 'filesize': 329636, 'datasetid': 'document', 'hash_type': 'MD5', 'mtime': '2019-05-08 04:10:17', 'hash': '5c8f552423213b66aab772494ae33ef9', 'filename': 'PEMASARAN INTERNASIONAL.pdf', 'fileid': 107572, 'mime_type': 'application/pdf'}], 'docid': 24995, 'main': 'PEMASARAN INTERNASIONAL.pdf', 'mime_type': 'application/pdf', 'language': 'en', 'placement': 1, 'security': 'public', 'eprintid': 12009}]",public,http://repository.lppm.unila.ac.id/id/eprint/12009,TRUE,253,2019-05-09 03:12:49,2019-05-09 03:12:49,,"[{'name': {'family': 'Pandjaitan', 'honourific': None, 'lineage': None, 'given': 'Dorothy Rouly H.'}, 'id': 'dorothy_rouly@yahoo.com'}]",2015-11-01 00:00:00.000000000,disk0/00/01/20/09,101.0,book,,['FEB6'],,,,,,,,,,Bandar Lampung,,,,,,978-602-0878-38-6
12,Pengaruh Konflik Peran dan Stress Kerja Pada Kinerja Karyawan Wanita,7,show,archive,2022-03-30 07:43:19,['H1'],,40641,published,pub,Jurnal Bisnis Dan Manajemen,"[{'rev_number': 1, 'uri': 'http://repository.lppm.unila.ac.id/id/document/162008', 'format': 'text', 'pos': 1, 'files': [{'uri': 'http://repository.lppm.unila.ac.id/id/file/452523', 'objectid': 162008, 'filesize': 9546291, 'datasetid': 'document', 'hash': '93da8dd1f047815d11888c1def8baa0f', 'filename': '20 Similarity_Pengaruh Motivasi Kerja.pdf', 'hash_type': 'MD5', 'mtime': '2022-03-29 03:05:38', 'mime_type': 'application/pdf', 'fileid': 452523}], 'main': '20 Similarity_Pengaruh Motivasi Kerja.pdf', 'docid': 162008, 'language': 'en', 'mime_type': 'application/pdf', 'security': 'public', 'placement': 1, 'eprintid': 40641}]",public,http://repository.lppm.unila.ac.id/id/eprint/40641,,404,2022-03-30 07:43:19,2022-03-30 07:43:19,,"[{'name': {'family': 'Rusdi', 'honourific': None, 'lineage': None, 'given': 'Rosnelly'}}, {'name': {'given': 'Ribhan', 'lineage': None, 'honourific': None, 'family': 'Ribhan'}}]",1970-01-01 00:00:00.000002015,disk0/00/04/06/41,,other,,['FEB6'],,,,,,http://jurnal.feb.unila.ac.id/index.php/jbm/search/search,,ISSN 1411 - 9366 Volume 11 Januari 2015,,,,,,,,
13,"Form Penilaian reviewer, Intelectual Capital, corporate value dan kinerja keuangan perbankan di BEI 2008-2012",7,show,archive,2020-11-22 11:50:17,['HG'],"Form Penilaian reviewer,
The purpose of this study is to find out the impact of intellectual capital on the financial performance of the company and the value of hanking companies listed at the Indonesia Stock Exchange. The population of this study is 33 banks listed at the Indonesia Stock Exchange during the period between 2008 and 2012. Based on the sampling criteria, 23 banks were selected for this study. The model used in this study is the path models with Intellectual capital dimensions as the independent variable, and financial performance (ROA) as the intervening variable that mediates intellectual capital on the firm value. The study indicated that intellectual capital affected the financial performance by 78.5 %, while the collective intellectual capital and financial performance affected the firm value by 16.3 %. These results suggest that intellectual capital contributed more to the financial performance compared to the firm value. This happened because the Indonesian capital market's investors, are still oriented towards tangible asset valuation compared to the intangible assets as the intellectual capital/ knowledge assets. Intellectual capital with financial performance as an intervening variable is able to contribute to the increase in the firm's value. In other words, the market gives a higher value to companies that have higher financial performance that are able to manage the intellectual resources effectively and efficiently.",26584,published,pub,MM- UNIKA ATMA JAYA JAKARTA,"[{'files': [{'uri': 'http://repository.lppm.unila.ac.id/id/file/238992', 'objectid': 40481, 'filename': '9. Reviewer Intelectual cipital, corporate value dan kinerja keu.pdf', 'hash': 'e03654b723adaea6ed3e2ecb3c5aa93a', 'mtime': '2020-11-22 05:28:16', 'hash_type': 'MD5', 'mime_type': 'application/pdf', 'fileid': 238992, 'filesize': 482805, 'datasetid': 'document'}], 'main': '9. Reviewer Intelectual cipital, corporate value dan kinerja keu.pdf', 'docid': 40481, 'uri': 'http://repository.lppm.unila.ac.id/id/document/40481', 'rev_number': 1, 'pos': 1, 'format': 'text', 'placement': 1, 'security': 'public', 'eprintid': 26584, 'language': 'en', 'mime_type': 'application/pdf'}]",public,http://repository.lppm.unila.ac.id/id/eprint/26584,,1031,2020-11-22 11:50:17,2020-11-22 11:50:17,,"[{'name': {'given': 'Sandy', 'lineage': None, 'family': 'Simorangkir', 'honourific': None}, 'id': None}, {'id': 'sri.hasnawati@feb.unila.ac.id', 'name': {'family': 'Hasnawati', 'honourific': None, 'lineage': None, 'given': 'Sri'}}]",2015-05-01 00:00:00.000000000,disk0/00/02/65/84,,other,,['FEB6'],,['Uniersitas Lampung'],,,,http://adl.aptik.or.id/default.aspx?tabID=61&src=a&id=169205,"[{'name': {'honourific': None, 'family': 'Simorangkir', 'lineage': None, 'given': 'Sandy'}}, {'name': {'family': 'Hasnawati', 'honourific': None, 'lineage': None, 'given': 'Sri'}}]",,[{'url': 'http://repository.lppm.unila.ac.id/id/eprint/21356'}],Jakarta -Indonesia,,,,,,
14,"“Pengaruh Daya Tarik Iklan, Kompetensi Tenaga Penjual, dan Persepsi
Kualitas Layanan e-Banking terhadapMinat Penggunaan Jasa Layanan
e-Banking BNI
(Studi Kasus pada BNI Kantor Layanan Unila)”",6,show,archive,2017-05-29 06:30:52,['AC'],"ABSTRAK
Tujuan penelitian ini adalah untuk mengetahui p engaruh d aya tarik iklan, kompentensi tenaga
penjual dan persepsi kualitas layanan e-banking terhadap minat penggunaan e-banking Bank BNI.
Penelitian ini merupakan p enelitian kuantitatif dengan teknik survei yang melibatkan 95 orang
nasabah Tabungan Plus Bank BNI Kantor Layanan Universitas Lampung. Pengumpulan data
menggunakan kuesioner, yang kemudian dianalisis menggunakan analisis regresi linier
berganda.
Hasil penelitian: (1) Daya tarik iklan, kompetensi tenaga penjual, dan kualitas layanan e-banking
secara bersama-sama berpengaruh terhadap minat penggunaan jasa layanan e-banking Bank BNI,
sebesar 47,5 %, masing-masing variabel bebas menyumbangkan pengaruh 19,51 %, 14,61 %, dan
13,38 %.; (2) Secara parsial daya tarik iklan berpengaruh positif sebesar 18,8 %, kompetensi
tenaga penjual berpengaruh positif sebesar 16,5 %, dan kualitas layanan e-banking berpengaruh
positif secara parsial terhadap minat penggunaan jasa layanan e-banking Bank BNI, sebesar 20,8
%.
Artinya, kompetensi tenaga penjual jasa layanan e-banking Bank BNI sudah baik tetapi ternyata
tidak cukup untuk meningkatkan minat nasabah untuk menggunakan jasa layanan e-banking.
Hal ini berarti kompetensi tenaga penjual bukan merupakan faktor dominan bagi nasabah untuk
melakukan keputusan pembelian. Tenaga penjual menjadi salah satu sumber informasi
nasabah untuk menjadi bahan pertimbangan dalam melakukan pembelian. Minat nasabah
meningkat secara signifikan dengan semakin meningkatnya kompetensi tenaga penjual. Tetapi
yang perlu disadari bahwa peningkatan minat tersebut belum pada akhirnya adalah keputusan
untuk melakukan pembelian. Demikian pula halnya pada kualitas layanan e-banking",1822,published,pub,,"[{'mime_type': 'application/pdf', 'language': 'en', 'eprintid': 1822, 'security': 'public', 'placement': 1, 'format': 'text', 'pos': 1, 'uri': 'http://repository.lppm.unila.ac.id/id/document/1675', 'rev_number': 1, 'main': 'JBM-Volume-11-No-1-Januari-2015.pdf', 'docid': 1675, 'files': [{'fileid': 12714, 'mime_type': 'application/pdf', 'hash_type': 'MD5', 'mtime': '2017-05-29 05:57:47', 'filename': 'JBM-Volume-11-No-1-Januari-2015.pdf', 'hash': 'e0d3fefdc95794cd1761ea9bee9701d3', 'datasetid': 'document', 'filesize': 1858811, 'objectid': 1675, 'uri': 'http://repository.lppm.unila.ac.id/id/file/12714'}]}]",public,http://repository.lppm.unila.ac.id/id/eprint/1822,TRUE,253,2017-05-29 06:30:52,2017-05-29 06:30:52,70-88,"[{'id': None, 'name': {'given': 'Driya', 'honourific': None, 'family': 'Wiryawan', 'lineage': None}}, {'id': 'dorothy_rouly@yahoo.com', 'name': {'lineage': None, 'family': 'Pandjaitan', 'honourific': None, 'given': 'Dorothy Rouly H.'}}]",2015-01-01 00:00:00.000000000,disk0/00/00/18/22,,article,,['FEB6'],1.0,,ISSN 1411 - 9366,Jurnal Bisnis dan Manajemen (JBM),11.0,http://manajemen.feb.unila.ac.id/publikasi/jbmanajemen/,,,,,,,,,,
15,"ANALISIS ANOMALI FRIDAY EFECT PADA PERUSAHAAN-PERUSAHAAN
YANG TERDAFTAR DI BEI",10,show,archive,2016-11-21 07:23:48,"['H1', 'HC']","ABSTRAK
Penelitian ini dilakukan dengan tujuan untuk mengetahui apakah terdapat pengaruh hari perdagangan terhadap return IHSG di Bursa Efek Indonesia serta untuk mengetahui terjadi atau tidaknya Friday Effect di BEI. Friday Effect merupakan suatu efek dimana return hari perdagangan Jumat adalah positif dan tertinggi dibandingkan return hari-hari perdagangan lainnya. Penelitian ini menggunakan data return IHSG selama 5 tahun, yakni dari Juli 2008 sampai dengan Juni 2013. Sementara teknik analisis data menggunakan analisis regresi linier ganda dengan uji-F dan uji-t. Pada
penelitian ini ditemukan bahwa return hari Jumat rata-rata tertinggi dan positif dibandingkan hari-hari lainnya, sehingga dapat disimpulkan bahwa terjadi Friday Effect pada BEI.
Kata kunci : Return, IHSG, dan Friday Effect",1232,published,pub,Jurusan Manajemen Fakultas Ekonomi dan Bisnis Universitas Lampung,"[{'files': [{'objectid': 1109, 'uri': 'http://repository.lppm.unila.ac.id/id/file/8235', 'datasetid': 'document', 'filesize': 1701728, 'mime_type': 'application/pdf', 'fileid': 8235, 'hash': '805ebe86524cd8542e10575571771434', 'filename': 'JBM Volume 11 No. 1 Januari 2015.pdf', 'hash_type': 'MD5', 'mtime': '2016-11-21 05:53:30'}], 'docid': 1109, 'main': 'JBM Volume 11 No. 1 Januari 2015.pdf', 'uri': 'http://repository.lppm.unila.ac.id/id/document/1109', 'rev_number': 1, 'pos': 1, 'format': 'text', 'placement': 1, 'security': 'public', 'eprintid': 1232, 'mime_type': 'application/pdf', 'language': 'en'}]",public,http://repository.lppm.unila.ac.id/id/eprint/1232,TRUE,388,2016-11-21 07:35:36,2016-11-21 07:23:48,29-43,"[{'name': {'lineage': None, 'honourific': None, 'family': 'Wiweko', 'given': 'Hidayah'}, 'id': 'hidayatwiweko@yahoo.com'}]",2015-01-01 00:00:00.000000000,disk0/00/00/12/32,,article,,['FEB6'],1.0,['Universitas Lampung'],1411-9366,Jurnal Bisnis dan Manajemen,11.0,http://manajemen.feb.unila.ac.id,,,,,,,,,,
16,"PENILAIAN KINERJA KEUANGAN PERUSAHAAN DENGAN METODE
RASIO KEUANGAN, ECONOMIC VALUE ADDED (EVA)
DAN MARKET VALUE ADDED (MVA)",6,show,archive,2016-11-21 07:23:50,['H1'],"Abstrak
Dalam penilaian kinerja keuangan perusahaan, analisis rasio keuangan merupakan metode analisis keuangan yang paling banyak digunakan di Indonesia. Untuk melengkapi analisis rasio keuangan kemudian berkembang metode analisis modifikasi baru, dimana metode ini dalam mengukur kinerja dapat secara tepat memperhatikan sepenuhnya kepentingan dan harapan penyedia dana (kreditur dan pemegang saham). Metode yang dimaksud adalah model Economic Value Added atau EVA (konsep penilaian kinerja) yang di Indonesia lebih dikenal dengan nama konsep Nilai Tambah Ekonomis. Metode yang kedua
yaitu MVA ( Market Value Added ) yang mempunyai tekanan yang sama dengan EVA yaitu pada kesejahteraan penyandang dana perusahaan. Dalam pengukuran kinerja berbasis Economic Value Added (EVA), dapat kita lihat bahwa perusahaan INAF, KAEF, KLBF, PYFA, SQBB, dan TSPC konsisten menghasilkan
nilai EVA yang positif, artinya perusahaan terus mampu menjaga peningkatan nilai tambah ekonomisnya yang positif. Sedangkan perusahaan DVLA, MERK, dan SCPI nilainya
bervariasi, dimana untuk DVLA, tahun 2010 sampai tahun 2013 menghasilkan nilai EVA yang negative, sedangkan perusahaan MERK hanya tahun 2010 menghasilkan nilai EVA yang negative, dan perusahaan SCPI, tahun 2009, 2010, dan tahun 2013 menghasilkan nilai EVA yang negative. Pengukuran kinerja berbasis Market Value Added, nilai MVA untuk semua
perusahaan sub sector Farmasi juga bervariasi antar perusahaan dan juga bervariasi antar tahunnya. Untuk DVLA, tahun 2012 menghasilkan nilai MVA yang negatif dan tahun
lainnya mampu mneghasilkan nilai MVA yang positif. INAF tahun 2009 dan tahun 2010 menghasilkan nilai MVA yang negatif, sedangkan tahun selanjutnya mampu menghasilkan nilai MVA yang positif. Sedangkan perusahaan KAEF, KLBF, MERK, PYFA, SQBB, dan TSPC konsisten menghasilkan nilai MVA yang positif dari tahun 2009 sampai dengan tahun 2013. Perusahaan SCPI, tahun 2009, 2012, dan 2013 menghasilkan nilai MVA yang negatif sedangkan tahun 2010 dan tahun 2011, mampu menghasilkan nilai MVA yang positif. Kata kunci : Kinerja Keuangan, Economic Value Added (EVA), Market Value Added MVA).",1233,published,pub,Jurusan Manajemen Fakultas Ekonomi dan Bisnis Universitas Lampung,"[{'mime_type': 'application/pdf', 'language': 'en', 'placement': 1, 'security': 'public', 'eprintid': 1233, 'rev_number': 1, 'uri': 'http://repository.lppm.unila.ac.id/id/document/1110', 'pos': 1, 'format': 'text', 'files': [{'uri': 'http://repository.lppm.unila.ac.id/id/file/8244', 'objectid': 1110, 'filename': 'JBM Volume 11 No. 2 Mei 2015.pdf', 'hash': '513873c028cb2569747753c86fa71ed0', 'mtime': '2016-11-21 06:16:23', 'hash_type': 'MD5', 'mime_type': 'application/pdf', 'fileid': 8244, 'filesize': 317741, 'datasetid': 'document'}], 'docid': 1110, 'main': 'JBM Volume 11 No. 2 Mei 2015.pdf'}]",public,http://repository.lppm.unila.ac.id/id/eprint/1233,TRUE,388,2016-11-21 07:23:50,2016-11-21 07:23:50,86-100,"[{'id': 'hidayatwiweko@yahoo.com', 'name': {'given': 'Hidayah', 'lineage': None, 'family': 'Wiweko', 'honourific': None}}]",2015-05-01 00:00:00.000000000,disk0/00/00/12/33,,article,,['FEB6'],2.0,['Universitas Lampung'],1441-9366,Jurnal Bisnis dan Manajemen,11.0,http://manajemen.feb.unila.ac.id,,,,,,,,,,
17,"PENGARUHANTARA TIGAMODELKOMPONENKOMITMEN TERHADAP STRES
KERJA  DAN JENJANG KARIR PADA PEGAWAI DI UNIVERSITAS LAMPUNG",5,show,archive,2017-11-16 04:49:06,['H1'],"This study was conducted on 100 respondents civil servants working at the University of Lampung.
Researchers focused on the influence of the three component model ofcommitment, work stress and
careerpath.
The purpose of this study was to determine the type of commitment that affect the stress of work and
career. Respondents described their perception of commitment, work stress and career sthrough a
questionnaire. The questionnaire used using Likert scale.
The regression results indicate that affective commitment is not significant to Stress and Career.
Commitment kontinuans also not significant, but significant work stress on the career ladder.
Mean while, the normative commitmen thas apositive influence on job stress and career.
Keywords: Commitment,JobStress, Career",5460,,pub,Jurusan Manajemen Fakultas Ekonomi dan Bisnis Universitas Lampung,,none,http://repository.lppm.unila.ac.id/id/eprint/5460,TRUE,640,2017-11-16 04:49:06,2017-11-16 04:49:06,173-246,"[{'name': {'honourific': None, 'family': 'Yuningsih', 'lineage': None, 'given': 'Y'}}]",2015-09-01 00:00:00.000000000,disk0/00/00/54/60,,article,,['FEB6'],3.0,['Universitas Lampung'],1411-9366,Jurnal Bisnis dan Manajemen,11.0,http://manajemen.feb.unila.ac.id/publikasi/jbmanajemen/,,,,,,,,,,
