,title,rev_number,metadata_visibility,eprint_status,status_changed,subjects,abstract,eprintid,date_type,ispublished,publisher,documents,full_text_status,uri,refereed,userid,lastmod,datestamp,pagerange,creators,date,dir,pages,type,book_title,divisions,number,corp_creators,issn,publication,volume,official_url,contributors,id_number,related_url,place_of_pub,event_type,event_location,event_title,pres_type,contact_email,isbn
0,"MANAJEMEN PEMASARAN USAHA KECIL 
Kasus Industri Pengolahan Makanan dan Ritel",8,show,archive,2018-04-25 04:20:54,['H1'],"Buku ini ditulis berdasarkan hasil penelitian penulis serta pengalaman praktis ketika mengajar
mahasiswa, sebagai pemateri seminar, pelatihan dan workshop. 

Guna memenuhi kebutuhan dan
keinginan berbagai pihak maka sistematika penyusunan revisi buku ini disusun sedemikian rupa
dengan dilengkapi kasus manajemen usaha kecil sehingga mudah dimengerti oleh para pembaca.

Dalam tulisan ini, penulis mencoba berbagi pengetahuan dan pengalaman dalam penelitian
dan pengajaran. Tulisan ini disajikan terutama untuk menjadi referensi bagi peneliti, mahasiswa
dan praktisi bisnis usaha kecil yang ingin mengetahui lebih jauh tentang Manajemen Pemasaran
Usaha Kecil.

Keterbatasan pengetahuan dan pengalaman penulis mungkin menjadikan tulisan ini memiliki
kelemahan. Penulis tidak menutup pintu masukan dan saran yang bersifat membangun. Harapan
penulis, masukan dan saran tersebut dapat memacu kita untuk lebih berkembang dan saling
meningkatkan pengetahuan kita bersama dalam penelitian, khususnya penelitian dalam ilmu
manajemen pemasaran.

Akhir kata, penulis berharap semoga buku ini dapat membantu siapa saja yang akan belajar
dan sedang mengadakan penelitian dalam bidang ilmu manajemen pemasaran.",6487,published,pub,Graha Ilmu,"[{'pos': 1, 'format': 'text', 'uri': 'http://repository.lppm.unila.ac.id/id/document/19431', 'rev_number': 1, 'docid': 19431, 'main': 'PEMASARAN USAHA KECIL-haki.pdf', 'files': [{'uri': 'http://repository.lppm.unila.ac.id/id/file/60077', 'objectid': 19431, 'filesize': 9281115, 'datasetid': 'document', 'mtime': '2018-02-15 06:41:25', 'hash_type': 'MD5', 'hash': '65e1cd7b9eb9ad710808f51c832bdbb1', 'filename': 'PEMASARAN USAHA KECIL-haki.pdf', 'fileid': 60077, 'mime_type': 'application/pdf'}], 'mime_type': 'application/pdf', 'language': 'en', 'eprintid': 6487, 'placement': 1, 'security': 'public'}]",public,http://repository.lppm.unila.ac.id/id/eprint/6487,TRUE,993,2018-04-25 04:20:54,2018-04-25 04:20:54,v-107,"[{'id': 'satriabangsawan1961@gmail.com', 'name': {'lineage': None, 'honourific': None, 'family': 'Bangsawan', 'given': 'Satria'}}]",1970-01-01 00:00:00.000002015,disk0/00/00/64/87,107.0,book_section,MANAJEMEN PEMASARAN USAHA KECIL  Kasus Industri Pengolahan Makanan dan Ritel,['FEB6'],,,,,,,,,,,,,,,,
1,PENGARUH KUALITAS LAYANAN ELEKTRONIK SIAKAD ONLINE TERHADAP KEPUASAN MAHASISWA DI FAKULTAS EKONOMI DAN BISNIS UNIVERSITAS LAMPUNG,9,show,archive,2017-11-16 03:23:00,"['AS', 'H1', 'HN']","Sistem Layanan Elektronik atau Electronic Services yang disingkat E-Services merupakan suatu aplikasi yang memanfaatkan Teknologi Informasi dan Komunikasi. Layanan elektronik merupakan layanan melalui internet yang mengacu kepada perdagangan melalui internet, dukungan pelanggan, termasuk layanan non-komersial yang biasanya disediakan oleh lembaga pemerintah. Industri perbankan dengan e-banking, industri penerbangan dengan e-ticketing, pemerintah dengan e-government dan industri pendidikan dengan e-learningnya.
Salah satu layanan elektronik yang disuguhkan oleh Perguruan Tinggi adalah SIAKAD Online, merupakan Sistem Informasi Akademik yang dibangun untuk memberikan kemudahan kepada sivitas akademika dalam kegiatan administrasi akademik kampus secara online. Siakad Online menggunakan sistem basis data terpusat     mengelola seluruh data secara terintegrasi sehingga data akan selalu up-to-date, realtime dan selalu siap untuk digunakan, serta mengurangi kemungkinan duplikasi data karena Siakad Online. Dengan menggunakan Siakad Online, maka kualitas pelayanan akademik yang diterima mahasiswa akan meningkat, terutama dalam hal keakuratan informasi, transfer informasi, efisiensi dan ketepatan waktu.
Tujuan penelitian ini adalah untuk mengetahui pengaruh kualitas layanan elektronik Siakad Online terhadap kepuasan mahasiswa di Fakultas Ekonomi dan Bisnis Universitas Lampung. Hipotesis pada penelitian ini adalah 1) Kualitas layanan elektronik Siakad Online Universitas Lampung berpengaruh positif dan signifikan terhadap kepuasan mahasiswa Fakultas Ekonomi dan Bisnis Universitas Lampung, 2) Kualitas layanan purna elektronik Siakad Online Universitas Lampung berpengaruh positif dan signifikan terhadap kepuasan mahasiswa Fakultas Ekonomi dan Bisnis.
Populasi penelitian ini adalah mahasiswa Fakultas Ekonomi dan Bisnis Universitas Lampung, dengan sampel sebanyak 100 responden, melalui metode non probability sampling dengan teknik random sampling. Analisis dilakukan  secara kualitatif menggunakan regregresi berganda dan analisis data secara kuantitatif dilakukan dengan menggunakan uji beda (uji t).
Hasil analisis data menunjukkan bahwa hipotesi yang menyatakan kualitas interaksi layanan elektronik (e-core service quality) Siakad Online Universitas Lampung berpengaruh positif dan signifikan terhadap kepuasan mahasiswa Fakultas Ekonomi dan Bisnis (β 0,480; t 5.640;  sig  0,00). Selanjutnya hipotesis yang menyatakan bahwa kualitas layanan purna elektronik (e-recovery service quality) Siakad Online Universitas Lampung berpengaruh positif dan signifikan terhadap kepuasan mahasiswa Fakultas Ekonomi dan Bisnis terjawab dan dapat didukung oleh hasil penelitian ini (β 0,346; t 4,066;  sig  0,00).",4728,,pub,Jurusan Manajemen Fakultas Ekonomi dan Bisnis Universitas Lampung,"[{'language': 'en', 'mime_type': 'application/pdf', 'eprintid': 4728, 'placement': 1, 'security': 'public', 'pos': 1, 'format': 'text', 'rev_number': 1, 'uri': 'http://repository.lppm.unila.ac.id/id/document/17636', 'main': 'PUBLIKASI JURNAL-JBM-SEPTEMBER-2015.pdf', 'docid': 17636, 'files': [{'objectid': 17636, 'uri': 'http://repository.lppm.unila.ac.id/id/file/46107', 'datasetid': 'document', 'filesize': 8259987, 'fileid': 46107, 'mime_type': 'application/pdf', 'hash_type': 'MD5', 'mtime': '2017-11-06 06:11:24', 'hash': '60b552d2408034fa0055fa639cbef816', 'filename': 'PUBLIKASI JURNAL-JBM-SEPTEMBER-2015.pdf'}]}]",public,http://repository.lppm.unila.ac.id/id/eprint/4728,TRUE,174,2017-11-16 03:23:00,2017-11-16 03:23:00,174-246,"[{'name': {'given': 'Yuniarti', 'family': 'Fihartini', 'honourific': None, 'lineage': None}, 'id': 'yuniarti.fihartini@feb.unila.ac.id'}]",2015-09-01 00:00:00.000000000,disk0/00/00/47/28,,article,,['FEB6'],3.0,['Universitas Lampung'],1411-9366,Jurnal Bisnis dan Manajemen,11.0,,,,,,,,,,,
2,"PENGARUH PROMOSI DAN ELECTRONIC WORD-OF-MOUTH 
DI MEDIA SOSIAL TERHADAP KEPUTUSAN PEMBELIAN KONSUMEN
DI BANDAR LAMPUNG",9,show,archive,2017-11-16 03:22:54,"['AS', 'H1', 'HM', 'HN']","Media sosial menjadi sarana komunikasi penting yang digunakan orang untuk terhubung dengan orang atau organisasi lain. Orang-orang menggunakan media sosial untuk berbagi pengalaman mereka, ulasan (review), informasi, saran, peringatan, tips mengenai masalah apapun yang menarik untuk orang-orang yang terhubung dengan mereka. Informasi tersebut merupakan sumber yang membantu, yang dapat mempengaruhi pengambilan keputusan konsumen. 
Melalui hubungan personal (personal relevance),interaksi secara online (online interactivity), pesan yang diterima (message), serta kedekatan terhadap merek (brand familiarity), konsumen akan memiliki persepsi dan penilaiannya terhadap suatu produk atau merek atas kegiatan promosi yang dilakukan produk atau merek tersebut secara online pada media sosial. Serta dengan memperhatikan konsumen lain (Concern for Others consumer), memperhatikan kesan-kesan positif (Expressing positive feelings), keluhan-keluhan dan kekecewaan (Venting negative Feelings), manfaat yang diberikan (Social benefits), loyalitas konsumen lain terhadap suatu merek (Helping the company), dan referensi-referensi (Advice seeking) konsumen akan memiliki penilaian serta dapat mengevaluasi suatu produk atau merek melalui eWOM yang diterimanya secara online melalui situs sosial media, dan hal ini akan mempengaruhi konsumen dalam proses pengambilan keputusan pembelian suatu produk atau jasa.   
Tujuan dari penelitian ini adalah untuk mengetahui pengaruh promosi dan electronic word of mouth di media sosial terhadap keputusan pembelian konsumen di Bandar Lampung. Hipotesis pada penelitian ini adalah 1) Promosi di Media sosial berpengaruh terhadap Electronic Word of Mouth (E-WoM) konsumen di Bandar Lampung, 2) Promosi dan Electronic Word of Mouth (E-WoM)) di Media sosial berpengaruh terhadap keputusan pembelian konsumen di Bandar Lampung
Populasi penelitian ini adalah mahasiswa di Bandar Lampung, dengan sampel sebanyak 100 responden, melalui metode non probability sampling dengan teknik random sampling. Analisis dilakukan  secara kualitatif menggunakan regregresi berganda dan analisis data secara kuantitatif dilakukan dengan menggunakan uji beda (uji t).
Hasil analisis data menunjukkan bahwa hipotesi yang menyatakan promosi berpengaruh positif dan signifikan terhadap electronic word of mouth di situs media social didukung oleh hasil penelitian ini, dengan R2 sebesar 0.295, koefisien sebesar 0.544, dan nilai signifikansi sebesar 0.000 Sebaliknya hipotesis yang menyatakan bahwa promosi dan electronic word of mouth berpengaruh positif dan signifikan terhadap keputusan pembelian konsumen di Bandar Lampung tidak sepenuhnya di dukung oleh penelitian ini, dimana hanya electronic word of mouth saja yang terbukti berpengaruh positif dan signifikan dengan R2 sebesar 0.149, koefisien sebesar 0.269, dan nilai signifikansi sebesar 0.018. Sementara promosi tidak terbukti berpengaruh terhadap keputusan pembelian konsumen dengan nilai signifikansi melebihi 0.05 yakni 0.137.",4724,published,pub,Jurusan Manajemen Fakultas Ekonomi dan Bisnis Universitas Lampung,"[{'mime_type': 'application/pdf', 'language': 'en', 'security': 'public', 'placement': 1, 'eprintid': 4724, 'uri': 'http://repository.lppm.unila.ac.id/id/document/17632', 'rev_number': 1, 'format': 'text', 'pos': 1, 'files': [{'filesize': 11348429, 'datasetid': 'document', 'filename': 'JURNAL PUBLIKASI-YUNI-JBM-JANUARI-2015.pdf', 'hash': 'df34d74b4b9b95b2dc5556e6470b7a58', 'mtime': '2017-11-06 05:49:34', 'hash_type': 'MD5', 'mime_type': 'application/pdf', 'fileid': 46082, 'uri': 'http://repository.lppm.unila.ac.id/id/file/46082', 'objectid': 17632}], 'main': 'JURNAL PUBLIKASI-YUNI-JBM-JANUARI-2015.pdf', 'docid': 17632}]",public,http://repository.lppm.unila.ac.id/id/eprint/4724,TRUE,174,2017-11-16 03:22:54,2017-11-16 03:22:54,1-15,"[{'id': 'yuniarti.fihartini@feb.unila.ac.id', 'name': {'given': 'Yuniarti', 'lineage': None, 'family': 'Fihartini', 'honourific': None}}]",2015-01-02 00:00:00.000000000,disk0/00/00/47/24,,article,,['FEB6'],1.0,['Universitas Lampung'],1411-9366,Jurnal Bisnis dan Manajemen,11.0,,,,,,,,,,,
3,"INTELLECTUAL CAPITAL,  CORPORATE VALUE DAN KINERJA KEUANGAN PERBANKAN DI BURSA EFEK INDONESIA 2008-2012",7,show,archive,2020-06-01 08:58:30,['HG'],"Tujuan dari penelitian ini adalah ingin mengetahui bagaimana pengaruh intelektual capital terhadap kinerja keuangan perusahaan dan nilai perusahaan  perbankan yang terdaftar di Bursa efek indonesia. Populasi penelitian sebanyak 33 bank yang tercatat di BEI periode 2008-2012. Dengan criteria yang ditentukan diperoleh sampel sebanyak 23 bank yang memenuhi syarat untuk diteliti. Model yang digunakan dalam penelitian ini adalah path model dengan dimensi intellectual capital sebagai variabel bebas, kinerja keuangan (ROA) sebagai variabel intervening yang memediasi  intellectual capital terhadap nilai perusahaan. Hasil penelitian menemukan bahwa  intellectual capital mempengaruhi kinerja keuangan perusahaan sebesar 78,5%, sementara intellectual capital bersama kinerja keuangan mempengaruhi nilai perusahaan sebesar 16,3%.  Hasil ini menyatakan bahwa intellectual capital lebih memiliki kontribusi terhadap peningkatan kinerja keuangan perusahaan dibandingkan pada nilai perusahaan. Hal ini dapat terjadi karena investor di pasar modal Indonesia, masih berorientasi pada penilaian asset tangibel dibandingkan dengan asset intangible seperti intellectual capital /knowledge assets. Intelelectual capital melalui kinerja keuangan sebagai variabel intervening mampu memberi kontribusi dalam peningkatan nilai perusahaan. Dengan kata lain pasar memberi penilaian yang tinggi pada perusahaan yang memiliki financial performance yang tinggi karena kemampuan mengelola sumber daya intellectual secara efektif dan efisisen.",21356,published,pub,Magister Manajemen-UNIKA ATMA JAYA,"[{'files': [{'fileid': 198548, 'mime_type': 'application/pdf', 'hash_type': 'MD5', 'mtime': '2020-06-01 07:01:41', 'hash': 'f803032ff41283a25016baac74dc4bc2', 'filename': 'Intelectual Capital ..... , corporate value dan kinerja keuangan perbankan di BEI 2008-2012pdf.pdf', 'datasetid': 'document', 'filesize': 7327201, 'objectid': 34752, 'uri': 'http://repository.lppm.unila.ac.id/id/file/198548'}], 'docid': 34752, 'main': 'Intelectual Capital ..... , corporate value dan kinerja keuangan perbankan di BEI 2008-2012pdf.pdf', 'rev_number': 1, 'uri': 'http://repository.lppm.unila.ac.id/id/document/34752', 'pos': 1, 'format': 'text', 'placement': 1, 'security': 'public', 'eprintid': 21356, 'mime_type': 'application/pdf', 'language': 'en'}]",public,http://repository.lppm.unila.ac.id/id/eprint/21356,TRUE,1031,2020-06-01 08:58:30,2020-06-01 08:58:30,69-84,"[{'name': {'lineage': None, 'honourific': None, 'family': 'Hasnawati', 'given': 'Sri'}, 'id': 'sri.hasnawati@feb.unila.ac.id'}]",2015-05-01 00:00:00.000000000,disk0/00/02/13/56,,article,,['FEB6'],1.0,['FEB UNIVERSITY OF LAMPUNG'],1907-4913,Telaah Manajemen: Jurnal Riset& Konsep Manajemen,10.0,http://adl.aptik.or.id/default.aspx?tabID=61&src=a&id=169205,"[{'name': {'honourific': None, 'family': 'Hasnawati', 'lineage': None, 'given': 'Sri'}, 'id': 'sri.hasnawati@feb.unila.ac.id'}]",169205,[{'url': 'http://adl.aptik.or.id/default.aspx?tabID=61&src=a&id=169205'}],,,,,,,
4,"INTELLECTUAL CAPITAL, CORPORATE VALUE DAN KINERJA KEUANGAN PERBANKAN DI BURSA EFEK INDONESIA 2008-2012.",7,show,archive,2020-07-24 00:56:36,['HG'],"SIMILARITY CHECK:
Tujuan dari penelitian ini adalah ingin mengetahui bagaimana pengaruh intelektual capital terhadap kinerja keuangan perusahaan dan nilai perusahaan perbankan yang terdaftar di Bursa efek indonesia. Populasi penelitian sebanyak 33 bank yang tercatat di BEI periode 2008-2012. Dengan criteria yang ditentukan diperoleh sampel sebanyak 23 bank yang memenuhi syarat untuk diteliti. Model yang digunakan dalam penelitian ini adalah path model dengan dimensi intellectual capital sebagai variabel bebas, kinerja keuangan (ROA) sebagai variabel intervening yang memediasi intellectual capital terhadap nilai perusahaan. Hasil penelitian menemukan bahwa intellectual capital mempengaruhi kinerja keuangan perusahaan sebesar 78,5%, sementara intellectual capital bersama kinerja keuangan mempengaruhi nilai perusahaan sebesar 16,3%. Hasil ini menyatakan bahwa intellectual capital lebih memiliki kontribusi terhadap peningkatan kinerja keuangan perusahaan dibandingkan pada nilai perusahaan. Hal ini dapat terjadi karena investor di pasar modal Indonesia, masih berorientasi pada penilaian asset tangibel dibandingkan dengan asset intangible seperti intellectual capital /knowledge assets. Intelelectual capital melalui kinerja keuangan sebagai variabel intervening mampu memberi kontribusi dalam peningkatan nilai perusahaan. Dengan kata lain pasar memberi penilaian yang tinggi pada perusahaan yang memiliki financial performance yang tinggi karena kemampuan mengelola sumber daya intellectual secara efektif dan efisisen.",23353,published,pub,Prodi MM Unika Atma Jaya,"[{'eprintid': 23353, 'placement': 1, 'security': 'public', 'language': 'en', 'mime_type': 'application/pdf', 'main': 'Similarity check Intelectual capital, CORPORATE VALUE DAN KINERJA KEUANGAN PERBANKAN DI BURSA EFEK INDONESIA 2008-2012 pdf.pdf', 'docid': 36947, 'files': [{'mime_type': 'application/pdf', 'fileid': 213619, 'hash': '8973842e7f599610c57b760c22aeba0b', 'filename': 'Similarity check Intelectual capital, CORPORATE VALUE DAN KINERJA KEUANGAN PERBANKAN DI BURSA EFEK INDONESIA 2008-2012 pdf.pdf', 'hash_type': 'MD5', 'mtime': '2020-07-23 09:31:00', 'datasetid': 'document', 'filesize': 8201418, 'objectid': 36947, 'uri': 'http://repository.lppm.unila.ac.id/id/file/213619'}], 'pos': 1, 'format': 'text', 'uri': 'http://repository.lppm.unila.ac.id/id/document/36947', 'rev_number': 1}]",public,http://repository.lppm.unila.ac.id/id/eprint/23353,,1031,2020-07-24 00:56:36,2020-07-24 00:56:36,,"[{'name': {'honourific': None, 'family': 'Hasnawati', 'lineage': None, 'given': 'Sri'}, 'id': 'sri.hasnawati@feb.unila.ac.id'}]",1970-01-01 00:00:00.000002015,disk0/00/02/33/53,,other,,['FEB6'],,['Universitas Lampung'],,,,http://adl.aptik.or.id/default.aspx?tabID=61&src=a&id=169205,,,[{'url': 'http://repository.lppm.unila.ac.id/id/eprint/21356'}],Jakarta,,,,,,
5,"KEPUTUSAN KEUANGAN, UKURAN PERUSAHAAN, STRUKTUR KEPEMILIKAN DAN NILAI PERUSAHAAN PUBLIK DI INDONESIA",7,show,archive,2020-07-24 00:56:46,['HG'],"SIMILARITY CHECK:
The objectives was to find empirical evidence of the influence fi­nan­cial d­e­cisions, firm size, and owner­ship structure on firm value in the three economic con­di­tions (before, during, and after the crisis). The model was used mul­tiple reg­ression. The study was con­duc­ted in 1992–2008 with samples of 78 public com­pa­nies and 1084 datas. The results explained that company size and de­cision not to pay dividends were most af­fected varia­bles. In addition, policy not to pay dividends had negative ef­fect on firm value. There were also significant differences of company value. For public companies, company's size should be considered. Po­li­cies of paying cash dividends could be con­sidered in order to increase company value.",23356,published,pub,Universitas Kristen Petra Surabaya,"[{'pos': 1, 'format': 'text', 'uri': 'http://repository.lppm.unila.ac.id/id/document/36950', 'rev_number': 1, 'docid': 36950, 'main': 'Similarity Check Keputusan keuangan, UKURAN PERUSAHAAN, STRUKTUR KEPEMILIKAN DAN NILAI PERUSAHAAN PUBLIK DI INDONESIA pdf.pdf', 'files': [{'uri': 'http://repository.lppm.unila.ac.id/id/file/213642', 'objectid': 36950, 'filesize': 3444237, 'datasetid': 'document', 'filename': 'Similarity Check Keputusan keuangan, UKURAN PERUSAHAAN, STRUKTUR KEPEMILIKAN DAN NILAI PERUSAHAAN PUBLIK DI INDONESIA pdf.pdf', 'hash': '725a47d1f01e9817186634edaf3a085e', 'mtime': '2020-07-23 09:48:34', 'hash_type': 'MD5', 'mime_type': 'application/pdf', 'fileid': 213642}], 'mime_type': 'application/pdf', 'language': 'en', 'eprintid': 23356, 'placement': 1, 'security': 'public'}]",public,http://repository.lppm.unila.ac.id/id/eprint/23356,,1031,2020-07-24 00:56:46,2020-07-24 00:56:46,,"[{'name': {'lineage': None, 'honourific': None, 'family': 'Hasnawati', 'given': 'Sri'}, 'id': 'sri.hasnawati@feb.unila.ac.id'}]",1970-01-01 00:00:00.000002015,disk0/00/02/33/56,,other,,['FEB6'],,['Universitas lampung'],,,,http://jurnalmanajemen.petra.ac.id/,,DOI:10.9744/jmk.17.1.65–75,[{'url': 'http://repository.lppm.unila.ac.id/id/eprint/4599'}],Surabaya,,,,,,
6,"Form Penilaian Reviewer,  Keputusan keuangan, ukuran perusahaan, struktur kepemilikan, dan nilai perusahaan publik di  Indonesia",7,show,archive,2020-11-22 11:50:06,['HG'],"The objectives was to find empirical evidence of the influence fi­nan­cial d­e­cisions, firm size, and owner­ship structure on firm value in the three economic con­di­tions (before, during, and after the crisis). The model was used mul­tiple reg­ression. The study was con­duc­ted in 1992–2008 with samples of 78 public com­pa­nies and 1084 datas. The results explained that company size and de­cision not to pay dividends were most af­fected varia­bles. In addition, policy not to pay dividends had negative ef­fect on firm value. There were also significant differences of company value. For public companies, company's size should be considered. Po­li­cies of paying cash dividends could be con­sidered in order to increase company value.",26574,published,pub,FCULTY OF ECONOMICS department of management university kristen petra,"[{'files': [{'uri': 'http://repository.lppm.unila.ac.id/id/file/238924', 'objectid': 40472, 'hash': '752a72456e1b5c957a0ffc5fa1a5e0c9', 'filename': '7. Reveiwer Keputusan keuangan, ukuran perusahaan, struktur kepemilikan.pdf', 'hash_type': 'MD5', 'mtime': '2020-11-22 02:37:53', 'mime_type': 'application/pdf', 'fileid': 238924, 'filesize': 482357, 'datasetid': 'document'}], 'main': '7. Reveiwer Keputusan keuangan, ukuran perusahaan, struktur kepemilikan.pdf', 'docid': 40472, 'rev_number': 1, 'uri': 'http://repository.lppm.unila.ac.id/id/document/40472', 'pos': 1, 'format': 'text', 'placement': 1, 'security': 'public', 'eprintid': 26574, 'mime_type': 'application/pdf', 'language': 'en'}]",public,http://repository.lppm.unila.ac.id/id/eprint/26574,,1031,2020-11-22 11:50:06,2020-11-22 11:50:06,,"[{'name': {'given': 'Sri', 'lineage': None, 'honourific': None, 'family': 'Hasnawati'}, 'id': 'sri.hasnawati@feb.unila.ac.id'}, {'id': None, 'name': {'honourific': None, 'family': 'Sawir', 'lineage': None, 'given': 'Agnes'}}]",2015-03-01 00:00:00.000000000,disk0/00/02/65/74,,other,,['FEB6'],,['Universitas Lampung'],,,,http://jurnalmanajemen.petra.ac.id/index.php/man/article/view/19231,"[{'name': {'given': 'Sri', 'honourific': None, 'family': 'Hasnawati', 'lineage': None}}, {'name': {'lineage': None, 'family': 'Sawir', 'honourific': None, 'given': 'Agnes'}}]",https://doi.org/10.9744/jmk.17.1.65-75,[{'url': 'http://repository.lppm.unila.ac.id/21356/'}],INDONESIA,,,,,,
7,"KEPUTUSAN KEUANGAN, UKURAN PERUSAHAAN, STRUKTUR KEPEMILIKAN DAN NILAI PERUSAHAAN PUBLIK DI INDONESIA",7,show,archive,2017-11-16 03:16:00,"['H1', 'HG']","The objectives was to find empirical evidence of the influence fi­nan­cial d­e­cisions, firm size, and owner­ship structure on firm value in the three economic con­di­tions (before, during, and after the crisis). The model was used mul­tiple reg­ression. The study was con­duc­ted in 1992–2008 with samples of 78 public com­pa­nies and 1084 datas. The results explained that company size and de­cision not to pay dividends were most af­fected varia­bles. In addition, policy not to pay dividends had negative ef­fect on firm value. There were also significant differences of company value. For public companies, company's size should be considered. Po­li­cies of paying cash dividends could be con­sidered in order to increase company value.",4599,published,pub,"Faculty of Economics, Department of Management - Petra Christian University","[{'eprintid': 4599, 'placement': 1, 'security': 'public', 'language': 'en', 'mime_type': 'application/pdf', 'docid': 17506, 'main': '19231-23245-1-SM.pdf', 'files': [{'fileid': 45229, 'mime_type': 'application/pdf', 'mtime': '2017-11-03 23:24:23', 'hash_type': 'MD5', 'hash': 'ea59a863112ef744797c828c41df178e', 'filename': '19231-23245-1-SM.pdf', 'datasetid': 'document', 'filesize': 421327, 'objectid': 17506, 'uri': 'http://repository.lppm.unila.ac.id/id/file/45229'}], 'pos': 1, 'format': 'text', 'uri': 'http://repository.lppm.unila.ac.id/id/document/17506', 'rev_number': 1}]",public,http://repository.lppm.unila.ac.id/id/eprint/4599,TRUE,1031,2017-11-16 03:16:00,2017-11-16 03:16:00,65-75,"[{'name': {'given': 'Sri', 'lineage': None, 'honourific': None, 'family': 'Hasnawati'}}, {'name': {'given': 'Agnes', 'family': 'Sawir', 'honourific': None, 'lineage': None}}]",1970-01-01 00:00:00.000002015,disk0/00/00/45/99,,article,,['FEB6'],1.0,,1411-1438,Jurnal Manajemen dan Kewirausahaan,17.0,http://jurnalmanajemen.petra.ac.id/,,,[{'url': 'http://jurnalmanajemen.petra.ac.id/index.php/man/issue/view/3204'}],,,,,,,
8,"Hasil Turnitin Prosiding MADIC : ""Strategic Human Resource Management and Firm Performance: The Moderation Pyshicological Contract",8,show,archive,2023-03-21 01:50:39,['HD28'],,49052,,unpub,MADIC,"[{'security': 'validuser', 'placement': 1, 'eprintid': 49052, 'language': 'en', 'mime_type': 'application/pdf', 'files': [{'uri': 'http://repository.lppm.unila.ac.id/id/file/533381', 'objectid': 188500, 'filename': '2015_Turnitin Prosiding madic.pdf', 'hash': '0b9afb957e4e6983e625921c97335484', 'hash_type': 'MD5', 'mtime': '2023-03-20 17:03:48', 'mime_type': 'application/pdf', 'fileid': 533381, 'filesize': 5752343, 'datasetid': 'document'}], 'main': '2015_Turnitin Prosiding madic.pdf', 'docid': 188500, 'formatdesc': 'Turnitin Prosiding MADIC', 'uri': 'http://repository.lppm.unila.ac.id/id/document/188500', 'rev_number': 2, 'format': 'other', 'pos': 1}]",restricted,http://repository.lppm.unila.ac.id/id/eprint/49052,,108,2023-03-21 01:50:39,2023-03-21 01:50:39,,"[{'id': 'umi_asra@yahoo.co.id', 'name': {'family': 'Hayati', 'honourific': None, 'lineage': None, 'given': 'Keumala'}}, {'name': {'lineage': None, 'family': 'Caniago', 'honourific': None, 'given': 'Indra'}, 'id': 'igoc4n@gmail.com'}]",1970-01-01 00:00:00.000002015,disk0_bak/00/04/90/52,,other,,['FEB6'],,,,,,,,,,,,,,,,
