,eprintid,date_type,status_changed,eprint_status,related_url,subjects,abstract,title,official_url,volume,rev_number,metadata_visibility,type,divisions,publication,issn,creators,dir,date,lastmod,userid,datestamp,ispublished,number,documents,publisher,uri,full_text_status,refereed,id_number,place_of_pub,pagerange,monograph_type,department,institution
8,28588,,2021-03-26 06:53:43,archive,,['TJ'],"Sumber daya agrikultur yang besar yang dimiliki Provinsi Lampung, khususnya singkong yang menjadi bahan baku tepung tapioka. Ampas dari produksi tepung tapioka ini disebut onggok. Onggok dapat dimanfaatkan sebagai bahan baku obat nyamuk bakar, pupuk, pembuatan saus, dan campuran kerupuk, serta pakan ternak. Sebagai bentuk pemberdayaan masyarakat, industri-industri tersebut memberikan onggok tersebut secara gratis atau dijual sangat murah dalam kondisi basah. Untuk meningkatkan nilai ekonomi dari onggok, para petani melakukan pengelolahan onggok secara tradisional dengan cara menjemur onggok menggunakan panas matahari di hamparan tanah lapang. Proses pengeringan ini sangat tergantung pada faktor cuaca. Jika hujan, kualitas onggok menjadi menurun dan kadar air menjadi tidak terkontrol serta warnanya menjadi kecokelatan yang menyebabkan harga onggok jatuh. Untuk mendapatkan hasil yang maksimal, sebelum dikeringkan ada baiknya onggok yang memiliki kadar air 81-85% tersebut diturunkan kadar airnya hingga 20-25%. Penurunan kadar air tersebut dapat dilakukan dengan cara penempaan. Proses pengempaan dapat dilakukan dengan berbagai cara yaitu: screw press, injection press dan filter press. Bagaimanapun harga Screw press sangat mahal dan memerlukan daya listrik besar serta perawatan yang mahal. Meskipun menggunakan generator tetap membutuhkan bahan bakar yang akan memberatkan petani. Injection press dan Filter press juga harganya mahal dan memerlukan daya listrik besar serta perawatannya mahal. Salah satu proses penempaan yang ramah lingkungan dan hemat energi serta ekonomis untuk meningkatkan kuantitas dan kualitas hasil pengeringan onggok ini dapat dilakukan dengan menggunakan energi air jatuh yang menekan hammer sehingga dinamakan water hammer press. Keunggulan Water hammer press ini ramah lingkungan, mudah dibuat, peralatannya murah, tidak membutuhkan biaya bahan bakar, serta perawatannya mudah dan murah. Teknologi Water Hammer Press ini mampu mereduksi kadar air onggok hingga onggok berkadar air sebesar 52% dengan kuantitas air umpan sebesar 60 liter dan onggok umpan sebesar 5 Kg serta ketinggian air jatuh umpan yang digunakan pada pengujian water hammer press ini sebesar 3 (tiga) meter. Kata kunci : Onggok singkong, Kadar air, Water Hammer Press",Water Hammer Press Untuk Pengurangan Kadar Air Komoditas Onggok,http://journal.eng.unila.ac.id/index.php/mech/article/view/227,,7,show,other,['FT7'],,,"[{'id': 'yudi_95@yahoo.com', 'name': {'lineage': None, 'honourific': None, 'family': 'Risano', 'given': 'A.Yudi Eka'}}, {'name': {'given': 'Indra Mamad', 'lineage': None, 'family': 'Gandidi', 'honourific': None}, 'id': 'indra.mamad@eng.unila.ac.id'}]",disk0/00/02/85/88,2014-03-01 00:00:00.000000000,2021-03-26 06:53:43,303,2021-03-26 06:53:43,pub,,"[{'rev_number': 1, 'uri': 'http://repository.lppm.unila.ac.id/id/document/42647', 'format': 'text', 'pos': 1, 'files': [{'fileid': 253726, 'mime_type': 'application/pdf', 'hash_type': 'MD5', 'mtime': '2021-03-26 03:45:49', 'hash': '4c9cc7005dca003c8f6435a303120721', 'filename': 'IThenticate_Report_JMechanical_Yudi_2014.pdf', 'datasetid': 'document', 'filesize': 3672484, 'objectid': 42647, 'uri': 'http://repository.lppm.unila.ac.id/id/file/253726'}], 'main': 'IThenticate_Report_JMechanical_Yudi_2014.pdf', 'docid': 42647, 'language': 'en', 'mime_type': 'application/pdf', 'security': 'public', 'placement': 1, 'eprintid': 28588}]",Jurnal Mechanical Jurnal Ilmiah Teknik Mesin,http://repository.lppm.unila.ac.id/id/eprint/28588,public,,"ISSN 2460-1888 Volume 5, Nomor 1, Maret 2014",Jurnal Mechanical,,,,
9,17247,published,2020-01-02 02:16:25,archive,,['TS'],"This work aims to determine the mechanical and biophysical properties of fibrin gel for the purpose of angiogenesis study and microvascular development in a threedimensional (3D) environment. In the human body system, fibrin gel is known to be an extracellular matrix (ECM) that actively promotes homeostasis during blood vessel formation, wound healing and other inflammation processes. In this study, we first test the effect of fibrin and thrombin composition on mechanical and biophysical properties of the gel. Further in vitro experiments using human umbilical vein endothelial cells
(HUVECs) were also conducted to find the optimum fibrinogen/thrombin concentration for the angiogenesis assay using a sandwich fibrin gel system. A fibrinogen/thrombin concentration of 2.0/1.0 results in optimum gel properties for three dimensional angiogenesis assay, which does not appear in other fibrinogen/thrombin concentrations. This sandwiched polymer fiber system has a potential future application for angiogenesis assay in tissue engineering and cardiovascular research","EFFECT OF MECHANICAL AND BIOPHYSICAL PROPERTIES OF FIBRIN 
GEL ON MICROVASCUAL DEVELOPMENT IN A THREE-DIMENSONAL
ANGIOGENESIS ASSAY",,9.0,6,show,article,['FT7'],International Journal of Automotive and Mechanical Engineering (IJAME),2229-8649,"[{'id': 'irza.sukmana@gmail.com', 'name': {'given': 'Irza', 'lineage': None, 'honourific': None, 'family': 'Sukmana'}}]",disk0/00/01/72/47,2014-06-01 00:00:00.000000000,2020-01-02 02:16:25,464,2020-01-02 02:16:25,pub,,"[{'docid': 30349, 'main': 'EFFECT OF MECHANICAL AND BIOPHYSICAL PROPERTIES OF FIBRIN GEL ON MICROVASCUAL DEVELOPMENT IN A THREE-DIMENSONAL ANGIOGENESIS ASSAY.pdf', 'files': [{'datasetid': 'document', 'filesize': 731339, 'mime_type': 'application/pdf', 'fileid': 146120, 'filename': 'EFFECT OF MECHANICAL AND BIOPHYSICAL PROPERTIES OF FIBRIN GEL ON MICROVASCUAL DEVELOPMENT IN A THREE-DIMENSONAL ANGIOGENESIS ASSAY.pdf', 'hash': '17f652fe7f4181214615b6c31070f471', 'hash_type': 'MD5', 'mtime': '2019-12-03 13:58:45', 'objectid': 30349, 'uri': 'http://repository.lppm.unila.ac.id/id/file/146120'}], 'pos': 1, 'format': 'text', 'uri': 'http://repository.lppm.unila.ac.id/id/document/30349', 'rev_number': 1, 'eprintid': 17247, 'placement': 1, 'security': 'public', 'language': 'en', 'mime_type': 'application/pdf'}]",UMP Publisher,http://repository.lppm.unila.ac.id/id/eprint/17247,public,TRUE,,,1662-1668,,,
10,17694,published,2020-02-17 03:36:36,archive,,['TS'],"Angiogenesis is the formation of new microvascular network from the pre-existing blood
vessel. In tissue engineering approaches, angiogenesis is essential for the promotion of
micro-vascular network inside an engineered scaffold construct, mimicking a functional blood vessel
in vivo. In the in vivo system, the formation of new blood vessels depends on the properties fibrin gel
extracellular matrix. In this study, we have investigated the effect of different fibrinogen and
thrombin composition on the biophysical properties of fibrin gel. Higher concentration of thrombin
(4.0 Units/milliliter) yields a shorter clotting time of the fibrin gel and result in better water uptake
property while at lower concentration of thrombin (0.5 Units/milliliter), the clotting time takes much
longer. Also, at lowest concentration ratio of fibrinogen to thrombin (0.5 milligram/milliliter to 4.0
Units/milliliter), the turbidity study shows the lowest absorbance compared to other samples.
Different concentration of fibrinogen and thrombin also affect the microstructure of the fibrin gel. The
variation of these properties will be then manipulated to be used for in vitro angiogenesis. This study
opens broader application of fibrin extracellular matrix in regenerative medicine and tissue
engineering researches.",Modulation of Fibrin Gel Extracellular Matrix Properties by Fibrinogen and Thrombin Concentrations for Angiogenesis Assay,,,10,show,other,['FT7'],,,"[{'id': 'irza.sukmana@gmail.com', 'name': {'lineage': None, 'family': 'Sukmana', 'honourific': None, 'given': 'Irza'}}]",disk0/00/01/76/94,1970-01-01 00:00:00.000002014,2020-02-17 03:36:36,464,2020-02-17 03:36:36,pub,,"[{'mime_type': 'application/pdf', 'language': 'en', 'eprintid': 17694, 'security': 'public', 'placement': 1, 'format': 'text', 'pos': 1, 'rev_number': 1, 'uri': 'http://repository.lppm.unila.ac.id/id/document/31038', 'docid': 31038, 'main': 'Plagiarism_Modulation of Fibrin Gel Extracellular Matrix Properties by Fibrinogen and Thrombin Concentrations for Angiogenesis Assay.pdf', 'files': [{'datasetid': 'document', 'filesize': 1217280, 'mime_type': 'application/pdf', 'fileid': 150833, 'filename': 'Plagiarism_Modulation of Fibrin Gel Extracellular Matrix Properties by Fibrinogen and Thrombin Concentrations for Angiogenesis Assay.pdf', 'hash': '723c64a460557969bc9c7150570441e0', 'mtime': '2020-02-06 00:43:00', 'hash_type': 'MD5', 'objectid': 31038, 'uri': 'http://repository.lppm.unila.ac.id/id/file/150833'}]}]","Trans Tech Publications, Switzerland",http://repository.lppm.unila.ac.id/id/eprint/17694,public,,,,,,,
11,17690,published,2020-02-17 03:38:09,archive,,['TS'],"This work aims to determine the mechanical and biophysical properties of fibrin gel for
the purpose of angiogenesis study and microvascular development in a threedimensional (3D) environment. In the human body system, fibrin gel is known to be an
extracellular matrix (ECM) that actively promotes homeostasis during blood vessel
formation, wound healing and other inflammation processes. In this study, we first test
the effect of fibrin and thrombin composition on mechanical and biophysical properties
of the gel. Further in vitro experiments using human umbilical vein endothelial cells
(HUVECs) were also conducted to find the optimum fibrinogen/thrombin concentration
for the angiogenesis assay using a sandwich fibrin gel system. A fibrinogen/thrombin
concentration of 2.0/1.0 results in optimum gel properties for three dimensional
angiogenesis assay, which does not appear in other fibrinogen/thrombin concentrations.
This sandwiched polymer fiber system has a potential future application for
angiogenesis assay in tissue engineering and cardiovascular research.","PLAGIARISM_EFFECT OF MECHANICAL AND BIOPHYSICAL PROPERTIES OF FIBRIN
GEL ON MICROVASCUAL DEVELOPMENT IN A THREE-DIMENSONAL
ANGIOGENESIS ASSAY",,,11,show,other,['FT7'],,,"[{'id': 'irza.sukmana@gmail.com', 'name': {'given': 'Irza', 'lineage': None, 'honourific': None, 'family': 'Sukmana'}}]",disk0/00/01/76/90,1970-01-01 00:00:00.000002014,2020-02-17 03:38:09,464,2020-02-17 03:38:09,pub,,"[{'files': [{'hash_type': 'MD5', 'mtime': '2020-02-06 00:53:02', 'filename': 'Plagiarism_EFFECT OF MECHANICAL AND BIOPHYSICAL PROPERTIES OF FIBRIN GEL ON MICROVASCUAL DEVELOPMENT IN A THREE-DIMENSONAL ANGIOGENESIS ASSAY.pdf', 'hash': '20eeb1ac066223910004c3f071736288', 'fileid': 150854, 'mime_type': 'application/pdf', 'filesize': 2325632, 'datasetid': 'document', 'uri': 'http://repository.lppm.unila.ac.id/id/file/150854', 'objectid': 31043}], 'docid': 31043, 'main': 'Plagiarism_EFFECT OF MECHANICAL AND BIOPHYSICAL PROPERTIES OF FIBRIN GEL ON MICROVASCUAL DEVELOPMENT IN A THREE-DIMENSONAL ANGIOGENESIS ASSAY.pdf', 'rev_number': 1, 'uri': 'http://repository.lppm.unila.ac.id/id/document/31043', 'format': 'text', 'pos': 1, 'security': 'public', 'placement': 1, 'eprintid': 17690, 'mime_type': 'application/pdf', 'language': 'en'}]",International Journal of Automotive and Mechanical Engineering (IJAME),http://repository.lppm.unila.ac.id/id/eprint/17690,public,,,,,,,
12,17688,published,2020-02-17 03:36:45,archive,,['TS'],"Angiogenesis is the formation of new microvascular network from the pre-existing blood
vessel. In tissue engineering approaches, angiogenesis is essential for the promotion of
micro-vascular network inside an engineered scaffold construct, mimicking a functional blood vessel
in vivo. In the in vivo system, the formation of new blood vessels depends on the properties fibrin gel
extracellular matrix. In this study, we have investigated the effect of different fibrinogen and
thrombin composition on the biophysical properties of fibrin gel. Higher concentration of thrombin
(4.0 Units/milliliter) yields a shorter clotting time of the fibrin gel and result in better water uptake
property while at lower concentration of thrombin (0.5 Units/milliliter), the clotting time takes much
longer. Also, at lowest concentration ratio of fibrinogen to thrombin (0.5 milligram/milliliter to 4.0
Units/milliliter), the turbidity study shows the lowest absorbance compared to other samples.
Different concentration of fibrinogen and thrombin also affect the microstructure of the fibrin gel. The
variation of these properties will be then manipulated to be used for in vitro angiogenesis. This study
opens broader application of fibrin extracellular matrix in regenerative medicine and tissue
engineering researches.",PLAGIARISM_Modulation of Fibrin Gel Extracellular Matrix Properties by Fibrinogen and Thrombin Concentrations for Angiogenesis Assay,,,12,show,other,['FT7'],,,"[{'name': {'lineage': None, 'honourific': None, 'family': 'Sukmana', 'given': 'Irza'}, 'id': 'irza.sukmana@gmail.com'}]",disk0/00/01/76/88,1970-01-01 00:00:00.000002014,2020-02-17 03:36:45,464,2020-02-17 03:36:45,pub,,"[{'rev_number': 1, 'uri': 'http://repository.lppm.unila.ac.id/id/document/31044', 'format': 'text', 'pos': 1, 'files': [{'uri': 'http://repository.lppm.unila.ac.id/id/file/150861', 'objectid': 31044, 'filesize': 1217280, 'datasetid': 'document', 'mtime': '2020-02-06 00:57:40', 'hash_type': 'MD5', 'filename': 'Plagiarism_Modulation of Fibrin Gel Extracellular Matrix Properties by Fibrinogen and Thrombin Concentrations for Angiogenesis Assay.pdf', 'hash': '723c64a460557969bc9c7150570441e0', 'fileid': 150861, 'mime_type': 'application/pdf'}], 'main': 'Plagiarism_Modulation of Fibrin Gel Extracellular Matrix Properties by Fibrinogen and Thrombin Concentrations for Angiogenesis Assay.pdf', 'docid': 31044, 'mime_type': 'application/pdf', 'language': 'en', 'security': 'public', 'placement': 1, 'eprintid': 17688}]","Trans Tech Publications, Switzerland",http://repository.lppm.unila.ac.id/id/eprint/17688,public,,,,,,,
13,17700,published,2020-02-17 03:36:23,archive,,['TS'],"Scaffold vascularisation is a prevalent challenge in order to develop a mature and functionalize engineering
tissue construct. Vascularisation problem is one of the major hurdles in development of thick and complex engineered tissue. Bioreactors have been used to overcome complex interplay influencing tissue vascularisation.
In this study we have designed and optimized our dynamic culture system for the angiogenesis development in
a 3D environment. Testing with human umbilical vein endothelial cells shows that the cells are able to develop
angiogenesis within two days of culture","Three-Dimensional Dynamic Bioreactor
Culture System Supports the Angiogenesis
Directional of Human Umbilical Vein
Endothelial Cells",,,10,show,other,['FT7'],,,"[{'name': {'lineage': None, 'family': 'Sukmana', 'honourific': None, 'given': 'Irza'}, 'id': 'irza.sukmana@gmail.com'}]",disk0/00/01/77/00,1970-01-01 00:00:00.000002014,2020-02-17 03:36:23,464,2020-02-17 03:36:23,pub,,"[{'main': 'Plagiarism_Three-Dimensional Dynamic Bioreactor Culture System Supports the Angiogenesis Directional of Human Umbilical Vein Endothelial Cells.pdf', 'docid': 30920, 'files': [{'objectid': 30920, 'uri': 'http://repository.lppm.unila.ac.id/id/file/150035', 'fileid': 150035, 'mime_type': 'application/pdf', 'hash_type': 'MD5', 'mtime': '2020-01-30 04:09:27', 'filename': 'Plagiarism_Three-Dimensional Dynamic Bioreactor Culture System Supports the Angiogenesis Directional of Human Umbilical Vein Endothelial Cells.pdf', 'hash': '0735ddd4a7822905e48ebcf7e4accec0', 'datasetid': 'document', 'filesize': 740195}], 'format': 'text', 'pos': 1, 'uri': 'http://repository.lppm.unila.ac.id/id/document/30920', 'rev_number': 1, 'eprintid': 17700, 'security': 'public', 'placement': 1, 'mime_type': 'application/pdf', 'language': 'en'}]",American Scientific Publishers,http://repository.lppm.unila.ac.id/id/eprint/17700,public,,,,,,,
14,28582,published,2021-03-26 06:53:21,archive,,['TJ'],"Cooling system in the engine functions as the protector of the machine by absorbing the heat. Heat engine is produced by fuel in the cylinder. The heat is deliberately created to generate energy, but it will cause excessive heat if it is left unchecked (over heating effect). In order to prevent overheating and keep the machine temperature, then it uses radiator. How effective radiator is used can be seen by using a tool called a radiator tester. Therefore, this research was Designed a Trial Radiator (Radiator Tester) Laboratory Scale Which is Completed by Round Handler’s Machine and Regulator Wind Blower on Diesel Engine L 300. This research was done by testing the car L 300 diesel in the field then noted rpm and air speed that blew into the radiator. The process of designing a radiator tester L300 diesel engine laboratory scale were making the framework platform machine, making radiator tester cooling system machine to set up a thermometer in the radiator hose in and out, making a mechanism round handlers machine, making a regulatory mechanism wind blower and installing a trial radiator with round handlers machine and wind blower. The rpm test result and air speed on the field was applied to the radiator tester laboratory scale. From the results of the tests, it showed that there was an increase in value of the effectiveness of the radiator without external airflow to engine speed 1000 rpm and the average value was 0.483. Whereas, there was a decrease on the effectiveness of the radiator when given outside air flow 2.3 m / s at 1500 rpm engine speed, which was 0.63. Keywords: Effectiveness, Radiators, Temperature, Air Flow",Perancangan dan Pengujian Radiator Tester Skala Laboratorium yang Terintegrasi Pengatur Putaran Mesin dan Hembusan Angin (Regulator Wind Blower ),http://journal.eng.unila.ac.id/index.php/mech/article/view/225,,7,show,other,['FT7'],,,"[{'name': {'family': 'Suudi', 'honourific': None, 'lineage': None, 'given': 'Ahmad'}, 'id': 'ahmad.suudi@eng.unila.ac.id'}, {'name': {'given': 'A.Yudi Eka', 'family': 'Risano', 'honourific': None, 'lineage': None}, 'id': 'yudi_95@yahoo.com'}, {'name': {'given': 'mahasin', 'lineage': None, 'honourific': None, 'family': 'zamnur'}, 'id': None}]",disk0/00/02/85/82,2014-03-01 00:00:00.000000000,2021-03-26 06:53:21,303,2021-03-26 06:53:21,pub,,"[{'language': 'en', 'mime_type': 'application/pdf', 'placement': 1, 'security': 'public', 'eprintid': 28582, 'uri': 'http://repository.lppm.unila.ac.id/id/document/42641', 'rev_number': 1, 'pos': 1, 'format': 'text', 'files': [{'uri': 'http://repository.lppm.unila.ac.id/id/file/253679', 'objectid': 42641, 'filesize': 3038366, 'datasetid': 'document', 'filename': 'IThenticate_Report_JMechanical_Suudi_Yudi_2014.pdf', 'hash': '7d9903774adcc6b564461871f817b3ad', 'mtime': '2021-03-26 03:26:04', 'hash_type': 'MD5', 'mime_type': 'application/pdf', 'fileid': 253679}], 'docid': 42641, 'main': 'IThenticate_Report_JMechanical_Suudi_Yudi_2014.pdf'}]",Jurnal Mechanical Jurnal Ilmiah Teknik Mesin,http://repository.lppm.unila.ac.id/id/eprint/28582,public,,"ISSN 2460-1888 Volume 5, Nomor 1, Maret 2014",Jurnal Mechanical,,,,
15,28583,published,2021-03-26 06:53:24,archive,,['TJ'],"Natural zeolite is an alternative adsorbent. It needs firstly to be activated before using it as absorbent in order to get zeolite with high adsorption capacity. Previously, the use of pelletized zeolite activated by NaOH�physic and KOH-physic with varied normalities was only performed in a diesel engine to observe the engine performance.In this study there were two kinds of activation, that is chemical activation with NaOH activator variation on the normality of 0.25 N, 0.5 N, 0.75 N, and 1.0 N and physical activation with using a temperature of 220 °C for 2 hours. All are made in the form of adhesive zeolite pellets with a diameter of 10 mm and a thickness of 3 mm. From the test results and analysis showed that the use of chemically activated zeolite can improve the performance of 4-stroke petrol engine when compared without using zeolite. The best performance in this experiment obtained at the normality of 0,75 N. At road test, the pelletized zeolite can reduce the fuel consumption 23, 15 %, and 16,51 % at stationary test, and increase acceleration by 14,77 %. Keywords: zeolite adsorbent, variation of normality, activator of NaOH",Pengaruh Variasi Normalitas NaOH pada Aktivasi Basa-Fisik Zeolit Pelet Perekat terhadap Prestasi Sepeda Motor Bensin 4-Langkah,http://journal.eng.unila.ac.id/index.php/mech/article/view/228,,7,show,other,['FT7'],,,"[{'id': 'herryw22@gmail.com', 'name': {'honourific': None, 'family': 'Wardono', 'lineage': None, 'given': 'Herry'}}, {'name': {'given': 'A.Yudi Eka', 'honourific': None, 'family': 'Risano', 'lineage': None}, 'id': 'yudi_95@yahoo.com'}, {'id': None, 'name': {'given': 'ari andre', 'honourific': None, 'family': 'pane', 'lineage': None}}]",disk0/00/02/85/83,2014-03-01 00:00:00.000000000,2021-03-26 06:53:24,303,2021-03-26 06:53:24,pub,,"[{'files': [{'objectid': 42642, 'uri': 'http://repository.lppm.unila.ac.id/id/file/253686', 'mime_type': 'application/pdf', 'fileid': 253686, 'hash': 'a1dba51a29ceea68fd5f9794e8cc5319', 'filename': 'IThenticate_Report_JMechanical_Wardono_Yudi_2014.pdf', 'mtime': '2021-03-26 03:32:23', 'hash_type': 'MD5', 'datasetid': 'document', 'filesize': 4189109}], 'docid': 42642, 'main': 'IThenticate_Report_JMechanical_Wardono_Yudi_2014.pdf', 'uri': 'http://repository.lppm.unila.ac.id/id/document/42642', 'rev_number': 1, 'format': 'text', 'pos': 1, 'security': 'public', 'placement': 1, 'eprintid': 28583, 'mime_type': 'application/pdf', 'language': 'en'}]",Jurnal Mechanical Jurnal Ilmiah Teknik Mesin,http://repository.lppm.unila.ac.id/id/eprint/28583,public,,"ISSN 2460-1888 Volume 5, Nomor 1, Maret 2014",Jurnal Mechanical,,,,
16,611,,2016-09-19 06:13:40,archive,,"['L1', 'LA']",,"Peer review Laporan Tahun Kedua Penelitian Strategis Nasional, Nopember 2014.Rancang Bangun Sistem Pahat Putar Modular (Modular Rotary Tool System) Untuk Pemesinan Material Alat Kesehatan Ortopedik (Titanium Alloy)",,,9,show,other,['FT7'],,,"[{'name': {'lineage': None, 'family': 'harun', 'honourific': None, 'given': 'suryadiwansa'}}]",disk0/00/00/06/11,1970-01-01 00:00:00.000002014,2016-11-10 03:13:05,316,2016-09-19 06:13:40,unpub,,"[{'mime_type': 'application/pdf', 'language': 'en', 'eprintid': 611, 'security': 'public', 'placement': 1, 'format': 'text', 'pos': 1, 'rev_number': 1, 'uri': 'http://repository.lppm.unila.ac.id/id/document/519', 'main': 'Peew Review Laporan Penelitian Stranas 2014.pdf', 'docid': 519, 'files': [{'filesize': 1241735, 'datasetid': 'document', 'hash': 'f2638bc5538509e3b74d31463f74a5c5', 'filename': 'Peew Review Laporan Penelitian Stranas 2014.pdf', 'mtime': '2016-09-16 06:40:48', 'hash_type': 'MD5', 'mime_type': 'application/pdf', 'fileid': 3353, 'uri': 'http://repository.lppm.unila.ac.id/id/file/3353', 'objectid': 519}]}]",suryadiwansa harun,http://repository.lppm.unila.ac.id/id/eprint/611,public,,,,,,,
