,eprintid,date_type,status_changed,eprint_status,related_url,subjects,abstract,title,official_url,volume,rev_number,metadata_visibility,type,divisions,publication,issn,creators,dir,date,lastmod,userid,datestamp,ispublished,number,documents,publisher,uri,full_text_status,refereed,id_number,place_of_pub,pagerange,monograph_type,department,institution
0,27511,published,2021-02-01 04:49:41,archive,[{'url': 'http://journal.eng.unila.ac.id/index.php/fema/issue/view/7'}],['TJ'],"Meningkatnya jumlah kendaraan bermotor yang masih menggunakan bahan bakar fosil sebagai bahan bakar utama, menyebabkan cadangan bahan bakar fosil semakin menipis. Dengan kondisi seperti ini pemerintah telah mengurangi subsidi bahan bakar dan berencana menerapkan pembatasan pemakaian bahan bakar pada kendaraan bermotor. Fly ash batu bara dapat dimanfaatkan untuk menagtasi hal di atas. Pengujian fly ash ini dilakukan dengan beberapa variasi yaitu pengujian konsumsi bahan bakar, akselerasi, dan emisi gas buang. Konsumsi bahan bakar dilakukan dengan road test (pada kecepatan rata-rata 50 km/jam menempuh jarak 5 km) dan stasioner (pada putaran mesin 8500). Pengujian akselerasi dilakukan pada0-120 km/jam, serta pengujian emisi gas buang pada putaran 1500 dan 8500 rpm. Pelet fly ash yang dibentuk menjadi pelet berdiameter 10 mm dan tebal 3 mm dengan beragam variasi air(air mineral, aquadesh, dan air sumur bor), juga variasi temperatur dan waktu aktivasi fisik (200C, 150C selama 1 jam dan 200C, 150C selama 2 jam). Pelet fly ashtersebut dikemas dalam suatu frame dan diletakkan di dalam saringan udara kendaraan uji sepeda motor yamaha vixion 150 cc. Sehingga sebelum udara masuk ke dalam ruang pembakaran, udara terlebih dahulu terhambat dengan pellet fly ash.Dalam penelitian ini, terbukti pelet fly ash mampu menghemat konsumsi bahan bakar hingga 28,8% pada road test, dan sebesar 25,5% pada pengujian stasioner. Akselerasi meningkat sebesar 7,3%.Disamping itu, filter pelet fly ashbatubara mampu mengurangi kadar CO hingga sebesar 26,7% pada putaran 1500 rpm dan 45,5% pada putaran 8500 rpm, mengurangi kadar HC hingga sebesar 34,8% pada putaran 1500 rpm dan 30,4% pada putaran 8500 rpm.",Pengaruh Variasi Jenis Air dan Temperatur Aktivasi dalam Campuran Fly Ash Bentuk Pelet terhadap Prestasi Mesin dan Emisi Gas Buang Sepeda Motor Bensin 4 Langkah,http://journal.eng.unila.ac.id/index.php/fema/article/view/89,2.0,8,show,article,['FT7'],FEMA Jurnal Ilmiah Teknik Mesin,2337-4780,"[{'name': {'given': 'B.Rachmad', 'lineage': None, 'honourific': None, 'family': 'Akbar'}, 'id': 'rachmad_b@yahoo.co.id'}, {'id': 'herryw22@gmail.com', 'name': {'given': 'Herry', 'lineage': None, 'honourific': None, 'family': 'Wardono'}}, {'id': 'mdyan.susila@eng.unila.ac.id', 'name': {'given': 'M Dyan', 'lineage': None, 'family': 'Susila', 'honourific': None}}]",disk0/00/02/75/11,2014-01-01 00:00:00.000000000,2021-02-01 04:49:41,27,2021-02-01 04:49:41,pub,1.0,"[{'rev_number': 1, 'uri': 'http://repository.lppm.unila.ac.id/id/document/41517', 'pos': 1, 'format': 'text', 'files': [{'uri': 'http://repository.lppm.unila.ac.id/id/file/245891', 'objectid': 41517, 'filesize': 485143, 'datasetid': 'document', 'hash': 'd2f806046125f96301f1b982a5ad1de1', 'filename': 'PENGARUH VARIASI JENIS AIR DAN TEMPERATUR AKTIVASI DALAM CAMPURAN FLY ASH.pdf', 'hash_type': 'MD5', 'mtime': '2021-01-27 08:40:52', 'mime_type': 'application/pdf', 'fileid': 245891}], 'main': 'PENGARUH VARIASI JENIS AIR DAN TEMPERATUR AKTIVASI DALAM CAMPURAN FLY ASH.pdf', 'docid': 41517, 'language': 'en', 'mime_type': 'application/pdf', 'placement': 1, 'security': 'public', 'eprintid': 27511}, {'language': 'en', 'mime_type': 'application/pdf', 'eprintid': 27511, 'security': 'public', 'placement': 2, 'format': 'text', 'pos': 2, 'rev_number': 1, 'uri': 'http://repository.lppm.unila.ac.id/id/document/41518', 'docid': 41518, 'main': 'PENGARUH VARIASI JENIS AIR DAN TEMPERATUR AKTIVASI DALAM CAMPURAN FLY ASH.pdf', 'files': [{'datasetid': 'document', 'filesize': 485143, 'fileid': 245893, 'mime_type': 'application/pdf', 'mtime': '2021-01-27 08:41:02', 'hash_type': 'MD5', 'hash': 'd2f806046125f96301f1b982a5ad1de1', 'filename': 'PENGARUH VARIASI JENIS AIR DAN TEMPERATUR AKTIVASI DALAM CAMPURAN FLY ASH.pdf', 'objectid': 41518, 'uri': 'http://repository.lppm.unila.ac.id/id/file/245893'}]}, {'placement': 3, 'security': 'public', 'eprintid': 27511, 'mime_type': 'application/pdf', 'language': 'en', 'files': [{'datasetid': 'document', 'filesize': 485143, 'fileid': 245895, 'mime_type': 'application/pdf', 'mtime': '2021-01-27 08:42:31', 'hash_type': 'MD5', 'hash': 'd2f806046125f96301f1b982a5ad1de1', 'filename': 'PENGARUH VARIASI JENIS AIR DAN TEMPERATUR AKTIVASI DALAM CAMPURAN FLY ASH.pdf', 'objectid': 41519, 'uri': 'http://repository.lppm.unila.ac.id/id/file/245895'}], 'main': 'PENGARUH VARIASI JENIS AIR DAN TEMPERATUR AKTIVASI DALAM CAMPURAN FLY ASH.pdf', 'docid': 41519, 'uri': 'http://repository.lppm.unila.ac.id/id/document/41519', 'rev_number': 1, 'pos': 3, 'format': 'text'}]","Jurusan Teknik Mesin, Unila",http://repository.lppm.unila.ac.id/id/eprint/27511,public,TRUE,,,,,,
1,18272,published,2020-03-03 07:16:32,archive,,['TJ'],,Similarity check result: Isothermal Oxidation Behavior of Aluminized AISI 1020 Steel at the Temperature of 700 C,http://jurnalmesin.petra.ac.id/index.php/mes,,7,show,other,['FT7'],,,"[{'id': 'mbruddin@eng.unila.ac.id', 'name': {'lineage': None, 'honourific': None, 'family': 'Badaruddin', 'given': 'Mohammad'}}]",disk0/00/01/82/72,2014-04-14 00:00:00.000000000,2020-03-03 07:16:32,451,2020-03-03 07:16:32,unpub,,"[{'security': 'public', 'placement': 1, 'eprintid': 18272, 'language': 'en', 'mime_type': 'application/pdf', 'files': [{'datasetid': 'document', 'filesize': 2764986, 'fileid': 153839, 'mime_type': 'application/pdf', 'mtime': '2020-02-27 10:41:09', 'hash_type': 'MD5', 'hash': '3a3751507c284dbe4a757c0feb5be273', 'filename': 'Similarity check result for Isothermal_Oxidation_Behavior_of_Aluminized_AISI_1.pdf', 'objectid': 31424, 'uri': 'http://repository.lppm.unila.ac.id/id/file/153839'}], 'docid': 31424, 'main': 'Similarity check result for Isothermal_Oxidation_Behavior_of_Aluminized_AISI_1.pdf', 'uri': 'http://repository.lppm.unila.ac.id/id/document/31424', 'rev_number': 1, 'format': 'text', 'pos': 1}]",Institute of Research and Community Outreach Petra Christian University,http://repository.lppm.unila.ac.id/id/eprint/18272,public,,https://doi.org/10.9744/jtm.15.1.15-20,Jurnal Teknik Mesin- Univ. Kristen Petra,,,,
2,18743,published,2020-03-17 01:37:06,archive,,['TJ'],"The AISI 1020 steel was coated by dipping it into the molten Al bath at 700 °C for 16s. The coating layer formed on the steel substrate is consisting of Al with a little Fe, FeAl3 and Fe2Al5 layers. The morphologies of the FeAl3 and Fe2Al5 layers are platelet and columnar structures, respectively. The oxidation test was carried out isothermally at 700 °C for a various time of 1-49 h in static air. The oxidation behaviors of both of the bare steel and the aluminized steel were studied by the oxidation kinetics, surface morphologies and phase transformation after oxidation testing. The oxidation products were characterized using Optical Microscope (OM), Scanning Electron Microscopy with Electron Dispersive Spectroscopy (SEM/EDS) and X-ray diffraction analysis. The magnitude of the rate constant (kp) of the aluminized steel is two order lower than the bare steel. The formations of intermetallic phases on the steel substrate for a shorter time are dominated by the interdiffusion between the inward diffusion of Al-atoms into the steel substrate and outward diffusion of Fe-atoms. The constituent phases in the aluminide layer compose of FeAl2, Fe2Al5 and FeAl. The formation ofFeAlphase is controlled by the inward diffusion of Fe-atoms into the Fe2Al5 phase. The improvement of the oxidation resistance of the aluminized steel subjected to severe oxidation is due to the formation of protective Al2O3scale.",Isothermal Oxidation Behavior of Aluminized AISI 1020 Steel at the Temperature of 700 oC,http://jurnalmesin.petra.ac.id/index.php/mes/pages/view/indexing,15.0,6,show,article,['FT7'],Jurnal Teknik Mesin-Universitas Kristen Petra,1410-9867,"[{'name': {'given': 'Mohammad', 'lineage': None, 'family': 'Badaruddin', 'honourific': None}, 'id': 'mbruddin@eng.unila.ac.id'}, {'name': {'honourific': None, 'family': 'Suharno', 'lineage': None, 'given': 'Suharno'}, 'id': 'suharno@eng.unila.ac.id'}, {'name': {'given': 'Hanif Ari', 'lineage': None, 'family': 'Wijaya', 'honourific': None}, 'id': 'hanifaw@gmail.com'}]",disk0/00/01/87/43,2014-04-01 00:00:00.000000000,2020-03-17 01:37:06,451,2020-03-17 01:37:06,pub,1.0,"[{'files': [{'uri': 'http://repository.lppm.unila.ac.id/id/file/157374', 'objectid': 31928, 'filesize': 731405, 'datasetid': 'document', 'filename': '19251-23305-2-PB.pdf', 'hash': 'd5a95c5472566a37a1f89c1913923f7f', 'hash_type': 'MD5', 'mtime': '2020-03-16 06:27:55', 'mime_type': 'application/pdf', 'fileid': 157374}], 'main': '19251-23305-2-PB.pdf', 'docid': 31928, 'rev_number': 1, 'uri': 'http://repository.lppm.unila.ac.id/id/document/31928', 'format': 'text', 'pos': 1, 'security': 'public', 'placement': 1, 'eprintid': 18743, 'language': 'en', 'mime_type': 'application/pdf'}]",The Institute of Research & Community Outreach - Petra Christian University,http://repository.lppm.unila.ac.id/id/eprint/18743,public,TRUE,https://doi.org/10.9744/jtm.15.1.15-19,,15-19,,,
3,27490,published,2021-02-01 04:49:29,archive,[{'url': 'https://core.ac.uk/download/pdf/297358032.pdf'}],['TJ'],"Kebutuhan listrik yang terus meningkat dan belum diiringi dengan peningkatan pasokan listrik dari PLN (Perusahaan Listrik Negara) sehingga sering terjadi pemadaman listrik. Masyarakat yang menggunakan listrik dari PLN mencari alternatif lain dengan menggunakan genset sebagai sumber pembangkit listrik sementara. Pada umumnya penggunaan genset digunakan untuk memenuhi kebutuhan listrik rumah tangga, kantor dan toko-toko. Mesin genset umumnya menggunakan bahan bakar bensin. Dengan kenaikan harga bahan bakar minyak saat ini, biaya operasional genset menjadi meningkat. Untuk mengatasi hal ini sekarang sudah tersedia jenis zat aditif sintetik dan zat aditif alami. Dengan penambahan zat aditif pada bahan bakar (bensin) dapat meningkatkan angka oktan dan kualitas dari bahan bakar sehingga didapatkan pembakaran yang sempurna. Untuk itu penelitian ini bertujuan untuk mengetahui pengaruh dari pemakaian zat aditif sintetik dengan zat aditif alami terhadap pemakaian bahan bakar dan emisi gas buang pada genset.
Untuk itu dilakukanlah serangkaian pengujian, pada pengujian ini menggunakan mesin genset CAMARO 4-langkah berbahan bakar bensin. Variasi pada pengujian ini meliputi pengujian konsumsi bahan bakar tanpa zat aditif, dengan zat aditif sintetik dan dengan zat aditif alami untuk tanpa beban dan dengan beban 700 watt. Variasi waktu yang digunakan dalam penelitian yaitu selama 10 menit, 20 menit dan 30 menit. Zat aditif yang digunakan dalam penelitian ini yaitu jenis zat aditif sintetik dengan perbandingan 1 (satu) pil/tablet untuk 4 liter bensin premium (1:4) dan untuk jenis zat aditif alami dengan perbandingan 1 (satu) pil/tablet untuk 30 liter bensin premium (1:30). Pada pengujian emisi gas buang bertujuan untuk mengetahui kandungan kadar gas CO, HC dan CO2 yang dihasilkan mesin genset.
Dari penelitian ini, didapat penurunan konsumsi bahan bakar terbaik yaitu pada kondisi tanpa beban dengan zat aditif sintetik sebesar 15,66 % dan pada beban 700 watt sebesar 16,99 %. Tegangan listrik yang dihasilkan mesin genset sebesar 181,106 volt dan nyala lampu yang dihasilkan tidak seterang dengan nyala lampu dari PLN yang tegangan listriknya sebesar 220 volt. Untuk penurunan kadar gas CO terbaik yaitu dengan menggunakan zat aditif alami pada kondisi tanpa beban sebesar 5,35 % dan pada beban 700 watt sebesar 9,06 %, untuk penurunan kadar gas HC terbaik yaitu dengan menggunakan zat aditif sintetik pada kondisi tanpa beban sebesar 344 ppm dan pada beban 700 watt sebesar 585 ppm, untuk peningkatan kadar gas CO2 terbaik yaitu dengan menggunakan zat aditif alami pada kondisi dengan beban 700 watt sebesar 6,3 %. Untuk prestasi terbaik pada penggunaan zat aditif sintetik pada kondisi tanpa beban sebesar 15,66 % dan pada beban 700 watt sebesar 16,99 %. Untuk perbandingan biaya bahan bakar lebih murah menggunakan zat aditif sintetik untuk 1 (satu) liter bahan bakar pada kondisi tanpa beban biaya yang dihabiskan sebesar Rp. 6.645,- dan mesin genset dapat beroperasi selama 2,9 jam, untuk 1 (satu) liter bahan bakar pada kondisi dengan beban 700 watt biaya yang dihabiskan sebesar Rp. 6.645,- dan mesin genset dapat beroperasi selama 1,3 jam.",Studi Komparasi Dari Zat Aditif Sintetik Dengan Zat Aditif Alami Terhadap Pemakaian Bahan Bakar Dan Emisi Gas Buang Pada Mesin Genset Motor Bensin 4-Langkah,http://journal.eng.unila.ac.id/index.php/fema/issue/archive,2.0,7,show,article,['FT7'],FEMA Jurnal Ilmiah Teknik Mesin,2337-4780,"[{'name': {'given': 'Maindra', 'family': 'Maindra', 'honourific': None, 'lineage': None}, 'id': 'mas.indra89@yahoo.com'}, {'name': {'honourific': None, 'family': 'harmen', 'lineage': None, 'given': 'harmen'}, 'id': 'harmen.1969@eng.unila.ac.id'}, {'id': 'mdyan.susila@eng.unila.ac.id', 'name': {'given': 'M Dyan', 'family': 'Susila', 'honourific': None, 'lineage': None}}]",disk0/00/02/74/90,2014-01-01 00:00:00.000000000,2021-02-01 04:49:29,27,2021-02-01 04:49:29,pub,1.0,"[{'content': 'published', 'mime_type': 'application/pdf', 'language': 'en', 'placement': 1, 'security': 'public', 'eprintid': 27490, 'rev_number': 3, 'uri': 'http://repository.lppm.unila.ac.id/id/document/41494', 'pos': 1, 'format': 'text', 'files': [{'datasetid': 'document', 'filesize': 594017, 'fileid': 245742, 'mime_type': 'application/pdf', 'mtime': '2021-01-27 07:12:14', 'hash_type': 'MD5', 'filename': '297358032.pdf', 'hash': 'edad305cb3fbd52fc05afc497b857e77', 'objectid': 41494, 'uri': 'http://repository.lppm.unila.ac.id/id/file/245742'}], 'main': '297358032.pdf', 'docid': 41494}]","Jurusan Teknik Mesin, Unila",http://repository.lppm.unila.ac.id/id/eprint/27490,public,TRUE,,,,,,
4,982,published,2016-10-30 13:31:08,archive,"[{'url': 'http://puslit2.petra.ac.id/ ejournal', 'type': 'pub'}]",['TJ'],"AISI 1020 steel was coated by dipping into a molten Al bath at 700 °C for 16s. The coating layer formed on the steel substrate is consisting of Al with a little Fe, FeAl3 and Fe2Al5 layers. The morphologies of the FeAl3 and Fe2Al5 layers are platelet and columnar structures, respectively. The oxidation test was carried out isothermally at 700 °C for a various time of 149 h in static air. The oxidation behaviors of both of the bare steel and the aluminized steel were studied by the oxidation kinetics, surface morphologies and phase transformation after oxidation testing. The oxidation products were characterized using Optical Microscope (OM), Scanning Electron Microscopy with Electron Dispersive Spectroscopy (SEM/EDS) and X-ray diffraction analysis. The magnitude of the rate constant of parabolic (kp) of the aluminized steel is two orders lower than the bare steel. The formations of intermetallic phases on the steel substrate for a shorter time are dominated by the interdiffusion between the inward diffusion of Al-atoms into the steel substrate and outward diffusion of Fe-atoms. The constituent phases in the aluminide layer compose of FeAl2, Fe2Al5 and FeAl. The formation of FeAl phase is controlled by the inward diffusion of Fe-atoms into the Fe2Al5 phase. The improvement of the oxidation resistance of the aluminized steel subjected to severe oxidation is due to the formation of protective Al2O3 scale.",Isothermal Oxidation Behavior of Aluminized AISI 1020 Steel at the Temperature of 700 oC,http://puslit2.petra.ac.id/ ejournal,15.0,7,show,article,['FT7'],Jurnal Teknik Mesin,1410-9867,"[{'name': {'given': 'Badaruddin', 'lineage': None, 'family': 'Mohammad', 'honourific': None}, 'id': 'mbruddin@eng.unila.ac.id'}, {'name': {'honourific': None, 'family': 'Suharno', 'lineage': None, 'given': 'Suharno'}, 'id': 'suharno@eng.unila.ac.id'}, {'id': 'hanif_aw@yahoo.co.id', 'name': {'given': 'Ari Wijaya', 'family': 'Hanif', 'honourific': None, 'lineage': None}}]",disk0/00/00/09/82,2014-04-01 00:00:00.000000000,2016-10-30 13:31:08,451,2016-10-30 13:31:08,pub,1.0,"[{'placement': 1, 'security': 'public', 'eprintid': 982, 'mime_type': 'application/pdf', 'language': 'en', 'files': [{'uri': 'http://repository.lppm.unila.ac.id/id/file/6291', 'objectid': 875, 'filename': '19251-23305-2-PB.pdf', 'hash': 'e4e8b5dbcdef6cf1f166ec33b6aa24a3', 'hash_type': 'MD5', 'mtime': '2016-10-28 10:26:42', 'mime_type': 'application/pdf', 'fileid': 6291, 'filesize': 680054, 'datasetid': 'document'}], 'docid': 875, 'main': '19251-23305-2-PB.pdf', 'uri': 'http://repository.lppm.unila.ac.id/id/document/875', 'rev_number': 1, 'pos': 1, 'format': 'text'}]",Institute of Research and Community Outreach Petra Christian University,http://repository.lppm.unila.ac.id/id/eprint/982,public,TRUE,10.9744/jtm.15.1.15-20,,15-20,,,
5,7011,published,2018-06-05 07:24:18,archive,,"['TJ', 'TS']","Most welding shops in the area Pringsewu District in carrying out the work are still using a system that is not working or is not systematically planned, which is why most welding shops suffered many losses, such as product processing time is longer, the cost of production incurred greater and workmanship unsatisfactory. Of the shortcomings and weaknesses of the system working in most welding shops in the Pringsewu District, it is necessary to study the process planning, which is applied in the manufacture of livestock manure dryer furnace in the manufacturing process in a small welding shop. This study aims to make a good process planning that can be applied to the world of entrepreneurship, especially welding shop.
The research was conducted at the welding shop at Pringsewu district in January-March 2013. Making the process planning begins with the creation of images 2dimensional furnace consists of 4 major components, namely cones, combustion chamber, body coatings, and disposal space. Procedures sheets gained as much as 11 pieces that serve to minimize material and wasted time. Calculation time of making the furnace obtained through primary and secondary data collection that results in two sketches workplace assembling component parts, 41 pieces of the map left and right hand and 8 pieces of the process flow map. The resulting time using MOST (Mynard Operation Sguence Technique) is equal to 57.8757 hours divided by 8 hours of working time in 1 day = 7.2344625 days or ± 8 days. The total estimated cost of production based on direct costs, indirect costs, and overhead costs for Rp.8.345.300",Perencanaan Proses Tungku Pengering Kotoran Hewan Ternak,,2.0,7,show,article,['FT7'],Jurnal Fresh Mechanical (FEMA),2337 - 4780,"[{'id': None, 'name': {'given': 'Cholyan', 'lineage': None, 'honourific': None, 'family': 'Perwira'}}, {'id': None, 'name': {'lineage': None, 'honourific': None, 'family': 'Burhanuddin', 'given': 'Yanuar'}}, {'name': {'given': 'Yahya', 'family': 'Panuju', 'honourific': None, 'lineage': None}, 'id': 'achmad.yahya@eng.unila.ac.id'}]",disk0/00/00/70/11,2014-01-01 00:00:00.000000000,2018-06-05 07:24:18,59,2018-06-05 07:24:18,pub,1.0,"[{'format': 'text', 'pos': 1, 'uri': 'http://repository.lppm.unila.ac.id/id/document/19985', 'rev_number': 1, 'main': 'Perencanaan Proses Tungku Pengering Kotoran Hewan Ternak.pdf', 'docid': 19985, 'files': [{'objectid': 19985, 'uri': 'http://repository.lppm.unila.ac.id/id/file/64185', 'datasetid': 'document', 'filesize': 920655, 'mime_type': 'application/pdf', 'fileid': 64185, 'hash': '4bebe9eecea6d27dcebe068718b27ea8', 'filename': 'Perencanaan Proses Tungku Pengering Kotoran Hewan Ternak.pdf', 'mtime': '2018-06-04 08:04:57', 'hash_type': 'MD5'}], 'language': 'en', 'mime_type': 'application/pdf', 'eprintid': 7011, 'security': 'public', 'placement': 1}]",Jurusan Teknik Mesin FT– Universitas Lampung.,http://repository.lppm.unila.ac.id/id/eprint/7011,public,TRUE,,,66-77,,,
6,7012,published,2018-06-05 07:24:15,archive,,['TJ'],"Automation systems are a manifestation of the concept of science that led to development of nowadays technology. In general automation is concept of human science that is used to run a process where there is no longer direct human intervention ranging from the beginning of the process until completion. This research is intended to create a automated a robotic system camera pan and tilt movements with a view to be implemented into a variety of forms of applications, such as KAP (Kite Aerial Photography), security camera, stealth cam, camera traps and etc. This research uses some mechanicsm of rigging as a medium for system the camera Arduino microcontroller is used as the controller of the controlling the camera movement. The system of controlled the movement of the camera by using time delay. The results showed that the robotics system of this research has succeeded in making a camera capable of autonomous moving to state time delay.",Pembuatan Sistem Robotika sebagai Implementasi Pergerakan Kamera secara Autonomous,,2.0,7,show,article,['FT7'],Jurnal Fresh Mechanical (FEMA),2337 - 4780,"[{'id': None, 'name': {'honourific': None, 'family': 'Putra', 'lineage': None, 'given': 'Dimas'}}, {'name': {'given': 'Martinus', 'honourific': None, 'family': 'Martinus', 'lineage': None}, 'id': 'martinus@eng.unila.ac.id'}, {'name': {'given': 'Yahya', 'honourific': None, 'family': 'Panuju', 'lineage': None}, 'id': 'achmad.yahya@eng.unila.ac.id'}]",disk0/00/00/70/12,2014-04-01 00:00:00.000000000,2018-06-05 07:24:15,59,2018-06-05 07:24:15,pub,2.0,"[{'placement': 1, 'security': 'public', 'eprintid': 7012, 'language': 'en', 'mime_type': 'application/pdf', 'files': [{'filesize': 350694, 'datasetid': 'document', 'mtime': '2018-06-04 08:13:54', 'hash_type': 'MD5', 'hash': 'c365f87048e7da3e8b157af37bf251ec', 'filename': 'Pembuatan Sistem Robotika sebagai Implementasi Pergerakan Kamera secara Autonomous.pdf', 'fileid': 64192, 'mime_type': 'application/pdf', 'uri': 'http://repository.lppm.unila.ac.id/id/file/64192', 'objectid': 19986}], 'main': 'Pembuatan Sistem Robotika sebagai Implementasi Pergerakan Kamera secara Autonomous.pdf', 'docid': 19986, 'rev_number': 1, 'uri': 'http://repository.lppm.unila.ac.id/id/document/19986', 'pos': 1, 'format': 'text'}]",Jurusan Teknik Mesin FT– Universitas Lampung.,http://repository.lppm.unila.ac.id/id/eprint/7012,public,TRUE,,,23-30,,,
7,27502,published,2021-02-01 04:49:32,archive,[{'url': 'http://journal.eng.unila.ac.id/index.php/fema/issue/view/34'}],['TJ'],"All this time microhydro power plants (MHP) created a resource use of water flow has high fall of water (head) while for areas that have stream of river but do not have high fall of water (head) still a lot of untapped but has potential hydrokinetic be able rotating turbine. This is what lies behind the research conducted to determine the effect of chord length on the performance of the helical turbine which is expected to come helical turbine performance as the optimum use of the potential hydrokinetic. Helical turbine tested had dimensions of 1.2 m high and 1 m in diameter, blade profile NACA 0030, chord length 15 cm, 20 cm and 25 cm with number of blades 3 pieces. Tests performed on the irrigation canals that open to varying water velocity of 0.52 m/s, 0.68 m/s and 0.8 m/s. From the test results obtained helical turbine performance as follows. The largest torque obtained in water velocity of 0.52 m/s, 0.68 m/s and 0.8 m/s is 3.89 Nm, 27.09 Nm and 39.38 Nm is the chord length of the turbine with 25cm and the smallest torque on the chord length of 15 cm of 2.31 Nm. Power largest turbine in the water velocity of 0.52 m/s, 0.68 m/s and 0.8 m/s is 7.12 Watt, 60.41 Watt and 103.96 Watt, turbine that is on the chord length of 25 cm and the smallest turbine power chord length of 15 cm by 3.58 watts. Largest turbine efficiency at water velocity of 0.52 m/s, 0.68 m/s and 0.8 m/s is 8.44%, 32.02% and 33.84% in the turbine with a chord length of 25 cm and efficiency the smallest turbines on the chord length of 15 cm of 1,17%.",Kajian Eksperimental Pengaruh Panjang Chord Sudu Terhadap Unjuk Kerja Turbin Helik Untuk Sistem Pembangkit Listrik Tenaga Mikrohidro (PLTMH),http://journal.eng.unila.ac.id/index.php/fema/article/view/250,2.0,7,show,article,['FT7'],FEMA Jurnal Ilmiah Teknik Mesin,2337-4780,"[{'name': {'lineage': None, 'family': ""Rapa'i"", 'honourific': None, 'given': 'Ahmad'}, 'id': None}, {'name': {'lineage': None, 'family': 'Sinaga', 'honourific': None, 'given': 'Jorfri Boike'}, 'id': 'jorfri6@yahoo.com'}, {'name': {'lineage': None, 'family': 'Susila', 'honourific': None, 'given': 'M Dyan'}, 'id': 'mdyan.susila@eng.unila.ac.id'}]",disk0/00/02/75/02,2014-04-01 00:00:00.000000000,2021-02-01 04:49:32,27,2021-02-01 04:49:32,pub,2.0,"[{'main': 'PENGARUH PANJANG CHORD SUDU TERHADAP UNJUK KERJA TURBIN HELIK.pdf', 'docid': 41508, 'files': [{'hash': 'ae2088384ad4614168a81a0825f3a102', 'filename': 'PENGARUH PANJANG CHORD SUDU TERHADAP UNJUK KERJA TURBIN HELIK.pdf', 'mtime': '2021-01-27 07:31:43', 'hash_type': 'MD5', 'mime_type': 'application/pdf', 'fileid': 245829, 'filesize': 392831, 'datasetid': 'document', 'uri': 'http://repository.lppm.unila.ac.id/id/file/245829', 'objectid': 41508}], 'pos': 1, 'format': 'text', 'uri': 'http://repository.lppm.unila.ac.id/id/document/41508', 'rev_number': 1, 'eprintid': 27502, 'placement': 1, 'security': 'public', 'language': 'en', 'mime_type': 'application/pdf'}]","Jurusan Teknik Mesin, Unila",http://repository.lppm.unila.ac.id/id/eprint/27502,public,TRUE,,,,,,
