,date_type,eprintid,abstract,subjects,related_url,status_changed,eprint_status,metadata_visibility,volume,rev_number,title,official_url,divisions,type,id_number,dir,date,creators,issn,publication,datestamp,pagerange,lastmod,userid,refereed,uri,full_text_status,publisher,documents,ispublished,number,event_location,event_title,event_type,pres_type,corp_creators,referencetext,contact_email,place_of_pub,funders,projects,keywords,succeeds,event_dates,contributors,patent_applicant,pages,isbn
21,published,12820,"Kacang-kacangan atau yang lebih dikenal dengan kacang polong menjadi sumber makanan yang mengandung protein tinggi sehingga sangat baik dikonsumsi bagi orang yang mengalami sakit. Kelompok usaha kecil yang memproduksi tepung kacang polong mengalami kesulitan untuk melakukan proses penyangraian karena bila penyangraian dilakukan sacara manual maka membutuhkan waktu yang sangat lama, tidak seragam kematangannya dan kwalitas produksi tidak standar. Oleh karena itu, diimplementasikan mesin sangrai rotary skala kecil (kapasitas 2.0 kg), dengan dimensi tabung berdiameter 25 cm dan panjang tabung 30 cm serta berbahan stainlees steel. Stailees steel digunakan agar menjadi higenitas bahan yang akan dikonsumsi. Mesin sangrai dilengkapi dengan pengontrol suhu, beroperasi dengan kecepatan putaran sebesar 10 rpm dan menggunakan panas dari kompor gas skala rumah tangga. Pengujian dilakukan terhadap beberapa jenis kacang, dimana hasil yang peroleh adalah kapasitas produksi meningkat, keseragaman kematangan kacang lebih baik,  dan lamanya waktu sangrai lebih pendek. Waktu yang diperlukan untuk sangrai kacang tanah hanya 15 menit dimana sangrai beroperasi pada suhu 150 °C dan waktu sangrai kacang kedelai 13 menit. Sementara itu, waktu sangrai untuk kacang hijau dan kacang merah  memerlukan waktu 13 menit. Sedangkan waktu sangrai yang diperlukan untuk biji kopi lebih lama yaitu 20 menit, karena kopi memiliki struktur biji yang lebih keras. Dengan demikian dapat dikatakan bahwa implementasi mesin sangrai kacang polong mampu mempersingkat waktu sangrai dibangdingkan dengan sangrai secara manual. Kemudian sangrai dilakukan pada suhu yang relatif  seragam sehingga kematangan biji kacang seragam untuk semua biji. Implementasi mesin sangrai telah meningkatkan kapasitas produksi kelompok usaha  hingga mencapai 200 kg setiap bulannya",['TS'],,2019-05-14 08:27:44,archive,show,,7,IMPLEMENTASI MESIN SANGRAI UNTUK MENINGKATKAN PRODUKTIFITAS TEPUNG KACANG POLONG,,['FT7'],conference_item,,disk0/00/01/28/20,2019-04-24 00:00:00.000000000,"[{'id': 'gusri.akhyar@eng.unila.ac.id', 'name': {'family': 'Ibrahim', 'honourific': None, 'lineage': None, 'given': 'Gusri'}}, {'name': {'given': 'Hamni', 'family': 'Arinal', 'honourific': None, 'lineage': None}, 'id': None}]",,,2019-05-14 08:27:44,,2019-05-14 08:27:44,528,TRUE,http://repository.lppm.unila.ac.id/id/eprint/12820,public,,"[{'files': [{'fileid': 113039, 'mime_type': 'application/pdf', 'hash_type': 'MD5', 'mtime': '2019-05-13 10:30:18', 'filename': 'Full paper_Gusri Akhyar Ibrahim.pdf', 'hash': 'c0b8c177f49d2e111e41f2a65d2ccd4c', 'datasetid': 'document', 'filesize': 182696, 'objectid': 25790, 'uri': 'http://repository.lppm.unila.ac.id/id/file/113039'}], 'main': 'Full paper_Gusri Akhyar Ibrahim.pdf', 'docid': 25790, 'rev_number': 1, 'uri': 'http://repository.lppm.unila.ac.id/id/document/25790', 'pos': 1, 'format': 'text', 'placement': 1, 'security': 'public', 'eprintid': 12820, 'language': 'en', 'mime_type': 'application/pdf'}]",pub,,Bandar Lampung,Seminar Nasional Universitas Lampung,conference,paper,,,,,,,,,24 April 2019,"[{'name': {'lineage': None, 'family': 'Ibrahim', 'honourific': None, 'given': 'Gusri'}, 'id': 'gusri.akhyar@eng.unila.ac.id', 'type': 'http://www.loc.gov/loc.terms/relators/AUT'}, {'id': None, 'type': None, 'name': {'given': 'Hamni', 'family': 'Arinal', 'honourific': None, 'lineage': None}}]",,,
22,published,12819,"Provinsi Lampung, daerah yang terletak di ujung pulau Sumatera memiliki potensi sumber daya alam yang melimpah, salah satunya adalah bamboo. Saat ini, bambo  banyak dimanfaatkan untuk menghasilkan kerajinan-kerajinan berupa industry kreatif. Desa Sidomulyo adalah salah satu daerah di Lampung Selatan yang sebagian besar masyarakatnya mengolah bambu menjadi bahan untuk tusuk sate. Proses pembuatan tusuk sate yang dilakukan saat ini dengan mengunak peralatan yang dioperasikan secara manual, sederhana dan tanpa bantuan mesin. Proses pembuatan tusuk sate antaranya adalah pembelahan, peranjangan, peruncingan, penyerutan dan pemolesan. Salah satu tahap proses yang penting adalah penyerutan, dimana dilakukan menggunakan pisau penyerut, ditarik menggunakan tang. Proses ini memerlukan waktu yang lama sehingga kapasitas produksinya sedikit, sementara kebutuhan akan tusuk sate sangat banyak permintaanya. Oleh karena itu, untuk meningkatkan produktivitas tusuk sate diperlukan mesin penyerut mekanik yang dapat memproduksi tusuk sate yang lebih efisien dan lebih efektif. Efisien yang dimaksud yaitu hemat, cepat dan tenaga yang dikeluarkan untuk mengerjakan ini lebih sedikit. Sedangkan efektif disini yaitu untuk memaksimalkan tujuan yang diharapkan seperti memudahkan para pengerajin dalm membuat tusuk sate.Mesin tusuk sate dibuat menggunakan mesin setengah PK dengan untuk memutar puli dan puli disambungkan ke roda-roda yang berfungsi untuk menggerakan lidi menuju pisau serut.  Setelah dilakukan pembuatan mesin penyerut tusuk sate mekanik, dapat meningkatkan produksi tusuk sate hingga mencapai 80 % dari hasil penyerutan dengan menggunakan cara manual.  Sehingga dengan demikian dapat meningkatkan pendapatan usaha dan memenuhi keperluan tusuk sate di daerah sekitarnya.",['TS'],,2019-05-14 08:22:54,archive,show,3.0,6,PEMBUATAN DAN PENGUJIAN MESIN PENYERUT TUSUK SATE MEKANIK,,['FT7'],article,,disk0/00/01/28/19,1970-01-01 00:00:00.000002019,"[{'id': 'gusri.akhyar@eng.unila.ac.id', 'name': {'family': 'Ibrahim', 'honourific': None, 'lineage': None, 'given': 'Gusri'}}, {'id': 'arinal.hamni@yahoo.com', 'name': {'given': 'Hamni', 'honourific': None, 'family': 'Arinal', 'lineage': None}}, {'id': None, 'name': {'lineage': None, 'family': 'Margaretta', 'honourific': None, 'given': 'Welly'}}, {'name': {'given': 'Harjo', 'lineage': None, 'honourific': None, 'family': 'Budi'}, 'id': None}]",,SAKAI SAMBAYAN — Jurnal Pengabdian kepada Masyarakat,2019-05-14 08:22:54,27-33,2019-05-14 08:22:54,528,TRUE,http://repository.lppm.unila.ac.id/id/eprint/12819,public,,"[{'files': [{'datasetid': 'document', 'filesize': 460671, 'mime_type': 'application/pdf', 'fileid': 113031, 'filename': '109-1-279-1-10-20190319.pdf', 'hash': '0fd220caafbdbc072b28227f36e33ed2', 'hash_type': 'MD5', 'mtime': '2019-05-13 10:17:55', 'objectid': 25789, 'uri': 'http://repository.lppm.unila.ac.id/id/file/113031'}], 'main': '109-1-279-1-10-20190319.pdf', 'docid': 25789, 'rev_number': 1, 'uri': 'http://repository.lppm.unila.ac.id/id/document/25789', 'format': 'text', 'pos': 1, 'security': 'public', 'placement': 1, 'eprintid': 12819, 'mime_type': 'application/pdf', 'language': 'en'}]",pub,1,,,,,,,,,,,,,,"[{'id': 'gusri.akhyar@eng.unila.ac.id', 'type': 'http://www.loc.gov/loc.terms/relators/AUT', 'name': {'family': 'Ibrahim', 'honourific': None, 'lineage': None, 'given': 'Gusri'}}, {'type': 'http://www.loc.gov/loc.terms/relators/AUT', 'id': None, 'name': {'given': 'Hamni', 'lineage': None, 'honourific': None, 'family': 'Arinal'}}]",,,
23,published,12816,"Naskah Direvisi 28/03/2019 Naskah Disetujui 29/03/2019 Naskah Online 29/03/2019 
 
 Magnesium merupakan salah satu material ringan yang sangat penting, terutama di bidang otomotif, dan biomedik. Aplikasi material magnesium dan paduannya di bidang material biomedik didasarkan pada sifat magnesium yang sangat mirip dengan sifat tulang manusia dan memiliki biocompatibility yang baik serta luluh di dalam tubuh. Aplikasi material magnesium juga banyak dikembangkan dengan cara ditanam (implan). Material paduan magnesium memiliki beberapa kelebihan secara kimia dan fisika, namun dalam proses pemesinan paduan magnesium dikenal sebagai material jenis logam yang mudah terbakar, terutama pada saat proses pemesinan dengan kecepatan tinggi. Dalam penelitian ini, sudut mata pahat (point angle), pelumas dan parameter pengeboran dianalisa untuk mengetahui pengaruhnya terhadap nilai kekasaran permukaan, kebulatan dan ketegaklurusan. Pada penelitian ini disain yang digunakan adalah Metode Taguchi L18 yang terdiri dari 3 faktor 3 level dan 1 faktor 2 level. Hasil penelitian menunjukkan bahwa kekasaran permukaan dipengaruhi oleh adanya kontribusi dari sudut sudut mata pahat18,9% dan lubrikan 14,5%. dimana sudut mata pahat adalah 650 dengan lubrikan minyak sintetis.  Kebulatan dipengaruhi oleh sudut mata pahat 450 dari proses pengeboran, terutama jika terjadi interaksi pada kadar pemakanan 0,2 mm/rev dan lubrikan sintetis. Keakuratan sisi potong/cutting edge berakibat pada gaya tangensial sehingga berpengaruh pada kestabilan putaran dan kebulatan hasil pengeboran. Nilai ketegaklurusan magnesium AZ31 dalam proses pengeboran sangat dipengaruhi pula oleh parameter pemotongan kadar pemakanan yang menghasilkan signifikansi P = 0,044 , sedangkan nilai signifikansi yang paling tinggi adalah interaksi antara kadar pemakanan 0,1 mm/rev dengan lubrikan sintetis  pada P = 0,041.",['TS'],,2019-05-14 08:22:40,archive,show,5.0,6,ANALISIS KEPRESISISAN LOBANG BOR  PADA PEMESINAN MAGNESIUM AZ31 MENGGUNAKAN METODE TAGUCHI,,['FT7'],article,,disk0/00/01/28/16,2019-04-10 00:00:00.000000000,"[{'name': {'given': 'Gusri Akhyar', 'lineage': None, 'family': 'Ibrahim', 'honourific': None}, 'id': 'gusri.akhyar@eng.unila.ac.id'}, {'id': 'yanuarb64@gmail.com', 'name': {'given': 'Burhanuddin', 'family': 'Yanuar', 'honourific': None, 'lineage': None}}]",,FLYWHEEL: JURNAL TEKNIK MESIN UNTIRTA,2019-05-14 08:22:40,29-33,2019-05-14 08:22:40,528,TRUE,http://repository.lppm.unila.ac.id/id/eprint/12816,public,Universitas Tirtayasa,"[{'rev_number': 1, 'uri': 'http://repository.lppm.unila.ac.id/id/document/25786', 'pos': 1, 'format': 'text', 'files': [{'fileid': 113013, 'mime_type': 'application/pdf', 'mtime': '2019-05-13 09:56:42', 'hash_type': 'MD5', 'filename': '5116-12154-1-PB.pdf', 'hash': '4e423725d7ef5b0b7b2e0285a9585f10', 'datasetid': 'document', 'filesize': 572045, 'objectid': 25786, 'uri': 'http://repository.lppm.unila.ac.id/id/file/113013'}], 'main': '5116-12154-1-PB.pdf', 'docid': 25786, 'mime_type': 'application/pdf', 'language': 'en', 'placement': 1, 'security': 'public', 'eprintid': 12816}]",pub,1,,,,,,,,,,,,,,,,,
24,published,22361,"Pengelasan merupakan proses penggabungan dua atau lebih logam dasar yang disatukan di permukaan kontaknya dengan atau tanpa zat penambah maupun pengisi.  Pengelasan terbagi menjadi dua kategori utama yaitu Liquid-State Weldingdan  Solid-State  Welding.  Friction Stir Welding merupakan salah satu contoh pengelasan Solid-State Welding (Non-Fusion Welding). Pengelasan FSW bias dilakukan pada dua buah benda yang jenisnya sama maupun yang jenisnya berbeda (dissimilar metal).  Aluminium adalah logam yang paling banyak terdapat di kerak bumi, dan unsur ketiga terbanyak setelah oksigen dan silikon. Aluminium adalah suatu unsur kimia yang terletak pada golongan 13 periode 3 dengan lambang Al dengan nomor atom 13.  Aluminium merupakan salah satu material yang sering digunakan sebagai bahan baku sambungan untuk pengelasan Friction Stir Welding. Friction Stir Welding (FSW) atau Las Gesek Puntir adalah proses pengelasan gesek yang memuntir tool dengan memanfaatkan energi panas dan penekanan tanpa zat penambah maupun pengisi hingga terjadi perubahan fasa pada logam dasar. Parameter proses pengelasan yang dilakukan pada penelitian ini adalah laju translasi tool yaitu, 16 mm/menit dan 22 mm/menit dengan putaran tool 2000 rpm menggunakan jenis indentor changing spiral form. Adapun pengujian yang dilakukan yaitu, pengujian tarik, pengujian kekerasan dan pengujian komposisi kimia. Hasil dari penelitian ini adalah ditemukan bahwa laju translasi tool, perlakuan panas dan kecepatan pengelasan sangat mempengaruhi sifat – sifat mekanik aluminium seri 1xxx dan seri 5xxx yang telas dilas. Laju translasi 22 mm/menit akan   meningkatkan   nilai   kekerasan   dan   kekuatan   tarik   yang  lebih   baik dibandingkan dengan laju translasi 16 mm/menit, namun tidak terlalu berdampak signifikan terhadap unsur-unsur kimiawi di dalamnya.",['TJ'],,2020-06-12 08:43:43,archive,show,5.0,6,PENGARUH KECEPATAN TOOL PADA DISSIMILAR METAL ALUMINIUM 1100 DAN 5052 TERHADAP KUALITAS HASIL PENGELASAN DENGAN METODE LAS GESEK PUNTIR (FRICTION STIR WELDING),http://journal.ubb.ac.id/index.php/machine,['FT7'],article,,disk0/00/02/23/61,2019-08-31 00:00:00.000000000,"[{'id': 'irza.sukmana@eng.unila.ac.id', 'name': {'lineage': None, 'honourific': None, 'family': 'Irza', 'given': 'Sukmana'}}]",2581-0138,"Machine; Jurnal Teknik Mesin Vol. 5 No. 1, Agustus 2019",2020-06-12 08:43:43,1-7,2020-06-12 08:43:43,464,TRUE,http://repository.lppm.unila.ac.id/id/eprint/22361,public,Universitas Bangka Belitung,"[{'mime_type': 'application/pdf', 'language': 'en', 'eprintid': 22361, 'security': 'public', 'placement': 1, 'format': 'text', 'pos': 1, 'uri': 'http://repository.lppm.unila.ac.id/id/document/35781', 'rev_number': 1, 'docid': 35781, 'main': 'jurnal deo renaldo s.pdf', 'files': [{'objectid': 35781, 'uri': 'http://repository.lppm.unila.ac.id/id/file/205449', 'datasetid': 'document', 'filesize': 372839, 'fileid': 205449, 'mime_type': 'application/pdf', 'mtime': '2020-06-12 06:54:32', 'hash_type': 'MD5', 'filename': 'jurnal deo renaldo s.pdf', 'hash': 'aba7cb8cb5bf5a3be603442196cd9bc6'}]}]",pub,1,,,,,['FT Unila'],,,,,,,,,,,,
25,published,45959,"Magnesium (Mg) and its alloys seem to be a potential biodegradable bone scaffold materials as their biocompatibility and mechanical properties fit to natural bone. Magnesium alloys as biomaterials have higher mechanical properties that may close to cancellous bone once composed and produced in a specific production route. Fabricating porous magnesium for bone scaffold material aims to reduce the rigidity and strength of the material by which the porous density can be adjusted to the original nature of the bone. It forms interconnected porosity, has physical and mechanical properties similar to cancellous bone. This paper describes the production and characterization of porous magnesium material for the potential application as bone scaffold through powder metallurgy technique with pieces of Titanium Wire Space Holder. Mg containing titanium pieces were then compacted and sintered before immersed in hydro fluoride acid solution to form a porous magnesium structure. Density and porosity, micro Vickers hardness, micro structure test and SEM-EDX were performed to prove the existing porous structure inside Mg metal. The result finds out that a good cooperation and a potential application for the fabrication of an inter-connected porous magnesium samples for cancellous bone implant.",['TJ'],,2022-10-25 06:52:37,archive,show,,8,Fabricating and Testing of Porous Magnesium Through Powder Metallurgy Technique using TWSH (Titanium Wire Space Holder) for Biodegradable Bone Scaffold Material,http://jesr.eng.unila.ac.id/index.php/ojs/article/view/18,['FT7'],other,https://doi.org/10.23960/jesr.v1i2.18,disk0/00/04/59/59,2019-12-01 00:00:00.000000000,"[{'name': {'lineage': None, 'family': 'Irza', 'honourific': None, 'given': 'Sukmana'}}, {'name': {'lineage': None, 'family': 'Shirley', 'honourific': None, 'given': 'Savetlana'}}, {'name': {'given': 'Burhanudin', 'lineage': None, 'honourific': None, 'family': 'Yanuar'}}, {'name': {'lineage': None, 'family': 'Mahruri Arif', 'honourific': None, 'given': 'Wicaksono'}}, {'name': {'honourific': None, 'family': 'Hadi', 'lineage': None, 'given': 'Nur'}}]",,,2022-10-25 06:52:37,,2022-10-25 06:52:37,464,,http://repository.lppm.unila.ac.id/id/eprint/45959,public,"Faculty of Engineering, Universitas Lampung","[{'eprintid': 45959, 'security': 'public', 'placement': 1, 'language': 'en', 'mime_type': 'application/pdf', 'main': 'JESR_Dec2019_Similarity_Irza.pdf', 'docid': 184776, 'files': [{'uri': 'http://repository.lppm.unila.ac.id/id/file/508859', 'objectid': 184776, 'filesize': 658687, 'datasetid': 'document', 'hash_type': 'MD5', 'mtime': '2022-10-25 05:58:40', 'hash': '9912356f962bba751e9d05fedeaff93b', 'filename': 'JESR_Dec2019_Similarity_Irza.pdf', 'fileid': 508859, 'mime_type': 'application/pdf'}], 'format': 'text', 'pos': 1, 'rev_number': 1, 'uri': 'http://repository.lppm.unila.ac.id/id/document/184776'}]",pub,,,,,,,,irza.sukmana@gmail.com,Journal of Engineering and Scientific Research (JESR),,,,,,,,,
26,submitted,13282,"Teknologi pengelasan merupakan salah satu teknik penggabungan dua atau lebih logam melalui atau tanpa pencairan permukaan kontak pada logam dasar yang akan disambungkan. Pengelasan tanpa pencairan permukaan logam yang akan disambungkan merupakan katagori solid-state welding (SSW) atau pengelasan pada fasa padat. Dalam proses pengelasan SSW, umumnya panas dihasilkan dari proses gesekan antar permukaan yang akan disambungkan hingga mencapai sekitar delapan per sepuluh atau 80% temperatur cair logam, kemudian diberikan gaya dorong untuk penyambungan bahan. Pengelasan SSW termasuk jenis pengelasan maju yang dalam prakteknya dapat menggunakan mesin-mesin produksi manufaktur, seperti: mesin bubut dan mesin frais. Kegiatan pengabdian masyarakat ini bertujuan untuk memberikan pengetahuan dasar dan peningkatan kemampuan pengelasan secara umum dan pengelasan gesek (friction welding) secara khusus kepada siswa dan guru Sekolah Menengah Kejuruan Negeri (SMKN) 1 Seputih Agung, Lampung Tengah. Selain itu, kegiatan pengabdian ini juga diharapkan dapat menjadi salah satu sarana peningkatan pemahaman dan awareness masyarakat terhadap Jurusan Teknik Mesin, Fakultas Teknik (FT) Universitas Lampung (Unila). Hasil pengabdian menunjukkan adanya peningkatan pengetahuan dasar peserta mengenai pengelasan sebesar 37,5%, dan pengelasan maju sebesar 80,6%, sedangkan peningkatan awareness Jurusan Teknik Mesin FT Unila sebesar 45,5%. Dengan adanya hasil yang positif tersebut, diharapkan kegiatan diseminasi teknologi maju oleh Dosen FT Unila dari berbagai jurusan diharapkan dapat ditingkatkan lagi di masa yang akan datang.",['TA'],,2019-08-01 07:22:59,archive,show,2019.0,6,"PENINGKATAN PENGETAHUAN DAN KEMAMPUAN DASAR PENGELASAN MAJU (ADVANCED WELDING) SISWA SEKOLAH MENENGAH KEJURUAN NEGERI (SMKN) 1 SEPUTIH AGUNG, KABUPATEN LAMPUNG TENGAH",,['FT7'],article,,disk0/00/01/32/82,1970-01-01 00:00:00.000002019,"[{'id': 'irza.sukmana@eng.unila.ac.id', 'name': {'honourific': None, 'family': 'Irza', 'lineage': None, 'given': 'Sukmana'}}, {'name': {'honourific': None, 'family': 'Sugiyanto', 'lineage': None, 'given': 'Sugiyanto'}, 'id': 'sugiyanto.1957@eng.unila.ac.id'}, {'name': {'given': 'Ahmad', 'lineage': None, 'honourific': None, 'family': 'Yudi Eka Rosano'}, 'id': 'yudi_95@yahoo.com'}]",,PROSIDING SEMNAS PENGABDIAN FT SENAPATI 2019,2019-08-01 07:22:59,1-5,2019-08-01 07:22:59,464,TRUE,http://repository.lppm.unila.ac.id/id/eprint/13282,public,Fakultas Teknik Unila,"[{'format': 'text', 'pos': 1, 'uri': 'http://repository.lppm.unila.ac.id/id/document/26280', 'rev_number': 1, 'docid': 26280, 'main': 'Makalah Senapati 2019 Irza.pdf', 'files': [{'objectid': 26280, 'uri': 'http://repository.lppm.unila.ac.id/id/file/116458', 'datasetid': 'document', 'filesize': 774998, 'mime_type': 'application/pdf', 'fileid': 116458, 'filename': 'Makalah Senapati 2019 Irza.pdf', 'hash': '3f9c854913caee28e86382b5af58f8cf', 'hash_type': 'MD5', 'mtime': '2019-05-24 09:04:32'}], 'mime_type': 'application/pdf', 'language': 'en', 'eprintid': 13282, 'security': 'public', 'placement': 1}]",inpress,1,,,,,['FT Unila'],,,,,,,,,,,,
27,published,38809,"Like in petroleum, geothermal has a high cost and risk in exploration, development including drilling and utilization. This needs a clear definition and understanding of the nature and characteristic of the system in question, so the increasing of investment cost and risk could be mitigated. Un-like in the petroleum industry, reservoir engineering and geoscience are intricately intertwined in geothermal. Considering this issue, in this study the author has integrated the results of reservoir engineering analysis with geoscience concept, to determine the up-flow zone, is a zone with high thermal potential and high permeability, so it can develop as geothermal field. It was conducted at a geothermal prospect in Indonesia located at the average 
altitudes of about 1000 meter above sea level (m.a.s.l), where 26 wells have been drilled. The research focus in characterising of the system, using wellbore temperatures and pressures measured. This will conclude the reservoir temperature and pressure as well as enthalpy, and up�flow zone by deploying several methods and approach: namely Horner temperature, BPD curve and Pivot concept, and thermal conductivity or heat transfer concept which applied in geo�science. The research includes a literature review on heat energy conversion to electricity based on reservoir temperature and or enthalpy approach, which is used to recommend the conversion system that can extract the heat efficiently. In addition, the question on location of the up-flow zone has been answered by this study, i.e. in the southern part of the field.",['TJ'],,2023-05-22 01:06:28,archive,show,1402.0,7,"Thermal characteristics of the X geothermal resources, and a 
recommendation on utilization possibility",doi:10.1088/1742-6596/1402/2/022057,['FT7'],article,10.1088/1742-6596/1402/2/022057,disk0/00/03/88/09,1970-01-01 00:00:00.000002019,"[{'id': 'krispudyastuti@trisakti.ac.id', 'name': {'given': 'Pudyastuti', 'family': 'K', 'honourific': None, 'lineage': None}}, {'name': {'lineage': None, 'honourific': None, 'family': 'Harmen', 'given': 'Harmen'}, 'id': 'harmen.1969@eng.unila.ac.id'}, {'name': {'lineage': None, 'family': 'M', 'honourific': None, 'given': 'Djumantara'}, 'id': None}, {'id': None, 'name': {'honourific': None, 'family': 'S', 'lineage': None, 'given': 'Fadhlurrahman'}}]",,Journal of Physics: Conference Series,2023-05-22 01:06:28,,2023-05-22 01:06:28,569,TRUE,http://repository.lppm.unila.ac.id/id/eprint/38809,public,IOP Publishing,"[{'placement': 1, 'security': 'public', 'eprintid': 38809, 'mime_type': 'application/pdf', 'language': 'en', 'files': [{'filename': 'Thermal characteristics of the X geothermal resources, and a recommendation on utilization possibility_2019_J._Phys.__Conf._Ser._1402_022057_Harmen.pdf', 'hash': '8c7bd518b45123679cd3a7ed53462eba', 'mtime': '2022-01-31 08:22:21', 'hash_type': 'MD5', 'mime_type': 'application/pdf', 'fileid': 438436, 'filesize': 990535, 'datasetid': 'document', 'uri': 'http://repository.lppm.unila.ac.id/id/file/438436', 'objectid': 159927}], 'main': 'Thermal characteristics of the X geothermal resources, and a recommendation on utilization possibility_2019_J._Phys.__Conf._Ser._1402_022057_Harmen.pdf', 'docid': 159927, 'uri': 'http://repository.lppm.unila.ac.id/id/document/159927', 'rev_number': 1, 'pos': 1, 'format': 'text'}]",pub,22057,,,,,"['Petroleum Engineering, FTKE, Universitas Trisakti, Jakarta, Indonesia', 'Mechanical Engineering, Universitas Lampung, Lampung, Indonesia', 'Petroleum Engineering, FTKE, Universitas Trisakti, Jakarta, Indonesia', 'Mechanical Engineering, Universitas Lampung, Lampung, Indonesia']",,,,,,,,,"[{'type': 'http://www.loc.gov/loc.terms/relators/AUT'}, {'type': 'http://www.loc.gov/loc.terms/relators/CTB'}, {'type': 'http://www.loc.gov/loc.terms/relators/RTM'}, {'type': 'http://www.loc.gov/loc.terms/relators/RTM'}]",,,
