,date_type,eprintid,abstract,subjects,related_url,status_changed,eprint_status,metadata_visibility,volume,rev_number,title,official_url,divisions,type,id_number,dir,date,creators,issn,publication,datestamp,pagerange,lastmod,userid,refereed,uri,full_text_status,publisher,documents,ispublished,number,event_location,event_title,event_type,pres_type,corp_creators,referencetext,contact_email,place_of_pub,funders,projects,keywords,succeeds,event_dates,contributors,patent_applicant,pages,isbn
28,published,13363,"An ASTM A29 steel was coated with aluminide by dipping in a molten Al bath at 700 °C for 16 s. The resistance of ASTM A29 steel to high-temperature oxidation drastically decreased upon oxidation at
850 °C for 12 h, whereas the oxidation resistance of the aluminised steel subjected to hot dipping was higher (by 25-fold). The external part of the aluminide layer, which consists of Fe2Al5, FeAl2, and FeAl (Cr, Si) phases scattered in the Fe2Al5 phase, was formed through the outward diffusion of Al and inward diffusion of Fe. The Fe2Al5 phase played an important role as a reservoir of Al atoms that form the alumina (Al2O3) scale, while Cr and Fe from the FeAl(Cr, Si) particles and accelerated the conversion of the metastable θ-Al2O3 phase to a stable α-Al2O3 phase. Consequently, the parabolic rate constants of aluminised steel decreased with extended oxidation time.",['TJ'],,2019-06-14 02:30:00,archive,show,6.0,7,The resistance of an aluminide coating on a high-strength ASTM A29 steel subjected to a temperature of 850 °C,https://doi.org/10.1088/2053-1591/ab2508,['FT7'],article,,disk0/00/01/33/63,2019-06-01 00:00:00.000000000,"[{'id': 'mbruddin@eng.unila.ac.id', 'name': {'family': 'Mohammad', 'honourific': None, 'lineage': None, 'given': 'Badaruddin'}}, {'id': 'sugiyanto.1957@eng.unila.ac.id', 'name': {'honourific': None, 'family': 'Sugiyanto', 'lineage': None, 'given': 'Sugiyanto'}}, {'name': {'given': 'Asmi', 'lineage': None, 'honourific': None, 'family': 'Dwi'}, 'id': 'asmid@yahoo.com'}]",,Materials Research Express,2019-06-14 02:30:00,,2019-06-14 02:30:00,1133,TRUE,http://repository.lppm.unila.ac.id/id/eprint/13363,public,IOP Publishing Ltd,"[{'placement': 1, 'security': 'public', 'eprintid': 13363, 'mime_type': 'application/pdf', 'language': 'en', 'files': [{'uri': 'http://repository.lppm.unila.ac.id/id/file/117096', 'objectid': 26379, 'filesize': 336672, 'datasetid': 'document', 'hash_type': 'MD5', 'mtime': '2019-06-12 20:19:32', 'hash': '312de71366ebdd9c355a82ae23e4729c', 'filename': 'Editorial Meyyappan 2014 Materials Research Express- P Badar.pdf', 'fileid': 117096, 'mime_type': 'application/pdf'}], 'main': 'Editorial Meyyappan 2014 Materials Research Express- P Badar.pdf', 'docid': 26379, 'rev_number': 1, 'uri': 'http://repository.lppm.unila.ac.id/id/document/26379', 'pos': 1, 'format': 'text'}, {'language': 'en', 'mime_type': 'application/pdf', 'placement': 2, 'security': 'public', 'eprintid': 13363, 'uri': 'http://repository.lppm.unila.ac.id/id/document/26380', 'rev_number': 1, 'pos': 2, 'format': 'text', 'files': [{'mime_type': 'application/pdf', 'fileid': 117098, 'filename': 'JOurnal International 05-06-2019 dari P Badar.pdf', 'hash': '5182a5099883975b4abdd663d663bf69', 'hash_type': 'MD5', 'mtime': '2019-06-12 20:19:47', 'datasetid': 'document', 'filesize': 1391961, 'objectid': 26380, 'uri': 'http://repository.lppm.unila.ac.id/id/file/117098'}], 'docid': 26380, 'main': 'JOurnal International 05-06-2019 dari P Badar.pdf'}]",pub,,,,,,,,mbruddin@eng.unila.ac.id,,,,,,,,,,
29,published,15463,"Pipa elbow merupakan salah satu komponen yang penting dalam sistem perpipaan. Disamping berfungsi untuk mengubah arah aliran fluida, pipa elbow juga berperan untuk menyerap ekspansi termal karena sifatnya yang lebih fleksibel dibandingkan dengan sebuah pipa lurus yang eqivalan. Sifat pipa elbow yang fleksibel ini adalah akibat dari ovalisasi (menjadi oval) penampangnya ketika menerima beban bending. Fleksibilitas yang baik ini juga dapat mengurangi tegangan akibat ekspansi termal. Dalam prakteknya, beban yang diterima oleh pipa elbow adalah beban bending (mechanical), beban termal dan tekanan internal (mechanical). Beban bending menyebabkan ovalisasi pada pipa elbow. Jika tekanan internal bekerja mengikuti beban bending, maka penampang yang tadinya oval akibat bending akan berkurang keovalannya (menuju lingkaran) dan pengurangan ini menunjukkan perilaku nonlinear. Sedangkan jika beban in-plane bending dan tekanan internal bekerja secara bersamaan pada pipa elbow, hubungan beban dan perpindahan radial tidak menunjukkan perilaku nonlinier. Pada kondisi actual di lapangan, beban yang diterima oleh pipa elbow adalah beban termal yang memberikan efek cenderung sama seperti akibat beban in-plane bending. Paper ini melaporkan hasil penelitian yang dilakukan untuk melihat perilaku nonlinier pipa elbow yang diberikan beban termal dan tekanan internal dibandingkan dengan beban in-plane bending dan tekanan internal. Penelitian ini dilakukan dengan metode elemen hingga menggunakan ANSYS Mechanical APDL. Material yang digunakan adalah titanium alloy (Ti-6Al-4V) dan diasumsikan berperilaku elastic-perfectly plastic. Hasil penelitian menunjukkan bahwa perilaku nonlinier terlihat signifikan pada pembebanan in-plane bending dan tekanan internal. Pada pembebanan in-plane bending dan tekanan internal, perpindahan radial suatu node adalah berlawanan. Jika perpindahan radial suatu node akibat bendng adalah positif, maka beban tekanan internal yang bekerja kemudian akan mengurangi perpindahan radial ini, memberikan efek yang berlawanan dengan perpindahan yang disebabkan oleh beban in-plane bending. Sedangkan pada pembebanan termal dan tekanan internal tidak menunjukkan perilaku nonlinier. Perpindahan radial suatu node akibat beban termal dan tekanan internal adalah searah. Tegangan akibat beban in-plane bending lebih besar dibandingkan dengan akibat beban termal. Tekanan internal meningkatkan tegangan yang disebabkan pembebanan termal dan mengurangi tegangan yang disebabkan pembebanan in-plane bending.",['TJ'],,2019-11-05 10:55:48,archive,show,12.0,7,Pengaruh Beban Thermal dan Mechanical Terhadap Perilaku Nonlinier Pipa Elbow Bertekanan,https://ojs.unud.ac.id/index.php/jem/article/view/51420,['FT7'],article,,disk0/00/01/54/63,2019-10-31 00:00:00.000000000,"[{'id': None, 'name': {'given': 'Nurcahya', 'lineage': None, 'family': 'Nugraha', 'honourific': None}}, {'id': 'asnawi.lubis@eng.unila.ac.id', 'name': {'lineage': None, 'family': 'Lubis', 'honourific': None, 'given': 'Asnawi'}}, {'name': {'given': 'Ahmad', 'honourific': None, 'family': ""Su'udi"", 'lineage': None}, 'id': None}]",2541-5328,Jurnal Energi dan Manufaktur,2019-11-05 10:55:48,,2019-11-05 10:55:48,457,TRUE,http://repository.lppm.unila.ac.id/id/eprint/15463,none,"Jurusan Teknik Mesin, Universitas Udayana",,pub,2,,,,,['Universitas Lampung'],,asnawi.lubis@eng.unila.ac.id,,,,"Pipa Elbow, Perilaku Nonlinier, Beban  Termal, In-Plane Bending",,,,,,
30,published,17293,"Pipa elbow merupakan salah satu komponen yang penting dalam sistem perpipaan. Disamping berfungsi untuk mengubah arah aliran fluida, pipa elbow juga berperan untuk menyerap ekspansi termal karena sifatnya yang lebih fleksibel dibandingkan dengan sebuah pipa lurus yang eqivalan. Sifat pipa elbow yang fleksibel ini adalah akibat dari ovalisasi (menjadi oval) penampangnya ketika menerima beban bending. Fleksibilitas yang baik ini juga dapat mengurangi tegangan akibat ekspansi termal. Dalam prakteknya, beban yang diterima oleh pipa elbow adalah beban bending (mechanical), beban termal dan tekanan internal (mechanical). Beban bending menyebabkan ovalisasi pada pipa elbow. Jika tekanan internal bekerja mengikuti beban bending, maka penampang yang tadinya oval akibat bending akan berkurang keovalannya (menuju lingkaran) dan pengurangan ini menunjukkan perilaku nonlinear. Sedangkan jika beban in-plane bending dan tekanan internal bekerja secara bersamaan pada pipa elbow, hubungan beban dan perpindahan radial tidak menunjukkan perilaku nonlinier. Pada kondisi actual di lapangan, beban yang diterima oleh pipa elbow adalah beban termal yang memberikan efek cenderung sama seperti akibat beban in-plane bending. Paper ini melaporkan hasil penelitian yang dilakukan untuk melihat perilaku nonlinier pipa elbow yang diberikan beban termal dan tekanan internal dibandingkan dengan beban in-plane bending dan tekanan internal. Penelitian ini dilakukan dengan metode elemen hingga menggunakan ANSYS Mechanical APDL. Material yang digunakan adalah titanium alloy (Ti-6Al-4V) dan diasumsikan berperilaku elastic-perfectly plastic. Hasil penelitian menunjukkan bahwa perilaku nonlinier terlihat signifikan pada pembebanan in-plane bending dan tekanan internal. Pada pembebanan in-plane bending dan tekanan internal, perpindahan radial suatu node adalah berlawanan. Jika perpindahan radial suatu node akibat bendng adalah positif, maka beban tekanan internal yang bekerja kemudian akan mengurangi perpindahan radial ini, memberikan efek yang berlawanan dengan perpindahan yang disebabkan oleh beban in-plane bending. Sedangkan pada pembebanan termal dan tekanan internal tidak menunjukkan perilaku nonlinier. Perpindahan radial suatu node akibat beban termal dan tekanan internal adalah searah. Tegangan akibat beban in-plane bending lebih besar dibandingkan dengan akibat beban termal. Tekanan internal meningkatkan tegangan yang disebabkan pembebanan termal dan mengurangi tegangan yang disebabkan pembebanan in-plane bending.",['TJ'],,2020-02-17 03:40:57,archive,show,12.0,10,"Perilaku Nonlinier Pipa Elbow Bertekanan dengan Beban Termal 
dan In-Plane Bending",https://ojs.unud.ac.id/index.php/jem/article/view/51420/32633,['FT7'],article,,disk0/00/01/72/93,2019-10-31 00:00:00.000000000,"[{'name': {'given': 'Nurcahya', 'honourific': None, 'family': 'Nugraha', 'lineage': None}, 'id': None}, {'id': 'asnawi.lubis@eng.unila.ac.id', 'name': {'family': 'Lubis', 'honourific': None, 'lineage': None, 'given': 'Asnawi'}}, {'id': None, 'name': {'given': 'Ahmad', 'lineage': None, 'family': 'Suudi', 'honourific': None}}]",2302-5255,Jurnal Energi dan Manufaktur,2020-02-17 03:40:57,82-86,2020-02-17 03:40:57,457,TRUE,http://repository.lppm.unila.ac.id/id/eprint/17293,public,Universitas Udayana,"[{'language': 'id', 'mime_type': 'application/pdf', 'content': 'published', 'eprintid': 17293, 'placement': 1, 'security': 'public', 'pos': 1, 'format': 'text', 'uri': 'http://repository.lppm.unila.ac.id/id/document/30402', 'rev_number': 2, 'docid': 30402, 'main': 'JEM_12_2_2019_Asnawi_Lubis.pdf', 'files': [{'datasetid': 'document', 'filesize': 377704, 'fileid': 146427, 'mime_type': 'application/pdf', 'hash_type': 'MD5', 'mtime': '2019-12-10 15:48:11', 'hash': '989687ed9b869324473c7f8979725b56', 'filename': 'JEM_12_2_2019_Asnawi_Lubis.pdf', 'objectid': 30402, 'uri': 'http://repository.lppm.unila.ac.id/id/file/146427'}]}]",pub,2,,,,,,,asnawi.lubis@eng.unila.ac.id,,,,"Pipa Elbow, Perilaku Nonlinier, Beban Termal, In-Plane Bending",,,,,,
31,published,15886,"AbstractProsthetic in its use generally causes problems for its users especially stumps that were injured due to their long-standing use and for that reason the study was conducted. This research uses resin and fiberglass as material of prosthetic  socket, accelerometer and gyroscope sensor as main sensor. Prosthetic  is made  equipped with an early warning system as a warning that prosthetic users have reached a safe limit so that users can minimize the occurrence of injuries to the stump. The result of this research is the weight of prosthetic end result of ± 1.2 kg with foot which have length ± 25 cm and width ± 8,8 cm and have height as big as ± 53,4 cm. The angle value used as the limit of number of steps in the early warning system obtained from this research is 34,750 
Keywords:prosthetic, accelerometer and gyroscope, angle, early warning system.",['TJ'],,2019-11-14 10:06:14,archive,show,14.0,6,Smart lower limb prosthetic based on accelerometer and gyroscope sensor with arduino microcontroller,http://jurnal.bkstm.org/index.php/jtmi/article/view/102,['FT7'],article,,disk0/00/01/58/86,2019-04-01 00:00:00.000000000,"[{'id': 'rzmhspks@gmail.com', 'name': {'given': 'Reza Mahesa', 'lineage': None, 'honourific': None, 'family': 'Paksi'}}, {'name': {'given': 'Ahmad', 'lineage': None, 'family': 'Suudi', 'honourific': None}, 'id': 'ahmad.suudi@eng.unila.ac.id'}, {'name': {'lineage': None, 'family': 'Martinus', 'honourific': None, 'given': 'Martinus'}, 'id': 'martinus@eng.unila.ac.id'}]",2597-7563.,Jurnal Teknik Mesin Indonesia,2019-11-14 10:06:14,5-9,2019-11-14 10:06:14,520,TRUE,http://repository.lppm.unila.ac.id/id/eprint/15886,public,BKSTM Indonesia,"[{'main': 'JTMI April 2019 Smart Limb.pdf', 'docid': 28977, 'files': [{'datasetid': 'document', 'filesize': 621047, 'fileid': 136280, 'mime_type': 'application/pdf', 'hash_type': 'MD5', 'mtime': '2019-11-07 06:59:54', 'hash': '5587140bb00252b014f872832d325dad', 'filename': 'JTMI April 2019 Smart Limb.pdf', 'objectid': 28977, 'uri': 'http://repository.lppm.unila.ac.id/id/file/136280'}], 'pos': 1, 'format': 'text', 'rev_number': 1, 'uri': 'http://repository.lppm.unila.ac.id/id/document/28977', 'eprintid': 15886, 'placement': 1, 'security': 'public', 'language': 'en', 'mime_type': 'application/pdf'}]",pub,1,,,,,,,,,,,,,,[{'type': 'http://www.loc.gov/loc.terms/relators/AUT'}],,,
32,published,27551,"Dalam melaksanakan aktifitas sehari-hari, sebagian dari kita menggunakan alat transportasi sepeda motor. Tak terkecuali para guru dan karyawan Pondok Pesantren Nurul Iman Kabupaten Pesawaran. Untuk menjamin aktivitas berjalan dengan baik, maka kita harus memastikan juga kendaraan yang dipakai dapat beroperasi dengan baik, serta harus dapat mengatasi masalah-masalah yang timbul pada kendaraannya secara cepat. Salah satu masalah yang sering dihadapi dalam berkendara menggunakan sepeda motor yaitu kempesnya ban motor. Untuk mengatasi hal ini, kita dapat menggunakan alat kompresor udara mini yang mudah dibuat, ekonomis, simpel, dan mudah digunakan. Mengingat besarnya manfaat alat ini maka dilakukanlah pelatihan pembuatan alat kompresor udara mini bagi para Guru dan Karyawan Pondok Pesantren Nurul Iman. Kegiatan pengabdian masyarakat ini bertujuan menambah pengetahuan tentang motor bakar dan kompresor udara mini sebagai alat bantu penambah udara pada ban sepeda motor serta dapat membuat, menggunakan, dan merawat alat kompresor udara mini tersebut. Hasil dari pengabdian ini menunjukkan adanya peningkatan pengetahuan tentang motor bakar sebesar 64,5%, kompresor sebesar 37%, alat kompresor udara mini sebesar 78,3%, dan pengetahuan tentang pembuatan, penginstalan, dan penggunaan serta perawatan alat kompresor udara mini sebesar 87%. Dari hasil yang positif tersebut, diharapkan kegiatan diseminasi penerapan teknologi dapat ditingkatkan lagi di masa yang akan datang",['TJ'],[{'url': 'http://senapati.eng.unila.ac.id/prosiding-2019/'}],2021-02-01 04:52:13,archive,show,1.0,6,"PELATIHAN PEMBUATAN ALAT KOMPRESOR UDARA MINI
PADA SEPEDA MOTOR SEBAGAI ALAT BANTU PENAMBAH UDARA PADA BAN BAGI GURU-GURU DAN KARYAWAN PONDOK PESANTREN NURUL IMAN DESA PURWOREJO KECAMATAN NEGERI KATON KABUPATEN PESAWARAN",http://senapati.eng.unila.ac.id/wp-content/uploads/2019/07/37.pdf,['FT7'],article,,disk0/00/02/75/51,2019-06-01 00:00:00.000000000,"[{'name': {'family': 'Risano', 'honourific': None, 'lineage': None, 'given': 'A.Yudi Eka'}, 'id': 'yudi_95@yahoo.com'}, {'name': {'given': 'Jorfri Boike', 'lineage': None, 'honourific': None, 'family': 'Sinaga'}, 'id': 'jorfri6@yahoo.com'}, {'name': {'given': 'M Dyan', 'lineage': None, 'family': 'Susila', 'honourific': None}, 'id': 'mdyan.susila@eng.unila.ac.id'}, {'id': None, 'name': {'family': 'Irawan', 'honourific': None, 'lineage': None, 'given': 'Dwi'}}]",2685-0427,PROSIDING SENAPATI SEMINAR NASIONAL PENGABDIAN KEPADA MASYARAKAT TEKNOLOGI DAN INOVASI Pengabdian Masyarakat di Era Revolusi Industri 4.0 dan Society 5.0,2021-02-01 04:52:13,135-139,2021-02-01 04:52:13,27,TRUE,http://repository.lppm.unila.ac.id/id/eprint/27551,public,Fakultas Teknik Unila,"[{'format': 'text', 'pos': 1, 'rev_number': 1, 'uri': 'http://repository.lppm.unila.ac.id/id/document/41564', 'main': 'PELATIHAN PEMBUATAN ALAT KOMPRESOR UDARA MINI.pdf', 'docid': 41564, 'files': [{'datasetid': 'document', 'filesize': 214866, 'fileid': 246181, 'mime_type': 'application/pdf', 'hash_type': 'MD5', 'mtime': '2021-01-29 11:12:44', 'hash': 'd50b4091c2fa0400560b2ce6afa1287f', 'filename': 'PELATIHAN PEMBUATAN ALAT KOMPRESOR UDARA MINI.pdf', 'objectid': 41564, 'uri': 'http://repository.lppm.unila.ac.id/id/file/246181'}], 'language': 'en', 'mime_type': 'application/pdf', 'eprintid': 27551, 'security': 'public', 'placement': 1}]",pub,,,,,,,,,,,,,,,,,,
33,submitted,12916,"Provinsi Lampung adalah salah satu provinsi di Indonesia yang lahan pertaniannya cukup luas. Salah satu permasalahan yang terjadi di lahan pertanian Provinsi Lampung yaitu kubutuhan air yang belum tercukupi. Walaupun di beberapa daerah telah terdapat sistem irigasi, namun tidak semua air tersebut dapat terdistribusi dengan baik seperti yang dapat dilihat pada Kelurahan Sumberrejo. Di Kelurahan ini sebagian tempat lahan pertaniannya lebih tinggi dari pada permukaan aliran air sehingga menyebabkan air tidak dapat mengalir ke lahan pertanian tersebut. Salah satu solusi yang dapat digunakan untuk mengatasi masalah tersebut yaitu menggunakan pompa hydram (hydraulic ram pump). Pompa hydram tidak menggunakan bahan bakar sebagai sumber suplai namun pompa hydram menggunakan energi potensial air itu sendiri untuk menaikkan sebagian air tersebut hingga ke ketinggian yang diinginkan. Pada makalah ini diberikan  pembangunan model sistem irigasi persawahan menggunakan teknologi pompa hydram di Kelurahan Sumberrejo.",['TJ'],,2019-05-16 03:46:18,archive,show,,6,PENERAPAN TEKNOLOGI POMPA TANPA MOTOR (HYDRAULIC RAM PUMP) UNTUK MEMBANTU  IRIGASI PERSAWAHAN MASYARAKAT DI KELURAHAN SUMBERREJO BANDAR LAMPUNG,,['FT7'],article,,disk0/00/01/29/16,2019-02-20 00:00:00.000000000,"[{'name': {'lineage': None, 'honourific': None, 'family': 'Sinaga', 'given': 'Jorfri Boike'}, 'id': 'jorfri6@yahoo.com'}, {'id': None, 'name': {'lineage': None, 'family': 'Supriadi', 'honourific': None, 'given': 'Harnowo'}}, {'id': 'rianti_dc@yahoo.com', 'name': {'lineage': None, 'honourific': None, 'family': 'Tanti', 'given': 'Novri'}}]",,kompasiana,2019-05-16 03:46:18,,2019-05-16 03:46:18,984,TRUE,http://repository.lppm.unila.ac.id/id/eprint/12916,public,,"[{'pos': 1, 'format': 'text', 'rev_number': 1, 'uri': 'http://repository.lppm.unila.ac.id/id/document/25901', 'docid': 25901, 'main': 'Publikasi Media Massa-1.pdf', 'files': [{'filename': 'Publikasi Media Massa-1.pdf', 'hash': '18e7b8ce13477bdd644c93a3d20b6285', 'hash_type': 'MD5', 'mtime': '2019-05-15 04:17:58', 'mime_type': 'application/pdf', 'fileid': 113940, 'filesize': 322090, 'datasetid': 'document', 'uri': 'http://repository.lppm.unila.ac.id/id/file/113940', 'objectid': 25901}], 'language': 'en', 'mime_type': 'application/pdf', 'eprintid': 12916, 'placement': 1, 'security': 'public'}]",submitted,,,,,,,,,,,,,,,,,,
34,submitted,16081,"Provinsi Lampung merupakan daerah penghasil beras, tetapi penanaman padi di wilayah ini sering mengalami gagal panen akibat defisit air. Hal ini disebabkan oleh banyak daerah pertanian masih belum memiliki sistem irigasi seperti yang ditemukan di Sumberrejo, kecamatan kemiling. Solusi yang digunakan untuk memenuhi ketersediaan air adalah menggunakan teknologi pompa hydram. Dengan adanya pompa hydram dapat digunakan untuk membantu petani mengairi area pertanian mereka tanpa menggunakan mesin atau motor listrik. Hasil pengujian kinerja model pompa hydram, dengan head pasokan 1,5m dan delivery head 7m, maka diameter dan panjang pipa pasokan sebesar 2in. dan 11,3m. Berat dan diameter katup limbah sebesar 0,32kg dan 4,6cm, dan volume ruang udara 4,771cm3. Hasil pengujian diperoleh 4.182lit/min (6m3/hari). Dan jika 2 pompa digunakan 24 jam, total air dipompa 12m3/hari. Jumlah a ir ini dapat digunakan untuk mengairi lahan sawah sekitar 300 m2",['TJ'],,2019-11-14 10:10:56,archive,show,,6,Penerapan teknologi pompa tanpa motor (hydraulic ram pump) untuk membantu irigasi pertanian masyarakat di Sumberrejo Kecamatan Kemiling Bandar Lampung,,['FT7'],article,,disk0/00/01/60/81,2019-09-25 00:00:00.000000000,"[{'name': {'given': 'Jorfri Boike', 'lineage': None, 'honourific': None, 'family': 'Sinaga'}, 'id': 'jorfri6@yahoo.com'}, {'id': 'rianti_dc@yahoo.com', 'name': {'given': 'Novri', 'family': 'Tanti', 'honourific': None, 'lineage': None}}, {'id': 'mdyan.susila@eng.unila.ac.id', 'name': {'family': 'Susila', 'honourific': None, 'lineage': None, 'given': 'M Dyan'}}, {'name': {'given': 'Raja Aman', 'lineage': None, 'honourific': None, 'family': 'Simarmata'}, 'id': None}]",,"Prosiding Seminar Nasiona lHasil Penelitian Sains, Teknik, danAplikasiIndustri 2019",2019-11-14 10:10:56,,2019-11-14 10:10:56,984,TRUE,http://repository.lppm.unila.ac.id/id/eprint/16081,public,,"[{'format': 'text', 'pos': 1, 'uri': 'http://repository.lppm.unila.ac.id/id/document/29179', 'rev_number': 1, 'main': 'Makalah 1.pdf', 'docid': 29179, 'files': [{'datasetid': 'document', 'filesize': 264225, 'fileid': 137795, 'mime_type': 'application/pdf', 'hash_type': 'MD5', 'mtime': '2019-11-12 05:08:23', 'filename': 'Makalah 1.pdf', 'hash': '89846061041b0ab5f34dc0f5a6219808', 'objectid': 29179, 'uri': 'http://repository.lppm.unila.ac.id/id/file/137795'}], 'language': 'en', 'mime_type': 'application/pdf', 'eprintid': 16081, 'security': 'public', 'placement': 1}]",inpress,,,,,,,,,,,,,,,,,,
35,,13741,hasil penilaian sejawat sebidang atau peer review,['TJ'],,2019-08-07 03:45:21,archive,show,,6,Improvement of Low-cycle fatigue resistance in ISI 4140 steel by anneling treatment,,['FT7'],article,,disk0/00/01/37/41,1970-01-01 00:00:00.000002019,"[{'name': {'family': 'Sugiyanto', 'honourific': None, 'lineage': None, 'given': 'Sugiyanto'}, 'id': 'sugiyanto.1957@eng.unila.ac.id'}]",406–417,International Journal of Fatigue,2019-08-07 03:45:21,,2019-08-07 03:45:21,1133,TRUE,http://repository.lppm.unila.ac.id/id/eprint/13741,public,Elsevier,"[{'eprintid': 13741, 'security': 'public', 'placement': 1, 'language': 'en', 'mime_type': 'application/pdf', 'main': '1. Scan Review Improvement of Low.... 1-4.pdf', 'docid': 26753, 'files': [{'hash': '857c4a12ecddcbb3ab2a222c06aa90d7', 'filename': '1. Scan Review Improvement of Low.... 1-4.pdf', 'mtime': '2019-08-07 02:58:59', 'hash_type': 'MD5', 'mime_type': 'application/pdf', 'fileid': 119834, 'filesize': 999165, 'datasetid': 'document', 'uri': 'http://repository.lppm.unila.ac.id/id/file/119834', 'objectid': 26753}], 'format': 'text', 'pos': 1, 'uri': 'http://repository.lppm.unila.ac.id/id/document/26753', 'rev_number': 1}]",pub,,,,,,['universitas lampung'],,,,,,,,,,,,
36,submitted,13375,"Panduan Diklat Pengembangan Kompetensi Profesional Dosen Vokasi (PKPB-DV) ini difungsikan untuk memberikan arah kepada para dosen agar dapat dengan mudah mengembangan kompetensi profesionalnya. Dengan panduan ini para dosen akan lebih terpacu untuk menjalankan Tridarma Perguruan Tinggi yang dibarengi dengan kompetensi pedagogik, kompetensi profesional, kompetensi kepribadian, dan kompetensi sosial, serta kinerja, integritas, etika, tata krama, dan tanggung jawab dalam bertugas.",['TJ'],[{'type': 'author'}],2019-06-14 08:08:20,archive,show,,7,Panduan Diklat Pengembangan Kompetensi Profesional Berkelanjutan Dosen Vokasi,,['FT7'],patent,143532,disk0/00/01/33/75,2019-06-01 00:00:00.000000000,"[{'id': 'sugiyanto.1957@eng.unila.ac.id', 'name': {'family': 'Sugiyanto', 'honourific': None, 'lineage': None, 'given': 'Sugiyanto'}}]",,,2019-06-14 08:08:20,,2019-06-14 08:08:20,1133,,http://repository.lppm.unila.ac.id/id/eprint/13375,public,,"[{'main': 'sertifikat_EC00201942068 11 Juni 2019 Sugiyanto.pdf', 'docid': 26391, 'files': [{'hash_type': 'MD5', 'mtime': '2019-06-14 07:34:14', 'filename': 'sertifikat_EC00201942068 11 Juni 2019 Sugiyanto.pdf', 'hash': 'fcc17beb3e26ee622f98ab86d537e279', 'fileid': 117180, 'mime_type': 'application/pdf', 'filesize': 777455, 'datasetid': 'document', 'uri': 'http://repository.lppm.unila.ac.id/id/file/117180', 'objectid': 26391}], 'format': 'text', 'pos': 1, 'uri': 'http://repository.lppm.unila.ac.id/id/document/26391', 'rev_number': 1, 'eprintid': 13375, 'security': 'public', 'placement': 1, 'mime_type': 'application/pdf', 'language': 'en'}]",pub,,,,,,,,,,,,,,,,Model,1.0,
37,published,13781,Hasil penilaian sejawat sebidang atau peer review,['TJ'],,2019-08-12 02:45:21,archive,show,,7,Panduan Diklat Pengembangan Kompetensi Profesional berkelanjutan Dosen Vokasi,http://repository.lppm.unila.ac.id/13375/,['FT7'],article,,disk0/00/01/37/81,1970-01-01 00:00:00.000002019,"[{'id': 'sugiyanto.1957@eng.unila.ac.id', 'name': {'given': 'Sugiyanto', 'lineage': None, 'honourific': None, 'family': 'Sugiyanto'}}]",EC00201809588,Hak Cipta,2019-08-12 02:45:21,,2019-08-12 02:45:21,1133,TRUE,http://repository.lppm.unila.ac.id/id/eprint/13781,public,Kementerian Hukum dan Hak Asasi Manusia,"[{'security': 'public', 'placement': 1, 'eprintid': 13781, 'language': 'en', 'mime_type': 'application/pdf', 'files': [{'datasetid': 'document', 'filesize': 809560, 'mime_type': 'application/pdf', 'fileid': 120120, 'hash': '76ec3438b96be78ebaefdf16ad9d0c9a', 'filename': '19. Scan Review HKI Panduan ............   73-76.pdf', 'mtime': '2019-08-08 18:46:17', 'hash_type': 'MD5', 'objectid': 26795, 'uri': 'http://repository.lppm.unila.ac.id/id/file/120120'}], 'docid': 26795, 'main': '19. Scan Review HKI Panduan ............   73-76.pdf', 'uri': 'http://repository.lppm.unila.ac.id/id/document/26795', 'rev_number': 1, 'format': 'text', 'pos': 1}]",pub,,,,,,['Universitas Lampung'],,,,,,,,,,,,
