,date_type,eprintid,abstract,subjects,related_url,status_changed,eprint_status,metadata_visibility,volume,rev_number,title,official_url,divisions,type,id_number,dir,date,creators,issn,publication,datestamp,pagerange,lastmod,userid,refereed,uri,full_text_status,publisher,documents,ispublished,number,event_location,event_title,event_type,pres_type,corp_creators,referencetext,contact_email,place_of_pub,funders,projects,keywords,succeeds,event_dates,contributors,patent_applicant,pages,isbn
13,published,24283,"The low-cycle fatigue (LCF) behaviour of AISI 4140 steel under annealed and as-received conditions was investigated at room temperature. The annealing treatment causes a marked decrease in mechanical strength but an increase in plastic energy and ductility. The annealing treatment of AISI 4140 steel significantly increases the LCF resistance of the material. In addition, the steel exhibits a transitional behaviour from initial cyclic softening to stable cyclic hardening with increasing strain amplitude. By contrast, the as-received AISI 4140 steel undergoes progressive cyclic softening until failure. Microstructural changes induced in the annealed steel cause near-Masing-type behaviour at low and high strain amplitudes. The enhancement of the LCF resistance of the annealed steel is attributed to the high magnitude of the compressive stress, which is dependent on the applied strain amplitude. A good correlation of the total failure cycles with plastic strain and elastic strain provides a precise equation model for predicting the LCF life of annealing-treated AISI 4140 steel.","['TJ', 'TL']",,2020-10-09 14:07:51,archive,show,125.0,8,Improvement of low-cycle fatigue resistance in AISI 4140 steel by annealing treatment,https://www.sciencedirect.com/journal/international-journal-of-fatigue,['FT7'],article,https://doi.org/10.1016/j.ijfatigue.2019.04.020,disk0/00/02/42/83,2019-08-01 00:00:00.000000000,"[{'name': {'given': 'Mohammad', 'honourific': None, 'family': 'Badaruddin', 'lineage': None}, 'id': 'mbruddin@eng.unila.ac.id'}, {'id': 'sugiyanto.1957@eng.unila.ac.id', 'name': {'given': 'Sugiyanto', 'honourific': None, 'family': 'Sugiyanto', 'lineage': None}}, {'id': 'herryw22@gmail.com', 'name': {'given': 'Herry', 'lineage': None, 'honourific': None, 'family': 'Wardono'}}, {'id': 'andoko.ft@um.ac.id', 'name': {'family': 'Andoko', 'honourific': None, 'lineage': None, 'given': 'Andoko'}}, {'name': {'family': 'Wang', 'honourific': None, 'lineage': None, 'given': 'Chaur Chaur'}, 'id': 'cjwang@mail.ntust.edu.tw'}, {'id': 'rivai.abukhalid@batan.go.id', 'name': {'given': 'Abu Khalid', 'lineage': None, 'family': 'Rivai', 'honourific': None}}]",0142-1123,International Journal of Fatigue,2020-10-09 14:07:51,406-417,2020-10-09 14:07:51,451,TRUE,http://repository.lppm.unila.ac.id/id/eprint/24283,public,Elsevier,"[{'format': 'text', 'pos': 1, 'uri': 'http://repository.lppm.unila.ac.id/id/document/38001', 'rev_number': 1, 'main': 'Improvement of low-cycle fatigue resistance in AISI 4140 steel by annealing treatment.pdf', 'docid': 38001, 'files': [{'objectid': 38001, 'uri': 'http://repository.lppm.unila.ac.id/id/file/220997', 'mime_type': 'application/pdf', 'fileid': 220997, 'hash': 'b516afa955c5e9b2ecf0bbb4ce00dc7b', 'filename': 'Improvement of low-cycle fatigue resistance in AISI 4140 steel by annealing treatment.pdf', 'mtime': '2020-10-08 13:40:18', 'hash_type': 'MD5', 'datasetid': 'document', 'filesize': 5076633}], 'mime_type': 'application/pdf', 'language': 'en', 'eprintid': 24283, 'security': 'public', 'placement': 1}]",pub,,,,,,,,,,,,,,,,,,
14,completed,18796,"Pembukaan usaha skala industry rumah tangga (home industry) yang bergerak dibidang
pengelasan terbukti menjadi usaha yang mampu bertahan ditengah kondisi krisis ekonomi
sekarang ini. Kebutuhan bahan dari baja meningkat dari tahun ketahun karena pertambahan
jumlah penduduk khsususnya di wilayah Propinsi Lampung yang membutuhkan tambahan
aksesories rumah untuk alasan keamanan dan estetika seperti: pagar besi, tralis dan kanopi.
Peluang untuk membuka usaha pengelasan baja dan bahan logam lain cukup menjanjikan
sebagai wirausaha mandiri bagi lulusan SMK. Oleh karena itu, keterampilan dan pengetahuan
tentang pengelasan pelat baja posisi horisontal (1G) dapat diberikan melalui program
pengabdian kepada masyarakat (PkM) Universitas Lampung kepada calon lulusan SMK,
khususnya di siswa kelas 3 SMK BLK Bandar Lampung.
Ketrampilan dalam mengelas baja posisi horizontal dapat dicapai melalui pelatihan
yang cukup dengan pemahaman dasar proses pengelasan. Pelatihan pengelasan ini diberikan
secara teori dan praktek. Sebelum teori siswa diberikan pre-tests untuk melihat sampai sejauj
mana siswa paham tentang proses pengelasan dan jenis-jenis pengelasaa. Pemberian materi
teori dasar pengelasan diberikan secara tutorial melalui komunikasi interaktif antara dosen
pemateri dan siswa. Kemudian praktek pengalasan diberikan setiap siswa mulai cara memilih
jenis elektroda, mengatur arus listrik yang tepat, meletakan posisi grounding dan mengetahui
apakah elektroda dan arus sudah terpasang. Ujian praktek pengelasan secara acak diberikan
kepada siswa sebanyak 5 orang untuk melalukan pengelasan yang sebenarnya. Hasil
pemgelasan dilakukan analisis secara visual. Kesimpulan yang diperoleh semangat siswa untuk
mampu trampil dalam mengelas baja posisi horizontal relatif tinggi meskipun hasil pengelasan
benda kerja belum menunjukan hasil yang standar.",['TJ'],,2020-03-19 01:05:50,archive,show,,7,MENINGKATKAN KEMAMPUAN PENGELASAN SISWA SMK BLK BANDAR LAMPUNG DENGAN PELATIHAN PENGELASAN HORISONTAL PADA PELAT BAJA,,['FT7'],other,,disk0/00/01/87/96,2019-11-05 00:00:00.000000000,"[{'id': 'mbruddin@eng.unila.ac.id', 'name': {'given': 'Mohammad', 'family': 'Badaruddin', 'honourific': None, 'lineage': None}}, {'name': {'honourific': None, 'family': 'Zulhanif', 'lineage': None, 'given': 'zulhanif'}, 'id': 'zulhanif1973@gmail.cim'}, {'name': {'given': 'Harnowo', 'family': 'Supriadi', 'honourific': None, 'lineage': None}, 'id': 'harnowo1969@gmail.com'}, {'name': {'given': 'Ruwanto', 'lineage': None, 'honourific': None, 'family': 'Ruwanto'}, 'id': 'wanto80@gmail.com'}]",,,2020-03-19 01:05:50,,2020-03-19 01:05:50,451,,http://repository.lppm.unila.ac.id/id/eprint/18796,public,LPPM UNILA,"[{'security': 'public', 'placement': 1, 'eprintid': 18796, 'mime_type': 'application/pdf', 'language': 'en', 'files': [{'uri': 'http://repository.lppm.unila.ac.id/id/file/157793', 'objectid': 31992, 'hash': '0864fa1af35bd947dab81a1e13881979', 'filename': 'LAPORAN PkM_DIPA FT_DI SMK BLK BANDAR LAMPUNG 2019.pdf', 'mtime': '2020-03-18 04:15:21', 'hash_type': 'MD5', 'mime_type': 'application/pdf', 'fileid': 157793, 'filesize': 5436644, 'datasetid': 'document'}], 'main': 'LAPORAN PkM_DIPA FT_DI SMK BLK BANDAR LAMPUNG 2019.pdf', 'docid': 31992, 'uri': 'http://repository.lppm.unila.ac.id/id/document/31992', 'rev_number': 1, 'format': 'text', 'pos': 1}]",unpub,,,,,,,,,,,,,,,,,,
15,published,12960,"This paper presents the low cycle fatigue properties of an extruded 6061 aluminum
alloy. The cyclic strain-controlled fatigue tests were performed under fully reversed total strain
amplitudes ranging from 0.5% to 1.3% at a fixed strain rate of 0.004 s�1 using smooth
specimens cyclically loaded along with the extrusion directions. The fatigue test results
represented by the hysteresis curves of stress-strain show slight Bauschinger effect at the total
strain amplitudes (��at) � 0.7 %. The corresponding cyclic strain response revealed that the
alloy underwent cyclic softening particularly at the lower strain amplitude (��at �0.7%) and at
the higher strain amplitudes, the alloy tended to undergo cyclic hardening. The strain-fatigue
life models were empirically determined by the Coffin-Manson-Basquin relationships.","['TJ', 'TL']",,2019-05-16 03:47:20,archive,show,1198.0,7,"Low Cycle Fatigue Properties of Extruded 6061-T6
Aluminum Alloy",https://iopscience.iop.org/article/10.1088/1742-6596/1198/3/032002/meta,['FT7'],article,10.1088/1742-6596/1198/3/032002,disk0/00/01/29/60,2019-04-01 00:00:00.000000000,"[{'name': {'family': 'Badaruddin', 'honourific': None, 'lineage': None, 'given': 'Mohammad'}, 'id': 'mbruddin@eng.unila.ac.id'}, {'id': 'zulhanif1973@gmail.com', 'name': {'given': 'Zulhanif', 'honourific': None, 'family': 'zulhanif', 'lineage': None}}, {'name': {'family': 'Supriadi', 'honourific': None, 'lineage': None, 'given': 'Harnowo'}, 'id': 'harnowo1969@gmail.com'}]",1742-6596,Journal of Physics: Conference Series,2019-05-16 03:47:20,1-6,2019-05-16 03:47:20,451,TRUE,http://repository.lppm.unila.ac.id/id/eprint/12960,public,IOP Publishing,"[{'eprintid': 12960, 'security': 'public', 'placement': 1, 'mime_type': 'application/pdf', 'language': 'en', 'docid': 25943, 'main': 'Badaruddin_2019_J._Phys.__Conf._Ser._1198_032002.pdf', 'files': [{'mime_type': 'application/pdf', 'fileid': 114190, 'filename': 'Badaruddin_2019_J._Phys.__Conf._Ser._1198_032002.pdf', 'hash': '12d532cde2e65afe6c5fde4032a53799', 'mtime': '2019-05-16 02:51:16', 'hash_type': 'MD5', 'datasetid': 'document', 'filesize': 816672, 'objectid': 25943, 'uri': 'http://repository.lppm.unila.ac.id/id/file/114190'}], 'format': 'text', 'pos': 1, 'uri': 'http://repository.lppm.unila.ac.id/id/document/25943', 'rev_number': 1}]",inpress,3,,,,,,,,,['Kemeristekdikti'],,Al 6061-T6;low cycle fatigue;strain softening;strain hardening,,,,,,
16,,21516,"Husk is a waste from the grinding process with the characteristics of a hard, scaly and dry layer. In the rice milling process, according to the Agricultural Research and Development Agency, the Department of Agriculture obtained 20-30% of rice husk, 8-12% of bran and 50 - 63.5% of milled rice. It can be seen that the amount of waste produced is predominantly dominated by rice husk and if not handled it will be a problem for the environment. One effort to reduce the form of waste was carried out research design of rice husk grinding machine become powder. The implementation method starts with designing, manufacturing and testing. The design of the grinding machine is planned to use a fuel motor drive, the transmission uses a V belt and the type of grinder is a combination of discmill and hammermill.The results of research and design obtained rice husk grinding machine with specifications dimensions of 1100 mm high, 400 mm long and 500 mm wide, Hyundai gasoline engine drive HDE 390 with power 7.6 kW, elbow profile frame 50 mm x 50 mm, belt transmission and pulley with a ratio of 1: 1, a combination milling mechanism namely hammer mills which have 3 single hammer attrition mills and a front through grinder with the help of screw conveyor components. The test results of the grinding machine capacity obtained a production capacity of 10 kg / hour, and fuel consumption which is 2.162 liters / hour.",['TJ'],,2020-06-02 13:55:28,archive,show,14.0,6,Perancangan mesin penghancur sekam padi dengan poros penggerak horisontal,http://doi.org/10.36289/jtmi.v14i2.115,['FT7'],article,doi:10.36289/jtmi.v14i2.115,disk0/00/02/15/16,1970-01-01 00:00:00.000002019,"[{'name': {'family': 'Budiyanto', 'honourific': None, 'lineage': None, 'given': 'Prasetyo'}, 'id': None}, {'id': 'zulhendri.h@eng.unila.ac.id', 'name': {'given': 'Zulhendri', 'honourific': None, 'family': 'Zulhendri', 'lineage': None}}, {'id': None, 'name': {'family': 'Akmal', 'honourific': None, 'lineage': None, 'given': 'Jamiatul'}}, {'name': {'given': 'Novri', 'family': 'Tanti', 'honourific': None, 'lineage': None}, 'id': None}, {'id': None, 'name': {'honourific': None, 'family': 'Suudi', 'lineage': None, 'given': 'Ahmad'}}]",1907-350X,Jurnal Teknik Mesin Indonesia,2020-06-02 13:55:28,37,2020-06-02 13:55:28,334,TRUE,http://repository.lppm.unila.ac.id/id/eprint/21516,public,,"[{'files': [{'fileid': 199610, 'mime_type': 'application/pdf', 'hash_type': 'MD5', 'mtime': '2020-06-02 12:48:13', 'filename': '115-1-233-1-10-20191007.pdf', 'hash': 'a3261fc814915bb10d8fa26472e48eb7', 'datasetid': 'document', 'filesize': 351592, 'objectid': 34913, 'uri': 'http://repository.lppm.unila.ac.id/id/file/199610'}], 'main': '115-1-233-1-10-20191007.pdf', 'docid': 34913, 'uri': 'http://repository.lppm.unila.ac.id/id/document/34913', 'rev_number': 1, 'format': 'text', 'pos': 1, 'security': 'public', 'placement': 1, 'eprintid': 21516, 'mime_type': 'application/pdf', 'language': 'en'}]",pub,2,,,,,,,,,,,,,,,,,
17,published,20650,"Kopi merupakan salah satu jenis tanaman perkebunan yang sudah lama dibudidayakan di provinsi Lampung, karena memiliki nilai ekonomi yang tinggi. Dalam pengolahan kopi pada olahan kopi bubuk secara industri kualitas kopi bubuk dipengaruhi kualitas penyangraian. Salah satu kendala yang menyebabkan rendahnya mutu biji kopi hasil olahan petani salah satunya dikarenakan panas penyangraian yang tidak merata dan tidak adanya pengontrolan suhu dalam penyangraian manual akibatnya terjadi panas berlebih yang menyebabkan distribusi panas pada biji kopi tidak merata dan biji kopi lebih cepat menghitam. Untuk menanggulangi masalah tersebut perlu mesin pemilah biji kopi sangrai dengan sistem otomasi berdasarkan parameter suhu dan warna kopi. Penyelesaian rancang bangun ini dilakukan dengan 2 tahapan yaitu perancangan konveyor sabuk dan perancangan otomasi. Setelah peralatan sudah difabrikasi selanjutnya dilakukan pengujian kapasitas angkut. Setelah itu dilakukan pengujian penginderaan suhu dan warna kopi sangrai. Pengujian penginderaan suhu menggunakan kamera termografi Cheap Thermocam V4 yang terhubung ke komputer. Pengujian warna kopi diperoleh intensitas warna yang berkaitan dengan warna fisik kopi dan suhunya.","['TJ', 'TS']",,2020-05-27 03:33:18,archive,show,,4,The design of a roasted coffee sorter system in order to control the quality of roasted coffee automatically based on the analysis of the thermographic image and color of roasted coffee,http://prosiding.bkstm.org/prosiding/2019/TM16.pdf,['FT7'],conference_item,,disk0/00/02/06/50,2019-11-01 00:00:00.000000000,"[{'name': {'given': 'Yanuar', 'lineage': None, 'family': 'Burhanuddin', 'honourific': None}}, {'name': {'given': 'Ade Salfa', 'lineage': None, 'family': 'Nugraha', 'honourific': None}}, {'name': {'honourific': None, 'family': 'Maulana', 'lineage': None, 'given': 'Masagus Imran'}}, {'name': {'lineage': None, 'honourific': None, 'family': 'Harun', 'given': 'Suryadiwansa'}}, {'name': {'family': 'Suudi', 'honourific': None, 'lineage': None, 'given': 'Ahmad'}}]",,,2020-05-27 03:33:18,1-6,2020-05-27 03:33:18,68,TRUE,http://repository.lppm.unila.ac.id/id/eprint/20650,public,,"[{'eprintid': 20650, 'placement': 1, 'security': 'public', 'language': 'en', 'mime_type': 'application/pdf', 'main': 'TM16.pdf', 'docid': 33995, 'files': [{'filesize': 622682, 'datasetid': 'document', 'hash': '99fe5f6ab000b7d4d2159ec866192cb7', 'filename': 'TM16.pdf', 'mtime': '2020-05-23 17:40:22', 'hash_type': 'MD5', 'mime_type': 'application/pdf', 'fileid': 193652, 'uri': 'http://repository.lppm.unila.ac.id/id/file/193652', 'objectid': 33995}], 'pos': 1, 'format': 'text', 'rev_number': 2, 'uri': 'http://repository.lppm.unila.ac.id/id/document/33995'}]",pub,,"Kampus Univ. Trisakti, Jakarta",Seminar Nasional Tahunan Teknik Mesin (SNTTM) XVIII,conference,paper,,,,,,,,20424.0,9-10 Oktober 2019,,,,
18,published,20653,"Kopi merupakan salah satu jenis tanaman perkebunan yang sudah lama dibudidayakan di provinsi Lampung, karena memiliki nilai ekonomi yang tinggi. Dalam pengolahan kopi pada olahan kopi bubuk secara industri kualitas kopi bubuk dipengaruhi kualitas penyangraian. Salah satu kendala yang menyebabkan rendahnya mutu biji kopi hasil olahan petani salah satunya dikarenakan panas penyangraian yang tidak merata dan tidak adanya pengontrolan suhu dalam penyangraian manual akibatnya terjadi panas berlebih yang menyebabkan distribusi panas pada biji kopi tidak merata dan biji kopi lebih cepat menghitam. Untuk menanggulangi masalah tersebut perlu mesin pemilah biji kopi sangrai dengan sistem otomasi berdasarkan parameter suhu dan warna kopi. Penyelesaian rancang bangun ini dilakukan dengan 2 tahapan yaitu perancangan konveyor sabuk dan perancangan otomasi. Setelah peralatan sudah difabrikasi selanjutnya dilakukan pengujian kapasitas angkut. Setelah itu dilakukan pengujian penginderaan suhu dan warna kopi sangrai. Pengujian penginderaan suhu menggunakan kamera termografi Cheap Thermocam V4 yang terhubung ke komputer. Pengujian warna kopi diperoleh intensitas warna yang berkaitan dengan warna fisik kopi dan suhunya.","['TJ', 'TS']",,2020-05-27 03:40:22,archive,show,,4,The design of a roasted coffee sorter system in order to control the quality of roasted coffee automatically based on the analysis of the thermographic image and color of roasted coffee,http://prosiding.bkstm.org/prosiding/2019/TM16.pdf,['FT7'],conference_item,,disk0/00/02/06/53,2019-11-01 00:00:00.000000000,"[{'name': {'given': 'Yanuar', 'family': 'Burhanuddin', 'honourific': None, 'lineage': None}}, {'name': {'given': 'Ade Salfa', 'honourific': None, 'family': 'Nugraha', 'lineage': None}}, {'name': {'given': 'Masagus Imran', 'lineage': None, 'honourific': None, 'family': 'Maulana'}}, {'name': {'given': 'Suryadiwansa', 'lineage': None, 'family': 'Harun', 'honourific': None}}, {'name': {'lineage': None, 'family': 'Suudi', 'honourific': None, 'given': 'Ahmad'}}]",,,2020-05-27 03:40:22,1-6,2020-05-27 03:40:22,68,TRUE,http://repository.lppm.unila.ac.id/id/eprint/20653,public,,"[{'main': 'TM16.pdf', 'docid': 33997, 'files': [{'uri': 'http://repository.lppm.unila.ac.id/id/file/193663', 'objectid': 33997, 'filesize': 622682, 'datasetid': 'document', 'hash': '99fe5f6ab000b7d4d2159ec866192cb7', 'filename': 'TM16.pdf', 'mtime': '2020-05-23 17:40:22', 'hash_type': 'MD5', 'mime_type': 'application/pdf', 'fileid': 193663}], 'format': 'text', 'pos': 1, 'rev_number': 2, 'uri': 'http://repository.lppm.unila.ac.id/id/document/33997', 'eprintid': 20653, 'security': 'public', 'placement': 1, 'mime_type': 'application/pdf', 'language': 'en'}]",pub,,"Kampus Univ. Trisakti, Jakarta",Seminar Nasional Tahunan Teknik Mesin (SNTTM) XVIII,conference,paper,,,,,,,,20424.0,9-10 Oktober 2019,,,,
19,published,21038,"Magnesium telah dikembangkan dalam bidang kedokteran yaitu sebagai material untuk implan dalam tubuh. Hasil penelitian sebelumnya menunjukan bahwa faktor utamanya adalah sifat magnesium sangat mirip dengan sifat tulang manusia. Sekrup AZ31 menunjukkan kekuatan tarik keluar yang serupa dengan sekrup stainless steel saat ditarik dari bahan tulang sintetis, dan tingkat degradasi jenis sekrup Mg-alloy di ruang tulang sumsum dan otot lebih cepat daripada di ruang tulang kortikal. Hal ini menunjukan bahwa pembuatan ulir pada magnesium AZ31 sangat mendukung untuk diaplikasikan pada bidang material biomedic. Kepresisian geometri ulir akan memberikan pengaruh terhadap kwalitas ulir, terutama pada saat ulir bekerja bila sudah digunakan sebagai penyambung tulang. Untuk mengatasi masalah tersebut, dapat dilakukan variasi pada parameter proses pemesinan magnesium, yaitu parameter pemotongan pada saat pembubutan ulir untuk mendapatkan hasil yang paling baik akurasinya. Hasil penelitian menunjukan nilai kesalahan tinggi ulir minimum yaitu 0,018188 mm didapatkan pada parameter kecepatan spindel 424 rpm dan kedalaman potong 0,433015. Nilai kesalahan jarak puncak ulir (pitch) minimum yaitu 0,0205 mm didapatkan pada parameter kecepatan spindel 212 rpm dan kedalaman potong 0,649523 mm. Nilai kesalahan sudut minimum yaitu 0,603
didapatkan pada parameter kecepatan spindel 212 rpm dan kedalaman potong 0,324761 mm.",['TS'],,2020-05-29 08:49:42,archive,show,12.0,6,Pengaruh Parameter Pemotongan Pada Proses Bubut Ulir (Threading) Terhadap Kepresisian Geometri Ulir Magnesium Paduan AZ31,http://ojs.unud.ac.id/index.php/jem,['FT7'],article,,disk0/00/02/10/38,2019-04-01 00:00:00.000000000,"[{'name': {'given': 'Akhyar', 'honourific': None, 'family': 'Gusri', 'lineage': None}, 'id': 'gusri.akhyar@eng.unila.ac.id'}, {'id': 'arinal.hamni@yahoo.com', 'name': {'family': 'Arinal', 'honourific': None, 'lineage': None, 'given': 'Hamni'}}]",ISSN: 2302-5255 (p) ISSN: 2541-5328 (e),"Jurnal Energi dan Manufaktur Vol. 12 No. 1, April 2019",2020-05-29 08:49:42,1-6,2020-05-29 08:49:42,528,TRUE,http://repository.lppm.unila.ac.id/id/eprint/21038,public,Universitas Udayana,"[{'format': 'text', 'pos': 1, 'rev_number': 1, 'uri': 'http://repository.lppm.unila.ac.id/id/document/34416', 'docid': 34416, 'main': 'Jurnal Energi dan Manufaktur Vol. 12 No. 1, April 2019 (1-6) .pdf', 'files': [{'filesize': 250636, 'datasetid': 'document', 'filename': 'Jurnal Energi dan Manufaktur Vol. 12 No. 1, April 2019 (1-6) .pdf', 'hash': '1c22eb2e22cccad1249e6443a1947795', 'mtime': '2020-05-29 07:58:22', 'hash_type': 'MD5', 'mime_type': 'application/pdf', 'fileid': 196307, 'uri': 'http://repository.lppm.unila.ac.id/id/file/196307', 'objectid': 34416}], 'mime_type': 'application/pdf', 'language': 'en', 'eprintid': 21038, 'security': 'public', 'placement': 1}]",pub,1,,,,,,,,,,,,,,"[{'type': 'http://www.loc.gov/loc.terms/relators/AUT'}, {'type': 'http://www.loc.gov/loc.terms/relators/AUT'}]",,,
20,published,20064,"Salah satu bahan yang populer saat ini adalah titanium, tetapi titanium adalah bahan yang sulit untuk diproses menggunakan permesinan frais konvensional karena konduktivitas termal yang buruk dari bahan tersebut sehingga proses permesinan mengakibatkan suhu tinggi yang diproduksi di zona pemotongan menyebabkan deformasi plastik pada alat pemotong dan peningkatan reaktivitas kimia pada titanium. Pemesinan mikro berkecepatan tinggi dapat digunakan untuk pemesinan mikro logam keras atau paduan yang sulit dicapai pada kecepatan rendah. Pemesinan mikro milling pada bahan titanium 6Al-4V ELI dengan variasi diameter pahat 1 dan 2 mm, kecepatan spindle 10.000 dan 15.000 rpm, feed 0,001 dan 0,005 mm/putaran, kedalaman potong 100 dan 150 μm, yang kemudian melakukan pemrosesan data menggunakan metode taguchi analisis faktorial dan analisa teoritis. Hasil penelitian menunjukkan bahwa diameter pahat dan kedalam potong memiliki efek paling besar pada kekasaran permukaan, semakin besar diameter pahat frais menghasilkan nilai kekasaran yang lebih kecil, ini berbanding terbalik dengan kedalaman pemotongan. Nilai kekasaran terendah adalah 0,26 dan nilai kekasaran tertinggi adalah 0,9.",['TJ'],,2020-05-19 06:39:20,archive,show,8.0,6,Kekasaran permukaan pada pemesinan frais mikro Ti 6Al- 4V ELI (extra low intertitial),http://ojs.ummetro.ac.id/index.php/turbo,['FT7'],article,,disk0/00/02/00/64,1970-01-01 00:00:00.000002019,"[{'id': 'gusri.akhyar@eng.unila.ac.id', 'name': {'given': 'Akhyar', 'family': 'Gusri', 'honourific': None, 'lineage': None}}, {'id': 'Suryadiwansa.harun@eng.unila.ac.id', 'name': {'honourific': None, 'family': 'Suryadiwansa', 'lineage': None, 'given': 'Harun'}}]","p-ISSN: 2301-6663, e-ISSN: 2477-250X",TURBO,2020-05-19 06:39:20,201-207,2020-05-19 06:39:20,528,TRUE,http://repository.lppm.unila.ac.id/id/eprint/20064,public,"Jurusan Teknik Mesin, Fakultas Teknik, Universitas Muhammadiyah Metro","[{'mime_type': 'application/pdf', 'language': 'en', 'eprintid': 20064, 'placement': 1, 'security': 'public', 'pos': 1, 'format': 'text', 'rev_number': 1, 'uri': 'http://repository.lppm.unila.ac.id/id/document/33397', 'docid': 33397, 'main': '1057-2188-1-PB.pdf', 'files': [{'objectid': 33397, 'uri': 'http://repository.lppm.unila.ac.id/id/file/189547', 'datasetid': 'document', 'filesize': 478188, 'mime_type': 'application/pdf', 'fileid': 189547, 'filename': '1057-2188-1-PB.pdf', 'hash': '7b1494ffd67a2492f1e9fc3bc11352c1', 'hash_type': 'MD5', 'mtime': '2020-05-19 03:42:41'}]}]",pub,2,,,,,,,,,,,,,,[{'type': 'http://www.loc.gov/loc.terms/relators/AUT'}],,,
