,refereed,full_text_status,uri,documents,ispublished,datestamp,lastmod,userid,dir,date,creators,issn,publication,divisions,type,metadata_visibility,rev_number,official_url,title,abstract,subjects,related_url,status_changed,eprint_status,date_type,eprintid,isbn,book_title,pagerange,publisher,corp_creators,keywords,monograph_type,id_number,pages,place_of_pub,department,institution,contact_email,volume,number,funders,contributors,event_dates,event_type,event_location,event_title,pres_type,projects,succeeds
14,FALSE,public,http://repository.lppm.unila.ac.id/id/eprint/8897,"[{'mime_type': 'application/pdf', 'language': 'en', 'placement': 1, 'security': 'public', 'eprintid': 8897, 'rev_number': 1, 'uri': 'http://repository.lppm.unila.ac.id/id/document/21978', 'pos': 1, 'format': 'text', 'files': [{'filesize': 9311697, 'datasetid': 'document', 'filename': 'hamzah uunes.pdf', 'hash': '7c4fe2486eb5d1c414906dfee3b97dc5', 'mtime': '2018-10-18 02:45:13', 'hash_type': 'MD5', 'mime_type': 'application/pdf', 'fileid': 86221, 'uri': 'http://repository.lppm.unila.ac.id/id/file/86221', 'objectid': 21978}], 'main': 'hamzah uunes.pdf', 'docid': 21978}]",pub,2018-10-26 10:12:07,2018-10-26 10:12:07,923,disk0/00/00/88/97,2016-06-01 00:00:00.000000000,"[{'name': {'given': 'Hamzah', 'family': 'Hamzah', 'honourific': None, 'lineage': None}}]",2527-3507,Unes Journal of law,['FH3'],article,show,6,,Perlindungan Terhadap Konsumen Perusahaan Listrik Negara (PLN) Dalam Memperoleh Hak Informasi,,['K1'],,2018-10-26 10:12:07,archive,,8897,,,105-121,"Faculty of law ekasakti university padang, west Sumatra, Indonesia",,,,,,,,,,1,,,,,,,,,,
15,,public,http://repository.lppm.unila.ac.id/id/eprint/3423,"[{'placement': 1, 'security': 'public', 'eprintid': 3423, 'language': 'en', 'mime_type': 'application/pdf', 'files': [{'objectid': 3278, 'uri': 'http://repository.lppm.unila.ac.id/id/file/23656', 'fileid': 23656, 'mime_type': 'application/pdf', 'hash_type': 'MD5', 'mtime': '2017-06-05 08:21:10', 'filename': 'ShieldProceeding-min(1).pdf', 'hash': 'f69b5f0e71bcf2ba97351cbad35e16c7', 'datasetid': 'document', 'filesize': 418869}], 'main': 'ShieldProceeding-min(1).pdf', 'docid': 3278, 'uri': 'http://repository.lppm.unila.ac.id/id/document/3278', 'rev_number': 1, 'pos': 1, 'format': 'text'}]",pub,2017-06-12 02:18:37,2017-06-12 02:18:37,1138,disk0/00/00/34/23,1970-01-01 00:00:00.000002016,"[{'id': 'siti.khoiriah@fh.unila.ac.id', 'name': {'family': 'Khoiriah', 'honourific': None, 'lineage': None, 'given': 'Siti'}}]",,,['FH3'],other,show,8,,Village Of Financial Management,"This village is the pioneer of the democratic system of autonomous and sovereignty. The village government is an integral part of the local government. Rural finance is the hierarchy of the financial structure of the central government above the district; provincial and central government have a significant role in the allocation of financial resources of the village.
To support this, the budget of each village throughout Indonesia will receive budget calculations based on the number of villages; with such considerations are the number of population, poverty, regional and geographical difficulty level, in order to improve the welfare of the village and equitable development.","['K1', 'KZ']",,2017-06-12 02:18:37,archive,,3423,,,,"Post Graduate Program, Universitas lampung",,,,,,,,,,,,,,,,,,,,
16,,public,http://repository.lppm.unila.ac.id/id/eprint/3409,"[{'mime_type': 'application/pdf', 'language': 'en', 'placement': 1, 'security': 'public', 'eprintid': 3409, 'rev_number': 1, 'uri': 'http://repository.lppm.unila.ac.id/id/document/3270', 'pos': 1, 'format': 'text', 'files': [{'datasetid': 'document', 'filesize': 920819, 'fileid': 23582, 'mime_type': 'application/pdf', 'mtime': '2017-06-05 07:27:47', 'hash_type': 'MD5', 'hash': 'fe1768f80fa31b76f5bcd03fcecb22cb', 'filename': 'Prosiding Khoir.pdf', 'objectid': 3270, 'uri': 'http://repository.lppm.unila.ac.id/id/file/23582'}], 'main': 'Prosiding Khoir.pdf', 'docid': 3270}]",pub,2017-06-12 02:20:46,2017-06-12 02:20:46,1138,disk0/00/00/34/09,1970-01-01 00:00:00.000002016,"[{'name': {'given': 'Siti', 'lineage': None, 'honourific': None, 'family': 'Khoiriah'}, 'id': 'siti.khoiriah@fh.unila.ac.id'}, {'id': 'zulkarnainridlwan@gmail.com', 'name': {'given': 'Zulkarnain', 'lineage': None, 'honourific': None, 'family': 'Ridlwan'}}, {'name': {'given': 'Rudy', 'family': 'Lukman Hakim', 'honourific': None, 'lineage': None}, 'id': 'rudy.1981@fh.unila.ac.id'}]",,,['FH3'],other,show,8,,PERENCANAAN PENGELOLAAN KEUANGAN DESA,"Undang-Undang Nomor 6 Tahun 2014 tentang Desa beserta peraturan pelaksanaanya telah mengamanatkan pemerintah Desa untuk lebih mandiri dalam mengelola pemerintahan dan berbagai sumber daya alam yang dimiliki, termasuk di dalamnya pengelolaan keuangan dan kekayaan milik desa.

Peran besar yang diterima oleh Desa, tentunya disertai dengan tanggung jawab yang besar pula. Oleh karena itu pemerintah desa harus bisa menerapkan prinsip akuntabilitas dalam tata pemerintahannya, dimana semua akhir kegiatan penyelenggaraan pemerintahan desa harus dapat dipertanggungjawabkan kepada masyarakat Desa sesuai dengan ketentuan.","['K1', 'KZ']",,2017-06-12 02:20:46,archive,published,3409,,,,Bagian Hukum Tata Negara FH UNILA,,,,,,,,,,,,,,,,,,,,
17,TRUE,public,http://repository.lppm.unila.ac.id/id/eprint/3625,"[{'main': 'ShieldProceeding_2016_1opt.pdf', 'docid': 3483, 'files': [{'filesize': 1140457, 'datasetid': 'document', 'hash': '668e33eb5e8f0e4dac34ade81c0013df', 'filename': 'ShieldProceeding_2016_1opt.pdf', 'mtime': '2017-07-03 04:42:56', 'hash_type': 'MD5', 'mime_type': 'application/pdf', 'fileid': 25343, 'uri': 'http://repository.lppm.unila.ac.id/id/file/25343', 'objectid': 3483}], 'pos': 1, 'format': 'text', 'rev_number': 1, 'uri': 'http://repository.lppm.unila.ac.id/id/document/3483', 'eprintid': 3625, 'placement': 1, 'security': 'public', 'mime_type': 'application/pdf', 'language': 'en'}]",pub,2017-07-31 08:14:09,2017-07-31 08:14:09,940,disk0/00/00/36/25,2016-11-01 00:00:00.000000000,"[{'name': {'given': 'Dwi Putri', 'family': 'Kurnia Martini', 'honourific': None, 'lineage': None}}, {'name': {'honourific': None, 'family': 'Akib', 'lineage': None, 'given': 'Muhammad'}}, {'name': {'given': 'FX', 'lineage': None, 'family': 'Sumarja', 'honourific': None}}]",,,['FH3'],conference_item,show,8,http://shield.unila.ac.id/,The Legal Status of Land Title Transfer That is Obtained by Auction Based on Country’s Precedence Right,"Tax is one of the biggest fund sources proponent in Indonesia’s development activities. Tax payment is an obligation for every Tax Subject. They would be reputed to have debt to Country once they don’t pay the tax. Tax liability is a debt that particularly arise because of law, so it has the precedence characteristic over other debts. If a Taxpayer don’t pay their tax, Government can sell their valuable assets off by the auction based on Country’s recedence Right. In Bandar Lampung City, land title transfer registration that is obtained by auction based on Country’s Precedence Right happened to the ownership land of a personal property on behalf of individual belonging, which became a company’s tax liability payment, and also an object of inheritance dispute. The land title transfer registration validity then became legally questionable, because the auction object is recorded on behalf of individual ownership, not the Company’s. Moreover, it was under inheritance dispute and has been blockaged at The Bandar Lampung Land Affair Office.
Keywords: Country’s Precedence Right, Auction, Land Certificate Blockage.",['K1'],"[{'url': 'http://repository.lppm.unila.ac.id', 'type': 'org'}]",2017-07-31 08:14:09,archive,published,3625,,,255-264,,,,,,,,,,,,,,,2-3 Nov 2016,conference,"Universitas Lampung, Bandar Lampung",1st Shield International Conference,paper,,
18,,public,http://repository.lppm.unila.ac.id/id/eprint/2745,"[{'language': 'en', 'mime_type': 'application/pdf', 'placement': 1, 'security': 'public', 'eprintid': 2745, 'rev_number': 1, 'uri': 'http://repository.lppm.unila.ac.id/id/document/2605', 'pos': 1, 'format': 'text', 'files': [{'objectid': 2605, 'uri': 'http://repository.lppm.unila.ac.id/id/file/18806', 'fileid': 18806, 'mime_type': 'application/pdf', 'mtime': '2017-06-01 06:09:23', 'hash_type': 'MD5', 'filename': 'Rudy_Universitas Lampung_Hikom 29 11 2016.pdf', 'hash': '025ad3661af9292ceb62835266f82ea7', 'datasetid': 'document', 'filesize': 4029320}], 'main': 'Rudy_Universitas Lampung_Hikom 29 11 2016.pdf', 'docid': 2605}, {'mime_type': 'application/pdf', 'language': 'en', 'eprintid': 2745, 'placement': 2, 'security': 'public', 'pos': 2, 'format': 'text', 'rev_number': 1, 'uri': 'http://repository.lppm.unila.ac.id/id/document/2608', 'main': 'Rudy_Universitas Lampung_Hikom 29 11 2016.pdf', 'docid': 2608, 'files': [{'uri': 'http://repository.lppm.unila.ac.id/id/file/18818', 'objectid': 2608, 'filename': 'Rudy_Universitas Lampung_Hikom 29 11 2016.pdf', 'hash': '025ad3661af9292ceb62835266f82ea7', 'hash_type': 'MD5', 'mtime': '2017-06-01 06:13:40', 'mime_type': 'application/pdf', 'fileid': 18818, 'filesize': 4029320, 'datasetid': 'document'}]}]",submitted,2017-06-02 11:56:34,2017-06-02 11:56:34,347,disk0/00/00/27/45,2016-12-29 00:00:00.000000000,"[{'name': {'lineage': None, 'family': 'Lukman Hakim', 'honourific': None, 'given': 'Rudy'}, 'id': 'rudy.1981@fh.unila.ac.id'}]",,,['FH3'],other,show,16,,"REKONSTRUKSI PEMBANGUNAN LEGISLASI BERBASIS 
HUKUM PENGAYOMAN","Pembangunan Legislasi sampai saat ini hanya mementingkan target kuantitas tanpa grand design dan kontruksi yang berkeadilan dan mengayomi. Keadaan karut marut pembangunan legislasi didasarkan pada hasil-hasil penelitian peneliti terdahulu. Bebearapa penelitian Ketua Peneliti dan Anggota Peneliti menghasilkan kesimpulan bahwa telah terjadi pembangunan legislasi yang masif namun tidak terarah.
Pembangunan legislasi yang tidak berintikan hukum pengayoman menyebabkan keadaan pembangunan legislasi saat ini. Dalam konteks pembangunan legislasi tersebut, penelitian ini bertujuan untuk merekonstruksi pembangunan legislasi saat ini dan menciptakan konstruksi baru pembangunan hukum yang berbasis hukum pengayoman yang berkeadilan. Urgensi penelitian ini terletak pada fakta bahwa pembangunan legislasi akan menentukan pembangunan hukum dan pembangunan hukum akan berimplikasi besar terhadap Pembangunan Bangsa dan Negara.
Penelitian ini menggunakan metode penelitian socio legal dengan cara  mengevaluasi konstruksi pembangunan legislasi saat ini baik kuantitas maupun kualitas.  Evaluasi konstruksi secara spesifik dilakukan terhadap institusi kelembagaan kekuasaan pembentuk legislasi,  jumlah dan rumpun legislasi yang pernah dibentuk, instrumen hukum utama sebagai landasan pembentukan legislasi, konstruksi prosedural pembentukan legislasi, dan terakhir adalah politik legislasi.  Komponen-komponen tersebut merupakan elemen yang sangat mempengaruhi pembangunan legislasi.
Penelitian ini sampai saat ini telah mendapatkan konstruksi pembangunan legislasi saat ini mencakup ambiguitas kekuasaan pembentuk legislasi, hasil data legislasi sejak mulai kemerdekaan sampai dengan saat ini, proses penyusunan legislasi, serta politik legislasi.  Namun demikian perlu dicatat bahwa data pada era orde baru tidak sampai menemukan sampai judul legislasi. Penelitian ini mempunyai luaran yang berupa draft jurnal internasional yang akan yang telah dipresentasikan di 1stALSA meeting Singapore dan Workshop on Constitutionalism, State, and Citizenship in Banyuwangi, draft jurnal konstitusi, buku referensi, dan naskah akademik RUU tentang Pembentukan Undang-Undang.","['K1', 'KZ']",,2017-06-02 11:56:34,archive,completed,2745,,,,Kemenristekdikti,,,,,,,,,,,,['Kemenristekdikti'],,,,,,,['Penelitian Hibah Kompetensi'],
19,,public,http://repository.lppm.unila.ac.id/id/eprint/51859,"[{'language': 'en', 'mime_type': 'application/pdf', 'security': 'public', 'placement': 1, 'eprintid': 51859, 'rev_number': 1, 'uri': 'http://repository.lppm.unila.ac.id/id/document/250789', 'format': 'text', 'pos': 1, 'files': [{'hash': '41e9f4fe789385ead085893c78f2a060', 'filename': '18241.pdf', 'mtime': '2023-05-19 06:23:49', 'hash_type': 'MD5', 'mime_type': 'application/pdf', 'fileid': 614366, 'filesize': 1054746, 'datasetid': 'document', 'uri': 'http://repository.lppm.unila.ac.id/id/file/614366', 'objectid': 250789}], 'docid': 250789, 'main': '18241.pdf'}]",unpub,2023-05-19 07:38:58,2023-05-19 07:38:58,212,disk0_bak/00/05/18/59,2016-10-01 00:00:00.000000000,"[{'name': {'given': 'Eka Putri', 'lineage': None, 'honourific': None, 'family': 'Marlia'}}, {'name': {'given': 'yuswanto', 'family': 'Yuswanto', 'honourific': None, 'lineage': None}}, {'name': {'given': 'Nurmayani', 'honourific': None, 'family': 'Nurmayani', 'lineage': None}}]",,,['FH3'],other,show,7,,Pengelolaan Anggaran Pendapatan Dan Belanja Daerah Menurut Undang-Undang Nomor 23 Tahun 2014 Tentang Pemerintahan Daerah,,['K1'],,2023-05-19 07:38:58,archive,completed,51859,,,,LPPM Unila,,,,,,,,,,,,,,,,,,,,
20,TRUE,public,http://repository.lppm.unila.ac.id/id/eprint/2783,"[{'format': 'text', 'pos': 1, 'uri': 'http://repository.lppm.unila.ac.id/id/document/2639', 'rev_number': 1, 'docid': 2639, 'main': 'Prosiding HI 2016.pdf', 'files': [{'uri': 'http://repository.lppm.unila.ac.id/id/file/19023', 'objectid': 2639, 'hash': '9c8929b4353c787c36c0b4b3f76b1de5', 'filename': 'Prosiding HI 2016.pdf', 'hash_type': 'MD5', 'mtime': '2017-06-01 07:40:51', 'mime_type': 'application/pdf', 'fileid': 19023, 'filesize': 5515364, 'datasetid': 'document'}], 'mime_type': 'application/pdf', 'language': 'en', 'eprintid': 2783, 'security': 'public', 'placement': 1}]",pub,2017-06-02 12:02:39,2017-06-02 12:02:39,276,disk0/00/00/27/83,2016-09-01 00:00:00.000000000,"[{'name': {'family': 'Meutia', 'honourific': None, 'lineage': None, 'given': 'Intan Fitri'}, 'id': 'intan.fitri@fisip.unila.ac.id'}, {'name': {'given': 'Bayu', 'lineage': None, 'honourific': None, 'family': 'Sujadmiko'}, 'id': 'bayu.sujadmiko@fh.unila.ac.id'}]",,,['FH3'],book_section,show,8,,Interrelation Between Sambang and Koban,"The objectives of this article is to present the description of community policing with using the rich field data collected by the author and to analyze it by examining the history and the present situation towards the role of police and its relation with community neighborhood especially in Indonesia. The article compared and analyzed the potential problems and challenges in applying police strategies approach to maintain public and social order. Additionally, this research referred to community policing implementation in Japan as comparative information. This study also examined the possibility of community policing approach in ethnic conflict resolution cases in Indonesia. This research is expected to offer a foundation for further research in analyzing the relation between police officers and community demands for the community policing implementation.This research was conducted qualitatively, in the form of ethnographic study, by using interview, observation and documentary, which were done purposively. The result of this research showed that community policing ultimately needed active participation from both police and community.It was found that Indonesia has implemented community policing firstly by establishing bhabinkamtibmas and sambang which is a form of community policing strategies in Indonesia. It is a representative of Indonesian police officer, which is assigned in each foster area due to, preemptive, preventive, and provides early warning of a threat to the community.In Japan which has homogeneous community, the establishment of Koban system—a form of community policing—has minimized the number of other conflicts and crimes.This success could be learned by other countries including Indonesia. Therefore, it is more challenging to organize community policing in Indonesia because of the cultural differences in which each ethnic community has its own customs and values.","['H1', 'K1']",,2017-06-02 12:02:39,archive,published,2783,978-602-61528-0-0,Prosiding Hukum Internasional 2016,116-142,Fakultas Hukum Universitas Lampung,,,,,142.0,Lampung,,,bayu.sujadmiko@fh.unila.ac.id,,,,,,,,,,,
21,,public,http://repository.lppm.unila.ac.id/id/eprint/3419,"[{'language': 'en', 'mime_type': 'application/pdf', 'security': 'public', 'placement': 1, 'eprintid': 3419, 'uri': 'http://repository.lppm.unila.ac.id/id/document/3276', 'rev_number': 1, 'format': 'text', 'pos': 1, 'files': [{'datasetid': 'document', 'filesize': 24901894, 'fileid': 23632, 'mime_type': 'application/pdf', 'hash_type': 'MD5', 'mtime': '2017-06-05 08:08:29', 'filename': 'BUKU HKI.pdf', 'hash': 'a504d6d3e8bafaa5ddab702fcbf63542', 'objectid': 3276, 'uri': 'http://repository.lppm.unila.ac.id/id/file/23632'}], 'main': 'BUKU HKI.pdf', 'docid': 3276}]",pub,2017-06-12 01:55:15,2017-06-12 01:55:15,147,disk0/00/00/34/19,2016-11-01 00:00:00.000000000,"[{'name': {'lineage': None, 'honourific': None, 'family': 'RISWANDI', 'given': 'AGUS BUDI'}}]",,,['FH3'],monograph,show,8,,EFEKTIVITAS DATABASE DALAM MELINDUNGAI PENGETAHUAN TRADISIONAL DARI TINDAKAN BIO PIRACY,"SEBAGAI BENTUK PERLINDUNAGN BAGI PENGETAHUAN TRADISIONAL PADA LEVEL INTERNASIONAL DIKEMBANGKAN DUA MODEL PERLINDUNGAN, YAITU POSITIF DAN DEFENSIF.

TULISAN INI DIFOKUSKAN UNTUK MENGETAHUI SEJAUH MANA EFEKTIFITAS PERLINDUNGAN SECARA DEFENSIF DALAM MELINDUNGI PENGETAHUAN TRADISIONAL DARI TINDAKAN BIO PIRACY",['K1'],,2017-06-12 01:55:15,archive,,3419,,,,PUSAT STUDY HKI UII,['PUSAT HKI UII YOGYAKARTA'],,manual,ISBN 978-602-60202-0-8,9.0,YOGYAKARTA,SENTRA HKI,UNIVERSITAS ISLAM INDONESIA,,,,,"[{'name': {'given': 'ROHAINI', 'lineage': None, 'family': 'ROHAINI', 'honourific': None}, 'id': 'rohaini.arifien81@gmail.com', 'type': 'http://www.loc.gov/loc.terms/relators/AUT'}]",,,,,,,
22,,public,http://repository.lppm.unila.ac.id/id/eprint/3421,"[{'pos': 1, 'format': 'text', 'uri': 'http://repository.lppm.unila.ac.id/id/document/3410', 'rev_number': 1, 'main': 'BUKU HKI_2.pdf', 'docid': 3410, 'files': [{'fileid': 24589, 'mime_type': 'application/pdf', 'hash_type': 'MD5', 'mtime': '2017-06-08 09:01:46', 'filename': 'BUKU HKI_2.pdf', 'hash': 'c0164b6318c774c7fafb0eb17f395725', 'datasetid': 'document', 'filesize': 24903776, 'objectid': 3410, 'uri': 'http://repository.lppm.unila.ac.id/id/file/24589'}], 'language': 'en', 'mime_type': 'application/pdf', 'eprintid': 3421, 'placement': 1, 'security': 'public'}]",pub,2017-06-12 01:55:05,2017-06-12 01:55:05,147,disk0/00/00/34/21,2016-11-01 00:00:00.000000000,"[{'name': {'given': 'ROHAINI', 'family': 'ROHAINI', 'honourific': None, 'lineage': None}, 'id': 'rohaini.arifien81@gmail.com'}]",,,['FH3'],monograph,show,8,,EFEKTIVITAS DATABASE DALAM MELINDUNGI PENGETAHUAN TRADISIONAL DARI TINDAKAN BIO PIRACY,"PADA LEVEL INTERNASIONAL DIKENAL DUA MODEL PERLINDUNGAN DALAM MELINDUNGI PENGETAHUAN TRADISIONAL, YAITU DEFENSIF DAN POSITIF. TULISAN DILAKUKAN UNTUK MENGTAHUI EFEKTIFITAS PERLINDUNGAN SECARA DEFENSIF YAITU MELALLUI PENGEMBANGAN DATABEASE PENGETAHUAN TRADISIONAL DALAM MELINDUNGI PENGETAHUAN TRADISIONAL DARI TINDAKAN BIO PIRACY",['K1'],,2017-06-12 01:55:05,archive,,3421,,,,PUSAT STUDY HKI UII,['PUSAT HKI UII YOGYAKARTA'],,manual,ISBN 978-602-60202-0-8,9.0,YOGYAKARTA,PUSAT STUDY HKI,UNIVERSITAS ISLAM INDONESIA,,,,,,,,,,,,
23,TRUE,public,http://repository.lppm.unila.ac.id/id/eprint/3173,"[{'uri': 'http://repository.lppm.unila.ac.id/id/document/3064', 'rev_number': 1, 'pos': 1, 'format': 'text', 'files': [{'uri': 'http://repository.lppm.unila.ac.id/id/file/22106', 'objectid': 3064, 'mtime': '2017-06-02 12:46:33', 'hash_type': 'MD5', 'filename': '449-1387-1-SM.pdf', 'hash': '3ac4f88d61076ca3c548f8d8cef6415a', 'fileid': 22106, 'mime_type': 'application/pdf', 'filesize': 646035, 'datasetid': 'document'}], 'docid': 3064, 'main': '449-1387-1-SM.pdf', 'language': 'en', 'mime_type': 'application/pdf', 'placement': 1, 'security': 'public', 'eprintid': 3173}]",pub,2017-06-05 02:17:14,2017-06-05 02:17:14,786,disk0/00/00/31/73,2016-05-20 00:00:00.000000000,"[{'name': {'lineage': None, 'family': 'Radliyah', 'honourific': None, 'given': 'Nunung'}, 'id': 'nunungradliyah@yahoo.com'}]",23391650,"International Conference on law, business and governance (ICon - LBG)",['FH3'],article,show,10,http://artikel.ubl.ac.id/index.php/iconlbg,Application of Islamic Economic Law of Murabahah Funding In Islamic Banking,"The Bank is a financial institution that has a strategic role in developing national development. Banking world recognize two systems, namely the economic system of conventional and Islamic economic system. Conventional economic systems are commercial banks and rural banks. Islamic bank is a bank that uses the basic Islamic law and doing business with the Islamic principles referring to the Al - Quran and Al -Hadith and Al- Ro'yu (reasonable minds). One Islamic products that exist in Islamic banking is murabaha financing. Their financing channeled Islamic bank will always involve risks, namely the risk of losses due to non-current provision of financing or financing problems. The problem in this research is how the application of the principle of economic law on the Sharia to financing murabaha Islamic Banking and rescue efforts against murabaha financing is problematic. This study is a normative legal research with descriptive type. This research is using the normative legal - normative approach applied to the type of normative approach, analytical legal substance (approach of legal content analysis). The data used are secondary data consists of primary legal materials, secondary law and tertiary legal materials. The findings of the research that murabahah on Islamic Banking uses wakalah that empowers the customer to buy the object or objects that have been agreed in the contract , so that execution of the contract murabaha does not conflict with existing provisions , whether the provisions issued by the National Sharia Council of Indonesian Ulema Council No. 04/DSN - MUI / IV / 2000 on murabaha and Bank Indonesia Regulation Number 7/46 / PBI / 2005 on Contract Assembler and Disbursement For banks Conducting Business Based on the principle of murabaha financing Syariah. Upaya rescue troubled on researching Islamic Banking customers , when acting in good faith efforts to rescue the troubled murabaha financing is done through financing by way of rescheduling restructuring (rescheduling), reconditioning (back requirements) , and restructuring (restructuring).

Keywords : Financing Agreement; Murabahah ; Islamic Economic Law",['K1'],"[{'type': 'pub', 'url': 'http://artikel.ubl.ac.id/index.php/iconlbg'}]",2017-06-05 02:17:14,archive,published,3173,,,II - 1-II - 5,"Bandar Lampung University (UBL) Faculty of Law, Faculty of Economics and Faculty of Social Science",['Universitas Lampung'],,,,,,,,,3,1.0,,,,,,,,,
24,TRUE,public,http://repository.lppm.unila.ac.id/id/eprint/3177,"[{'files': [{'filesize': 5746333, 'datasetid': 'document', 'hash_type': 'MD5', 'mtime': '2017-06-02 13:06:27', 'filename': 'AICIS.pdf', 'hash': 'bf19ba5b435a9db6357ac0776ec06466', 'fileid': 22126, 'mime_type': 'application/pdf', 'uri': 'http://repository.lppm.unila.ac.id/id/file/22126', 'objectid': 3067}], 'docid': 3067, 'main': 'AICIS.pdf', 'uri': 'http://repository.lppm.unila.ac.id/id/document/3067', 'rev_number': 1, 'pos': 1, 'format': 'text', 'placement': 1, 'security': 'public', 'eprintid': 3177, 'mime_type': 'application/pdf', 'language': 'en'}]",pub,2017-06-05 02:22:52,2017-06-05 02:22:52,786,disk0/00/00/31/77,2016-11-03 00:00:00.000000000,"[{'name': {'given': 'Nunung', 'lineage': None, 'family': 'Radliyah', 'honourific': None}, 'id': 'nunungradliyah@yahoo.com'}]",,Annual International Conference on Islamic Studies,['FH3'],article,show,6,https://aicis.radenintan.ac.id/,Arbitrase Syariah Sebagai Alternatif Penyelesaian Sengketa Lembaga Perbankan Syariah Serta Kekuatan Dan Kelemahan Dalam Penerapan Di Indonesi,"Lembaga keuangan nonbank pun sekarang ini sudah cukup banyak yang menggunakan sistem syariah antara lain asuransi, pegadaian, obligasi, pasar modal dan reksadana syariah. Untuk itu, maka perlu adanya suatu penyelesaian perselisihan dalam hal ini terutama penyelesaian alternatif  yakni melalui arbitrase syariah dalam menyelesaikan sengketa lembaga perbankan syariah yang akan memberikan penyelesaian secara adil dan cepat yang timbul dalam berbagai bidang seperti bidang keuangan, jasa, perdagangan, indrustri maupun bidang lainnya yang didasarkan pada  ajaran Al-Qur‘an, Sunnah Rasul (Hadis), dan akal fikiran (Ijtihad). Metode pendekatan masalah yuridis-normatif, jenis penelitian normative, dan tipe penelitian deskriptif analitis, dengan analisis secara kualitatif. Hasil temuan dari penelitian ini menjelaskan bahwa 1) Bentuk Penyelesaian Sengketa Perbankan Syariah di Indonesia salah satunya adalah melalui Mediasi Perbankan sebagaimana diatur dalam Pasal 1 angka 5 PBI No.8/5/PBI/2006 tentang Mediasi Perbankan yang kemudian diubah dengan Peraturan Bank Indonesia No. 10/1/PBI/2008. 2) Prosedur dan proses penyelesaian sengketa lembaga keuangan syariah melalui bayarnas harus didasarkan pada UU No. 30 Tahun 1999 tentang Arbitrase dan Peraturan Prosedur Bayarnas. 3) Kekuatan dan kelemahan penyelesaian sengketa perbankan syariah melalui arbitrase syariah di Indonesia yaitu arbitrase syariah menarik bagi para pedagang dan investor 

Keyword : Arbitrase, Perbankan Syariah, Penyelesaian Alternative",['K1'],"[{'url': 'https://aicis.radenintan.ac.id/', 'type': 'org'}]",2017-06-05 02:22:52,archive,published,3177,,,158-169,IAIN Raden Intan Lampung,['Universitas Lampung'],,,,,,,,,1,2.0,,,,,,,,,
