,eprintid,metadata_visibility,rev_number,title,abstract,subjects,status_changed,eprint_status,dir,creators,divisions,type,full_text_status,uri,publisher,documents,ispublished,datestamp,lastmod,userid,refereed,publication,date_type,issn,corp_creators,pagerange,number,official_url,volume
0,48380,show,9,"Financial Feasibility Analysis of Salted Anchovy Processing on Pasaran Island, Bandar Lampung",Similarity Test,['AC'],2023-02-15 01:20:04,archive,disk0_bak/00/04/83/80,"[{'id': 'erlina.rufaedah@fkip.unila.ac.id', 'name': {'family': 'Erlina', 'honourific': None, 'lineage': None, 'given': 'Rufaidah'}}]",['FP6'],other,public,http://repository.lppm.unila.ac.id/id/eprint/48380,"Dr. Erlina Rufaidah, M,Si","[{'mime_type': 'application/pdf', 'language': 'en', 'eprintid': 48380, 'placement': 1, 'security': 'public', 'pos': 1, 'format': 'text', 'rev_number': 1, 'uri': 'http://repository.lppm.unila.ac.id/id/document/187672', 'main': 'Financial Feasibility Analysis of Salted Anchovy Processing on Pasaran Island, Bandar Lampung(1).pdf', 'docid': 187672, 'files': [{'filename': 'Financial Feasibility Analysis of Salted Anchovy Processing on Pasaran Island, Bandar Lampung(1).pdf', 'hash': '0373c6b399274d6a86188a3eac10cc50', 'hash_type': 'MD5', 'mtime': '2023-02-14 07:28:45', 'mime_type': 'application/pdf', 'fileid': 528255, 'filesize': 985689, 'datasetid': 'document', 'uri': 'http://repository.lppm.unila.ac.id/id/file/528255', 'objectid': 187672}]}]",pub,2023-02-15 01:20:04,2023-02-15 01:20:04,1000,,,,,,,,,
1,48383,show,6,"Financial Feasibility Analysis of Salted Anchovy Processing on Pasaran Island, Bandar Lampung",Korespodensi,['AI'],2023-02-15 01:19:49,archive,disk0_bak/00/04/83/83,"[{'id': 'erlina.rufaedah@fkip.unila.ac.id', 'name': {'given': 'Rufaidah', 'family': 'Erlina', 'honourific': None, 'lineage': None}}]",['FP6'],article,public,http://repository.lppm.unila.ac.id/id/eprint/48383,,"[{'eprintid': 48383, 'security': 'public', 'placement': 1, 'language': 'en', 'mime_type': 'application/pdf', 'main': 'Bukti Korespondensi Scopus Erlina Rufaidah.pdf', 'docid': 187673, 'files': [{'hash': 'cde3b240f40789826a3e90d34876fec5', 'filename': 'Bukti Korespondensi Scopus Erlina Rufaidah.pdf', 'hash_type': 'MD5', 'mtime': '2023-02-14 07:43:31', 'mime_type': 'application/pdf', 'fileid': 528262, 'filesize': 272054, 'datasetid': 'document', 'uri': 'http://repository.lppm.unila.ac.id/id/file/528262', 'objectid': 187673}], 'format': 'text', 'pos': 1, 'rev_number': 1, 'uri': 'http://repository.lppm.unila.ac.id/id/document/187673'}]",pub,2023-02-15 01:19:49,2023-02-15 01:19:49,1000,TRUE,"Financial Feasibility Analysis of Salted Anchovy Processing on Pasaran Island, Bandar Lampung",,,,,,,
2,20101,show,6,RESPON PETANI TERHADAP SISTEM TANAM JAJAR LEGOWO DI KECAMATAN TUMIJAJAR KABUPATEN TULANG BAWANG BARAT,,['H1'],2020-05-19 06:41:52,archive,disk0/00/02/01/01,"[{'name': {'lineage': None, 'honourific': None, 'family': 'Gultom', 'given': 'Dame Trully'}, 'id': 'trully.dame@yahoo.co.id'}]",['FP6'],article,public,http://repository.lppm.unila.ac.id/id/eprint/20101,,"[{'placement': 1, 'security': 'public', 'eprintid': 20101, 'language': 'en', 'mime_type': 'application/pdf', 'files': [{'datasetid': 'document', 'filesize': 152341, 'fileid': 189813, 'mime_type': 'application/pdf', 'hash_type': 'MD5', 'mtime': '2020-05-19 06:26:07', 'filename': '1. RESPON PETANI TERHADAP SISTEM TANAM JAJAR LEGOWO DI KECAMATAN TUMIJAJAR KABUPATEN TULANG BAWANG BARAT.pdf', 'hash': 'e2df6431825d5afd97ab5f6431fd612a', 'objectid': 33440, 'uri': 'http://repository.lppm.unila.ac.id/id/file/189813'}], 'main': '1. RESPON PETANI TERHADAP SISTEM TANAM JAJAR LEGOWO DI KECAMATAN TUMIJAJAR KABUPATEN TULANG BAWANG BARAT.pdf', 'docid': 33440, 'uri': 'http://repository.lppm.unila.ac.id/id/document/33440', 'rev_number': 1, 'pos': 1, 'format': 'text'}]",pub,2020-05-19 06:41:52,2020-05-19 06:41:52,719,TRUE,RESPON PETANI TERHADAP SISTEM TANAM JAJAR LEGOWO DI KECAMATAN TUMIJAJAR KABUPATEN TULANG BAWANG BARAT,published,,,,,,
3,42641,show,6,"KETAHANAN PANGAN RUMAH TANGGA PETANI KELAPA SAWIT SWADAYA 
DI KABUPATEN TULANG BAWANG","The aims of this research are to analyze the level of food security, the factors that affect the level of food
security, and efforts to increase the level of food security of palm oil farmer households (POFH). The research
was conducted using a survey method in Tulang Bawang Regency by involving 67 respondents from POFH who
were chosen by a simple random sampling. The results of the research showed that 47.76% of POFH were
categorized as the most secure of food, 29.85% as less secure, 20.90% as vulnerable, and 1.49% as food
insecure. The factors that positively affect household food security were household income, formal education
level of household head, and ethnicity.  The factor that negatively affect household food security was the the
number family members. The efforts to increase the level of food security by Government were monitoring the
stock of rice, drafting food balance, Programs called Pengembangan Usaha Pangan Masyarakat (PUPM),
Kawasan Rumah Pangan Lestari (KRPL) and Modal Pengembangan Pangan Pokok Lebel (MP3L). The efforts
of palm oil farmer households were owing groceries (47.50%), do outside work of palm oil farmer (50.62%),
and changing dietary habit (1.88%).

Key words: cross-classification, food security, palm oil households.",['S1'],2022-06-20 05:04:39,archive,disk0/00/04/26/41,"[{'id': 'dwih_unila@yahoo.com', 'name': {'given': 'Dwi', 'family': 'Haryono', 'honourific': None, 'lineage': None}}, {'name': {'lineage': None, 'honourific': None, 'family': 'Hanung', 'given': 'Ismono'}, 'id': None}]",['FP6'],article,public,http://repository.lppm.unila.ac.id/id/eprint/42641,Universitas Lampung,"[{'uri': 'http://repository.lppm.unila.ac.id/id/document/164353', 'rev_number': 1, 'format': 'text', 'pos': 1, 'files': [{'filename': 'ketahanan pangan.pdf', 'hash': '91ac0c13ff47138c0e8214cf91686222', 'mtime': '2022-06-20 05:00:02', 'hash_type': 'MD5', 'mime_type': 'application/pdf', 'fileid': 467902, 'filesize': 1386781, 'datasetid': 'document', 'uri': 'http://repository.lppm.unila.ac.id/id/file/467902', 'objectid': 164353}], 'docid': 164353, 'main': 'ketahanan pangan.pdf', 'mime_type': 'application/pdf', 'language': 'en', 'security': 'public', 'placement': 1, 'eprintid': 42641}]",pub,2022-06-20 05:04:39,2022-06-20 05:04:39,972,TRUE,JIIA (Jurnal Ilmu-Ilmu Agribisnis),,2337-7070,,,,,
4,12424,show,9,KERAGAAN PRODUKSI ETANOL 15 GENOTIPE SORGUM (Sorghum bicolor (L.) MOENCH) YANG DITUMPANGSARIKAN DENGAN UBI KAYU DI TANJUNG BINTANG LAMPUNG,"Produksi etanol dari sumberdaya terbarukan telah banyak diminati akhir-akhir ini.  Selain tebu, tanaman yang sangat berpotensi sebagai penghasil etanol adalah sorgum manis (Sorghum bicolor {L.} Moench). Meskipun tanaman sorgum dikenal toleran terhadap kekeringan dan dapat ditanam pada berbagai kondisi lahan, namun penanaman sorgum secara monokultur dalam skala luas tidak mudah diterima petani.  Oleh karena itu dalam penelitian ini sorgum diperkenalkan sebagai tanaman sela di antara tanaman ubi kayu yang banyak ditanam di Provinsi Lampung. Tujuan penelitian ini adalah untuk mengevaluasi 15 genotipe sorgum yang berpotensi sebagai penghasil etanol.  Penelitian ini menggunakan rancangan acak kelompok yang terdiri atas 15 perlakuan (15 genotipe sorgum) yang ditumpangsarikan dengan ubi kayu, dan setiap perlakuan diulang 3 kali. Jarak tanam sorgum adalah 80 cm x 20 cm dan ditanam di antara barisan tanamn ubi kayu yang berjarak tanam 60 cm x 80 cm. Setiap plot percobaan terdapat 100 rumpun tanaman sorgum dan 40 tanaman ubi kayu. Hasil penelitian menunjukkan bahwa semua variabel yang diamati berbeda sangat nyata antar genotipe (p < 0,01). Genotipe sorgum yang berpotensi sebagai penghasil etanol terbanyak secara berurutan adalah GH3 (646 l/ha), Super-1 (571 l/ha), GH4 (450 l/ha) dan GH6 (446 l/ha).","['S1', 'SB']",2019-05-10 02:35:09,archive,disk0/00/01/24/24,"[{'name': {'lineage': None, 'family': 'Karyanto', 'honourific': None, 'given': 'Agus'}, 'id': 'agus.karyanto@fp.unila.ac.id'}, {'id': 'mkamal1961@yahoo.com', 'name': {'honourific': None, 'family': 'Kamal', 'lineage': None, 'given': 'Muhammad'}}, {'name': {'given': 'Irmawati', 'lineage': None, 'family': 'Irmawati', 'honourific': None}, 'id': 'irmawati0337@gmail.com'}, {'id': 'msyamshadi@yahoo.co.id', 'name': {'given': 'Muhammad Syamsoel', 'lineage': None, 'family': 'Hadi', 'honourific': None}}]",['FP6'],article,public,http://repository.lppm.unila.ac.id/id/eprint/12424,,"[{'pos': 1, 'format': 'text', 'uri': 'http://repository.lppm.unila.ac.id/id/document/25404', 'rev_number': 1, 'main': 'Agus K-makalah seminar Agroteknologi UINSGD 2019 new.pdf', 'docid': 25404, 'files': [{'uri': 'http://repository.lppm.unila.ac.id/id/file/110491', 'objectid': 25404, 'hash_type': 'MD5', 'mtime': '2019-05-10 02:22:00', 'hash': '0c364a89b3fa53b37fb2396b79b712cd', 'filename': 'Agus K-makalah seminar Agroteknologi UINSGD 2019 new.pdf', 'fileid': 110491, 'mime_type': 'application/pdf', 'filesize': 728958, 'datasetid': 'document'}], 'language': 'en', 'mime_type': 'application/pdf', 'eprintid': 12424, 'placement': 1, 'security': 'public'}]",inpress,2019-05-10 02:35:09,2019-05-10 02:35:09,671,TRUE,Prosiding Seminar Nasional Agroteknologi 2019,published,,"['Jurusan Agroteknologi FP UNILA', 'Jurusan Agronomi dan Hortikultura FP UNILA', 'Alumni Agroteknologi FP UNILA', 'Jurusan Agronomi dan Hortikultura FP UNILA']",,,,
5,11044,show,8,"KEBERLANJUTAN USAHATANI MANGGIS PROGRAM SERTIFIKAT PRIMA
DI KECAMATAN KOTA AGUNG KABUPATEN TANGGAMUS","This research aims to analyze the performance of mangosteen farming and certification benefits ofsustainable mangosteen farming development in terms of economic, social, and environmental aspects. Thelocation of the research is decided purposely in Terdana, Kota Agung, Tanggamus District. The samples of
this research are 54 farmers whose products have been certified by prima. The performance of mangosteen farming is assessed by R / C ratio. The results showed that the performance of mangosteen farming in terms of R / C ratio per-ha was 6.91; it meant that each cash cost incurred by farmers of Rp1.00 then the farmers would receive revenue of Rp6.91 (could provide benefits on economical aspects). Prima Certification Program of mangosteen farming in Terdana, Kota Agung, Tanggamus district was quite sustainable in economic, social, and environmental aspects, in which sustainability index were 67.90; 71.02 and 72.82
Key words: farm income , mangosteen, prima certification, sustainability",['S1'],2019-04-09 06:55:50,archive,disk0/00/01/10/44,"[{'id': None, 'name': {'given': 'Biha elatiM', 'lineage': None, 'honourific': None, 'family': 'Sari'}}, {'id': 'barifin@uwalumni.com', 'name': {'lineage': None, 'family': 'Arifin', 'honourific': None, 'given': 'Bustanul'}}, {'id': 'yakti_indriani@yahoo.com', 'name': {'given': 'Yaktiworo', 'lineage': None, 'honourific': None, 'family': 'Indriani'}}]",['FP6'],article,public,http://repository.lppm.unila.ac.id/id/eprint/11044,Jurusan Agribisnis Fakultas Pertanian Universitas Lampung,"[{'content': 'published', 'mime_type': 'application/xml', 'language': 'id', 'placement': 1, 'security': 'public', 'eprintid': 11044, 'uri': 'http://repository.lppm.unila.ac.id/id/document/24043', 'rev_number': 4, 'pos': 1, 'format': 'text', 'files': [{'datasetid': 'document', 'filesize': 52707, 'fileid': 101085, 'mime_type': 'application/xml', 'hash_type': 'MD5', 'mtime': '2019-03-29 04:18:41', 'filename': 2413, 'hash': 'b65f3fcedc82b407bb883c2862dda403', 'objectid': 24043, 'uri': 'http://repository.lppm.unila.ac.id/id/file/101085'}], 'main': 2413, 'docid': 24043}]",pub,2019-04-09 06:55:50,2019-04-09 06:55:50,938,TRUE,Jurnal Ilmu-Ilmu Agribisnis,published,Print 2337-7070 ;  e-ISSN  2620-4177,,271-278,3.0,http://jurnal.fp.unila.ac.id/index.php/JIA,6.0
6,8179,show,6,"KINERJA PRODUKSI DAN STRATEGI PENGEMBANGAN AGROINDUSTRI 
KOPI BUBUK DI KOTA BANDAR LAMPUNG","This research aims to analyze the production performance and Agroindustry development strategy of coffee 
powder in Bandar Lampung City.  This research is a case study in a coffee powder agroindustry namely
Sinar Baru Cap Bola Dunia.  Respodents are the owner and employees of the agroindustry.  Research data
is analyzed by quantitative and qualitative descriptive analysis (analysis of production performance) and
descriptive qualitative analysis (SWOT).  The results showed that the performance of Sinar Baru Cap Bola
Dunia Agroindustry in overall was not in good category.  The main priority strategy for developing the
agroindustry were (a) utilizing the human resources’ skills to increase production utilizing modern
technology, (b) utilizing the human resources’ skills to increase production and government support for
increasing sales through exhibitions conducted by department of cooperatives, industry, and trade, (c)
utilizing the location near to the sales location there by reducing distribution costs and facilitating the
marketing of products to meet the increasing demands of the population, (d) collaborating with the
government to facilitate information access related to the agroindustry and promotion abroad, especially to
introduce the product in Southeast Asia market through cyberspace or overseas exhibition activities, (e)
producing a quality product according to consumers’ tastes for consumers to re-purchase so that it could be
competetive to similar competitors.

Key words: coffee powder, development strategy, production performance",['S1'],2018-06-28 08:17:43,archive,disk0/00/00/81/79,"[{'id': None, 'name': {'lineage': None, 'family': 'maya sari', 'honourific': None, 'given': 'ayu'}}, {'id': 'dwih_unila@yahoo.com', 'name': {'given': 'Dwi', 'lineage': None, 'honourific': None, 'family': 'Haryono'}}, {'id': None, 'name': {'given': 'Rabiatul', 'lineage': None, 'honourific': None, 'family': 'Adawiyah'}}]",['FP6'],article,public,http://repository.lppm.unila.ac.id/id/eprint/8179,Universitas Lampung,"[{'mime_type': 'application/pdf', 'language': 'en', 'placement': 1, 'security': 'public', 'eprintid': 8179, 'rev_number': 1, 'uri': 'http://repository.lppm.unila.ac.id/id/document/21210', 'pos': 1, 'format': 'text', 'files': [{'objectid': 21210, 'uri': 'http://repository.lppm.unila.ac.id/id/file/81395', 'mime_type': 'application/pdf', 'fileid': 81395, 'filename': '1744-4596-1-SM (Artikel).pdf', 'hash': '1c5ffb30eddb17d304df831da3e5e531', 'hash_type': 'MD5', 'mtime': '2018-06-28 07:45:43', 'datasetid': 'document', 'filesize': 74082}], 'main': '1744-4596-1-SM (Artikel).pdf', 'docid': 21210}]",pub,2018-06-28 08:17:43,2018-06-28 08:17:43,972,TRUE,JIIA (Jurnal Ilmu-Ilmu Agribisnis),,2337-7070,['Universitas Lampung'],,,,5.0
