,eprintid,date_type,title,metadata_visibility,rev_number,eprint_status,status_changed,abstract,subjects,creators,dir,date,type,divisions,publisher,documents,ispublished,contributors,uri,full_text_status,corp_creators,userid,lastmod,datestamp,funders,contact_email,place_of_pub,projects,publication,issn,refereed,number,pagerange,volume,official_url,related_url,id_number,referencetext,succeeds
0,46074,completed,Modifying PPP in Promoting Communicative Language Teaching to Improve the Students’ English Communicative Competence (Similarity Check),show,7,archive,2022-10-29 11:28:57,"This study was going to find out the significant difference of the English communicative competence between the students who were taught by using original PPP method and the students who were taught by using modified PPP by using CLT. Moreover, the more effective method between original PPP method and the modified one in improving the students’ communicative competence was investigated. This is a quasi-experimental research using both control and experimental class comparing the original and modified PPP. The subject was forty junior EFL students whose English were still at the lower level. The result showed that there is a significant difference between students’ English communicative competence after being taught by using original PPP method and the modified one. In addition, both original and modified PPP are good to facilitate the learners in having good grammatical competence; however, only PPP that has been modified by using CLT that can facilitate them in having a good communicative competence.",['PE'],"[{'id': 'rachmabelinda@gmail.com', 'name': {'given': 'Rachma Vivien', 'lineage': None, 'honourific': None, 'family': 'Belinda'}}, {'id': 'patuan.raja@fkip.unila.ac.id', 'name': {'given': 'Patuan', 'honourific': None, 'family': 'Raja', 'lineage': None}}, {'id': 'nainggolan.flora@yahoo.com', 'name': {'family': 'Flora', 'honourific': None, 'lineage': None, 'given': 'Flora'}}]",disk0/00/04/60/74,2022-10-29 00:00:00.000000000,other,['FKIP1'],FKIP Universitas Lampung,"[{'eprintid': 46074, 'placement': 1, 'security': 'public', 'language': 'en', 'mime_type': 'application/pdf', 'docid': 184895, 'main': '11-Modifying PPP in Promoting Communicative Language Teaching-Tur.pdf.pdf', 'files': [{'objectid': 184895, 'uri': 'http://repository.lppm.unila.ac.id/id/file/509686', 'mime_type': 'application/pdf', 'fileid': 509686, 'hash': 'db9965698b0f1b5f255ea66391f9db23', 'filename': '11-Modifying PPP in Promoting Communicative Language Teaching-Tur.pdf.pdf', 'hash_type': 'MD5', 'mtime': '2022-10-29 07:17:00', 'datasetid': 'document', 'filesize': 686901}], 'pos': 1, 'format': 'text', 'rev_number': 1, 'uri': 'http://repository.lppm.unila.ac.id/id/document/184895'}]",unpub,"[{'type': 'http://www.loc.gov/loc.terms/relators/AUT'}, {'type': 'http://www.loc.gov/loc.terms/relators/AUT'}, {'type': 'http://www.loc.gov/loc.terms/relators/AUT'}]",http://repository.lppm.unila.ac.id/id/eprint/46074,public,"['Prodi Pendidikan Bahasa Inggris FKIP Unila', 'Prodi Pendidikan Bahasa Inggris FKIP Unila', 'Prodi Pendidikan Bahasa Inggris FKIP Unila']",1044,2022-10-29 11:28:57,2022-10-29 11:28:57,,,,,,,,,,,,,,,
1,43641,,Persyaratan Tambahan Pengajuan Guru Besar,show,10,archive,2022-07-27 01:22:47,"No	Jenis kontrak	No Kontrak	Tanggal	Jumlah dana, Rp
1	Kerja sama dengan industri
PT Hutama Karya	33.03.PP/HK-DSU/TOL.TTP/2022	11 Maret 2022	Rp 104.520.000
2	Kerja sama dengan industri
Pabrik Genteng Ibukota	011/SPPP/IB/PENELITIAN/XII/2021	21 Desember 2021	Rp 50.000.000
3	Profesorship	023.17.2.677516/2021	23 November 2020	Rp50.000.000",['TA'],"[{'name': {'lineage': None, 'family': 'Chatarina', 'honourific': None, 'given': 'Niken'}, 'id': 'chatarinaniken@yahoo.com'}]",disk0/00/04/36/41,2022-07-27 00:00:00.000000000,other,['FKIP1'],Universitas Lampung,"[{'files': [{'uri': 'http://repository.lppm.unila.ac.id/id/file/475991', 'objectid': 165580, 'filesize': 6200975, 'datasetid': 'document', 'mtime': '2022-07-27 00:45:01', 'hash_type': 'MD5', 'filename': 'Persyaratan Tambahan.pdf', 'hash': '7e4020120321818c261285ead77fce96', 'fileid': 475991, 'mime_type': 'application/pdf'}], 'main': 'Persyaratan Tambahan.pdf', 'docid': 165580, 'uri': 'http://repository.lppm.unila.ac.id/id/document/165580', 'rev_number': 1, 'format': 'text', 'pos': 1, 'security': 'public', 'placement': 1, 'eprintid': 43641, 'mime_type': 'application/pdf', 'language': 'en'}]",unpub,,http://repository.lppm.unila.ac.id/id/eprint/43641,public,,846,2022-07-27 01:22:47,2022-07-27 01:22:47,"['PT Hutama Karya', 'Pabrik Genteng Ibukota', 'DIPA BLU']",chatarinaniken@yahoo.com,Bandar Lampung,"['Perilaku pelat sebagai model jalan beton', 'Kerapuhan Genteng Beton', 'Degradasi Beton basement RSPTN Unila']",,,,,,,,,,,
2,46215,published,MENINGKATKAN KETERAMPILAN BERBAHASAPRANCIS  BAGI PEMANDU WISATA PEMULA,show,6,archive,2022-11-03 00:53:31,"Tujuan yang ingin dicapai dalam kegiatan ini adalah memberikan pengetahuan atau wawasan kepada  para  siswa SMK Negeri 3  Bandarlampung  tentang bagaimana menjadi penamdu wisata yang baik dan professional  dalam   bahasa  Prancis.    Metode    yang   digunakan dalam  pelatihan  ini  adalah  metode  ceramah,  tanya  jawab,  dan praktik.,   Pada awalnya para   peserta pelatihan   menyimak  penjelasan    yang  diberikan  oleh  narasumber  dengan seksama dan antusias dengan dibantu media power point yang ditampilkan melalui LCD. Kemudian para peserta pelatihan  diberikan waktu untuk berpraktik memerankan atau menjadi pemandu wisata di dalam kelompok mereka masing-masing. Setelah itu mereka diberikan waktu untuk     bertanya kepada nara sumber tentang materi yang kurang jelas, kemudian nara sumber  menjawab semua  pertanyaan  tersebut. Dalam kegiatan ini diberikan pre- test  dan post-test untuk mengetahui sejauh mana pengetahuan para peserta sebelum dan sesudah pelatihan diberikan. Sasaran kegiatan pengabdian ini adalah para siswa kelas X SMK Negeri 3  Bandarlampung yang telah belajar bahasa Prancis melalui program muatan peminatan kejuruan  pada kurikulum  di sekolah SMK , sebanyak 32  orang.  Tempat pelatihan dilaksanakan di SMK N 3 Bandarlampung ,Jalan Cut Mutia, Gulak Galik, kecamatan Teluk Betung Utara 35212 Bandarlampung.  Adapun  pelatihannya d ilaksanakan  selama  3  hari  yaitu  dari tanggal  15  sam[ai dengan 7  Juni  2022.   Hasil Pre- test dan Post- Tes menunjukkan adanya kemajuan, diperoleh nilai rata- rata Pre-Test 21,5 dan Post-Test  61,9375.  Hal itu menunjukkan ada  peningkatan 40,4375 point.  Harapan dari kegiatan    ini adalah para siswa  SMK Negeri 3  Bandarlampung  dapat memahami dan mengerti   bagaimana menjadi pemandu wisata yang baik dan  professional sesuai dengan kriteria standar  yang diinginkan.   
Kata Kunci : Bahasa Prancis, Pemandu wisata, Pemula.",['L1'],"[{'id': 'endang.ikhtiarti@fkip.unila.aac.id', 'name': {'lineage': None, 'honourific': None, 'family': 'Endang', 'given': 'Ikhtiarti'}}, {'name': {'given': 'Rosita', 'lineage': None, 'honourific': None, 'family': 'Diana'}, 'id': 'ndianarosita@ymail.com'}, {'name': {'family': 'Indah Nevira', 'honourific': None, 'lineage': None, 'given': 'INT'}, 'id': 'indah.nevira@fkip.unila.ac.id'}, {'id': 'setiarini99@yahoo.fr', 'name': {'given': 'Rini', 'honourific': None, 'family': 'Setia', 'lineage': None}}]",disk0/00/04/62/15,2022-09-25 00:00:00.000000000,article,['FKIP1'],"Jurusan Pendidikan Bahasa dan Seni, FKIP Universitas Lampung","[{'docid': 185104, 'main': 'LAPORAN PENGABDIAN-ENDANG IKHTIARTI- BHS PRANCIS-FKIP.pdf', 'files': [{'mtime': '2022-11-02 18:50:19', 'hash_type': 'MD5', 'hash': '0e8f4c0380f494e1d3568cb98b6dd20a', 'filename': 'LAPORAN PENGABDIAN-ENDANG IKHTIARTI- BHS PRANCIS-FKIP.pdf', 'fileid': 510825, 'mime_type': 'application/pdf', 'filesize': 617556, 'datasetid': 'document', 'uri': 'http://repository.lppm.unila.ac.id/id/file/510825', 'objectid': 185104}], 'pos': 1, 'format': 'text', 'rev_number': 1, 'uri': 'http://repository.lppm.unila.ac.id/id/document/185104', 'eprintid': 46215, 'placement': 1, 'security': 'public', 'mime_type': 'application/pdf', 'language': 'en'}]",pub,,http://repository.lppm.unila.ac.id/id/eprint/46215,public,,236,2022-11-03 00:53:31,2022-11-03 00:53:31,,,,,Jurnal Pengabdian Kepada Masyarakat Education Language and Arts (ELA),"p-ISSN: 1234-5678, e-ISSN: 1234-5678",TRUE,2.0,120-130,1.0,https://journals.fkip.unila.ac.id/index.php/ela/article/view/41,[{'url': 'https://journals.fkip.unila.ac.id/index.php/ela/article/view/41'}],,,
3,503,published,"Negotiation of Meaning: Language awareness 
and Corrective Feedback",show,9,archive,2023-04-13 00:35:10,,['PE'],"[{'id': 'nainggolan.flora@yahoo.com', 'name': {'given': 'Flora', 'family': 'Flora', 'honourific': None, 'lineage': None}}]",disk0/00/00/05/03,2022-12-31 00:00:00.000000000,other,['FKIP1'],Graha Ilmu,"[{'language': 'en', 'mime_type': 'application/pdf', 'security': 'public', 'placement': 1, 'eprintid': 503, 'rev_number': 1, 'uri': 'http://repository.lppm.unila.ac.id/id/document/190099', 'format': 'text', 'pos': 1, 'files': [{'uri': 'http://repository.lppm.unila.ac.id/id/file/543994', 'objectid': 190099, 'hash': 'b47ca937e564f445d463bd22cf690f76', 'filename': 'Negotiation of Meaning-hal cov sd romawi-1.pdf', 'mtime': '2023-04-12 11:51:59', 'hash_type': 'MD5', 'mime_type': 'application/pdf', 'fileid': 543994, 'filesize': 3507253, 'datasetid': 'document'}], 'main': 'Negotiation of Meaning-hal cov sd romawi-1.pdf', 'docid': 190099}]",pub,,http://repository.lppm.unila.ac.id/id/eprint/503,public,,848,2023-04-13 00:35:10,2023-04-13 00:35:10,,,Yogyakarta,,,,TRUE,,,,http://grahailmu.id/graha-ilmu/produk/negotiation-of-meaning-language-awareness-and-corrective-feedback/,"[{'type': 'pub', 'url': 'http://grahailmu.id/graha-ilmu/produk/negotiation-of-meaning-language-awareness-and-corrective-feedback/'}]",978-623-376-182-6,,
4,46072,,"Context and Language Learning Strategies:
Thai students’ strategies within the realms of learning English and Indonesian (Similarity Check)",show,7,archive,2022-10-29 11:28:44,"Abstract—This study aimed at finding the learning strategies
of Thai students within English and Indonesian during their
study in Lampung, Indonesia. This study applied the descriptive quantitative design; the subjects were 13 female Thai students taking a bachelor’s degree in Indonesia; and the instrument used was a variant of SILL. It was found that overall they used different strategies in learning the two languages in different contexts. The result also shows that there are significantly differences in language strategies used by the Thai students in learning English and Indonesian especially in Cognitive strategy and Social strategy when they learn in Indonesia. The results are discussed in light of the previous research findings in relevance to those of this study",['PE'],"[{'name': {'lineage': None, 'honourific': None, 'family': 'Flora', 'given': 'Flora'}, 'id': 'nainggolan.flora@yahoo.com'}, {'name': {'given': 'Patuan', 'lineage': None, 'family': 'Raja', 'honourific': None}, 'id': 'patuan.raja@fkip.unila.ac.id'}]",disk0/00/04/60/72,2022-10-29 00:00:00.000000000,other,['FKIP1'],FKIP Universitas Lampung,"[{'main': '09-Context and Language Learning Strategies Thai students’ strategies .pdf.pdf', 'docid': 184893, 'files': [{'objectid': 184893, 'uri': 'http://repository.lppm.unila.ac.id/id/file/509672', 'datasetid': 'document', 'filesize': 2452298, 'fileid': 509672, 'mime_type': 'application/pdf', 'mtime': '2022-10-29 07:09:20', 'hash_type': 'MD5', 'hash': '9ae579397b72e60b6e7ec9741457d663', 'filename': '09-Context and Language Learning Strategies Thai students’ strategies .pdf.pdf'}], 'pos': 1, 'format': 'text', 'uri': 'http://repository.lppm.unila.ac.id/id/document/184893', 'rev_number': 1, 'eprintid': 46072, 'placement': 1, 'security': 'public', 'language': 'en', 'mime_type': 'application/pdf'}]",unpub,"[{'type': 'http://www.loc.gov/loc.terms/relators/AUT'}, {'type': 'http://www.loc.gov/loc.terms/relators/AUT'}]",http://repository.lppm.unila.ac.id/id/eprint/46072,public,"['Prodi Pendidikan Bahasa Inggris FKIP Unila', 'Prodi Pendidikan Bahasa Inggris FKIP Unila']",1044,2022-10-29 11:28:44,2022-10-29 11:28:44,,,,,,,,,,,,,,,
5,46068,,DISCOVERY LEARNING STRATEGY: INTEGRATING THINK-PAIR-SHARE AND TEACHER’S CORRECTIVE FEEDBACK TO ENHANCE STUDENTS’ WRITING LANGUAGE ACCURACY (SIMILARITY CHECK),show,7,archive,2022-10-29 11:28:31,"This research aimed at finding out the students‟ writing language accuracy and their experience (perception) after learning how to use the integration of Think-Pair-Share (TPS) and Teacher‟s Corrective Feedback (TCF) within discovery learning strategy. A quantitative study in the form of pre-experimental design was conducted which involved 24 students of English study program in the Faculty of Education at Lampung University-Indonesia who took Pre-Intermediate writing class. These students were prepared to be junior and/or senior school English teachers. Therefore, language accuracy was badly needed. The results demonstrate that there was improvement of students‟ writing language accuracy after the implementation of integrating Think-Pair-Share and teacher‟s corrective feedback within discovery learning strategy. Grammar accuracy was the highest compared to vocabulary and spelling accuracy. In addition, the students demonstrated positive perception among the five categories of perception, interest and motivation were the highest. It is because of the steps of TPS and minimum TCF in the form of scaffolding and constructive questions of the teacher.",['PE'],"[{'id': 'nainggolan.flora@yahoo.com', 'name': {'lineage': None, 'family': 'Flora', 'honourific': None, 'given': 'Flora'}}, {'name': {'given': 'Patuan', 'lineage': None, 'honourific': None, 'family': 'Raja'}, 'id': 'patuan.raja@fkip.unila.ac.id'}, {'id': 'mahpu_mahpul@yahoo.com', 'name': {'given': 'Mahpul', 'lineage': None, 'family': 'Mahpul', 'honourific': None}}]",disk0/00/04/60/68,2022-10-29 00:00:00.000000000,other,['FKIP1'],FKIP Universitas Lampung,"[{'rev_number': 1, 'uri': 'http://repository.lppm.unila.ac.id/id/document/184889', 'pos': 1, 'format': 'text', 'files': [{'datasetid': 'document', 'filesize': 542175, 'fileid': 509644, 'mime_type': 'application/pdf', 'hash_type': 'MD5', 'mtime': '2022-10-29 06:48:42', 'filename': '02-Discovery Learning Strategy Integrating Think-Pair-Share and Teacher’s Corrective.pdf.pdf', 'hash': '3cdc8f5720d0d19a2bd89c8c0f58a717', 'objectid': 184889, 'uri': 'http://repository.lppm.unila.ac.id/id/file/509644'}], 'docid': 184889, 'main': '02-Discovery Learning Strategy Integrating Think-Pair-Share and Teacher’s Corrective.pdf.pdf', 'mime_type': 'application/pdf', 'language': 'en', 'placement': 1, 'security': 'public', 'eprintid': 46068}]",unpub,"[{'type': 'http://www.loc.gov/loc.terms/relators/AUT'}, {'type': 'http://www.loc.gov/loc.terms/relators/AUT'}, {'type': 'http://www.loc.gov/loc.terms/relators/AUT'}]",http://repository.lppm.unila.ac.id/id/eprint/46068,public,"['Prodi Pendidikan Bahasa Inggris FKIP Unila', 'Prodi Pendidikan Bahasa Inggris FKIP Unila', 'Prodi Pendidikan Bahasa Inggris FKIP Unila']",1044,2022-10-29 11:28:31,2022-10-29 11:28:31,,,,,,,,,,,,,,,
6,46073,,MODIFIED PPP PROCEDURE IN TEACHING CONDITIONAL SENTENCES THROUGH WHATSAPP FOR VOCATIONAL SCHOOL STUDENTS (SIMILARITY CHECK),show,7,archive,2022-10-29 11:28:51,"The aims of the study are to find out whether there is a significant difference in students' achievement of conditional sentences between those who are taught using modified PPP procedure through WhatsApp and those who are taught using original PPP procedure in limited offline learning. The population was the students of SMKN 1 Metro. This study is quasi-experimental, and the sampling
was taken in two classes. The experimental class was given the treatment using a modified PPP procedure through WhatsApp. In contrast, the control class was given the treatment using the original PPP procedure in limited offline learning. The findings showed a significant difference in students' achievement of conditional sentences between those two procedures, which is in line with the difference in students' perception of the learning process between those two classes. Modified one was more effective in improving students' achievement of conditional sentences, especially in pandemic Covid 19, where online learning is necessary. The conclusion is that the modification of the PPP procedure through WhatsApp is very effective to use even after the pandemic, because there are more opportunities for students to discuss using WhatsApp which makes them gain a deeper understanding and better achievement of the conditional sentence material.",['PE'],"[{'id': 'umimarifah03@gmail.com', 'name': {'given': 'Umi', 'honourific': None, 'family': ""Ma'rifah"", 'lineage': None}}, {'name': {'given': 'Patuan', 'family': 'Raja', 'honourific': None, 'lineage': None}, 'id': 'patuan.raja@fkip.unila.ac.id'}, {'id': 'nainggolan.flora@yahoo.com', 'name': {'given': 'Flora', 'lineage': None, 'honourific': None, 'family': 'Flora'}}]",disk0/00/04/60/73,2022-10-29 00:00:00.000000000,other,['FKIP1'],FKIP Universitas Lampung,"[{'eprintid': 46073, 'placement': 1, 'security': 'public', 'language': 'en', 'mime_type': 'application/pdf', 'main': '10-Modified PPP Procedure in Teaching Conditional Sentences Through .pdf.pdf', 'docid': 184894, 'files': [{'datasetid': 'document', 'filesize': 645445, 'fileid': 509679, 'mime_type': 'application/pdf', 'hash_type': 'MD5', 'mtime': '2022-10-29 07:12:22', 'filename': '10-Modified PPP Procedure in Teaching Conditional Sentences Through .pdf.pdf', 'hash': 'a2a0912cc415acb533b004cce09cc2f2', 'objectid': 184894, 'uri': 'http://repository.lppm.unila.ac.id/id/file/509679'}], 'pos': 1, 'format': 'text', 'rev_number': 1, 'uri': 'http://repository.lppm.unila.ac.id/id/document/184894'}]",unpub,"[{'type': 'http://www.loc.gov/loc.terms/relators/AUT'}, {'type': 'http://www.loc.gov/loc.terms/relators/AUT'}, {'type': 'http://www.loc.gov/loc.terms/relators/AUT'}]",http://repository.lppm.unila.ac.id/id/eprint/46073,public,"['Prodi Pendidikan Bahasa Inggris FKIP Unila', 'Prodi Pendidikan Bahasa Inggris FKIP Unila', 'Prodi Pendidikan Bahasa Inggris FKIP Unila']",1044,2022-10-29 11:28:51,2022-10-29 11:28:51,,,,,,,,,,,,,,,
7,42763,published,TRANSLANGUAGING PRACTICES IN EFL CLASSROOMS:EVIDENCE FROM INDONESIA,show,10,archive,2022-06-28 09:47:47,"The aim of this paper is to elucidate a comprehensive perspective on translanguaging practices in EFL classrooms in Indonesia by reviewing empirical literature published in scientific journals and/or proceedings focusing on four primary areas, which include: (1) research methodology; (2) advantages and disadvantages of translanguaging; (3) languages
used when translanguaging; and (4) perceptions and attitudes toward translanguaging. The findings indicate all of the studies under review were conducted through a qualitative
approach with the instruments of observations, interviews, and questionnaire. Teachers and students have the benefit of translanguaging practices in EFL classrooms, yet it should be
taken into account that L1 should be adopted judiciously. They translanguage using English, Indonesian, and local languages and even foreign languages other than English. They have voiced their agreement to the implementation of translanguaging as pedagogy since it positively impacts EFL teaching and learning. However, few teachers have contrasting views about this voice. Suggestions for future research on translanguaging are also discussed.","['L1', 'P1']","[{'name': {'given': 'GEDE EKA', 'family': 'PUTRAWAN', 'honourific': None, 'lineage': None}, 'id': 'gputrawan08@gmail.com'}]",disk0/00/04/27/63,2022-06-28 00:00:00.000000000,article,['FKIP1'],Facultas Ilmu Budaya Universitas Mulawarman,"[{'docid': 164482, 'main': '7973-23215-1-PB-OK.pdf', 'files': [{'hash_type': 'MD5', 'mtime': '2022-06-28 09:07:48', 'filename': '7973-23215-1-PB-OK.pdf', 'hash': '4c78e8736fee0ee37f9a2a8309591069', 'fileid': 468784, 'mime_type': 'application/pdf', 'filesize': 315983, 'datasetid': 'document', 'uri': 'http://repository.lppm.unila.ac.id/id/file/468784', 'objectid': 164482}], 'format': 'text', 'pos': 1, 'formatdesc': 'Artikel Publikasi', 'uri': 'http://repository.lppm.unila.ac.id/id/document/164482', 'rev_number': 3, 'eprintid': 42763, 'security': 'public', 'placement': 1, 'language': 'en', 'mime_type': 'application/pdf', 'content': 'published'}, {'eprintid': 42763, 'placement': 2, 'security': 'public', 'language': 'en', 'mime_type': 'application/pdf', 'content': 'other', 'docid': 164483, 'main': 'Similarity-Report-Translanguaging practices ... 7973-23215-1-PB.pdf', 'files': [{'mime_type': 'application/pdf', 'fileid': 468787, 'hash': '866e673b32ddd103da1344ab2654c21a', 'filename': 'Similarity-Report-Translanguaging practices ... 7973-23215-1-PB.pdf', 'hash_type': 'MD5', 'mtime': '2022-06-28 09:14:37', 'datasetid': 'document', 'filesize': 3965627, 'objectid': 164483, 'uri': 'http://repository.lppm.unila.ac.id/id/file/468787'}], 'pos': 2, 'format': 'text', 'rev_number': 2, 'uri': 'http://repository.lppm.unila.ac.id/id/document/164483', 'formatdesc': 'Similarity Report'}]",pub,,http://repository.lppm.unila.ac.id/id/eprint/42763,public,,1177,2022-06-28 09:47:47,2022-06-28 09:47:47,,,,,"CaLLs (Journal of Culture, Arts, Literature, and Linguistics)",2549-7707,TRUE,1.0,69-86,8.0,http://e-journals.unmul.ac.id/index.php/CALLS/article/view/7973/4388,[{'url': 'http://e-journals.unmul.ac.id/index.php/CALLS/article/view/7973'}],http://dx.doi.org/10.30872/calls.v8i1.7973,,
8,42716,published,BILINGUALS’ LINGUISTIC REPERTOIRE AND FOREIGN LANGUAGE INSTRUCTION: WHAT DO TEACHERS SAY ABOUT TEACHING EFL THROUGH TRANSLANGUAGING?,show,10,archive,2022-06-24 01:13:41,"In recent decades, translanguaging has made rapid progress in the field of language instruction. The term ""translanguaging"" implies that bilinguals have a single linguistic repertoire from which they strategically select linguistic features for effective communication. The current method of language education, which takes a monolingual approach, faces a challenge from the phenomenon known as translanguaging. Therefore, this study aims to describe the perspectives of Indonesian EFL teachers on translanguaging-based EFL instruction for students from a variety of linguistic backgrounds. This is a qualitative study employing interviews to collect data, with eight EFL teachers serving as participants. A content analysis was used to analyze the collected data. This study suggests that EFL teachers have divergent perspectives on translanguaging in EFL classrooms. However, those with negative attitudes toward translanguaging recognize the importance of this pedagogical approach and continue to use L1 in their EFL classrooms, indicating that they still believe in monolingual pedagogy even though they do not fully apply it. Finally, the study's implications and limitations are discussed.","['PE', 'PL']","[{'id': 'gputrawan08@gmail.com', 'name': {'lineage': None, 'family': 'PUTRAWAN', 'honourific': None, 'given': 'GEDE EKA'}}, {'name': {'family': 'Sinaga', 'honourific': None, 'lineage': None, 'given': 'Tuntun'}, 'id': 'tuntunsinaga@gmail.com'}]",disk0/00/04/27/16,2022-05-30 00:00:00.000000000,article,['FKIP1'],"Fakultas Sastra, Universitas Islam Sumatera Utara (UISU)","[{'placement': 1, 'security': 'public', 'eprintid': 42716, 'content': 'published', 'language': 'en', 'mime_type': 'application/pdf', 'files': [{'uri': 'http://repository.lppm.unila.ac.id/id/file/468414', 'objectid': 164435, 'filesize': 730922, 'datasetid': 'document', 'hash_type': 'MD5', 'mtime': '2022-06-23 16:53:15', 'hash': 'dfff5501358cfd9a0098fbe1682e39a8', 'filename': '5489-14561-1-PB.pdf', 'fileid': 468414, 'mime_type': 'application/pdf'}], 'docid': 164435, 'main': '5489-14561-1-PB.pdf', 'uri': 'http://repository.lppm.unila.ac.id/id/document/164435', 'rev_number': 2, 'pos': 1, 'format': 'text'}, {'placement': 2, 'security': 'public', 'eprintid': 42716, 'content': 'other', 'mime_type': 'application/pdf', 'language': 'en', 'files': [{'uri': 'http://repository.lppm.unila.ac.id/id/file/468417', 'objectid': 164436, 'hash_type': 'MD5', 'mtime': '2022-06-23 16:53:54', 'hash': 'df2cba64b200e629568dce826d67fe3c', 'filename': 'BILINGUALS’ LINGUISTIC REPERTOIRE-SimilarityReport9.pdf', 'fileid': 468417, 'mime_type': 'application/pdf', 'filesize': 1885428, 'datasetid': 'document'}], 'docid': 164436, 'main': 'BILINGUALS’ LINGUISTIC REPERTOIRE-SimilarityReport9.pdf', 'uri': 'http://repository.lppm.unila.ac.id/id/document/164436', 'rev_number': 3, 'formatdesc': 'Similarity Report', 'pos': 2, 'format': 'other'}]",pub,,http://repository.lppm.unila.ac.id/id/eprint/42716,public,,1177,2022-06-24 01:13:41,2022-06-24 01:13:41,,,,,Journal of Language,2685-8878,TRUE,1.0,166-172,4.0,https://jurnal.uisu.ac.id/index.php/journaloflanguage/article/view/5489,[{'url': 'https://jurnal.uisu.ac.id/index.php/journaloflanguage/article/view/5489/pdf'}],https://doi.org/10.30743/jol.v4i1.5489,,
