,eprintid,date_type,title,metadata_visibility,rev_number,eprint_status,status_changed,abstract,subjects,creators,dir,date,type,divisions,publisher,documents,ispublished,contributors,uri,full_text_status,corp_creators,userid,lastmod,datestamp,funders,contact_email,place_of_pub,projects,publication,issn,refereed,number,pagerange,volume,official_url,related_url,id_number,referencetext,succeeds
20,42750,published,Correlation of Vocabulary Proficiency and Learning Styles with Reading Comprehension of Prospective English Teachers: A Case of Universitas Lampung.,show,8,archive,2022-06-27 08:26:49,"Correlation of Vocabulary Proficiency and Learninng Styles with Reading Comprehension of Prospective English Teachers: A Case of Universitas Lampung. Objectives: To analyze the correlation of vocabulary proficiency (X1) and reading achievement (Y);
second, to investigate the correlation between learning styles (X2) and reading achievement (Y); andto analyze the composite correlation between X1, X2 and Y. Methods: Simple random technique was used, 80 students were chosen, out of 120, based on the total sample, i.e., all students taking reading
comprehension and vocabulary. A questionaire was used to measure learning styles, and two sets of tests were used, to measure vocabulary and reading achievement. Findings: There was a correlation between students’ vocabulary proficiency (X1) and reading achievement (Y), r = 0.532; there was a correlation between learning styles (X2) and reading achievement (Y), r = 0.784; finally, there was a correlation between X1, X2 and Y, r = 0.823. Conclusion: Vocabulary proficiency and learning styles
play important roles in improving reading achievement.","['L1', 'LB1501', 'LC5201']","[{'name': {'honourific': None, 'family': 'Ujang', 'lineage': None, 'given': 'Suparman'}, 'id': 'ujang.suparman@fkip.unila.ac.id'}]",disk0/00/04/27/50,2022-06-25 00:00:00.000000000,article,['FKIP1'],Unit Database dan Publikasi Ilmiah FKIP kerjasama dengan ISPI,"[{'pos': 1, 'format': 'text', 'rev_number': 1, 'uri': 'http://repository.lppm.unila.ac.id/id/document/164469', 'main': 'Correlation of Vocabulary Proficiency and Learning Styles with Reading.pdf', 'docid': 164469, 'files': [{'hash': 'b3f7764e8d23b990d0ff87b862c67e18', 'filename': 'Correlation of Vocabulary Proficiency and Learning Styles with Reading.pdf', 'hash_type': 'MD5', 'mtime': '2022-06-27 07:34:04', 'mime_type': 'application/pdf', 'fileid': 468667, 'filesize': 2407844, 'datasetid': 'document', 'uri': 'http://repository.lppm.unila.ac.id/id/file/468667', 'objectid': 164469}], 'language': 'en', 'mime_type': 'application/pdf', 'eprintid': 42750, 'placement': 1, 'security': 'public'}]",pub,,http://repository.lppm.unila.ac.id/id/eprint/42750,public,,992,2022-06-27 08:26:49,2022-06-27 08:26:49,,,,,Jurnal Pendidikan Progresif,2087-9849,TRUE,3.0,1021-1033,12.0,http://jurnal.fkip.unila.ac.id/index.php/jpp/article/view/24774/pdf,,,,
21,42749,published,Correlational study of vocabulary mastery and cognitive learning style in vocational school.,show,8,archive,2022-06-27 08:26:47,"The  research  is  intended  to  analyze  whether  there  is  a  correlation  between students’ vocabulary mastery and cognitive learning  style  with  their  reading comprehension  ability.  Methodology:  It  was  conducted  in  Muhammadiyah Vocational  school  Bandar  Lampung.  The  sample  comprises  30  students  using random  sampling  technique.  A  questionnaire  was  used  to  trace  students’ cognitivelearning strategy, and two sets of tests were used to measure students’ vocabulary   mastery   and   another   to   measure   their   reading   ability.   The instruments were tried out to determine the quality of validity, reliability, level of difficulty and discriminating power. The findings: It has been found that, first, there    is    a    correlation    between    vocabulary    mastery    (X1)    and    reading comprehension  (Y),  where  rx1.y  =  0.35;  second,  there  is  a  correlation  between students’ cognitive learning style (X2) and their reading ability (Y). where rx2.y= 0.95,  it  is  very  strong  correlation:  and  finally,  there  is  a  composite  correlation between X1, X2, and their reading ability (Y). Multiple regression is 0.997 meaning that  there  is  a  positive  and  significant  correlation  between  X1,  X2,  and  Y.  It suggests  that  to  improve  reading  ability,  teachers  should  develop  students’ vocabulary  mastery  and  cognitive  learning  style.  Cognitive  learning  style  and vocabulary mastery cannot be separated.","['L1', 'LB1501', 'LC5201']","[{'name': {'given': 'Suparman', 'lineage': None, 'honourific': None, 'family': 'Ujang'}, 'id': 'ujang.suparman@fkip.unila.ac.id'}]",disk0/00/04/27/49,2022-04-01 00:00:00.000000000,article,['FKIP1'],Universitas Tanjungpura,"[{'mime_type': 'application/pdf', 'language': 'en', 'security': 'public', 'placement': 1, 'eprintid': 42749, 'rev_number': 1, 'uri': 'http://repository.lppm.unila.ac.id/id/document/164468', 'format': 'text', 'pos': 1, 'files': [{'objectid': 164468, 'uri': 'http://repository.lppm.unila.ac.id/id/file/468659', 'datasetid': 'document', 'filesize': 569337, 'fileid': 468659, 'mime_type': 'application/pdf', 'hash_type': 'MD5', 'mtime': '2022-06-27 07:28:18', 'filename': 'Correlational study of vocabulary mastery and cognitive learning style in vocational school..pdf', 'hash': '9970ae9ea5f69048a845aee0a3eda9a2'}], 'docid': 164468, 'main': 'Correlational study of vocabulary mastery and cognitive learning style in vocational school..pdf'}]",pub,,http://repository.lppm.unila.ac.id/id/eprint/42749,public,,992,2022-06-27 08:26:47,2022-06-27 08:26:47,,,,,Journal of English Language Teaching Innovations and Materials (JELTIM),2657-1617,TRUE,1.0,102-126,4.0,https://jurnal.untan.ac.id/index.php/JELTIM/article/view/33159/pdf,,,,
22,42917,published,Modified PPP Procedure in Teaching Conditional Sentences Through Whatsapp for Vocational School Students,show,6,archive,2022-07-05 02:22:18,"he aims of the study are to find out whether there is a significant difference in students' achievement of conditional sentences between those who are taught using modified PPP procedure through WhatsApp and those who are taught using original PPP procedure in limited offline learning. The population was the students of SMKN 1 Metro. This study is quasi-experimental, and the sampling was taken in two classes. The experimental class was given the treatment using a modified PPP procedure through WhatsApp. In contrast, the control class was given the treatment using the original PPP procedure in limited offline learning. The findings showed a significant difference in students' achievement of conditional sentences between those two procedures, which is in line with the difference in students' perception of the learning process between those two classes. Modified one was more effective in improving students' achievement of conditional sentences, especially in pandemic Covid 19, where online learning is necessary. The conclusion is that the modification of the PPP procedure through WhatsApp is very effective to use even after the pandemic, because there are more opportunities for students to discuss using WhatsApp which makes them gain a deeper understanding and better achievement of the conditional sentence material.",['L1'],"[{'name': {'family': 'marifah', 'honourific': None, 'lineage': None, 'given': 'Umi'}, 'id': None}, {'id': None, 'name': {'honourific': None, 'family': 'Patuan Raja', 'lineage': None, 'given': 'Patuan'}}, {'id': 'nainggolan.flora@yahoo.com', 'name': {'honourific': None, 'family': 'Flora', 'lineage': None, 'given': 'Flora'}}]",disk0/00/04/29/17,1970-01-01 00:00:00.000002022,article,['FKIP1'],Lembaga Penerbitan dan Publikasi Ilmiah Program Pascasarjana     IAI Sunan Giri Ponorogo.,"[{'eprintid': 42917, 'placement': 1, 'security': 'public', 'language': 'en', 'mime_type': 'application/pdf', 'docid': 164703, 'main': 'document (10).pdf', 'files': [{'objectid': 164703, 'uri': 'http://repository.lppm.unila.ac.id/id/file/469954', 'datasetid': 'document', 'filesize': 559322, 'fileid': 469954, 'mime_type': 'application/pdf', 'hash_type': 'MD5', 'mtime': '2022-07-05 01:22:29', 'hash': '556e5a5d7ec995a57d735b9a3a5e1155', 'filename': 'document (10).pdf'}], 'pos': 1, 'format': 'text', 'rev_number': 1, 'uri': 'http://repository.lppm.unila.ac.id/id/document/164703'}]",pub,,http://repository.lppm.unila.ac.id/id/eprint/42917,public,,1044,2022-07-05 02:22:18,2022-07-05 02:22:18,,,,,"Qalamuna - Jurnal Pendidikan, Sosial, dan Agama",1907-6355,TRUE,1.0,133-152,14.0,https://ejournal.insuriponorogo.ac.id/index.php/qalamuna/article/view/1462,,,,
