,eprintid,date_type,title,metadata_visibility,rev_number,eprint_status,status_changed,abstract,subjects,creators,dir,date,type,divisions,publisher,documents,ispublished,contributors,uri,full_text_status,corp_creators,userid,lastmod,datestamp,funders,contact_email,place_of_pub,projects,publication,issn,refereed,number,pagerange,volume,official_url,related_url,id_number,referencetext,succeeds
12,46071,,"English as an International Language: Perceptions of EFL
Preservice Teachers in Higher Education Institutions in Indonesia (Similarity Check)",show,7,archive,2022-10-29 11:28:38,"It is widely known that the English language has rapidly spread across the globe and is now used for a wide range of purposes. Its status as a national/foreign language has shifted to that of an international language. Despite this awareness, however, studies on perceptions of English as an international language (EIL) among EFL preservice teachers in the Indonesian context are not commonplace in the literature. Therefore, this study was aimed at elucidating the perceptions of the four aspects of EIL among
EFL preservice teachers in higher education institutions in Indonesia. This quantitative study adopted a descriptive approach using a five-point Likert scale questionnaire with a total of 14 close-ended statements. Data collected from the questionnaire were analysed using descriptive statistics. The findings suggest that EIL is positively viewed by participants as a means of global communication to achieve a variety of purposes. They welcome and accept various varieties of English, demonstrating a strong
multilingual/multicultural understanding through their ability to accept different pronunciation patterns and adapt their behavior and conversational styles when interacting with people from diverse cultural backgrounds. They have a strong sense of ownership over their own English varieties. Finally, the study’s implications for the four aspects of EIL including the current status of English, English varieties, multicultural communication strategies, and the identity of English speakers are also discussed, along with limitations and recommendations for future research.",['PE'],"[{'id': 'patuan.raja@fkip.unila.ac.id', 'name': {'family': 'Raja', 'honourific': None, 'lineage': None, 'given': 'Patuan'}}, {'name': {'honourific': None, 'family': 'Flora', 'lineage': None, 'given': 'Flora'}, 'id': 'nainggolan.flora@yahoo.com'}, {'name': {'lineage': None, 'honourific': None, 'family': 'PUTRAWAN', 'given': 'GEDE EKA'}, 'id': 'gputrawan08@gmail.com'}, {'name': {'family': 'Razali', 'honourific': None, 'lineage': None, 'given': 'Abu Bakar'}, 'id': None}]",disk0/00/04/60/71,2022-10-29 00:00:00.000000000,other,['FKIP1'],FKIP Universitas Lampung,"[{'uri': 'http://repository.lppm.unila.ac.id/id/document/184892', 'rev_number': 1, 'pos': 1, 'format': 'text', 'files': [{'filename': '06. English as an International Language Perceptions of EFL Preservice Teachers in Higher Education .pdf', 'hash': '03968e83167c83a834f5a79a727a2a64', 'hash_type': 'MD5', 'mtime': '2022-10-29 07:00:17', 'mime_type': 'application/pdf', 'fileid': 509665, 'filesize': 486408, 'datasetid': 'document', 'uri': 'http://repository.lppm.unila.ac.id/id/file/509665', 'objectid': 184892}], 'docid': 184892, 'main': '06. English as an International Language Perceptions of EFL Preservice Teachers in Higher Education .pdf', 'language': 'en', 'mime_type': 'application/pdf', 'placement': 1, 'security': 'public', 'eprintid': 46071}]",unpub,"[{'type': 'http://www.loc.gov/loc.terms/relators/AUT'}, {'type': 'http://www.loc.gov/loc.terms/relators/AUT'}, {'type': 'http://www.loc.gov/loc.terms/relators/AUT'}, {'type': 'http://www.loc.gov/loc.terms/relators/AUT'}]",http://repository.lppm.unila.ac.id/id/eprint/46071,public,"['Prodi Pendidikan Bahasa Inggris FKIP Unila', 'Prodi Pendidikan Bahasa Inggris FKIP Unila', 'Prodi Pendidikan Bahasa Inggris FKIP Unila', 'University of Putra Malaysia']",1044,2022-10-29 11:28:38,2022-10-29 11:28:38,,,,,,,,,,,,,,,
13,41509,published,English as an International Language: Perceptions of EFL Preservice Teachers in Higher Education Institutions in Indonesia,show,16,archive,2022-05-09 01:27:51,"It is widely known that the English language has rapidly spread across the globe and is now used for a wide range of purposes. Its status as a national/foreign language has shifted to that of an international language. Despite this awareness, however, studies on perceptions of English as an international language (EIL) among EFL preservice teachers in the Indonesian context are not commonplace in the literature. Therefore, this study was aimed at elucidating the perceptions of the four aspects of EIL among EFL preservice teachers in higher education institutions in Indonesia. This quantitative study adopted a descriptive approach using a five-point Likert scale questionnaire with a total of 14 close-ended statements. Data collected from the questionnaire were analysed using descriptive statistics. The findings suggest that EIL is positively viewed by participants as a means of global communication to achieve a variety of purposes. They welcome and accept various varieties of English, demonstrating a strong multilingual/multicultural understanding through their ability to accept different pronunciation patterns and adapt their behavior and conversational styles when interacting with people from diverse cultural backgrounds. They have a strong sense of ownership over their own English varieties. Finally, the study’s implications for the four aspects of EIL including the current status of English, English varieties, multicultural communication strategies, and the identity of English speakers are also discussed, along with limitations and recommendations for future research.","['H1', 'L1', 'LB2300', 'PE']","[{'name': {'given': 'Patuan', 'lineage': None, 'family': 'Raja', 'honourific': None}, 'id': 'raja_pid@yahoo.com'}, {'id': 'nainggolan.flora@yahoo.com', 'name': {'lineage': None, 'honourific': None, 'family': 'Flora', 'given': 'Flora'}}, {'id': 'gputrawan08@gmail.com', 'name': {'given': 'GEDE EKA', 'lineage': None, 'family': 'PUTRAWAN', 'honourific': None}}, {'id': None, 'name': {'given': 'Abu Bakar', 'honourific': None, 'family': 'Razali', 'lineage': None}}]",disk0/00/04/15/09,2022-04-21 00:00:00.000000000,article,['FKIP1'],Hindawi,"[{'uri': 'http://repository.lppm.unila.ac.id/id/document/163153', 'rev_number': 2, 'format': 'text', 'pos': 1, 'files': [{'uri': 'http://repository.lppm.unila.ac.id/id/file/459590', 'objectid': 163153, 'mtime': '2022-04-29 07:42:42', 'hash_type': 'MD5', 'filename': '3234983 (3).pdf', 'hash': 'c7a5e2d5729356634b573507155af46e', 'fileid': 459590, 'mime_type': 'application/pdf', 'filesize': 468474, 'datasetid': 'document'}], 'main': '3234983 (3).pdf', 'docid': 163153, 'content': 'published', 'language': 'en', 'mime_type': 'application/pdf', 'security': 'public', 'placement': 1, 'eprintid': 41509}, {'placement': 2, 'security': 'public', 'eprintid': 41509, 'content': 'other', 'mime_type': 'application/pdf', 'language': 'en', 'files': [{'objectid': 163154, 'uri': 'http://repository.lppm.unila.ac.id/id/file/459593', 'datasetid': 'document', 'filesize': 960529, 'mime_type': 'application/pdf', 'fileid': 459593, 'filename': 'Korespondensi Education Research International Hindawi -PR.pdf', 'hash': '1906a4d13a9532bd954b34030f18b4fd', 'hash_type': 'MD5', 'mtime': '2022-04-29 07:44:35'}], 'docid': 163154, 'main': 'Korespondensi Education Research International Hindawi -PR.pdf', 'uri': 'http://repository.lppm.unila.ac.id/id/document/163154', 'rev_number': 2, 'formatdesc': 'Korespondensi Article ID 3234983', 'pos': 2, 'format': 'other'}, {'eprintid': 41509, 'security': 'public', 'placement': 3, 'language': 'en', 'mime_type': 'application/pdf', 'content': 'other', 'docid': 163155, 'main': 'Similarity-Article ID 3234983.pdf', 'files': [{'objectid': 163155, 'uri': 'http://repository.lppm.unila.ac.id/id/file/459596', 'fileid': 459596, 'mime_type': 'application/pdf', 'hash_type': 'MD5', 'mtime': '2022-04-29 07:46:28', 'hash': '51549556609fa7ef3d20d5bd310441a1', 'filename': 'Similarity-Article ID 3234983.pdf', 'datasetid': 'document', 'filesize': 2230091}], 'format': 'other', 'pos': 3, 'formatdesc': 'Similarity Report Article ID 3234983', 'rev_number': 2, 'uri': 'http://repository.lppm.unila.ac.id/id/document/163155'}]",pub,,http://repository.lppm.unila.ac.id/id/eprint/41509,public,,1177,2022-05-09 01:27:51,2022-05-09 01:27:51,['Universitas Lampung'],patuan.raja@fkip.unila.ac.id,,,Education Research International,2090-4002,TRUE,,1-8,2022.0,https://www.hindawi.com/journals/edri/2022/3234983/,[{'url': 'https://downloads.hindawi.com/journals/edri/2022/3234983.pdf'}],https://doi.org/10.1155/2022/3234983,,
14,46070,,THE CORRELATION BETWEEN PERCEPTIONS ON THE USE OF ONLINE DIGITAL INTERACTIVE MEDIA AND READING COMPREHENSION ABILITY (SIMILARITY CHECK),show,7,archive,2022-10-29 11:28:23,"The use of online interactive media in English teaching and learning has been significantly increasing since past few years. The media got more popular after distant or online learning was encouraged during the COVID-19 pandemic. The emergence of digital learning management systems such as Edmodo, Google Classroom, and Moddle further intensified the implementation of not only education-based platforms such as British Council and Quizziz, but also popularized non-education media such as YouTube, Instagram, and Twitter which were intentionally designed for entertainment. This research is designed to foster students’ perceptions on the use of online digital interactive media and correlate the perceptions with their reading comprehension ability. A total of 41 students from different middle and high schools, who lived in various orphanages, participated in this research. Close-ended Likert-scale questionnaire was distributed to obtain the data of students’ perceptions while reading comprehension test was adapted from British Council and implemented to see the correlation between the students’ perception and their reading comprehension ability. The finding shows that more than 75% of the students believed that online digital interactive media were very crucial and helpful in language learning process. Moreover, the mean score of the reading comprehension test indicated positive correlation between students’ perceptions and their reading comprehension ability. This study implies foster students’ perceptions in the use of online interactive media highly correlate with their reading comprehension performance.",['PE'],"[{'id': 'patuan.raja@fkip.unila.ac.id', 'name': {'honourific': None, 'family': 'Raja', 'lineage': None, 'given': 'Patuan'}}, {'id': 'bambang_setiyadi76@yahoo.co.id', 'name': {'given': 'Ag. Bambang', 'lineage': None, 'family': 'Setiyadi', 'honourific': None}}, {'id': 'fajar.riyantika@fkip.unila.ac.id', 'name': {'given': 'Fajar', 'lineage': None, 'honourific': None, 'family': 'Riyantika'}}]",disk0/00/04/60/70,2022-10-29 00:00:00.000000000,other,['FKIP1'],FKIP Universitas Lampung,"[{'files': [{'fileid': 509658, 'mime_type': 'application/pdf', 'mtime': '2022-10-29 06:56:43', 'hash_type': 'MD5', 'hash': '41fcc877894f831048a0cc8d000d6c63', 'filename': '05-The Correlation Between Perceptions on the Use of Online Digital06.pdf.pdf', 'datasetid': 'document', 'filesize': 3227481, 'objectid': 184891, 'uri': 'http://repository.lppm.unila.ac.id/id/file/509658'}], 'main': '05-The Correlation Between Perceptions on the Use of Online Digital06.pdf.pdf', 'docid': 184891, 'uri': 'http://repository.lppm.unila.ac.id/id/document/184891', 'rev_number': 1, 'format': 'text', 'pos': 1, 'security': 'public', 'placement': 1, 'eprintid': 46070, 'mime_type': 'application/pdf', 'language': 'en'}]",unpub,"[{'type': 'http://www.loc.gov/loc.terms/relators/AUT'}, {'type': 'http://www.loc.gov/loc.terms/relators/AUT'}, {'type': 'http://www.loc.gov/loc.terms/relators/AUT'}]",http://repository.lppm.unila.ac.id/id/eprint/46070,public,"['Prodi Pendidikan Bahasa Inggris FKIP Unila', 'Prodi Pendidikan Bahasa Inggris FKIP Unila', 'Prodi Pendidikan Bahasa Inggris FKIP Unila']",1044,2022-10-29 11:28:23,2022-10-29 11:28:23,,,,,,,,,,,,,,,
15,42426,published,"Aplikasi model berbasis masalah dalam membaca bahasa 
Prancis bagi mahasiswa",show,6,archive,2022-06-14 01:16:25,"Abstract
This study describes the reading French using a problem-based learning model, which is compared to reading French in conventionally. Reading in problem-based class has a positive impact on students' reading scores,and the growth of their self-awareness to work together and be responsible for solving the problems given. This study used an 
experimental method with a population of all semester 1 students of the French Language Education Study Program for the Academic Year 2019/2020, and the sample was carried out using a lottery technique for the experimental and the control class. The results of the study have proven that the reading ability of students in problem-based learning is 
higher than those using the conventional method, and the level of students' reading ability is in the good category with a median of 75, and the results of the study represent the population, so the hypothesis is accepted.
Keywords : problem-based learning, French reading skill.
Abstrak
Penelitian ini menggambarkan proses belajar membaca bahasa Prancis dengan menggunakan model belajar berbasis masalah, yang dibandingkan dengan belajar membaca secara konvensional. Belajar membaca di kelas 
berbasis masalah berdampak positif terhadap nilai membaca mahasiswa, dan tumbuhnya kesadaran diri mereka untuk bekerjasama dan bertanggungjawab dalam menuntaskan masalah yang diberikan. Penelitian ini menggunakan metode eksperimen dengan populasi dari seluruh mahasiswa semester 1 Program Studi Pendidikan Bahasa Prancis Tahun Akademik 2019/2020, dan sampel dilakukan dengan teknik undian untuk kelas eksperimen dan kelas kontrol. Hasil penelitian telah 
membuktikan bahwa kemampuan membaca mahasiswa di kelas terbalik lebih tinggi dibanding yang menggunakan cara konvensional, dan tingkat kemampuan membaca mahasiswa masuk dalam kategori baik dengan median 75, dan hasil penelitian mewakili populasi, sehingga hipotesis diterima.
Kata kunci: Pembelajaran Berbasis Masalah, Keterampilan Membaca Bahasa Prancis",['L1'],"[{'id': 'ndianarosita@gmail.com', 'name': {'given': 'Diana', 'family': 'Rosita', 'honourific': None, 'lineage': None}}]",disk0/00/04/24/26,1970-01-01 00:00:00.000002022,article,['FKIP1'],Jurusan Pendidikan Bahasa dan Seni FKIP Universitas Lampung,"[{'mime_type': 'application/pdf', 'language': 'en', 'eprintid': 42426, 'placement': 1, 'security': 'public', 'pos': 1, 'format': 'text', 'rev_number': 1, 'uri': 'http://repository.lppm.unila.ac.id/id/document/164137', 'docid': 164137, 'main': '20869-61331-1-PB.pdf', 'files': [{'uri': 'http://repository.lppm.unila.ac.id/id/file/466389', 'objectid': 164137, 'filesize': 266850, 'datasetid': 'document', 'mtime': '2022-06-13 22:51:13', 'hash_type': 'MD5', 'filename': '20869-61331-1-PB.pdf', 'hash': 'f8941c2ba2d2b037abf91c84584246ef', 'fileid': 466389, 'mime_type': 'application/pdf'}]}]",pub,,http://repository.lppm.unila.ac.id/id/eprint/42426,public,,459,2022-06-14 01:16:25,2022-06-14 01:16:25,,,,,AKSARA,1411-20151,TRUE,1.0,137-147,23.0,http://jurnal.fkip.unila.ac.id/index.php/aksara/article/view/20869,,,,
16,41893,,PEER REVIEW JURNAL DENGAN JUDUL: The effect of using pronunciation applications on students' pronunciation abilities,show,11,archive,2022-05-27 03:23:18,ABSTRACT,"['L1', 'PE']","[{'id': 'dianshafwati@fkip.unila.ac.id', 'name': {'given': 'Dian', 'lineage': None, 'family': 'Shafwati', 'honourific': None}}]",disk0/00/04/18/93,1970-01-01 00:00:00.000002022,other,['FKIP1'],Engish Education Study Program,"[{'content': 'other', 'mime_type': 'application/pdf', 'language': 'en', 'security': 'public', 'placement': 1, 'eprintid': 41893, 'formatdesc': 'PEER REVIEW JURNAL ILMIAH NASIONAL', 'uri': 'http://repository.lppm.unila.ac.id/id/document/163564', 'rev_number': 3, 'format': 'text', 'pos': 1, 'files': [{'objectid': 163564, 'uri': 'http://repository.lppm.unila.ac.id/id/file/462352', 'mime_type': 'application/pdf', 'fileid': 462352, 'hash': '0b9a291ded112cc0e5d5aeac2cef02e4', 'filename': 'peer review jurnal.pdf', 'hash_type': 'MD5', 'mtime': '2022-05-26 17:44:11', 'datasetid': 'document', 'filesize': 1412976}], 'main': 'peer review jurnal.pdf', 'docid': 163564}]",pub,,http://repository.lppm.unila.ac.id/id/eprint/41893,public,,3302,2022-05-27 03:23:18,2022-05-27 03:23:18,,,-,,,,,,,,http://jurnal.fkip.unila.ac.id/index.php/123,,-,,
17,41819,published,The effect of using pronunciation applications on students' pronunciation abilities,show,9,archive,2022-05-25 06:08:08,"ABSTRACT
 
As part of speaking skill, pronunciation has an important factor in learning English as a
foreign language, especially in communication. In English communication, if our
pronunciation is wrong or inappropriate the result will be miscommunication, even to the
point of not conveying the purpose of communication in a conversation because the
meaning of a word or sentence is not conveyed properly. So far, the steps for learning and
modeling pronunciation in English are done directly or face-to-face. Lecturers and
students also need appropriate learning media and support online learning to carry out this
Pronunciation course. Regarding applications, the benefits of many applications that are
suitable for learning English are; students can watch videos related to the topic, are able
to save examples of learning materials, and are able to save the exercises they have done
as learning evaluation material for teachers and students later. Applications which are
appropriate are the methods which are not only support online learning but can also
improve students' pronunciation skills. This study aims to determine whether or not using
the pronunciation application have an significant effect on students' pronunciation
abilities. This study is used one group pretest-posttest. This design analyzes the results of
students' pronunciation abilities at the beginning and at the end of the lesson. The subjects
of this study were undergraduate students of the English Education Study Program, FKIP
University of Lampung. One class consists of 31 students who take pronunciation
courses. Based on the data analysis, the researcher concludes that there is no significant
difference of students’ pronunciation ability before and after taught using pronunciation
applications. Meanwhile, we can say that there is slightly significant improvement
between pretest of posttest of pronunciation test. 
Keywords: Application, Pronunciation, Pronunciation Abilities",['PE'],"[{'id': 'dianshafwati@fkip.unila.ac.id', 'name': {'given': 'Dian', 'honourific': None, 'family': 'Shafwati', 'lineage': None}}]",disk0/00/04/18/19,2022-05-01 00:00:00.000000000,article,['FKIP1'],Engish Education Study Program,"[{'docid': 163489, 'main': '24407-60408-1-PB.pdf', 'files': [{'fileid': 461847, 'mime_type': 'application/pdf', 'mtime': '2022-05-25 04:32:00', 'hash_type': 'MD5', 'filename': '24407-60408-1-PB.pdf', 'hash': '0f956ab836d94049200196abe436473e', 'datasetid': 'document', 'filesize': 555733, 'objectid': 163489, 'uri': 'http://repository.lppm.unila.ac.id/id/file/461847'}], 'pos': 1, 'format': 'text', 'rev_number': 1, 'uri': 'http://repository.lppm.unila.ac.id/id/document/163489', 'eprintid': 41819, 'placement': 1, 'security': 'public', 'language': 'en', 'mime_type': 'application/pdf'}]",pub,,http://repository.lppm.unila.ac.id/id/eprint/41819,public,,3302,2022-05-25 06:08:08,2022-05-25 06:08:08,,,,,Unila Journal Of English Teaching (U-JET),ISSN 2798-4532,TRUE,1.0,93-99,11.0,http://jurnal.fkip.unila.ac.id/index.php/123/index,,,,
18,46069,completed,DEVELOPING STRATEGY USE AND LANGUAGE PERFORMANCE THROUGH IMPLICIT STRATEGY TRAINING (SIMILARITY CHECK),show,7,archive,2022-10-29 11:27:11,"More studies advocate explicit strategy training and a few studies agree that training strategies should be integrated in language learning. The present study reports on the implementation of an implicit strategy training for metacognitive strategies in the context of English as a Foreign Language (EFL) setting in Indonesia. In the study which involved 37 senior high school students, strategies were measured using a questionnaire based on a seven - point Likert scale comprising of metacognitive strategies for the four language skills: listening, speaking, reading and writing. To find out the effect of implicit learning strategy training on students’ learning strategy use, a paired sample t-test was used to compare the data taken from the students’ learning strategy questionnaire. An English proficiency test was also administered for the purpose of the identification of the students’ proficiency in English before and after the treatment, and to correlate them with the use of metacognitive strategies. The findings indicate that there was a trend towards students using metacognitive strategies of the four language skills more frequently after they were trained to use such strategies implicitly. In particular, the study reveals that the language learners significantly improved their use of metacognitive strategies in writing, and the use of metacognitive strategies in writing was significantly correlated to students’ writing performance. The study suggests that language learners could improve their language performance through the improvement of strategy use in implicit strategy training.",['PE'],"[{'name': {'honourific': None, 'family': 'Sukirlan', 'lineage': None, 'given': 'Muhammad'}, 'id': 'muhammad_sukirlan@yahoo.co.id'}, {'id': 'patuan.raja@fkip.unila.ac.id', 'name': {'given': 'Patuan', 'lineage': None, 'honourific': None, 'family': 'Raja'}}, {'id': 'bambang_setiyadi76@yahoo.co.id', 'name': {'family': 'Setiyadi', 'honourific': None, 'lineage': None, 'given': 'Ag. Bambang'}}, {'name': {'given': 'Fitri', 'lineage': None, 'family': 'Agustine', 'honourific': None}, 'id': 'fitriagustine24@gmail.com'}]",disk0/00/04/60/69,2022-10-29 00:00:00.000000000,other,['FKIP1'],FKIP Universitas Lampung,"[{'placement': 1, 'security': 'public', 'eprintid': 46069, 'mime_type': 'application/pdf', 'language': 'en', 'files': [{'uri': 'http://repository.lppm.unila.ac.id/id/file/509651', 'objectid': 184890, 'filesize': 432061, 'datasetid': 'document', 'hash': '3888045565f706a9d8e4ad39a0c123db', 'filename': '03-Developing Strategy Use and Language Performance through Implicit Strategy.pdf.pdf', 'mtime': '2022-10-29 06:52:07', 'hash_type': 'MD5', 'mime_type': 'application/pdf', 'fileid': 509651}], 'docid': 184890, 'main': '03-Developing Strategy Use and Language Performance through Implicit Strategy.pdf.pdf', 'rev_number': 1, 'uri': 'http://repository.lppm.unila.ac.id/id/document/184890', 'pos': 1, 'format': 'text'}]",unpub,"[{'type': 'http://www.loc.gov/loc.terms/relators/AUT'}, {'type': 'http://www.loc.gov/loc.terms/relators/AUT'}, {'type': 'http://www.loc.gov/loc.terms/relators/AUT'}, {'type': 'http://www.loc.gov/loc.terms/relators/AUT'}]",http://repository.lppm.unila.ac.id/id/eprint/46069,public,"['Prodi Pendidikan Bahasa Inggris FKIP Unila', 'Prodi Pendidikan Bahasa Inggris FKIP Unila', 'Prodi Pendidikan Bahasa Inggris FKIP Unila', 'SMA Negeri II Bandar Lampung']",1044,2022-10-29 11:27:11,2022-10-29 11:27:11,,,,,,,,,,,,,,,
19,36687,,Prof. Cucu Sutarsyah Latih Guru Bahasa Inggris Pesawaran Gunakan Assessment Higher Order Thinking Skills,show,10,archive,2021-11-14 02:06:11,"Dosen Bahasa Inggris FKIP Universitas Lampung (Unila), Prof. Cucu Sutarsyah bersama tim melatih 36 guru Bahasa Inggris SMP/MTs Pesawaran menggunakan evaluasi pembelajaran Bahasa Inggris berbasis higher order thinking skills (HOTS). Dalam kegiatan pengabdian yang dilaksanakan di SMPN 4 Padang Cermin, Pesawaran, pada 14 dan 15 Juli 2020 lalu,  Prof. Cucu Sutarsyah dibantu oleh tiga dosen yaitu Ujang Suparman, MA., Ph.D., Drs. Huzairin. M.Pd. dan Drs. Deddy Supriyadi, M.Pd.

Cucu Sutarsyah mengatakan guru harus meningkatkan kompetensi dalam bidang penilaian (assessment)  karena assessment tidak bisa dipisahkan dari kegiatan pembelajaran.  Bentuk penilaian yang digunakan guru di dalam kelas akan berkorelasi positif dengan hasil belajar siswa.",['L1'],"[{'id': 'cucusutarsyah@gmail.com', 'name': {'given': 'Cucu', 'lineage': None, 'family': 'Sutarsyah', 'honourific': None}}, {'name': {'given': 'Ujang', 'lineage': None, 'family': 'Suparman', 'honourific': None}, 'id': 'ujang.suparman@fkip.unila.ac.id'}, {'name': {'given': 'huzairin', 'honourific': None, 'family': 'Huzairin', 'lineage': None}, 'id': 'huzairin1958@gmail.com'}]",disk0/00/03/66/87,2022-11-13 00:00:00.000000000,article,['FKIP1'],On Line news,"[{'mime_type': 'application/vnd.openxmlformats-officedocument.wordprocessingml.document', 'language': 'en', 'eprintid': 36687, 'security': 'public', 'placement': 1, 'format': 'text', 'pos': 1, 'rev_number': 1, 'uri': 'http://repository.lppm.unila.ac.id/id/document/157603', 'docid': 157603, 'main': 'Rinda materi media.docx', 'files': [{'uri': 'http://repository.lppm.unila.ac.id/id/file/422468', 'objectid': 157603, 'filesize': 1226202, 'datasetid': 'document', 'mtime': '2021-11-13 14:37:46', 'hash_type': 'MD5', 'filename': 'Rinda materi media.docx', 'hash': 'd8dc347d2ef108a9fd7f070aa1d9ea06', 'fileid': 422468, 'mime_type': 'application/vnd.openxmlformats-officedocument.wordprocessingml.document'}]}]",pub,,http://repository.lppm.unila.ac.id/id/eprint/36687,public,,1049,2022-02-02 08:20:50,2021-11-14 02:06:11,,,,,PortailNes.ID,,TRUE,,1-3,1.0,https://portallnews.id/pendidikan/prof-cucu-sutarsyah-latih-guru-bahasa-inggris-pesawaran-gunakan-assessment-higher-order-thinking-skills/,,,,
