,corp_creators,userid,lastmod,datestamp,pagerange,ispublished,contributors,pres_type,documents,full_text_status,uri,refereed,type,divisions,creators,date,dir,status_changed,eprint_status,related_url,subjects,abstract,title,official_url,event_type,rev_number,metadata_visibility,event_title,eprintid,date_type,event_location,volume,publisher,number,issn,publication,projects,funders,contact_email,id_number
0,['Universitas Lampung'],432,2023-03-27 08:52:58,2023-03-27 08:52:58,40-54,pub,"[{'type': 'http://www.loc.gov/loc.terms/relators/CRP', 'name': {'given': 'Sandi', 'lineage': None, 'family': 'Asmara', 'honourific': None}}]",paper,"[{'eprintid': 49306, 'placement': 1, 'security': 'public', 'language': 'en', 'mime_type': 'application/pdf', 'main': '8106.pdf', 'docid': 188853, 'files': [{'objectid': 188853, 'uri': 'http://repository.lppm.unila.ac.id/id/file/535435', 'fileid': 535435, 'mime_type': 'application/pdf', 'mtime': '2023-03-27 07:51:14', 'hash_type': 'MD5', 'hash': '403e191efff804923b76e8867176ec5a', 'filename': '8106.pdf', 'datasetid': 'document', 'filesize': 2065756}], 'pos': 1, 'format': 'text', 'uri': 'http://repository.lppm.unila.ac.id/id/document/188853', 'rev_number': 1}]",public,http://repository.lppm.unila.ac.id/id/eprint/49306,TRUE,conference_item,['FP18'],"[{'name': {'lineage': None, 'honourific': None, 'family': 'Asmara', 'given': 'Sandi'}, 'id': 'Shandiasmara@yahoo.com'}, {'id': None, 'name': {'given': 'Kusnardi', 'lineage': None, 'family': 'Kusnardi', 'honourific': None}}, {'name': {'given': 'Ida', 'lineage': None, 'family': 'Rachmawati', 'honourific': None}, 'id': None}]",1970-01-01 00:00:00.000002014,disk0_bak/00/04/93/06,2023-03-27 08:52:58,archive,[{'url': 'https://repository.unri.ac.id/xmlui/handle/123456789/7380'}],['S1'],"One of the food security subsystem that needs to be considered is the quality and food safety, because it is associated with health problems for consumers. Lack of attention to it, resulting in a decrease in the impact of health, ranging from food poisoning due to hygienic storage and presentation process to the risk of various diseases due to the use of pesticides and additives (food additive) is dangerous. To support the successful development of food security, it is becoming one of the main concerns of the Provincial Government of Lampung. The purpose of this study to determine the condition of quality and food safety of fresh fruits and vegetables according to the concept From Farm To Table in the stages of production, post-harvest, distribution, marketing and processing as well as ditahapan the tipping point that requires handling first. The study was conducted in July-September 2013 in the five districts as regional centers of production and fruit and vegetable market in Lampung, the respondent farmers, traders, consumers and workers. Sampling and study methods based on geographic differences Purpose Random, infrastructure and social economic conditions that affect the quality and food safety. Descriptive statistical analysis method using a bar chart. The results of the study, quality control measures and food safety needs to be improved at this stage of the cultivation, distribution and marketing. Institutions need to multiply the pesticide residue testing materials Pure Reference Standards and test equipment hazardous chemicals (nitrates, mercury, bishepol A, aresink, artificial coloring, butylated hydroxyanisole. Way transport of fruit and vegetables need to be developed society. Marketing is the most vulnerable stage because there are many using formalin. perception of the respondents (farmers, traders, consumers and workers) should be equated to quality in order to facilitate development. urtan For food safety issues are coaching traders, consumers, farmers and workers.

Keywords : Quality, Food Safety, Food Security",KAJIAN MUTU DAN KEAMANAN PANGAN BUAH DAN SAYUR SEGAR UNTUK MENDUKUNG PEMBANGUNAN KETAHANAN PANGAN PROPINSI LAMPUNG,https://repository.unri.ac.id/xmlui/handle/123456789/7380,conference,7,show,Seminar Dan Lokakarya Nasional FKPTI-TPI 2014,49306,published,Universitas Riau,,,,,,,,,
1,,353,2018-04-25 09:15:46,2018-04-25 09:15:46,205-215,pub,,,"[{'rev_number': 1, 'uri': 'http://repository.lppm.unila.ac.id/id/document/18956', 'format': 'text', 'pos': 1, 'files': [{'objectid': 18956, 'uri': 'http://repository.lppm.unila.ac.id/id/file/55786', 'datasetid': 'document', 'filesize': 561886, 'fileid': 55786, 'mime_type': 'application/pdf', 'mtime': '2017-11-18 16:04:53', 'hash_type': 'MD5', 'filename': '658-1825-1-PB_v4 No3_2014.pdf', 'hash': 'f94abc328b8c4c22e8412acd00600954'}], 'main': '658-1825-1-PB_v4 No3_2014.pdf', 'docid': 18956, 'mime_type': 'application/pdf', 'language': 'en', 'security': 'public', 'placement': 1, 'eprintid': 6040}]",public,http://repository.lppm.unila.ac.id/id/eprint/6040,TRUE,article,['FP18'],"[{'name': {'honourific': None, 'family': 'Delya', 'lineage': None, 'given': 'Buti'}, 'id': 'butidelya@gmail.com'}, {'id': 'ahmad.tusip@fp.unila.ac.id', 'name': {'family': 'Tusi', 'honourific': None, 'lineage': None, 'given': 'Ahmad'}}, {'name': {'given': 'Budianto', 'family': 'Lanya', 'honourific': None, 'lineage': None}, 'id': 'budianto.lanya@fp.unila.ac.id'}, {'id': 'zul2007@gmail.com', 'name': {'given': 'Iskandar', 'family': 'Zulkarnain', 'honourific': None, 'lineage': None}}]",2014-10-22 00:00:00.000000000,disk0/00/00/60/40,2018-04-25 09:15:46,archive,,['S1'],"Ebb and flow hydroponic system generally used a timer to controlnutrient addition. The use ofthe timer, however
has major disadvantage including inefficiency of nutrient usage. This research aimed at designing of ebb and
flow automatic hydroponic system which able to turn on/off the pump based on the moisture content using
microcontroller.The research was conducted at Greenhouse Facility of the Integrated Field Lab of Agriculture
School, the University of Lampung from April - June 2014. The procedure begins with the manufacture of
instrument, calibration, system design tool, the power supply circuit, equipment test and field test. The results
showed that has been successfully realized automatic ebb and flow hydroponic system working based on the
moisture content. The value of setting point obtained for controling water content for turning on the pump was
< 34.95% andturning offthe pumpwas > 69.83%. Cultivation testusingchilli pepper resulted thatautomatic ebb
and flow hydroponic systemwassignifically better thanmanually system one,interms of plantheight and number
of leaves.
Keyword:Hydroponic, ebb and flow system,microcontroller, moisture content.","RANCANG BANGUN SISTEM HIDROPONIK PASANG SURUT OTOMATIS
UNTUK BUDIDAYA TANAMAN CABAI",,,6,show,,6040,published,,3.0,Jurusan Teknik Pertanian Fakultas Pertanian Unila,3.0,2302-559X,Jurnal Teknik Pertanian Lampung,,,,
2,,480,2023-05-15 01:21:25,2023-05-15 01:21:25,261-266,pub,,,"[{'format': 'text', 'pos': 1, 'rev_number': 3, 'uri': 'http://repository.lppm.unila.ac.id/id/document/249240', 'main': 607, 'docid': 249240, 'files': [{'datasetid': 'document', 'filesize': 22933, 'mime_type': 'application/xml', 'fileid': 610844, 'filename': 607, 'hash': '21181a8c7377b6bffd3f78455e55126e', 'hash_type': 'MD5', 'mtime': '2023-05-13 15:05:28', 'objectid': 249240, 'uri': 'http://repository.lppm.unila.ac.id/id/file/610844'}], 'mime_type': 'application/xml', 'language': 'en', 'content': 'published', 'eprintid': 51565, 'security': 'public', 'placement': 1}]",public,http://repository.lppm.unila.ac.id/id/eprint/51565,TRUE,article,['FP18'],"[{'name': {'honourific': None, 'family': 'Febriana', 'lineage': None, 'given': 'Nivoliya'}, 'id': None}, {'id': 'bustomirosadi@yahoo.com', 'name': {'given': 'Bustomi', 'honourific': None, 'family': 'Rosadi', 'lineage': None}}, {'name': {'lineage': None, 'honourific': None, 'family': 'Tusi', 'given': 'Ahmad'}, 'id': 'ahmad.tusip@fp.unila.ac.id'}]",1970-01-01 00:00:00.000002014,disk0_bak/00/05/15/65,2023-05-15 01:21:25,archive,,['S1'],"The objective of this research is to find out the influence of evapotranspiration deficit toward plants growth and
water use efficiency of three soybean varieties (Glycine max. (L) Merr.). This research was conducted in the
greenhouse, integrated laboratory of Agriculture Faculty, Lampung University on November, 2013 to January,
2014. This research used a complity randomized design consisting two treatment factors with three times
repetition. The fisrt factor was evapotranspiration deficit (E) consisting of E1 (1.0), E2 (0.8), and E3 (0.6), and
E4 (0.4). The second factorwas variety (V) consisting of Tanggamus (V1), Kaba (V2), andWillis (V3). The result
of research showedthat evapotranspiration deficit and varietywas significantly differentwhereas the interaction
was not significantly different at all growth components, production andwater use efficiency .The highest result
productionwasWiliis (V3) and Kaba (V2) on E1 (1.0) 12.33 gr/pot. The highest value ofwater use efficiencywas
Willis (V3).",Pengaruh Defisit Evapotranspirasi terhadap Pertumbuhan Tanaman dan Efisiensi Penggunaan Air pada Tiga Varietas Kedelai (Glycine max (L.) Merill),https://jurnal.fp.unila.ac.id/index.php/JTP/article/view/665,,8,show,,51565,published,,3.0,Jurusan Teknik Pertanian Fakultas Pertanian Unila,3.0,2302-559X,Jurnal Teknik Pertanian Lampung,,,,
3,['Universitas Lampung'],988,2021-09-13 01:30:52,2021-09-13 01:30:52,,pub,"[{'name': {'family': 'Haryanto', 'honourific': None, 'lineage': None, 'given': 'Agus'}, 'type': 'http://www.loc.gov/loc.terms/relators/AUT', 'id': 'agus.haryanto@fp.unila.ac.id'}]",,"[{'mime_type': 'application/pdf', 'language': 'en', 'eprintid': 33850, 'security': 'public', 'placement': 1, 'format': 'text', 'pos': 1, 'rev_number': 1, 'uri': 'http://repository.lppm.unila.ac.id/id/document/154089', 'docid': 154089, 'main': 'Bukti Kehadiran Seminar PERTETA Bandung 2014 AH.pdf', 'files': [{'datasetid': 'document', 'filesize': 1475224, 'fileid': 400452, 'mime_type': 'application/pdf', 'mtime': '2021-09-10 22:31:14', 'hash_type': 'MD5', 'filename': 'Bukti Kehadiran Seminar PERTETA Bandung 2014 AH.pdf', 'hash': '854f86d305c5ffbab47787acfebde26c', 'objectid': 154089, 'uri': 'http://repository.lppm.unila.ac.id/id/file/400452'}]}]",public,http://repository.lppm.unila.ac.id/id/eprint/33850,,other,['FP18'],"[{'id': 'agus.haryanto@fp.unila.ac.id', 'name': {'given': 'Agus', 'lineage': None, 'honourific': None, 'family': 'Haryanto'}}]",1970-01-01 00:00:00.000002014,disk0/00/03/38/50,2021-09-13 01:30:52,archive,,['S1'],Sertifikat,Bukti Kehadiran Seminar PERTETA Bandung 2014 AH,,,7,show,,33850,completed,,,FTIP-UNPAD,,,,,,,
4,['Universitas Lampung'],988,2021-09-13 01:31:54,2021-09-13 01:31:54,,unpub,"[{'type': 'http://www.loc.gov/loc.terms/relators/AUT', 'id': 'agus.haryanto@fp.unila.ac.id', 'name': {'given': 'Agus', 'family': 'Haryanto', 'honourific': None, 'lineage': None}}]",,"[{'eprintid': 33870, 'security': 'public', 'placement': 1, 'mime_type': 'application/pdf', 'language': 'en', 'main': 'MP3EI 2014 Komplit.pdf', 'docid': 154109, 'files': [{'filesize': 2557161, 'datasetid': 'document', 'hash': '5da3b8c0f26ffb7398c835d9aa6a8882', 'filename': 'MP3EI 2014 Komplit.pdf', 'hash_type': 'MD5', 'mtime': '2021-09-11 12:34:56', 'mime_type': 'application/pdf', 'fileid': 400588, 'uri': 'http://repository.lppm.unila.ac.id/id/file/400588', 'objectid': 154109}], 'format': 'text', 'pos': 1, 'uri': 'http://repository.lppm.unila.ac.id/id/document/154109', 'rev_number': 1}]",public,http://repository.lppm.unila.ac.id/id/eprint/33870,,experiment,['FP18'],"[{'name': {'given': 'Agus', 'lineage': None, 'family': 'Haryanto', 'honourific': None}, 'id': 'agus.haryanto@fp.unila.ac.id'}]",1970-01-01 00:00:00.000002014,disk0/00/03/38/70,2021-09-13 01:31:54,archive,,['S1'],"Tujuan program ini adalah untuk: (1) Mengkaji efisiensi agro industri kelapa sawit dalam pemanfaatan sumber daya alam (biomass), (2) Mengidentifikasi peluang serta strategi untuk memanfaatkan hasil samping dan limbah pengolahan kelapa sawit dalam rangka peningkatan nilai tambah dan meminimalkan dampak lingkungan termasuk mengurangi emisi GRK, (3) Mengidentifikasi peluang serta strategi pengembangan produk hilir berbasis kelapa sawit, (4) Membuat model zero waste pada produksi kelapa sawit, (5) Melakukan aplikasi lapangan produksi biogas skala rumah tangga dari limbah cair kelapa sawit (POME) untuk masyarakat sekitar pabrik kelapa sawit.
Limbah industri pengolahan kelapa sawit sangat potensial untuk dijadikan sebagai bahan baku industri terkait. Pemanfaatan semaksimal mungkin limbah industri pengolahan kelapa sawit sangat penting dalam kaitannya dengan konsep “Zero Emissions.” Aplikasi konsep ini dapat menjadi senjata yang ampuh guna menepis isu-isu negative berkaitan dengan pengembangan industri kelapa sawit di tanah air. Pemetaaan tentang potensi agroindustri
kelapa sawit dilihat dari sisi efisiensi pemanfaatan sumber daya alam (biomas), penguasaan teknologi dari hulu sampai hilir, dan sebaran sumber daya manusia ahli di bidang tersebut sangat diperlukan dalam rangka merumuskan kebijakan secara komprehensif untuk mencari terobosan baru/inovasi dalam pengembangan agroindustri kelapa sawit di Sumatera.
Hasil penelitian tahun pertama (2012) menunjukkan bahwa teknologi pemanfaatan limbah sawit sebagai bahan baku untuk industri lain sangatlah memungkinkan. Teknologi
pemanfaatan POME untuk menghasilkan biogas tampaknya memberikan peluang besar untuk meningkatkan nilai tambah pengolahan kelapa sawit. Hasil kegiatan tahun kedua (2013) menunjukkan bahwa digester biogas skala rumah tangga (5 m3) dapat dioperasikan menggunakan POME. Pada tahun ketiga (2014) akan dikembangkan digester skala kecil dapat yang memanfaatkan sekaligus POME dan tandan kosong kelapa sawit. Mula-mula akan diinstal satu unit digester skala kecil (kapasitas 220 liter) dengan substrat tandan kosong akan diteliti melalui proses fermentasi kering sebagai percontohan. Selanjutnya, bekerjasama dengan pabrik pengolah kelapa sawit, dikembangkan digester biogas yang bekerja dengan substrat POME dilanjutkan substrat tandan kosong.
Hasil penelitian menunjukkan bahwa tandan kosong kelapa sawit berpotensi menghasilkan biogas melalui proses fermentasi kering. Hasil penelitian menggunakan sumber bakteri kotoran sapi menunjukkan produksi biogas dari tandan kosong mencapai 1.561,4 L dengan waktu retensi 41 hari (rata-rata sebesar 38 L). Produktivitas biogas mencapai 1074.6 L/kg VSremoved dengan kandungan metana 36.1%. Produksi biogas dari tandan kosong juga dapat
dilakukan dengan sumber bakteri efluen dari digester biogas berbahan baku POME. Hasilnya adalah produksi biogas 1.235 L dengan waktu retensi 46 hari (rata-rata sebesar 26,8 L); produktivitas gas sebesar 1120.6 L/kg VSremoved; dan kandungan metana 40.1%. Efektivitas
produksi biogas dua tahap sedang dalam proses pengujian untuk aplikasi genset skala kecil (1 kilowatt).",Laporan Penelitian (Tahun III): INOVASI PENGEMBANGAN AGROINDUSTRI KELAPA SAWIT DALAM RANGKA OPTIMASI NILAI TAMBAH (APLIKASI BIOGAS SISTEM HIBRID DI PABRIK KELAPA SAWIT),,,7,show,,33870,completed,,,,,,,['MP3EI'],['DIKTI'],,
5,['University of Lampung'],988,2020-03-30 01:52:08,2020-03-30 01:52:08,223-229,pub,"[{'name': {'given': 'Agus', 'honourific': None, 'family': 'Haryanto', 'lineage': None}, 'type': 'http://www.loc.gov/loc.terms/relators/AUT', 'id': 'agus.haryanto@fp.unila.ac.id'}]",paper,"[{'uri': 'http://repository.lppm.unila.ac.id/id/document/32147', 'rev_number': 1, 'pos': 1, 'format': 'text', 'files': [{'objectid': 32147, 'uri': 'http://repository.lppm.unila.ac.id/id/file/158661', 'datasetid': 'document', 'filesize': 1237447, 'mime_type': 'application/pdf', 'fileid': 158661, 'hash': 'ae08e16ad53f3d34bd6036d9474e455d', 'filename': '8-ProsidingTakBerindex-04-Pengaruh_Umur_Pakai_Pisau.pdf', 'mtime': '2020-03-28 06:04:36', 'hash_type': 'MD5'}], 'docid': 32147, 'main': '8-ProsidingTakBerindex-04-Pengaruh_Umur_Pakai_Pisau.pdf', 'mime_type': 'application/pdf', 'language': 'en', 'placement': 1, 'security': 'public', 'eprintid': 18909}]",public,http://repository.lppm.unila.ac.id/id/eprint/18909,TRUE,conference_item,['FP18'],"[{'name': {'lineage': None, 'family': 'Haryanto', 'honourific': None, 'given': 'Agus'}, 'id': 'agus.haryanto@fp.unila.ac.id'}]",2014-11-11 00:00:00.000000000,disk0/00/01/89/09,2020-03-30 01:52:08,archive,,['S1'],"Rendemen pati pada pengolahan tepung tapioka di industri tepung tapioka rakyat dipengaruhi oleh ketajaman pisau pemarut. Semakin tumpul pisau pemarut maka semakin banyak pati yang akan tertinggal di dalam onggok. Tujuan dari penelitian ini adalah untuk mengetahui pengaruh lama penggunaan pisau parut terhadap kadar pati yang tertinggal
di dalam onggok pada industri tepung tapioka rakyat. Penelitian dilaksanakan di industri tepung tapioka rakyat di Desa Tresnomulyo, Kecamatan Sukaraja Nuban, Kabupaten
Lampung Timur pada tanggal 23 Juni sampai dengan 25 Agustus 2014. Penelitian dilakukan dengan cara mengamati kadar pati onggok dan umur pakai pisau pemarut. Kadar pati onggok diukur menggunakan metode densitas relatif atau spesific grafity. Hasil penelitian menunjukkan bahwa terdapat pengaruh umur pakai pisau terhadap kadar pati yang tertinggal di dalam onggok. Semakin lama pisau pemarut ini digunakan, maka kadar pati di dalam onggok semakin meningkat. Hubungan antara kadar pati onggok dan umur pakai pisau dapat disajikan sebagai Y = 0,190 t + 3,784(R2 = 0,889). Potensi kerugian ekonomi yang terjadi mencapai Rp.606.000,00 (lama penggunaan pisau 2 hari) hingga Rp.7.986.000,00 (lama penggunaan pisau 6 hari).",Pengaruh Umur Pakai Pisau Parut Singkong Terhadap Kadar Pati Onggok Pada Industri Tepung Tapioka Rakyat,,conference,7,show,SEMINAR NASIONAL FTIP UNPAD – PERTETA – HIPI 2014,18909,published,"Fakultas Teknologi Industri Pertanian Universitas Padjadjaran, Bandung",,,,,,,,,
6,['Universitas Lampung'],988,2021-01-21 00:50:22,2021-01-21 00:50:22,173-184,pub,"[{'type': 'http://www.loc.gov/loc.terms/relators/AUT', 'id': 'agus.haryanto@fp.unila.ac.id', 'name': {'lineage': None, 'family': 'Haryanto', 'honourific': None, 'given': 'Agus'}}]",,"[{'mime_type': 'application/pdf', 'language': 'en', 'content': 'published', 'eprintid': 27405, 'placement': 1, 'security': 'public', 'pos': 1, 'format': 'text', 'uri': 'http://repository.lppm.unila.ac.id/id/document/41409', 'rev_number': 2, 'main': '2014 JTEP ABE, PENGARUH PENAMBAHAN SERAT TEMBAGA PADA SUMBU KOMPOR.pdf', 'docid': 41409, 'files': [{'objectid': 41409, 'uri': 'http://repository.lppm.unila.ac.id/id/file/245086', 'mime_type': 'application/pdf', 'fileid': 245086, 'filename': '2014 JTEP ABE, PENGARUH PENAMBAHAN SERAT TEMBAGA PADA SUMBU KOMPOR.pdf', 'hash': '6c61c21ebf5546aa13bbb8bb754c67ca', 'mtime': '2021-01-20 11:10:06', 'hash_type': 'MD5', 'datasetid': 'document', 'filesize': 457527}]}]",public,http://repository.lppm.unila.ac.id/id/eprint/27405,TRUE,article,['FP18'],"[{'id': 'agus.haryanto@fp.unila.ac.id', 'name': {'given': 'Agus', 'lineage': None, 'family': 'Haryanto', 'honourific': None}}, {'id': 'budianto.lanya@fp.unila.ac.id', 'name': {'given': 'Budianto', 'family': 'Lanya', 'honourific': None, 'lineage': None}}]",1970-01-01 00:00:00.000002014,disk0/00/02/74/05,2021-01-21 00:50:22,archive,,['TA'],"This study aimed to determine the effect of copper wires addition to the cloth wick on the performance of stove fueled by waste cooking oil. The study was divided into two stages. First, is to test the capillarity of wick at different copper wires addition by observing flame quality, capillary height, and flaming period. Second, is to design a stove based on the results obtained in the first stage and to test performance of the stove in boiling water. Parameters to be observed include boiling time, rate of fuel consumption, and thermal efficiency. The results showed that the addition of copper wires increase the wick’s capillarity characterized by increasing absorption of the used cooking oil. Wick with a composition of 20 % copper wires and 80 % cloth produced the best capillarity (7.5 cm height). Waste cooking oil stove was capable to boil 3 kg of water in 15 minutes with a fuel consumption rate of 0.1275 kg/hour. The stove has a thermal efficiency of 33,33 %.","PENGARUH PENAMBAHAN SERAT TEMBAGA PADA SUMBU KOMPOR
TERHADAP KINERJA KOMPOR MINYAK JELANTAH",http://jurnal.fp.unila.ac.id/index.php/JTP/article/view/266/262,,8,show,,27405,published,,2.0,Jurusan Teknik Pertanian Fakultas Pertanian Unila,3.0,2302-559X,Jurnal Teknik Pertanian Lampung,,,,
7,,832,2022-10-31 08:48:28,2022-10-31 08:48:28,213-222,pub,,,"[{'language': 'en', 'mime_type': 'application/pdf', 'security': 'public', 'placement': 1, 'eprintid': 46126, 'rev_number': 1, 'uri': 'http://repository.lppm.unila.ac.id/id/document/184953', 'format': 'text', 'pos': 1, 'files': [{'uri': 'http://repository.lppm.unila.ac.id/id/file/510103', 'objectid': 184953, 'hash': 'c46c705c08af6ccb3bea0d00638a0223', 'filename': '8 Baby Kailan Lengkap (Non Sinta) GEA.pdf', 'hash_type': 'MD5', 'mtime': '2022-10-31 08:32:46', 'mime_type': 'application/pdf', 'fileid': 510103, 'filesize': 2833903, 'datasetid': 'document'}], 'main': '8 Baby Kailan Lengkap (Non Sinta) GEA.pdf', 'docid': 184953}]",public,http://repository.lppm.unila.ac.id/id/eprint/46126,TRUE,article,['FP18'],"[{'id': 'ublixz_peace@yahoo.com', 'name': {'lineage': None, 'family': 'Krisnawati', 'honourific': None, 'given': 'Dian'}}, {'name': {'lineage': None, 'family': 'Triyono', 'honourific': None, 'given': 'Sugeng'}, 'id': 'sugeng.triyono@fp.unila.ac.id'}, {'name': {'given': 'M. Zen', 'honourific': None, 'family': 'Kadir', 'lineage': None}, 'id': None}]",2014-10-22 00:00:00.000000000,disk0/00/04/61/26,2022-10-31 08:48:28,archive,,['S1'],"Penelitian ini bertujuan untuk mengetahui pengaruh pemberian aerasi terhadap pertumbuhan tanaman baby
kailan (Brassica oleraceae var. Achepala) pada Teknologi Hidroponik Sistem Terapung (THST) di dalam dan luar
greenhouse. Penelitian ini menggunakan Rancangan split plot dengan dua faktor.  Faktor pertama yaitu greenhouse
dengan dua taraf, di dalam (N0) dan di luar (N1) greeenhouse.  Faktor kedua yaitu aerasi dengan tiga taraf, aerator
(A1), styrofoam menggantung (A2) dan styrofoam menyentuh larutan nutrisi (A3).  Terdapat enam kombinasi
perlakuan dengan ulangan sebanyak tiga kali.  Data dianalisis menggunakan uji F (5%) dan uji BNT (5%). Hasil
penelitian menunjukkan bahwa pemberian aerasi di dalam dan luar greenhouse berpengaruh nyata terhadap
pertumbuhan dan hasil produksi tanaman.  Penggunaan aerasi di luar greenhouse menghasilkan produksi tertinggi.
Perhitungan biaya produksi (pupuk dan listrik) dan hasil panen menunjukan bahwa perlakuan styrofoam
menggantung (A2) di dalam greenhouse merupakan perlakuan dengan biaya produksi terendah.  Hasil sidik
ragam menunjukan parameter larutan nutrisi (EC, DO dan pH) tidak berbeda nyata.  Hal ini menunjukkan larutan
nutrisi homogen dan bukan faktor penyebab perbedaan pertumbuhan dan hasil tanaman.
Kata kunci : Aerasi, Baby kailan, Greenhouse, Teknologi Hidroponik Sistem Terapung, Produksi.",8.	PENGARUH AERASI TERHADAP PERTUMBUHAN TANAMAN BABY KAILAN (Brassica oleraceae var. achepala) PADA TEKNOLOGI HIDROPONIK SISTEM TERAPUNG DI DALAM DAN DI LUAR GREENHOUSE,https://jurnal.fp.unila.ac.id/index.php/JTP/article/view/659/601,,6,show,,46126,published,,3.0,Jurusan Teknik Pertanian Fakultas Pertanian Unila,3.0,2302-559X,Jurnal Teknik Pertanian Lampung,,,sugeng.triyono@fp.unila.ac.id,-
