,corp_creators,userid,lastmod,datestamp,pagerange,ispublished,contributors,pres_type,documents,full_text_status,uri,refereed,type,divisions,creators,date,dir,status_changed,eprint_status,related_url,subjects,abstract,title,official_url,event_type,rev_number,metadata_visibility,event_title,eprintid,date_type,event_location,volume,publisher,number,issn,publication,projects,funders,contact_email,id_number
8,,832,2022-10-19 02:38:13,2022-10-19 02:38:13,213-222,pub,,,"[{'docid': 184638, 'main': '10 Baby Kailan Lengkap.pdf', 'files': [{'filesize': 1579632, 'datasetid': 'document', 'hash': '7c51e2c805d511fa191a9b78d53c68c4', 'filename': '10 Baby Kailan Lengkap.pdf', 'mtime': '2022-10-18 22:50:44', 'hash_type': 'MD5', 'mime_type': 'application/pdf', 'fileid': 507786, 'uri': 'http://repository.lppm.unila.ac.id/id/file/507786', 'objectid': 184638}], 'format': 'text', 'pos': 1, 'uri': 'http://repository.lppm.unila.ac.id/id/document/184638', 'rev_number': 1, 'eprintid': 45826, 'security': 'public', 'placement': 1, 'mime_type': 'application/pdf', 'language': 'en'}]",public,http://repository.lppm.unila.ac.id/id/eprint/45826,TRUE,article,['FP18'],"[{'name': {'family': 'Krisnawati', 'honourific': None, 'lineage': None, 'given': 'Dian'}, 'id': 'ublixz_peace@yahoo.com'}, {'id': 'sugeng.triyono@fp.unila.ac.id', 'name': {'lineage': None, 'honourific': None, 'family': 'Triyono', 'given': 'Sugeng'}}, {'id': '-', 'name': {'lineage': None, 'family': 'Kadir', 'honourific': None, 'given': 'M. Zen'}}]",2014-10-22 00:00:00.000000000,disk0/00/04/58/26,2022-10-19 02:38:13,archive,,['S1'],"This research is aimed to find out the effects of aeration on baby kailan (Brassica oleraceae var. Achepala ) in
floating system hidroponic technology inside and outside the greenhouse. This research used a factorial in a split
plot design with 2 factors, namely factor I (weation) and Factor II (aeration). The first factor had two levels,
inside (N0) and outside (N1) greenhouse. The second factor consisted of 3 levels; mechanical aeration (A1),
hanging styrofoam (A2) and floating styrofoam (A3); resulting in six treatment combinations with three
replications. The data was analyzed using ANOVA (analysis of variance) at 5 % significantlevel and folowed by
LSD. The resultsshowed thatthe inside and otsutside greenhouse significantly affected growth and yield. The use
of aeration outside the greenhouse had shown maximal production. The hanging styrofoam system (A2) inside
the greenhouse showed the lowest production cost (fertilizer and electricity. None of the environment and
nutrition parameters (EC, DO and pH) was significantly different during the research, implying that the
environment and nutrion solution were homogeneous and did not affect the plant growth.
Keywords:Aeration,baby kailan, greenhouse,floatingsystem, production.","PENGARUH AERASI TERHADAP PERTUMBUHAN TANAMAN 
BABY KAILAN (Brassica oleraceae var. achepala) PADA 
TEKNOLOGI HIDROPONIK SISTEM TERAPUNG DI DALAM 
DAN DI LUAR GREENHOUSE",https://jurnal.fp.unila.ac.id/index.php/JTP/article/view/659/601,,6,show,,45826,published,,3.0,"Jurusan Teknik Pertanian, F Pertanian, Unila",3.0,2302- 559X,Jurnal Teknik Pertanian Lampung,,,sugeng.triyono@fp.unila.ac.id,-
9,,480,2023-05-15 01:21:29,2023-05-15 01:21:29,103-110,pub,,,"[{'uri': 'http://repository.lppm.unila.ac.id/id/document/249242', 'rev_number': 3, 'pos': 1, 'format': 'text', 'files': [{'datasetid': 'document', 'filesize': 23182, 'mime_type': 'application/xml', 'fileid': 610860, 'filename': 545, 'hash': '36ae40e30a48e8474cf464b35cb25492', 'hash_type': 'MD5', 'mtime': '2023-05-13 15:20:26', 'objectid': 249242, 'uri': 'http://repository.lppm.unila.ac.id/id/file/610860'}], 'docid': 249242, 'main': 545, 'content': 'published', 'language': 'en', 'mime_type': 'application/xml', 'placement': 1, 'security': 'public', 'eprintid': 51567}]",public,http://repository.lppm.unila.ac.id/id/eprint/51567,TRUE,article,['FP18'],"[{'name': {'given': 'Aulia Nurbaiti', 'family': 'Mansyur', 'honourific': None, 'lineage': None}, 'id': None}, {'name': {'family': 'Triyono', 'honourific': None, 'lineage': None, 'given': 'Sugeng'}, 'id': 'sugeng.triyono@fp.unila.ac.id'}, {'id': 'ahmad.tusip@fp.unila.ac.id', 'name': {'given': 'Ahmad', 'lineage': None, 'family': 'Tusi', 'honourific': None}}]",1970-01-01 00:00:00.000002014,disk0_bak/00/05/15/67,2023-05-15 01:21:29,archive,,['S1'],"The study aims to determine the response of green mustard (Brassica juncea L.) to the shade.  This study used a randomized complete block design (RCB).  Treatment consisted of T0 (control), T1 (one shade), T2 (two shades with one shade slightly slided to the east), T3 (two shades with one shade slightly slided to the west) and T4 (three shades).  Shade in the form of plywood to the width and the distance between the shade of 12 cm are placed 50 cm above the gutter extends.  Gutters along the 4 m with plant spacing of 10 cm is used as a nutrient.  Comparison of fertilizer ( a : b) and water for 250 ml : 250 ml : 50 liter.  Experiment used gutters as the growing media which were devided into three parts, namely B1 (section near the aerator), B2 (middle gutter) and B3 (the farthest part of aerator). Nutrient solution is circulated at flow rate of 1.2 cm/sec by using a small pump, which was also functioned as the aerator.  Data was analyzed by using the analysis of variance test and LSD multiple comparisons.  The results showed that T2 (two shades with one shade slightly slided to the east) produces the best respons with plant height (33,07 cm) and final weight (436,47 g).  The result also showed that all environmental parameters (EC, DO, and pH) observed a long the gutter were not significantly different, indicating that the nutrient solution was quite homogeneous throughout the gutters.",Pengaruh Naungan terhadap Pertumbuhan Sawi (Brassia juncea L.) pada Sistem Hidroponik DFT (Deep Flow Technique),https://jurnal.fp.unila.ac.id/index.php/JTP/article/view/583,,8,show,,51567,published,,3.0,Jurusan Teknik Pertanian Fakultas Pertanian Unila,2.0,2302-559X,Jurnal Teknik Pertanian Lampung,,,,
10,,832,2022-10-31 09:47:37,2022-10-31 09:47:37,83-90,pub,,,"[{'mime_type': 'application/pdf', 'language': 'en', 'eprintid': 46132, 'security': 'public', 'placement': 1, 'format': 'text', 'pos': 1, 'uri': 'http://repository.lppm.unila.ac.id/id/document/184959', 'rev_number': 1, 'main': '13 sawi (Non Sinta).pdf', 'docid': 184959, 'files': [{'objectid': 184959, 'uri': 'http://repository.lppm.unila.ac.id/id/file/510145', 'datasetid': 'document', 'filesize': 2317584, 'mime_type': 'application/pdf', 'fileid': 510145, 'filename': '13 sawi (Non Sinta).pdf', 'hash': '9c37b2f1fb1eaa546b299fe83417eb33', 'mtime': '2022-10-31 09:02:51', 'hash_type': 'MD5'}]}]",public,http://repository.lppm.unila.ac.id/id/eprint/46132,TRUE,article,['FP18'],"[{'id': 'lietha_09@yahoo.co.id', 'name': {'honourific': None, 'family': 'Ningrum', 'lineage': None, 'given': 'Diah Yulita'}}, {'name': {'lineage': None, 'family': 'Triyono', 'honourific': None, 'given': 'Sugeng'}, 'id': 'sugeng.triyono@fp.unila.ac.id'}, {'id': 'ahmad.tusip@fp.unila.ac.id', 'name': {'given': 'Ahmad', 'honourific': None, 'family': 'Tusi', 'lineage': None}}]",2014-03-26 00:00:00.000000000,disk0/00/04/61/32,2022-10-31 09:47:37,archive,,['S1'],"This study aims to determine the effect of duration of aeration on the growth and yield of mustard plants
(Brassica juncea L.), nutrient solution and electricity consumptions.  The experiment was conducted in
September and October 2013 at The Integrated Field Laboratory, and Land and Water Resources
Engineering Laboratory, The Departement of Agricultural Engineering, The University of Lampung.  The
experiment consisted of four treatments of aeration intervals including N
24
M
0
 (control), N
15
 (15 minute
on-30 minute off), N
15
M
60
 (15 minute on- 60 minute off) and N
15
M
90
 (15 minute on- 90 minute off).  Each
treatment was divided into 3 segments along the gutter, including R1 (segment near the aerator), R2 (middle
segment chamfer) and R3 (section away from the aerator).  The results showed that the use of a nutrient
solution circulating pump with a flow rate of 0.27 cm/s is sufficient for EC, DO, pH fairly uniform along the
gutter.  Aeration with interval 15 minute on- 60 minute off turned out to produce the highest mustard crop
(2,146 kg) with the lowest consumption of fertilizer and electricity by IDR 1753.00/kg.  
Keywords: Aeration, DFT, hydroponics, intermitten, mustard
 
M
30",13.	PENGARUH LAMA AERASI TERHADAP PERTUMBUHAN DAN HASIL TANAMAN SAWI (Brassica juncea L.) PADA HIDROPONIK DFT (Deep Flow Technique),https://jurnal.fp.unila.ac.id/index.php/JTP/article/view/384/366,,6,show,,46132,published,,3.0,Jurusan Teknik Pertanian Fakultas Pertanian Unila,1.0,2302-559X,Jurnal Teknik Pertanian Lampung,,,sugeng.triyono@fp.unila.ac.id,-
11,,832,2022-10-19 02:38:05,2022-10-19 02:38:05,83-90,pub,,,"[{'pos': 1, 'format': 'text', 'rev_number': 1, 'uri': 'http://repository.lppm.unila.ac.id/id/document/184634', 'docid': 184634, 'main': '9 Lama Aerasi thp Sawi Lengkap.pdf', 'files': [{'hash_type': 'MD5', 'mtime': '2022-10-18 22:42:29', 'filename': '9 Lama Aerasi thp Sawi Lengkap.pdf', 'hash': 'ba0f437bd1aa8bfb32b611ea7eb93fbf', 'fileid': 507759, 'mime_type': 'application/pdf', 'filesize': 1550642, 'datasetid': 'document', 'uri': 'http://repository.lppm.unila.ac.id/id/file/507759', 'objectid': 184634}], 'language': 'en', 'mime_type': 'application/pdf', 'eprintid': 45822, 'placement': 1, 'security': 'public'}]",public,http://repository.lppm.unila.ac.id/id/eprint/45822,TRUE,article,['FP18'],"[{'name': {'given': 'Diah Yulita', 'family': 'Ningrum', 'honourific': None, 'lineage': None}, 'id': 'lietha_09@yahoo.co.id'}, {'name': {'given': 'Sugeng', 'lineage': None, 'family': 'Triyono', 'honourific': None}, 'id': 'sugeng.triyono@fp.unila.ac.id'}, {'name': {'given': 'Ahmad', 'lineage': None, 'family': 'Tusi', 'honourific': None}, 'id': 'ahmad.tusip@fp.unila.ac.id'}]",2014-03-26 00:00:00.000000000,disk0/00/04/58/22,2022-10-19 02:38:05,archive,,['S1'],"This study aims to determine the effect of duration of aeration on the growth and yield of mustard plants 
(Brassica juncea L.), nutrient solution and electricity consumptions. The experiment was conducted in 
September and October 2013 at The Integrated Field Laboratory, and Land and Water Resources 
Engineering Laboratory, The Departement of Agricultural Engineering, The University of Lampung. The 
experiment consisted of four treatments of aeration intervals including N24M0 (control), N15M30 (15 minute 
on-30 minute off), N15M60 (15 minute on- 60 minute off) and N15M90 (15 minute on- 90 minute off). Each 
treatment was divided into 3 segments along the gutter, including R1 (segment near the aerator), R2 (middle 
segment chamfer) and R3 (section away from the aerator). The results showed that the use of a nutrient 
solution circulating pump with a flow rate of 0.27 cm/s is sufficient for EC, DO, pH fairly uniform along the 
gutter. Aeration with interval 15 minute on- 60 minute off turned out to produce the highest mustard crop 
(2,146 kg) with the lowest consumption of fertilizer and electricity by IDR 1753.00/kg.
Keywords: Aeration, DFT, hydroponics, intermitten, mustard","PENGARUH LAMA AERASI TERHADAP PERTUMBUHAN DAN 
HASIL TANAMAN SAWI (Brassica juncea L.) PADA HIDROPONIK 
DFT (Deep Flow Technique)",https://jurnal.fp.unila.ac.id/index.php/JTP/article/view/384/366,,8,show,,45822,published,,3.0,Jurusan Teknik Pertanian Lampung,1.0,2302- 559X,Jurnal Teknik Pertanian Lampung,,,sugeng.triyono@fp.unila.ac.id,-
12,,832,2022-10-19 02:38:21,2022-10-19 02:38:21,239-244,pub,,,"[{'language': 'en', 'mime_type': 'application/pdf', 'security': 'public', 'placement': 1, 'eprintid': 45828, 'rev_number': 1, 'uri': 'http://repository.lppm.unila.ac.id/id/document/184639', 'format': 'text', 'pos': 1, 'files': [{'mtime': '2022-10-18 22:58:31', 'hash_type': 'MD5', 'filename': '11 Zeolit Lengkap.pdf', 'hash': 'fbd8d1a5732e5785ccd2ecf1b4bfaafd', 'fileid': 507797, 'mime_type': 'application/pdf', 'filesize': 1264029, 'datasetid': 'document', 'uri': 'http://repository.lppm.unila.ac.id/id/file/507797', 'objectid': 184639}], 'docid': 184639, 'main': '11 Zeolit Lengkap.pdf'}]",public,http://repository.lppm.unila.ac.id/id/eprint/45828,TRUE,article,['FP18'],"[{'name': {'given': 'Rodiyanti', 'honourific': None, 'family': 'Rodiyanti', 'lineage': None}, 'id': 'odiyanti66@gmail.com'}, {'name': {'given': 'Sugeng', 'lineage': None, 'family': 'Triyono', 'honourific': None}, 'id': 'sugeng.triyono@fp.unila.ac.id'}, {'id': '-', 'name': {'given': 'Nugroho', 'family': 'Haryono', 'honourific': None, 'lineage': None}}]",2014-11-10 00:00:00.000000000,disk0/00/04/58/28,2022-10-19 02:38:21,archive,,['S1'],"This research was aimed to investigate reactionkinetic oftofu industrywastewater using zeolite medium. A static
filter reactor using zeolite medium was constructed to carry outthis research. Tofuwastewater was resirculated
through the medium with various hydraulic retention times(HRT): 0, 3, 6, 12, 24, 36, and 48 hours. First order
reaction wasthen applied on this kinetics. The resultsshowed that pHincreased from 4.1 to 8.02. Total P in the
wastewater decreased from12,1 mg/L to 6,91mg/L (42% reduction), while in the media totalP increased from
3,04 mg/L to 5,97 mg/L within 48 hours of filtration. N-NH4
+ decreased from 64.184 mg/L to 12.85 mg/L
(79.9% reduction). Total Solids decreased from 10.404 mg/L to 4003 m (61.5% reduction).
Keywords:wastewater,biofilter, zeolite","KINETIKA FILTRASI LIMBAH CAIR INDUSTRI TAHU DENGAN 
MENGGUNAKAN METODE BIOFILTER MEDIA ZEOLIT",https://jurnal.fp.unila.ac.id/index.php/JTP/article/view/662/604,,6,show,,45828,published,,3.0,Jurusan Teknik Pertanian Fakultas Pertanian Unila,3.0,2302-559X,Jurnal Teknik Pertanian Lampung,,,sugeng.triyono@fp.unila.ac.id,-
13,,480,2023-05-15 01:21:27,2023-05-15 01:21:27,127-140,pub,,,"[{'main': 548, 'docid': 249241, 'files': [{'objectid': 249241, 'uri': 'http://repository.lppm.unila.ac.id/id/file/610852', 'mime_type': 'application/xml', 'fileid': 610852, 'hash': '62313fe16fadfbf42f1517a983ff7eff', 'filename': 548, 'mtime': '2023-05-13 15:13:49', 'hash_type': 'MD5', 'datasetid': 'document', 'filesize': 23278}], 'pos': 1, 'format': 'text', 'rev_number': 3, 'uri': 'http://repository.lppm.unila.ac.id/id/document/249241', 'eprintid': 51566, 'placement': 1, 'security': 'public', 'language': 'en', 'mime_type': 'application/xml', 'content': 'published'}]",public,http://repository.lppm.unila.ac.id/id/eprint/51566,TRUE,article,['FP18'],"[{'name': {'lineage': None, 'family': 'Setyaningrum', 'honourific': None, 'given': 'Diah Ayu'}, 'id': None}, {'id': 'ahmad.tusip@fp.unila.ac.id', 'name': {'given': 'Ahmad', 'family': 'Tusi', 'honourific': None, 'lineage': None}}, {'name': {'given': 'Sugeng', 'lineage': None, 'family': 'Triyono', 'honourific': None}, 'id': 'sugeng.triyono@fp.unila.ac.id'}]",1970-01-01 00:00:00.000002014,disk0_bak/00/05/15/66,2023-05-15 01:21:27,archive,,['S1'],"This study aimed to analyze the performance of drip irrigation systems, determine performance of tomato treated under the irrigation systems.Field research was conducted at the Laboratory of Land and Water Resources Engineering; and at the Laboratory ofintegrated field, Faculty of Agriculture, University of Lampung in August 2013 to December 2013.Irrigation systems consisted of main componens: water supplies, Polythilene lateral tube, and emitters. Emitter on every pot, were made of Polythilene (PE) fabric.Pot experiment consisted of 32 pots, divided into two groups, a group of 16 pots was treated with surface drip irrigation system and the other half was treated with subsurface drip irrigation system.  Variables observed to the irrigation systems wereflowrate, coefficient variance (CV), emition uniformity (EU).  Variables observed to the plant were evapotranspiration (ETc), Kc, Soil moisture, water consumption, plant growth, and yield.  The results showed that the surface drip irrigation system had flowrate of 0.96 liter/hour, CV of 0.41 and EU of 54.85%, while the subsurface drip irrigation system had flowrate of 1.08 liter/hour, CV of 0.41 and EU of 56.43%.  Plants performance treated with surface drip irrigation system showed total crop evapotranspiration (ETc) of 490,8 mm,  while subsurface drip irrigation system showed total crop evapotranspiration (ETc) of 580,9 mm.Higher crop evapotranspiration of subsurface drip irrigation system was due to better plant growth in the subsurface drip irrigation system.  This was also shown by higher crop coefficience (Kc) of subsurface drip irrigation system.",Aplikasi Sistem Irigasi Tetes pada Tanaman Tomat (Lycopersicum esculentum Mill),https://jurnal.fp.unila.ac.id/index.php/JTP/article/view/586,,8,show,,51566,published,,3.0,Jurusan Teknik Pertanian Fakultas Pertanian Unila,2.0,2302-559X,Jurnal Teknik Pertanian Lampung,,,,
14,,10,2016-08-22 02:20:04,2016-08-22 02:20:04,139-142,pub,,,"[{'language': 'en', 'mime_type': 'application/pdf', 'security': 'public', 'placement': 1, 'eprintid': 327, 'uri': 'http://repository.lppm.unila.ac.id/id/document/317', 'rev_number': 1, 'format': 'text', 'pos': 1, 'files': [{'objectid': 317, 'uri': 'http://repository.lppm.unila.ac.id/id/file/1858', 'fileid': 1858, 'mime_type': 'application/pdf', 'hash_type': 'MD5', 'mtime': '2016-08-19 05:24:39', 'hash': 'fca956e54b490b81f3a68488d59914d4', 'filename': 'Chlorogenic Acid (CGA) Determination in Roasted Coffee Beans by Near Infrared (NIR) Spectroscopy.pdf', 'datasetid': 'document', 'filesize': 522133}], 'docid': 317, 'main': 'Chlorogenic Acid (CGA) Determination in Roasted Coffee Beans by Near Infrared (NIR) Spectroscopy.pdf'}]",public,http://repository.lppm.unila.ac.id/id/eprint/327,TRUE,article,['FP18'],"[{'name': {'given': 'Dididng', 'lineage': None, 'honourific': None, 'family': 'Suhandy'}, 'id': 'diding2004@yahoo.com'}]",2014-10-01 00:00:00.000000000,disk0/00/00/03/27,2016-08-22 02:20:04,archive,,,"Roasting can potentially affect the functional properties of the resulting coffee. For instance, antioxidant phenolic chlorogenic acids (CGA) are known to be thermally labile. In this study, we develop a new NIR spectroscopic method to measure CGA concentration found in the coffee beans. High performance liquid chromatography (HPLC) was used to determine standard reference values of CGA concentration. A partial least squares regression (PLSR) with full cross-validation method was employed for the development and the validation of the regression model. The resultant model accuracy of RCV2RCV2 = 0.76 and RMSECV = 1.16% with preprocessing of the spectra by MSC and SNV is thought to be accurate enough for the rapid and non-destructive determination of CGA concentration in roasted coffee beans.
Keywords: NIR spectroscopy; PLS; Chlorogenic acid; Different roasting degrees; Coffee",Chlorogenic acid (CGA) determination in roasted coffee beans by Near Infrared (NIR) spectroscopy,http://www.sciencedirect.com,,5,show,,327,published,,7.0,Elsevier,4.0,,"Engineering in Agriculture, Environment and Food",,,,
15,,337,2016-12-07 04:25:49,2016-12-07 04:25:49,139-142,pub,[{'type': 'http://www.loc.gov/loc.terms/relators/AUT'}],,"[{'format': 'text', 'pos': 1, 'rev_number': 1, 'uri': 'http://repository.lppm.unila.ac.id/id/document/1173', 'docid': 1173, 'main': 'ac.els-cdn.com_S188183661400041X_1-s2.0-S188183661400041X-main paper shan san.pdf', 'files': [{'objectid': 1173, 'uri': 'http://repository.lppm.unila.ac.id/id/file/8704', 'fileid': 8704, 'mime_type': 'application/pdf', 'mtime': '2016-12-07 04:08:28', 'hash_type': 'MD5', 'hash': '741228412b0cd0467b19d760c4e971c5', 'filename': 'ac.els-cdn.com_S188183661400041X_1-s2.0-S188183661400041X-main paper shan san.pdf', 'datasetid': 'document', 'filesize': 4992258}], 'mime_type': 'application/pdf', 'language': 'en', 'eprintid': 1298, 'security': 'public', 'placement': 1}]",public,http://repository.lppm.unila.ac.id/id/eprint/1298,TRUE,article,['FP18'],"[{'name': {'given': 'Diding', 'honourific': None, 'family': 'Suhandy', 'lineage': None}, 'id': 'diding.sughandy@fp.unila.ac.id'}]",2014-08-27 00:00:00.000000000,disk0/00/00/12/98,2016-12-07 04:25:49,archive,,['S1'],"Roasting can potentially affect the functional properties of the resulting coffee. For instance, antioxidant phenolic chlorogenic acids (CGA) are known to be thermally labile. In this study, we develop a new NIR spectroscopic method to measure CGA concentration found in the coffee beans. High performance liquid chromatography (HPLC) was used to determine standard reference values of CGA concentration. A partial least squares regression (PLSR) with full cross-validation method was employed for the development and the validation of the regression model. The resultant model accuracy of RCV2 = 0.76 and RMSECV = 1.16% with preprocessing of the spectra by MSC and SNV is thought to be accurate enough for the rapid and non-destructive determination of CGA concentration in roasted coffee beans.",Chlorogenic acid (CGA) determination in roasted coffee beans by Near Infrared (NIR) spectroscopy,http://www.sciencedirect.com/science/article/pii/S188183661400041X,,7,show,,1298,published,,7.0,Elsevier,4.0,1881-8366,"Engineering in Agriculture, Environment and Food",,,,http://dx.doi.org/10.1016/j.eaef.2014.08.003
16,,337,2016-12-13 01:10:53,2016-12-13 01:10:53,7-12,pub,"[{'name': {'given': 'bustomi', 'lineage': None, 'honourific': None, 'family': 'rosadi'}, 'type': 'http://www.loc.gov/loc.terms/relators/AUT'}, {'type': 'http://www.loc.gov/loc.terms/relators/AUT', 'name': {'family': 'senge', 'honourific': None, 'lineage': None, 'given': 'masateru'}}, {'name': {'lineage': None, 'honourific': None, 'family': 'suhandy', 'given': 'diding'}, 'type': 'http://www.loc.gov/loc.terms/relators/AUT'}, {'type': 'http://www.loc.gov/loc.terms/relators/AUT', 'name': {'lineage': None, 'family': 'tusi', 'honourific': None, 'given': 'ahmad'}}]",,"[{'placement': 1, 'security': 'public', 'eprintid': 1308, 'language': 'en', 'mime_type': 'application/pdf', 'files': [{'objectid': 1183, 'uri': 'http://repository.lppm.unila.ac.id/id/file/8776', 'datasetid': 'document', 'filesize': 114273, 'fileid': 8776, 'mime_type': 'application/pdf', 'mtime': '2016-12-09 01:39:56', 'hash_type': 'MD5', 'hash': '4f998703b040e843dba72b44ae8abe81', 'filename': 'JAEB10021-20140311-154528-6251-39589 (1).pdf'}], 'main': 'JAEB10021-20140311-154528-6251-39589 (1).pdf', 'docid': 1183, 'uri': 'http://repository.lppm.unila.ac.id/id/document/1183', 'rev_number': 1, 'pos': 1, 'format': 'text'}]",public,http://repository.lppm.unila.ac.id/id/eprint/1308,TRUE,article,['FP18'],"[{'id': 'diding.sughandy@fp.unila.ac.id', 'name': {'given': 'Diding', 'family': 'Suhandy', 'honourific': None, 'lineage': None}}]",1970-01-01 00:00:00.000002014,disk0/00/00/13/08,2016-12-13 01:10:53,archive,,['S1'],"The objective of this research was to investigate the effect of EC (electric conductivity) levels of nutrient solution on the growth and yield of tomatoes under the hydroponic system. This research was conducted in a plastic house on the experimental farm of Lampung University, Lampung in Indonesia from April to July 2009. The EC treatments to nutrient solutions were S1 (1 dSm-1), S2 (2 dSm-1), S3 (3 dSm-1), S4 (4 dSm-1), and S5 (5 dSm-1) arranged in a completely randomized design with four replications. The results showed that the highest yield was under S3 (120.8 g/plant), followed by S2 (96.6 g/plant), S1 (89.7 g/plant), S4 (88.4 g/plant), and S5 (75.5 g/plant). The yields of tomato responded to EC levels of nutrient solution in the two ranges of lower and higher EC than 3 dSm-1. The yield increased as EC of nutrient solution increased from 0 to 3 dSm-1 probably, due to increase of nutrients. On the other hand, the yield decreased as the EC of nutrient solution increased from 3 to 5 dSm-1 probably, due to increase of water stress. So, it can be concluded that the salinity threshold of the tomatoes was 3 dSm-1. On the other hand, the highest SSC (soluble solid content) was recorded under S5 (7.34 brix), followed by S4 (6.93 brix), S3 (6.44 brix), S2 (6.26 brix), and S1 (6.11 brix). It means that the S5 treatment was the best quality. Among the range of treatments, treatment S3 (3 dSm-1) gave the highest yield, but lower SSC than S4 (4 dmS-1) and S5 (5 dSm-1).","The Effect of EC Levels of Nutrient Solution on the Growth, Yield, and Quality of Tomatoes (Solanum Lycopersicum) under the Hydroponic System",http://www.bowenpublishing.com/jaeb/paperInfo.aspx?PaperID=15010&year=2014&volume=2&number=1,,6,show,,1308,published,,2.0,Bowen Publishing,1.0,2331-3234,Journal of Agricultural Engineering and Biotechnology(JAEB),,,,10.18005/JAEB0201002
