,corp_creators,userid,lastmod,datestamp,pagerange,ispublished,contributors,pres_type,documents,full_text_status,uri,refereed,type,divisions,creators,date,dir,status_changed,eprint_status,related_url,subjects,abstract,title,official_url,event_type,rev_number,metadata_visibility,event_title,eprintid,date_type,event_location,volume,publisher,number,issn,publication,projects,funders,contact_email,id_number
17,,337,2016-12-07 04:25:51,2016-12-07 04:25:51,148-154,pub,[{'type': 'http://www.loc.gov/loc.terms/relators/AUT'}],,"[{'eprintid': 1297, 'placement': 1, 'security': 'public', 'language': 'en', 'mime_type': 'application/pdf', 'main': '1-s2.0-S1881836614000433-main YULIA.pdf', 'docid': 1172, 'files': [{'datasetid': 'document', 'filesize': 1088797, 'fileid': 8698, 'mime_type': 'application/pdf', 'hash_type': 'MD5', 'mtime': '2016-12-07 03:53:19', 'hash': 'ad9ad52400d6ca0c1a6e70f654d2fe92', 'filename': '1-s2.0-S1881836614000433-main YULIA.pdf', 'objectid': 1172, 'uri': 'http://repository.lppm.unila.ac.id/id/file/8698'}], 'pos': 1, 'format': 'text', 'uri': 'http://repository.lppm.unila.ac.id/id/document/1172', 'rev_number': 1}]",public,http://repository.lppm.unila.ac.id/id/eprint/1297,TRUE,article,['FP18'],"[{'id': 'diding.sughandy@fp.unila.ac.id', 'name': {'family': 'Suhandy', 'honourific': None, 'lineage': None, 'given': 'Diding'}}]",2014-08-23 00:00:00.000000000,disk0/00/00/12/97,2016-12-07 04:25:51,archive,,['S1'],"The influence of sample temperature variation on l-AA determination using Fourier transform infrared attenuated total reflectance terahertz (FTIR-ATR-THz) spectroscopy was investigated. Using the best local calibration models at 22, 31 and 40 °C, prediction results for a prediction sample set at any one temperature were excellent, with low RMSEP and high SDRpred values. However, bias and SEP were significantly increased when samples from different temperatures were used in these models; higher RMSEPs resulted. On the other hand, global calibration models based on combinations of different temperatures gave better prediction results, with lower RMSEP and higher SDRpred values for all prediction samples at 22, 31 and 40 °C. With these global calibration models the bias predictions were also significantly decreased; resulting in lower RMSEP values.",Investigation on the influence of temperature in l-ascorbic acid determination using FTIR-ATR terahertz spectroscopy: Calibration model with temperature compensation,http://www.sciencedirect.com/science/article/pii/S1881836614000433,,6,show,,1297,published,,7.0,Elsevier,4.0,1881-8366,"Engineering in Agriculture, Environment and Food",,,,http://dx.doi.org/10.1016/j.eaef.2014.08.005
18,,480,2023-05-15 01:21:00,2023-05-15 01:21:00,69-82,pub,,,"[{'format': 'text', 'pos': 1, 'rev_number': 3, 'uri': 'http://repository.lppm.unila.ac.id/id/document/249211', 'docid': 249211, 'main': 365, 'files': [{'mtime': '2023-05-13 13:58:26', 'hash_type': 'MD5', 'filename': 365, 'hash': 'a1efc18e8d85bcb6db76e8c4d17b39a2', 'fileid': 610767, 'mime_type': 'application/xml', 'filesize': 23712, 'datasetid': 'document', 'uri': 'http://repository.lppm.unila.ac.id/id/file/610767', 'objectid': 249211}], 'mime_type': 'application/xml', 'language': 'en', 'content': 'published', 'eprintid': 51557, 'security': 'public', 'placement': 1}]",public,http://repository.lppm.unila.ac.id/id/eprint/51557,TRUE,article,['FP18'],"[{'id': None, 'name': {'given': 'Sri', 'lineage': None, 'honourific': None, 'family': 'Wahyuni'}}, {'name': {'given': 'Sugeng', 'lineage': None, 'honourific': None, 'family': 'Triyono'}, 'id': 'sugeng.triyono@fp.unila.ac.id'}, {'id': 'ahmad.tusip@fp.unila.ac.id', 'name': {'given': 'Ahmad', 'lineage': None, 'honourific': None, 'family': 'Tusi'}}]",2014-03-19 00:00:00.000000000,disk0_bak/00/05/15/57,2023-05-15 01:21:00,archive,,['S1'],"This study aimedto observe the effect of soakingthe root of leafy vegetableson thefreshnessduringsale.  Vegetablesused werekangkungandgreen mustardfrom hydroponicsandconventionalcultivations.  Treatments wereconsistedofsoakingwithaeratedwater, soakingwithunaeratedwater, soaking withaerated nutrient solution(EC 0.4mS/cm), displaying in mist sprayed (humidified) cabinet without soaking,andcontrol(neither soaking nor spraying).  Soakingwas donein aglasscontainer(50cm length, 40cm width, 20cm height)andfilledwithwater±20liters/5 cm height.  Parametersmeasured werewater content, leaf water potential,andleafdiscoloration.  The results showedthatthe average room temperature and RH were found about 29oC and 80%. Respectively temperature and RH in the humidified cabinet were not much different from the ambiance.  Soakingwithaeration was able to keep vegetables fresh without wilting process.  Percentage of yellowing reached 10% of the total number within 5days for hydroponics kangkung, 2 days for conventional kangkung, 4days for hydroponics green mustard, and 2 days for conventional green mustard during the display.  Vegetables displayed in the room with no treatment (control) were wilting consistently, their water content was decreasing, and their water potential tended to increase from the beginning.  Thus, discoloration was more proper parameter for the soaked vegetables, while change of water content and water potential were more proper for non soaked or spayed vegetables.",Perbandingan Teknik Pemajangan Sayuran Daun untuk Mempertahankan Kesegaran Selama Penjualan,https://jurnal.fp.unila.ac.id/index.php/JTP/article/view/383,,8,show,,51557,published,,3.0,Jurusan Teknik Pertanian Fakultas Pertanian Unila,1.0,2302-559X,Jurnal Teknik Pertanian Lampung,,,,
19,,832,2022-10-19 02:36:59,2022-10-19 02:36:59,141-154,pub,,,"[{'language': 'en', 'mime_type': 'application/pdf', 'eprintid': 45819, 'security': 'public', 'placement': 1, 'format': 'text', 'pos': 1, 'rev_number': 1, 'uri': 'http://repository.lppm.unila.ac.id/id/document/184631', 'docid': 184631, 'main': '8 Irigasi tetes Lengkap 2.pdf', 'files': [{'fileid': 507739, 'mime_type': 'application/pdf', 'hash_type': 'MD5', 'mtime': '2022-10-18 22:32:38', 'hash': 'bb5c2a5d359970cac5954bcdf172f6ef', 'filename': '8 Irigasi tetes Lengkap 2.pdf', 'datasetid': 'document', 'filesize': 2529558, 'objectid': 184631, 'uri': 'http://repository.lppm.unila.ac.id/id/file/507739'}]}]",public,http://repository.lppm.unila.ac.id/id/eprint/45819,TRUE,article,['FP18'],"[{'id': 'hendri_y_tp@yahoo.com', 'name': {'family': 'Yanto', 'honourific': None, 'lineage': None, 'given': 'Hendri'}}, {'name': {'given': 'Ahmad', 'lineage': None, 'family': 'Tusi', 'honourific': None}, 'id': 'ahmad.tusip@fp.unila.ac.id'}, {'name': {'lineage': None, 'family': 'Triyono', 'honourific': None, 'given': 'Sugeng'}, 'id': 'sugeng.triyono@fp.unila.ac.id'}]",2014-06-05 00:00:00.000000000,disk0/00/04/58/19,2022-10-19 02:36:59,archive,,['S1'],"The research aimedto testperformance ofa drip irrigationsystemto irrigate cauliflower cultivatedina greenhouse.
The drip irrigationsystem using emitter type regulating stick emitter as many 315. One Mainpipe, one manifold,
and four lateral pipes were from PE types with the diameter of 13 mm. The methods to deliver irrigation water
were by using a small pump 13 Watt and by using gravitational pressure with head 155 cm. Variables observed
were emissionuniformity (EU),water requirement,plant growth, andwaterproductivity. The resultsshowed that
Emission uniformities were 64,49 % for gravitationalflow and 61,46 % for pumping flow. These values were still
below recommended, that is 75 % - 85 %. The minimum, maximum, and mean reference evapotranspiration
(ETo) were recorded as 5,80 mm/day, 9,70 mm/day, and 7,20mm/day. Whilst crop evapotranspiration (ETc) at
the day of 41 after planted was 3.2 mm/day. Average yield of cauliflower was 58 gram per plant, while water
productivity was0,87 gram/litter.
Keyword: cauliflower, cropwater requirement, drip irrigation, emitter, emission uniformity","THE APPLICATION OF DRIP IRRIGATION SYSTEM ON 
CAULIFLOWER (Brassica Oleracea Var. Botrytis L. Subvar. 
Cauliflora DC) IN A GREENHOUSE",https://jurnal.fp.unila.ac.id/index.php/JTP/article/view/587/549,,6,show,,45819,published,,3.0,"Jurusan Teknik Pertanian, F Pertanian, Unila",2.0,2302- 559X,Teknik Pertanian Lampung,,,sugeng.triyono@fp.unila.ac.id,-
20,,832,2022-10-31 08:48:26,2022-10-31 08:48:26,141-154,pub,,,"[{'mime_type': 'application/pdf', 'language': 'en', 'eprintid': 46125, 'security': 'public', 'placement': 1, 'format': 'text', 'pos': 1, 'uri': 'http://repository.lppm.unila.ac.id/id/document/184952', 'rev_number': 1, 'docid': 184952, 'main': '7 Irigasi tetes Lengkap 2 Non Sinta GEA.pdf', 'files': [{'objectid': 184952, 'uri': 'http://repository.lppm.unila.ac.id/id/file/510097', 'datasetid': 'document', 'filesize': 3538440, 'fileid': 510097, 'mime_type': 'application/pdf', 'hash_type': 'MD5', 'mtime': '2022-10-31 08:27:10', 'filename': '7 Irigasi tetes Lengkap 2 Non Sinta GEA.pdf', 'hash': '241d431a666a1dbdb30a3896b8053f21'}]}]",public,http://repository.lppm.unila.ac.id/id/eprint/46125,TRUE,article,['FP18'],"[{'name': {'given': 'Yanto', 'family': 'Yanto', 'honourific': None, 'lineage': None}, 'id': None}, {'id': 'ahmad.tusip@fp.unila.ac.id', 'name': {'given': 'Ahmad', 'family': 'Tusi', 'honourific': None, 'lineage': None}}, {'id': 'sugeng.triyono@fp.unila.ac.id', 'name': {'family': 'Triyono', 'honourific': None, 'lineage': None, 'given': 'Sugeng'}}]",2014-06-05 00:00:00.000000000,disk0/00/04/61/25,2022-10-31 08:48:26,archive,,['S1'],"T
E
J
.


P

Tujuan penelitian adalah menguji sistem irigasi tetes, menganalisa kebutuhan dan produktivitas air irigasi
tanaman Kembang kol di dalam greenhouse.  Sistem irigasi tetes menggunakan penetes (emitter) jenis regulating
stick emitter sebanyak 315 penetes.  Satu pipa utama, satu manifold, dan empat lateral menggunakan selang jenis
PE dengan diameter 13 mm.  Metode distribusi air irigasi menggunakan pompa kecil 13 Watt, dan menggunakan
tekanan gravitasi dengan tinggi head 155 cm.  Variabel yang diamati adalah keseragaman penyebaran (EU),
kebutuhan air, pertumbuhan tanaman, dan produktivitas air.  Hasil menunjukan nilai keseragaman penyebaran
(EU) adalah sebesar 64,49 % untuk aliran gravitasi dan 61,46 % untuk aliran pompa.  Nilai ini masih di bawah
nilai keseragaman penyebaran yang disarankan yaitu 75 % - 85 %.  Evapotrasnpirasi acuan (ETo) minimal,
maksimal, dan nilai tengah adalah 5,80 mm/hari, 9,70 mm/hari, dan 7,20 mm/hari. Evapotranspirasi tanaman
(ETc) pada hari ke 41 setelah tanam adalah 3,2 mm/hari.  Hasil rata-rata Kembang kol adalah 58 g/tanaman,
sedangkan produktivitas airnya adalah 0,87 gram/liter.
Kata Kunci:  Kembang kol, Kebutuhan air tanaman, Irigasi tetes, Emitter, Keseragaman tetesan",7.	APLIKASI SISTEM IRIGASI TETES PADA TANAMAN KEMBANG KOL (Brassica Oleracea Var. Botrytis L. Subvar. Cauliflora DC) DALAM GREENHOUSE,https://jurnal.fp.unila.ac.id/index.php/JTP/article/view/587/549,,6,show,,46125,published,,3.0,Jurusan Teknik Pertanian Fakultas Pertanian Unila,1.0,2302-559X,Jurnal Teknik Pertanian Lampung,,,sugeng.triyono@fp.unila.ac.id,-
