,rev_number,metadata_visibility,title,referencetext,subjects,status_changed,eprint_status,date_type,eprintid,uri,full_text_status,ispublished,contributors,documents,datestamp,userid,corp_creators,lastmod,date,dir,creators,divisions,type,publication,issn,pagerange,refereed,number,publisher,abstract,volume,official_url,event_dates,event_type,event_location,event_title,pres_type,related_url,contact_email,id_number
24,9,show,"COMPARISON OF GENES EXPRESSION; MIRNA 146 A, MIR-103, MIR-423-3P, MIR-21, MIR-16

IN CELL LINES HEP-G2 SERIES 1886 AND PLC5",,['RM'],2016-07-18 08:26:38,archive,published,184,http://repository.lppm.unila.ac.id/id/eprint/184,public,pub,"[{'type': 'http://www.loc.gov/loc.terms/relators/AUT', 'id': 'asepsukohar@gmail.com', 'name': {'lineage': None, 'honourific': None, 'family': 'SUKOHAR', 'given': 'ASEP'}}, {'name': {'honourific': None, 'family': 'HERAWATI', 'lineage': None, 'given': 'HENING'}, 'type': 'http://www.loc.gov/loc.terms/relators/AUT', 'id': None}, {'id': None, 'type': 'http://www.loc.gov/loc.terms/relators/AUT', 'name': {'given': 'ARIEF', 'family': 'WITARTO B', 'honourific': None, 'lineage': None}}, {'type': 'http://www.loc.gov/loc.terms/relators/AUT', 'id': None, 'name': {'given': 'HENDRA', 'family': 'SIBERO T', 'honourific': None, 'lineage': None}}, {'type': 'http://www.loc.gov/loc.terms/relators/AUT', 'id': None, 'name': {'given': 'SUTYARSO', 'lineage': None, 'family': 'SUTYARSO', 'honourific': None}}]","[{'main': '3347-15317-1-Publish_Dr Asep.pdf', 'docid': 189, 'files': [{'uri': 'http://repository.lppm.unila.ac.id/id/file/1068', 'objectid': 189, 'filesize': 407002, 'datasetid': 'document', 'hash': '10edb1f544874cee64886db67ea88332', 'filename': '3347-15317-1-Publish_Dr Asep.pdf', 'mtime': '2016-07-18 07:50:29', 'hash_type': 'MD5', 'mime_type': 'application/pdf', 'fileid': 1068}], 'pos': 1, 'format': 'text', 'rev_number': 1, 'uri': 'http://repository.lppm.unila.ac.id/id/document/189', 'eprintid': 184, 'placement': 1, 'security': 'public', 'language': 'en', 'mime_type': 'application/pdf'}]",2016-07-18 08:26:38,151,,2016-08-31 02:30:14,2015-02-02 00:00:00.000000000,disk0/00/00/01/84,"[{'id': 'asepsukohar@gmail.com', 'name': {'family': 'Sukohar', 'honourific': None, 'lineage': None, 'given': 'Asep'}}, {'name': {'given': 'HENING', 'family': 'HERAWATI', 'honourific': None, 'lineage': None}, 'id': None}, {'name': {'given': 'ARIEF', 'honourific': None, 'family': 'WITARTO  B', 'lineage': None}, 'id': None}, {'name': {'family': 'SIBERO T', 'honourific': None, 'lineage': None, 'given': 'HENDRA'}, 'id': None}, {'id': None, 'name': {'given': 'SUTYARSO', 'honourific': None, 'family': 'SUTYARSO', 'lineage': None}}]",['FK1'],article,International Journal of Pharmacy and Pharmaceutical Sciences,0975-1491,76-79,TRUE,2.0,"Vol 7, Issue 2, ( Feb 2015 )","Objective: Detection of hepatocellular cancer cells(HCC) in vitro has reached the smallest level, that is miRNA(micro RNA) in particular miRNA146A. This study was conducted from February to May2013 at the Department of Molecular Biology, Dharmais Cancer Hospital. The purpose of this study was to compare the value of Cq and expression ofmicroRNA(miRNA/mir) on Hep-G2 and PLC5.

Methods: In vitro study were performed in Hep-G2 series 1886 and PLC5. The study used on 33 samples consisting of 5 groups of mir (miRNA146A, miR-423-3p, miR-103, miR-21and miR-16) in Hep-G2 and 5 groups of mirinPLC5 with 3 times repetition, 1 NTC and 2 spike.

Results: MiRNA146 A expressionin Hep-G2against mir-423-3p, mir-103, mir-21, mir-16resulted in values as follows in consecutive order: (0.05), (0.03), (0.01), and (0.55). The highest expression was: miRNA146 Aagainst mir-16 and the smallest expression miRNA146 Aagainst mir-21in Hep-G2. MiRNA146 A expressionincell linesPLC5against mir-423-3p, mir-103, mir-21, mir-16resulted in values as follows: (0.01), (0.00), (0.00), and(0.02). The highest expression: miRNA146 A against mir-16, and the smallest expression: miRNA146 Aagainstmir-103 and mir-21 in PLC5.

Conclusion: MiRNA 146 A, mir-423-3p, mir-103, mir-21, and mir-16 were expressed in Hep-G2 series 1886 and PLC5. The highest gene expression in miRNA146 A against mir-16 was found inHep-G2 andPLC5. The lowest gene expression in miRNA 146 A against mir-103 andmir-16 was found in PLC5.",7.0,http://www.ijppsjournal.com/contents.htm,,,,,,"[{'type': 'pub', 'url': 'http://www.ijppsjournal.com/contents.htm'}]",,
25,8,show,Comparative effects of chlorogenic acid and doxorubic in against expression of caspase3 in cell lines Hep-G2,,['RM'],2016-08-28 13:04:50,archive,published,191,http://repository.lppm.unila.ac.id/id/eprint/191,public,pub,"[{'name': {'given': 'ASEP', 'honourific': None, 'family': 'Sukohar', 'lineage': None}, 'id': 'asepsukohar@gmail.com', 'type': 'http://www.loc.gov/loc.terms/relators/AUT'}, {'id': None, 'type': 'http://www.loc.gov/loc.terms/relators/AUT', 'name': {'given': 'Muhartono', 'honourific': None, 'family': 'Muhartono', 'lineage': None}}]","[{'eprintid': 191, 'placement': 1, 'security': 'public', 'mime_type': 'application/pdf', 'language': 'en', 'main': 'JCPR-2015-7-1-187-192_Publish_Dr Asep.pdf', 'docid': 194, 'files': [{'mime_type': 'application/pdf', 'fileid': 1115, 'filename': 'JCPR-2015-7-1-187-192_Publish_Dr Asep.pdf', 'hash': '04f8a996935e10ffc4ab1aa4696db819', 'hash_type': 'MD5', 'mtime': '2016-07-18 09:22:56', 'datasetid': 'document', 'filesize': 227241, 'objectid': 194, 'uri': 'http://repository.lppm.unila.ac.id/id/file/1115'}], 'pos': 1, 'format': 'text', 'uri': 'http://repository.lppm.unila.ac.id/id/document/194', 'rev_number': 1}]",2016-08-28 13:04:50,151,,2016-08-28 13:04:50,2015-09-16 00:00:00.000000000,disk0/00/00/01/91,"[{'id': 'asepsukohar@gmail.com', 'name': {'lineage': None, 'family': 'Sukohar', 'honourific': None, 'given': 'Asep'}}, {'id': None, 'name': {'lineage': None, 'honourific': None, 'family': 'Muhartono', 'given': 'Muhartono'}}]",['FK1'],article,Journal of Chemical and Pharmaceutical Research,0975-7384,187-192,TRUE,1.0,Volume 7 Issue 1 2015,"Based on reports from the International Agency for Research on Cancer (IARC) in 2008, it has been found more than 12 million new cancer cases in the world. We need an effort to discover new anticancer drugs from natural substance origin. Chlorogenic acid was isolated from Lampung Robusta coffee(Coffea Robusta). Pure experimental design in vitro using a Cell Lines Hep-G2 was conducted in the Department of Molecular Biology Cancer Hospital Dharmais. The aim of this study was to know the action mechanism of chlorogenic acid. In vitro study was using Hep-G2 cells and samples were divided into four groups; 2 control group treatment, 1 experiment group exposed to 727µM chlorogenic acid, 1 experiment group exposed to doxorubicin 1.5µM, and group treatment have been treated with 3times repetition. The expression of caspase 3 was examined at 0,8, 18 and 24. Data were analyzed with livaks method and repeated measurement. This study shows an increasing expression of caspase 3 from 0-8 hours. Caspase 3 shows the highest expression at 8 hours after doxorubicin exposure, with expression value 4.36 followed by chlorogenc acid it expression value 0.74. The caspase 3 expression was decreased after 8 hours up to 24 hours after either doxorubicin or chlorogenic acid exposure. Conclusion, IC50 doxorubicin (1.5µM) is moretoxic than chlorogenic acid (727µM). At 8 hours after doxorubicin and chlorogenic acid exposure, caspase 3 expression with doxorubicin (4,36) higher than chlorogenic acid (0.74).",7.0,http://jocpr.com,,,,,,"[{'url': 'http://jocpr.com', 'type': 'pub'}]",,
26,8,show,"Penyuluhan Mediasi Sengketa Medik pada Dokter yang akan
Diambil Sumpah di Fakultas Kedokteran Unila",,['RM'],2016-08-28 13:05:29,archive,published,241,http://repository.lppm.unila.ac.id/id/eprint/241,public,pub,"[{'name': {'lineage': None, 'honourific': None, 'family': 'Sukohar', 'given': 'Asep'}, 'id': 'asepsukohar@gmail.com', 'type': 'http://www.loc.gov/loc.terms/relators/AUT'}, {'id': None, 'type': None, 'name': {'given': 'Hendra Tarigan', 'lineage': None, 'honourific': None, 'family': 'Sibero'}}, {'name': {'lineage': None, 'family': 'Ratna', 'honourific': None, 'given': 'Maya Ganda'}, 'type': None, 'id': None}]","[{'security': 'public', 'placement': 1, 'eprintid': 241, 'mime_type': 'application/pdf', 'language': 'en', 'files': [{'filesize': 117053, 'datasetid': 'document', 'hash_type': 'MD5', 'mtime': '2016-07-22 03:07:28', 'hash': '8e728b3699a986c064f963ad2d959456', 'filename': '17 DR ASEP.pdf', 'fileid': 1382, 'mime_type': 'application/pdf', 'uri': 'http://repository.lppm.unila.ac.id/id/file/1382', 'objectid': 234}], 'main': '17 DR ASEP.pdf', 'docid': 234, 'uri': 'http://repository.lppm.unila.ac.id/id/document/234', 'rev_number': 1, 'format': 'text', 'pos': 1}]",2016-08-28 13:05:29,151,,2016-08-28 13:05:29,2015-10-02 00:00:00.000000000,disk0/00/00/02/41,"[{'name': {'lineage': None, 'honourific': None, 'family': 'Sukohar', 'given': 'Asep'}, 'id': 'asepsukohar@gmail.com'}, {'id': None, 'name': {'given': 'Hendra Tarigan', 'honourific': None, 'family': 'Sibero', 'lineage': None}}, {'id': None, 'name': {'honourific': None, 'family': 'Ratna', 'lineage': None, 'given': 'Maya Ganda'}}]",['FK1'],article,Jurnal Pengabdian Masyarakat Ruwa Jurai,2503-2615,71-74,TRUE,1.0,"VOLUME 1, NOMOR 1, OKTOBER TAHUN 2015","Semakin banyaknya pengaduan kasus Malpraktik kedokteran di Indonesia sebagai bentuk ketidakpuasan
terhadap pelayanan kedokteran yang diterima pasien. Dengan banyaknya pengaduan kasus Malpraktik
kedokteran maka kasus di Pengadilan bertambah sehingga Mahkamah Agung mengeluarkan Peraturan
Mahkamah Agung (PerMA) Nomor 2 Tahun 2003 tentang Prosedur Mediasi di Pengadilan. Mediasi sengketa
medik sebagai satu bentuk penyelesaian sengketa medik di luar pengadilan dan mempunyai kekuatan hukum.
Metode yang dilakukan pada kegiatan ini adalah penyuluhan dengan metode ceramah dan role play. Khalayak
sasaran pada kegiatan ini adalah 18 dokter yang baru lulus ujian UKMPPD yang akan disumpah. Hasil post test
yang dilakukan menunjukan adanya peningkatan nilai rerata peserta. Hasil post test didapatkan 6 peserta
(33,33%) masuk kategori cukup paham dan sebanyak 12 peserta (66,67%) dapat dikategorikan paham terhadap
materi yang diberikan. Terjadi peningkatan pengetahuan yang siginifikan pada 18 dokter yang baru lulus
UKMPPD setelah mendapat penyuluhan materi tentang Penyelesaian Sengketa Medik Kedokteran",1.0,http://jurnal.fk.unila.ac.id,,,,,,"[{'url': 'http://jurnal.fk.unila.ac.id', 'type': 'pub'}]",,
27,6,show,Tomato (Lycopersicum esculentum Mill.) As Anti Aging Skin,,['R1'],2017-01-16 01:59:51,archive,published,1394,http://repository.lppm.unila.ac.id/id/eprint/1394,public,pub,,"[{'files': [{'filesize': 726800, 'datasetid': 'document', 'hash_type': 'MD5', 'mtime': '2017-01-14 03:36:42', 'hash': 'c7b144b68dae0c3a57df1da861ff394a', 'filename': 'Erisa-Senthrya-BR.pdf', 'fileid': 9417, 'mime_type': 'application/pdf', 'uri': 'http://repository.lppm.unila.ac.id/id/file/9417', 'objectid': 1269}], 'main': 'Erisa-Senthrya-BR.pdf', 'docid': 1269, 'rev_number': 1, 'uri': 'http://repository.lppm.unila.ac.id/id/document/1269', 'format': 'text', 'pos': 1, 'security': 'public', 'placement': 1, 'eprintid': 1394, 'language': 'en', 'mime_type': 'application/pdf'}]",2017-01-16 01:59:51,575,,2017-01-16 01:59:51,1970-01-01 00:00:00.000002015,disk0/00/00/13/94,"[{'id': 'surbaktierisa@gmail.com', 'name': {'given': 'Erisa Senthya B', 'honourific': None, 'family': 'Surbakti', 'lineage': None}}, {'id': 'nisaberawi0226@gmail.com', 'name': {'given': 'Nisa Berawi', 'lineage': None, 'family': 'Khairun', 'honourific': None}}]",['FK1'],article,Majority,2337-3776,73-78,TRUE,3.0,Khairun Nisa,"Skin aging is a biological process that occurs naturally and coincides with increase of the age. But skin aging actually happens depends on the human genetic structure , environment and lifestyle. The aging process is divided into two different concepts, they are Intrinsic aging and extrinsic aging (photoaging, radiation, pollution). Extrinsic aging is the basis for the discussion of aging skin because the sunlight. Sun's UV radiation produce oxidation photo reaction that occurs due to release of Reactive Oxygen Species (ROS) then cause decrease of skin collagen. Public usually use some method as anti aging treatment, they are cosmetic surgery and laser technology method to eliminate the wrinkles because skin aging. However, both methods are expensive and difficult to do, so the method by relying antioxidants sourced from food and beverages become choice. The tomato (Lycopersicum Esculentum Mill) acts as an antioxidant that can prevent skin cell damage caused by free radicals. The tomato has compound of lycopene, polyphenols, and vitamin C as antioxidant that can decrease the release of free radicals such as ROS therefore inhibiting collagen damage that causes wrinkles. Tomatoes are made into juice and its contents can be used as an alternative method of anti-aging skin.
Keywords: free radical, skin aging, tomato",5.0,http://jukeunila.com/majority/majority-volume-5-no-3/,,,,,,,,
28,7,show,"Pemeriksaan Kadar Asam Urat dan Penyuluhan tentang Penyakit
Gout pada Masyarakat di Desa Kalisari Kecamatan Natar Kabupaten
Lampung Selatan",,"['R1', 'RA']",2022-01-11 01:19:03,archive,published,37814,http://repository.lppm.unila.ac.id/id/eprint/37814,public,pub,,"[{'rev_number': 1, 'uri': 'http://repository.lppm.unila.ac.id/id/document/158744', 'pos': 1, 'format': 'text', 'files': [{'uri': 'http://repository.lppm.unila.ac.id/id/file/430725', 'objectid': 158744, 'filesize': 426437, 'datasetid': 'document', 'hash': '2e573aa9767523c89a42136d871f9de4', 'filename': 'JPM1149-1751-1-PB.pdf', 'hash_type': 'MD5', 'mtime': '2022-01-10 16:19:12', 'mime_type': 'application/pdf', 'fileid': 430725}], 'docid': 158744, 'main': 'JPM1149-1751-1-PB.pdf', 'mime_type': 'application/pdf', 'language': 'en', 'placement': 1, 'security': 'public', 'eprintid': 37814}]",2022-01-11 01:19:03,421,,2022-01-11 01:19:03,2015-10-01 00:00:00.000000000,disk0/00/03/78/14,"[{'name': {'given': 'Susianti', 'lineage': None, 'family': 'Susianti', 'honourific': None}, 'id': 'susiantiglb@yahoo.com'}, {'id': None, 'name': {'family': 'Kurniawan', 'honourific': None, 'lineage': None, 'given': 'Betta'}}, {'id': 'reni.zuraida@fk.unila.ac.id', 'name': {'honourific': None, 'family': 'Zuraida', 'lineage': None, 'given': 'Reni'}}, {'name': {'given': 'Hanna', 'lineage': None, 'family': 'Mutiara', 'honourific': None}, 'id': 'hanna_dr@yahoo.com'}]",['FK1'],article,JPM Ruwa Jurai,2503-2615,64-66,TRUE,1.0,FK Unila,"Penyakit gout adalah salah satu tipe dari arthritis (rematik) yang disebabkan terlalu banyaknya atau tidak
normalnya kadar asam urat di dalam tubuh. Di masyarakat beredar mitos bahwa ngilu sendi berarti penyakit
asam urat. Pengertian ini perlu diluruskan, sehingga dirasa perlu untuk melakukan penyuluhan dan perlu
dilakukan pemeriksaan kadar asam urat. Kegiatan dilaksanakan pada tanggal 15 November 2015 pukul 15.30 s.d.
17.30 WIB di Desa Kalisari Kecamatan Natar Kabupaten Lampung Selatan dan dihadiri 31 orang warga yang
didominasi oleh ibu-ibu rumah tangga. Metode yang digunakan dalam kegiatan ini adalah penyuluhan yang
dilanjutkan dengan diskusi. Evaluasi yang dilakukan terdiri dari evaluasi awal (pre-test), evaluasi proses
(pertanyaan saat diskusi) dan evaluasi akhir (post-test). Berdasarkan data hasil pengamatan diperoleh rata-rata
nilai pre-test peserta 45,61 dan post-test 65,37. Setelah mendapatkan penyuluhan mengenai penyakit gout,
terdapat peningkatan pengetahuan masyarakat di Desa Kalisari Kecamatan Natar Kabupaten Lampung Selatan
tentang penyakit gout. Setelah dilakukan penyuluhan, masing-masing peserta diperiksa kadar asam urat dalam
darah yang diambil dari darah perifer dan diperiksa menggunakan stick. Dari hasil pemeriksaan didapatkan
bahwa dari 31 orang peserta dan 10 orang yang memiliki kadar asam urat di atas normal. Itu berarti angka
kejadian gout di desa Kalisari cukup tinggi. Terdapat peningkatan pengetahuan masyarakat di Desa Kalisari
Kecamatan Natar Kabupaten Lampung Selatan tentang penyakit gout. Angka kejadian penyakit gout di Desa
Kalisari Kecamatan Natar Kabupaten Lampung Selatan sendiri cukup tinggi.",1.0,,,,,,,,,
29,8,show,Perbedaan Kemampuan Memori Kerja pada Tikus Paska Paparan Gelombang Elektromagnetik dari Handphone Selama 14 hari,,"['R1', 'RZ']",2016-09-01 01:17:51,archive,published,499,http://repository.lppm.unila.ac.id/id/eprint/499,public,pub,,"[{'eprintid': 499, 'security': 'public', 'placement': 1, 'mime_type': 'application/pdf', 'language': 'en', 'docid': 416, 'main': 'naskah publikasi 2.pdf', 'files': [{'mtime': '2016-08-31 03:59:22', 'hash_type': 'MD5', 'filename': 'naskah publikasi 2.pdf', 'hash': 'c1bf1feaeee2585b4a38c15cd94fc290', 'fileid': 2647, 'mime_type': 'application/pdf', 'filesize': 113212, 'datasetid': 'document', 'uri': 'http://repository.lppm.unila.ac.id/id/file/2647', 'objectid': 416}], 'format': 'text', 'pos': 1, 'rev_number': 1, 'uri': 'http://repository.lppm.unila.ac.id/id/document/416'}]",2016-09-01 01:17:51,286,"['Bagian Anatomi, Fakultas kedokteran Universitas Lampung', 'Bagian Anatomi, Fakultas kedokteran Universitas Lampung', 'Bagian Ilmu kedokteran Komunitas, FK Unila']",2016-09-01 01:17:51,2015-03-01 00:00:00.000000000,disk0/00/00/04/99,"[{'id': 'ajwulan@gmail.com', 'name': {'given': 'ANggraeni Janar', 'family': 'Wulan', 'honourific': None, 'lineage': None}}, {'name': {'lineage': None, 'honourific': None, 'family': 'Iyos', 'given': 'Rekha Nova'}, 'id': None}, {'name': {'lineage': None, 'honourific': None, 'family': 'Aditya', 'given': 'Muhammad'}, 'id': None}]",['FK1'],article,JUKE,ISSN 2088-9348,13-17,TRUE,9.0,Fakultas Kedokteran Universitas Lampung dan IDI WIlayah Lampung,"Penggunaan handphone sudah menjadi bagian dari gaya hidup masyarakat. Hal ini merupakan sebuah ancaman serius untuk kesehatan manusia. Paparan gelombang Elektromagnetik (EM) dapat menyebabkan gangguan pada otak manusia balk pada struktur, fungsi maupun aspek biokimiawinya. Stres akibat paparan gelombang EM dapat mengganggu fungsi memori. Penelitian ini bertujuan untuk mengetahui ada atau tidaknya perbedaan nilai memori kerja pada tikus putih (Rattus norvegicus) jantan galur Sprague dawley. Pada penelitian ini digunakan 18 ekor tikus putih (Rattus norvegicus) galur Sprague dawley, berusia 2-3 minggu dibagi ke dalam 3 kelompok, yaitu kelompok kontrol (K), kelompok perlakuan 1 (P1) dipaparkan dengan gelombang EM dari handphone 1 jam/hari (P1), dan P2 dipaparkan dengan durasi 3 jann/hari selama 14 hari. Pengujian memori kerja menggunakan radial arm maze. Hasil rerata memori kerja pada masing-masing kelompok adalah sebagai berikut K: 2%, P1: 1,33%, P2: 2,33%. Dari hasil analisa One Way ANOVA didapatkan nilai p=0,55 (p>0,05). Simpulan, paparan gelombang EM handphone selama 14 hari tidak mempengaruhi kemampuan memori kerja tikus putih (Rattus norvegicus) jantan galur Sprague dawley",5.0,http://juke.kedokteranunila.ac.id,,,,,,[{'url': 'http://juke.kedokteranunila.ac.id'}],,
30,7,show,Risk factors of MDR Gram negative bacteremia among hospitalized patients,,['RC'],2020-06-19 19:16:16,archive,published,22418,http://repository.lppm.unila.ac.id/id/eprint/22418,public,pub,,"[{'mime_type': 'application/pdf', 'language': 'en', 'placement': 1, 'security': 'public', 'eprintid': 22418, 'rev_number': 1, 'uri': 'http://repository.lppm.unila.ac.id/id/document/36164', 'pos': 1, 'format': 'text', 'files': [{'filename': 'ISAAR 2015_Abstract Book.pdf', 'hash': 'db670c3ddcc4c7a0d7da25b12f707098', 'mtime': '2020-06-19 14:57:07', 'hash_type': 'MD5', 'mime_type': 'application/pdf', 'fileid': 208071, 'filesize': 186961, 'datasetid': 'document', 'uri': 'http://repository.lppm.unila.ac.id/id/file/208071', 'objectid': 36164}], 'docid': 36164, 'main': 'ISAAR 2015_Abstract Book.pdf'}]",2020-06-19 19:16:16,112,,2020-06-19 19:16:16,1970-01-01 00:00:00.000002015,disk0/00/02/24/18,"[{'name': {'given': 'A', 'lineage': None, 'family': 'Yonata', 'honourific': None}}, {'name': {'honourific': None, 'family': 'Chen', 'lineage': None, 'given': 'K'}}, {'name': {'honourific': None, 'family': 'Loho', 'lineage': None, 'given': 'T'}}, {'name': {'lineage': None, 'honourific': None, 'family': 'Abdullah', 'given': 'M'}}]",['FK1'],conference_item,,,S88-S88,TRUE,,,,45.0,https://www.sciencedirect.com/journal/international-journal-of-antimicrobial-agents,"May, 14-15, 2015",conference,"Incheon, Korea",10 th  International Symposium on Antimicrobial Agents and Resistance,poster,,,
31,8,show,Diagnosis dan Tatalaksana Polymyositis,,['RC'],2020-06-19 19:16:07,archive,,22416,http://repository.lppm.unila.ac.id/id/eprint/22416,public,pub,,"[{'files': [{'objectid': 36163, 'uri': 'http://repository.lppm.unila.ac.id/id/file/208062', 'mime_type': 'application/pdf', 'fileid': 208062, 'filename': '637-1295-1-PB.pdf', 'hash': 'a1b3f7b63a5870b6e9a03c5940b43049', 'hash_type': 'MD5', 'mtime': '2020-06-19 14:16:28', 'datasetid': 'document', 'filesize': 132658}], 'main': '637-1295-1-PB.pdf', 'docid': 36163, 'uri': 'http://repository.lppm.unila.ac.id/id/document/36163', 'rev_number': 2, 'format': 'text', 'pos': 1, 'security': 'public', 'placement': 1, 'eprintid': 22416, 'language': 'en', 'mime_type': 'application/pdf'}]",2020-06-19 19:16:07,112,,2020-06-19 19:16:07,1970-01-01 00:00:00.000002015,disk0/00/02/24/16,"[{'name': {'lineage': None, 'honourific': None, 'family': 'Yonata', 'given': 'Ade'}}]",['FK1'],article,Juke Unila,2088-9348,69-75,TRUE,9.0,,,5.0,http://juke.kedokteran.unila.ac.id/index.php/juke,,,,,,,,
32,6,show,Analysis of the Relationship of Hormonal Contraceptive Use in Women with Sexual Dysfunction,,['RB'],2017-01-16 01:59:47,archive,published,1392,http://repository.lppm.unila.ac.id/id/eprint/1392,public,pub,,"[{'rev_number': 1, 'uri': 'http://repository.lppm.unila.ac.id/id/document/1267', 'pos': 1, 'format': 'text', 'files': [{'filesize': 368011, 'datasetid': 'document', 'hash_type': 'MD5', 'mtime': '2017-01-14 03:22:01', 'hash': '85cd5782bb926f48893455eab963bdef', 'filename': '103-108-ZAHRA-Z.pdf', 'fileid': 9405, 'mime_type': 'application/pdf', 'uri': 'http://repository.lppm.unila.ac.id/id/file/9405', 'objectid': 1267}], 'main': '103-108-ZAHRA-Z.pdf', 'docid': 1267, 'language': 'en', 'mime_type': 'application/pdf', 'placement': 1, 'security': 'public', 'eprintid': 1392}]",2017-01-16 01:59:47,575,,2017-01-16 01:59:47,1970-01-01 00:00:00.000002015,disk0/00/00/13/92,"[{'name': {'given': 'Zettira', 'family': 'Zahra', 'honourific': None, 'lineage': None}, 'id': 'Rharha_smanda@yahoo.com'}, {'name': {'honourific': None, 'family': 'Khairun', 'lineage': None, 'given': 'Nisa Berawi'}, 'id': 'nisaberawi0226@gmail.com'}]",['FK1'],article,Majority,2337-3776,103-107,TRUE,7.0,Khairun Nisa,"Sexual dysfunctionin women is an important reproductive health issues as its relate to the continuity of a woman's reproductive function and influence on the harmony of marriage. More than half of women in a country may experience sexual dysfunction. Epidemiologic data in the United States reported the incidents of sexual dysfunction in women is 43%, with complaints of sexual desire disorder 10 - 46%, disorders of sexual arousal disorder 4 - 7%, orgasm disorder 5 - 42%, pain is 3 - 18% and 30% vaginismus. Use of hormonal contraception method is one of the risk factors that may affect the incidence of sexual dysfunction in users. The use of hormonal contraceptive methods is one of the risk factors that may affect the incidence of sexual dysfunction in users because the content contained therein affect physiological function of hormonal women that can lead to various sexual disorders such as disorders of interest, orgasm disorders and disorders lust.
Keywords: Hormonal Contraception, Sexual Dysfunction",4.0,http://jukeunila.com/majority/majority-volume-4-no-7/,,,,,,,,
