,rev_number,metadata_visibility,title,referencetext,subjects,status_changed,eprint_status,date_type,eprintid,uri,full_text_status,ispublished,contributors,documents,datestamp,userid,corp_creators,lastmod,date,dir,creators,divisions,type,publication,issn,pagerange,refereed,number,publisher,abstract,volume,official_url,event_dates,event_type,event_location,event_title,pres_type,related_url,contact_email,id_number
0,10,show,PENINGKATAN PENGETAHUAN IBU USIA REPRODUKTIF MELALUI PENYULUHAN DAN SIMULASI TENTANG ASI EKSKLUSIF UNTUK MENINGKATKAN DERAJAT KESEHATAN IBU DAN ANAK DI PUSKESMAS WAY KANDIS BANDAR LAMPUNG,"1. World Health Organization. Complementary feeding of young children in developing countries: a review of current scientific knowledge. Geneva:WHO; 1998.
2. Institute of Medicine. Nutrition during lactation.Washington DC: National Academic Press; 1991.
3. Saarinen UM, Kajosari M. Breastfeeding asprophylaxis against atopic disease; prospectivefollow-up study until 17 years old. Lancet 1995;346: 1065-9.
4. Roesli U. Mitos menyusui. Seminar Telaah Mutakhir tentang ASI. Bali:FAOPS-Perinasia; 2001.
5. Anderson JW, Johnstone BM, Remley DT. Breastfeeding and cognitive development: a metaanalysis. Am J Clin Nutr. 1999; 70:525-35.
6. Uauy R, de Andraca I. Human milk and breastfeeding for optimal mental development. J Nutr. 1995; 125:2278S-80S.
7. Besar DS. Metode amenorea laktasi. Seminar Telaah Mutakhir tentang ASI. Bali: FAOPS-Perinasia; 2001.
8. Davies-Adetugbo A, Ojofeitimi EO. Maternal education, breastfeeding behaviours, and lactational amenorrhea: studies among two ethnic communities in Ile Ife, Nigeria. Nutrition and Health. 1996; 11:115-26.
9. UNICEF-RI. The situation of women and childrenin Indonesia. Jakarta: Unicef-RI; 2000.
10. Sub-Committee on Nutrition. Nutrition throughout the life cycle, 4th report on the world nutrition situation. Geneva: ACC/SCN-IFPRI; 2000.
11. Roesli U. Mengenal asi eksklusif. Jakarta: Trubus Agriwidya; 2000.
12. Republik Indonesia. Rancangan program pembangunan nasional tahun 2001-2005. Jakarta: Republik Indonesia; 2000.
13. Simanjuntak D. Faktor-faktor yang berhubungan dengan pemberian makanan pendamping asi dini pada bayi di Kecamatan Pasar Rebo, Jakarta Timur tahun 2001 [tesis]. Depok: Universitas Indonesia; 2002.
21
14. Utomo B. The slowing progress of breastfeeding promotion program in Indonesia: causes and recommendation. Diskusi Pakar Bidang Gizi tentang ASI MP-ASI, Antropometri, dan BBLR. Cipanas: Depkes-RI; 19-21 Januari 2001.",['RG'],2019-01-02 08:02:10,archive,published,10428,http://repository.lppm.unila.ac.id/id/eprint/10428,public,pub,"[{'id': None, 'type': 'http://www.loc.gov/loc.terms/relators/AUT', 'name': {'lineage': None, 'honourific': None, 'family': 'Aditya', 'given': 'Muhammad'}}, {'type': 'http://www.loc.gov/loc.terms/relators/AUT', 'id': None, 'name': {'given': 'Winda', 'family': 'Trijayanthi Utama', 'honourific': None, 'lineage': None}}, {'id': 'ratnadps@gmail.com', 'type': 'http://www.loc.gov/loc.terms/relators/AUT', 'name': {'lineage': None, 'honourific': None, 'family': 'Dewi Puspita Sari', 'given': 'Ratna'}}, {'name': {'lineage': None, 'honourific': None, 'family': 'Nareswari', 'given': 'Shinta'}, 'type': 'http://www.loc.gov/loc.terms/relators/AUT', 'id': None}]","[{'language': 'en', 'mime_type': 'application/pdf', 'eprintid': 10428, 'placement': 1, 'security': 'public', 'pos': 1, 'format': 'text', 'rev_number': 1, 'uri': 'http://repository.lppm.unila.ac.id/id/document/23448', 'main': 'dr Ratna DPS (Laporan Pengabdian dg dr M Aditya).pdf', 'docid': 23448, 'files': [{'fileid': 96952, 'mime_type': 'application/pdf', 'hash_type': 'MD5', 'mtime': '2018-11-27 04:32:01', 'hash': '99ac12097a0001044793a765cc1c80d2', 'filename': 'dr Ratna DPS (Laporan Pengabdian dg dr M Aditya).pdf', 'datasetid': 'document', 'filesize': 4815109, 'objectid': 23448, 'uri': 'http://repository.lppm.unila.ac.id/id/file/96952'}]}]",2019-01-02 08:02:10,1197,"['Fakultas Kedokteran Universitas Lampung', 'Fakultas Kedokteran Universitas Lampung', 'Fakultas Kedokteran Universitas Lampung', 'Fakultas Kedokteran Universitas Lampung']",2019-02-12 02:27:19,1970-01-01 00:00:00.000002015,disk0/00/01/04/28,"[{'name': {'honourific': None, 'family': 'Aditya', 'lineage': None, 'given': 'Muhammad'}}, {'name': {'given': 'Winda', 'lineage': None, 'honourific': None, 'family': 'Trijayanthi Utama'}}, {'name': {'lineage': None, 'family': 'Dewi Puspita Sari', 'honourific': None, 'given': 'Ratna'}}, {'name': {'family': 'Nareswari', 'honourific': None, 'lineage': None, 'given': 'Shinta'}}]",['FK1'],experiment,,,,,,,,,,,,,,,,,
1,6,show,Role of Sildenafil in Acceleration of Delayed Union Fracture Healing on Sprague-Dawley Rats Model,,['RF'],2020-06-03 07:14:35,archive,published,21632,http://repository.lppm.unila.ac.id/id/eprint/21632,public,pub,,"[{'security': 'public', 'placement': 1, 'eprintid': 21632, 'language': 'en', 'mime_type': 'application/pdf', 'files': [{'uri': 'http://repository.lppm.unila.ac.id/id/file/200323', 'objectid': 35020, 'filesize': 9645004, 'datasetid': 'document', 'hash_type': 'MD5', 'mtime': '2020-06-03 05:51:32', 'filename': '2015RoleofSIldenafilinaccelerationofdelayedunionfracturehealingonSpragueDawleyRatsModelBJMMR.pdf', 'hash': 'bc00eb83f6251f06c15c9707b1d7f82a', 'fileid': 200323, 'mime_type': 'application/pdf'}], 'docid': 35020, 'main': '2015RoleofSIldenafilinaccelerationofdelayedunionfracturehealingonSpragueDawleyRatsModelBJMMR.pdf', 'uri': 'http://repository.lppm.unila.ac.id/id/document/35020', 'rev_number': 1, 'format': 'text', 'pos': 1}]",2020-06-03 07:14:35,285,['Universitas Lampung'],2020-06-03 07:14:35,2015-12-01 00:00:00.000000000,disk0/00/02/16/32,"[{'name': {'given': 'Fauzi', 'lineage': None, 'family': 'Ahmad', 'honourific': None}, 'id': 'ahmad.fauzi@fk.unila.ac.id'}]",['FK1'],article,British Journal of Medicine & Medical Research,2231-0614,419-428,TRUE,5.0,SCIENCEDOMAIN international,"This work was carried out in collaboration between all authors. Author AF managed the experimental process, analyses of the study, performed the histomorphometry analysis. Author AFKdesignedthe study, wrote the protocol and wrote the manuscript. AuthorAKmanaged theliterature searches,provide scientific support andauthorEKperformed the immunohistochemistry analyses. All authors read and approved the final manuscript",8.0,https://www.researchgate.net/profile/Aryadi_Kurniawan2/publication/332571072_2015_Role_of_SIldenafil_in_accelerationof_delayed_union_fracture_healing_on_Sprague_Dawley_Rats_Model_BJMMR/links/5cbeb299299bf1209778d739/2015-Role-of-SIldenafil-in-accelerationof-delayed-union-fracture-healing-on-Sprague-Dawley-Rats-Model-BJMMR.pdf,,,,,,,,
2,6,show,Trigger Finger,,['RF'],2020-06-03 07:14:53,archive,,21636,http://repository.lppm.unila.ac.id/id/eprint/21636,public,pub,,"[{'eprintid': 21636, 'placement': 1, 'security': 'public', 'language': 'en', 'mime_type': 'application/pdf', 'docid': 35023, 'main': '647-1335-1-PB.pdf', 'files': [{'mtime': '2020-06-03 06:02:07', 'hash_type': 'MD5', 'filename': '647-1335-1-PB.pdf', 'hash': '8f17ef8b093ae1732da35812bd41e952', 'fileid': 200336, 'mime_type': 'application/pdf', 'filesize': 371714, 'datasetid': 'document', 'uri': 'http://repository.lppm.unila.ac.id/id/file/200336', 'objectid': 35023}], 'pos': 1, 'format': 'text', 'rev_number': 1, 'uri': 'http://repository.lppm.unila.ac.id/id/document/35023'}]",2020-06-03 07:14:53,285,['Universitas Lampung'],2020-06-03 07:14:53,1970-01-01 00:00:00.000002015,disk0/00/02/16/36,"[{'name': {'given': 'Fauzi', 'honourific': None, 'family': 'Ahmad', 'lineage': None}, 'id': 'ahmad.fauzi@fk.unila.ac.id'}]",['FK1'],article,JUKE,ISSN 2088-9348,134-140,TRUE,9.0,Fakultas Kedokteran Universitas Lampung dan IDI WIlayah Lampung,"Trigger finger adalah penyakit yang umum terjadi pada jari, yang disebabkan oleh peradangan dan penyempitan pulley A-1, menyebabkan rasa sakit, terkunci dan hilangnya gerakan jari yang terkena. Meskipun dapat terjadi pada siapa saja, trigger finger lebih sering terdapat pada penderita diabetes dan wanita, umumnya pada dekade kelima dan keenam. Diagnosis penyakit ini cukup mudah, karena sebagian besar pasien mengeluh clicking atau jari terkunci, namun proses patologis lain seperti fraktur, tumor, atau cedera jaringan lunak lainnya harus disingkirkan. Penatalaksanaan konservatif antara lain splinting, injeksi kortikosteroid dan terapi adjuvant. Penatalaksanaan bedah terdiri dari pembedahan pulley A-1 dengan teknik terbuka atau perkutaneus. Komplikasi pembedahan jarang terjadi, meliputi bowstringing, cedera saraf interdigitalis, dan triggering yang tidak sembuh. Beberapa pasien memerlukan prosedur yang lebih ekstensif untuk mengurangi ukuran tendon fleksor. Kondisi komorbid mempengaruhi penatalaksanaan trigger finger. Pemahaman tentang pathomekanik, faktor risiko, dan variasi penatalaksanaan trigger finger, sangat penting untuk perawatan yang tepat. [JuKe Unila 2015; 5(9):134-140]

Kata Kunci: penatalaksanaan konservatif, penatalaksanaan bedah, trigger finger",5.0,https://juke.kedokteran.unila.ac.id/index.php/juke/issue/view/MA,,,,,,,,
3,6,show,Correlation of ALT/AST and Bilirubin Levels in Hepatitis C Patients at Internal Medicine Department of Dr. H Abdul Moeloek Lampung Province along January - December 2014,,['RB'],2017-01-16 01:58:48,archive,published,1389,http://repository.lppm.unila.ac.id/id/eprint/1389,public,pub,,"[{'placement': 1, 'security': 'public', 'eprintid': 1389, 'language': 'en', 'mime_type': 'application/pdf', 'files': [{'uri': 'http://repository.lppm.unila.ac.id/id/file/9387', 'objectid': 1264, 'filesize': 526265, 'datasetid': 'document', 'hash_type': 'MD5', 'mtime': '2017-01-14 02:52:03', 'filename': '25.pdf', 'hash': '60580ce43b6df1946434b4545b95f6dd', 'fileid': 9387, 'mime_type': 'application/pdf'}], 'docid': 1264, 'main': '25.pdf', 'rev_number': 1, 'uri': 'http://repository.lppm.unila.ac.id/id/document/1264', 'pos': 1, 'format': 'text'}]",2017-01-16 01:58:48,575,,2017-01-16 01:58:48,1970-01-01 00:00:00.000002015,disk0/00/00/13/89,"[{'id': None, 'name': {'given': 'Aleya', 'lineage': None, 'family': 'Aleya', 'honourific': None}}, {'name': {'given': 'Nisa Berawi', 'honourific': None, 'family': 'Khairun', 'lineage': None}, 'id': 'nisaberawi0226@gmail.com'}]",['FK1'],article,Majority,2337-3776,135-139,TRUE,9.0,Khairun Nisa,"Hepatitis C is a disease that can be contagious inflammation of the liver caused by the hepatitis C virus. Viral hepatitis consists of five types of hepatitis such as hepatitis A, hepatitis B, hepatitis C, hepatitis D, and hepatitis E. This disease become a mayor problem in Indonesia. Therapy of hepatitis C virus in Indonesia by providing antivirus and pegilated interferon. Alanine
Aminotransferase/Aspartate Aminotransferase (ALT/AST) and bilirubin are products of the liver which in case of liver damage, there will be the result in abnormalities in liver enzymes and bilirubin. This study aimed to determine the effect of increased levels of ALT/AST with total bilirubin levels in hepatitis C patients at Internal Medicine Department of Dr. H Abdul Moeloek Lampung Province from January to December 2014. The result showed that when there is an increased bilirubin levels so liver enzymes will be increased too. But increased liver enzymes and bilirubin levels do not specify that individual is infected by
hepatitis C.

Keywords: ALT/AST, bilirubin, hepatitis C.",4.0,http://jukeunila.com/majority/edisi-4-no-9/,,,,,,,,
4,6,show,Effects of Dietary Fiber to Cholesterol Level on Overweight Patients,,['RB'],2017-01-16 01:59:43,archive,published,1390,http://repository.lppm.unila.ac.id/id/eprint/1390,public,pub,,"[{'eprintid': 1390, 'security': 'public', 'placement': 1, 'language': 'en', 'mime_type': 'application/pdf', 'docid': 1265, 'main': '121-126-ALYSSA.pdf', 'files': [{'hash_type': 'MD5', 'mtime': '2017-01-14 03:03:40', 'hash': '2a71af3f4f7cf3fda9bfc6ef11b7325f', 'filename': '121-126-ALYSSA.pdf', 'fileid': 9393, 'mime_type': 'application/pdf', 'filesize': 464877, 'datasetid': 'document', 'uri': 'http://repository.lppm.unila.ac.id/id/file/9393', 'objectid': 1265}], 'format': 'text', 'pos': 1, 'rev_number': 1, 'uri': 'http://repository.lppm.unila.ac.id/id/document/1265'}]",2017-01-16 01:59:43,575,,2017-01-16 01:59:43,1970-01-01 00:00:00.000002015,disk0/00/00/13/90,"[{'id': 'farlyssa@gmail.com', 'name': {'lineage': None, 'honourific': None, 'family': 'Allyssa', 'given': 'Fairudz'}}, {'id': 'nisaberawi0226@gmail.com', 'name': {'given': 'Nisa Berawi', 'honourific': None, 'family': 'Khairun', 'lineage': None}}]",['FK1'],article,Majority,2337-3776,121-126,TRUE,8.0,Khairun Nisa,"Overweight incidence in worldwide is tend to increase, including in Indonesia. It happens because change of lifestyle of Indonesian people. Overweight is influenced by consumption factor, sedentary life, genetic and social determinant such as family economy. Overweight that can lead to obesity could create diseases such as metabolic syndrome, type 2 diabetes mellitus, atherosclerosis, coronary heart disease and cancer. Lots of medications for obesity with hypercholesterolemia have been found, but if this condition is treated just in curative side, it still could create serious health problems. One of the effort that we can do is modify consumption factors as risk factor with increase fibrous food. Dietary fiber is a form of complex carbohydrate which commonly get from plants. In common, dietary fiber, like lignin, inulin and B-glucan can help to lower blood cholesterol level by ensnare the fat in intestine and bind bile acids and increase the excretion of bile acids to stool.
Keywords: cholesterol, dietary fiber, HDL (High Density Lipoprotein), LDL(Low Density Lipoprotein) , obesity, overweight",4.0,http://jukeunila.com/majority/majority-volume-4-no-8/,,,,,,,,
5,6,show,The Different of Protein Intake Between Chronic Renal Failure Patients with Malnutrition and Not Malnutrition in Hemodialysis Unit at dr. Abdul Moeloek Hospital Bandar Lampung,,['R1'],2016-09-01 01:18:31,archive,,500,http://repository.lppm.unila.ac.id/id/eprint/500,public,pub,[{'type': 'http://www.loc.gov/loc.terms/relators/AUT'}],"[{'files': [{'objectid': 417, 'uri': 'http://repository.lppm.unila.ac.id/id/file/2659', 'fileid': 2659, 'mime_type': 'application/pdf', 'hash_type': 'MD5', 'mtime': '2016-08-31 04:09:56', 'hash': '6e2c1ac284dcae0e7ba67cfa4bad0cf5', 'filename': 'DIA_JKK unsri_2015.pdf', 'datasetid': 'document', 'filesize': 148334}], 'main': 'DIA_JKK unsri_2015.pdf', 'docid': 417, 'rev_number': 1, 'uri': 'http://repository.lppm.unila.ac.id/id/document/417', 'format': 'text', 'pos': 1, 'security': 'public', 'placement': 1, 'eprintid': 500, 'language': 'en', 'mime_type': 'application/pdf'}]",2016-09-01 01:18:31,183,,2016-09-01 01:18:31,1970-01-01 00:00:00.000002015,disk0/00/00/05/00,"[{'id': 'riditie@gmail.com', 'name': {'given': 'Dian Isti', 'lineage': None, 'family': 'Angraini', 'honourific': None}}]",['FK1'],article,JURNAL KEDOKTERAN DAN KESEHATAN,,163-168,TRUE,2.0,,"Chronic renal failure patients undergoing hemodialysis are at risk of malnutrition, especially protein energy
malnutrition. Adequate protein intake in hemodialysis patients aims to compensate for the loss of protein due to the
hemodialysis process and to fullfill of basic physiological functions of the body. Malnutrition can increase the risk of
morbidity and mortality. This study aims to determine the differences between the mean intake of protein in
hemodialysis patients are malnourished and not malnourished. This study is an observational analytic with cross
sectional design, in 43 patients with chronic renal failure undergoing hemodialysis in hemodialysis installation dr. H.
Abdoel Moeloek in October to December 2013, taken with consecutive sampling technique. Malnutrition was the
underweight status based on assessment of body mass index (BMI). Protein intake was obtained by the method of
assessment of food consumption using semiquantitative food frequency questionnaire quesionaire (SQ-FFQ) that
explores history of the patient ate during the last week. The results showed that subjects who were malnourished as
much as 16.3%, and less protein intake was 36.5%. The mean intake of protein malnourished subjects (54 grams / day)
lower than in subjects who are not malnourished (60.4 g / day). There were no differences between the mean protein
intake was statistically significant between the groups malnourished and not malnourished (p = 0.163). Conclusion:
there are no differences between the mean protein intake was statistically significant in subjects who are malnourished
or not malnourished.
Keywords: CRF-HD patients, malnutrition, protein inta",2.0,http://ejournal.unsri.ac.id/index.php/jkk,,,,,,,,
6,8,show,Perilaku Konsumsi Makanan Berisiko Berhubungan dengan Status Gizi pada Pasien Poliklinik Universitas Lampung,,['R1'],2016-09-01 01:14:02,archive,published,498,http://repository.lppm.unila.ac.id/id/eprint/498,public,pub,[{'type': 'http://www.loc.gov/loc.terms/relators/AUT'}],"[{'eprintid': 498, 'security': 'public', 'placement': 1, 'mime_type': 'application/pdf', 'language': 'en', 'docid': 414, 'main': 'DIA_prosiding_2015.pdf', 'files': [{'uri': 'http://repository.lppm.unila.ac.id/id/file/2640', 'objectid': 414, 'hash': '14b8d781cc4b84b244b314754c198c32', 'filename': 'DIA_prosiding_2015.pdf', 'mtime': '2016-08-31 03:56:23', 'hash_type': 'MD5', 'mime_type': 'application/pdf', 'fileid': 2640, 'filesize': 106639, 'datasetid': 'document'}], 'format': 'text', 'pos': 1, 'rev_number': 1, 'uri': 'http://repository.lppm.unila.ac.id/id/document/414'}]",2016-09-01 01:14:02,183,,2016-09-01 01:14:02,2015-10-01 00:00:00.000000000,disk0/00/00/04/98,"[{'name': {'given': 'Dian Isti', 'lineage': None, 'honourific': None, 'family': 'Angraini'}, 'id': 'riditie@gmail.com'}]",['FK1'],conference_item,Prosiding Seminar Presentasi Artikel Ilmiah Dies Natalis FK Unila ke 13,,26-30,TRUE,,,"Underweight or overweight were nutritional problem in developing countries such as Indonesia and this is a double burden.
Nutritional problems can be caused by many factors such as unhealthy lifestyle (diet and exercise), socioeconomic
conditions, stress and others. Changes in diet such as low consumption of fruits and vegetables, as well as behavioral risk foods can cause a person to experience more nutritional problems. 
This study was an observational analytic study with cross sectional approach in 52 patients who came to the clinic Unila in September 2015 and more than 18 years old.
Samples taken by total sampling. Behavioral risk foods comsumption obtained by the results of a questionnaire containing 13 questions and the determination of categories by using the receiver operating characteristic (ROC) graph. Nutritional status was assessed using anthropometric measurements using body mass index (BMI). The results showed that the respondents did not have behavioral risk foodscomsumption (51.9%) and has the nutritional status of obesity (44.3%).
There is a significant relationship between behavioral risk foods with nutritional status (p = 0.012). Respondents with behavioral risk foods comsumption have a 12 times greater risk to overweight nutritional status than those who do not behave risk foods comsumption (OR = 12). Conclusion: behavioral risk food consumption associated with nutrition status.
Keywords : behavioral risk foods comsumption, nutritional status, Unila clinic patients.",,,Oktober 2015,conference,Bandar lampung,Seminar Presentasi Artikel Ilmiah Dies Natalis FK Unila ke 13,paper,,,
7,7,show,"Hubungan Pengetahuan Ibu, Sikap dan Perilaku terhadap Status Gizi Balita pada Komunitas Nelayan di Kota Karang Raya Teluk Betung Timur Bandar Lampung",,['RA'],2020-05-22 05:20:04,archive,published,20350,http://repository.lppm.unila.ac.id/id/eprint/20350,public,pub,,"[{'eprintid': 20350, 'placement': 1, 'security': 'public', 'mime_type': 'application/pdf', 'language': 'en', 'main': 'Medical Journal of Lampung University_Melly Reni Aditya.pdf', 'docid': 33692, 'files': [{'uri': 'http://repository.lppm.unila.ac.id/id/file/191570', 'objectid': 33692, 'mtime': '2020-05-22 04:36:41', 'hash_type': 'MD5', 'filename': 'Medical Journal of Lampung University_Melly Reni Aditya.pdf', 'hash': 'a2113cd398bc712d4dbde15e521a7b14', 'fileid': 191570, 'mime_type': 'application/pdf', 'filesize': 447529, 'datasetid': 'document'}], 'pos': 1, 'format': 'text', 'uri': 'http://repository.lppm.unila.ac.id/id/document/33692', 'rev_number': 1}]",2020-05-22 05:20:04,616,,2020-05-22 05:20:04,2015-06-01 00:00:00.000000000,disk0/00/02/03/50,"[{'id': None, 'name': {'lineage': None, 'honourific': None, 'family': 'Anida', 'given': 'Melly'}}, {'id': 'reni.zuraida@fk.unila.ac.id', 'name': {'honourific': None, 'family': 'Zuraida', 'lineage': None, 'given': 'Reni'}}, {'id': None, 'name': {'honourific': None, 'family': 'Aditya', 'lineage': None, 'given': 'Muhammad'}}]",['FK1'],article,Majority,2337-3776,167-176,TRUE,8.0,Juke Unila,"Status gizi merupakan prediktor kualitas sumber daya manusia di masa depan. Beberapa faktor yang mempengaruhi status
gizi balita yaitu pendidikan, pengetahuan, pekerjaan ibu, sosial ekonomi, pendapatan keluarga, dan jumlah anggota
keluarga. Penelitian ini bertujuan mengetahui hubungan pengetahuan, sikap, dan perilaku gizi ibu terhadap status gizi balita. Penelitian ini adalah analitik observasional dengan pendekatan cross-sectional. Jumlah sampel dalam penelitian ini yaitu 128 ibu dan balitanya yang berusia 6-24 bulan. Pengumpulan data melalui wawancara menggunakan kuesioner. Untuk mengetahui pengaruh antar variabel menggunakan uji regresi logistik. Hasilnya terdapat hubungan pengetahuan gizi ibu (p=0,000), sikap gizi ibu (p=0,000), dan perilaku gizi ibu (p=0,01) terhadap status gizi balita. Sikap gizi ibu merupakan faktor yang paling berpengaruh terhadap status gizi balita (OR=0,161). 
Kata kunci: Pengetahuan gizi ibu, perilaku gizi ibu, sikap gizi ibu, status gizi balita",4.0,https://juke.kedokteran.unila.ac.id/index.php/majority/article/view/1493,,,,,,,,
