,rev_number,metadata_visibility,title,referencetext,subjects,status_changed,eprint_status,date_type,eprintid,uri,full_text_status,ispublished,contributors,documents,datestamp,userid,corp_creators,lastmod,date,dir,creators,divisions,type,publication,issn,pagerange,refereed,number,publisher,abstract,volume,official_url,event_dates,event_type,event_location,event_title,pres_type,related_url,contact_email,id_number
16,13,show,Uterine Rupture,,['RG'],2016-07-22 03:39:02,archive,published,219,http://repository.lppm.unila.ac.id/id/eprint/219,public,pub,"[{'name': {'given': 'Ratna Dewi', 'honourific': None, 'family': 'Puspita Sari', 'lineage': None}, 'type': 'http://www.loc.gov/loc.terms/relators/AUT', 'id': 'ratnadps@gmail.com'}]","[{'uri': 'http://repository.lppm.unila.ac.id/id/document/218', 'rev_number': 1, 'format': 'text', 'pos': 1, 'files': [{'filesize': 108032, 'datasetid': 'document', 'filename': 'ARTIKEL REVIEW RATNA DPS.doc', 'hash': '08c7e8015f50b4374294305fa8f47d0f', 'hash_type': 'MD5', 'mtime': '2016-07-21 06:46:23', 'mime_type': 'application/msword', 'fileid': 1295, 'uri': 'http://repository.lppm.unila.ac.id/id/file/1295', 'objectid': 218}], 'docid': 218, 'main': 'ARTIKEL REVIEW RATNA DPS.doc', 'mime_type': 'application/msword', 'language': 'en', 'security': 'public', 'placement': 1, 'eprintid': 219}]",2016-07-22 03:39:02,1197,,2016-07-22 03:39:02,2015-06-01 00:00:00.000000000,disk0/00/00/02/19,"[{'id': 'ratnadps@gmail.com', 'name': {'honourific': None, 'family': 'Puspita Sari', 'lineage': None, 'given': 'Ratna Dewi'}}]",['FK1'],article,JKK Unila,,,TRUE,,,"Abstract

Hemorrhage is majority cause of maternal mortality in addition preeclampsia/eclampsia and infections. Uterine rupture is the tearing of the uterine wall during pregnancy or during labour more than 28 weeks gestational age. Maternal mortality due to hemorrhagic caused by uterine rupture ranged from 17.9% to 62.6%. At the first stage and the second stage of labour, boundary between the lower uterine segment and the upper uterine segment is called physiological retraction, if the lower part of uterine is not progress it became pathological retraction (Bandl's Ring). When the lower uterine segment is still no progress at delivery time it cause uterine rupture and complications such as maternal mortality. It required accuracy in diagnosis of uterine rupture and treatment can be done properly and quickly, so shock and infection can be prevented. 

Keywords:  Uterine Rupture, Hemorrhage, Lower Uterine Segment",,,,,,,,,,
17,6,show,Four Pillars of Management of Type 2 Diabetes Mellitus Patients,"1. Dunning MB. 2009. A Manual of
Laboratory and Diagnostic Test. 8 th Ed.
Lippincott Williams & Wilkins.
2. Kementrian Kesehatan Republik
Indonesia. Riset Kesehatan Dasar. Jakarta:
Laporan Riskesdas. Badan Penelitian dan
Pengembangan Kesehatan Kementerian
Kesehatan; 2010.
3. Lind M, Odén A, Fahlén M, Eliasson B. The
True Value of HbA1c as a Predictor of
Diabetic Complications: Simulations of
HbA1c Variables. PLoS ONE. 2009; 4(2):
4412.
4. Fauci, AS., et al., Harrison’s Principles of
Internal Medicine. 17th ed. USA: The
McGraw-Hill Companies, Inc. 2008; pp.
338.
5. American Diabetes Association. Diagnosis
and Classification of Diabetes Mellitus.
America: Diabetes Care. 2011; hlm. 34.
6. Perkumpulan Endokrinologi Indonesia.
Konsensus Pengendalian dan Pencegahan
Diabetes Mellitus Tipe2 di Indonesia.
Jakarta: Perkeni; 2011.
7. American Diabetes Association. 2013.
Diabetes Basics. Alexandria. [diakses
tanggal 21 juli 2015]. Tersedia dari:
from:http://www.diabetes.org/diabetesbasics/
8. Goldstein DE., et al. Tests of Glycaemia in
Diabetes. Diabetes Care. 2004; 27:1761–
1773.
9. Gunton JE., et al., Cigarette smoking
affects glycemic control in diabetes.
Diabetes care. 2002; 25(4). 796-7.
10. Guyton AC, Hall JE. Textbook of Medical
Physiology. 11th ed. Pennsylvania: Elsevier
Saunders; 2006: 78: 971-2.
11. Holt, Kumar. ABC of Diabetes. Sixth
edition. UK: Wiley-Blackwell; 2010.
12. International Diabetes Federation, 2013.
[diakses tanggal 21 Juli 2015]. Tersedia
dari: http://www.idf.org/about-insulin-0/
13. Lind M, Odén A, Fahlén M, Eliasson B. The
True Value of HbA1c as a Predictor of
Diabetic Complications: Simulations of
HbA1c Variables. PLoS ONE; 2009: 4(2):
4412.
14. Semiardji G. Pendidikan
Berkesinambungan Patologi Klinik.
Jakarta: Bagian Patologi Klinik Fakultas
Kedokteran Universitas Indonesia; 2003.",['RB'],2016-07-22 03:39:33,archive,published,235,http://repository.lppm.unila.ac.id/id/eprint/235,public,pub,,"[{'docid': 227, 'main': 'khairunnisa berawi3.pdf', 'files': [{'mtime': '2016-07-21 07:55:14', 'hash_type': 'MD5', 'filename': 'khairunnisa berawi3.pdf', 'hash': '5704a093d45312c2cc31082fb3fc9bcc', 'fileid': 1339, 'mime_type': 'application/pdf', 'filesize': 362669, 'datasetid': 'document', 'uri': 'http://repository.lppm.unila.ac.id/id/file/1339', 'objectid': 227}], 'pos': 1, 'format': 'text', 'rev_number': 1, 'uri': 'http://repository.lppm.unila.ac.id/id/document/227', 'eprintid': 235, 'placement': 1, 'security': 'public', 'language': 'en', 'mime_type': 'application/pdf'}]",2016-07-22 03:39:33,575,,2016-07-22 03:39:33,2015-12-01 00:00:00.000000000,disk0/00/00/02/35,"[{'name': {'lineage': None, 'family': 'Putra', 'honourific': None, 'given': 'I Wayan A'}}, {'name': {'given': 'Khairun Nisa', 'honourific': None, 'family': 'Berawi', 'lineage': None}}]",['FK1'],article,MAJORITY,2337-3776,8-12,TRUE,9.0,Medical Journal of Lampung Univerisity,"Diabetes mellitus (DM) is a group of metabolic diseases characterized by hyperglycemia resulting from defects in insulin secretion, insulin action or both. Insulin is a hormone produced by the pancreas that play a role in incorporating the glucose from food into body cells, where the glucose to be converted into energy needed by muscles and tissues to function.
Diabetes is not able to absorb glucose properly and glucose increases in the blood (hyperglycemia) and tissue damage over time. The management of patients with diabetes mellitus are known four pillars essential in controlling the course of the disease and complications. The four pillars are education, nutrition therapy, physical activity and pharmacology.
Keywords: diabetes melitus, the four pillars of the management of diabetes melitus",4.0,http://jukeunila.com,,,,,,[{'url': 'http://jukeunila.com/majority/edisi-4-no-9/'}],nisaberawi0226@gmail.com,
18,8,show,Telmisartan menghambat peningkatan kadar TGF-β1 aorta tikus (Rattus norvegicus) yang diinduksi NaCl 8%,,"['R1', 'RS']",2016-09-03 08:08:22,archive,published,529,http://repository.lppm.unila.ac.id/id/eprint/529,none,pub,,,2016-09-03 08:08:22,154,,2016-09-15 03:17:17,1970-01-01 00:00:00.000002015,disk0/00/00/05/29,"[{'id': 'rickyramadhian@gmail.com', 'name': {'given': 'Muhammad Ricky', 'lineage': None, 'family': 'Ramadhian', 'honourific': None}}]",['FK1'],article,Seminar Nasional Sains dan Teknologi VI UNILA,1098-6596,,TRUE,,,"Predicting the binding mode of flexible polypeptides to proteins is an important task that falls outside the domain of applicability of most small molecule and protein−protein docking tools. Here, we test the small molecule flexible ligand docking program Glide on a set of 19 non-α-helical peptides and systematically improve pose prediction accuracy by enhancing Glide sampling for flexible polypeptides. In addition, scoring of the poses was improved by post-processing with physics-based implicit solvent MM- GBSA calculations. Using the best RMSD among the top 10 scoring poses as a metric, the success rate (RMSD ≤ 2.0 Å for the interface backbone atoms) increased from 21% with default Glide SP settings to 58% with the enhanced peptide sampling and scoring protocol in the case of redocking to the native protein structure. This approaches the accuracy of the recently developed Rosetta FlexPepDock method (63% success for these 19 peptides) while being over 100 times faster. Cross-docking was performed for a subset of cases where an unbound receptor structure was available, and in that case, 40% of peptides were docked successfully. We analyze the results and find that the optimized polypeptide protocol is most accurate for extended peptides of limited size and number of formal charges, defining a domain of applicability for this approach.",,,,,,,,,rickyramadhian@gmail.com,
19,6,show,Hubungan diabetes melitus dengan kejadian gagal ginjal kronik,,['RC'],2020-06-19 07:50:13,archive,,22414,http://repository.lppm.unila.ac.id/id/eprint/22414,public,pub,,"[{'files': [{'filesize': 517956, 'datasetid': 'document', 'mtime': '2020-06-19 07:45:32', 'hash_type': 'MD5', 'filename': 'DM vs Ginjal Kronik.pdf', 'hash': '8409bf63fce4bdf6577b8dadea738ad3', 'fileid': 208035, 'mime_type': 'application/pdf', 'uri': 'http://repository.lppm.unila.ac.id/id/file/208035', 'objectid': 36160}], 'main': 'DM vs Ginjal Kronik.pdf', 'docid': 36160, 'rev_number': 1, 'uri': 'http://repository.lppm.unila.ac.id/id/document/36160', 'format': 'text', 'pos': 1, 'security': 'public', 'placement': 1, 'eprintid': 22414, 'mime_type': 'application/pdf', 'language': 'en'}]",2020-06-19 07:50:13,112,,2020-06-19 07:50:13,1970-01-01 00:00:00.000002015,disk0/00/02/24/14,"[{'name': {'given': 'Janis', 'family': 'Rivandi', 'honourific': None, 'lineage': None}}, {'name': {'lineage': None, 'family': 'Yonata', 'honourific': None, 'given': 'Ade'}}]",['FK1'],article,Jurnal Majority,,27-34,TRUE,9.0,,"Ginjal merupakan organ vital yang berperan sangat penting dalam mempertahankan kestabilan lingkungan dalam  tubuh. 
Ginjal mengatur keseimbangan cairan tubuh, elektrolit dan asam basa dengan cara menyaring darah yang melalui ginjal, 
reabsorbsi  selektif  air,  serta  mengekresi  kelebihannya  sebagai  kemih  serta  mengeluarkan  sampah  metabolisme  (urea, 
kreatinin dan asam urat) dan zat kimia asing.  Nefropati diabetik adalah kelainan degeneratif vaskuler ginjal, mempunyai 
hubungan    dengan  gangguan  metabolisme  karbohidrat  atau  intoleransi  gula  (Diabetes  Melitus).  Didefinisikan  sebagai 
sindrom klinis pada pasien DM yang ditandai dengan albuminuria menetap (>300 mg/24 jam atau >200 mikrogram/menit) 
pada minimal dua kali pemeriksaan dalam kurun waktu 3 sampai 6 bulan. Diabetes Melitus adalah suatu kelompok penyakit 
metabolik dengan karakteristik hiperglikemia yang terjadi karena kelainan sekresi insulin,kerja insulin atau kedua-duanya. 
Kelainan yang terjadi pada ginjal penyandang diabetes melitus dimulai dengan adanya mikroalbuminuria. Mikroalbuminuria 
umumnya didefinisikan sebagai ekskresi albumin lebih dari 30 mg per hari dan dianggap penting untuk timbulnya nefropati 
diabetik  yang  jika  tidak  terkontrol  kemudian  akan  berkembang  menjadi  proteinuria  secara  klinis  dan  berlanjut  dengan 
penurunan fungsi laju filtrasi glomerular dan berakhir dengan keadaan gagal ginjal.   Diperkirakan 30-40% penderita DM tipe 
1 dan 20-30% penderita DM tipe 2 akan menderita nefropati diabetik suatu saat yang dapat berakhir dengan keadaan gagal 
ginjal.",4.0,,,,,,,,,
20,6,show,Skrining Ultrasonografi pada Sindroma Down,,['RG'],2016-08-28 13:07:01,archive,published,250,http://repository.lppm.unila.ac.id/id/eprint/250,public,pub,"[{'name': {'given': 'Rodiani', 'lineage': None, 'family': 'Rodiani', 'honourific': None}, 'type': 'http://www.loc.gov/loc.terms/relators/AUT'}]","[{'rev_number': 1, 'uri': 'http://repository.lppm.unila.ac.id/id/document/242', 'pos': 1, 'format': 'text', 'files': [{'objectid': 242, 'uri': 'http://repository.lppm.unila.ac.id/id/file/1434', 'datasetid': 'document', 'filesize': 578215, 'fileid': 1434, 'mime_type': 'application/pdf', 'hash_type': 'MD5', 'mtime': '2016-07-22 07:57:16', 'filename': 'Prosiding.pdf', 'hash': '00dc8dac4f38451a5d153867b118c90f'}], 'main': 'Prosiding.pdf', 'docid': 242, 'language': 'en', 'mime_type': 'application/pdf', 'placement': 1, 'security': 'public', 'eprintid': 250}]",2016-08-28 13:07:01,556,,2016-08-28 13:07:01,2015-10-24 00:00:00.000000000,disk0/00/00/02/50,"[{'name': {'lineage': None, 'family': 'Rodiani', 'honourific': None, 'given': 'Rodiani'}}]",['FK1'],article,Prosiding Seminar Presentasi Artikel Ilmiah Dies Natalis FK Unila ke-13,978-602-73961-0-4,43-51,TRUE,,24 Oktober 2015,"Sindroma Down adalah kondisi keterbelakangan fisik dan mental yang diakibatkan oleh abnormalitas kromosom. Di
Indonesia ditemukan hingga sekitar 300 ribu kasus dan ditemukan semakin meningkat seiring peningkatan usia ibu. Dalam
deteksi sindroma Down dapat dilakukan deteksi dini sejak dalam kehamilan. Dalam tes diagnostik, hasil positif berarti
kemungkinan besar pasien menderita penyakit atau kondisi yang memprihatinkan. Sedangkan skrining bertujuan untuk
memperkirakan risiko pasien yang memiliki penyakit. Tes diagnostik cenderung lebih mahal dan memerlukan prosedur yang
rumit, sedangkan tes skrining cepat dan mudah dilakukan. Namun, tes skrining memiliki lebih banyak peluang untuk salah,
baik falsepositive
maupun falsenegative.
Kegunaan utama ultrasonografi (USG) sebagai alat skrining untuk mendeteksi
sindroma Down dilakukan pada trimester pertama dan kedua kehamilan. Beberapa marker yang dapat dijumpai pada
skrining trimester pertama kehamilan antara lain nuchal translucency, kista higroma, hipoplasia atau tidak adanya os nasal,
doppler duktus venosus, serta adanya regurgitasi tricuspid. Marker pada trimester kedua yang ditemukan antara lain
thickness nuchal fold, short long bones, hiperekoik pada usus, echogenic intracardiac focus, dilatasi ginjal, serta choroid
plexus cysts. Penanda yang lebih spesifik adalah pengukuran os nasal janin namun belum ada teknik standar untuk
mengukur os nasal. Marker tambahan yang ditemukan berupa increased iliac wing angle, ear length, dan single umbilical
artery serta klinodaktili. Apabila markermarker
sesuai per trimester ditemukan dengan skor>2 maka bernilai sensitifitas
82% untuk sindroma Down. Simpulan : USG merupakan modalitas yang sensitif pada proses penegakan diagnostik sindroma
Down.",,http://fk.unila.ac.id/prosiding-seminar-presentasi,,,,,,"[{'type': 'pub', 'url': 'http://fk.unila.ac.id/prosiding-seminar-presentasi'}]",,
21,6,show,"PERANAN SISTEM REPONG DAMAR TERHADAP PENDAPATAN, ASUPAN
MAKAN DAN STATUS GIZI BALITA: STUDI KASUS DI DESA PAHMUNGAN
KECAMATAN PESISIR TENGAH KABUPATEN PESISIR BARAT",,['SD'],2020-05-22 05:19:49,archive,published,20345,http://repository.lppm.unila.ac.id/id/eprint/20345,public,pub,,"[{'language': 'en', 'mime_type': 'application/pdf', 'eprintid': 20345, 'security': 'public', 'placement': 1, 'format': 'text', 'pos': 1, 'uri': 'http://repository.lppm.unila.ac.id/id/document/33689', 'rev_number': 1, 'docid': 33689, 'main': 'Jurnal Silva Lestari_Jan 2015_Desmayanti dan Samsul Bahri dan Reni Zuraida.pdf', 'files': [{'objectid': 33689, 'uri': 'http://repository.lppm.unila.ac.id/id/file/191544', 'datasetid': 'document', 'filesize': 98407, 'mime_type': 'application/pdf', 'fileid': 191544, 'hash': '91bf2a1fc9707ef290892a92c8d5ef22', 'filename': 'Jurnal Silva Lestari_Jan 2015_Desmayanti dan Samsul Bahri dan Reni Zuraida.pdf', 'mtime': '2020-05-22 03:57:40', 'hash_type': 'MD5'}]}]",2020-05-22 05:19:49,616,,2020-05-22 05:19:49,2015-01-01 00:00:00.000000000,disk0/00/02/03/45,"[{'name': {'honourific': None, 'family': 'Saputri', 'lineage': None, 'given': 'D E'}, 'id': None}, {'name': {'lineage': None, 'family': 'Bakri', 'honourific': None, 'given': 'Samsul'}, 'id': 'samsul.bakri@fp.unila.ac.id'}, {'name': {'given': 'Reni', 'honourific': None, 'family': 'Zuraida', 'lineage': None}, 'id': 'reni.zuraida@fk.unila.ac.id'}]",['FK1'],article,Sylva Lestari,2339-0913,,TRUE,1.0,,"Kawasan Dengan Tujuan Istimewa atau KDTI (SK Menhut No.47/Kpts-II/1998)hutan adat Repong Damar seluas 29.000 ha yang merupakan best practice dalam manajemen hutan
berbasis masyarakat di Provinsi Lampung Bagian Barat belum diketahui tentang kapasitasnya dalam menjamin kebersinambungan pembangunan sumberdaya manusia utamanya yang kritis mulai pada usia balita.  Penelitian ini dilakukan mulai bulan Maret-April 2014 di Desa
Pahmungan Kecamatan Pesisir Tengah Kabupaten Pesisir Barat.  Tujuan dari penilitian ini adalah untuk mengetahui pengaruh simultan antara populasi kepemilikan pohon damar
dengan pendapatan, pengeluaran pangan rumah tangga, asupan makan balita, dan status gizi balita.  Akuisisi data dilakukan melalui wawancara untuk menjaring data populasi
kepemilikan pohon damar [PHN], pendapatan [YI], pengeluaran pangan [YII], asupan makan (food recall)balita sebagai dasar penentuan status gizi balita [YIII] yang dihitung dengan
metode antropometri (Kemenkes, 2010), khususnya berat badan menurut tinggi badan(BB/TB).  Untuk menguji hipotesis digunakan persamaan simultan 4 tahap. Optimasi parameter menggunakan piranti lunak minitab 16. Simpulan, telah dibuktikan ada tautan yang nyata antara peranan sistem repong damar terhadap pendapatan, status kesehatan, dan
status gizi balita.  Ditemukan relasi/hubungan nyata antara pendapatan repong damar [YI][YI]i= -0.1770+0.023150 [PHN]i.  Selanjutnya secara simultan ditemukan hubungan  nyata
antara pengeluaran pangan (YII) dengan [YII] seperti digambarkan dengan model [YII]i=1.1546+0.438 [YI].  Lebih lanjut secara simultan ditemukan hubungan nyata antara asupan makan balita [YIII] dengan pengeluaran pangan [YII] dengan model [YIII]i= 17.012 +3.703[YII].
Kata kunci: Repong damar, pendapatan, status kesehatan dan status gizi balita.",3.0,,,,,,,,,
22,6,show,"Hubungan Tingkat Pengetahuan Ibu terhadap Penggunaan Alat Kontrasepsi
dalam Rahim (AKDR)",,['RG'],2016-08-28 13:06:28,archive,published,248,http://repository.lppm.unila.ac.id/id/eprint/248,public,pub,"[{'name': {'given': 'Noviana Hartika', 'lineage': None, 'family': 'Sari', 'honourific': None}, 'type': 'http://www.loc.gov/loc.terms/relators/AUT'}, {'name': {'family': 'Rodiani', 'honourific': None, 'lineage': None, 'given': 'Rodiani'}, 'type': 'http://www.loc.gov/loc.terms/relators/AUT'}]","[{'pos': 1, 'format': 'text', 'rev_number': 1, 'uri': 'http://repository.lppm.unila.ac.id/id/document/240', 'docid': 240, 'main': '20 dr. Rodiani (Majority).pdf', 'files': [{'objectid': 240, 'uri': 'http://repository.lppm.unila.ac.id/id/file/1424', 'fileid': 1424, 'mime_type': 'application/pdf', 'hash_type': 'MD5', 'mtime': '2016-07-22 07:35:50', 'filename': '20 dr. Rodiani (Majority).pdf', 'hash': '986c8cf4a8e7cacb6fd8697de9a9bd8a', 'datasetid': 'document', 'filesize': 481194}], 'language': 'en', 'mime_type': 'application/pdf', 'eprintid': 248, 'placement': 1, 'security': 'public'}]",2016-08-28 13:06:28,556,,2016-08-28 13:06:28,2015-12-02 00:00:00.000000000,disk0/00/00/02/48,"[{'name': {'honourific': None, 'family': 'Sari', 'lineage': None, 'given': 'Noviana Hartika'}}, {'name': {'honourific': None, 'family': 'Rodiani', 'lineage': None, 'given': 'Rodiani'}}]",['FK1'],article,Medical Journal of Lampung University,2337-3776,108-112,TRUE,9.0,"Volume 4, Nomor 9, Desember 2015","Kontrasepsi adalah salah satu solusi dalam menghadapi laju pertumbuhan penduduk di Indonesia yang mengalami
peningkatan dari 1,45 persen (1990–2000) menjadi 1,49 persen (2000-2010). Kontrasepsi bertujuan untuk tercapainya
kesehatan reproduksi yang berkualitas, menurunkan angka kematian ibu dan bayi, dan penanggulangan masalah kesehatan
reproduksi dalam rangka membangun keluarga kecil berkualitas. Beberapa metode kontrasepsi modern yang dapat
digunakan seperti oral kontrasepsi, suntikan, implant, IUD, dan sterilisasi.penggunaan Alat Kontrasepsi Alat Dalam Rahim
(AKDR). Alat Kontrasepsi Alat Dalam Rahim adalah suatu alat atau benda kontrasepsi yang dimasukkan ke dalam rahim yang
mencegah kehamilan dengan baik, reversibel dan berjangka panjang, dapat dipakai oleh semua perempuan usia reproduktif
untuk tujuan kontrasepsi sehingga menjadi salah satu rekomendasi kuat sebagai kontrasepsi efektif. Namun, kontrasepsi
AKDR tidak serta merta menjadi pilihan utama karena pemilihan metode kontrasepsi ini dipengaruhi oleh banyak faktor,
salah satunya adalah pengetahuan pengguna kontrasepsi mengenai manfaat, efektivitas, indikasi hingga efek samping dari
kontrasepsi. Pengetahuan terbagi menjadi 6 tingkatan yaitu tahu, memahami, aplikasi, analisis, sintesis dan evaluasi. Faktor
yang mempengaruhi pengetahuan meliputi umur, intelegensia, lingkungan, sosial budaya, pendidikan, informasi, dan
pengalaman. Berdasarkan faktor yang mempengaruhi beserta materi mengenai penggunaan AKDR tersebut dapat menjadi
alat ukur melalui wawancara atau angket dengan menanyakan pertanyaan keresponden sehingga didapatkan suatu korelasi
atau hubungan pengetahuan ibu terhadap penggunaan AKDR.",4.0,http://jukeunila.com/majority/,,,,,,"[{'type': 'pub', 'url': 'http://jukeunila.com/majority/'}]",,
23,7,show,Effectiveness of Tamarillo Extract for Decreasing Blood Glucose and LDL Cholesterol Levels in Obese Patient,,"['R1', 'RB']",2017-01-16 01:59:57,archive,published,1397,http://repository.lppm.unila.ac.id/id/eprint/1397,public,pub,,"[{'eprintid': 1397, 'placement': 1, 'security': 'public', 'mime_type': 'application/pdf', 'language': 'en', 'docid': 1272, 'main': '20-1.pdf', 'files': [{'objectid': 1272, 'uri': 'http://repository.lppm.unila.ac.id/id/file/9436', 'datasetid': 'document', 'filesize': 485652, 'fileid': 9436, 'mime_type': 'application/pdf', 'mtime': '2017-01-14 06:02:46', 'hash_type': 'MD5', 'hash': 'c86c420f4d6762979f5ce3dd33f59feb', 'filename': '20-1.pdf'}], 'pos': 1, 'format': 'text', 'uri': 'http://repository.lppm.unila.ac.id/id/document/1272', 'rev_number': 1}]",2017-01-16 01:59:57,575,,2017-01-16 01:59:57,1970-01-01 00:00:00.000002015,disk0/00/00/13/97,"[{'name': {'given': 'Mara Asvita', 'family': 'Silvia', 'honourific': None, 'lineage': None}, 'id': 'silviamara1305@gmail.com'}, {'name': {'lineage': None, 'honourific': None, 'family': 'Khairun', 'given': 'Nisa Berawi'}, 'id': 'nisaberawi0226@gmail.com'}]",['FK1'],article,Majority,2337-3776,102-106,TRUE,1.0,Khairun Nisa,"Obesity is excessive fat accumulation in the body. Obesity is caused due to an imbalance between calorie intake and calorie output so the excess calories are stored as fat. If obesity is taking place in the long term, it can lead to hyperglycemia and hypercholesterolemia. Hyperglycemia is an increase blood glucose levels while hypercholesterolemia is an increase blood total cholesterol, LDL, and triglyceride and a decrease of blood HDL levels. Tamarillo (Cyphomandra betaceae) has efficacy in lowering blood glucose levels (hypoglycemic), blood cholesterol levels (hypocholesterolemic) and body weight. Tamarillo
extract , especially polyphenols, can restore the regulation of adipokines in obese patients so can decrease the risk of insulin resistance and triglycerides production in adipose tissue. The results showed that Tamarillo extract in 200-300 mg/kg dose cause a decrease of blood glucose levels, blood LDL cholesterol levels and body weight in adultmale Sprague-Dawley rats obesity who induced by high fat diet.
Keywords : hypercholesterolemia, hyperglycemia, obesity, tamarillo",5.0,http://jukeunila.com/majority/majority-volume-5-no-1/,,,,,,,,
