,rev_number,metadata_visibility,title,referencetext,subjects,status_changed,eprint_status,date_type,eprintid,uri,full_text_status,ispublished,contributors,documents,datestamp,userid,corp_creators,lastmod,date,dir,creators,divisions,type,publication,issn,pagerange,refereed,number,publisher,abstract,volume,official_url,event_dates,event_type,event_location,event_title,pres_type,related_url,contact_email,id_number
8,6,show,The Relationship of Gymnastic Asthma Routinity to Lung Function At Asthma Patient,"1. Riset Kesehatan Dasar (RISKESDAS).
Epidemiologi asma. Jakarta: Badan
Penelitian dan Pengembangan Kesehatan
Kementerian Indonesia; 2013.
2. Global Initiative for Asthma (GINA). Global
strategy for asthma management and
prevention. Ontario: NIH Publication;
2007.
3. Daru KCJ. Pengaruh pemberian senam
asma terhadap frekwensi kekambuhan
asma bronkial [skripsi]. Surakarta: Fakultas
Ilmu Kesehatan Universitas
Muhammadiyah; 2008.
4. Yayasan Asma Indonesia (YAI). Senam
asma. Jakarta: Yayasan Asma
Indone;2006.
5. Yunus F, Anwar J, Fachrurodji H, Wiyono
WH, Jusuf A. Pengaruh senam asma
Indonesia terhadappenderita asma. J
Respir Indo. 2002; 22(3):118-24.
6. Snell, R. Anatomi klinik untuk mahasiswa
kedokteran. Edisi ke-6. Jakarta: EGC; 2006.
7. Guyton, AC. Buku ajar fisiologi kedokteran.
Edisi ke-11. Jakarta: EGC; 2007.
8. Sherwood, LL. Fisiologi manusia: dari sel
ke sistem. Edisi ke- 6. Jakarta: EGC; 2011.
9. Alsagaff, Hood, Abdul M. Dasar-dasar ilmu
penyakit paru. Surabaya: Universitas
Airlangga; 2005.
10. Bernstein JA. Asthma in handbook of
allergic disorders. Philadelphia: Lipincott
Williams & Wilkins; 2007.
11. Eapen SS, Busse WW. Asthma in
inflammatory mechanisms in allergic
diseases. USA: Marcel Dekker; 2006.
12. Price SA, Wilson LM. Patofisiologi konsep
klinis proses-proses penyakit. Edisi ke-4.
EGC: Jakarta; 1995.
13. Rengganis I. Diagnosis dan tatalaksana
asma bronkial. Jakarta: FKUI; 2008.
14. Perhimpunan Dokter Paru Indonesia
(PDPI). Asma diagnosis dan
penatalaksanaan di indonesia. Jakarta:
PDPI; 2006.
15. Katzung BG. Basic and clinical
pharmacology. Edisi ke-10. EGC: Jakarta;
2007.
16. Harahap F, Aryastuti E. Uji fungsi paru.
Jakarta: IDI; 2012.
17. Amin M. Olahraga pada penyakit paru
obstruktif. J Respir Indo.2006; 1(1): 5
halaman.
18. Handari M. Hubungan antara sebelum dan
setelah mengikuti senam asma dengan
frekuensi kekambuhan penyakit asma. J
Kes Surya Medika Yogyakarta. 2004; 1(1):
5 halaman.
19. Ari E. Persepsi pasien asma tentang
efektivitas senam asma dalam
meminimalkan kejadian ulang serangan
asma [tesis]. Bandung: Stikes Santo
Borromeus; 2011.
20. Camalia SS, Dewi I, Sutanto PH.
Peningkatan kekuatan otot pernapasan
dan fungsi paru melalui senam asma pada
pasien asma. J Kep Indo. 2011; 14(2):101-6",['RB'],2016-07-22 03:39:39,archive,published,236,http://repository.lppm.unila.ac.id/id/eprint/236,public,pub,,"[{'main': 'khairunnisa berawi4.pdf', 'docid': 228, 'files': [{'datasetid': 'document', 'filesize': 364634, 'mime_type': 'application/pdf', 'fileid': 1345, 'hash': '2fd91fca1fcd174d83034a7fd2da8fe2', 'filename': 'khairunnisa berawi4.pdf', 'mtime': '2016-07-21 08:11:41', 'hash_type': 'MD5', 'objectid': 228, 'uri': 'http://repository.lppm.unila.ac.id/id/file/1345'}], 'format': 'text', 'pos': 1, 'rev_number': 1, 'uri': 'http://repository.lppm.unila.ac.id/id/document/228', 'eprintid': 236, 'security': 'public', 'placement': 1, 'language': 'en', 'mime_type': 'application/pdf'}]",2016-07-22 03:39:39,575,,2016-07-22 03:39:39,2015-12-01 00:00:00.000000000,disk0/00/00/02/36,"[{'id': None, 'name': {'honourific': None, 'family': 'Azhar', 'lineage': None, 'given': 'Azmy H'}}, {'name': {'honourific': None, 'family': 'Berawi', 'lineage': None, 'given': 'Khairun Nisa'}, 'id': 'nisaberawi0226@gmail.com'}]",['FK1'],article,Medical Journal of Lampung University,2337 3776,103-107,TRUE,9.0,Medical Journal of Lampung Univerisity,"Abstract
Lung disease is a health problem in Indonesia, one of them is asthma. WHO data showed 300 million people worldwide are
diagnosed with asthma, and is expected to increase to 400 million people in 2025. In asthma, there’s bronchiolus muscle spasms that cause the shortness of breath, difficulty in expiration, decreased lung capacity and weakened physical condition. Asthma treatment efforts have been implemented pharmacologically with drugs that are controller nor reliever.
Successful treatment of asthma should be supported from the physical factors such as physical exercise and education, one of the efforts is asthma gymnastic, it is necessary to reinforce the respiratory muscles. Lung function measurements used to assess airway obstruction, lung function abnormalities reversibiliti and lung function variability. Asthma is an reversible obstructive lung disease. The dominant clinical symptoms is a history of episodes the shortness of breath, especially at night
are often accompanied by a cough. One way to relieve the obstruction is doing some physical sports such as gymnastics
asthma. Gymnastics asthma is considered capable of reducing obstruction and increase the elasticity of bronchial and
respiratory muscles. It found that people who do gymnastics asthma were able to reduce the recurrence of asthma
exacerbation. Lung function results can be better if patients routinely doing gymnastics asthma.
Keywords: asthma, gymnastic asthma, lung function, shortness of breath, treatment",4.0,http://jukeunila.com,,,,,,"[{'type': 'pub', 'url': 'http://jukeunila.com/majority/edisi-4-no-9/'}]",nisaberawi0226@gmail.com,
9,6,show,The Effect of Sweet Star Fruit Juice (Averrhoa carambola L) for Lowering Blood Pressure,,['R1'],2017-01-16 01:59:53,archive,published,1395,http://repository.lppm.unila.ac.id/id/eprint/1395,public,pub,,"[{'mime_type': 'application/pdf', 'language': 'en', 'placement': 1, 'security': 'public', 'eprintid': 1395, 'uri': 'http://repository.lppm.unila.ac.id/id/document/1270', 'rev_number': 1, 'pos': 1, 'format': 'text', 'files': [{'fileid': 9423, 'mime_type': 'application/pdf', 'hash_type': 'MD5', 'mtime': '2017-01-14 03:57:14', 'filename': '5-1.pdf', 'hash': '2f5e575c2ecf7ec6cdbaee2a60949df1', 'datasetid': 'document', 'filesize': 458388, 'objectid': 1270, 'uri': 'http://repository.lppm.unila.ac.id/id/file/9423'}], 'docid': 1270, 'main': '5-1.pdf'}]",2017-01-16 01:59:53,575,,2017-01-16 01:59:53,1970-01-01 00:00:00.000002015,disk0/00/00/13/95,"[{'name': {'given': 'Virgita Pasya', 'lineage': None, 'family': 'Azzren', 'honourific': None}, 'id': 'azzrenpasya@gmail.com'}, {'id': 'nisaberawi0226@gmail.com', 'name': {'family': 'Khairun', 'honourific': None, 'lineage': None, 'given': 'Nisa Berawi'}}]",['FK1'],article,Majority,2337-3776,23-27,TRUE,1.0,Khairun Nisa,"Hypertension or high blood pressure is one of the diseases that becomes one of the public health problems in Indonesia.
The prevalence of hypertension in Indonesia is pretty high namely 26,5% corresponding to Riskesdas 2013 data. Hypertension is often called the silent killer because sometimes it is unrecognized but triggered another disease such as stroke, kidney failure, heart failure and coronary heart disease. Hypertension treatment is done by administering antihypertension drugs. However, administration of these drugs often cause side effects for hypertension. Add by the lifelong dependence to the drug which caused the cost of therapy is relatively expensive. Therefore, it is necessary to find a safe, practical, and cheap antihypertension medications that can lower blood pressure. One alternative is to use the sweet star fruit (Averrhoa carambola L) juice because of its high potassium and fiber also low sodium contents. This review focused on the effect of sweet star fruit juice on blood pressure in human. Conclusion, the sweet star fruit juice can be an
alternative in lowering blood pressure.
Keywords: Averrhoa carambola L, blood pressure, hypertension, sweet star fruit juice",5.0,http://jukeunila.com/majority/majority-volume-5-no-1/,,,,,,,,
10,6,show,Factors - Factors Influencing the Incidence of Genesis Shortness of Breath Bronchial Asthma Sufferers,"1. Price SA, Wilson LM. Patofisiologi Konsep
Klinis Proses-Proses Penyakit. Edisi ke-6..
Jakarta: EGC; 2006.
2. Bakta IM, Suastika IK. Gawat Darurat di
Bidang Penyakit Dalam. Jakarta: EGC; 2006.
3. Beasley B, Holt S, Fabian D, Masoli M.
GINA (Global Initiative for Asthma). Global
Strategy For Asthma Management And
Prevention. New Zealand: Medical
Research Institute of New Zealand; 2012.
4. Rahajoe, Nastiti N, Supriyatno. Buku Ajar
Respirologi Anak. Jakarta: IDAI; 2008.
5. Hadibroto, Iwan, Alam S. Asma. Jakarta:
PT. Gramedia Pustaka Utama; 2006.
6. PDPI (Perhimpunan Dokter Paru
Indonesia). Asma Pedoman Diagnosis Dan
Penatalaksanaan Di Indonesia. Jakarta:
FKUI; 2004
7. Guyton AC, John EH. Buku Ajar Fisiologi
Kedokteran. Jakarta: EGC; 2007.
8. Price SA, Wilson LM. Patofisiologi, Konsep
Klinis Proses-Proses
9. Sudoyo AW, Setiyohadi B, Alwi IK, Setiati S.
Ilmu Penyakit Dalam. Edisi ke-5. Jakarta:
Internal Publishing; 2009.
10. Greenberg MI. Teks Atlas Kedokteran
Kedaruratan. Jakarta: Erlangga; 2008.",['RB'],2016-07-22 03:39:47,archive,published,237,http://repository.lppm.unila.ac.id/id/eprint/237,public,pub,,"[{'format': 'text', 'pos': 1, 'uri': 'http://repository.lppm.unila.ac.id/id/document/229', 'rev_number': 1, 'main': 'Khairunnisa berawi5.pdf', 'docid': 229, 'files': [{'datasetid': 'document', 'filesize': 364493, 'mime_type': 'application/pdf', 'fileid': 1351, 'filename': 'Khairunnisa berawi5.pdf', 'hash': '650d35a7fc2ad3212af06f475165964a', 'hash_type': 'MD5', 'mtime': '2016-07-21 08:21:40', 'objectid': 229, 'uri': 'http://repository.lppm.unila.ac.id/id/file/1351'}], 'mime_type': 'application/pdf', 'language': 'en', 'eprintid': 237, 'security': 'public', 'placement': 1}]",2016-07-22 03:39:47,575,,2016-07-22 03:39:47,2015-12-01 00:00:00.000000000,disk0/00/00/02/37,"[{'name': {'given': 'M. Aria', 'family': 'Laksana', 'honourific': None, 'lineage': None}}, {'name': {'lineage': None, 'family': 'Berawi', 'honourific': None, 'given': 'Khairun Nisa'}}]",['FK1'],article,MAJORITY,2337 3776,64-68,TRUE,9.0,Medical Journal of Lampung Univerisity,"Abstract
Bronchial asthma is a chronic inflammatory disorder of the airways that involves many cells and cellular elements. Until now, the death is caused by an asthma attack such as shortness of breath, wheezing, and others. According to World Health Organization (WHO), in 2008 there were 300 million people suffer from asthma and 225 thousand people die from asthma worldwide. The prevalence of asthma worldwide is equal to 8-10% of children and 3-5% in adults. In 2007, Riset Kesehatan Dasar (Riskesda) notes the prevalence of asthma is not known with certainty, but an estimated 5-7% of the Indonesian population suffer from asthma. Due to the high attack rate is causing a lot of research directed research on risk factors for
asthma. Genetic and environmental factors has been known to affect the onset of symptoms and risk factors for asthma.
There are various other factors that influence the prevalence of this disease include age, gender, race, socio - economic and environmental factors. These factors affect the rate of occurrence of asthma attacks, the degree of asthma and deaths caused asthma.
Keywords: Asthma, wheezing, shortness of breath",4.0,http://jukeunila.com,,,,,,[{'url': 'http://jukeunila.com/majority/edisi-4-no-9/'}],nisaberawi0226@gmail.com,
11,8,show,PENGARUH PETA PIKIRAN TERHADAP PENGETAHUAN  MAHASISWA KEDOKTERAN,,['R1'],2017-06-02 20:52:52,archive,published,2894,http://repository.lppm.unila.ac.id/id/eprint/2894,public,pub,,"[{'rev_number': 1, 'uri': 'http://repository.lppm.unila.ac.id/id/document/2775', 'pos': 1, 'format': 'text', 'files': [{'datasetid': 'document', 'filesize': 536038, 'fileid': 19912, 'mime_type': 'application/pdf', 'mtime': '2017-06-01 23:26:52', 'hash_type': 'MD5', 'filename': 'Rika L.pdf', 'hash': '75c58b57a7947eebefc1c3d0c866f0bc', 'objectid': 2775, 'uri': 'http://repository.lppm.unila.ac.id/id/file/19912'}], 'main': 'Rika L.pdf', 'docid': 2775, 'language': 'en', 'mime_type': 'application/pdf', 'placement': 1, 'security': 'public', 'eprintid': 2894}]",2017-06-02 20:52:52,367,,2017-06-02 20:52:52,2015-11-17 00:00:00.000000000,disk0/00/00/28/94,"[{'name': {'family': 'Lisiswanti', 'honourific': None, 'lineage': None, 'given': 'Rika'}, 'id': 'rika_lisiswanti@yahoo.com'}]",['FK1'],conference_item,,,1-5,TRUE,,,"Latar belakang. Peta pikiran merupakan salah satu alat yang dapat digunakan untuk belajar bagi mahasiswa kedokteran. Peta pikiran membantu mahasiswa untuk memproses informasi dan menyimpan informasi. Peta pikiran membantu mahasiswa membayangkan dan mengasosiasikan antara konsep. Peta pikiran bermanfaat dalam pemecahan masalah, berfikir kritis, mengingat kembali informasi, serta mengetahui keseluruhan konsep yang dipelajari serta digunakan sebagai penilaian. Tujuan Penelitian. Untuk melihat pengaruh peta pikiran terhadap pengetauan mahasiswa. Metode Penelitian. Penelitian ini merupakan penelitian quasi eksperimental.  Penelitian dilaksanakan di Fakultas Kedokteran Universitas Lampung. Populasi penelitian adalah mahasiswa tahun pertama angkatan 2014 kelas A sebanyak 115 orang. Kemudian Mahasiswa dibagi secara random menjadi dua kelompok. Kelompok pertama adalah kelompok yang menggunakan peta pikiran dan kelompok tanpa peta pikiran pada pembelajaran penyakit dalam. Nilai pengetahuan yang diukur dengan MCQ mahasiswa yang menggunakan peta pikiran dibandingkan dengan tidak menggunakan peta pikiran dengan menggunakan uji t-test. Dilihat apakah p valuae < 0,05, maka perbedaannya signifikan. Hasil Penelitian. Uji beda dengan independent t-test antara pos tes kelompok kontrol dan kelompok eksperimen berbeda secara signifikan yaitu 0,00 p<0,005. Nilai pos tes kelompok kontrol lebih tinggi dibanding kelompok eksperimen. Kesimpulan. Mahasiswa yang menggunakan peta pikiran menunjukan rata-rata nilai mcq yang lebih rendah secara bermakna dibandingkan mahasiswa yang mendapat pengalaman belajar tanpa menggunakan peta pikiran. Keyword: mind mapping, mahasiswa kedokteran, pengetahuan",,,,conference,,IASHE 4 TH INTERNATIONAL CONFERENCE,speech,,,
12,7,show,Efek Protektif Hesperidin terhadap Nefrotoksisitas akibat Penggunaan Cisplatin,,['RC'],2020-06-19 19:16:03,archive,,22415,http://repository.lppm.unila.ac.id/id/eprint/22415,public,pub,,"[{'docid': 36162, 'main': '1402-1997-1-PB.pdf', 'files': [{'hash_type': 'MD5', 'mtime': '2020-06-19 14:10:01', 'hash': '6582fd22584a271078646ea959429859', 'filename': '1402-1997-1-PB.pdf', 'fileid': 208056, 'mime_type': 'application/pdf', 'filesize': 363340, 'datasetid': 'document', 'uri': 'http://repository.lppm.unila.ac.id/id/file/208056', 'objectid': 36162}], 'format': 'text', 'pos': 1, 'uri': 'http://repository.lppm.unila.ac.id/id/document/36162', 'rev_number': 2, 'eprintid': 22415, 'security': 'public', 'placement': 1, 'mime_type': 'application/pdf', 'language': 'en'}]",2020-06-19 19:16:03,112,,2020-06-19 19:16:03,1970-01-01 00:00:00.000002015,disk0/00/02/24/15,"[{'name': {'given': 'Idzni', 'lineage': None, 'honourific': None, 'family': 'Mardhiyah'}}, {'name': {'given': 'Ade', 'lineage': None, 'family': 'Yonata', 'honourific': None}}]",['FK1'],article,Majority,2337-3776,13-19,TRUE,9.0,Juke Unila,"Cisplatin merupakan salah satu obat yang digunakan untuk terapi berbagai jenis tumor solid dengan penggunaannya yang 
luas dan efektif. Akan tetapi, cisplatin memiliki efek samping terkait dosis pada ginjal, koklea, gastrointestinal dan sumsum 
tulang.  Nefrotoksisitas  merupakan  efek  samping  yang  paling  sering  dan  penting  secara  klinis.  Beberapa  penelitian  telah 
menunjukkan beberapa mekanisme, di antaranya stres oksidatif, kerusakan DNA, dan respon inflamasi, yang dikaitkan erat 
dengan nefrotoksisitas yang diinduksi cisplatin. Walaupun efek samping kerusakan ginjal akibat cisplatin dapat dikurangi 
dengan  pemberian  diuretik  dan  pre-hidrasi  pasien,  prevalensi  nefrotoksisitas  akibat  penggunaan  cisplatin  masih  tetap 
tinggi. Oleh karena itu, terapi yang dapat memperbaiki nefrotoksisitas cisplatin menjadi penting untuk dikembangkan. Di 
sisi lain, hesperidin, flavonoid utama pada jeruk dan lemon, mempunyai nefroprotektif yang telah terbukti baik secara in 
vitro  maupun  in  vivo.  Bioaktivitas  yang  dimiliki  hesperidin  antara  lain  adalah  aktivitas  antioksidan,  antiinflamasi, 
antimikroba, antikarsinogenik, inhibisi agregasi sel, antialergi, radioproteksi, dan lain sebagainya. Dengan berbagai aktivitas 
tersebut,  hesperidin  merupakan  alternatif  potensial  untuk  mencegah  toksisitas  ginjal  akibat  penggunaan  cisplatin  tanpa 
menurunkan aktivitas tumorisidalnya",4.0,,,,,,,,,
13,8,show,HONEY AS AN ALTERNATIVE HEALING FOR BURNS ON WHITE RATS (RATTUS NORVEGICUS) STRAIN SPRAQUE DAWLEY,,"['RM', 'RS']",2016-08-28 13:05:12,archive,published,199,http://repository.lppm.unila.ac.id/id/eprint/199,public,pub,"[{'id': None, 'type': 'http://www.loc.gov/loc.terms/relators/AUT', 'name': {'lineage': None, 'honourific': None, 'family': 'Muhartono', 'given': 'Muhartono'}}, {'type': 'http://www.loc.gov/loc.terms/relators/AUT', 'id': 'asepsukohar@gmail.com', 'name': {'given': 'Asep', 'family': 'Sukohar', 'honourific': None, 'lineage': None}}, {'id': None, 'type': 'http://www.loc.gov/loc.terms/relators/AUT', 'name': {'honourific': None, 'family': 'T Sibero', 'lineage': None, 'given': 'Hendra'}}, {'type': 'http://www.loc.gov/loc.terms/relators/AUT', 'id': None, 'name': {'lineage': None, 'family': 'Widarti', 'honourific': None, 'given': 'Indri'}}]","[{'mime_type': 'application/pdf', 'language': 'en', 'eprintid': 199, 'placement': 1, 'security': 'public', 'pos': 1, 'format': 'text', 'uri': 'http://repository.lppm.unila.ac.id/id/document/203', 'rev_number': 1, 'docid': 203, 'main': '1308_pdf.pdf', 'files': [{'filename': '1308_pdf.pdf', 'hash': '406b7aecac9444efefadc0392c45cd29', 'hash_type': 'MD5', 'mtime': '2016-07-19 01:23:59', 'mime_type': 'application/pdf', 'fileid': 1178, 'filesize': 2101950, 'datasetid': 'document', 'uri': 'http://repository.lppm.unila.ac.id/id/file/1178', 'objectid': 203}]}]",2016-08-28 13:05:12,151,,2016-08-28 13:05:12,2015-01-06 00:00:00.000000000,disk0/00/00/01/99,"[{'name': {'given': 'Muhartono', 'lineage': None, 'honourific': None, 'family': 'Muhartono'}, 'id': None}, {'name': {'lineage': None, 'honourific': None, 'family': 'Sukohar', 'given': 'Asep'}, 'id': 'asepsukohar@gmail.com'}, {'name': {'lineage': None, 'family': 'T Sibero', 'honourific': None, 'given': 'Hendra'}, 'id': None}, {'id': None, 'name': {'given': 'Indri', 'family': 'Widarti', 'honourific': None, 'lineage': None}}]",['FK1'],article,Internasional Journal Of Research In Ayurveda & Pharmacy,2229-3566,101-104,TRUE,1.0,"Volume 6, Issue 1, Jan - Feb 2015","Burns is a serious health problem that can lead to morbidity, disability, and death. One of the standard treatment of burns is hydrogel. Hydrogel is
good for burn but quite expensive, so it is necessary to look for the cheaper, easier with less side effects like honey. The aim of this study was to determine whether honey can act as better alternative treatment for burns than hydrogel in Spraque Dawley rat strain. This study was a comparative experimental study in anatomical pathology laboratory medical faculty of Lampung University using 15 white rats divided into 3 groups: 5 rats control group which was only given burns (group 1), 5 rats that was given burns and honey topically (group 2) and 5 rats that was given burns and hydrogel topically (group 3). The clinical healing and histopathologic picture were performed. Statistical analysis performed using One Way Anova test and Post Hoc LSD test. The test results showed no significant difference between the honey and the hydrogel group (p = 0.861 and p = 0.502). As conclusion, honey can be used as an alternative drug for treatment of burns on White rats (Rattus norvegicus) Spraque Dawley strain",6.0,http://www.ijrap.net/archives.php,,,,,,"[{'type': 'pub', 'url': 'http://www.ijrap.net/archives.php'}]",,10.7897/2277-4343.06122
14,6,show,THE EFFECT OF NUTRITIONAL STATUS TO PHYSICAL FITNESS OF KARATE ATHLETES IN BANDAR LAMPUNG,,['RB'],2017-01-16 01:59:49,archive,published,1393,http://repository.lppm.unila.ac.id/id/eprint/1393,public,pub,,"[{'language': 'en', 'mime_type': 'application/pdf', 'eprintid': 1393, 'placement': 1, 'security': 'public', 'pos': 1, 'format': 'text', 'uri': 'http://repository.lppm.unila.ac.id/id/document/1268', 'rev_number': 1, 'main': 'Neola-Amanda.pdf', 'docid': 1268, 'files': [{'mime_type': 'application/pdf', 'fileid': 9411, 'hash': 'aa58187870c56ee76d1d0ef3e349f909', 'filename': 'Neola-Amanda.pdf', 'mtime': '2017-01-14 03:30:35', 'hash_type': 'MD5', 'datasetid': 'document', 'filesize': 108860, 'objectid': 1268, 'uri': 'http://repository.lppm.unila.ac.id/id/file/9411'}]}]",2017-01-16 01:59:49,575,,2017-01-16 01:59:49,1970-01-01 00:00:00.000002015,disk0/00/00/13/93,"[{'id': 'neolaamanda@gmail.com', 'name': {'given': 'Amanda MZ', 'lineage': None, 'family': 'Neola', 'honourific': None}}, {'id': 'nisaberawi0226@gmail.com', 'name': {'honourific': None, 'family': 'Khairun', 'lineage': None, 'given': 'Nisa Berawi'}}, {'id': None, 'name': {'given': 's', 'honourific': None, 'family': 'Tiwuk', 'lineage': None}}]",['FK1'],article,mAJORITY,2337-3776,1-4,TRUE,6.0,Khairun Nisa,"can be measured with certain methods. Nutritional status that abnormal or low will have an impact on the level of physical fitness. One of the factors that influence physical fitness is nutrients or food. The purpose of this study was to examine the effect of nutritional status to fitness level in karate athletes in the city of Bandar Lampung. This research type is analytic study with cross sectional approach. The sampel obtained were 18 people using purposive sampling technique. Nutritional
status variables measured by using anthropometric using index IMT/U and fitness levels measured with multistage fitness test. Obtained that majority karate athlete's nutritional status is normal with a percentage of 61.1%, average of karate athlete's fitness level is enough that is 37.61. Nutritional status have a significant effect to fitness level in karate athletes in the city of Bandar Lampung (p=0.005).
Keywords: athletes, health, nutritional status, physical fitness",4.0,http://jukeunila.com/uncategorized/volume-4-no-6-suplemen/,,,,,,,,
15,6,show,Obesitas sebagai Resiko Pemberat Dismenore pada Remaja,,['RG'],2016-08-28 13:06:19,archive,published,247,http://repository.lppm.unila.ac.id/id/eprint/247,public,pub,"[{'type': 'http://www.loc.gov/loc.terms/relators/AUT', 'name': {'given': 'Hani', 'family': 'Pratiwi', 'honourific': None, 'lineage': None}}, {'type': 'http://www.loc.gov/loc.terms/relators/AUT', 'name': {'family': 'Rodiani', 'honourific': None, 'lineage': None, 'given': 'Rodiani'}}]","[{'main': '17-1dr. Rodiani (Majority).pdf', 'docid': 239, 'files': [{'hash': '85c586bfaa890fea0401124f8451a1f1', 'filename': '17-1dr. Rodiani (Majority).pdf', 'mtime': '2016-07-22 07:19:59', 'hash_type': 'MD5', 'mime_type': 'application/pdf', 'fileid': 1419, 'filesize': 383756, 'datasetid': 'document', 'uri': 'http://repository.lppm.unila.ac.id/id/file/1419', 'objectid': 239}], 'pos': 1, 'format': 'text', 'rev_number': 1, 'uri': 'http://repository.lppm.unila.ac.id/id/document/239', 'eprintid': 247, 'placement': 1, 'security': 'public', 'language': 'en', 'mime_type': 'application/pdf'}]",2016-08-28 13:06:19,556,,2016-08-28 13:06:19,2015-12-01 00:00:00.000000000,disk0/00/00/02/47,"[{'name': {'given': 'Hani', 'honourific': None, 'family': 'Pratiwi', 'lineage': None}}, {'name': {'lineage': None, 'family': 'Rodiani', 'honourific': None, 'given': 'Rodiani'}}]",['FK1'],article,Medical Journal of Lampung University,2337-3776,108-112,TRUE,9.0,"Volume 4, Nomor 9, Desember 2015","Dismenore merupakan nyeri perut yang dirasakan wanita yang mengalami menstruasi, keluhan ini sering kali akan mengganggu aktivitas dan memerlukan istirahat. Nyeri saat haid menyebabkan ketidaknyamanan dalam aktivitas fisik sehari-hari. Keluhan ini berhubungan dengan ketidakhadiran berulang di kampus ataupun di tempat kerja, sehingga dapat mengganggu produktivitas. Wanita normal setiap bulan secara periodik akan mengalami peristiwa reproduksi yang disebut menstruasi yaitu meluruhnya jaringan endometrium karena tidak adanya telur matang yang dibuahi oleh sperma. Peristiwa itu wajar dan alami sehingga dapat dipastikan bahwa semua wanita yang normal pasti akan mengalami proses ini, akan tetapi pada kenyataannya banyak wanita mengalami masalah menstruasi diantaranya nyeri haid atau biasa disebut dismenore. Dismenore dapat diklasifikasikan menjadi dua, yaitu dismenore primer dan dismenore sekunder. Dismenore primer yaitu nyeri pada saat menstruasi yang dijumpai tanpa adanya kelainan pada alat-alat genitalia yang nyata, sedangkan dismenore sekunder yaitu nyeri pada saat menstruasi yang disebabkan oleh kelainan ginekologi seperti salpingitis kronika, endometriosis,adenomiosis uteri, stenosis servitis uteri.Faktor-faktor yang dapat mempengaruhi nyeri saat menstruasi diantaranya menarche pada usia dini, siklus haid yang panjang, merokok atau alkohol, aktivitas atau olahraga yang kurang, gizi atau obesitas, dan stress. Gizi atau obesitas merupakan faktor yang mempengaruhi terjadinya nyeri perut atau dismenore. hal ini didukung dengan kebiasaan mengkonsumsi makanan yang tidak sesuai seperti kudapan atau junk food. Mengkonsumsi yang berlemak dapat meningkatkan hormon prostaglandin yang dapat menyebabkan nyeri di bagian perut bawah atau dismenore.",4.0,http://jukeunila.com/majority/,,,,,,"[{'type': 'pub', 'url': 'http://jukeunila.com/majority/'}]",,
