,date_type,eprintid,metadata_visibility,volume,rev_number,title,official_url,abstract,subjects,status_changed,eprint_status,dir,date,creators,issn,publication,divisions,type,refereed,uri,full_text_status,publisher,documents,number,ispublished,pagerange,datestamp,lastmod,userid
0,published,48885,show,6,6,WORKSHOP PENGGUNAAN ANDROID DALAM MEMBANTU PROSES PENILAIAN PASCA PANDEMI PADA GURU DI KABUPATEN PESAWARAN PROVINSI LAMPUNG,http://ejurnalmalahayati.ac.id/index.php/kreativitas/article/view/9112/pdf,"Penilaian sangat diperlukan bagi seorang pendidik untuk mengetahui tingkat
keberhasilan selama proses belajar. Fungsi penilaian adalah untuk dapat
mengetahui ketercapaian peserta didik dalam pembelajaran. Penlaian juga
penting bagi pendidik untuk introspeksi diri, mengetahui kelemahan dan
kelebihan dalam pembelajaran. System penilan yang dilakukan untuk saat ini
menggunakan teknologi karena mempermudah proses assesment. Adapun
tujuan dari kegiatan ini adalah memberikan pelatihan dasar Assesment
berbasis android pada guru SMA di kab. Pesawaran. Manfaat dari kegiatan ini
adalah memberikan pelatihan kepada guru-guru supaya menerapkan penilaian
kepada siswa secara efektif, efisien serta tepat guna dengan menggunakan
android. Guru mahir menyusun assesment penilaian hasil belajar siswa dan
mahir menggunakan android untuk keperluan assesment siswa. Metode kegiatan
yang digunakan adalah metode praktek pelatihan dan diskusi sosialisasi.
Pemahaman guru terhadap penilaian meningkat, hal ini dibuktikan dengan
perbedaan nilai pretest dan post-test. Penggunaan android sangat membantu
proses penilaian guru di sekolah dalam hal keefektifan penilaian, pemeriksaan
jawaban, mengetahui daya beda soal, dan mengetahui taraf sukar buti",['L1'],2023-03-09 06:39:29,archive,disk0_bak/00/04/88/85,2023-03-01,"[{'name': {'given': 'Riswanti', 'honourific': None, 'family': 'Riswanti Rini', 'lineage': None}}]",2615- 0921,JURNAL KREATIVITAS PENGABDIAN KEPADA MASYARAKAT (PKM),['FKIP6'],article,TRUE,http://repository.lppm.unila.ac.id/id/eprint/48885,public,malahayati,"[{'mime_type': 'application/pdf', 'language': 'en', 'eprintid': 48885, 'security': 'public', 'placement': 1, 'format': 'text', 'pos': 1, 'uri': 'http://repository.lppm.unila.ac.id/id/document/188326', 'rev_number': 1, 'docid': 188326, 'main': '9112-40382-1-PB.pdf', 'files': [{'uri': 'http://repository.lppm.unila.ac.id/id/file/532177', 'objectid': 188326, 'filesize': 362594, 'datasetid': 'document', 'hash': '5ec8af15f652d25e1120933fd8ad49e6', 'filename': '9112-40382-1-PB.pdf', 'mtime': '2023-03-09 04:48:31', 'hash_type': 'MD5', 'mime_type': 'application/pdf', 'fileid': 532177}]}]",3,pub,1139-1148,2023-03-09 06:39:29,2023-03-09 06:39:29,998
