,type,divisions,issn,creators,publication,dir,date,corp_creators,userid,lastmod,datestamp,pagerange,documents,publisher,number,ispublished,contributors,refereed,full_text_status,uri,eprintid,date_type,eprint_status,status_changed,abstract,subjects,title,official_url,metadata_visibility,rev_number,volume,related_url
0,article,['FP17'],1410-5020,"[{'name': {'given': 'Madi', 'honourific': None, 'family': 'Hartono', 'lineage': None}}]",Jurnal Penelitian Pertanian Terapan,disk0/00/00/58/65,2010-01-01,['Universitas Lampung'],787,2017-11-17 04:26:41,2017-11-17 04:26:41,52-58,"[{'uri': 'http://repository.lppm.unila.ac.id/id/document/18788', 'rev_number': 1, 'format': 'text', 'pos': 1, 'files': [{'uri': 'http://repository.lppm.unila.ac.id/id/file/54649', 'objectid': 18788, 'hash_type': 'MD5', 'mtime': '2017-11-17 04:18:58', 'filename': 'JPPT POLINELA SEMEN BOER.pdf', 'hash': 'e1c9c92fdd08f8f61bb9ad486d7a2ca9', 'fileid': 54649, 'mime_type': 'application/pdf', 'filesize': 297469, 'datasetid': 'document'}], 'docid': 18788, 'main': 'JPPT POLINELA SEMEN BOER.pdf', 'mime_type': 'application/pdf', 'language': 'en', 'security': 'public', 'placement': 1, 'eprintid': 5865}]",Poloiteknik Negeri Lampung,1.0,pub,"[{'id': 'madihartono66@yahoo.co.id', 'name': {'given': 'Madi', 'family': 'HartonoM', 'honourific': None, 'lineage': None}}]",TRUE,public,http://repository.lppm.unila.ac.id/id/eprint/5865,5865,published,archive,2017-11-17 04:26:41,"The research was aimed to study quality of semen crossbreed Boer goat. The study was conducted at Batu Kramat Village, Kota Agung Timur Subdistrict, Tanggamus District, Lampung Province during November-December 2008. A Completely Randomized Design with five replications was used with four breeds goat that were Kacang, PE, Boercang, and Boerawa. The result showed that breed of goat were  not significantly different (P>0,05) about volume, concentration, and abnormality of semen, but were significantly affected (P<0,01) with motility and live-cells. The best quality of semen was Boerawa goat i.e. volume 1,02 ml; motility 88%; concentration 2.290.000.000 cells.ml-1; live-cell
89,67%; and abnormality 1,98%.


Key word : quality of semen, crossbreed Boer goat",['SF'],Kualitas Semen Kambing Peranakan Boer,http://www.jptonline.or.id,show,6,10,
1,article,['FP17'],978–979-8510-20-5,"[{'name': {'given': 'Sumardi', 'honourific': None, 'family': 'Sumardi', 'lineage': None}, 'id': 'sumardi_bio@yahoo.co.id'}, {'name': {'lineage': None, 'family': 'Hartono', 'honourific': None, 'given': 'Madi'}, 'id': 'madi.hartono@fp.unila.ac.id'}, {'name': {'lineage': None, 'family': 'Handayani', 'honourific': None, 'given': 'Kusuma'}, 'id': None}]",PROSIDING Seminar Nasional Sains dan Teknologi III,disk0/00/00/67/58,2010-10-19,['Universitas Lampung'],787,2018-04-25 07:56:10,2018-04-25 07:56:10,415-422,"[{'format': 'text', 'pos': 1, 'uri': 'http://repository.lppm.unila.ac.id/id/document/19726', 'rev_number': 1, 'main': 'Prosiding MH Probiotik.pdf', 'docid': 19726, 'files': [{'uri': 'http://repository.lppm.unila.ac.id/id/file/61992', 'objectid': 19726, 'filesize': 880170, 'datasetid': 'document', 'hash': 'dd7de6d4bfd984482e0fa5e653884466', 'filename': 'Prosiding MH Probiotik.pdf', 'mtime': '2018-04-19 14:08:18', 'hash_type': 'MD5', 'mime_type': 'application/pdf', 'fileid': 61992}], 'mime_type': 'application/pdf', 'language': 'en', 'eprintid': 6758, 'security': 'public', 'placement': 1}]",LPPM Unila,,pub,"[{'name': {'lineage': None, 'family': 'Hartono', 'honourific': None, 'given': 'Madi'}}]",TRUE,public,http://repository.lppm.unila.ac.id/id/eprint/6758,6758,published,archive,2018-04-25 07:56:10,"Tujuan penelitian ini adalah untuk mengetahui pengaruh biakan Bacillus sp. terhadap pertumbuhan Salmonella sp dan Escherichia coli pada broiler. Dari hasil penelitian dapat diketahui bahwa Bacillus dapat menekan pertumbuhan
Salmonella sp (T3= 0,76 dari LogX+1), sedangkan E.coli tidak mampu memperlihatkan pengaruhnya. Efek pemberian Bacillus sp juga memperlihatkan PBT (Pertambahan Bobot Tubuh) 478 gr pada minggu ke-4 dan bobot karkas 900
gr. Hasil tersebut tidak berbeda nyata pada perlakuan probiotik komersial.",['SF'],PENGARUH PEMBERIAN BIAKAN BACILLUS Sp. TERHADAP PERTUMBUHAN SALMONELA DAN ESCHERICHIA COLI PADA BROILER,hhtp:// lemlit@unila.ac.id,show,7,1,[{'url': 'hhtp://lppm@kpa.unila.ac.id'}]
