,ispublished,documents,publisher,uri,full_text_status,lastmod,userid,datestamp,creators,date,dir,type,divisions,title,rev_number,metadata_visibility,status_changed,eprint_status,subjects,abstract,eprintid,date_type
0,unpub,"[{'mime_type': 'application/pdf', 'language': 'en', 'placement': 1, 'security': 'public', 'eprintid': 50389, 'uri': 'http://repository.lppm.unila.ac.id/id/document/190097', 'rev_number': 1, 'pos': 1, 'format': 'text', 'files': [{'hash': '0c70a489338570aabc31b2b8653ed056', 'filename': 'Usul PHB 2007 Lanjutan.pdf', 'hash_type': 'MD5', 'mtime': '2023-04-12 10:04:35', 'mime_type': 'application/pdf', 'fileid': 543979, 'filesize': 1715471, 'datasetid': 'document', 'uri': 'http://repository.lppm.unila.ac.id/id/file/543979', 'objectid': 190097}], 'main': 'Usul PHB 2007 Lanjutan.pdf', 'docid': 190097}]",FT Unila,http://repository.lppm.unila.ac.id/id/eprint/50389,public,2023-04-13 00:35:07,390,2023-04-13 00:35:07,"[{'id': 'joni.agustian@eng.unila.ac.id', 'name': {'given': 'Joni', 'family': 'Agustian', 'honourific': None, 'lineage': None}}, {'name': {'lineage': None, 'honourific': None, 'family': 'Nugrahini', 'given': 'Panca'}, 'id': None}, {'id': 'lilis.hermida@eng.unila.ac.id', 'name': {'lineage': None, 'honourific': None, 'family': 'Hermida', 'given': 'Lilis'}}]",2007-11-01,disk0_bak/00/05/03/89,other,['FT6'],"Karakterisasi proses anaerobik perombak
substrat multi karbon dengan teknologi sel
terimobilisasi UASB – TAHAP II",7,show,2023-04-13 00:35:07,archive,['TP'],"Tujuan jangka panjang penelitian ini adalah dihasilkannya unit pengolahan limbah
cair secara biologi anaerobik dengan umpan campuran limbah cair dari industri tapioka,
industri gula dan pabrik pengolahan minyak kelapa sawit. Umpan yang terdiri atas
campuran limbah cair ketiga jenis industri tersebut dengan perbandingan tertentu diolah
dengan menggunakan teknologi proses anaerobik sel terimobilisasi UASB.
Penelitian ini menggunakan reaktor UASB skala laboratorium. Variasi konsentrasi COD dengan beban maksimal 25.000 mg/L pada waktu tinggal hidrolik
cairan tertentu dan kondisi pH dan nutrisi umpan yang ditetapkan dievaluasi dalam
penelitian, sehingga analisis parameter kinetika dan simulasi untuk scale-up serta
analisis finansial terhadap kemungkinan penerapan UASB dapat dilakukan",50389,submitted
1,unpub,"[{'uri': 'http://repository.lppm.unila.ac.id/id/document/190096', 'rev_number': 1, 'format': 'text', 'pos': 1, 'files': [{'objectid': 190096, 'uri': 'http://repository.lppm.unila.ac.id/id/file/543971', 'datasetid': 'document', 'filesize': 6456558, 'mime_type': 'application/pdf', 'fileid': 543971, 'filename': 'Laporan Pen Hibah Bersaing 2007 Joni Agustian.pdf', 'hash': '7d8201499a48d5b78abea7702a7ef6d4', 'hash_type': 'MD5', 'mtime': '2023-04-12 09:51:08'}], 'docid': 190096, 'main': 'Laporan Pen Hibah Bersaing 2007 Joni Agustian.pdf', 'mime_type': 'application/pdf', 'language': 'en', 'security': 'public', 'placement': 1, 'eprintid': 50388}]",FT Unila,http://repository.lppm.unila.ac.id/id/eprint/50388,public,2023-04-13 00:35:12,390,2023-04-13 00:35:12,"[{'name': {'given': 'Joni', 'lineage': None, 'family': 'Agustian', 'honourific': None}, 'id': 'joni.agustian@eng.unila.ac.id'}, {'name': {'lineage': None, 'family': 'Nugrahini', 'honourific': None, 'given': 'Panca'}, 'id': None}, {'id': 'lilis.hermida@eng.unila.ac.id', 'name': {'honourific': None, 'family': 'Hermida', 'lineage': None, 'given': 'Lilis'}}]",2007-11-01,disk0_bak/00/05/03/88,other,['FT6'],Laporan Penelitian Hibah Bersaing KArakterisasi Poses Anaerobik Perombak Substrat Multi-Karbon Dengan Teknologi Sel Terimobilisasi UASB,8,show,2023-04-13 00:35:12,archive,['TP'],"Pengolahan limbah cair secara biologi anaerobik dengan umpan campuran limbah cair dari industri tapioka, industri gula dan pabrik pengolahan minyak kelapa sawit merupakan proses pengolahan dengan prospek yang baik.  Kandungan senyawa karbon dalam limbah cair ketiga industri tersebut cukup tinggi, sehingga dapat digunakan untuk membangkitkan biogas metan yang dapat digunakan sebagai sumber energi.  Umpan yang terdiri atas campuran limbah cair ketiga industri dengan perbandingan tertentu diolah dengan teknologi proses anaerobik sel terimobilisasi UASB.  Reaktor UASB merupakan tipe reaktor yang mampu bekerja pada tingkat beban organik yang tinggi.  Oleh karena itu kandungan COD yang besar yang ada dalam limbah cair akan dapat diolah dengan baik.  Penelitian ini menggunakan reaktor UASB skala laboratorium.  Variasi konsentrasi COD dengan beban maksimal 15.000 mg/L , waktu tinggal hidrolik cairan 10-20 jam, kondisi pH dan nutrisi umpan yang alami dan terkontrol dievaluasi dalam penelitian.  
Dalam eksperimen digunakan perbandingan volume 1:1:12 agar diperoleh kandungan COD campuran awal diatas 15.000 mg/L.  Campuran ketiga jenis limbah cair pada penelitian ini menghasilkan limbah cair yang berwarna coklat keruh dengan pH sekitar 5.  Reduksi kandungan COD limbah cair pada setiap kelompok eksperimen berada pada rentang yang cukup baik, yaitu sekitar 67,07%-82,52% pada laju beban organik 6-36 kgCOD/m3/hari.  Kondisi pH-nutrisi alami menghasilkan tingkat reduksi COD yang lebih besar daripada kondisi limbah cair yang memiliki pH dan nutrisi terkendali.  Jumlah gas yang diakumulasi berada pada rentang rata-rata 140-370 mL/jam.  Pada kondisi pH 5,5-6,5 proses degradasi COD limbah cair campuran berjalan lebih maksimal daripada biodegradasi dengan kondisi pH yang cenderung asam atau mendekati 7.  Proses biodegradasi dengan pH kontrol menghasilkan reduksi COD sebesar 42-92%, sedangkan reduksi COD pada kondisi pH alami adalah lebih tinggi (sekitar 61-97%).  Jika dibandingkan kedua kondisi diatas dapat ditemui bahwa pH alami 5,5 dan pH kontrol 6,5 memiliki nilai yang lebih baik dari kelompok pH lainnya, dengan tingkat reduksi berada pada rentang 70-80%.  Mayoritas nilai pH effluen berada pada nilai diatas 6,0, sehingga proses hidrolisis-fermentasi dan metanasi berjalan dengan kesetimbangan yang baik.  Kandungan TSS yang diumpankan ke bioreaktor UASB adalah 553-6.350 mg/L, yang masih dapat diolah oleh bioreaktor UASB dengan tingkat effisiensi yang cukup tinggi pada saat kandungan TSS > 4.000 mg/L.  Kandungan nitrogen dan posfor yang terdapat dalam limbah cair (nutrisi alami) cukup menunjang aktivitas mikroorganisme anaerobik dalam mereduksi kandungan COD limbah cair gabungan.  Kesimpulan yang didapat adalah bioreaktor UASB dapat beroperasi dengan baik dalam mengolah limbah cair campuran dari tiga jenis industri tersebut.",50388,submitted
