,event_location,event_title,eprintid,date_type,title,official_url,event_dates,rev_number,event_type,metadata_visibility,eprint_status,status_changed,subjects,abstract,creators,dir,date,type,divisions,ispublished,documents,pres_type,uri,full_text_status,refereed,lastmod,userid,pagerange,datestamp,related_url,volume,publication,issn,id_number,number,publisher,contributors,contact_email,corp_creators
0,"Park Royal Hotel, Penang, Malaysia",The 3rd International Conference on Environmental Research and Technology 2012,714,published,Free lipase-based enzymatic acetylation of racemic atenolol: A preliminary kinetic resolution study,https://icert.usm.my/index.php/en/gallery/icert-2012,30 May - 1 June 2012,10,conference,show,archive,2016-10-04 01:12:48,['TP'],"Since distomers of racemic drugs are frequently not used to heal diseases, utilization of single enantiomeric drugs not only decreases the drugs dosages and side effects but also reduces eco-toxicological problem.  Since enzymatic membrane reactors (EMR) can be run continuously, observation on free-enzyme catalysis as a preliminary study before development of the EMR is needed.  This paper describes acetylation of the racemic atenolol enzymatically using free lipases.  The atenolol enantiomers reacted with vinyl acetate in water miscible organic compounds and phosphate buffer solutions.  High conversions were obtained once the reactions were conducted in the organic media using PFL (XR: 84.22%, XS: 91.78%), Lipoprotein 62336 (XR: 100%; XS: 100%) and CALB (XR: 77%, XS: 51.82%).  Reactions in PO4 buffers produced low conversions.  It seems the KR process was difficult to be developed through the acetylation pathway.  During observations on the AT enantiomers’ concentrations, the analytical protocols produced excellent selectivities.  The highest selectivity was given by the slowest flow rate, which developed higher enantiomeric peak areas.","[{'id': 'joni.agustian@eng.unila.ac.id', 'name': {'given': 'Joni', 'honourific': None, 'family': 'Agustian', 'lineage': None}}, {'name': {'given': 'Azlina', 'lineage': None, 'honourific': None, 'family': 'Harun@Kamaruddin'}, 'id': None}]",disk0/00/00/07/14,1970-01-01 00:00:00.000002012,conference_item,['FT6'],pub,"[{'eprintid': 714, 'placement': 1, 'security': 'public', 'mime_type': 'application/pdf', 'language': 'en', 'content': 'published', 'main': '07 Proceeding Internasional ICERT 2012.pdf', 'docid': 612, 'files': [{'hash': 'ac4819862268cf8177c4ffdfb7c3e8bf', 'filename': '07 Proceeding Internasional ICERT 2012.pdf', 'mtime': '2016-10-03 14:05:47', 'hash_type': 'MD5', 'mime_type': 'application/pdf', 'fileid': 4075, 'filesize': 1752855, 'datasetid': 'document', 'uri': 'http://repository.lppm.unila.ac.id/id/file/4075', 'objectid': 612}], 'pos': 1, 'format': 'text', 'uri': 'http://repository.lppm.unila.ac.id/id/document/612', 'rev_number': 2}]",speech,http://repository.lppm.unila.ac.id/id/eprint/714,public,TRUE,2016-10-04 01:12:48,390,91-96,2016-10-04 01:12:48,,,,,,,,,,
1,,,711,published,"Chromatographic Comparison of Atenolol Separation in Reaction
Media on Cellulose tris-(3,5-dimethylphenylcarbamate) Chiral
Stationary Phase Using Ultra Fast Liquid Chromatography",http://onlinelibrary.wiley.com/journal/10.1002/(ISSN)1520-636X,,6,,show,archive,2016-10-04 01:12:30,['TP'],"Because chiral liquid chromatography (LC) could become a powerful tool to
estimate racemic atenolol quantity, excellent enantiomeric separation should be produced during
data acquisition for satisfactory observation of atenolol concentrations throughout the racemic
resolution processes. Selection of chiral LC column and analytical protocol that fulfill demands of
the ultra fast LC analysis is essential. This article describes the characteristics of atenolol chromatographic
separation that resulted fromdifferent resolution media and analytical protocols with the use
of a ChiralcelW OD column. The chromatograms showed quite different characteristics of the
separation process. The single enantiomer and racemic atenolol could be recognized by the
ChiralcelW OD column in less than 20 min. Symmetrical peaks were obtained; however, several
protocols produced peaks with wide bases and slanted baselines. Observations showed that efficient
enantioresolution of racemic atenolol was obtained at slow mobile phase flow rate, decreased concentration
of amine-type modifier but increased alcohol content in mobile phase and highest ultraviolet
detection wavelength were required. The optimal ultra fast LC protocol enables to reduce and eliminate
the peaks of either the atenolol solvent or the buffers and provided the highest peak intensities
of both atenolol enantiomers.","[{'name': {'given': 'Joni', 'family': 'Agustian', 'honourific': None, 'lineage': None}, 'id': 'joni.agustian@eng.unila.ac.id'}, {'name': {'family': 'Harun@Kamaruddin', 'honourific': None, 'lineage': None, 'given': 'Azlina'}, 'id': None}, {'id': None, 'name': {'given': 'Hassan', 'family': 'Aboul-Enein', 'honourific': None, 'lineage': None}}]",disk0/00/00/07/11,2012-05-01 00:00:00.000000000,article,['FT6'],pub,"[{'files': [{'objectid': 608, 'uri': 'http://repository.lppm.unila.ac.id/id/file/4055', 'datasetid': 'document', 'filesize': 855443, 'fileid': 4055, 'mime_type': 'application/pdf', 'mtime': '2016-10-03 09:20:19', 'hash_type': 'MD5', 'filename': '03 Jurnal Internasional Chirality 2012.pdf', 'hash': '7b56daa74ae1f8028de953653378b13f'}], 'main': '03 Jurnal Internasional Chirality 2012.pdf', 'docid': 608, 'rev_number': 1, 'uri': 'http://repository.lppm.unila.ac.id/id/document/608', 'format': 'text', 'pos': 1, 'security': 'public', 'placement': 1, 'eprintid': 711, 'mime_type': 'application/pdf', 'language': 'en'}]",,http://repository.lppm.unila.ac.id/id/eprint/711,public,TRUE,2016-10-04 01:12:30,390,356-367,2016-10-04 01:12:30,"[{'url': 'http://onlinelibrary.wiley.com/doi/10.1002/chir.22019/%20abstract', 'type': 'pub'}]",24.0,Chirality,1520-636X,10.1002/chir.22019,5.0,John Wiley and Sons,,,
2,,,3796,published,Pyrolysis-GC-MS reveals important differences in hydrolytic degradation process of wood flour and rice bran filled polylactide composites,https://www.journals.elsevier.com/polymer-degradation-and-stability,,6,,show,archive,2017-08-14 01:31:40,['TP'],"Pyrolysis-GC-MS of polylactide (PLA) biocomposites before and after hydrolytic degradation revealed
prominent differences in the hydrolytic degradation process of rice bran and wood flour filled biocomposites. The water uptake and mass loss for polylactide/wood flour composites were similar to that
of plain PLA. Pyrolysis-GC-MS, however, showed that on prolonged aging the hydrolysis of PLA led to
increased wood flour concentration in the remaining biocomposite matrices. In contrast, the polylactide/
rice bran composites exhibited larger water uptake and higher mass loss. Pyrolysis-GC-MS and FTIR
analysis proved that the higher mass loss was caused by migration of rice bran from the composites. The
type of natural filler could thus greatly influence the degradation process and/or the stability of the
materials in aqueous or humid environments.","[{'id': 'edwinazwar@yahoo.co.id', 'name': {'given': 'Edwin', 'honourific': None, 'family': 'Azwar', 'lineage': None}}]",disk0/00/00/37/96,1970-01-01 00:00:00.000002012,article,['FT6'],pub,"[{'files': [{'uri': 'http://repository.lppm.unila.ac.id/id/file/26580', 'objectid': 3654, 'hash': 'c65f10e5fe2b02f098b0bdd15d58d197', 'filename': '1.IJ GCMSEdwinPaper1OK.pdf', 'mtime': '2017-08-08 07:36:04', 'hash_type': 'MD5', 'mime_type': 'application/pdf', 'fileid': 26580, 'filesize': 1251629, 'datasetid': 'document'}], 'main': '1.IJ GCMSEdwinPaper1OK.pdf', 'docid': 3654, 'uri': 'http://repository.lppm.unila.ac.id/id/document/3654', 'rev_number': 1, 'format': 'text', 'pos': 1, 'security': 'public', 'placement': 1, 'eprintid': 3796, 'mime_type': 'application/pdf', 'language': 'en'}]",,http://repository.lppm.unila.ac.id/id/eprint/3796,public,TRUE,2017-08-14 01:31:40,951,281-287,2017-08-14 01:31:40,,97.0,Polymer Degradation and Stability,0141-3910,10.1016/j.polymdegradstab.2011.12.017,,Elsevier,"[{'name': {'given': 'Edwin', 'family': 'Azwar', 'honourific': None, 'lineage': None}, 'id': 'edwinazwar@yahoo.co.id', 'type': 'http://www.loc.gov/loc.terms/relators/AUT'}]",,
3,,,3923,published,"Tuning the Mechanical Properties of Tapioca Starch by
Plasticizers, Inorganic Fillers and Agrowaste-Based Fillers",https://www.hindawi.com/journals/isrn/2012/463298/,,6,,show,archive,2017-09-15 01:23:42,['TP'],"Mechanical properties of tapioca starch-based films were tuned by different additives and additive combinations. The additives
included plasticizers (glycerol, sorbitol, and citric acid), inorganic fillers (halloysite and kaolin), and agrowaste-based fillers (milled
wood flour and rice bran). In addition, new biobased additives were prepared from wood flour and rice bran through liquefaction
reaction. Through different additive combinations, starch-based materials with significant differences in tensile properties were
designed. Addition of halloysite nanoclay resulted in materials with improved tensile strength at break and rather low strain at
break. The effect of kaolin on tensile strength was highly dependent on the used plasticizer. However, in most combinations the
addition of kaolin resulted in materials with intermediate tensile strength and strain at break values. The addition of milled wood
flour and rice bran improved the tensile strength, while the addition of liquefied fillers especially liquefied rice bran increased the
strain at break indicating that liquefied rice bran could have potential as a plasticizer for starch blends.","[{'name': {'honourific': None, 'family': 'Azwar', 'lineage': None, 'given': 'Edwin'}, 'id': 'edwinazwar@yahoo.co.id'}, {'name': {'family': 'Hakkarainen', 'honourific': None, 'lineage': None, 'given': 'Mina'}, 'id': 'minna@polymer.kth.se'}]",disk0/00/00/39/23,2012-04-10 00:00:00.000000000,article,['FT6'],pub,"[{'placement': 1, 'security': 'public', 'eprintid': 3923, 'mime_type': 'application/pdf', 'language': 'en', 'files': [{'fileid': 27433, 'mime_type': 'application/pdf', 'hash_type': 'MD5', 'mtime': '2017-09-13 08:04:14', 'filename': '3.IJ STARCHOK.pdf', 'hash': 'c7003c1a89e48aa7fd32573b9924860a', 'datasetid': 'document', 'filesize': 4644791, 'objectid': 3778, 'uri': 'http://repository.lppm.unila.ac.id/id/file/27433'}], 'main': '3.IJ STARCHOK.pdf', 'docid': 3778, 'uri': 'http://repository.lppm.unila.ac.id/id/document/3778', 'rev_number': 1, 'pos': 1, 'format': 'text'}]",,http://repository.lppm.unila.ac.id/id/eprint/3923,public,TRUE,2017-09-15 01:23:42,951,1-7,2017-09-15 01:23:42,,2012.0,ISRN Polymer Science,2090-8733,463298,463298.0,International Scholarly Research Network,,minna@polymer.kth.se,
4,,,28504,published,"Monoglyceride synthesis through glycerol esterification with lauric acid over a propyl sulfonic acid
functionalized SBA-15 mesoporous catalyst (HSO3SBA-15) was studied under reduced pressure to continuously
remove water formed. Effects of various reaction parameters such as reaction temperature
(413–433 K), catalyst loading (1–5%) and glycerol/lauric acid molar ratio (2:1 and 4:1) on lauric acid
conversion and products selectivity were successfully elucidated and correlated with reaction scheme
and kinetic model. The parent and functionalized SBA-15 were characterized using FT-IR, ammonia
chemisorptions, surface analysis, TEM and SEM. Reusability behavior of the catalyst was also demonstrated.
Glycerol esterification could be modeled as irreversible parallel reactions and the kinetic data
were successfully fitted to a second order kinetic model. The apparent activation energy for monoglyceride
formation using a catalyst loading of 5% and glycerol/lauric acid molar ratio of 4:1 was found to be
42 kJ/mol. The HSO3SBA-15 catalyst could be reused up to four times without significant loss of catalytic
activity.",,,6,,show,archive,2021-03-22 01:41:40,['TP'],"A series of propyl sulfonic acid-modified SBA-
15 catalysts (SBA-15SO3H) was prepared under various
conditions using post-functionalization approach. A factorial
design coupled with response surface analysis were
employed to evaluate the effects of the preparation
conditions on the catalyst activity. Optimization of the
conditions to find the most active SBA-15SO3H catalyst
with the highest activity in glycerol esterification with
lauric acid at 160 �C for 6 h was also made. Amount of
3-(mercaptopropyl)trimethoxysilane (MPTMS) and reflux
time were chosen as parameters of the preparation conditions.
The presence of propyl sulfonic acid groups in SBA-
15SO3H catalysts was confirmed by FT-TIR method. The
catalysts were also characterized by means of surface
analysis, XRD, TEM and TGA. The results obtained from
the statistical models suggested that the amount of MPTMS
was more important parameter to influence the activity
compared to the reflux time. The optimum preparation
condition was achieved at a reflux time of 20 h and an
MPTMS amount of 1 mL/gram SBA-15 to obtain the SBA-
15SO3H(1) with the highest monoglyceride selectivity
(70.2%) and corresponding lauric acid conversion (95%) in
the esterification process.","[{'name': {'family': 'Hermida', 'honourific': None, 'lineage': None, 'given': 'Lilis'}, 'id': 'lilis.hermida@eng.unila.ac.id'}]",disk0/00/02/85/04,1970-01-01 00:00:00.000002012,article,['FT6'],pub,"[{'language': 'en', 'mime_type': 'application/pdf', 'eprintid': 28504, 'security': 'public', 'placement': 1, 'format': 'text', 'pos': 1, 'uri': 'http://repository.lppm.unila.ac.id/id/document/42550', 'rev_number': 1, 'main': 'Gabung JOPO 2012.pdf', 'docid': 42550, 'files': [{'uri': 'http://repository.lppm.unila.ac.id/id/file/253120', 'objectid': 42550, 'filesize': 2738585, 'datasetid': 'document', 'hash_type': 'MD5', 'mtime': '2021-03-21 09:36:02', 'filename': 'Gabung JOPO 2012.pdf', 'hash': 'c0c15874b64e1f0ff244470a325d94df', 'fileid': 253120, 'mime_type': 'application/pdf'}]}]",,http://repository.lppm.unila.ac.id/id/eprint/28504,public,TRUE,2021-03-22 01:41:40,397,835-846,2021-03-22 01:41:40,,19.0,Journal of Porous Materials,1573-4854,,,Springer,,,
5,,,2013,published,Effects of functionalization conditions of sulfonic acid grafted SBA-15 on catalytic activity in the esterification of glycerol to monoglyceride: a factorial design approach,https://link.springer.com/article/10.1007/s10934-011-9538-x,,6,,show,archive,2017-05-30 04:53:26,['TP'],"A series of propyl sulfonic acid-modified SBA-
15 catalysts (SBA-15SO3H) was prepared under various
conditions using post-functionalization approach. A factorial
design coupled with response surface analysis were
employed to evaluate the effects of the preparation
conditions on the catalyst activity. Optimization of the
conditions to find the most active SBA-15SO3H catalyst
with the highest activity in glycerol esterification with
lauric acid at 160 �C for 6 h was also made. Amount of
3-(mercaptopropyl)trimethoxysilane (MPTMS) and reflux
time were chosen as parameters of the preparation conditions.
The presence of propyl sulfonic acid groups in SBA-
15SO3H catalysts was confirmed by FT-TIR method. The
catalysts were also characterized by means of surface
analysis, XRD, TEM and TGA. The results obtained from
the statistical models suggested that the amount of MPTMS
was more important parameter to influence the activity
compared to the reflux time. The optimum preparation
condition was achieved at a reflux time of 20 h and an
MPTMS amount of 1 mL/gram SBA-15 to obtain the SBA-
15SO3H(1) with the highest monoglyceride selectivity
(70.2%) and corresponding lauric acid conversion (95%) in
the esterification process.","[{'id': 'lilis.hermida@eng.unila.ac.id', 'name': {'lineage': None, 'family': 'Hermida', 'honourific': None, 'given': 'Lilis'}}, {'id': None, 'name': {'given': 'Ahmad Zuhairi', 'lineage': None, 'family': 'Abdullah', 'honourific': None}}, {'id': None, 'name': {'honourific': None, 'family': 'Mohammed', 'lineage': None, 'given': 'Abdur Rahman'}}]",disk0/00/00/20/13,2012-10-01 00:00:00.000000000,article,['FT6'],pub,"[{'language': 'en', 'mime_type': 'application/pdf', 'security': 'public', 'placement': 1, 'eprintid': 2013, 'uri': 'http://repository.lppm.unila.ac.id/id/document/1876', 'rev_number': 1, 'format': 'text', 'pos': 1, 'files': [{'uri': 'http://repository.lppm.unila.ac.id/id/file/13978', 'objectid': 1876, 'hash_type': 'MD5', 'mtime': '2017-05-30 04:29:22', 'filename': '2012-J Porous Mater-Published.pdf', 'hash': '36b23956d9666fb95645530aef720606', 'fileid': 13978, 'mime_type': 'application/pdf', 'filesize': 668979, 'datasetid': 'document'}], 'main': '2012-J Porous Mater-Published.pdf', 'docid': 1876}]",,http://repository.lppm.unila.ac.id/id/eprint/2013,public,TRUE,2017-05-30 04:53:26,397,835-846,2017-05-30 04:53:26,,19.0,Journal of Porous Materials,1573-4854,,5.0,Springer,,,
6,"Bayview Hotel, Penang, Malaysia",Interrnationall Conference on Environmentall Research and Technology (ICERT 2012),2001,published,STRUCTURE CHARACTERISTICS AND CATALYTIC ACTIVITY OF NICKEL SUPPORTED ON MESOSTRUCTURED CELLULAR FOAM (MCF) SILICA FOR DECARBOXYLATION OF PALMITIC ACID: EFFECT OF TEOS,,30 January - 1 February 2013,7,conference,show,archive,2017-05-30 04:27:31,['TP'],"Mesostructured cellular foam (MCF) silica materials with different pore topology prepared at various amounts of TEOS (9.2; 25; 32 ml) were used as supports for incorporation of nickel. Nickel incorporated MCF catalysts were prepared using deposition-precipitation at 90 oC and followed by reduction process at 550 oC. The influence of different pore topology of MCF on characteristics of the nickel incorporated MCF catalysts was studied using nitrogen physisorption, TEM, and SEM-EDX techniques. Activities of the catalysts were tested for decarboxylation of palmitic acid in solvent free condition at reaction temperature of 300 oC under nitrogen flow for production of n-pentadecane hydrocarbon fuel. The results show that NiMCF-9.2T(R) catalyst using MCF-9.2T support prepared at TEOS amount of 9.2 ml achieved the highest palmitic acid conversion and n-pentadecane yield. The highest activity was mainly attributed to the high nickel composition and a fine nickel particle dispersed in the NiMCF-9.2T(R) catalyst.","[{'name': {'lineage': None, 'honourific': None, 'family': 'Hermida', 'given': 'Lilis'}, 'id': 'lilis.hermida@eng.unila.ac.id'}, {'id': None, 'name': {'given': 'Ahmad Zuhairi', 'lineage': None, 'honourific': None, 'family': 'Abdullah'}}, {'id': None, 'name': {'given': 'Abdur Rahman', 'lineage': None, 'family': 'Mohammed', 'honourific': None}}]",disk0/00/00/20/01,1970-01-01 00:00:00.000002012,conference_item,['FT6'],pub,"[{'files': [{'datasetid': 'document', 'filesize': 371755, 'fileid': 13922, 'mime_type': 'application/pdf', 'hash_type': 'MD5', 'mtime': '2017-05-30 04:19:27', 'filename': '2012proceeding  ICERT.pdf', 'hash': '57a8324406ffc7ee8ac480f81609bbfe', 'objectid': 1862, 'uri': 'http://repository.lppm.unila.ac.id/id/file/13922'}], 'docid': 1862, 'main': '2012proceeding  ICERT.pdf', 'uri': 'http://repository.lppm.unila.ac.id/id/document/1862', 'rev_number': 1, 'pos': 1, 'format': 'text', 'placement': 1, 'security': 'public', 'eprintid': 2001, 'language': 'en', 'mime_type': 'application/pdf'}]",paper,http://repository.lppm.unila.ac.id/id/eprint/2001,public,TRUE,2017-05-30 04:27:31,397,1-7,2017-05-30 04:27:31,,,,,,,,,,
7,Vistana Hotel Penang,"MAMIP2012 Asian International Conference on Materials, Minerals and Polymer",2009,published,Surface Characteristic of Mesostructured Cellular Foam (MCF) Silica and Nickel Supported on the MCF Materials,,23-24 Maret 2012,7,conference,show,archive,2017-05-30 04:27:21,['TP'],"Surface characteristics of mesostructured cellular foam (MCF) silica materials prepared at an aging temperature of 80 oC and different aging times were investigated. The
effect of nickel nanoparticle incorporation into these structures was also examined in terms of surface area, pore volumes and cell size and window pore size which were obtained from nitrogen adsorption-desorption measurements. The structures properties were also
characterized using TEM and SEM analysis. The nitrogen adsorption-desorption measurements show that the window pore size increased with the aging time in the MCF
silica synthesis. The window pore size of MCF silica material significantly affected the nickel
nanoparticle incorporation.","[{'name': {'given': 'Lilis', 'family': 'Hermida', 'honourific': None, 'lineage': None}}, {'name': {'lineage': None, 'family': 'Abdullah', 'honourific': None, 'given': 'Ahmad Zuhairi'}}, {'name': {'given': 'Abdur Rahman', 'honourific': None, 'family': 'Mohammed', 'lineage': None}}]",disk0/00/00/20/09,1970-01-01 00:00:00.000002012,conference_item,['FT6'],pub,"[{'main': '2012MAMIP-complete.pdf', 'docid': 1866, 'files': [{'filesize': 444327, 'datasetid': 'document', 'mtime': '2017-05-30 04:23:40', 'hash_type': 'MD5', 'hash': '0dff08f1e73da76a63c55b2088219a9c', 'filename': '2012MAMIP-complete.pdf', 'fileid': 13943, 'mime_type': 'application/pdf', 'uri': 'http://repository.lppm.unila.ac.id/id/file/13943', 'objectid': 1866}], 'format': 'text', 'pos': 1, 'uri': 'http://repository.lppm.unila.ac.id/id/document/1866', 'rev_number': 1, 'eprintid': 2009, 'security': 'public', 'placement': 1, 'language': 'en', 'mime_type': 'application/pdf'}]",paper,http://repository.lppm.unila.ac.id/id/eprint/2009,public,TRUE,2017-05-30 04:27:21,397,294-302,2017-05-30 04:27:21,,,,,,,,,,
8,,,49978,published,Fenomena Variasi Konsentrasi Substrat dan Kecepatan Pengadukan pada Fermentasi Etanol dari Limbah Cair Hasil Pengepresan Kulita Nenas Menggunakan Schizosaccharomyces pombe,,,6,,show,archive,2023-04-10 00:58:07,['QR'],"Bioetanol merupakan sumber energi alternatif yang mempunyai prospek yang baik sebagai pengganti bahan bakar minyak (BBM) dan gasohol dengan bahan baku yang dapat diperbaharui dan ramah lingkungan. Bahan baku yang digunakan dapat berasal dari biomassa yang mengandung karbohidrat dan gula. Kadar glukosa pada sampel limbah cair pengepresan kulit nenas pada industri pengalengan nenas PT. Great Giant Pieaple Co (PT.GGPC) memiliki kandungan glukosa sebsar 16,8 dengan kata lain sampel tersebut cukup layak untuk dikembangkan menjadi etanol dengan proses fermentasi. Penelitian ini mengkaji tentang fermentasi etanol dari limbah cair hasil pengepresan kulit nenas menggunakan Schizosaccharomyces pombe dengan tujuan untuk mengetahui pengaruh konsentrasi substrat dan kecepatan pengadukan terhadap temperatur optimal pada fermentasi etanol dari limbah tersebut. Proses fermentasi dilakukan secara batch anaerob dengan pengendalian pH 4,5, waktu fermentasi 4 hari, dan penambahan nutrisi pupuk urea dan NPK. Mikroorganisme yang digunakan adalah Schizosaccharomyces pombe yang memiliki daya konversi gula menjadi etanol yang tinggi. Parameter yang digunakan pada penelitian ini adalah variasi konsentrasi substrat 8, 16, 32 gr/L dan kecepatan pengadukan 50, 150, 250 rpm. Untuk mengetahui konsumsi substrat dilakukan analisis konsentrasi glukosa dengan metode Phenol-Sulfat menggunakan alat spektrofotometer, sedangkan untuk analisis konsentrasi etanol menggunakan refraktometer, dan analisis jumlah sel mikroorganisme menggunakan alat haemacytometer. Hasil penelitian didapat konsentrasi etanol 4 g/l - 21,22g/l. Konsentrasi etanol tertinggi diperoleh pada temperatur 30 C, kecepatan pengadukan 0 rpm dan konsentrasi substrat 32 g/l, yield 70,7%, laju pembentukan produk (qp) 4,07689.jam dan laju pertumbuhan spesifik maksimum 0,02199/jam","[{'id': 'pancanugrahini@gmail.com', 'name': {'lineage': None, 'family': 'Panca Nugrahini F', 'honourific': None, 'given': 'Panca'}}, {'id': 'orynas@gmail.com', 'name': {'given': 'Qori', 'lineage': None, 'honourific': None, 'family': 'Qori Nasrul Ulum'}}]",disk0_bak/00/04/99/78,2012-11-28 00:00:00.000000000,article,['FT6'],pub,"[{'mime_type': 'application/pdf', 'language': 'en', 'eprintid': 49978, 'security': 'public', 'placement': 1, 'format': 'text', 'pos': 1, 'rev_number': 1, 'uri': 'http://repository.lppm.unila.ac.id/id/document/189667', 'main': 'Ao.pdf', 'docid': 189667, 'files': [{'mtime': '2023-04-09 10:29:01', 'hash_type': 'MD5', 'filename': 'Ao.pdf', 'hash': 'ecbf25ba36938a4d0397df03376ec715', 'fileid': 540858, 'mime_type': 'application/pdf', 'filesize': 3183975, 'datasetid': 'document', 'uri': 'http://repository.lppm.unila.ac.id/id/file/540858', 'objectid': 189667}]}]",,http://repository.lppm.unila.ac.id/id/eprint/49978,public,TRUE,2023-04-10 00:58:07,336,330-340,2023-04-10 00:58:07,,4.0,Seminar Nasional AVoER,979-587-440-3,,4.0,Universitas Sriwijaya,,,
