,status_changed,eprint_status,abstract,subjects,event_dates,title,metadata_visibility,rev_number,event_type,eprintid,event_title,date_type,event_location,userid,lastmod,datestamp,documents,pres_type,ispublished,refereed,full_text_status,uri,type,divisions,creators,publication,date,dir,official_url,id_number,number,publisher,related_url,volume,contact_email,issn,pagerange,corp_creators,place_of_pub,funders,projects,contributors,patent_applicant,pages,keywords,referencetext,note,editors,isbn
57,2018-11-14 02:50:35,archive,"Jambu biji kristal di Provinsi Lampung diserang nematoda puru akar. Penggunaan nematisida kimiawi untuk mengendalikan nematode pada jambu membawa banyak dampak negative. Oleh karena itu penerapan pengendalian hayati menggunakan bionematisda yang ramah lingkungan perlu dipelajari. Penelitian ini bertujuan untuk menemukan jamur parasit telur nematoda puru akar yang berpotensi sebagai bahan aktif bionematisida. Eksplorasi jamur Paecilomyces lilacinus dilakukan di perkebunan jambu biji di Lampung Timur dan Tanggamus. Pengujian patogenisitas isolat jamur secara in-vitro terhadap NPA dilakukan untuk menemukan jamur yang ideal sebagai kandidat bahan aktif bionematisida. Indentifikasi jamur berdasarkan ciri bentuk koloni, miselium dan spora. Selain itu, dilakukan juga identifikasi jamur secara melokuler. Ditemukan 5 isolat jamur P. lilacinus dari pertanaman jambu Kristal di Lampung Timur dan Tanggamus. Berdasarkan ciri morfologi kelima isolat tersebut masing-masing yang diberi kode BiOP, B4120X, B3010, B412G dan B01T menunjukkan ciri jamur P. lilacinus. Hasil pengujian patogenesitas invitro menunjukkan bahwa jamur isolat B3010, B412G dan B01T memiliki daya patogenesitas yang tinggi yaitu 99-100% pada 60 jam setelah infestasi dan daya infeksi isolat B01T yang tinggi yaitu 90% telah terjadi sejak 12 jsi, sehingga dapat dinominasikan sebagai kandidat bahan aktif pembuatan bionematisida.  Berdasarkan identifikasi molekuler jamur tersebut menjadi Purpureocilium lilacinum. Ditemukan 5 isolat P. lilcinum yang memeiliki patogenisitas > 90%.",['S1'],6 Oktober 2018,JAMUR PAECILOMYCES LILACINUS PARASIT TELUR NEMATODA PURU AKAR PADA PERTANAMAN JAMBU BIJI DI LAMPUNG,show,11,conference,9863,Seminar Nasional PFI Yogyakarta,completed,Yogyakarta,738,2018-11-14 02:50:35,2018-11-14 02:50:35,"[{'security': 'public', 'placement': 1, 'eprintid': 9863, 'language': 'en', 'mime_type': 'application/pdf', 'files': [{'datasetid': 'document', 'filesize': 250232, 'mime_type': 'application/pdf', 'fileid': 92939, 'filename': 'Artikel - Jurnal JAMUR PAECILOMYCES LILACINUS-PDF.pdf', 'hash': 'b2e8ec3af99bdd76cba61738a9f9bdd8', 'hash_type': 'MD5', 'mtime': '2018-11-13 14:25:53', 'objectid': 22871, 'uri': 'http://repository.lppm.unila.ac.id/id/file/92939'}], 'docid': 22871, 'main': 'Artikel - Jurnal JAMUR PAECILOMYCES LILACINUS-PDF.pdf', 'uri': 'http://repository.lppm.unila.ac.id/id/document/22871', 'rev_number': 1, 'format': 'text', 'pos': 1}]",paper,unpub,FALSE,public,http://repository.lppm.unila.ac.id/id/eprint/9863,conference_item,['FP24'],"[{'id': 'igede.swibawa@fp.unila.ac.id', 'name': {'given': 'I Gede', 'lineage': None, 'family': 'Swibawa', 'honourific': None}}, {'id': 'yuyun.fitriana@fp.unila.ac.id', 'name': {'family': 'Fitriana', 'honourific': None, 'lineage': None, 'given': 'Yuyun'}}, {'name': {'given': '.', 'lineage': None, 'honourific': None, 'family': 'Solikhin'}, 'id': None}, {'id': 'radix.suharjo@fp.unila.ac.id', 'name': {'given': 'Radix', 'lineage': None, 'honourific': None, 'family': 'Suharjo'}}, {'id': None, 'name': {'honourific': None, 'family': 'Wardana', 'lineage': None, 'given': 'RA'}}, {'name': {'lineage': None, 'family': 'Haryani', 'honourific': None, 'given': 'MS'}, 'id': None}]",,2018-10-01 00:00:00.000000000,disk0/00/00/98/63,,,,,,,,,,,,,,,,,,,,,
58,2021-01-18 01:08:56,archive,Lembar hasil penilaian artikel jurnal ilmiah oleh tiga revewer dari dalam dan luar Unila,['S1'],,"Lembar hasil penilaian artikel, The population of white ballied plant hopper and their natural enemies: The new pest in Lampung",show,7,,27348,,,,738,2021-01-18 01:08:56,2021-01-18 01:08:56,"[{'format': 'text', 'pos': 1, 'rev_number': 1, 'uri': 'http://repository.lppm.unila.ac.id/id/document/41347', 'main': '17. Lembar Hasil Penilaian (The Population of White bellied plant).pdf', 'docid': 41347, 'files': [{'objectid': 41347, 'uri': 'http://repository.lppm.unila.ac.id/id/file/244673', 'datasetid': 'document', 'filesize': 684252, 'mime_type': 'application/pdf', 'fileid': 244673, 'filename': '17. Lembar Hasil Penilaian (The Population of White bellied plant).pdf', 'hash': 'fc9147ad8161605fd240f20272ded739', 'mtime': '2021-01-15 15:51:16', 'hash_type': 'MD5'}], 'mime_type': 'application/pdf', 'language': 'en', 'eprintid': 27348, 'security': 'public', 'placement': 1}]",,unpub,,public,http://repository.lppm.unila.ac.id/id/eprint/27348,other,['FP24'],"[{'id': 'igede.swibawa@fp.unila.ac.id', 'name': {'honourific': None, 'family': 'Swibawa', 'lineage': None, 'given': 'I Gede'}}, {'id': 'fx.susilo@fp.unila.ac.id', 'name': {'lineage': None, 'family': 'Susilo', 'honourific': None, 'given': 'FX'}}, {'id': 'agus.muhammad@fp.unila.ac.id', 'name': {'given': 'Agus M.', 'lineage': None, 'honourific': None, 'family': 'Hariri'}}, {'id': 'solikhin@fp.unila.ac.id', 'name': {'given': '.', 'lineage': None, 'honourific': None, 'family': 'Solikhin'}}]",,1970-01-01 00:00:00.000002018,disk0/00/02/73/48,,,,Jurusan Proteksi Tanaman FP Unila,,,,,,,,,,,,,,,,,
59,2018-11-14 02:47:14,archive,"The Population of White-Bellied Planthoppers and their Natural Enemies: the New Pest of Corn in Lampung. The whitebellied planthoppers (Stenocranus pasificus), hereinafter referred to as WBP,as new exotic pests in Lampung have the potential to reduce corn production and
threaten national food sovereignty. Therefore, population
of the pest needs to be managed to prevent the outbreaks. However, there is still limited information on the bio-ecology of WBP. Thus, this research was conducted to: 1) study the population growth pattern of WBP on various corn cultivars and 2) document the natural enemies of WBP. This research was carried out from May to December 2017with a survey method on several corn fields in South Lampung and planting trial on an experimental field of Faculty of Agriculture, Universitas Lampung planted with 3 corn
cultivars, i.e. Madura, P-27 and NK which were arranged in randomized complete block design with three replications. The results of the research showed: 1) there were two peaks of population density observed during plant growth. The peak of adult stage of macroptera population density occurred at 17 and 53 days after planting (dap), the highest number of leaves with oviposition mass was observed at 24 and 65 dap, while the peak of population density of nymph stage and adult stage of brachiptera occurred at 31 and 75 dap; 2) Natural enemies of WBP included 9 orders, classified as specialist predators of mirid bugs (Cyrtorhynus) and rove beetles (Paederus), and generalist predators of spiders (Araneae) and lady beetles (Coccinellidae). The population of specialist predators was fluctuated depending on WBP population, while the population of generalist predators was varied.",['S1'],,"THE POPULATION OF WHITE-BELLIED PLANTHOPPERS AND THEIR
NATURAL ENEMIES: THE NEW PEST OF CORN IN LAMPUNG",show,7,,9815,,published,,738,2018-11-14 02:47:14,2018-11-14 02:47:14,"[{'security': 'public', 'placement': 1, 'eprintid': 9815, 'mime_type': 'application/pdf', 'language': 'en', 'files': [{'filesize': 1928048, 'datasetid': 'document', 'hash_type': 'MD5', 'mtime': '2018-11-13 02:19:01', 'filename': '2018 I G. Swibawa et al. White belly plant hopper JHPT.pdf', 'hash': '74e925b4b333e7b437e1c69d5f01e0e0', 'fileid': 92669, 'mime_type': 'application/pdf', 'uri': 'http://repository.lppm.unila.ac.id/id/file/92669', 'objectid': 22829}], 'main': '2018 I G. Swibawa et al. White belly plant hopper JHPT.pdf', 'docid': 22829, 'uri': 'http://repository.lppm.unila.ac.id/id/document/22829', 'rev_number': 1, 'format': 'text', 'pos': 1}]",,pub,TRUE,public,http://repository.lppm.unila.ac.id/id/eprint/9815,article,['FP24'],"[{'id': 'igede.swibawa@fp.unila.ac.id', 'name': {'given': 'I Gede', 'honourific': None, 'family': 'Swibawa', 'lineage': None}}, {'name': {'given': 'FX', 'lineage': None, 'family': 'Susilo', 'honourific': None}, 'id': 'fx.susilo@fp.unila.ac.id'}, {'id': 'agus.muhammad@fp.unila.ac.id', 'name': {'lineage': None, 'honourific': None, 'family': 'Hariri', 'given': 'Agus M.'}}, {'name': {'given': '.', 'lineage': None, 'honourific': None, 'family': 'Solikhin'}, 'id': 'solikhin@fp.unila.ac.id'}]",Jurnal Hama dan Penyakit Tumbuhan Tropika,2018-03-01 00:00:00.000000000,disk0/00/00/98/15,,,,"Jurusan Proteksi Tanaman, PEI Bandar Lampung, PFI Lampung",,,,1411-7525,,,,,,,,,,,,,
60,2019-05-02 04:15:48,archive,"Oryctes rhinoceros L. (Coleoptera: Scarabaeidae) merupakan salah satu hama penting tanaman kelapa dan kelapa sawit di Indonesia.  Intensitas serangan hama ini bisa mencapai 69%. Pemanfaatan agensia hayati untuk mengendalikan hama O. rhinoceros terus dikembangkan dan diharapkan memberikan hasil yang efektif.   Salah satu agensia hayati tersebut adalah jamur entomopatogen Metarhizium sp. Penelitian ini bertujuan untuk memperoleh  isolat Metarhizium  sp. yang memiliki virulensi yang tinggi terhadap  hama 
O. rhinoceros. Hasil penelitian menunjukan bahwa Metarhizium sp. isolat dari Salatiga, Tegineneng, dan Natar mampu menginfeksi dan menyebabkan kematian larva O. rhinoceros dalam waktu yang cukup singkat dan memiliki nilai virulensi yang cukup tinggi. Pengujian di lapangan menunjukkan bahwa Metarhizium sp. isolat dari Salatiga, Tegineneng, dan isolat Natar memiliki nilai periode letal masing-masing adalah 10,4 hari; 11,0 hari; dan 11,0 hari, sedangkan nilai virulensinya  masing-masing sebesar 0,096; 0,091;  dan 0,90. 
 
Kata kunci : oryctes rhinoceros, Metarhizium  sp., periode letal, virulensi",['S1'],12 - 13 Juli 2018,Uji virulensi beberapa isolat Metarhizium sp. terhadap larva Oryctes rhinoceros L.,show,9,conference,11335,Seminar Nasional Perhimpunan Entomologi Indonesia Cabang Palembang,published,Palembang,1090,2019-05-02 04:15:48,2019-05-02 04:15:48,"[{'eprintid': 11335, 'security': 'public', 'placement': 1, 'mime_type': 'application/pdf', 'language': 'en', 'docid': 24334, 'main': 'Prosiding PEI-terbit 2018 Lestari dkk..pdf', 'files': [{'hash': '09bc2b687f1b931c673b8d8e6f5b5861', 'filename': 'Prosiding PEI-terbit 2018 Lestari dkk..pdf', 'mtime': '2019-04-28 00:27:53', 'hash_type': 'MD5', 'mime_type': 'application/pdf', 'fileid': 103151, 'filesize': 3049313, 'datasetid': 'document', 'uri': 'http://repository.lppm.unila.ac.id/id/file/103151', 'objectid': 24334}], 'format': 'text', 'pos': 1, 'rev_number': 1, 'uri': 'http://repository.lppm.unila.ac.id/id/document/24334'}]",paper,pub,TRUE,public,http://repository.lppm.unila.ac.id/id/eprint/11335,conference_item,['FP24'],"[{'name': {'given': 'Lestari', 'family': 'Wibowo', 'honourific': None, 'lineage': None}, 'id': 'lestari.wibowo@fp.unila.ac.id'}, {'id': 'hamim.sudarsono@fp.unila.ac.id', 'name': {'given': 'Hamim', 'honourific': None, 'family': 'Sudarsono', 'lineage': None}}, {'name': {'lineage': None, 'family': 'Hariri', 'honourific': None, 'given': 'Agus M.'}, 'id': 'agus.muhammad@fp.unila.ac.id'}, {'id': 'fx.susilo@fp.unila.ac.id', 'name': {'given': 'FX', 'lineage': None, 'family': 'Susilo', 'honourific': None}}, {'id': 'nryasin@gmail.com', 'name': {'family': 'Yasin,', 'honourific': None, 'lineage': None, 'given': 'N.'}}]",,1970-01-01 00:00:00.000002018,disk0/00/01/13/35,,,,,,,,,289-298,,,,,,,,,,,,
61,2019-05-02 03:57:41,archive,"Oryctes rhinoceros L. (Coleoptera: Scarabaeidae) is one of the important pest in
coconut and oil palm  in Indonesia. The intensity of this pest attack was up to 69%. The
use of natural agent in controlling O. rhinoceros is keep on improved, in order to gain an
effective yield. One of natural agent from O. rhinoceros pest is the entomopathogen
Metarhizium sp. This research was aimed to gather some Metarhizium sp. isolate that has
high virulence towards the O. rhinoceros pest. The results showed that Metarhizium sp.
isolate from Salatiga, Tegineneng, and Natar are able to infect and kill O. rhinoceros larva
in a short period of  time and they have high virulence value. The field experiment showed
that Metarhizium sp. isolate from Salatiga, Tegineneng, and Natar have lethal period,
10.4, 11.0, and 11.0 days respectively, while the virulence values are 0.096, 0.091, and
0.090. 

Keywords:  Oryctes rhinoceros, Metarhizium  sp., lethal period, virulence",['S1'],12-13 July 2018,Uji Virulensi Beberapa Isolat Metarhizium sp. terhadap Larva Oryctes rhinoceros L.,show,9,conference,10732,"Seminar Nasional Perhimpunan Entomologi Indonesia (PEI) Cabang Palembang 2018, Palembang  12-13 Juli 2018",published,Palembang,907,2019-05-02 03:57:41,2019-05-02 03:57:41,"[{'files': [{'objectid': 23750, 'uri': 'http://repository.lppm.unila.ac.id/id/file/99117', 'datasetid': 'document', 'filesize': 3075545, 'mime_type': 'application/pdf', 'fileid': 99117, 'filename': 'Prosiding Semnas-PEI-2018-Lestari Wibowo.pdf', 'hash': 'b809cb89a813f581e65328cfb7b5e521', 'hash_type': 'MD5', 'mtime': '2019-02-11 12:28:44'}], 'main': 'Prosiding Semnas-PEI-2018-Lestari Wibowo.pdf', 'docid': 23750, 'rev_number': 1, 'uri': 'http://repository.lppm.unila.ac.id/id/document/23750', 'pos': 1, 'format': 'text', 'placement': 1, 'security': 'public', 'eprintid': 10732, 'language': 'en', 'mime_type': 'application/pdf'}]",paper,pub,TRUE,public,http://repository.lppm.unila.ac.id/id/eprint/10732,conference_item,['FP24'],"[{'id': 'lestari.wibowo@fp.unila.ac.id', 'name': {'given': 'Lestari', 'lineage': None, 'honourific': None, 'family': 'Wibowo'}}, {'id': 'hamim.sudarsono@fp.unila.ac.id', 'name': {'family': 'Sudarsono', 'honourific': None, 'lineage': None, 'given': 'Hamim'}}, {'name': {'lineage': None, 'honourific': None, 'family': 'Hariri', 'given': 'Agus M.'}, 'id': 'agus.muhammad@fp.unila.ac.id'}, {'name': {'given': 'Nur', 'family': 'Yasin', 'honourific': None, 'lineage': None}, 'id': 'nryasin@gmail.com'}, {'name': {'family': 'Susilo', 'honourific': None, 'lineage': None, 'given': 'FX'}, 'id': 'fx.susilo@fp.unila.ac.id'}]",,2018-07-12 00:00:00.000000000,disk0/00/01/07/32,,,,,,,lestari.wibowo.62@gmail.com,,289-298,,,,,,,,,,,,
62,2019-02-23 14:16:48,archive,"To support rice productivity over a long time, paddy cultivation is done with a sustainable farming system that based on conservation.  Conservation-based agriculture increase the diversity of agroecosystems with refugia planting.  Refugia plants are flowering plants that grow around cultivated plants that have the potential to provide suitable microhabitat that contribute to the conservation of natural enemies.The study was conducted  in August to October 2018 in the wetland paddy  at Sidosari Village, Natar District, Lampung.   Identification of arthropod families in the Plant Pest Laboratory of the Department of Plant Protection, Faculty of Agriculture, Lampung University. Result study are planting refugia and applying IPM to the ecosystem of wetland paddy  increase arthropods diversity, the population of pest insects is lower in wetland paddy ecosystem with planting refugia and application of IPM,  population density of biological agents higher than conventional  wetland  paddy fields, and  the disease incidence tungro is dependent on Nephotettix virescens  in wetland that  refugia planting and the application of IPM or the conventional paddy fields.",['S1'],03-04 Dec 2018,The role of refugia in the wetland paddy ecosystem,show,8,workshop,10831,6TH INTERNATIONAL WORKSHOP ON CROP PRODUCTION AND PRODUCTIVITY UNDER GLOBAL CLIMATE CHANGE,published,Bandar Lampung,330,2019-02-23 14:16:48,2019-02-23 14:16:48,"[{'rev_number': 1, 'uri': 'http://repository.lppm.unila.ac.id/id/document/23843', 'pos': 1, 'format': 'text', 'files': [{'datasetid': 'document', 'filesize': 641949, 'mime_type': 'application/pdf', 'fileid': 99746, 'filename': 'Artikel Seminar Gifu University.pdf', 'hash': '7921f96eee7d7ab7bdd599de0fbea34c', 'mtime': '2019-02-23 06:51:45', 'hash_type': 'MD5', 'objectid': 23843, 'uri': 'http://repository.lppm.unila.ac.id/id/file/99746'}], 'main': 'Artikel Seminar Gifu University.pdf', 'docid': 23843, 'mime_type': 'application/pdf', 'language': 'en', 'placement': 1, 'security': 'public', 'eprintid': 10831}]",paper,pub,TRUE,public,http://repository.lppm.unila.ac.id/id/eprint/10831,conference_item,['FP24'],"[{'name': {'lineage': None, 'family': 'Wibowo', 'honourific': None, 'given': 'Lestari'}}, {'name': {'honourific': None, 'family': 'Widagdo', 'lineage': None, 'given': 'Setyo'}}, {'name': {'lineage': None, 'honourific': None, 'family': 'Dirmawati', 'given': 'Suskandini Ratih'}}, {'name': {'lineage': None, 'family': 'Nurdin', 'honourific': None, 'given': 'M'}}]",,2018-12-03 00:00:00.000000000,disk0/00/01/08/31,http://iss.ndl.go.jp/books/R100000002-I029383171-00,,,,"[{'url': 'http://iss.ndl.go.jp/books/R100000002-I029383171-00', 'type': 'org'}]",,,,50-52,['Jurusan Proteksi Tanaman Fakultas Pertanian Universitas Lampung'],,['Gifu University'],['6TH INTERNATIONAL WORKSHOP ON CROP PRODUCTION AND PRODUCTIVITY UNDER GLOBAL CLIMATE CHANGE'],"[{'type': 'http://www.loc.gov/loc.terms/relators/AUT', 'name': {'given': 'Lestari', 'family': 'Wibowo', 'honourific': None, 'lineage': None}}, {'type': 'http://www.loc.gov/loc.terms/relators/AUT', 'name': {'lineage': None, 'honourific': None, 'family': 'Widagdo', 'given': 'Setyo'}}, {'type': 'http://www.loc.gov/loc.terms/relators/AUT', 'name': {'given': 'Suskandini Ratih', 'lineage': None, 'honourific': None, 'family': 'Dirmawati'}}, {'name': {'given': 'M', 'honourific': None, 'family': 'Nurdin', 'lineage': None}, 'type': 'http://www.loc.gov/loc.terms/relators/AUT'}]",,,,,,,
63,2019-11-07 07:57:04,archive,"Dalam budidaya tanaman, salah satu kendala utama yang menjadi penghambat produksi baik secara kualitas maupun kuantitas adalah adanya serangan organisme pengganggu tanaman. Salah satu hama yang menyerang budidaya tanaman adalah ulat grayak (Spodoptera litura F.). Tujuan dari penelitian ini untuk mengetahui toksistas ekstrak buah mahkota dewa (Phaleria papuena Warb.) terhadap ulat grayak (Spodoptera litura F.). Penelitian ini menggunakan 6 perlakuan ekstrak buah mahkota dewa. Pada setiap satuan percobaan digunakan 15 ekor ulat grayak yang dipapari ekstrak buah mahkota dewa. Perlakuan yang digunakan adalah konsentrasi ekstrak buah mahkota dewa yang terdiri atas 6 taraf konsentrasi, yaitu 0%, 1%, 5%, 10%, 20%, 30%. Untuk memperoleh nilai LC 50 data mortalitas yang diperoleh pada uji toksisitas ekstrak buah mahkota dewa (Phaleria papuena Warb.) terhadap ulat grayak(Spodoptera litura F.) dilakukan analisis probit dengansoftware menggunakan SPSS v23for windows.Nilai LC 50 ditentukan pada taraf nyata 5%. Hasil penelitian menunjukkan bahwa ekstrak buah mahkota dewa dapat mematikan ulat grayak. Nilai LC 50 ekstrak buah mahkota dewa terhadap larva Spodoptera litura F. yaitu 7,98% pada 8 hari setelah aplikasi. Semakin tinggi konsentrasi ekstrak buah mahkota dewa yang digunakan maka akan semakin cepat dalam mematikan ulat grayak, semakin tinggi konsentrasi ekstrak buah mahkota dewa LT 50 -nya semakin rendah.",['S1'],,TOKSISITAS EKSTRAK BUAH MAHKOTA DEWA (Phaleria papuena Warb.)TERHADAP ULAT GRAYAK (Spodoptera litura F.) DI LABORATORIUM,show,6,,15867,,published,,801,2019-11-07 07:57:04,2019-11-07 07:57:04,"[{'eprintid': 15867, 'security': 'public', 'placement': 1, 'mime_type': 'application/pdf', 'language': 'en', 'main': 'nur yasin.pdf', 'docid': 28959, 'files': [{'objectid': 28959, 'uri': 'http://repository.lppm.unila.ac.id/id/file/136170', 'datasetid': 'document', 'filesize': 134708, 'mime_type': 'application/pdf', 'fileid': 136170, 'hash': '6552bce4b1819622e1e211648998f8d4', 'filename': 'nur yasin.pdf', 'mtime': '2019-11-07 05:17:42', 'hash_type': 'MD5'}], 'format': 'text', 'pos': 1, 'rev_number': 1, 'uri': 'http://repository.lppm.unila.ac.id/id/document/28959'}]",,pub,FALSE,public,http://repository.lppm.unila.ac.id/id/eprint/15867,article,['FP24'],"[{'name': {'given': 'Irvan', 'honourific': None, 'family': 'Zestyadi R.S', 'lineage': None}}, {'name': {'given': '.', 'lineage': None, 'honourific': None, 'family': 'Solikhin'}}, {'name': {'family': 'Nuryasin', 'honourific': None, 'lineage': None, 'given': 'Nuryasin'}}]",Jurnal Agrotek Tropika,2018-01-01 00:00:00.000000000,disk0/00/01/58/67,http://jurnal.fp.unila.ac.id/index.php/JA/article/view/2528,,1,Jurnal Agrotek Tropika,,6,,2337-4993,21-25,,,,,,,,,,,,
