,status_changed,eprint_status,abstract,subjects,event_dates,title,metadata_visibility,rev_number,event_type,eprintid,event_title,date_type,event_location,userid,lastmod,datestamp,documents,pres_type,ispublished,refereed,full_text_status,uri,type,divisions,creators,publication,date,dir,official_url,id_number,number,publisher,related_url,volume,contact_email,issn,pagerange,corp_creators,place_of_pub,funders,projects,contributors,patent_applicant,pages,keywords,referencetext,note,editors,isbn
0,2018-10-31 02:52:25,archive,"Penelitian ini bertujuan untuk menginventarisasi penyakit pada berbagai klon ubi kayu hasil seleksi dan menduga keragaman keparahan beberapa penyakit yang ditemukan pada populasi F1 half-sib. Benih botani yang digunakan dipanen dari Sekincau, Lampung Barat pada tahun 2015 dan disemai dalam polibeg. Selanjutnya pada Maret 2016 bibit ditanam di lahan Laboratorium Lapang Terpadu Universitas Lampung.  Pada akhir Februari 2017 tanaman ubi kayu dipotong hingga tersisa batangnya setinggi 50 cm dari atas permukaan tanah. Pengamatan gejala penyakit dilakukan terhadap 75 klon ubi kayu F1 yang berasal dari 15 tetua betina.  Pengamatan dilakukan setiap dua minggu sekali selama dua bulan dimulai sejak 7 bulan setelah pemotongan.  Gejala penyakit yang ditemukan pada setiap klon ubi kayu dicatat dan dihitung keparahannya. Penelitian ini dilakukan dengan metode survei yang tidak menggunakan rancangan maupun ulangan. Sebaran data keparahan setiap penyakit yang ditemukan diketahui dari box and whisker plot dengan menggunakan program SAS (The SAS System for Windows 9.0). Data keparahan penyakit dianalisis untuk menduga nilai tengah, kisaran, dan ragam antar klon ubi kayu. Hasil pengamatan menunjukkan adanya tiga penyakit pada tanaman ubi kayu yaitu penyakit bercak daun coklat (Cercospora henningsii), bercak daun baur (Cercospora viscosae), dan hawar daun bakteri (Xanthomonas campestris).  Keparahan penyakit bercak daun coklat yang tertinggi terdapat pada populasi F1 CMM 25-27-122 (36,67%) dengan keragaman luas, sedangkan populasi F1 UJ3 memiliki keparahan terendah (2,50%) dengan keragaman sempit. Keparahan penyakit bercak daun baur yang tertinggi terdapat pada populasi F1 BL5-1 (68%) sedangkan populasi F1 BL4 memiliki keparahan terendah (3,10%), keduanya mempunyai keragaman luas. Keparahan penyakit hawar daun bakteri yang tertinggi terdapat pada populasi F1 BL5-1 (38,30%) sedangkan populasi F1 UJ3 memiliki intensitas terendah (1,70%) dengan keragaman luas.",['S1'],2-3 Oktober 2018,INVENTARISASI DAN KEPARAHAN PENYAKIT PADA BEBERAPA POPULASI F1     UBI KAYU DI BANDAR LAMPUNG,show,15,conference,9107,Lokakarya dan Seminar Nasional Forum Komunikasi Perguruan Tinggi Pertanian Indonesia,submitted,Banda Aceh,380,2019-07-10 07:30:17,2018-10-31 02:52:25,"[{'uri': 'http://repository.lppm.unila.ac.id/id/document/22182', 'rev_number': 3, 'format': 'text', 'pos': 1, 'files': [{'objectid': 22182, 'uri': 'http://repository.lppm.unila.ac.id/id/file/87847', 'datasetid': 'document', 'filesize': 841728, 'mime_type': 'application/msword', 'fileid': 87847, 'filename': 'Full_Paper-FKPTPI_2018.doc', 'hash': '2220bc5259afd78a3c4dcb84a9c77526', 'hash_type': 'MD5', 'mtime': '2018-10-30 06:33:24'}], 'main': 'Full_Paper-FKPTPI_2018.doc', 'docid': 22182, 'content': 'accepted', 'mime_type': 'application/msword', 'language': 'id', 'security': 'public', 'placement': 1, 'eprintid': 9107}]",paper,submitted,FALSE,public,http://repository.lppm.unila.ac.id/id/eprint/9107,conference_item,['FP24'],"[{'name': {'lineage': None, 'honourific': None, 'family': 'Aeny', 'given': 'Titik Nur'}, 'id': 'titik.nuraeny@fp.unila.ac.id'}, {'id': 'riniayu838@gmail.com', 'name': {'honourific': None, 'family': 'Prameswari', 'lineage': None, 'given': 'Rini Ayu'}}, {'name': {'given': 'Setyo Dwi', 'family': 'Utomo', 'honourific': None, 'lineage': None}, 'id': 'setyo.dwiutomo@fp.unila.ac.id'}, {'id': 'suskandini.ratih@fp.unila.ac.id', 'name': {'given': 'Suskandini Ratih', 'lineage': None, 'family': 'Dirmawati', 'honourific': None}}]",Prosiding Lokakarya dan Seminar Nasional Forum Komunikasi Perguruan Tinggi Fakultas Pertanian Indonesia Tahun 2018,1970-01-01 00:00:00.000002018,disk0/00/00/91/07,,,,,,,,,,,,,,,,,,,,,
1,2019-12-27 02:49:01,archive,"Aeny TN, Prasetyo J, Suharjo R, Dirmawati SR, Efri, Niswati A. 2018. Isolation and Identification of actinomycetes potential as the antagonist of Dickeya zeae pineapple soft rot in Lampung, Indonesia. Biodiversitas 19: 2052-2058. This study was aimed to collect and identify actinomycetes from the rhizosphere of pineapple with the potency as a biocontrol agent of Dickeya zeae, the pathogen of pineapple soft rot. Soil samples were collected from four different pineapple plantations in Lampung Province, in December 2016. Samples were air-dried, serially diluted, and plated on modified ISP2 medium and several single characterized colonies were sub cultured and purified. The growing colonies were grouped into different colour series based on their aerial-mycelia and substrate-mycelia colors. Antagonistic activity of the actinomycetes isolates were evaluated against Dickeya zeae by agar diffusion method using the same medium agar lawn with the bacterial cultures. Selected antagonistic actinomycete isolates with the biggest clear zone formation were further characterized and identified molecularly based on 16S rDNA sequences. The results showed that as many as 34 actinomycete isolates collected from pineapple rhizosphere produced clear zones. Two isolates, namely GGF2-i5 and GGF4-i18, presented the biggest clear zone were proposed as the potential antagonist strains against D. zeae and identified as Streptomyces parvulus and Streptomyces hygroscopicus subsp. hygroscopicus, respectively. Both of the 16S rRNA gene sequences from those strains were deposited in the GenBank with the accession number MH170279 and MH170280, respectively.
Keywords: actinomycetes, Ananas comosus, antagonist, Dickeya zeae, Streptomyces",['S1'],,"Isolation and identification of actinomycetes potential as the antagonist of Dickeya zeae pineapple soft rot in Lampung, Indonesia",show,6,,17415,,published,,380,2019-12-27 02:49:01,2019-12-27 02:49:01,"[{'mime_type': 'application/pdf', 'language': 'en', 'eprintid': 17415, 'security': 'public', 'placement': 1, 'format': 'text', 'pos': 1, 'uri': 'http://repository.lppm.unila.ac.id/id/document/30541', 'rev_number': 1, 'main': 'D190610.pdf FULLPAPER.pdf', 'docid': 30541, 'files': [{'uri': 'http://repository.lppm.unila.ac.id/id/file/147358', 'objectid': 30541, 'filesize': 681245, 'datasetid': 'document', 'mtime': '2019-12-26 15:39:52', 'hash_type': 'MD5', 'filename': 'D190610.pdf FULLPAPER.pdf', 'hash': 'd5fe79af6efb02f3484653cb2e2585a9', 'fileid': 147358, 'mime_type': 'application/pdf'}]}]",,pub,TRUE,public,http://repository.lppm.unila.ac.id/id/eprint/17415,article,['FP24'],"[{'id': 'titik.nuraeny@fp.unila.ac.id', 'name': {'given': 'Titik Nur', 'honourific': None, 'family': 'Aeny', 'lineage': None}}, {'id': 'joko.prasetyo@fp.unila.ac.id', 'name': {'given': 'Joko', 'family': 'Prasetyo', 'honourific': None, 'lineage': None}}, {'id': 'radix.suharjo@fp.unila.ac.id', 'name': {'given': 'Radix', 'family': 'Suharjo', 'honourific': None, 'lineage': None}}, {'id': 'suskandini.ratih@fp.unila.ac.id', 'name': {'honourific': None, 'family': 'Dirmawati', 'lineage': None, 'given': 'Suskandini R.'}}, {'id': 'efri.1960@fp.unila.ac.id', 'name': {'given': 'Efri', 'lineage': None, 'honourific': None, 'family': 'Efri'}}, {'name': {'lineage': None, 'honourific': None, 'family': 'Niswati', 'given': 'Ainin'}, 'id': 'ainin.niswati@fp.unila.ac.id'}]",BIODIVERSITAS,2018-10-21 00:00:00.000000000,disk0/00/01/74/15,https://smujo.id/biodiv/article/view/3083,DOI: 10.13057/biodiv/d190610,6,Society for Indonesian Biodiversity,[{'url': 'https://biodiversitas.mipa.uns.ac.id/D/D1906.htm'}],19,titik.nuraeny@fp.unila.ac.id,1412-033X,2052-2058,,,,,,,,,,,,
2,2019-09-28 05:47:03,archive,similirity Biodiversitas_radix,['S1'],,similirity Biodiversitas_radix,show,8,,14368,,,,579,2019-09-28 05:47:03,2019-09-28 05:47:03,"[{'mime_type': 'application/pdf', 'language': 'en', 'eprintid': 14368, 'placement': 1, 'security': 'public', 'pos': 1, 'format': 'text', 'uri': 'http://repository.lppm.unila.ac.id/id/document/27421', 'rev_number': 1, 'main': 'Short_Communication__Isolation_and_identification_.pdf', 'docid': 27421, 'files': [{'uri': 'http://repository.lppm.unila.ac.id/id/file/124653', 'objectid': 27421, 'hash_type': 'MD5', 'mtime': '2019-09-27 05:23:15', 'hash': 'bcdb16a510b0fd0d1070955a520dae08', 'filename': 'Short_Communication__Isolation_and_identification_.pdf', 'fileid': 124653, 'mime_type': 'application/pdf', 'filesize': 3407509, 'datasetid': 'document'}]}]",,pub,,public,http://repository.lppm.unila.ac.id/id/eprint/14368,other,['FP24'],"[{'name': {'given': 'Titik Nur', 'lineage': None, 'family': 'Aeny', 'honourific': None}, 'id': 'titik.nuraeny@fp.unila.ac.id'}, {'id': 'joko.prasetyo@fp.unila.ac.id', 'name': {'lineage': None, 'family': 'Prasetyo', 'honourific': None, 'given': 'Joko'}}, {'id': 'radix.suharjo@fp.unila.ac.id', 'name': {'given': 'Radix', 'lineage': None, 'family': 'Suharjo', 'honourific': None}}, {'name': {'lineage': None, 'honourific': None, 'family': 'Dirmawati', 'given': 'Suskandini R.'}, 'id': 'suskandini.ratih@fp.unila.ac.id'}, {'id': 'efri.1960@fp.unila.ac.id', 'name': {'lineage': None, 'family': 'Efri', 'honourific': None, 'given': 'Efri'}}, {'name': {'given': 'Ainin', 'lineage': None, 'family': 'Niswati', 'honourific': None}, 'id': 'ainin.niswati@fp.unila.ac.id'}]",,2018-11-01 00:00:00.000000000,disk0/00/01/43/68,http://biodiversitas.mipa.uns.ac.id,10.13057/biodiv/d190610,,Society for Indonesian Biodiversity,,,,,,,,,,,,,,,,,
3,2018-10-31 02:48:57,archive,"This  study  was aimed  to collect  and  identify actinomycetes from  the  rhizosphere  of  pineapple  with  the  potency  as  a biocontrol  agent of Dickeya zeae,  the 
pathogen of pineapple soft rot. Soil samples were collected from four different pineapple plantations in Lampung
Province, in December 2016.Samples were air-dried, serially diluted, and plated on modified ISP2 medium and several 
single characterized colonies were sub cultured and purified. The growing colonies  were  grouped  into  different  colour  series  based  on  their  aerial-
mycelia  and substrate mycelia colors. Antagonistic activity of the actinomycetes isolates were evaluated against
Dickeya zeae by agar diffusion method using the same medi
umagar lawn with the bacterial cultures. Selected
antagonistic actinomycete isolates with the biggest clear zone formation were  further  characterized  and  identified  molecularly  based  on  16S  rDNA  sequences.The  results  showed  that  as  many  as  34 actinomycete  isolates
collected  from  pineapple  rhizosphere  produced  clear  zones.Two isolates, namely GGF2-i5  and  GGF4-i18,presented 
the  biggest clear zone were proposed  as  the  potential  antagonist strains against D.  zeae and identified  as 
Streptomyces parvulus and Streptomyces hygroscopicus subsp. hygroscopicus, respectively. Both of the 16S rRNA gene sequences from those strains were deposited in the GenBank with the accession number MH170279 and MH170280, respectively
.",['S1'],,"Isolation and identification of actinomycetes potential as the antagonist of Dickeya zeae pineapple soft rot in Lampung,
Indonesia",show,8,,9106,,published,,380,2018-10-31 02:48:57,2018-10-31 02:48:57,"[{'format': 'text', 'pos': 1, 'rev_number': 1, 'uri': 'http://repository.lppm.unila.ac.id/id/document/22180', 'docid': 22180, 'main': 'D190610-1 BIODIVERSITAS.pdf', 'files': [{'mime_type': 'application/pdf', 'fileid': 87828, 'filename': 'D190610-1 BIODIVERSITAS.pdf', 'hash': 'd5fe79af6efb02f3484653cb2e2585a9', 'hash_type': 'MD5', 'mtime': '2018-10-30 05:16:38', 'datasetid': 'document', 'filesize': 681245, 'objectid': 22180, 'uri': 'http://repository.lppm.unila.ac.id/id/file/87828'}], 'language': 'en', 'mime_type': 'application/pdf', 'eprintid': 9106, 'security': 'public', 'placement': 1}]",,pub,TRUE,public,http://repository.lppm.unila.ac.id/id/eprint/9106,article,['FP24'],"[{'name': {'given': 'Titik Nur', 'family': 'Aeny', 'honourific': None, 'lineage': None}, 'id': 'titik.nuraeny@fp.unila.ac.id'}, {'id': 'joko.prasetyo@fp.unila.ac.id', 'name': {'lineage': None, 'honourific': None, 'family': 'Prasetyo', 'given': 'Joko'}}, {'id': 'radix.suharjo@fp.unila.ac.id', 'name': {'lineage': None, 'family': 'Suharjo', 'honourific': None, 'given': 'Radix'}}, {'name': {'family': 'Suskandini', 'honourific': None, 'lineage': None, 'given': 'RD'}, 'id': 'suskandini.ratih@fp.unila.ac.id'}, {'id': 'efri.1960@fp.unila.ac.id', 'name': {'honourific': None, 'family': 'Efri', 'lineage': None, 'given': 'Efri'}}, {'name': {'honourific': None, 'family': 'Niswati', 'lineage': None, 'given': 'Ainin'}, 'id': 'ainin.niswati@fp.unila.ac.id'}]",Biodiversitas Journal of Biological Diversity,2018-10-21 00:00:00.000000000,disk0/00/00/91/06,http://biodiversitas.mipa.uns.ac.id,,6,Society for Indonesian Biodiversity,,19,,1412-033X,2052-2058,,,,,,,,,,,,
4,2020-08-11 05:37:08,archive,LEMBAR HASIL PENILAIAN SEJAWWAT / PEER REVIEW,['S1'],,"SHORT COMMUNICATION : ISOLATION ADN IDENTIFICATION OF ACTINOMYCETES POTENTIAL AS THE ANTAGONIST OF DICKEYA ZEAE PINEAPPLE SOFT ROT IN LAMPUNG, INDONESIA",show,8,,23580,,published,,1016,2020-08-11 05:37:08,2020-08-11 05:37:08,"[{'placement': 1, 'security': 'public', 'eprintid': 23580, 'mime_type': 'application/pdf', 'language': 'en', 'files': [{'mime_type': 'application/pdf', 'fileid': 215461, 'hash': 'df076169a1edf455308765acb9c1b122', 'filename': 'Short Communication Isolation and Identification.pdf', 'hash_type': 'MD5', 'mtime': '2020-08-11 03:53:15', 'datasetid': 'document', 'filesize': 1396722, 'objectid': 37208, 'uri': 'http://repository.lppm.unila.ac.id/id/file/215461'}], 'docid': 37208, 'main': 'Short Communication Isolation and Identification.pdf', 'uri': 'http://repository.lppm.unila.ac.id/id/document/37208', 'rev_number': 1, 'pos': 1, 'format': 'text'}]",,pub,,public,http://repository.lppm.unila.ac.id/id/eprint/23580,other,['FP24'],"[{'name': {'honourific': None, 'family': 'Aeny', 'lineage': None, 'given': 'Titik Nur'}, 'id': 'titik.nuraeny@fp.unila.ac.id'}, {'id': 'joko.prasetyo@fp.unila.ac.id', 'name': {'given': 'Joko', 'family': 'Prasetyo', 'honourific': None, 'lineage': None}}, {'id': 'radix.suharjo@fp.unila.ac.id', 'name': {'lineage': None, 'family': 'Suharjo', 'honourific': None, 'given': 'Radix'}}, {'name': {'given': 'RD', 'family': 'Suskandini', 'honourific': None, 'lineage': None}, 'id': 'suskandini.ratih@fp.unila.ac.id'}, {'name': {'lineage': None, 'family': 'Efri', 'honourific': None, 'given': 'Efri'}, 'id': 'efri.1960@fp.unila.ac.id'}, {'id': 'ainin.niswati@fp.unila.ac.id', 'name': {'honourific': None, 'family': 'Niswati', 'lineage': None, 'given': 'Ainin'}}]",,1970-01-01 00:00:00.000002018,disk0/00/02/35/80,,2085-4722,,JOURNAL OF BIOLOGICAL DIVESITY,,,,,,['UNIVERSITAS LAMPUNG'],,,,,,,,,,,
5,2018-11-02 01:55:32,archive,"Tujuan penelitian adalah untuk mengetahui serta menghitung intensitas serangan hama dan patogen tanaman padi (Oryza sativa L.) pada berbagai media tanam dengan sistem hidroponik. Penelitian ini dilaksanakan di desa Natar, Dusun II kecamatan Natar kabupaten Lampung Selatan pada bulan Mei sampai Juli 2016 dengan penelitian pendahuluan yang sudah dilakukan pada bulan Mei sampai Juni 2015. Penelitian ini menggunakan rancangan acak kelompok dengan media tanam sebagai perlakuan. Perhitungan intensitas serangan hama dan patogen dilakukan dengan menghitung kejadian penyakit maupun hama di setiap rumpun padi di berbagai media tanam yang berbeda-beda. Media tanam padi yang digunakan untuk sistem hidroponik adalah kontrol (K) berupa tanah sawah, arang sekam (AS), pasir malang+arang sekam (PM+AS), dan pasir malang (PM). Setiap media tanam yang berbeda di masukkan pada 12 kotak tanam padi.  Setiap kotak diulang sebanyak tiga kali sehingga terdapat 12 sampel tanaman padi yang diamati hama dan penyakitnya. Hasil penelitian menunjukkan bahwa patogen yang menyerang tanaman padi dengan sistem hidroponik pada berbagai media tanam adalah penyakit bercak daun sempit dan bercak cokelat sedangkan serangga pada tanaman padi dengan sistem hidroponik dengan berbagai media tanam adalah belalang dan wereng. Penggunan media tanam arang sekam dengan sistem hidroponik menghasilkan intensitas keparahan penyakit lebih rendah dari media tanam lainnya pada dua jenis penyakit yang teridentifikasi.

Kata kunci: Media Tanam, Padi, Sistem Hidroponik",['S1'],,INTENSITAS  SERANGAN  HAMA DAN PATOGEN  PADA AGROEKOSISTEM HIDROPONIK TANAMAN PADI (Oryza sativa L.) DENGAN BERBAGAI MEDIA TANAM,show,7,,9239,,published,,330,2018-11-02 01:55:32,2018-11-02 01:55:32,"[{'language': 'en', 'mime_type': 'application/pdf', 'eprintid': 9239, 'placement': 1, 'security': 'public', 'pos': 1, 'format': 'text', 'rev_number': 1, 'uri': 'http://repository.lppm.unila.ac.id/id/document/22301', 'docid': 22301, 'main': 'Jurnal Agrotek Tropika Mei 2018.pdf', 'files': [{'objectid': 22301, 'uri': 'http://repository.lppm.unila.ac.id/id/file/88662', 'datasetid': 'document', 'filesize': 743075, 'fileid': 88662, 'mime_type': 'application/pdf', 'mtime': '2018-11-01 16:01:09', 'hash_type': 'MD5', 'hash': '0b0192c9fc4d1c03cdcfdca50268b6d5', 'filename': 'Jurnal Agrotek Tropika Mei 2018.pdf'}]}]",,pub,TRUE,public,http://repository.lppm.unila.ac.id/id/eprint/9239,article,['FP24'],"[{'name': {'honourific': None, 'family': 'Ahmad', 'lineage': None, 'given': 'Afrizal'}}, {'name': {'family': 'Suskandini', 'honourific': None, 'lineage': None, 'given': 'Ratih  Dirmawati'}}, {'name': {'lineage': None, 'honourific': None, 'family': 'Muhammad', 'given': 'Nurdin'}}, {'name': {'honourific': None, 'family': 'Susilo', 'lineage': None, 'given': 'Fransiskus Xaverius'}}]",J. Agrotek  Tropika.,2018-05-01 00:00:00.000000000,disk0/00/00/92/39,,,No. 2,Universitas Lampung,,Vol. 6,,ISSN  2337-4993,86-90,"['Jurusan Agroteknologi, Fakultas Pertanian, Universitas Lampung Jl. Prof. Soemantri Brojonegoro, No. 1 Bandar Lampung 35145']",,,,,,,,,,,
6,2018-06-25 02:26:09,archive,"Penelitian ini bertujuan untuk mengetahui karakter empat isolat jamur  B.bassiana (Bbyf 22, Bbyf 24, Bbyf, dan BbTa) dalam pertambahan diameter koloni, kerapatan spora, dan  perkecambahan spora serta kemampuan tiga isolat jamur B. bassiana   dalam menimbulkan mortalitas terhadap ulat api (Setothosea spp.).Penelitian ini dilaksanakan di Laboratorium Bioteknologi Pertanian, Fakultas Pertanian, Universitas Lampung, dari bulan Juli 2016 sampai Januari 2017.  Penelitian ini terdiri dari dua set  percobaan, yaitu percobaan pertama untuk mengetahui pertambahan diameter koloni, kerapatan spora, dan perkecambahan
Spora secara in vitro dengan Rancangan Acak Lengkap (RAL) dan diulang  lima kali.  Percoban kedua uji patogenisitas jamur B.  bassiana terhadap ulat api (Setothosea spp.) dengan Rancangan Acak Lengkap (RAL) dan diulang  tiga kali dengan konsentrasi  106, 107, dan 108
.  Pengamatan dilakukan terhadap diameter koloni, kerapatan spora, perkecambahan spora, dan mortalitas.   Data diuji dengan analisis ragam dan nilai tengah perlakuan diuji dengan uji Duncan Multiple Range Test (DMRT) pada taraf 5%.Keempat isolat jamurB. bassiana memiliki pertambahan koloni, kerapatan spora dan daya berkecambah (viabilitas) yang berbeda-beda, dari keempat jamur tersebut isolat Bbyf 24 yang memiliki pertambahan koloni, kerapatan spora dan daya berkecambah (viabilitas) yang paling baik dibandingkan B. bassiana asal Tanggamus.Tiga isolat B. bassiana dari tiga tingkat  pengenceran mampu menimbulkan mortalitas pada ulat api, namun isolat yang mampu menimbulkan mortalitas ulat api dengan baik yaitu isolat Bbyf danBbyf24 mencapai 33% dengan tingkat pengenceran 108.",['S1'],,Patogenisitas Empat Isolat Jamur Beauveria bassiana (Bals.) Vuill.  terhadap Ulat Api (Setothosea spp.) di Laboratorium,show,5,,7636,,,,907,2018-06-25 02:26:09,2018-06-25 02:26:09,,,pub,TRUE,none,http://repository.lppm.unila.ac.id/id/eprint/7636,article,['FP24'],"[{'id': None, 'name': {'given': 'W.', 'honourific': None, 'family': 'Anggraini', 'lineage': None}}, {'name': {'lineage': None, 'family': 'Fitriana', 'honourific': None, 'given': 'Yuyun'}, 'id': 'yuyun.fitriana@fp.unila.ac.id'}, {'id': 'agus.muhammad@fp.unila.ac.id', 'name': {'family': 'Hariri', 'honourific': None, 'lineage': None, 'given': 'Agus M.'}}, {'id': 'purjomo@yahoo.com', 'name': {'family': 'Purnomo', 'honourific': None, 'lineage': None, 'given': '.'}}]",Jurnal Agrotek Tropika,2018-05-01 00:00:00.000000000,disk0/00/00/76/36,,,2,Jurusan Agroteknologi Fakultas Pertanian Universitas Lampung,,6,,2337-4993,105-109,,,,,,,,,,,,
7,2020-12-17 07:18:23,archive,"Penelitian ini bertujuan untuk mengetahui karakter empat isolat jamur B.bassiana (Bbyf 22, Bbyf 24, Bbyf, dan BbTa) dalam pertambahan diameter koloni, kerapatan spora, dan perkecambahan spora serta kemampuan tiga isolat jamur B. bassiana dalam menimbulkan mortalitas terhadap ulat api (Setothosea spp.).Penelitian ini dilaksanakan di Laboratorium Bioteknologi Pertanian, Fakultas Pertanian, Universitas Lampung, dari bulan Juli 2016 sampai Januari 2017. Penelitian ini terdiri dari dua set percobaan, yaitu percobaan pertama untuk mengetahui pertambahan diameter koloni, kerapatan spora, dan perkecambahan Spora secara in vitro dengan Rancangan Acak Lengkap (RAL) dan diulang lima kali. Percoban kedua uji patogenisitas jamur B. bassiana terhadap ulat api (Setothosea spp.) dengan Rancangan Acak Lengkap (RAL) dan diulang tiga kali dengan konsentrasi 106, 107, dan 108 . Pengamatan dilakukan terhadap diameter koloni, kerapatan spora, perkecambahan spora, dan mortalitas. Data diuji dengan analisis ragam dan nilai tengah perlakuan diuji dengan uji Duncan Multiple Range Test (DMRT) pada taraf 5%.Keempat isolat jamurB. bassiana memiliki pertambahan koloni, kerapatan spora dan daya berkecambah (viabilitas) yang berbeda-beda, dari keempat jamur tersebut isolat Bbyf 24 yang memiliki pertambahan koloni, kerapatan spora dan daya berkecambah (viabilitas) yang paling baik dibandingkan B. bassiana asal Tanggamus.Tiga isolat B. bassiana dari tiga tingkat pengenceran mampu menimbulkan mortalitas pada ulat api, namun isolat yang mampu menimbulkan mortalitas ulat api dengan baik yaitu isolat Bbyf danBbyf24 mencapai 33% dengan tingkat pengenceran 108.",['S1'],,Patogenisitas Empat Isolat Jamur Beauveria bassiana (Bals.) Vuill. terhadap Ulat Api (Setothosea spp.) di Laboratorium,show,6,,27119,,published,,158,2020-12-17 07:18:23,2020-12-17 07:18:23,"[{'language': 'en', 'mime_type': 'application/pdf', 'eprintid': 27119, 'security': 'public', 'placement': 1, 'format': 'text', 'pos': 1, 'rev_number': 1, 'uri': 'http://repository.lppm.unila.ac.id/id/document/41133', 'main': '2602-6179-1-SM.pdf', 'docid': 41133, 'files': [{'filesize': 664530, 'datasetid': 'document', 'filename': '2602-6179-1-SM.pdf', 'hash': 'cbc6a853f29fc7be8ea68ddf8b92a15d', 'mtime': '2020-12-17 06:43:37', 'hash_type': 'MD5', 'mime_type': 'application/pdf', 'fileid': 243126, 'uri': 'http://repository.lppm.unila.ac.id/id/file/243126', 'objectid': 41133}]}]",,pub,FALSE,public,http://repository.lppm.unila.ac.id/id/eprint/27119,article,['FP24'],"[{'name': {'lineage': None, 'honourific': None, 'family': 'Anggraini', 'given': 'Windari'}, 'id': None}, {'id': 'yuyun.fitriana@fp.unila.ac.id', 'name': {'given': 'Yuyun', 'honourific': None, 'family': 'Fitriana', 'lineage': None}}, {'name': {'given': 'Agus M.', 'honourific': None, 'family': 'Hariri', 'lineage': None}, 'id': 'agus.muhammad@fp.unila.ac.id'}, {'id': 'purjomo@yahoo.com', 'name': {'lineage': None, 'family': 'Purnomo', 'honourific': None, 'given': '.'}}]",Jurnal Agrotek Tropika,2018-05-31 00:00:00.000000000,disk0/00/02/71/19,http://jurnal.fp.unila.ac.id/index.php/JA/article/view/2602/2248,http://dx.doi.org/10.23960/jat.v6i2.2602,2,Jurnal Agrotek Tropika,,6,,2337-4993,105-109,,,,,,,,,,,,
