,status_changed,eprint_status,abstract,subjects,event_dates,title,metadata_visibility,rev_number,event_type,eprintid,event_title,date_type,event_location,userid,lastmod,datestamp,documents,pres_type,ispublished,refereed,full_text_status,uri,type,divisions,creators,publication,date,dir,official_url,id_number,number,publisher,related_url,volume,contact_email,issn,pagerange,corp_creators,place_of_pub,funders,projects,contributors,patent_applicant,pages,keywords,referencetext,note,editors,isbn
31,2021-01-18 01:08:04,archive,Lembar hasil penilaian artikel jurnal ilmiah oleh tiga revewer dari dalam dan luar Unila,['S1'],,"Lembar hasil penilaian artikel, Kemunitas dan tingkat kerusakan tanaman kopi robusta (Coffea canephora var robusta) tua di Kabupaten Tanggamus, Provinsi Lampung",show,7,,27340,,,,738,2021-01-18 01:08:04,2021-01-18 01:08:04,"[{'files': [{'objectid': 41339, 'uri': 'http://repository.lppm.unila.ac.id/id/file/244610', 'fileid': 244610, 'mime_type': 'application/pdf', 'hash_type': 'MD5', 'mtime': '2021-01-15 14:47:33', 'hash': '8ded123413035cdf6656f0760a044122', 'filename': '9. Lembar Hasil Penilaian (Komunitas Nematoda dan Tingkat).pdf', 'datasetid': 'document', 'filesize': 687719}], 'main': '9. Lembar Hasil Penilaian (Komunitas Nematoda dan Tingkat).pdf', 'docid': 41339, 'uri': 'http://repository.lppm.unila.ac.id/id/document/41339', 'rev_number': 1, 'format': 'text', 'pos': 1, 'security': 'public', 'placement': 1, 'eprintid': 27340, 'mime_type': 'application/pdf', 'language': 'en'}]",,unpub,,public,http://repository.lppm.unila.ac.id/id/eprint/27340,other,['FP24'],"[{'name': {'given': 'Ananda Rizki', 'family': 'Lerian', 'honourific': None, 'lineage': None}, 'id': 'ananda.leri09.gmail.com'}, {'id': 'igede.swibawa@fp.unila.ac.id', 'name': {'family': 'Swibawa', 'honourific': None, 'lineage': None, 'given': 'I Gede'}}, {'id': 'nryasin@gmail.com', 'name': {'lineage': None, 'family': 'Yasin', 'honourific': None, 'given': 'Nur'}}, {'name': {'given': 'Titik Nur', 'honourific': None, 'family': 'Aeny', 'lineage': None}, 'id': 'titik.nuraeny@fp.unila.ac.id'}]",,1970-01-01 00:00:00.000002018,disk0/00/02/73/40,,,,Jurusan Agroteknologi FP Unila,,,,,,,,,,,,,,,,,
32,2020-03-06 03:46:37,archive,"Penelitian ini bertujuan untuk mengetahui genus dan populasi nematoda parasit tumbuhan yang dominan serta tingkat kerusakan tanaman kopi robusta (Coffea canephoravar robusta) tua.  Penelitian dilakukan pada bulan Februari  Agustus 
2017, dengan pemilihan desa dilakukan secara acak tetapi beberapa dipilih secara  purposive berdasarkan rekomendasi dari PT Nestle Indonesia di kabupaten Tanggamus.  Nematoda dari tanah diekstraksi menggunakan metode penyaringan bertingkatdan sentrifugasi menggunakan larutan gula sedangkan nematoda dari akar diekstraksi menggunakan metode Baerman yang dimodifikasi.  Nematoda diidentifikasi sampai tingkat genus berdasarkan ciri morfologinya.  Nematoda parasit tumbuhan yang dominan ditentukan berdasarkan Prominence Valuedalam komunitasnya.  Data tingkat kerusakan tanaman, kelimpahan seluruh nematoda, dan kelimpahan nematoda parasit tumbuhan dominan dianalisis ragam dan pemisahan nilai tengah menggunakan uji Beda Nyata Terkecil (BNT) pada taraf  nyata 5%.  Hasil penelitian menunjukkan bahwa ditemukan 37 genus nematoda yang meliputi 22 genus nematoda hidup bebas dan 15 genus nematoda parasit tumbuhan.  Lima genus nematoda parasit tumbuhan yang dominan yaitu Pratylenchus, Paratylenchus, Rotylenchulus, Tetylenchus dan Tylenchus.  Pratylenchus merupakan nematoda parasit tumbuhan yang paling dominan paling tinggi di semua kebun yang disurvai.  Kelimpahan Pratylenchus berkisar 29-84 individu/300cc tanah dan 0-3 individu/ 10 gram akar. Tingkat kerusakan tanaman mutlak (keterjadian)59% - 86%, tingkat kerusakan relatif (keparahan) pada tajuk berkisar 32,76 - 53,45%, dan intensitas kerusakan akar berkisar 25,5 - 70,5 %.",['S1'],,KOMUNITAS NEMATODA DAN TINGKAT KERUSAKAN TANAMAN KOPI ROBUSTA (Coffea canephora varrobusta) TUA DI KABUPATEN TANGGAMUS PROVINSI LAMPUNG,show,6,,18405,,,,738,2020-03-06 03:46:37,2020-03-06 03:46:37,"[{'placement': 1, 'security': 'public', 'eprintid': 18405, 'language': 'en', 'mime_type': 'application/pdf', 'files': [{'uri': 'http://repository.lppm.unila.ac.id/id/file/154806', 'objectid': 31554, 'filename': '15. 2018 Riski et al. 2018. JAT 6 (3)- September 2018.pdf', 'hash': 'a1a5bdb0147bf82dcb4cd6513d490915', 'mtime': '2020-03-05 15:36:08', 'hash_type': 'MD5', 'mime_type': 'application/pdf', 'fileid': 154806, 'filesize': 100434, 'datasetid': 'document'}], 'main': '15. 2018 Riski et al. 2018. JAT 6 (3)- September 2018.pdf', 'docid': 31554, 'uri': 'http://repository.lppm.unila.ac.id/id/document/31554', 'rev_number': 1, 'pos': 1, 'format': 'text'}]",,submitted,TRUE,public,http://repository.lppm.unila.ac.id/id/eprint/18405,article,['FP24'],"[{'name': {'lineage': None, 'honourific': None, 'family': 'Lerian', 'given': 'Ananda Rizki'}, 'id': None}, {'id': 'igswibawa@yahoo.com', 'name': {'given': 'i Gede', 'family': 'Swibawa', 'honourific': None, 'lineage': None}}, {'id': 'nryasin@gmail.com', 'name': {'given': 'Nur', 'family': 'Yasin', 'honourific': None, 'lineage': None}}, {'id': 'titik.nuraeny@fp.unila.ac.id', 'name': {'lineage': None, 'family': 'Aeny', 'honourific': None, 'given': 'Titik Nur'}}]",Jurnal Sylva Lestari,2018-09-01 00:00:00.000000000,disk0/00/01/84/05,https://ojs.unud.ac.id/index.php/agrotrop/article/view/15333,,3,Universitas Lampung,,6,,ISSN 2339-0913,147-153,,,,,,,,,,,,
33,2018-06-04 06:32:21,archive,"Lampung is one of the Province that potential to cacao produce. Stem borer Zeuzera coffeae (Lepidoptera: Cossidae) is one of the pests that often be found, besides Conopomorpha cramerella and Helopelthis sp. Z. coffeae can bore branches and stems it caused xylem damage, plant break easily or plant growth inhibited. The research were conducted from September to October 2017. Sampling was doing at smallholder cocoa plantation in Cipadang Village, Gedongtataan Sub-district, Pesawaran District. Survey was doing to observe pest attacks characteristic, inventory of attacked host, identification of symptoms, and number of fruits. Attack intensity in young plant is higher than in older
plants. In 4 years plants the intensity of attack and damage are 11,34% and 7,73%. While the intensity of attack and damage in the 9 plant years are 7,50% and 5,00%.",['S1'],,"Intensitas Serangan Hama Penggerek Batang Kakao di Perkebunan Rakyat Cipadang, Gedongtataan, Pesawaran",show,7,,6990,,published,,1063,2018-06-04 06:32:21,2018-06-04 06:32:21,"[{'format': 'text', 'pos': 1, 'uri': 'http://repository.lppm.unila.ac.id/id/document/19963', 'rev_number': 2, 'main': 'AIP Poltek  6 (1) 2018.pdf', 'docid': 19963, 'files': [{'filesize': 837122, 'datasetid': 'document', 'mtime': '2018-06-03 12:50:00', 'hash_type': 'MD5', 'filename': 'AIP Poltek  6 (1) 2018.pdf', 'hash': '552a2b9c436493fb3e326dd70d7f40ba', 'fileid': 64001, 'mime_type': 'application/pdf', 'uri': 'http://repository.lppm.unila.ac.id/id/file/64001', 'objectid': 19963}], 'language': 'en', 'mime_type': 'application/pdf', 'content': 'published', 'eprintid': 6990, 'security': 'public', 'placement': 1}]",,pub,TRUE,public,http://repository.lppm.unila.ac.id/id/eprint/6990,article,['FP24'],"[{'name': {'given': 'Puji', 'lineage': None, 'honourific': None, 'family': 'Lestari'}, 'id': 'puji.lestari@fp.unila.ac.id'}, {'name': {'given': '.', 'honourific': None, 'family': 'Purnomo', 'lineage': None}, 'id': 'purjomo@yahoo.com'}]",Jurnal Agro Industri Perkebunan,2018-05-01 00:00:00.000000000,disk0/00/00/69/90,http://jurnal.polinela.ac.id/index.php/AIP/article/view/746,http://dx.doi.org/10.25181/jaip.v6i1.746,1,Politeknik Negeri Lampung,,6,,2548-9259,1-8,['University of Lampung'],,,,,,,,,,,
34,2019-05-16 03:37:44,archive,"Plant disease is one of the reasons that cause the
destruction of plant. It affects plant productivity and quality. Most of the farmers made mistake in cope with this problem because of the lack of knowledge. Expert system is a solution that has been widely used for identifying disease. This paper presents an Android-based expert system to help identifying tomato diseases. Data used in this expert system consist of 16 data of
tomato diseases,  53 data of symptoms, and 20 variety of rules. This paper implements forward chaining and certainty factor method. Forward chaining is used as a reasoning method to get the result of disease identification. Certainty factor is used as a
calculation method to obtain accuracy degree of identification results. Testing has been done through two stages, internal and external. The result from internal testing shows that tomato expert system works properly and fit perfectly in various android devices. External testing is done by giving questionnaire to 44 respondents. The result of questionnaires shows that tomato expert system is categorized as good by them.",['S1'],,"Implementation of Forward Chaining and Certainty
Factor Method on Android-Based Expert System of
Tomato Diseases Identification",show,8,,12966,,published,,579,2019-05-16 03:37:44,2019-05-16 03:37:44,"[{'eprintid': 12966, 'security': 'public', 'placement': 2, 'language': 'en', 'mime_type': 'application/pdf', 'docid': 25950, 'main': 'Fwrd chaing_radix.pdf', 'files': [{'filesize': 1011275, 'datasetid': 'document', 'mtime': '2019-05-16 03:09:51', 'hash_type': 'MD5', 'filename': 'Fwrd chaing_radix.pdf', 'hash': 'c197fb04ad78284a845d4ed572e910a5', 'fileid': 114221, 'mime_type': 'application/pdf', 'uri': 'http://repository.lppm.unila.ac.id/id/file/114221', 'objectid': 25950}], 'format': 'text', 'pos': 2, 'rev_number': 1, 'uri': 'http://repository.lppm.unila.ac.id/id/document/25950'}]",,pub,FALSE,public,http://repository.lppm.unila.ac.id/id/eprint/12966,article,['FP24'],"[{'id': 'kurnia.muludi@fmipa.unila.ac.id', 'name': {'given': 'Kurnia', 'family': 'Muludi', 'honourific': None, 'lineage': None}}, {'name': {'given': 'Radix', 'family': 'Suharjo', 'honourific': None, 'lineage': None}, 'id': 'radix.suharjo@fp.unila.ac.id'}, {'id': 'admi_syarif@yahoo.com', 'name': {'given': 'Admi', 'honourific': None, 'family': 'Syarif', 'lineage': None}}, {'id': None, 'name': {'given': 'Fitria', 'lineage': None, 'family': 'Ramadhani', 'honourific': None}}]",(IJACSA) International Journal of Advanced Computer Science and Applications,1970-01-01 00:00:00.000002018,disk0/00/01/29/66,,,9,,,9,,,451-459,,,,,,,,,,,,
35,2019-09-28 05:46:57,archive,similarity IJACSA_radix,['S1'],,similarity IJACSA_radix,show,9,,14366,,published,,579,2019-09-28 05:46:57,2019-09-28 05:46:57,"[{'language': 'en', 'mime_type': 'application/pdf', 'eprintid': 14366, 'placement': 1, 'security': 'public', 'pos': 1, 'format': 'text', 'rev_number': 1, 'uri': 'http://repository.lppm.unila.ac.id/id/document/27419', 'docid': 27419, 'main': 'Implementation_of_Forward_Chaining_and_Certainty_F.pdf', 'files': [{'uri': 'http://repository.lppm.unila.ac.id/id/file/124638', 'objectid': 27419, 'hash_type': 'MD5', 'mtime': '2019-09-27 04:53:06', 'filename': 'Implementation_of_Forward_Chaining_and_Certainty_F.pdf', 'hash': 'bff20468dcb69ccb3f743b2fa4415e49', 'fileid': 124638, 'mime_type': 'application/pdf', 'filesize': 2881070, 'datasetid': 'document'}]}]",,pub,,public,http://repository.lppm.unila.ac.id/id/eprint/14366,other,['FP24'],"[{'name': {'honourific': None, 'family': 'Muludi', 'lineage': None, 'given': 'Kurnia'}, 'id': 'kurnia.muludi@fmipa.unila.ac.id'}, {'name': {'given': 'Radix', 'lineage': None, 'family': 'Suharjo', 'honourific': None}, 'id': 'radix.suharjo@fp.unila.ac.id'}, {'name': {'family': 'Syarif', 'honourific': None, 'lineage': None, 'given': 'Admi'}, 'id': 'admi_syarif@yahoo.com'}, {'id': None, 'name': {'honourific': None, 'family': 'Ramadhani', 'lineage': None, 'given': 'Fitria'}}]",,2018-09-01 00:00:00.000000000,disk0/00/01/43/66,https://thesai.org/Publications/ViewPaper?Volume=9&Issue=9&Code=IJACSA&SerialNo=57,10.14569/IJACSA.2018.090957,,International Journal of Advanced Computer Science and Applications(IJACSA),,,,,,,,,,,,,,,,,
36,2020-02-17 07:35:12,archive,"Penurunan jumlah ekspor pisang disebabkan oleh kualitas buah pisang yang kurang baik akibat serangan penyakit antraknosa. Hingga saat ini fungisida sintetik yang kurang ramah lingkungan masih digunakan untuk mengendalikan penyakit antraknosa sehingga perlu adanya fungisida alternatif yang lebih ramah lingkungan. Penelitian ini dilaksanakan pada bulan April-Juni
2016 di Laboratorium Hama Penyakit Tanaman, Universitas Lampung. Tujuan penelitian ini adalah untuk mengetahui efektifitas ekstrak daun krinyu dan teki sebagai fungisida nabati dalam menekan pertumbuhan C. musae patogen antraknosa pada pisang. Penelitian ini menggunakan rancangan acak lengkap dengan tujuh perlakuan dan empat ulangan. Perlakuan dibagi menjadi kontrol, krinyu fraksi air, krinyu fraksi alkohol, teki fraksi air, teki fraksi alkohol, krinyu tanpa fraksinasi dan teki tanpa fraksinasi. Selanjutnya dilakukan uji beda nyata terkecil (BNT). Hasil penelitian menunjukkan bahwa perlakuan ekstrak krinyu tanpa fraksinasi lebih efektif menekan pertumbuhan dan pembentukan spora C. musae baik secara in vitro maupun in vivo.

Kata kunci : Colletotrichum musae, krinyu, pisang, teki",['S1'],,EFEKTIFITAS EKSTRAK DAUN KRINYU (Chromolaena odorata) DAN TEKI (Cyperus rotundus L.) TERHADAP PERTUMBUHAN Colletotrichum musae PATOGEN ANTRAKNOSA PADA PISANG (Musa paradisiacal L.),show,6,,18025,,published,,1016,2020-02-17 07:35:12,2020-02-17 07:35:12,"[{'eprintid': 18025, 'placement': 1, 'security': 'public', 'language': 'en', 'mime_type': 'application/pdf', 'docid': 31164, 'main': '2531-5990-1-SM(1).pdf', 'files': [{'datasetid': 'document', 'filesize': 58695, 'mime_type': 'application/pdf', 'fileid': 151988, 'hash': '783b0d8d1b6d7f6152db9cbc3d2e68a1', 'filename': '2531-5990-1-SM(1).pdf', 'hash_type': 'MD5', 'mtime': '2020-02-17 07:27:18', 'objectid': 31164, 'uri': 'http://repository.lppm.unila.ac.id/id/file/151988'}], 'pos': 1, 'format': 'text', 'rev_number': 1, 'uri': 'http://repository.lppm.unila.ac.id/id/document/31164'}]",,pub,TRUE,public,http://repository.lppm.unila.ac.id/id/eprint/18025,article,['FP24'],"[{'id': None, 'name': {'family': 'Nur Muhammad', 'honourific': None, 'lineage': None, 'given': 'Yanuar'}}, {'id': 'efri.1960@fp.unila.ac.id', 'name': {'given': 'Efri', 'lineage': None, 'honourific': None, 'family': 'Efri'}}, {'id': 'radix.suharjo@fp.unila.ac.id', 'name': {'given': 'Radix', 'family': 'Suharjo', 'honourific': None, 'lineage': None}}]",Jurnal Agrotek Tropika,1970-01-01 00:00:00.000002018,disk0/00/01/80/25,,,1,Jurnal Agrotek Tropika,,6,,2337-4993,,['Universitas Lampung'],,,,,,,,,,,
37,2018-06-25 02:24:48,archive,"Diamond back moth (Plutella xylostella) [Lepidoptera: Plutellalidae] is the most important pest of Brasisca vegetable in many part of area in Indonesia. Pest control of this pest has been relied on the use of synthetic insecticide. However prolog use of insecticide cause ecological and economical problems. There is a need for pest control that are sustainable and eviromentally
sound. The use of natural (botanical insecticide) such as Ageratum conyzoides is expected to solve that problem. The objective of this research was to test the capability of goatweed suspension to cause mortality P. xylostella larvae and to measure toxicity level (LC50 and LT50) of Ageratum extract. This research was conduched during Juli 2016- February 2017 in green house and laboratory. The results indicated that all of concentration of goatweed (1-5%) was able to cause mortality on P. xylostella larvae. The lethal concentration for 50% mortality (LC50) value was 2,0254%. While the time need to kill 50% of
P. xylostella larva were: 33.31 h, 20.68 h,  21.09 h, 12.65 h, 10.86 h treated by concentration of: 1%, 2%, 3%, 4% and 5% respectively. This study indicated the potential use of Ageratum extract to contol P.xylostella.",['S1'],,"UJI POTENSI DAUN BABADOTAN (Ageratum conyzoides L.) SEBAGAI
INSEKTISIDA BOTANI TERHADAP HAMA (Plutella xylostella L.)
DI LABORATORIUM",show,7,,7605,,published,,1063,2018-06-25 02:24:48,2018-06-25 02:24:48,"[{'uri': 'http://repository.lppm.unila.ac.id/id/document/20655', 'rev_number': 2, 'pos': 1, 'format': 'text', 'files': [{'uri': 'http://repository.lppm.unila.ac.id/id/file/68419', 'objectid': 20655, 'filename': 'J Agrotek Vol 6 No. 2  Mei2018,91-98.pdf', 'hash': '72c94933e41509d5c4949bd990f260ec', 'hash_type': 'MD5', 'mtime': '2018-06-23 15:15:45', 'mime_type': 'application/pdf', 'fileid': 68419, 'filesize': 820878, 'datasetid': 'document'}], 'docid': 20655, 'main': 'J Agrotek Vol 6 No. 2  Mei2018,91-98.pdf', 'content': 'published', 'language': 'en', 'mime_type': 'application/pdf', 'placement': 1, 'security': 'public', 'eprintid': 7605}]",,pub,TRUE,public,http://repository.lppm.unila.ac.id/id/eprint/7605,article,['FP24'],"[{'id': None, 'name': {'given': '.', 'honourific': None, 'family': 'Nurhudiman', 'lineage': None}}, {'id': 'rosma.hasibuan@fp.unila.ac.id', 'name': {'given': 'Rosma', 'lineage': None, 'honourific': None, 'family': 'Hasibuan'}}, {'name': {'honourific': None, 'family': 'Hariri', 'lineage': None, 'given': 'Agus M.'}, 'id': 'agus.muhammad@fp.unila.ac.id'}, {'id': 'purjomo@yahoo.com', 'name': {'given': '.', 'lineage': None, 'family': 'Purnomo', 'honourific': None}}]",Jurnal Agrotek Tropika,2018-05-01 00:00:00.000000000,disk0/00/00/76/05,http://jurnal.fp.unila.ac.id/index.php/JA/,,2,Jurnal Agrotek Tropika,,6,,2337-4993,91-98,['University of Lampung'],,,,,,,,,,,
38,2018-06-25 02:26:06,archive,"Diamond back moth (Plutella xylostella) [Lepidoptera: Plutellidae] is the most important pest of  Brasisca vegetable in many part of area in Indonesia. Pest control of this pest has been relied on the use of synthetic insecticide. However prolog use of insecticide cause ecological and economical problems. There is a need for pest control that are sustainable and environmentally sound. The use of natural (botanical insecticide) such as Ageratum conyzoides is expected to solve that problem. The objective of this research was to test the capability of goatweed suspension to cause mortality P. xylostella larvae and to   measure toxicity level (LC50 and LT50) of Ageratum extract. This research was conducted during Juli 2016- February 2017 in  green house and laboratory. The results indicated that all of concentration of goatweed (1-5%) was able to cause mortality on  P. xylostella larvae. The lethal concentration for 50% mortality (LC50) value was 2,0254%. While the time need to kill 50% of  P. xylostella larva were: 33.31 h, 20.68 h,  21.09 h, 12.65 h, 10.86 h treated by concentration of: 1%, 2%, 3%, 4% and 5%  respectively. This study indicated the potential use of Ageratum extract to contol P. xylostella.",['S1'],,"Uji Potensi Daun Babadotan (Ageratum conyzoides L.) sebagai
Insektisida Botani terhadap Hama Plutella xylostella L.
di Laboratorium",show,6,,7634,,,,907,2018-06-25 02:26:06,2018-06-25 02:26:06,,,pub,TRUE,none,http://repository.lppm.unila.ac.id/id/eprint/7634,article,['FP24'],"[{'name': {'lineage': None, 'honourific': None, 'family': 'Nurhudiman', 'given': 'Nurhudiman'}, 'id': None}, {'name': {'given': 'Rosma', 'family': 'Hasibuan', 'honourific': None, 'lineage': None}, 'id': 'rosma.hasibuan@fp.unila.ac.id'}, {'name': {'honourific': None, 'family': 'Hariri', 'lineage': None, 'given': 'Agus M.'}, 'id': 'agus.muhammad@fp.unila.ac.id'}, {'name': {'given': 'Purnomo', 'lineage': None, 'family': 'Purnomo', 'honourific': None}, 'id': 'purjomo@yahoo.com'}]",Jurnal Agrotek Tropika,2018-05-01 00:00:00.000000000,disk0/00/00/76/34,,,2,Jurusan Agroteknologi Fakultas Pertanian Universitas Lampung,,6,,2337-4993,91-98,,,,,,,,,,,,
39,2019-04-02 09:04:20,archive,"This study was aimed to reveal the identity of Talaromyces spp. and their ability as entomopathogen, antagonist, phosphate solubilizing fungi, chitin degrading fungi, and Plant Growth Promoting Fungi (PGPF). Six isolates of Talaromyces spp. were used in this study. Those all isolates were obtained from three different plants rhizosphere, namely pineapple (AS-2 UNILA, AS-3 UNILA, AS-4 UNILA, AS-5 UNILA), corn (AS-8 UNILA), and chili (AS-11 UNILA). Identification was performed on the basis of morphological characteristics and molecular technique using sequence analysis of Internal Transcribed Spacer (ITS) region. Ability as entomopathogen was investigated on cocoa mirid bug (Helopeltis spp.). Antagonist test was conducted using dual culture method against Phytophtora sp. which was isolated from cocoa pod rot symptom. Ability as phosphate solubilizing fungi and chitin degrading fungi was conducted on pikovskaya and chitin agar medium, respectively. Ability as PGPF was achieved using cucumber plant as indicator plant. The data collected in this study were identity of the isolates, mortality of cocoa mirid bug, percentage of inhibition againt Phytophtora sp., area of the clear (halo) zone around the colony which was grown on pikovskaya and chitin agar media, plant height, wet weight of shoot, greenish leaves and percentage of shoot N-content. Based on the morphological characteristics, it was confirmed that all the isolates were in the group of Talaromyces. Sequence analysis result of ITS region (ITS1-ITS4) revealed that all the isolates were placed in the group of Talaromyces sayulitensis. All the isolates showed capability as entomopathogen (16.67-46.67% of mortality), antagonist (56.03-74.57% of inhibition), phosphate degrading fungi (27.40-35.80 mm2 of clear (halo) zone area) and chitin degrading fungi (17.30-24.30 mm2 of clear (halo) zone area). Three isolates showed capability as PGPF (AS4-UNILA, AS8-UNILA and AS11-UNILA) but not for the other 3 isolates (AS2-UNILA, AS3-UNILA and AS5-UNILA).",['S1'],3-5 December 2018,Study of Talaromyces spp. with Multiple Beneficial Task,show,9,conference,11064,"Inter Academia Asia 2018, The 5th Conference",,Shizuoka Jepang,158,2019-04-02 09:04:20,2019-04-02 09:04:20,"[{'rev_number': 1, 'uri': 'http://repository.lppm.unila.ac.id/id/document/24058', 'format': 'text', 'pos': 1, 'files': [{'fileid': 101193, 'mime_type': 'application/pdf', 'hash_type': 'MD5', 'mtime': '2019-04-02 07:28:22', 'hash': '7fed9ec325d553dccc46e5aafa5cdcaf', 'filename': 'shizuoka presentation Desember 2018.pdf', 'datasetid': 'document', 'filesize': 1040396, 'objectid': 24058, 'uri': 'http://repository.lppm.unila.ac.id/id/file/101193'}], 'docid': 24058, 'main': 'shizuoka presentation Desember 2018.pdf', 'language': 'en', 'mime_type': 'application/pdf', 'security': 'public', 'placement': 1, 'eprintid': 11064}]",speech,unpub,FALSE,public,http://repository.lppm.unila.ac.id/id/eprint/11064,conference_item,['FP24'],"[{'id': None, 'name': {'lineage': None, 'honourific': None, 'family': 'Pangesti', 'given': 'Ika Rachma'}}, {'name': {'given': 'Radix', 'lineage': None, 'family': 'Suharjo', 'honourific': None}, 'id': 'radix.suharjo@fp.unila.ac.id'}, {'name': {'family': 'Fitriana', 'honourific': None, 'lineage': None, 'given': 'Yuyun'}, 'id': 'yuyun.fitriana@fp.unila.ac.id'}, {'id': None, 'name': {'given': 'Eryka', 'honourific': None, 'family': 'Merdiana', 'lineage': None}}, {'name': {'given': 'Lita Theresia', 'honourific': None, 'family': 'Pasaribu', 'lineage': None}, 'id': None}, {'name': {'honourific': None, 'family': 'Swibawa', 'lineage': None, 'given': 'I Gede'}, 'id': 'igede.swibawa@fp.unila.ac.id'}, {'id': 'kfhidayat@gmail.com', 'name': {'given': 'Kuswanta Futas', 'lineage': None, 'family': 'Hidayat', 'honourific': None}}]",,2018-12-04 00:00:00.000000000,disk0/00/01/10/64,,,,,,,,,25-25,,,,,,,,,,,,
