,status_changed,eprint_status,abstract,subjects,event_dates,title,metadata_visibility,rev_number,event_type,eprintid,event_title,date_type,event_location,userid,lastmod,datestamp,documents,pres_type,ispublished,refereed,full_text_status,uri,type,divisions,creators,publication,date,dir,official_url,id_number,number,publisher,related_url,volume,contact_email,issn,pagerange,corp_creators,place_of_pub,funders,projects,contributors,patent_applicant,pages,keywords,referencetext,note,editors,isbn
15,2019-02-23 14:16:45,archive,Beras merupakan makanan pokok bangsa Indonesia. Kebutuhan beras senantiasa meningkat dari tahun ke tahun seiring dengan bertambahnya jumlah penduduk.  Namun untuk budidayanya seringkali dihadapkan kepada ketidaktersediaan subsidi pupuk NPK anorganik. Oleh karena itu diperkenalkan budidaya padi secara organik. Selain untuk pemenuhan pupuk tanpa tergantung kepada pabrik kimia maka ada pula manfaat positif lainnya yaitu mampu melakukan efisiensi biaya produksi dan perbaikan mutu produk dan lingkungan tanam.,['S1'],"Rabu, 14 November 2018",Arti Penting Budidaya Padi  Organik yang Berpotensi Hasil Tinggi di Kelurahan Rajabasa Jaya Kecamatan Rajabasa Kota Bandar Lampung,show,10,other,10832,Seminar Nasional Hasil-Hasil Pengabdian Kepada Masyarakat 2018,published,Hotel Bukit Randu Bandar Lampung,330,2019-02-23 14:16:45,2019-02-23 14:16:45,"[{'rev_number': 1, 'uri': 'http://repository.lppm.unila.ac.id/id/document/23844', 'pos': 1, 'format': 'text', 'files': [{'uri': 'http://repository.lppm.unila.ac.id/id/file/99754', 'objectid': 23844, 'hash_type': 'MD5', 'mtime': '2019-02-23 07:13:30', 'filename': 'PKM 2018.pdf', 'hash': '95c5a3b0dbb333a0904533b0c399ebef', 'fileid': 99754, 'mime_type': 'application/pdf', 'filesize': 2771249, 'datasetid': 'document'}], 'main': 'PKM 2018.pdf', 'docid': 23844, 'language': 'en', 'mime_type': 'application/pdf', 'placement': 1, 'security': 'public', 'eprintid': 10832}]",paper,pub,TRUE,public,http://repository.lppm.unila.ac.id/id/eprint/10832,conference_item,['FP24'],"[{'name': {'family': 'Dirmawati', 'honourific': None, 'lineage': None, 'given': 'Suskandini R'}}, {'name': {'honourific': None, 'family': 'Nuryasin', 'lineage': None, 'given': 'Nuryasin'}}, {'name': {'lineage': None, 'family': 'Sunyoto', 'honourific': None, 'given': 'Sunyoto'}}, {'name': {'given': 'Sri', 'family': 'Yusnaini', 'honourific': None, 'lineage': None}}, {'name': {'family': 'Wibowo', 'honourific': None, 'lineage': None, 'given': 'Lestari'}}]",,2018-12-20 00:00:00.000000000,disk0/00/01/08/32,http://lppm.unila.ac.id/semnaspkm2018/,,,,"[{'url': 'https://drive.google.com/file/d/1hFe6ZxdVh4eIeXf7vI4ZNWv12KlWugtY/view', 'type': 'org'}]",,,,437-439,"['Jurusan Proteksi Tanaman Fakultas Pertanian Universitas Lampung', 'Jurusan Agroteknologi Fakultas Pertanian Universitas Lampung']",,['LPPM Universitas Lampung'],['Seminar Nasional Hasil-Hasil Pengabdian Kepada Masyarakat'],"[{'name': {'lineage': None, 'honourific': None, 'family': 'Dirmawati', 'given': 'Suskandini R'}, 'type': 'http://www.loc.gov/loc.terms/relators/AUT'}, {'name': {'lineage': None, 'family': 'Nuryasin', 'honourific': None, 'given': 'Nuryasin'}, 'type': 'http://www.loc.gov/loc.terms/relators/AUT'}, {'name': {'given': 'Sunyoto', 'lineage': None, 'family': 'Sunyoto', 'honourific': None}, 'type': 'http://www.loc.gov/loc.terms/relators/AUT'}, {'type': 'http://www.loc.gov/loc.terms/relators/AUT', 'name': {'lineage': None, 'honourific': None, 'family': 'Yusnaini', 'given': 'Sri'}}, {'name': {'honourific': None, 'family': 'Wibowo', 'lineage': None, 'given': 'Lestari'}, 'type': 'http://www.loc.gov/loc.terms/relators/AUT'}]",,,,,,,
16,2019-02-23 14:16:50,archive,"Fusarium oxysporum penyebab penyakit moler yang dapat mengurangi pertumbuhan bawang merah hingga 50%. Upaya pengendalian penyakit moler selama ini dilakukan dengan
mengumpulkan dan memusnahkan tanaman sakit kemudian menyulam pertanaman.    Penggunaan varietas tahan penyakit moler seperti varietas Sumenep kurang diminati petani karena umurnya panjang dan produksinya rendah. Pencarian alternatif pengendalian yang dapat dikembangkan
adalah dengan penggunaan isolat Plant Growth Promoting Bacteria sebagai pengendali hayati suatu patogen sekaligus penyubur pertumbuhan tanaman yang  juga menyebabkan arthropoda serangga hama tidak menyukai warna hijaunya.  Tujuan penelitian ini adalah  mengetahui pengaruh aplikasi  Pseudomonas fluorescens terhadap intensitas penyakit moler, dan mengetahui pengaruh aplikasi  Pseudomonas fluorescens terhadap keragaman serangga pada tanaman bawang merah. Penelitian ini  dilakukan pada bulan April 2018 sampai dengan bulan Agustus 2018 di Labarotarium Hama dan Penyakit Tumbuhan dan di  Laboratorium Lapang Terpadu Fakultas Pertanian, Universitas Lampung. Percobaan dalam Rancangan Acak Kelompok Lengkap dengan empat perlakuan dan tiga ulangan.  Perbedaan perlakuan dianalisis ragam dan
dilanjutkan dengan Uji Beda Nyata Terkecil taraf kepercayaan 95%. pengaruh aplikasi Pseudomonas fluorescens dapat menekan keterjadian penyakit moler dan aplikasi  Pseudomonas fluorescens memberikan indeks keragaman serangga yang rendah pada pertanaman bawang merah. 

Kata Kunci: Arthropoda, Bawang Merah,Moler, Plant Growth Promoting Bacteria",['S1'],13 November 2018,Studi Kemelimpahan Arthropoda Dan Keterjadian Penyakit Moler Pada Bawang Merah Terdampak Plant Growth Promoting Bacteria,show,10,other,10833,Seminar Hasil Penelitian Tahun 2018,published,"Hotel Bukit Randu, Bandar Lampung",330,2019-02-23 14:16:50,2019-02-23 14:16:50,"[{'rev_number': 1, 'uri': 'http://repository.lppm.unila.ac.id/id/document/23845', 'pos': 1, 'format': 'text', 'files': [{'hash': 'e10a1c950b65ad1ff42d6623c552cf40', 'filename': 'Semnas Penelitian 2018.pdf', 'mtime': '2019-02-23 07:32:31', 'hash_type': 'MD5', 'mime_type': 'application/pdf', 'fileid': 99764, 'filesize': 2075260, 'datasetid': 'document', 'uri': 'http://repository.lppm.unila.ac.id/id/file/99764', 'objectid': 23845}], 'main': 'Semnas Penelitian 2018.pdf', 'docid': 23845, 'mime_type': 'application/pdf', 'language': 'en', 'placement': 1, 'security': 'public', 'eprintid': 10833}]",paper,pub,TRUE,public,http://repository.lppm.unila.ac.id/id/eprint/10833,conference_item,['FP24'],"[{'id': 'suskandini.ratih@fp.unila.ac.id', 'name': {'given': 'Suskandini R.', 'lineage': None, 'family': 'Dirmawati', 'honourific': None}}, {'name': {'lineage': None, 'honourific': None, 'family': 'Wibowo', 'given': 'Lestari'}, 'id': 'lestari.wibowo@fp.unila.ac.id'}, {'name': {'lineage': None, 'family': 'Hariri', 'honourific': None, 'given': 'Agus M.'}, 'id': 'agus.muhammad@fp.unila.ac.id'}, {'id': None, 'name': {'given': 'Purnomo', 'lineage': None, 'family': 'Purnomo', 'honourific': None}}, {'id': None, 'name': {'honourific': None, 'family': 'Suharjo', 'lineage': None, 'given': 'Radix'}}, {'name': {'given': 'Bagus Rizki', 'honourific': None, 'family': 'Ramadhan', 'lineage': None}, 'id': None}, {'name': {'lineage': None, 'honourific': None, 'family': 'Natalia', 'given': 'Desta'}, 'id': None}]",,2018-12-20 00:00:00.000000000,disk0/00/01/08/33,http://lppm.unila.ac.id/semnaslit2018/,,,,"[{'type': 'org', 'url': 'https://drive.google.com/file/d/1rEKXnMLZjDD5yzMUW6UfWfnPHheDm-mo/view'}]",,,,390-401,['Jurusan Proteksi Tanaman Fakultas Pertanian Universitas Lampung'],,['LPPM Universitas Lampung'],['Seminar Hasil Penelitian Tahun 2018'],"[{'name': {'given': 'Suskandini R', 'lineage': None, 'honourific': None, 'family': 'Dirmawati'}, 'type': 'http://www.loc.gov/loc.terms/relators/AUT'}, {'type': 'http://www.loc.gov/loc.terms/relators/AUT', 'name': {'given': 'Lestari', 'family': 'Wibowo', 'honourific': None, 'lineage': None}}, {'type': 'http://www.loc.gov/loc.terms/relators/AUT', 'name': {'given': 'Agus M', 'honourific': None, 'family': 'Hariri', 'lineage': None}}, {'type': 'http://www.loc.gov/loc.terms/relators/AUT', 'name': {'given': 'Purnomo', 'honourific': None, 'family': 'Purnomo', 'lineage': None}}, {'name': {'family': 'Suharjo', 'honourific': None, 'lineage': None, 'given': 'Radix'}, 'type': 'http://www.loc.gov/loc.terms/relators/AUT'}, {'type': 'http://www.loc.gov/loc.terms/relators/AQT', 'name': {'given': 'Bagus Rizki', 'honourific': None, 'family': 'Ramadhan', 'lineage': None}}, {'name': {'lineage': None, 'family': 'Natalia', 'honourific': None, 'given': 'Desta'}, 'type': 'http://www.loc.gov/loc.terms/relators/AQT'}]",,,,,,,
17,2019-05-02 04:08:05,archive,"Kubis (Brassica oleracea) merupakan salah satu jenis tanaman sayuran penting yang mempunyai nilai gizi yang tinggi. Serangan organisme pengganggu tanaman (OPT) merupakan salah satu faktor pembatas hasil dan produksi sayuran kubis. Serangga Crocidolomia binotalis Zell. (Lepidoptera: Pyralidae) merupakan hama tanaman kubis karena dapat merusak sehingga menyebabkan gagal panen. Tujuan penelitian ini adalah untuk mengetahui pengaruh ekstrak daun mimba, daun mengkudu dan babadotan terhadap mortalitas larva C. binotalis. Penelitian ini disusun dalam Rancangan Acak Kelompok (RAK) dengan perlakuan kontrol (A1), mimba 2,5% (Mi1), mimba 5% (Mi2), mengkudu 2,5% (Me1), mengkudu 5% (Me2), babadotan 2,5%, (Ba1) dan babadotan 5% (Ba2). Hasil penelitian menunjukkan bahwa aplikasi insektisida botani (daun mimba, daun mengkudu
dan babadotan) mampu menyebabkan kematian larva C. binotalis pada semua perlakuan yang diuji. Lebih lanjut, semua perlakuan berpengaruh sangat nyata terhadap mortalitas larva C. binotalis.  
Kata kunci : kubis, Crocidolomia binotalis, daun mimba, daun mengkudu dan babadotan.",['S1'],,"Uji Efikasi Ekstrak Daun Mimba, Daun Mengkudu dan  Babadotan terhadap Mortalitas Larva Crocidolomia  binotalis Zell. di Laboratorium",show,5,,11450,,,,907,2019-05-02 04:08:05,2019-05-02 04:08:05,,,pub,TRUE,none,http://repository.lppm.unila.ac.id/id/eprint/11450,article,['FP24'],"[{'id': 'wiwin_ervinatun@yahoo.com', 'name': {'given': 'Wiwin', 'honourific': None, 'family': 'Ervinatun', 'lineage': None}}, {'id': None, 'name': {'given': 'Rosma', 'family': 'Hasibuan', 'honourific': None, 'lineage': None}}, {'name': {'given': 'Agus M.', 'honourific': None, 'family': 'Hariri', 'lineage': None}, 'id': 'agus.muhammad@fp.unila.ac.id'}, {'id': 'lestari.wibowo@fp.unila.ac.id', 'name': {'honourific': None, 'family': 'Wibowo', 'lineage': None, 'given': 'Lestari'}}]",Jurnal Agrotek Tropika,1970-01-01 00:00:00.000002018,disk0/00/01/14/50,http://jurnal.fp.unila.ac.id/index.php/JA,,3,Jurnal Agrotek Tropika,,6,,2337-4993,161-167,,,,,,,,,,,,
18,2019-05-02 04:08:05,archive,"Kubis (Brassica oleracea) merupakan salah satu jenis tanaman sayuran penting yang mempunyai nilai gizi yang tinggi. Serangan organisme pengganggu tanaman (OPT) merupakan salah satu faktor pembatas hasil dan produksi sayuran kubis. Serangga Crocidolomia binotalis Zell. (Lepidoptera: Pyralidae) merupakan hama tanaman kubis karena dapat merusak sehingga menyebabkan gagal panen. Tujuan penelitian ini adalah untuk mengetahui pengaruh ekstrak daun mimba, daun mengkudu dan babadotan terhadap mortalitas larva C. binotalis. Penelitian ini disusun dalam Rancangan Acak Kelompok (RAK) dengan perlakuan kontrol (A1), mimba 2,5% (Mi1), mimba 5% (Mi2), mengkudu 2,5% (Me1), mengkudu 5% (Me2), babadotan 2,5%, (Ba1) dan babadotan 5% (Ba2). Hasil penelitian menunjukkan bahwa aplikasi insektisida botani (daun mimba, daun mengkudu
dan babadotan) mampu menyebabkan kematian larva C. binotalis pada semua perlakuan yang diuji. Lebih lanjut, semua perlakuan berpengaruh sangat nyata terhadap mortalitas larva C. binotalis.  
Kata kunci : kubis, Crocidolomia binotalis, daun mimba, daun mengkudu dan babadotan",['S1'],,"Uji Efikasi Ekstrak Daun Mimba, Daun Mengkudu dan  Babadotan terhadap Mortalitas Larva Crocidolomia  binotalis Zell. di Laboratorium",show,5,,11451,,,,907,2019-05-02 04:08:05,2019-05-02 04:08:05,,,pub,TRUE,none,http://repository.lppm.unila.ac.id/id/eprint/11451,article,['FP24'],"[{'name': {'lineage': None, 'honourific': None, 'family': 'Ervinatun', 'given': 'Wiwin'}, 'id': 'wiwin_ervinatun@yahoo.com'}, {'name': {'given': 'Rosma', 'lineage': None, 'honourific': None, 'family': 'Hasibuan'}, 'id': 'rosma.hasibuan@fp.unila.ac.id'}, {'id': 'agus.muhammad@fp.unila.ac.id', 'name': {'lineage': None, 'honourific': None, 'family': 'Hariri', 'given': 'Agus M.'}}, {'name': {'given': 'Lestari', 'lineage': None, 'family': 'Wibowo', 'honourific': None}, 'id': 'lestari.wibowo@fp.unila.ac.id'}]",Jurnal Agrotek Tropika,1970-01-01 00:00:00.000002018,disk0/00/01/14/51,http://jurnal.fp.unila.ac.id/index.php/JA,,3,Jurnal Agrotek Tropika,,6,,2337-4993,161-167,,,,,,,,,,,,
19,2019-05-02 03:57:48,archive,"Kubis (Brassica oleracea) merupakan salah satu jenis tanaman sayuran penting yang mempunyai nilai gizi yang tinggi. Serangan organisme pengganggu tanaman (OPT) merupakan salah satu faktor pembatas hasil dan produksi sayuran kubis. Serangga Crocidolomia binotalis Zell. (Lepidoptera: Pyralidae) merupakan hama tanaman kubis karena dapat merusak sehingga menyebabkan gagal panen. Tujuan penelitian ini adalah untuk mengetahui pengaruh ekstrak daun mimba, daun mengkudu dan babadotan terhadap mortalitas larva C. binotalis. Penelitian ini disusun dalam Rancangan Acak Kelompok (RAK) dengan perlakuan kontrol (A1), mimba 2,5% (Mi1), mimba 5% (Mi2), mengkudu 2,5% (Me1), mengkudu 5% (Me2), babadotan 2,5%, (Ba1) dan babadotan 5% (Ba2). Hasil penelitian menunjukkan bahwa aplikasi insektisida botani (daun mimba, daun mengkudu
dan babadotan) mampu menyebabkan kematian larva C. binotalis pada semua perlakuan yang diuji. Lebih lanjut, semua perlakuan berpengaruh sangat nyata terhadap mortalitas larva C. binotalis.  

Kata kunci : kubis, Crocidolomia binotalis, daun mimba, daun mengkudu dan babadotan",['S1'],,"Uji Efikasi Ekstrak Daun Mimba, Daun Mengkudu dan  Babadotan terhadap Mortalitas Larva Crocidolomia  binotalis Zell. di Laboratorium",show,6,,11480,,,,907,2019-05-02 03:57:48,2019-05-02 03:57:48,"[{'main': 'JAgrotekTropika-6(3)-Sept2018-Ervinatun etal.pdf', 'docid': 24476, 'files': [{'fileid': 104201, 'mime_type': 'application/pdf', 'mtime': '2019-05-01 05:16:17', 'hash_type': 'MD5', 'hash': '10aaa1a6e7398ecb6830426cc4266e2a', 'filename': 'JAgrotekTropika-6(3)-Sept2018-Ervinatun etal.pdf', 'datasetid': 'document', 'filesize': 193837, 'objectid': 24476, 'uri': 'http://repository.lppm.unila.ac.id/id/file/104201'}], 'pos': 1, 'format': 'text', 'uri': 'http://repository.lppm.unila.ac.id/id/document/24476', 'rev_number': 1, 'eprintid': 11480, 'placement': 1, 'security': 'public', 'language': 'en', 'mime_type': 'application/pdf'}]",,pub,TRUE,public,http://repository.lppm.unila.ac.id/id/eprint/11480,article,['FP24'],"[{'id': 'wiwin_ervinatun@yahoo.com', 'name': {'given': 'Wiwin', 'honourific': None, 'family': 'Ervinatun', 'lineage': None}}, {'name': {'honourific': None, 'family': 'Hasibuan', 'lineage': None, 'given': 'Rosma'}, 'id': 'rosma.hasibuan@fp.unila.ac.id'}, {'name': {'family': 'Hariri', 'honourific': None, 'lineage': None, 'given': 'Agus M.'}, 'id': 'agus.muhammad@fp.unila.ac.id'}, {'name': {'family': 'Wibowo', 'honourific': None, 'lineage': None, 'given': 'Lestari'}, 'id': 'lestari.wibowo@fp.unila.ac.id'}]",Jurnal Agrotek Tropika,1970-01-01 00:00:00.000002018,disk0/00/01/14/80,http://jurnal.fp.unila.ac.id/index.php/JA/article/view/2924/2369,,3,Jurnal Agrotek Tropika,,6,,2337-4993,161-167,,,,,,,,,,,,
20,2018-11-06 03:08:17,archive,"Penelitian ini bertujuan untuk mengetahui kemampuan dan identitas jamur Aspergillus spp. sebagai antagonis, entomopatogen, pemacu pertumbuhan tanaman, pelarut fosfat dan pereduksi kitin. Sebanyak 4 isolat jamur Aspergillus spp. (AS1, AS6, AS7 dan AS9) digunakan dalam penelitian ini. Uji kemampuan sebagai antagonis dilakukan terhadap jamur Phytophtora sp. yang diisolasi dari buah kakao bergejala busuk. Pengujian kemampuan sebagai entomopatogen dilakukan terhadap hama pencucuk buah kakao (Helopeltis sp.). Kemampaun sebagai PGPF diuji menggunakan tanaman timun sebagai indikator. Uji kemampuan sebagai pelarut fosfat dan pereduksi kitin dilakukan menggunakan media pikovskaya dan kitin agar. Identifikasi dilakukan berdasarkan pengamatan morfologi dan analisis sekuen daerah ITS1 dan ITS4. Hasil penelitian menunjukkan bahwa 1 isolat (AS1) mempunyai semua peranan yang diuji  (antagonis, entomopatogen pemacu pertumbuhan tanaman, pelarut fosfat dan pereduksi kitin). Sebanyak 1 isolat (AS6), mempunyai semua peranan, kecuali sebagai pemacu pertumbuhan tanaman. Sebanyak 2 isolat (AS7 dan AS9) mempunyai semua peranan kecuali sebagai pelarut fosfat. Hasil pengamatan morfologi menunjukkan bahwa keempat isolat tersebut merupakan jamur Aspergillus sp.. Hasil analisis sekuen daerah ITS1 dan ITS4 menunjukkan bahwa 1 isolat (AS1) merupakan Aspergillus flavus dan 3 isolat yang lain (AS6, AS7 dan AS9) merupakan Aspergillus oryzae.",['S1'],6 Oktober 2018,Karakterisasi dan Identifikasi Jamur Aspergillus spp. dengan Multi Peranan yang Menguntungkan,show,12,conference,9541,Seminar Nasional IX PFI Joglosemar,,Universitas Gadjah Mada Yogyakarta,158,2018-11-06 03:08:17,2018-11-06 03:08:17,"[{'uri': 'http://repository.lppm.unila.ac.id/id/document/22578', 'rev_number': 1, 'format': 'text', 'pos': 1, 'files': [{'hash_type': 'MD5', 'mtime': '2018-11-05 23:13:12', 'hash': '6fb566485b19e212c25ab039c16373ca', 'filename': 'PFI Jogja Yuyun 2018 Full.pdf', 'fileid': 90809, 'mime_type': 'application/pdf', 'filesize': 1613208, 'datasetid': 'document', 'uri': 'http://repository.lppm.unila.ac.id/id/file/90809', 'objectid': 22578}], 'main': 'PFI Jogja Yuyun 2018 Full.pdf', 'docid': 22578, 'mime_type': 'application/pdf', 'language': 'en', 'security': 'public', 'placement': 1, 'eprintid': 9541}]",speech,pub,FALSE,public,http://repository.lppm.unila.ac.id/id/eprint/9541,conference_item,['FP24'],"[{'id': 'yuyun.fitriana@fp.unila.ac.id', 'name': {'given': 'Yuyun', 'lineage': None, 'honourific': None, 'family': 'Fitriana'}}, {'id': 'radix.suharjo@fp.unila.ac.id', 'name': {'given': 'Radix', 'lineage': None, 'honourific': None, 'family': 'Suharjo'}}, {'name': {'given': 'Eryka', 'family': 'Merdiana', 'honourific': None, 'lineage': None}, 'id': None}, {'name': {'given': 'Ika Rachma', 'honourific': None, 'family': 'Pangesti', 'lineage': None}, 'id': None}, {'name': {'given': 'Lita Theresia', 'lineage': None, 'honourific': None, 'family': 'Pasaribu'}, 'id': None}, {'id': 'fx.susilo@fp.unila.ac.id', 'name': {'given': 'FX', 'lineage': None, 'honourific': None, 'family': 'Susilo'}}, {'name': {'lineage': None, 'family': 'Swibawa', 'honourific': None, 'given': 'I Gede'}, 'id': 'igede.swibawa@fp.unila.ac.id'}, {'id': 'kfhidayat@gmail.com', 'name': {'given': 'Kuswanta Futas', 'lineage': None, 'honourific': None, 'family': 'Hidayat'}}, {'name': {'given': '.', 'honourific': None, 'family': 'Purnomo', 'lineage': None}, 'id': 'purjomo@yahoo.com'}, {'name': {'lineage': None, 'honourific': None, 'family': 'Solikhin', 'given': '.'}, 'id': None}, {'id': 'puji.lestari@fp.unila.ac.id', 'name': {'honourific': None, 'family': 'Lestari', 'lineage': None, 'given': 'Puji'}}]",,2018-10-06 00:00:00.000000000,disk0/00/00/95/41,,,,,,,,,,,,,,,,,,,,,
21,2018-04-25 02:24:43,archive,"Basal stem rot caused by Ganoderma boninense is one of the most important problems causing severe economic losses in many oil palm industries, including in Indonesia. Recently, Trichoderma spp. has been widely used as biological control agent of G. boninense, however, this fungus was negatively affected by low pH condition. In Indonesia, oil palm commonly cultivated in marginal soil such us ultisol and peat soil with low pH (acid). In this study, three mutagens (EMS, gamma rays and UV irradiation) were used to generate low pH-tolerant mutant of Trichoderma spp. to increase its survival and effectiveness when it is applied in the previous mentioned field circumstance. Four Trichoderma isolates were used as the wild type. The mutant isolates were able to grow and produce spores in the pH 2-Potato Dextrose medium but not for the wild type. Only 1 out of 109 potentially low pH-tolerant mutant of Trichoderma showed better colony growth, sporulation, viability and antagonist to G. boninense than the wild type. These results showed that EMS, gamma rays and UV irradiation can be used to improve low-pH tolerant of Trichoderma spp.. However, the mutants must be carefully evaluated for any possibility of its negative impacts.","['S1', 'SB']",7-8 March 2018,"Low pH-tolerant mutant of Trichoderma spp. 
induced by EMS, gamma rays and UV irradiation",show,10,other,6682,International Symposium on Innovative Crop Protection for Sustainable Agriculture 2018,published,Gifu University,158,2018-04-25 02:24:43,2018-04-25 02:24:43,"[{'language': 'en', 'mime_type': 'application/pdf', 'eprintid': 6682, 'placement': 1, 'security': 'public', 'pos': 1, 'format': 'text', 'uri': 'http://repository.lppm.unila.ac.id/id/document/19644', 'rev_number': 1, 'main': 'yuyun et al pH Trichoderma .pdf', 'docid': 19644, 'files': [{'uri': 'http://repository.lppm.unila.ac.id/id/file/61521', 'objectid': 19644, 'mtime': '2018-04-10 11:25:48', 'hash_type': 'MD5', 'hash': '03c59b77849659a61390aff57ab863df', 'filename': 'yuyun et al pH Trichoderma .pdf', 'fileid': 61521, 'mime_type': 'application/pdf', 'filesize': 2278893, 'datasetid': 'document'}]}]",speech,pub,FALSE,public,http://repository.lppm.unila.ac.id/id/eprint/6682,conference_item,['FP24'],"[{'name': {'family': 'Fitriana', 'honourific': None, 'lineage': None, 'given': 'Yuyun'}}, {'name': {'lineage': None, 'family': 'Suharjo', 'honourific': None, 'given': 'Radix'}}, {'name': {'honourific': None, 'family': 'Rini', 'lineage': None, 'given': 'Maria Viva'}}, {'name': {'honourific': None, 'family': 'Hidayat', 'lineage': None, 'given': 'Kuswanta Futas'}}]",,2018-03-07 00:00:00.000000000,disk0/00/00/66/82,,,,,,,,,85-90,,,,,,,,,,,,
22,2018-06-25 02:33:47,archive,"Basal stem rot caused by Ganoderma boninense is one of the most important problems causing severe economic losses
in many oil palm industries, including in Indonesia. Recently, Trichoderma spp. has been widely used as biological
control agent of G. boninense, however, this fungus was negatively affected by low pH condition. In Indonesia, oil palm
commonly cultivated in marginal soil such us ultisol and peat soil with low pH (acid). In this study, three mutagens
(EMS, gamma rays and UV irradiation) were used to generate low pH-tolerant mutant of Trichoderma spp. to increase
its survival and effectiveness when it is applied in the previous mentioned field circumstance. Four Trichoderma isolates
were used as the wild type. The mutant isolates were able to grow and produce spores in the pH 2-Potato Dextrose
medium but not for the wild type. Only 1 out of 109 potentially low pH-tolerant mutant of Trichoderma showed better colony growth, sporulation, viability and antagonist to G. boninense than the wild type. These results showed that EMS, gamma rays and UV irradiation can be used to improve low-pH tolerant of Trichoderma spp.. However, the mutants must be carefully evaluated for any possibility of its negative impacts.",['S1'],7-8 March 2018,"Low pH-tolerant mutant of Trichoderma spp. induced by EMS, 
gamma rays and UV irradiation",show,7,conference,7609,International Symposium on Innovative Crop Protection for Sustainable Agriculture 2018,published,Gifu University,741,2018-06-25 02:33:47,2018-06-25 02:33:47,"[{'security': 'public', 'placement': 1, 'eprintid': 7609, 'language': 'en', 'mime_type': 'application/pdf', 'files': [{'uri': 'http://repository.lppm.unila.ac.id/id/file/68453', 'objectid': 20660, 'mtime': '2018-06-23 15:55:13', 'hash_type': 'MD5', 'hash': '35c9babe8acda13eb11049f723e1da1f', 'filename': 'Fitriana~MVR Proceedings_CropProtection2018.pdf', 'fileid': 68453, 'mime_type': 'application/pdf', 'filesize': 882195, 'datasetid': 'document'}], 'docid': 20660, 'main': 'Fitriana~MVR Proceedings_CropProtection2018.pdf', 'uri': 'http://repository.lppm.unila.ac.id/id/document/20660', 'rev_number': 1, 'format': 'text', 'pos': 1}]",paper,pub,TRUE,public,http://repository.lppm.unila.ac.id/id/eprint/7609,conference_item,['FP24'],"[{'name': {'given': 'Yuyun', 'honourific': None, 'family': 'Fitriana', 'lineage': None}, 'id': 'yuyun.fitriana@fp.unila.ac.id'}, {'id': 'radix.suharjo@fp.unila.ac.id', 'name': {'given': 'Radix', 'family': 'Suharjo', 'honourific': None, 'lineage': None}}, {'id': 'maria.vivarini@fp.unila.ac.id', 'name': {'honourific': None, 'family': 'Rini', 'lineage': None, 'given': 'Maria Viva'}}, {'id': 'kfhidayat@gmail.com', 'name': {'honourific': None, 'family': 'Hidayat', 'lineage': None, 'given': 'Kuswanta Futas'}}]",,2018-03-01 00:00:00.000000000,disk0/00/00/76/09,http://www.ugsas.gifu-u.ac.jp/eng/news/2018/02/3134.html,,,,,,,,85-90,,,,,,,,,,,,
