,dir,date,publication,creators,issn,divisions,type,full_text_status,uri,refereed,ispublished,number,documents,publisher,datestamp,lastmod,userid,projects,date_type,eprintid,volume,rev_number,metadata_visibility,title,official_url,referencetext,subjects,abstract,eprint_status,status_changed,related_url,id_number,pagerange,department,institution,thesis_type,thesis_name,event_type,event_dates,event_title,event_location,contributors,pres_type,contact_email,keywords
0,disk0/00/00/41/48,1970-01-01 00:00:00.000002017,Jurnal Pendidikan Matematika Unila,"[{'name': {'given': 'Darwanto', 'honourific': None, 'family': 'Darwanto', 'lineage': None}, 'id': None}, {'id': None, 'name': {'family': 'Caswita', 'honourific': None, 'lineage': None, 'given': 'Caswita'}}, {'id': 'suharsono.1962@fmipa.unila.ac.id', 'name': {'lineage': None, 'family': 'Suharsono', 'honourific': None, 'given': 'Suharsono'}}]",: 2338-1183,['FKIP22'],article,public,http://repository.lppm.unila.ac.id/id/eprint/4148,TRUE,pub,1.0,"[{'placement': 1, 'security': 'public', 'eprintid': 4148, 'mime_type': 'application/xml', 'language': 'id', 'files': [{'mime_type': 'application/xml', 'fileid': 42100, 'filename': 11703, 'hash': '3513fb1f5ae4851d54a769409e3f4094', 'hash_type': 'MD5', 'mtime': '2017-10-27 03:39:42', 'datasetid': 'document', 'filesize': 19104, 'objectid': 17042, 'uri': 'http://repository.lppm.unila.ac.id/id/file/42100'}], 'docid': 17042, 'main': 11703, 'rev_number': 5, 'uri': 'http://repository.lppm.unila.ac.id/id/document/17042', 'formatdesc': 'Jurnal Pendidikan Matematika Unila Vol.5 No:1  (2017)', 'pos': 1, 'format': 'other'}]",FKIP Universitas Lampung,2017-11-10 15:24:09,2017-11-10 15:24:09,845,['Thesis Magister Pendidikan Matematika'],published,4148,5.0,7,show,"PENGEMBANGAN BAHAN AJAR DENGAN MODEL PBL UNTUK MENGEMBANGKAN KEMAMPUAN BERPIKIR KREATIF SISWA
Darwanto Darwanto, Caswita Caswita, Suharsono Suharsono",http://jurnal.fkip.unila.ac.id/index.php/MTK/article/view/11703,"References

Hassoubah, Zaleha Izhab. 2008. Mengasah Pikiran Kretaif dan kritis. Bandung: Nuansa.

Johnson, Elaine B. 2014. CTL Contextual Teaching & Learning. Bandung: Kaifa Learning.

Kemendikbud. 2012. Survey International TIMSS. [Online]. http://litbang.kemendikbud.go.id/index.php/survei-international-timss. (25 Maret 2016).

Khayati, Fitrotul. 2015. Mengembangkan Modul Matematika untuk Pembelajaran Berbasis Masalah (Problem Based Learning) Pada Materi Pokok Persamaan Garis Lurus Kelas VIII SMP. Tesis Magister UNS.

Munandar, Utami. 2012. Pengembangan Kreativitas Anak Berbakat. Jakarta: Rineka Cipta.

Noer, Sri Hastuti. 2009. Kemampuan Berpikir Kreatif Matematis (Apa, Mengapa, dan Bagaimana). Prosiding Seminar Nasional Penelitian, Pendidikan dan Penerapan MIPA, Fakultas MIPA, Universitas Negeri Yogyakarta.

Panen, P dan Purwanto. 2001. Penulisan Bahan Ajar. Jakarta: Depdiknas.

Prastowo, A. 2011. Panduan Kreatif Membuat Bahan Ajar Inovatif. Yogyakarta: Diva Press.

Sugiyono. 2010. Statistik untuk Penelitian. Bandung: Alfabeta.

Tan, Seng Oon. 2004. Enhancing Thinking Through Problem Based Learning Approaches: International Perspectives. Singapura: Cengange Learning.

Tarrow, N. B. dan Lundsteen. 1978. Guiding Young Children Learning. New York: McGraw-Hill Book Company.",['LB1603'],"Abstract

The aim of this research and development was to find out the validity and the effectivityof developed math learning materials by PBL in developing students’ creative thinking ability. The subjects of this research were the tenth grade students of MAN 2 Lampung Utara. The result showed that based on the judgement of the experts on learning materials, design and media, the developed learning materials have met the requirements and eligibility standard. The result of this research of data analysis confirmed that the mean score of students’ learning result passed the school passing grade and it was good. Besides, through data analysis of students’ respon, it showed that students’ respon was good so that the learning process by developed learning materials could be able to develop students’ creative thinking.

Penelitian dan pengembangan ini bertujuan untuk mengetahui tingkat validitas dan efektivitas pengembangan bahan ajar matematika dengan model PBL dalam mengembangkan kemampuan berpikir kreatif siswa. Subjek penelitian ini adalah peserta didik kelas X MIA2 MAN 2 Lampung Utara. Hasil penelitian ini menunjukkan bahwa bahan ajar telah memenuhi syarat dan standar kelayakan berdasarkan penilaian ahli materi, ahli desain dan media. Hasil analisis data menunjukan bahwa rata-rata hasil tes belajar peserta didik menunjukan hasil yang baik yaitu terlampauinya KKM, dan juga analisis data berupa respon menunjukan bahwa peserta didik merespon dengan baik, sehingga pembelajaran dengan menggunakan bahan ajar yang telah dikembangkan mampu mengembangkan berpikir kreatif peserta didik.

­­­­Kata kunci: bahan ajar, berpikir kreatif, problembased learning",archive,2017-11-10 15:24:09,,,,,,,,,,,,,,,
1,disk0/00/00/85/54,2017-09-01 00:00:00.000000000,Jurnal Pendidikan Matematika Unila,"[{'name': {'given': 'Armila', 'family': 'Linda', 'honourific': None, 'lineage': None}}, {'name': {'honourific': None, 'family': 'Asnawati', 'lineage': None, 'given': 'Rini'}}, {'name': {'lineage': None, 'honourific': None, 'family': 'Sutiarso', 'given': 'Sugeng'}}]",2338-1183,['FKIP22'],article,public,http://repository.lppm.unila.ac.id/id/eprint/8554,TRUE,pub,8.0,"[{'uri': 'http://repository.lppm.unila.ac.id/id/document/21612', 'rev_number': 1, 'pos': 1, 'format': 'text', 'files': [{'filename': 'juli 2017.pdf', 'hash': '6417232830b58f06c084600f080af1de', 'mtime': '2018-07-05 09:00:59', 'hash_type': 'MD5', 'mime_type': 'application/pdf', 'fileid': 83913, 'filesize': 564012, 'datasetid': 'document', 'uri': 'http://repository.lppm.unila.ac.id/id/file/83913', 'objectid': 21612}], 'main': 'juli 2017.pdf', 'docid': 21612, 'language': 'en', 'mime_type': 'application/pdf', 'placement': 1, 'security': 'public', 'eprintid': 8554}]",Universitas Lampung,2018-08-03 07:28:42,2018-08-03 07:28:42,864,,published,8554,5.0,6,show,Efektivitas Pembelajaran Kooperatif Tipe TAPPS Ditinjau dari Kemampuan Pemecahan Masalah Matematis Siswa,http://jurnal.fkip.unila.ac.id,,['LB1603'],"Penelitian eksperimen semu ini bertujuan untuk mengetahui efektivitas model pembelajaran kooperatif tipe Thinking Aloud Pair Problem Solving(TAPPS) ditinjau dari kemampuan pemecahan masalah matematis siswa. Populasi penelitian ini adalah seluruh siswa kelas VIII SMP Negeri 21 Bandar Lampung tahun ajaran 2016/2017 yang terdistribusi dalam sebelas kelas. Sampel dalam penelitian ini adalah siswa kelas VIII A dan VIII B yang diambil dengan teknik purposive sampling. Penelitian ini menggunakan desain pretest-posttest control group design. Instrumen penelitian ini adalah tes kemampuan pemecahan masalah matematis. Analisis data penelitian ini menggunakan uji Mann-Whitney U dan Uji Tanda Binomial. Berdasarkan hasil penelitian pembelajaran kooperatif tipe TAPPS tidak efektif ditinjau dari kemampuan pemecahan masalah matematis siswa.
Kata kunci: efektivitas, TAPPS, pemecahan masalah matematis",archive,2018-08-03 07:28:42,[{'url': 'http://jurnal.fkip.unila.ac.id/index.php/MTK/article/view/14035'}],14035,902-912,,,,,,,,,,,,
2,disk0/00/02/23/99,1970-01-01 00:00:00.000002017,,"[{'name': {'given': 'Nurhanurawati', 'family': 'Nurhanurawati', 'honourific': None, 'lineage': None}, 'id': 'nurha.nurawati@fkip.unila.ac.id'}]",,['FKIP22'],thesis,public,http://repository.lppm.unila.ac.id/id/eprint/22399,,pub,,"[{'language': 'en', 'mime_type': 'application/vnd.openxmlformats-officedocument.wordprocessingml.document', 'placement': 1, 'security': 'public', 'eprintid': 22399, 'rev_number': 1, 'uri': 'http://repository.lppm.unila.ac.id/id/document/35821', 'pos': 1, 'format': 'text', 'files': [{'objectid': 35821, 'uri': 'http://repository.lppm.unila.ac.id/id/file/205716', 'datasetid': 'document', 'filesize': 24297, 'mime_type': 'application/vnd.openxmlformats-officedocument.wordprocessingml.document', 'fileid': 205716, 'hash': 'f5cb26084abed41d4caf895a6770e66f', 'filename': 'Abstrak Disertasi Nurhanurawati.docx', 'hash_type': 'MD5', 'mtime': '2020-06-12 19:00:21'}], 'main': 'Abstrak Disertasi Nurhanurawati.docx', 'docid': 35821}]",,2020-06-14 00:19:44,2020-06-14 00:19:44,789,,published,22399,,11,show,Proses berpikir intuitif dalam memecahkan masalah kekonvergenan barisan,http://mulok.library.um.ac.id/home.php?s_data=Disertasi&s_teks2=Matematika&s_field=3&s_teks=Nurhanurawati&submit=Search&mod=b&cat=1,,['L1'],"RINGKASAN
Nurhanurawati. 2018. Proses Berpikir Intuitif dalam Pemecahan Masalah Kekonvergenan Barisan. Disertasi, Program Studi Pendidikan Matematika, Program Pascasarjana Universitas Negeri Malang. Pembimbing: (I) Prof. Drs. Purwanto, Ph.D., (II) Dr. H. Abdur Rahman As�ari, M.Pd., M.A., (III) Dr. Edy Bambang Irawan, M. Pd.
Kata Kunci: proses berpikir intuitif, pemecahan masalah, kekonvergenan barisan
Penelitian kualitatif fenomenologis ini bertujuan mendeskripsikan perbedaan proses berpikir intuitif dan alur terjadinya proses berpikir intuitif mahasiswa ketika menentukan kekonvergenan barisan berdasarkan proses pemecahan masalah Polya. Subjek penelitian ini adalah mahasiswa Pendidikan Matematika semester 6 dan semester 8 yang telah menempuh perkuliahan Analisis Real. Pemilihan subjek penelitian didasarkan pertimbangan munculnya pemikiran intuitif ketika memecahkan masalah serta kemampuan komunikasi yang baik. Pengumpulan data dilakukan dengan cara memberikan lembar tugas pemecahan masalah kekonvergenan barisan kepada mahasiswa untuk diselesaikan secara think-aloud. Selanjutnya dilakukan wawancara berbasis tugas berkaitan dengan hasil kerja mahasiswa tersebut menggunakan pedoman wawancara semi terstruktur untuk mengetahui pemikirannya ketika menyimpulkan sesuatu dan mengambil suatu langkah, serta mengetahui alasan menggunakan langkah tersebut. Kegiatan think-aloud dan wawancara direkam menggunakan rekaman audio-visual. Data yang diperoleh dianalisis dengan tahapan mentranskripsi data, mereduksi data, mengkode data, memeriksa keabsahan data, menelaah data, menginterpretasi temuan, memvalidasi temuan, dan menarik kesimpulan.
Hasil penelitian menemukan bahwa berdasarkan alur proses pemecahan masalah secara intuitif, ada perbedaan proses berpikir intuitif yang dialami mahasiswa ketika memecahkan masalah kekonvergenan barisan. Perbedaan tersebut digolongkan ke dalam dua kategori karakteristik berpikir intuitif berdasarkan alur proses pemecahan masalah secara intuitif yaitu berpikir intuitif lurus dan berpikir intuitif siklis. Mahasiswa dikatakan berpikir intuitif lurus jika ia memecahkan masalah sesuai alurnya tanpa pernah mengubah alur pikirannya, yaitu tetap pada satu strategi atau cara yang digunakan selama memecahkan masalah dengan proses sebagai berikut. Pertama, mahasiswa memahami masalah dengan cara mengenali masalah tersebut secara self-evident menerima pernyataan yang ada dalam permasalahan dengan kepastian intrinsik dan dengan sangat percaya diri. Kedua, mahasiswa merencanakan pemecahan masalah dengan cara mengaitkan objek-objek yang ada dalam permasalahan dengan hal yang paling diingatnya atau pernah dialaminya dengan kepastian intrinsik. Ketiga, mahasiswa melaksanakan pemecahan masalah dengan cara melakukan coba-coba terbatas, menghitung beberapa suku pertama barisan secara premature closure untuk memperoleh ide mengenai kemungkinan solusi masalah. Selanjutnya mahasiswa melakukan dugaan terhadap solusi dengan melihat penampakan/visualisasi objek (dalam hal ini suku-suku barisan) berdasarkan hasil dramatisasi. Dengan terlalu percaya diri menggunakan primacy effect dan secara global mahasiswa
vi
menyatakan solusi dengan kalimat yang lengkap. Keempat, mahasiswa melihat kembali dengan cara mencoba menguji kebenaran solusi. Sedangkan mahasiswa dikatakan berpikir intuitif siklis apabila ia mengalami beberapa kali kebuntuan dalam memecahkan masalah sehingga ia mengubah alur pikirannya, dengan proses sebagai berikut. Pertama, mahasiswa memahami masalah secara self-evident dan menerima pernyataan yang ada dalam permasalahan dengan kepastian intrinsik dan dengan sangat percaya diri. Kedua, mahasiswa merencanakan pemecahan masalah secara cepat dan cenderung terburu-buru, dengan coba-coba berdasarkan primacy effect. Ketiga, mahasiswa melaksanakan pemecahan masalah tentang kekonvergenan barisan dengan cara mengamati perilaku barisan, namun ia mengalami kebuntuan. Selanjutnya mahasiswa kembali ke langkah kedua, merencanakan pemecahan masalah lalu dilanjutkan kembali dengan langkah ketiga yaitu melaksanakan pemecahan masalah. Ini bisa berlangsung beberapa kali sampai ia menemukan perilaku barisan. Setelah menemukan perilaku suku barisan, selanjutnya mahasiswa melakukan dugaan terhadap solusi, lalu mahasiswa menyatakan solusi dengan kalimat yang lengkap.",archive,2020-06-14 00:19:44,[{'url': 'http://mulok.library.um.ac.id/home.php?s_data=Disertasi&s_teks2=Matematika&s_field=3&s_teks=Nurhanurawati&submit=Search&mod=b&cat=1'}],,,Pendidikan Matematika,Universitas Negeri Malang,doctoral,phd,,,,,,,,
3,disk0/00/00/85/59,2017-09-01 00:00:00.000000000,Jurnal Pendidikan Matematika Unila,"[{'name': {'given': 'Azizah Arum', 'lineage': None, 'family': 'Puspaningtias', 'honourific': None}, 'id': None}, {'name': {'given': 'Sugeng', 'lineage': None, 'family': 'Sutiarso', 'honourific': None}, 'id': 'sugeng.sutiarso@fkip.unila.ac.id'}, {'name': {'given': 'Tina', 'honourific': None, 'family': 'Yunarti', 'lineage': None}, 'id': 'tina_yunarti@yahoo.com'}]",2338-1183,['FKIP22'],article,public,http://repository.lppm.unila.ac.id/id/eprint/8559,TRUE,pub,9.0,"[{'rev_number': 1, 'uri': 'http://repository.lppm.unila.ac.id/id/document/21614', 'pos': 1, 'format': 'text', 'files': [{'hash': 'f1d9534f0241cb1fffebf32d5053a437', 'filename': 'okt 2017.pdf', 'mtime': '2018-07-05 09:13:01', 'hash_type': 'MD5', 'mime_type': 'application/pdf', 'fileid': 83928, 'filesize': 447563, 'datasetid': 'document', 'uri': 'http://repository.lppm.unila.ac.id/id/file/83928', 'objectid': 21614}], 'main': 'okt 2017.pdf', 'docid': 21614, 'mime_type': 'application/pdf', 'language': 'en', 'placement': 1, 'security': 'public', 'eprintid': 8559}]",FKIP Universitas Lampung,2018-08-03 07:34:03,2018-08-03 07:34:03,864,,published,8559,5.0,6,show,Efektivitas Model Discovery Learning Ditinjau dari Pemahaman Konsep Matematis Siswa,http://jurnal.fkip.unila.ac.id,,['LB1603'],"Penelitian eksperimen semu ini bertujuan untuk mengetahui efektivitas model discovery learning ditinjau dari pemahaman konsep matematis siswa. Populasi penelitian ini adalah seluruh siswa kelas VIII SMP Negeri 1 Punggur tahun pelajaran 2016/2017 yang terdistribusi dalam sembilan
kelas. Sampel dalam penelitian ini adalah siswa kelas VIII A dan VIII B yang diambil dengan teknik purposive sampling. Penelitian ini menggunakan pretestposttest control group design. Instrumen penelitian ini adalah instrumen tes
pemahaman konsep matematis. Analisis data penelitian ini menggunakan uji kesamaan dua rata-rata yaitu uji t’ dan uji proporsi satu pihak. Berdasarkan hasil penelitian, model discovery learning tidak efektif ditinjau dari pemahaman konsep matematis siswa.",archive,2018-08-03 07:34:03,[{'url': 'http://jurnal.fkip.unila.ac.id/index.php/MTK/article/view/14204'}],14204,1003-1014,,,,,,,,,,,,
4,disk0/00/00/41/52,1970-01-01 00:00:00.000002017,Jurnal Pendidikan Matematika Unila,"[{'id': None, 'name': {'lineage': None, 'honourific': None, 'family': 'Ratna Wijaya', 'given': 'Ni Made'}}, {'id': None, 'name': {'given': 'Haninda', 'family': 'Bharata', 'honourific': None, 'lineage': None}}, {'name': {'lineage': None, 'family': 'Suharsono', 'honourific': None, 'given': 'Suharsono'}, 'id': 'suharsono.1962@fmipa.unila.ac.id'}]",2338-1183,['FKIP22'],article,public,http://repository.lppm.unila.ac.id/id/eprint/4152,TRUE,pub,3.0,"[{'language': 'en', 'mime_type': 'application/xml', 'placement': 1, 'security': 'public', 'eprintid': 4152, 'uri': 'http://repository.lppm.unila.ac.id/id/document/17047', 'rev_number': 3, 'formatdesc': 'Jurnal Pendidikan Matematika Unila Vol:5 No:1 (2017) Wijaya', 'pos': 1, 'format': 'other', 'files': [{'uri': 'http://repository.lppm.unila.ac.id/id/file/42137', 'objectid': 17047, 'filesize': 19527, 'datasetid': 'document', 'mtime': '2017-10-27 04:30:58', 'hash_type': 'MD5', 'hash': '6aa230ec19d9c07ced09cc241170c70b', 'filename': 12774, 'fileid': 42137, 'mime_type': 'application/xml'}], 'main': 12774, 'docid': 17047}]",FKIP Universitas Lampung,2017-11-10 15:24:41,2017-11-10 15:24:41,845,['Thesis Magister Pendidikan Matematika'],published,4152,5.0,8,show,"Pengembangan LKPD Berbasis Strategi TAPPS untuk Meningkatkan Kemampuan Komunikasi Matematis Siswa
Ni Made Ratna Wijaya, Haninda Bharata, Suharsono S",http://jurnal.fkip.unila.ac.id/index.php/MTK/issue/view/712,"References

Eggen, Paul. dan Kauchak. 2012. Strategi dan Model Pembelajaran. Jakarta: Indeks.

Jatmiko, M. Anang. 2014. Pengaruh metode TAPPS terhadap kemam¬pu¬an komunikasi matema¬tik siswa. Skripsi pada FMIPA UIN Jakarta: Tidak diterbitkan.

Johnson and Chung. 1999. The Effect of Thinking Aloud Pair Problem Solving (TAPPS) on the Troubleshooting Ability Avia¬tion Technician Students. Jurnal of Industrial Teacher Education (Volume 37, Number 1). [online]. Tersedia :http://scholar.lib.vt.edu (diakses pada 25 Oktober 2014).

NCTM. 2000. Principles and Stan-dard for School Mathematics: The Learning Principles. [online] tersedia : http://nctm.org. (diakses pada 25 Oktober 2014).

OECD. 2014. PISA 2012. Results in Focus What 15-year-olds Know and What They Can Do with They Know. Paris: OECD

Sanjaya, Wina. 2013. Penelitian Pendidikan jenis, Metode, dan Prosedur. Jakarta : Prenada Media Grup.

Sudijono, Anas. 2008. Pengantar Evaluasi Pendidikan. Jakarta: Raja Grafindo Persada.

Sugiyono. 2008. Metode Penelitian Pendidikan Pendekatan Kuantitatif, Kualitatif, dan R&D. Bandung: CV. ALFABETA.

Trianto. 2009. Mendesain Pembelajaran Inovatif Progesif. Jakarta: Kencana Pranada Media Group.

Winsler, Adam. 2009. Private Speech, Executive Funtioning, and The Development of Verbal Self-Regulation. Cambridg",['LB1603'],"Abstract

This research development aimed to develop of TAPPS strategy worksheet for increasing mathematical communication ability. This study was initiated with preliminary studies, the composing, the validation, preliminary field testing, and main field testing. The subject of this research was students of VII D class of SMP N 1 Seputih Raman. The result of preliminary study indicated that there was a need to develop  worksheet. The arranges of worksheet were started with the draft-preperation and all of components based on the composing guidelines. The result of the validation showed that the worksheet got the standard qualification for its content and design. The field trial results showed that students’ mathematical communication aspect was good enough because more than 70 % of the students have reached minimum criteria.

Penelitian ini merupakan penelitian pengembangan yang bertujuan untuk mengetahui bagaimana hasil pengembangan LKPD berbasis strategi TAPPS untuk meningkatkan kemampuan komunikasi matematis. Penelitian ini diawali dari studi pendahuluan, penyusunan LKPD, validasi LKPD, uji coba lapangan awal, dan uji lapangan. Subjek penelitian ini adalah siswa kelas VII-D SMP Negeri 1 Seputih Raman Tahun Pelajaran 2016/2017.  Hasil studi pendahuluan menunjukkan adanya kebutuhan dikembangkannya LKPD berbasis startegi TAPPS. Penyusunan LKPD diawali dengan menyusun draft LKPD dan semua komponennya berdasarkan panduan penyusunan LKPD. Hasil validasi menunjukkan bahwa LKPD telah memenuhi standar kelayakan isi, dan desain. Hasil uji coba lapangan menunjukkan bahwa LKPD termasuk dalam kategori baik. Hasil uji lapangan menunjukkan bahwa aspek komunikasi matematis siswa cukup baik karena lebih dari 70% siswa telah memenuh kriteria ketuntasan minimal.

Kata kunci: Komunikasi matematis, LKPD,  TAPPS.",archive,2017-11-10 15:24:41,,,,,,,,,,,,,,,
5,disk0/00/02/35/40,2017-11-27 00:00:00.000000000,Journal of Physics: Conference Series,"[{'id': 'santy.setiawati@fkip.unila.ac.id', 'name': {'honourific': None, 'family': 'Setiawati', 'lineage': None, 'given': 'Santy'}}, {'id': None, 'name': {'given': 'Tatang', 'honourific': None, 'family': 'Herman', 'lineage': None}}, {'id': None, 'name': {'lineage': None, 'family': 'Jupri', 'honourific': None, 'given': 'Al'}}]",,['FKIP22'],article,public,http://repository.lppm.unila.ac.id/id/eprint/23540,TRUE,pub,,"[{'placement': 1, 'security': 'public', 'eprintid': 23540, 'mime_type': 'application/pdf', 'language': 'en', 'files': [{'datasetid': 'document', 'filesize': 523990, 'fileid': 215188, 'mime_type': 'application/pdf', 'mtime': '2020-08-06 03:37:28', 'hash_type': 'MD5', 'filename': 'Setiawati_2017_J._Phys.-_Conf._Ser._909_012063.pdf', 'hash': '8bb65a2536c50fede9c8bececc7d1461', 'objectid': 37167, 'uri': 'http://repository.lppm.unila.ac.id/id/file/215188'}], 'main': 'Setiawati_2017_J._Phys.-_Conf._Ser._909_012063.pdf', 'docid': 37167, 'rev_number': 1, 'uri': 'http://repository.lppm.unila.ac.id/id/document/37167', 'pos': 1, 'format': 'text'}]",IOP Publishing Ltd,2020-08-06 03:51:44,2020-08-06 03:51:44,2861,,published,23540,909.0,6,show,Investigating middle school students' difficulties in mathematical literacy problems level 1 and 2,https://iopscience.iop.org/issue/1742-6596/909/1,,['L1'],"The background of this study is the lack of mathematical literacy skills of students. The proficiency of students' mathematical literacy skills based on the results of the PISA 2015 study shows that Indonesian students at the proficiency level 1. This fact gave rise to this study which aims to investigate middle school students' difficulties in mathematical literacy problems level 1 and 2. Qualitative research was used in this study. An individual written test on mathematical literacy problems was administered, followed by interviews. The subjects of the study were 61 students grade VII in Bandung and 26 of them were interviewed afterward. Data analysis revealed that students' error in performing arithmetic most frequently observed. Other observed difficulties concerned understanding about algebra concept, applying arithmetic operation in algebraic expressions, and interpreting symbols to represent the unknown. In solving mathematical literacy problems, students use their prior knowledge, although sometimes not relevant to the questions. Based on the results, we suggest that mathematics learning in contextual learning and which invites students to participate in the processes of understanding the concepts.",archive,2020-08-06 03:51:44,,,,,,,,,,,,,,,
