,title,official_url,metadata_visibility,rev_number,volume,eprint_status,status_changed,abstract,subjects,eprintid,date_type,documents,publisher,number,ispublished,contributors,refereed,uri,full_text_status,corp_creators,userid,lastmod,pagerange,datestamp,creators,issn,publication,dir,date,type,divisions,id_number,related_url
0,Peningkatan Hasil Belajar Mahasiswa pada Pembelajaran Teori Bilangan dengan Pembelajaran Tipe STAD,http://jurnal.fkip.unila.ac.id/index.php/MTK,show,6,9.0,archive,2022-01-11 01:18:54,"This action research aims to improve the learning outcomes of Number Theory in Mathematics Education students in the Even semester of the 2019/2020 academic year through STAD-type cooperative learning. The research was conducted at the Mathematics Education Study Program, MIPA Education Department, FKIP University of Lampung. Data were collected through tests and also activity observations to see their
contribution to the learning outcomes. The test was carried out after three lessons were carried out at the end of each cycle. The final cycle test was conducted to see student learning outcomes after the implementation of STAD-type cooperative learning. Based on the test results, individual improvement points, awards are determined, as well as determine the increase in learning outcomes of participants in each cycle. The results of data analysis concluded that STAD-type cooperative learning can improve Number Theory learning outcomes in Mathematics Education students in the even semester of the 2019/2020 academic year. The increase in learning outcomes is greater than the increase in student activity in lectures.",['L1'],37807,submitted,"[{'rev_number': 1, 'uri': 'http://repository.lppm.unila.ac.id/id/document/158737', 'pos': 1, 'format': 'text', 'files': [{'objectid': 158737, 'uri': 'http://repository.lppm.unila.ac.id/id/file/430686', 'mime_type': 'application/pdf', 'fileid': 430686, 'filename': 'Jurnal Pdk Mtk-_31-12-2021.pdf', 'hash': '91258919d986615cf752ae728773ac9e', 'mtime': '2022-01-10 14:30:45', 'hash_type': 'MD5', 'datasetid': 'document', 'filesize': 240147}], 'main': 'Jurnal Pdk Mtk-_31-12-2021.pdf', 'docid': 158737, 'mime_type': 'application/pdf', 'language': 'en', 'placement': 1, 'security': 'public', 'eprintid': 37807}]",Jurnal Pendidikan Matematika,4.0,pub,"[{'name': {'lineage': None, 'honourific': None, 'family': 'Coesamin', 'given': 'M'}, 'id': 'm.coesamin@fkip.unila.ac.id', 'type': 'http://www.loc.gov/loc.terms/relators/AUT'}]",TRUE,http://repository.lppm.unila.ac.id/id/eprint/37807,public,['Universitas Lampung'],724,2022-01-11 01:18:54,514-530,2022-01-11 01:18:54,"[{'name': {'given': 'M', 'honourific': None, 'family': 'Coesamin', 'lineage': None}, 'id': 'm.coesamin@fkip.unila.ac.id'}]",2338-1183,Jurnal Pendidikan Matematika,disk0/00/03/78/07,2021-12-31 00:00:00.000000000,article,['FKIP22'],,
1,Peningkatan Hasil Belajar Mahasiswa pada Pembelajaran Teori Bilangan dengan Pembelajaran Tipe STAD,http://jurnal.fkip.unila.ac.id/index.php/MTK,show,6,9.0,archive,2022-01-11 01:18:57,"This action research aims to improve the learning outcomes of Number Theory in
Mathematics Education students in the Even semester of the 2019/2020 academic year
through STAD-type cooperative learning. The research was conducted at the
Mathematics Education Study Program, MIPA Education Department, FKIP University
of Lampung. Data were collected through tests and also activity observations to see their
contribution to the learning outcomes. The test was carried out after three lessons were
carried out at the end of each cycle. The final cycle test was conducted to see student
learning outcomes after the implementation of STAD-type cooperative learning. Based
on the test results, individual improvement points, awards are determined, as well as
determine the increase in learning outcomes of participants in each cycle. The results of
data analysis concluded that STAD-type cooperative learning can improve Number
Theory learning outcomes in Mathematics Education students in the even semester of the
2019/2020 academic year. The increase in learning outcomes is greater than the increase
in student activity in lectures.",['L1'],37810,submitted,"[{'pos': 1, 'format': 'text', 'uri': 'http://repository.lppm.unila.ac.id/id/document/158740', 'rev_number': 1, 'main': 'Jurnal Pdk Mtk_Coesamin_31-12-2021.pdf', 'docid': 158740, 'files': [{'objectid': 158740, 'uri': 'http://repository.lppm.unila.ac.id/id/file/430703', 'fileid': 430703, 'mime_type': 'application/pdf', 'hash_type': 'MD5', 'mtime': '2022-01-10 15:12:08', 'hash': '91258919d986615cf752ae728773ac9e', 'filename': 'Jurnal Pdk Mtk_Coesamin_31-12-2021.pdf', 'datasetid': 'document', 'filesize': 240147}], 'language': 'en', 'mime_type': 'application/pdf', 'eprintid': 37810, 'placement': 1, 'security': 'public'}]",Jurnal Pendidikan Matematika Universitas Lampung,4.0,pub,"[{'name': {'honourific': None, 'family': 'Coesamin', 'lineage': None, 'given': 'M'}, 'type': 'http://www.loc.gov/loc.terms/relators/AUT', 'id': 'm.coesamin@fkip.unila.ac.id'}]",TRUE,http://repository.lppm.unila.ac.id/id/eprint/37810,public,['Universitas Lampung'],724,2022-01-11 01:18:57,514-530,2022-01-11 01:18:57,"[{'name': {'lineage': None, 'family': 'Coesamin', 'honourific': None, 'given': 'M'}, 'id': 'm.coesamin@fkip.unila.ac.id'}]",2338-1183,Jurnal Pendidikan Matematika Universitas Lampung,disk0/00/03/78/10,2021-12-31 00:00:00.000000000,article,['FKIP22'],,
2,The relationship between emotional intelligence with student's mathematics representation ability,https://doi.org/10.47577/tssj.v24i1,show,6,24.0,archive,2021-10-20 01:41:01,"This study aims to determine the relationship between students' emotional intelligence
and students' mathematical representation abilities. The population in the study were all eighth
grade students of SMP Negeri 1 Sukoharjo, Sukoharjo sub-district, Pringsewu Regency for the
2020/2021 academic year which were distributed in nine classes. The research sample was
selected by purposive sampling technique and 32 students were selected for class VIII-A. The
design used is a correlational research design. The research data is in the form of quantitative
data in the form of students' emotional intelligence scores obtained through filling out
questionnaires on students' emotional intelligence and students' mathematical representation
ability scores obtained through circle material test activities. The data analysis technique in this
study uses the Pearson product moment correlation test. The conclusion of this study is that there
is a significant relationship between students' emotional intelligence and students' mathematical
representation abilities, with a Pearson product moment correlation index number of 0.698,
meaning that the higher the emotional intelligence of students, the higher the students'
mathematical representation ability.",['L1'],34564,submitted,"[{'pos': 1, 'format': 'text', 'uri': 'http://repository.lppm.unila.ac.id/id/document/155102', 'rev_number': 1, 'main': '4750-Article Text-18016-1-10-20211009.pdf', 'docid': 155102, 'files': [{'objectid': 155102, 'uri': 'http://repository.lppm.unila.ac.id/id/file/406326', 'fileid': 406326, 'mime_type': 'application/pdf', 'hash_type': 'MD5', 'mtime': '2021-10-19 15:06:46', 'hash': 'f9cb8793d0d0d5330bd88d1b0c3ff5eb', 'filename': '4750-Article Text-18016-1-10-20211009.pdf', 'datasetid': 'document', 'filesize': 2155425}], 'mime_type': 'application/pdf', 'language': 'en', 'eprintid': 34564, 'placement': 1, 'security': 'public'}]",Technium Science Inc,,pub,"[{'id': 'm.coesamin@fkip.unila.ac.id', 'type': 'http://www.loc.gov/loc.terms/relators/AUT', 'name': {'given': 'M', 'honourific': None, 'family': 'Coesamin', 'lineage': None}}, {'type': 'http://www.loc.gov/loc.terms/relators/AUT', 'id': 'sugeng.sutiarso@fkip.unila.ac.id', 'name': {'lineage': None, 'family': 'Sutiarso', 'honourific': None, 'given': 'Sugeng'}}, {'name': {'lineage': None, 'family': 'Saputri', 'honourific': None, 'given': 'Nadila Intan'}, 'id': 'snadilaintan@gmail.com', 'type': 'http://www.loc.gov/loc.terms/relators/AUT'}]",TRUE,http://repository.lppm.unila.ac.id/id/eprint/34564,public,['Universitas Lampung'],724,2021-10-20 01:41:01,65-73,2021-10-20 01:41:01,"[{'name': {'honourific': None, 'family': 'Coesamin', 'lineage': None, 'given': 'M'}, 'id': 'm.coesamin@fkip.unila.ac.id'}, {'id': 'sugeng.sutiarso@fkip.unila.ac.id', 'name': {'given': 'Sugeng', 'honourific': None, 'family': 'Sutiarso', 'lineage': None}}, {'id': 'snadilaintan@gmail.com', 'name': {'lineage': None, 'family': 'Saoutri', 'honourific': None, 'given': 'Nadila Intan'}}]",2668-7798,Technium Social Sciences Journal,disk0/00/03/45/64,2021-10-01 00:00:00.000000000,article,['FKIP22'],,
3,Workshop Happiness Learning dan Kecemasan Matematika Generasi Digital pada Tatanan Kehidupan Baru,,show,6,1.0,archive,2022-01-19 05:39:52,"Workshop Happiness Learning dan Kecemasan Matematika Generasi Digital pada Tatanan Kehidupan Baru. Menurunnya kemampuan akademis di bidang matematika dan munculnya kecemasan matematika di benak siswa merupakan dampak dari memahami konsep-konsep matematika dengan pembelajaran daring. Kegiatan workshop ini bertujuan untuk membantu dan meningkatkan kemampuan guru dalam merancang media pembelajaran yang menyenangkan bagi generasi digital menuju tatanan kehidupan baru dan memfasilitasi guru agar mampu menganalisis kecemasan matematika yang dialami siswa dan mampu mengatasinya agar siswa dapat belajar dengan optimal. Pelaksanaan kegiatan pengabdian dilakukan mulai tanggal 25 s.d. 27 Oktober 2020 secara daring (online) melalui aplikasi Zoom Cloud Meetings. Kegiatan ini melibatkan 17 orang guru Sekolah Dasar di Kota Bandar Lampung. Guru mengungkapkan hasil belajar siswa dalam pembelajaran daring sebanyak 53% kurang memuaskan. Guru pun mengutarakan mengatasi siswa yang kesulitan dalam pembelajaran matematika dengan memberikan bimbingan, perhatian khusus dan mengulang-ulang penjelasan. Setelah guru mengikuti pemaparan materi dan penyusunan media pembelajaran yang mendukung pembelajaran menyenangkan untuk mengatasi kecemasan matematis, 82% guru mengungkapkan lebih mudah menyusun lagu matematika, dikarenakan mudah dikaitkan dengan lagu yang dikenal anak-anak. Wawasan guru dalam media pembelajaran matematika harus lebih beragam lagi. Penyusunan media pembelajaran selanjutnya diperlukan secara digital mengingat tatanan kehidupan baru semenjak terjadinya pandemi Covid-19.",['L1'],37986,submitted,"[{'pos': 1, 'format': 'text', 'uri': 'http://repository.lppm.unila.ac.id/id/document/158923', 'rev_number': 1, 'docid': 158923, 'main': 'Jurnal Pengabdian M Coesamin dkk_2022.pdf', 'files': [{'datasetid': 'document', 'filesize': 134561, 'mime_type': 'application/pdf', 'fileid': 431960, 'filename': 'Jurnal Pengabdian M Coesamin dkk_2022.pdf', 'hash': '10386535029ac9317cd9ccd87e44219d', 'mtime': '2022-01-18 12:45:45', 'hash_type': 'MD5', 'objectid': 158923, 'uri': 'http://repository.lppm.unila.ac.id/id/file/431960'}], 'mime_type': 'application/pdf', 'language': 'en', 'eprintid': 37986, 'placement': 1, 'security': 'public'}]",Jurnal Pengabdian Kepada Masyarakat,2.0,pub,"[{'name': {'honourific': None, 'family': 'Coesamin', 'lineage': None, 'given': 'M'}, 'type': 'http://www.loc.gov/loc.terms/relators/AUT', 'id': 'm.coesamin@fkip.unila.ac.id'}, {'type': 'http://www.loc.gov/loc.terms/relators/AUT', 'id': 'tina.yunarti@fkip.unila.ac.id', 'name': {'given': 'Tina', 'family': 'Yunarti', 'honourific': None, 'lineage': None}}, {'name': {'given': 'Tia', 'family': 'Agnesa', 'honourific': None, 'lineage': None}, 'type': 'http://www.loc.gov/loc.terms/relators/AUT', 'id': 'tia.agnesa88@fkip.unila.ac.id'}, {'type': 'http://www.loc.gov/loc.terms/relators/AUT', 'id': 'santy.setiawati@fkip.unila.ac.id', 'name': {'given': 'Santy', 'honourific': None, 'family': 'Setiawati', 'lineage': None}}]",TRUE,http://repository.lppm.unila.ac.id/id/eprint/37986,public,['Universitas Lampung'],724,2022-01-19 05:39:52,96-99,2022-01-19 05:39:52,"[{'id': 'm.coesamin@fkip.unila.ac.id', 'name': {'family': 'Coesamin', 'honourific': None, 'lineage': None, 'given': 'M'}}, {'id': 'tina.yunarti@fkip.unila.ac.id', 'name': {'honourific': None, 'family': 'Yunarti', 'lineage': None, 'given': 'Tina'}}, {'name': {'given': 'Tia', 'lineage': None, 'family': 'Agnesa', 'honourific': None}, 'id': 'tia.agnesa88@fkip.unila.ac.id'}, {'name': {'honourific': None, 'family': 'Setiawati', 'lineage': None, 'given': 'Santy'}, 'id': 'santy.setiawati@fkip.unila.ac.id'}]",2807-2251,Jurnal Pengabdian Kepada Masyarakat,disk0/00/03/79/86,2021-12-01 00:00:00.000000000,article,['FKIP22'],,
4,MODEL EVALUASI PEMBELAJARAN MATEMATIKA SMA BERBASIS ROUND TABLE DAN TUTOR SEBAYA,,show,7,,archive,2021-11-12 07:41:39,"Dalam pembelajaran, evaluasi mendapat peran yang cukup penting, karena dapat digunakan untuk meningkatkan kualitas pembelajaran. Pada penelitian terdahulu, sudah dikembangkan model evaluasi yang berbasis pembelajaran Round Table dan Tutor Sebaya dengan beberapa kekurangan dan keterbatasan, sehingga perlu dilakukan penyempurnaan. Penelitian ini merupakan Design Research dengan jenis studi pengembangan. Tahapan yang akan dilakukan secara umum ada tiga yaitu tahap pendahuluan, tahap pembuatan prototipe dan tahap penilaian. Lokasi penelitian yaitu di salah satu sekolah yang ada di Bandar Lampung yang difokuskan ke kelas XI. Hasil penelitian ini adalah diperolehnya suatu produk alat evaluasi pembelajaran yang dikembangkan dan siap digunakan guru dalam membelajarkan matematika di semua jenjang pendidikan dasar sampai menengah yang berbasis Model Round Table dan Tutor Teman Sebaya. Kedepan diharapkan alat evaluasi ini juga dapat diujicobakan ke jenjang pendidikan menengah seperti SMP.",['L1'],36406,,"[{'uri': 'http://repository.lppm.unila.ac.id/id/document/157337', 'rev_number': 1, 'pos': 1, 'format': 'text', 'files': [{'mtime': '2021-11-12 03:56:12', 'hash_type': 'MD5', 'hash': '4262d71f9d153231472ba5de5ae7125c', 'filename': 'Laporan Penelitian Mandiri 2021.pdf', 'fileid': 420423, 'mime_type': 'application/pdf', 'filesize': 501240, 'datasetid': 'document', 'uri': 'http://repository.lppm.unila.ac.id/id/file/420423', 'objectid': 157337}], 'docid': 157337, 'main': 'Laporan Penelitian Mandiri 2021.pdf', 'mime_type': 'application/pdf', 'language': 'en', 'placement': 1, 'security': 'public', 'eprintid': 36406}]",Fakultas Keguruan dan Ilmu Pendidikan Unila,,unpub,,,http://repository.lppm.unila.ac.id/id/eprint/36406,public,,2754,2021-11-12 07:41:39,,2021-11-12 07:41:39,"[{'name': {'honourific': None, 'family': 'Erimson', 'lineage': None, 'given': 'Siregar'}, 'id': 'erimson.siregar@fkip.unila.ac.id'}, {'name': {'given': 'Nata', 'family': 'Nurain Suryadinata', 'honourific': None, 'lineage': None}, 'id': 'nurain.suryadinata@fkip.unila.ac.id'}, {'id': 'mcoesamin@gmail.com', 'name': {'given': 'M', 'lineage': None, 'family': 'Coesamin', 'honourific': None}}]",,,disk0/00/03/64/06,2021-11-11 00:00:00.000000000,other,['FKIP22'],,
5,PENGARUH KEMAMPUAN AWAL DAN MOTIVASI BELAJAR TERHADAP KEMAMPUAN KOMUNIKASI MATEMATIS SISWA,,show,6,9.0,archive,2021-05-30 15:25:52,"This study aims to determine the effect of initial ability and learning motivation on students' mathematical communication skills. The population in this study were all students of class XI IPA SMA Fransiskus Bandar Lampung odd semester 2020/2021 academic year. The sample of this research was 32 students of class XI_IPA_2, who were selected using cluster random sampling technique. Analysis of research data using multiple linear regression test. The results of the hypothesis test show that there is a significant influence between initial ability on mathematical communication skills, there is a significant influence between learning motivation on mathematical communication skills, and there is a significant influence jointly between initial ability and learning motivation on mathematical communication skills. Based on the results of the analysis, it is concluded that the initial ability and learning motivation have a significant effect on students' mathematical communication skills.",['L1'],31305,submitted,"[{'rev_number': 1, 'uri': 'http://repository.lppm.unila.ac.id/id/document/141454', 'format': 'text', 'pos': 1, 'files': [{'objectid': 141454, 'uri': 'http://repository.lppm.unila.ac.id/id/file/370946', 'mime_type': 'application/pdf', 'fileid': 370946, 'hash': 'dbf33d99eae9900bba8a5652e27369a0', 'filename': '21898-52644-1-PB_Sara Fitriani.pdf', 'mtime': '2021-05-29 13:21:40', 'hash_type': 'MD5', 'datasetid': 'document', 'filesize': 310565}], 'docid': 141454, 'main': '21898-52644-1-PB_Sara Fitriani.pdf', 'language': 'en', 'mime_type': 'application/pdf', 'security': 'public', 'placement': 1, 'eprintid': 31305}]",,1.0,pub,"[{'name': {'family': 'Fitriani', 'honourific': None, 'lineage': None, 'given': 'Sara'}, 'id': None, 'type': 'http://www.loc.gov/loc.terms/relators/AUT'}, {'name': {'given': 'Nurhanurawati', 'family': 'Nurhanurawati', 'honourific': None, 'lineage': None}, 'type': 'http://www.loc.gov/loc.terms/relators/AUT', 'id': 'nurha.nurawati@fkip.unila.ac.id'}, {'type': 'http://www.loc.gov/loc.terms/relators/AUT', 'id': 'm.coesamin@gmail.com', 'name': {'lineage': None, 'honourific': None, 'family': 'Coesamin', 'given': 'M'}}]",TRUE,http://repository.lppm.unila.ac.id/id/eprint/31305,public,['Universitas Lampung'],724,2021-05-30 15:25:52,,2021-05-30 15:25:52,"[{'id': None, 'name': {'honourific': None, 'family': 'Fitriani', 'lineage': None, 'given': 'Sara'}}, {'name': {'honourific': None, 'family': 'Nurhanurawati', 'lineage': None, 'given': 'Nurhanurawati'}, 'id': 'nurha.nurawati@fkip.unila.ac.id'}, {'name': {'lineage': None, 'honourific': None, 'family': 'Coesamin', 'given': 'M'}, 'id': 'mcoesamin@gmail.com'}]",2338 - 1183,Jurnal Pendidikan Matematika Universitas Lampung,disk0/00/03/13/05,2021-03-30 00:00:00.000000000,article,['FKIP22'],,
6,Pengaruh Kemampuan Awal dan Motivasi Belajar Terhadap Kemampuan Komunikasi Matematis,http://jurnal.fkip.unila.ac.id/index.php/MTK/index,show,21,9.0,archive,2021-05-30 15:37:13,"This study aims to determine the effect of initial ability and learning motivation on students' mathematical communication skills. The population in this study were all students of class XI IPA SMA Fransiskus Bandar Lampung odd semester 2020/2021 academic year. The sample of this research was 32 students of class XI_IPA_2, who were selected using cluster random sampling technique. Analysis of research data using multiple linear regression test. The results of the hypothesis test show that there is a significant influence between initial ability on mathematical communication skills, there is a significant influence between learning motivation on mathematical communication skills, and there is a significant influence jointly between initial ability and learning motivation on mathematical communication skills. Based on the results of the analysis, it is concluded that the initial ability and learning motivation have a significant effect on students' mathematical communication skills.",['L1'],31395,published,"[{'eprintid': 31395, 'placement': 1, 'security': 'public', 'language': 'id', 'mime_type': 'application/xml', 'content': 'published', 'main': 21898, 'docid': 141894, 'files': [{'uri': 'http://repository.lppm.unila.ac.id/id/file/371922', 'objectid': 141894, 'filesize': 23180, 'datasetid': 'document', 'hash': 'd68c1e46d6d1c05522bbe2904d9c5eb1', 'filename': 21898, 'mtime': '2021-05-30 14:41:04', 'hash_type': 'MD5', 'mime_type': 'application/xml', 'fileid': 371922}], 'pos': 1, 'format': 'text', 'uri': 'http://repository.lppm.unila.ac.id/id/document/141894', 'rev_number': 8, 'formatdesc': 'Artikel Jurnal'}, {'format': 'text', 'pos': 2, 'rev_number': 1, 'uri': 'http://repository.lppm.unila.ac.id/id/document/141920', 'docid': 141920, 'main': 'JURNAL SARA FITRIANI.docx', 'files': [{'filesize': 176572, 'datasetid': 'document', 'filename': 'JURNAL SARA FITRIANI.docx', 'hash': '36f8be5ec23b34f1b57f11eeaa81c5ff', 'mtime': '2021-05-30 15:14:28', 'hash_type': 'MD5', 'mime_type': 'application/vnd.openxmlformats-officedocument.wordprocessingml.document', 'fileid': 371990, 'uri': 'http://repository.lppm.unila.ac.id/id/file/371990', 'objectid': 141920}], 'mime_type': 'application/vnd.openxmlformats-officedocument.wordprocessingml.document', 'language': 'en', 'eprintid': 31395, 'security': 'public', 'placement': 2}]",Pendidikan Matematika Universitas lampung,1.0,pub,,TRUE,http://repository.lppm.unila.ac.id/id/eprint/31395,public,['Jurusan Pendidikan MIPA Universitas Lampung'],789,2021-05-30 15:37:13,31-41,2021-05-30 15:37:13,"[{'id': None, 'name': {'family': 'Fitriani', 'honourific': None, 'lineage': None, 'given': 'Sara'}}, {'name': {'given': 'Nurhanurawati', 'lineage': None, 'family': 'Nurhanurawati', 'honourific': None}, 'id': 'nurha.nurawati@fkip.unila.ac.id'}, {'id': 'mcoesamin@gmail.com', 'name': {'honourific': None, 'family': 'Coesamin', 'lineage': None, 'given': 'M'}}]",2338 - 1183,Jurnal Pendidikan Matematika Universitas Lampung,disk0/00/03/13/95,2021-03-01 00:00:00.000000000,article,['FKIP22'],,
7,PENGARUH KECERDASAN EMOSIONAL DAN KEMAMPUAN AWAL TERHADAP KEMAMPUAN KOMUNIKASI MATEMATIS SISWA DALAM PEMBELAJARAN ONLINE,,show,7,,archive,2021-11-12 00:48:50,"Pembelajaran online menyisakan banyak permasalahan terkait proses maupun hasil pembelajaran. Berbagai hal yang terjadi diantaranya kurangnya motivasi belajar, terbatasnya media pembelajaran yang digunakan guru, akses internet, pembelajaran yang belum sepenuhnya interaktif dan masalah psikologis lainya yang banyak dialami siswa.  Hal ini pun terungkap dari studi pendahuluan yang dilakukan melalui penyebaranangket kepada guru matematika di Provinsi Lampung. 
Salah satu upaya untuk meningkatkan kemampuan komunikasi matematis siswa dalam pembelajaran online dapat dilakukan melalui pengkajian secara mendalam bagimana kaitan kemampuan awal, kecerdasan emosional siswa dalam proses pembelajaran. Penelitian ini bertujuan untuk: 1) mengidentifikasi pengaruh kecerdasan emosional dan kemampuan awal dengan kemampuan komunikasi matematis siswa, 2) mengukur besarnya pengaruh kecerdasan emosional dan kemampuan awal dengan kemampuan komunikasi matematis siswa.
Populasi dalam penelitian ini adalah seluruh siswa kelas VIII SMP Negeri 1 Metro Tahun Ajaran 2020/2021 yang terdistribusi dalam sembilan kelas dengan jumlah siswa 282 orang. Dari ke Sembilan kelas tersebut akan dipilih satu kelas yang akan dijadikan sebagai sampel teknik cluster random sampling. Instrumen yang digunakan adalah tes kemampuan awa dan tes kemampuan komunikasi matematis serta angket kecerdasan emosional siswa. Luaran penelitian ini berupa model pengaruh kecerdasan emosional dan kemampuan awal terhadap kemampuan komunikasi matematis yang menjadi menjadi dasar pengembangan pembelajaran online serta satu artikel ilmiah yang dimuat dalam Jurnal Nasional Berindeks Sinta 2.  Berdasarkan hasil analisis data dan pembahasan dapat disimpulkan bahwa: (1) secara umum terdapat pengaruh yang signifikan antara kemampuan awal dan kecerdasan emosi terhadap kemampuan komunikasi matematis siswa; (2) secara parsial terdapat pengaruh yang signifikan antara kemampuan awal dan kecerdasan emosi terhadap kemampuan komunikasi matematis siswa.",['L1'],36283,,"[{'mime_type': 'application/pdf', 'language': 'en', 'eprintid': 36283, 'security': 'public', 'placement': 1, 'format': 'text', 'pos': 1, 'rev_number': 1, 'uri': 'http://repository.lppm.unila.ac.id/id/document/157220', 'main': 'Laporan Penelitian Senior_FKIP_Pentatito G_2021.pdf', 'docid': 157220, 'files': [{'objectid': 157220, 'uri': 'http://repository.lppm.unila.ac.id/id/file/419523', 'fileid': 419523, 'mime_type': 'application/pdf', 'hash_type': 'MD5', 'mtime': '2021-11-11 22:51:45', 'hash': '0050c1aaadb73fe8ef95ef271acc9ffd', 'filename': 'Laporan Penelitian Senior_FKIP_Pentatito G_2021.pdf', 'datasetid': 'document', 'filesize': 482817}]}]",lppm unila,,unpub,,,http://repository.lppm.unila.ac.id/id/eprint/36283,public,,403,2021-11-12 00:48:50,,2021-11-12 00:48:50,"[{'name': {'honourific': None, 'family': 'Gunowibowo', 'lineage': None, 'given': 'Pentatito'}, 'id': 'pentatito.gunowibowo@fkip.unila.ac.id'}, {'id': 'hastuti_noer@yahoo.com', 'name': {'given': 'Sri Hastuti', 'honourific': None, 'family': 'Noer', 'lineage': None}}, {'id': 'mellatriana@yahoo.com', 'name': {'given': 'Mella', 'family': 'Triana', 'honourific': None, 'lineage': None}}]",,,disk0/00/03/62/83,1970-01-01 00:00:00.000002021,other,['FKIP22'],,
