,title,official_url,metadata_visibility,rev_number,volume,eprint_status,status_changed,abstract,subjects,eprintid,date_type,documents,publisher,number,ispublished,contributors,refereed,uri,full_text_status,corp_creators,userid,lastmod,pagerange,datestamp,creators,issn,publication,dir,date,type,divisions,id_number,related_url
17,"Sertifikat Haki Artikel: Model Pembelajaran ALQURUN (Acknowledge, Literature, Quest, Unite, Refine, Use, Name)",,show,7,,archive,2021-06-23 01:08:33,,['LB'],32803,published,"[{'pos': 1, 'format': 'text', 'uri': 'http://repository.lppm.unila.ac.id/id/document/149351', 'rev_number': 1, 'main': 'Sertifikat_Haki Artikel_Sugeng Sutiarso.pdf', 'docid': 149351, 'files': [{'filesize': 238980, 'datasetid': 'document', 'hash': 'd72b14f4a4a265e0ef50d42ce83bba3d', 'filename': 'Sertifikat_Haki Artikel_Sugeng Sutiarso.pdf', 'mtime': '2021-06-23 00:43:26', 'hash_type': 'MD5', 'mime_type': 'application/pdf', 'fileid': 388331, 'uri': 'http://repository.lppm.unila.ac.id/id/file/388331', 'objectid': 149351}], 'mime_type': 'application/pdf', 'language': 'en', 'eprintid': 32803, 'placement': 1, 'security': 'public'}]",Kemenkumham RI,,pub,,,http://repository.lppm.unila.ac.id/id/eprint/32803,public,,864,2021-06-23 01:08:33,,2021-06-23 01:08:33,"[{'name': {'given': 'Sugeng', 'honourific': None, 'family': 'Sutiarso', 'lineage': None}, 'id': 'sugeng.sutiarso@fkip.unila.ac.id'}]",,,disk0/00/03/28/03,2021-03-15 00:00:00.000000000,other,['FKIP22'],,
18,"Hubungan Kemampuan Berpikir Reflektif Matematis dengan
Kemampuan Pemecahan Masalah Matematis Peserta Didik",,show,6,6.0,archive,2021-11-08 07:26:33,"Mathematical reflective thinking skills and mathematical problem solving are abilities that must be developed by students because these abilities are needed when learning mathematics. The purpose of this study was to see the
relationship between mathematical reflective thinking skills and mathematical problem solving. The type of this research is correlational design. The sampling technique used probability sampling with a research sample of 34 students of class XI SMK Muhammadiyah 2 Bandar Lampung. The data collection method for this research is a test of mathematical reflective thinking ability and a test
of mathematical problems solving ability. The data analysis technique in this study is simple linear regression analysis. Based on the results of the study, it
can be found that there is a relationship between mathematical reflective thinking skills and mathematical problem solving. The influence of mathematical reflective thinking ability on mathematical problem solving is 27%.",['LB1603'],35501,published,"[{'docid': 156372, 'main': '7Sugeng dkk_JKPM_Juni 21.pdf', 'files': [{'uri': 'http://repository.lppm.unila.ac.id/id/file/413678', 'objectid': 156372, 'filesize': 360475, 'datasetid': 'document', 'hash_type': 'MD5', 'mtime': '2021-11-08 06:53:52', 'hash': 'e843e8dacdb70c53296507cf06abf6f9', 'filename': '7Sugeng dkk_JKPM_Juni 21.pdf', 'fileid': 413678, 'mime_type': 'application/pdf'}], 'pos': 1, 'format': 'text', 'rev_number': 1, 'uri': 'http://repository.lppm.unila.ac.id/id/document/156372', 'eprintid': 35501, 'placement': 1, 'security': 'public', 'language': 'en', 'mime_type': 'application/pdf'}]",Universitas Indraprasta PGRI,2.0,pub,,TRUE,http://repository.lppm.unila.ac.id/id/eprint/35501,public,,864,2021-11-08 07:26:33,327-336,2021-11-08 07:26:33,"[{'id': 'raannisacahyaimani@gmail.com', 'name': {'given': 'Annisa Cahya Imani', 'lineage': None, 'family': 'Syadid', 'honourific': None}}, {'id': 'sugeng.sutiarso@fkip.unila.ac.id', 'name': {'given': 'Sugeng', 'honourific': None, 'family': 'Sutiarso', 'lineage': None}}]",2477-2682,Jurnal Kajian Pendidikan Matematika,disk0/00/03/55/01,2021-06-30 00:00:00.000000000,article,['FKIP22'],http://dx.doi.org/10.30998/jkpm.v6i2.9808,[{'url': 'https://journal.lppmunindra.ac.id/index.php/jkpm/article/view/9808'}]
19,PENGEMBANGAN HANDOUT BERBASIS GUIDED NOTE TAKING PADA MATERI SISTEM PERSAMAAN LINEAR TIGA VARIABEL,https://ojs.fkip.ummetro.ac.id/index.php/matematika/article/view/3226,show,7,10.0,archive,2021-06-02 01:07:36,"Penelitian ini bertujuan untuk mengembangkan bahan ajar berupa handout berbasis guided note taking pada materi sistem persamaan linear tiga variabel dan mengetahui kualitas handout dilihat dari aspek kevalidan dan kepraktisan. Penelitian ini merupakan penelitian pengembangan yang mengacu pada model pengembangan 4D, yaitu define, design, develop, disseminate. Subjek dalam penelitian ini adalah 2 guru dan 5 siswa SMAN 1 Buay Bahuga. Instrumen yang digunakan untuk mengukur kualitas handout yang dikembangkan meliputi angket ahli, angket respon guru dan siswa. Angket ahli digunakan untuk mengukur kevalidan handout sedangkan angket respon guru dan siswa digunakan untuk mengukur kepraktisan handout. Produk penelitian berupa handout berbasis guided note taking pada materi system persamaan linear tiga variabel kelas X SMA. Hasil penelitian menunjukkan bahwa dilihat dari aspek kevalidan termasuk dalam kategori valid dengan skor rata-rata 75 berdasarkan penilaian dua dosen ahli (ahli materi, desain dan bahasa); dilihat dari respon dua guru dengan rata-rata 42,5 termasuk dalam kategori baik dan respon siswa dengan rata-rata 41,8 ternasuk dalam kategori baik sehingga aspek kepraktisan dikategorikan praktis berdasarkan hasil respon pengguna handout. Berdasarkan hasil penelitian dapat disimpulkan bahwa handout berbasis guided note taking pada materi sistem persamaan linear tiga variabel yang dikembangkan adalah valid dan praktis digunakan dalam pembelajaran.","['L1', 'LB1501']",31617,published,"[{'uri': 'http://repository.lppm.unila.ac.id/id/document/143204', 'rev_number': 1, 'format': 'text', 'pos': 1, 'files': [{'objectid': 143204, 'uri': 'http://repository.lppm.unila.ac.id/id/file/374736', 'datasetid': 'document', 'filesize': 689137, 'mime_type': 'application/pdf', 'fileid': 374736, 'filename': 'PENGEMBANGAN HANDOUT BERBASIS GUIDED NOTE TAKING PADA MATERI SISTEM PERSAMAAN LINEAR TIGA VARIABEL.pdf', 'hash': 'c07ee96d81b86009ffa92f49fdf64b55', 'hash_type': 'MD5', 'mtime': '2021-06-01 12:58:20'}], 'docid': 143204, 'main': 'PENGEMBANGAN HANDOUT BERBASIS GUIDED NOTE TAKING PADA MATERI SISTEM PERSAMAAN LINEAR TIGA VARIABEL.pdf', 'mime_type': 'application/pdf', 'language': 'en', 'security': 'public', 'placement': 1, 'eprintid': 31617}]","Mathematics Education, University of Muhammadiyah Metro",1.0,pub,"[{'type': 'http://www.loc.gov/loc.terms/relators/AUT'}, {'type': 'http://www.loc.gov/loc.terms/relators/AUT'}, {'type': 'http://www.loc.gov/loc.terms/relators/AUT'}]",TRUE,http://repository.lppm.unila.ac.id/id/eprint/31617,public,,553,2021-06-02 01:07:36,38-47,2021-06-02 01:07:36,"[{'name': {'family': 'diana', 'honourific': None, 'lineage': None, 'given': 'neti'}, 'id': 'netidiana11@gmail.com'}, {'name': {'given': 'Sugeng', 'lineage': None, 'family': 'Sutiarso', 'honourific': None}, 'id': 'sugeng.sutiarso@fkip.unila.ac.id'}, {'id': 'hanindabharata99@gmail.com', 'name': {'given': 'Haninda', 'family': 'Bharata', 'honourific': None, 'lineage': None}}]",2442-5419,AKSIOMA: Jurnal Program Studi Pendidikan Matematika,disk0/00/03/16/17,2021-03-29 00:00:00.000000000,article,['FKIP22'],,
