,title,official_url,metadata_visibility,rev_number,volume,eprint_status,status_changed,abstract,subjects,eprintid,date_type,documents,publisher,number,ispublished,contributors,refereed,uri,full_text_status,corp_creators,userid,lastmod,pagerange,datestamp,creators,issn,publication,dir,date,type,divisions,id_number,related_url
8,"EFEKTIVITAS PENERAPAN STRATEGI METACOGNITIF DITINJAU
DARI KEMAMPUAN BERPIKIR REFLEKTIF",,show,8,,archive,2021-11-12 00:55:08,"Upaya untuk meningkatkan kemampuan berpikir reflektif siswa dapat dilakukan melalui proses belajar dengan memberikan masalah-masalah kontekstual. Dalam pelaksanaannya, guru perlu menerapkan strategi metacognitif yang akan memicu siswa untuk mengenal apa yang diketahui dan apa yang dibutuhkan dari masalah, dan memberikan kesempatan pada siswa untuk menerapkan strategi penyelesaian, serta menarik kesimpulan dari permasalahan. Penelitian ini bertujuan untuk: 1) mendisain dan mengembangkan model strategi
pembelajaran metacognitif untuk meningkatkan kemampuan berpikir reflektif siswa, 2) melihat efektivitas model yang dikembangkan terhadap peningkatan kemampuan berpikir reflektif siswa. Populasi penelitian adalah siswa kelas VIII SMP Negeri di Kota Bandar Lampung. Satu sekolah yang terpilih secara acak sebagai sekolah sampel adalah SMPN 2 bandar Lampung. Pada sekolah ini diambil secara acak satu kelas sebagai kelas eksperimen, yang diterapkan strategi pembelajaran metacognitif. Dalam hal ini terpilihlah siswa kelas VIII9 sebagai kelas eksperimen dengan jumlah siswa 28 orang. Instrumen yang digunakan adalah tes kemampuan berpikir reflektif siswa telah valid, reliabel, dan daya pembeda serta tingkat kesukarannya telah memenuhi kriteria. Hasil penelitian dan pembahasan menyimpulkan bahwa
proporsi siswa yang memiliki kemampuan berpikir reflektif matematis terkategori baik pada kelas yang mengikuti pembelajaran strategi metakognitif lebih dari 60%
dari jumlah siswa. Dengan demikian, penerapan strategi metakognitif efektif ditinjau dari kemampuan berpikir reflektif matematis siswa kelas VIII SMPN 2 Bandar Lampung",['L1'],36285,,"[{'language': 'en', 'mime_type': 'application/pdf', 'security': 'public', 'placement': 1, 'eprintid': 36285, 'rev_number': 1, 'uri': 'http://repository.lppm.unila.ac.id/id/document/157222', 'format': 'text', 'pos': 1, 'files': [{'objectid': 157222, 'uri': 'http://repository.lppm.unila.ac.id/id/file/419537', 'fileid': 419537, 'mime_type': 'application/pdf', 'mtime': '2021-11-11 22:56:59', 'hash_type': 'MD5', 'hash': '5d02a1595175b861221f3f5a9bbbb526', 'filename': 'LAPPenelitian_Pak Penta_2021 (10 nov 2021) (2).pdf', 'datasetid': 'document', 'filesize': 1257679}], 'main': 'LAPPenelitian_Pak Penta_2021 (10 nov 2021) (2).pdf', 'docid': 157222}]",lppm unila,,unpub,,,http://repository.lppm.unila.ac.id/id/eprint/36285,public,,403,2021-11-12 00:55:08,,2021-11-12 00:55:08,"[{'id': 'pentatito.gunowibowo@fkip.unila.ac.id', 'name': {'given': 'Pentatito', 'honourific': None, 'family': 'Gunowibowo', 'lineage': None}}, {'id': 'santy.setiawati@fkip.unila.ac.id', 'name': {'lineage': None, 'honourific': None, 'family': 'Setiawati', 'given': 'Santy'}}, {'name': {'honourific': None, 'family': 'Agnesa', 'lineage': None, 'given': 'Tia'}, 'id': 'tia.agnesa88@fkip.unila.ac.id'}]",,,disk0/00/03/62/85,1970-01-01 00:00:00.000002021,other,['FKIP22'],,
9,"HANDBOOK ARITMATIKA SOSIAL DENGAN PENDEKATAN
NILAI-NILAI ISLAM",http://fkip.ummetro.ac.id/journal/index.php/matematika/index,show,9,10.0,archive,2021-05-24 04:42:01,"Tujuan penelitian ini adalah mengembangkan bahan ajar yang layak (valid dan praktis) berbentuk
handbook dengan menggunakan pendekatan nilai-nilai islam pada materi aritmatika sosial. Jenis
penelitian yang digunakan adalah Research and Development (R&D) dengan langkah-langkah: potensi
dan masalah, pengumpulan data, desain produk, validasi desain, revisi desain, uji coba produk, revisi
produk, uji coba pemakaian, revisi produk, produk masal. Instrumen penelitian yang digunakan adalah
lembar angket validasi, lembar angket respon siswa dan lembar angket respon guru. Berdasarkan hasil
validasi dengan persentase penilaian dari aspek materi dan bahasa 84,2% dikategorikan sangat valid,
aspek agama 81,8% dikategorikan sangat valid, dan aspek desain 78,8% dikategorikan valid, dan rata-rata
penilaian validator adalah 81,4% dengan kategori sangat valid. Sedangkan dari hasil uji coba pemakaian
diperoleh rata-rata angket respon yang diberikan oleh 1 guru dan 18 peserta didik sebesar 84,3%
dikategorikan sangat layak. Berdasarkan kriteria yang telah ditetapkan maka bahan ajar berbentuk
handbook dengan menggunakan pendekatan nilai-nilai islam pada materi aritmatika","['L1', 'LB1603']",30573,published,"[{'docid': 137619, 'main': 'pdf', 'files': [{'hash': '9474f13a31c4da86aa95dd9c30979491', 'filename': 'pdf', 'hash_type': 'MD5', 'mtime': '2021-05-24 03:55:34', 'mime_type': 'application/xml', 'fileid': 362410, 'filesize': 139899, 'datasetid': 'document', 'uri': 'http://repository.lppm.unila.ac.id/id/file/362410', 'objectid': 137619}], 'format': 'text', 'pos': 1, 'uri': 'http://repository.lppm.unila.ac.id/id/document/137619', 'rev_number': 3, 'eprintid': 30573, 'security': 'public', 'placement': 1, 'mime_type': 'application/xml', 'language': 'en', 'content': 'published'}]","Mathematics Education, University of Muhammadiyah Metro",1.0,pub,"[{'type': 'http://www.loc.gov/loc.terms/relators/AUT'}, {'type': 'http://www.loc.gov/loc.terms/relators/AUT'}, {'type': 'http://www.loc.gov/loc.terms/relators/AUT'}]",TRUE,http://repository.lppm.unila.ac.id/id/eprint/30573,public,,2754,2021-05-24 04:42:01,28-37,2021-05-24 04:42:01,"[{'name': {'lineage': None, 'honourific': None, 'family': 'Hardiyanti', 'given': 'Septi'}, 'id': ': septihardiyanti0909@gmail.com'}, {'id': 'nurulfaridamath@gmail.com', 'name': {'lineage': None, 'family': 'Farida', 'honourific': None, 'given': 'Nurul'}}, {'name': {'family': 'Suryadinata', 'honourific': None, 'lineage': None, 'given': 'Nurain'}, 'id': 'nurain.suryadinata@fkip.unila.ac.id'}]",2442-5419,AKSIOMA: Jurnal Program Studi Pendidikan Matematika,disk0/00/03/05/73,2021-03-01 00:00:00.000000000,article,['FKIP22'],https://doi.org/10.24127/ajpm.v10i1.2140,
10,"The Effect of Problem Based Learning and Open-Ended Learning
on Mathematics Creative Thinking Ability: A Meta Analysis Study",http://jurnal.fkip.unila.ac.id/index.php/jpmipa/,show,9,22.0,archive,2021-11-02 08:45:06,"This study aims to analyze the effect of Problem Based Learning (PBL) and Open Ended Learning (OEL) on the ability to think creative mathematically based on the effect size
category, education level, and learning materials. This research method is a meta-analysis by reviewing several journals that have been published online. This study used 15 journals on PBL and 15 journals on OEL related to mathematical creative thinking skills. The instrument in this meta-analysis was carried out with a coding category sheet according to the research variables, namely: the year of the study, the title of the study, the level of education, the material used in the study, also the independent variable and dependent variable of study. The data analysis technique used is descriptive statistics. The results of the meta-analysis showed that PBL had a
higher effect than OEL on students' mathematical creative thinking abilities. Based on the level of education, PBL has more influence on junior high school students, while OEL has more influence on students at high school level. In terms of learning materials, PBL has more influence on SPLDV material than other materials, while OEL has more influence on social
arithmetic material.",['L1'],34806,published,"[{'security': 'public', 'placement': 1, 'eprintid': 34806, 'language': 'en', 'mime_type': 'application/pdf', 'files': [{'filesize': 281633, 'datasetid': 'document', 'mtime': '2021-11-02 01:33:54', 'hash_type': 'MD5', 'filename': '3Sugeng dkk_JPMIPA_9 Sept 2021.pdf', 'hash': 'c5e00360cc342b465ebcaa46442051df', 'fileid': 408248, 'mime_type': 'application/pdf', 'uri': 'http://repository.lppm.unila.ac.id/id/file/408248', 'objectid': 155481}], 'docid': 155481, 'main': '3Sugeng dkk_JPMIPA_9 Sept 2021.pdf', 'rev_number': 1, 'uri': 'http://repository.lppm.unila.ac.id/id/document/155481', 'format': 'text', 'pos': 1}, {'security': 'public', 'placement': 2, 'eprintid': 34806, 'mime_type': 'application/pdf', 'language': 'en', 'files': [{'uri': 'http://repository.lppm.unila.ac.id/id/file/408250', 'objectid': 155482, 'filesize': 281633, 'datasetid': 'document', 'filename': '3Sugeng dkk_JPMIPA_9 Sept 2021.pdf', 'hash': 'c5e00360cc342b465ebcaa46442051df', 'hash_type': 'MD5', 'mtime': '2021-11-02 01:34:27', 'mime_type': 'application/pdf', 'fileid': 408250}], 'docid': 155482, 'main': '3Sugeng dkk_JPMIPA_9 Sept 2021.pdf', 'rev_number': 1, 'uri': 'http://repository.lppm.unila.ac.id/id/document/155482', 'format': 'text', 'pos': 2}]",Universitas Lampung,1.0,pub,,TRUE,http://repository.lppm.unila.ac.id/id/eprint/34806,public,,864,2021-11-02 08:45:06,112-120,2021-11-02 08:45:06,"[{'name': {'given': 'Nia', 'lineage': None, 'honourific': None, 'family': 'Kurniati'}, 'id': 'kurniatinia27997@gmail.com'}, {'id': 'sugeng.sutiarso@fkip.unila.ac.id', 'name': {'given': 'Sugeng', 'honourific': None, 'family': 'Sutiarso', 'lineage': None}}]","2550-1313 (online), 2087-9849 (print)",Jurnal Pendidikan MIPA,disk0/00/03/48/06,2021-06-01 00:00:00.000000000,article,['FKIP22'],"2021, 112-120 endidikan MIPA  13 | p-ISSN: 2087-9849 ila.ac.id/index.php/jpmipa/  earning and Open-Ended Learning ing Ability: A Meta Analysis Study    , Sugeng Sutiarso 2   cation, Universitas Lampung, Indonesia  ect of Problem Based Learning (PBL) and O",[{'url': 'http://jurnal.fkip.unila.ac.id/index.php/jpmipa/article/view/21988'}]
11,BIMBINGAN TEKNIS VIRTUAL LESSON STUDY: MENINGKATKAN PEDAGOGICAL CONTENT KNOWLEDGE DALAM MELAKUKAN ANALISIS REFLEKSI DIDAKTIS GURU-GURU SMP NEGERI 2 BANDAR LAMPUNG,,show,7,,archive,2021-11-12 00:55:26,"Bimbingan teknis implementasi Virtual Lesson Study (VLS) ini bertujuan untuk meningkatkan pengetahuan, keterampilan, dan kehandalan untuk mengimplementasikan VLS serta melakukan analis reflektif bagi guru-guru di SMPN 2 khususnya dan di Kota Bandar Lampung umumnya.  Kegiatan ini juga membantu meningkatkan kualitas pengajaran dan pembelajaran siswa, memungkinkan diskusi mendalam dengan kolega, membangun kebersamaan, menciptakan budaya pembelajaran reflektif dan berkelanjutan, serta memberi kesempatan bagi guru baru untuk belajar kurikulum, manajemen, konten dan pedagogi dari guru yang berpengalaman. Metode yang digunakan dalam kegiatan pengabdian ini yaitu pelatihan VLS, pendampingan guru model, serta implementasi pelaksanaan VLS.   Implementasi pelaksanaan VLS dilaksanakan pada pada tahap plan dan do. Rangkaian kegiatan tersebut berkontribusi pada Pedagogical Content Knowledge (PCK) guru. Hasil kegiatan pengabdian menunjukkan adanya peningkatan pemahaman dan keterampilan guru-guru peserta dalam ranah PCK dan implementasi VLS. Hal tersebut ditandai dengan besar rata-rata skor n-gain teori sebesar 0,32 (kategori peningkatan sedang) dan rata-rata skor n-gain praktek sebesar 0,67 (kategori peningkatan sedang). Hasil uji Wilcoxon pada taraf nyata 0,05 juga menunjukkan adanya perbedaan yang signifikan baik pada rata-rata skor peningkatan pengetahuan dan keterampilan peserta setelah teori dengan rata-rata skor peningkatan pengetahuan dan keterampilan peserta setelah praktek. Temuan tersebut mempertegas pentingnya kegiatan pendampingan dalam pelaksanaan kegiatan pengabdian kepada masyarakat ini. Namun demikian, kondisi kebijakan sekolah yang berubah-ubah terkait bentuk pertemuan pembelajaran di sekolah sebagai imbas dari ketentuan PPKM, membuat kegiatan see dan analisis refleksi yang direncanakan belum dapat terlaksana secara optimal. Oleh karena itu, peningkatan pengetahuan dan keterampilan guru-guru peserta terkait PCK dan implementasi VLS masih sangat berpeluang besar untuk ditingkatkan lebih baik lagi sehingga  dapat lebih mengeksplorasi campuran konten dan pedagogi yang unik dari  guru, yang pada akhirnya akan membentuk pengertian profesional bagi guru itu sendiri",['L1'],36289,,"[{'format': 'text', 'pos': 1, 'uri': 'http://repository.lppm.unila.ac.id/id/document/157225', 'rev_number': 1, 'main': 'Laporan Akhir PKM Sri H Noer_2021.pdf', 'docid': 157225, 'files': [{'datasetid': 'document', 'filesize': 2546307, 'fileid': 419562, 'mime_type': 'application/pdf', 'mtime': '2021-11-11 23:08:38', 'hash_type': 'MD5', 'filename': 'Laporan Akhir PKM Sri H Noer_2021.pdf', 'hash': 'a3ab1476a085a55dc558fcdcd84fe8d8', 'objectid': 157225, 'uri': 'http://repository.lppm.unila.ac.id/id/file/419562'}], 'mime_type': 'application/pdf', 'language': 'en', 'eprintid': 36289, 'security': 'public', 'placement': 1}]",lppm unila,,unpub,,,http://repository.lppm.unila.ac.id/id/eprint/36289,public,,548,2021-11-12 00:55:26,,2021-11-12 00:55:26,"[{'id': 'hastuti_noer@yahoo.com', 'name': {'lineage': None, 'honourific': None, 'family': 'Noer', 'given': 'Sri Hastuti'}}, {'name': {'lineage': None, 'honourific': None, 'family': 'Gunowibowo', 'given': 'Pentatito'}, 'id': 'pentatito.gunowibowo@fkip.unila.ac.id'}, {'id': 'widyaa58@gmail.com', 'name': {'given': 'Widyastuti', 'family': 'Widyastuti', 'honourific': None, 'lineage': None}}, {'name': {'lineage': None, 'family': 'Triana', 'honourific': None, 'given': 'Mella'}, 'id': 'mellatriana@yahoo.com'}]",,,disk0/00/03/62/89,1970-01-01 00:00:00.000002021,other,['FKIP22'],,
12,"PENGEMBANGAN PEMBELAJARAN ONLINE UNTUK MEMFASILITASI PENINGKATAN KEMANDIRIAN BELAJAR
 DAN MOTIVASI BERPRESTASI SISWA SERTA DAMPAKNYA TERHADAP KEMAMPUAN BERPIKIR MATEMATIS",,show,7,,archive,2021-11-12 00:55:12,"Pandemi Covid-19 telah mengubah tatanan kehidupan termasuk dunia pendidikan. Kebijakan belajar dari rumah membuat semua yang berkecimpung di dunia pendidikan harus siap melakukan pembelajarn online. Meskipun kemajuan teknologi memungkinkan siswa belajar sepenuhnya secara online, tetapi pembelajaran online membutuhkan tingkat motivasi diri dan kemandirian belajar yang lebih tinggi. Oleh karena itu, meningkatkan kemandirian dan motivasi berprestasi dengan menanamkan berbagai fitur dalam lingkungan pembelajaran online tampaknya efektif dalam meningkatkan hasil belajar matematika siswa.
Dengan kondisi pembelajaran online saat ini, siswa lebih mengalami kesulitan belajar matematika bila guru tidak mampu mengelola pembelajaran. Beberapa kendala dalam pembelajaran online antara lain media pembelajaran yang digunakan guru dominan monoton dan membuat murid merasa jenuh, pembelajaran belum interaktif dan cenderung tugas online. Studi pendahuluan kepada 46 guru matematika, menunjukkan bahwa 81 persen menyatakan motivasi belajar siswa menurun, 66 persen menyatakan guru hanya membagikan soal latihan kepada siswa. Sebagian besar guru kesulitan dalam menyampaikan bahan ajar, kesulitan membuat perangkat pembelajaran, kesulitan dalam memilih metode dan media pembelajaran online. 
Penelitian ini bertujuan menghasilkan model pembelajaran online yang mencakup langkah pembelajaran, sistem sosial, sistem pendukung, serta dampak pembelajaran dan dampak pengiring pembelajaran yang valid dan praktis untuk memfasilitasi peningkatan kemandirian belajar dan motivasi berprestasi siswa serta menganalisis efektivitas model dalam meningkatkan kemampuan berpikir matematis siswa. Tahapan penelitian diawali dengan studi pendahuluan untuk mengetahui bagaimana pelaksanaan pembelajaran online yang sudah dilakukan. Pengembangan produk model pembelajaran dilakukan pendisainan model pembelajaran, lalu dilakukan validasi oleh ahli. Berdasarkan hasil penerapan model pada pembelajaran di dua sekolah sampel diperoleh hasil: Berdasarkan hasil analisis data dan pengujian hipotesis dapat diketahui bahwa: (1) secara umum terdapat pengaruh yang signifikan antara kemandirian belajar dan motivasi berprestasi terhadap kemampuan komunikasi matematis dan pemecahan masalah matematis siswasiswa. 2) Secara parsial terdapat pengaruh yang signifikan antara kemandirian belajar dan motivasi berprestasi terhadap kemampuan komunikasi matematis siswa dan juga pada kemampuan pemecahan masalah matematis siswa",['L1'],36286,,"[{'pos': 1, 'format': 'text', 'uri': 'http://repository.lppm.unila.ac.id/id/document/157224', 'rev_number': 1, 'docid': 157224, 'main': 'Laporan Penelitian Senior_FKIP_Sri H Noer_2021.pdf', 'files': [{'objectid': 157224, 'uri': 'http://repository.lppm.unila.ac.id/id/file/419552', 'datasetid': 'document', 'filesize': 519162, 'fileid': 419552, 'mime_type': 'application/pdf', 'mtime': '2021-11-11 23:04:29', 'hash_type': 'MD5', 'hash': '0884dcfd86ed9f3a512c7d162bbdc94b', 'filename': 'Laporan Penelitian Senior_FKIP_Sri H Noer_2021.pdf'}], 'language': 'en', 'mime_type': 'application/pdf', 'eprintid': 36286, 'placement': 1, 'security': 'public'}]",lppm unila,,unpub,,,http://repository.lppm.unila.ac.id/id/eprint/36286,public,,548,2021-11-12 00:55:12,,2021-11-12 00:55:12,"[{'name': {'given': 'Sri Hastuti', 'honourific': None, 'family': 'Noer', 'lineage': None}, 'id': 'hastuti_noer@yahoo.com'}, {'name': {'given': 'Mella', 'lineage': None, 'honourific': None, 'family': 'Triana'}, 'id': 'mellatriana@yahoo.com'}]",,,disk0/00/03/62/86,1970-01-01 00:00:00.000002021,other,['FKIP22'],,
13,DAMPAK SELF-EFFICACY TERHADAP KEMAMPUAN KOMUNIKASI MATEMATIS SISWA,,show,7,3.0,archive,2022-06-20 01:21:37,"Penelitian ini bertujuan untuk mengetahui dan mendeskripsikan pengaruh self-efficacy terhadap kemampuan komunikasi matematis siswa. Populasi dalam penelitian adalah seluruh siswa kelas IX SMP Negeri 20 Bandar Lampung tahun pelajaran 2020/2021 yang terdistribusi dalam sepuluh kelas. Sampel penelitian ini adalah siswa kelas IX F sebanyak 30 siswa yang dipilih menggunakan teknik cluster random sampling. Desain yang digunakan adalah desain penelitian kausal komparatif. Data penelitian ini berupa data kuantitatif yang diperoleh dari pengisian instrumen angket self-efficacy dan tes kemampuan komunikasi matematis yang merupakan data primer. Teknik analisis data yang digunakan dalam penelitian ini adalah regresi linier sederhana dengan  = 0,05. Hasil penelitian menunjukkan bahwa mayoritas siswa memiliki kemampuan komunikasi matematis dan self-efficacy yang cukup tinggi dan semakin tinggi self-efficacy siswa maka kemampuan komunikasi matematis siswa juga semakin tinggi. Kesimpulan dari penelitian ini adalah self-efficacy siswa memiliki pengaruh positif yang signifikan terhadap kemampuan komunikasi matematis siswa, dengan 63,1% variabilitas kemampuan komunikasi siswa dapat dijelaskan oleh self-efficacy.","['L1', 'LA']",42619,published,"[{'eprintid': 42619, 'security': 'public', 'placement': 1, 'mime_type': 'application/pdf', 'language': 'en', 'main': 'Jumadika Nurhanurawati dkk.pdf', 'docid': 164330, 'files': [{'uri': 'http://repository.lppm.unila.ac.id/id/file/467708', 'objectid': 164330, 'filesize': 1426295, 'datasetid': 'document', 'hash': 'd366d44184c5de164450757058c82b80', 'filename': 'Jumadika Nurhanurawati dkk.pdf', 'hash_type': 'MD5', 'mtime': '2022-06-19 09:08:04', 'mime_type': 'application/pdf', 'fileid': 467708}], 'format': 'text', 'pos': 1, 'rev_number': 1, 'uri': 'http://repository.lppm.unila.ac.id/id/document/164330'}]",,2.0,pub,"[{'type': 'http://www.loc.gov/loc.terms/relators/AUT'}, {'type': 'http://www.loc.gov/loc.terms/relators/AUT'}]",TRUE,http://repository.lppm.unila.ac.id/id/eprint/42619,public,,1140,2022-06-20 01:21:37,51-58,2022-06-20 01:21:37,"[{'name': {'honourific': None, 'family': 'Nurhanurawati', 'lineage': None, 'given': 'Nurhanurawati'}, 'id': 'nurhanurawati94@gmail.com'}, {'id': 'widyaa58@gmail.com', 'name': {'given': 'Widyastuti', 'family': 'Widyastuti', 'honourific': None, 'lineage': None}}]",2657-1986,Jurnal Magister Pendidikan Matematika (Jumadika),disk0/00/04/26/19,2021-07-16 00:00:00.000000000,article,['FKIP22'],,
14,"Analysis of Students' Mathematical Literacy Ability in
Algebraic Concepts Based on Trends in International
Mathematics and Science Study (TIMSS) Problems",,show,7,21.0,archive,2021-11-02 08:45:04,"This research uses descriptive qualitative. The aim is to examine students'mathematical literacy abilities and types of errors made by students of MTs Mathla’ul Anwar Kedondong in solving algebraic concept questions that were first accessed from TIMSS. The subjects of this study were all students of class VIII-A MTs Mathla’ul Anwar Kedondong, which had 30 students. The data was collected using tests and interviews. All student answers in the analysis of mathematical errors are based on empathy for students' mathematical literacy abilities, namely aspects of knowledge, application, and communication. Furthermore, for
further analysis of the students 'mathematical errors, 2 students with the lowest scores were selected, representing the mathematical errors of all students based on the four aspects of the students' mathematical literacy abilities for interviews. The data analysis technique is by reducing
data, presenting data, and drawing conclusions. The results of the analysis of the data collected, the mathematical literacy ability of students included in the medium category with an average score of 62.38 scores on a scale of 100. Based on the analysis of the mathematical literacy scheme
capability mentioned, students can request solutions according to their needs and sufficient good at solving problems on the criminal aspect. However, judging from the mathematical mistakes made by students, students who made mistakes did not review the answers in solving the
problems. This causes the problem solving is not correct.",['LB1603'],34805,published,"[{'mime_type': 'application/pdf', 'language': 'en', 'eprintid': 34805, 'security': 'public', 'placement': 1, 'format': 'text', 'pos': 1, 'rev_number': 1, 'uri': 'http://repository.lppm.unila.ac.id/id/document/155480', 'docid': 155480, 'main': '2Sugeng dkk_technium_Juli 2021.pdf', 'files': [{'objectid': 155480, 'uri': 'http://repository.lppm.unila.ac.id/id/file/408203', 'datasetid': 'document', 'filesize': 2041989, 'mime_type': 'application/pdf', 'fileid': 408203, 'hash': '1df69d14c7136e4512ed6a58b7678c0c', 'filename': '2Sugeng dkk_technium_Juli 2021.pdf', 'hash_type': 'MD5', 'mtime': '2021-11-02 01:07:55'}]}]",Technium Science Inc,,pub,,TRUE,http://repository.lppm.unila.ac.id/id/eprint/34805,public,,864,2021-11-02 08:45:04,381-392,2021-11-02 08:45:04,"[{'id': 'erimson.siregar@fkip.unila.ac.id', 'name': {'lineage': None, 'family': 'Siregar', 'honourific': None, 'given': 'Erimson'}}, {'id': 'sugeng.sutiarso@fkip.unila.ac.id', 'name': {'family': 'Sutiarso', 'honourific': None, 'lineage': None, 'given': 'Sugeng'}}, {'name': {'given': 'Zulhiyandi', 'family': 'Yusuf', 'honourific': None, 'lineage': None}, 'id': None}]",2668-7798,Technium Social Sciences Journal,disk0/00/03/48/05,2021-07-01 00:00:00.000000000,article,['FKIP22'],https://doi.org/10.47577/tssj.v21i1.3904,[{'url': 'https://techniumscience.com/index.php/socialsciences/article/view/3904'}]
15,"Penilaian Sejawat: Haki Artikel ""Model Pembelajaran ALQURUN (Acknowledge, Literature, Quest, Unite, Refine, Use, Name)""",,show,13,,archive,2021-05-24 01:36:42,,['L1'],30445,,"[{'mime_type': 'application/pdf', 'language': 'en', 'security': 'public', 'placement': 1, 'eprintid': 30445, 'rev_number': 1, 'uri': 'http://repository.lppm.unila.ac.id/id/document/136970', 'format': 'text', 'pos': 1, 'files': [{'uri': 'http://repository.lppm.unila.ac.id/id/file/360877', 'objectid': 136970, 'hash_type': 'MD5', 'mtime': '2021-05-21 13:09:42', 'filename': 'Penilaian Sejawat Haki Artikel_Sugeng Sutiarso.pdf', 'hash': '70b20a31a069fa76252bc3f2a36daac3', 'fileid': 360877, 'mime_type': 'application/pdf', 'filesize': 1015394, 'datasetid': 'document'}], 'docid': 136970, 'main': 'Penilaian Sejawat Haki Artikel_Sugeng Sutiarso.pdf'}]",Kemenkumham RI,,pub,,,http://repository.lppm.unila.ac.id/id/eprint/30445,public,,864,2021-05-24 01:36:42,,2021-05-24 01:36:42,"[{'id': 'sugeng.sutiarso@fkip.unila.ac.id', 'name': {'given': 'Sugeng', 'family': 'Sutiarso', 'honourific': None, 'lineage': None}}]",,,disk0/00/03/04/45,2021-03-15 00:00:00.000000000,other,['FKIP22'],,
16,"Sertifikat HAKI & ARTIKEL ""Model Pembelajaran ALQURUN (Acknowledge, Literature, Quest, Unite, Refine, Use, Name)""",,show,7,,archive,2021-05-24 01:37:00,,['L1'],30451,published,"[{'main': 'Sertifikat HAKI & ARTIKEL_Sugeng Sutiarso.pdf', 'docid': 137002, 'files': [{'hash_type': 'MD5', 'mtime': '2021-05-21 13:43:59', 'hash': '97f57a58fa7ba113f38af6f1509b4151', 'filename': 'Sertifikat HAKI & ARTIKEL_Sugeng Sutiarso.pdf', 'fileid': 360954, 'mime_type': 'application/pdf', 'filesize': 738194, 'datasetid': 'document', 'uri': 'http://repository.lppm.unila.ac.id/id/file/360954', 'objectid': 137002}], 'format': 'text', 'pos': 1, 'rev_number': 1, 'uri': 'http://repository.lppm.unila.ac.id/id/document/137002', 'eprintid': 30451, 'security': 'public', 'placement': 1, 'language': 'en', 'mime_type': 'application/pdf'}]",Kemenkumham RI,,pub,,,http://repository.lppm.unila.ac.id/id/eprint/30451,public,,864,2021-05-24 01:37:00,,2021-05-24 01:37:00,"[{'id': 'sugeng.sutiarso@fkip.unila.ac.id', 'name': {'lineage': None, 'honourific': None, 'family': 'Sutiarso', 'given': 'Sugeng'}}]",,,disk0/00/03/04/51,2021-03-15 00:00:00.000000000,other,['FKIP22'],,
